text,translated_text
بشكل عام، بيتطلب البقاء بأي بلد أجنبي لفترة طويلة الحصول على تأشيرة مقدمًا.,Levantine Arabic: بشكل عام، بيتطلب البقاء بأي بلد أجنبي لفترة طويلة الحصول على تأشيرة مقدمًا. English: يتطلب البقاء بأي بلد أجنبي لفترة طويلة الحصول على تأشيرة مقدمًا.
كل قطار عندو عربات MetroPlus و Metro؛ فعربات MetroPlus دايماً بتكون بنهاية القطار الأقرب لكيب تاون.,Levantine Arabic: كل قطار عندو عربات MetroPlus و Metro؛ فعربات MetroPlus دايماً بتكون بنهاية القطار الأقرب لكيب تاون. English: سافر إلى أي مكان في العالم من خلال مطار أو مطار أو مطار أو مطار أو مطار أو مطار أو مطار أو مطار أو مطار أو مطار أو مطار أو مطار أو مطار أو مطار أو مطار أو مطار أو مطار أو مطار أو مطار أو مطار أو مطار أو مطار أو مطار أو مطار أو مطار أو مطار أو مطار أو مطار أو مطار أو مطار أو
الكل بشارك بالمجتمع وبيستعمل أنظمة النقل. والكل تقريباً بيشتكي من أنظمة النقل.,Levantine Arabic: الكل بشارك بالمجتمع وبيستعمل أنظمة النقل. والكل تقريباً بيشتكي من أنظمة النقل. English: كل بشارك بالمجتمع وبيستعمل أنظمة النقل. والكل تقريباً بيشتكي من أنظمة النقل.
بما أن المناطق قليلة السكان، التلوث الضوئي ما بكون مشكلة بكتير من الأحيان، رح تقدر كمان تستمتع بالنجوم.,Levantine Arabic: بما أن المناطق قليلة السكان، التلوث الضوئي ما بكون مشكلة بكتير من الأحيان، رح تقدر كمان تستمتع بالنجوم. English: أحياناً، تبدو النجوم في أماكن بعيدة جداً، ولكن في الواقع، هناك الكثير من النجوم في أماكن بعيدة جداً.
بتختلف تكاليف الفيزا ومتطلباتها من بلد لبلد وبتعتمد على البلد الجاي منه.,Levantine Arabic: بتختلف تكاليف الفيزا ومتطلباتها من بلد لبلد وبتعتمد على البلد الجاي منه. English: يختلف تكاليف الفيزا من بلد لبلد وبتعتمد على البلد الجاي منه.
بشكل عام، ما في منفعة من البحث عن خصومات لمقاعد درجة رجال الأعمال أو مقاعد الدرجة الأولى على الرحلات المباشرة من A لـ B.,Levantine Arabic: بشكل عام، ما في منفعة من البحث عن خصومات لمقاعد درجة رجال الأعمال أو مقاعد الدرجة الأولى على الرحلات المباشرة من A لـ B. English: يسمح لك باختيار مقاعد درجة رجال الأعمال أو مقاعد الدرجة الأولى على الرحلات المباشرة من A لـ B.
يعتبر رمي بوميرانغ مهارة شائعة عدد كبير من السياح بحبوا يكسبوها.,Levantine Arabic: يعتبر رمي بوميرانغ مهارة شائعة عدد كبير من السياح بحبوا يكسبوها. English: يعد رمي بوميرانغ مهارة شائعة عدد كبير من السياح بحبوا يكسبوها. Arabic: يعد رمي بوميرانغ مهارة شائعة عدد كبير من السياح بحبوا يكسبوها.
هيدي الرحلة مش الخيار الوحيد إذا كنت حابب تتخطى جنوب المحيط الهادئ والساحل الغربي لأمريكا الجنوبية. (شوف الخيارات المذكورة تحت).,Levantine Arabic: هيدي الرحلة مش الخيار الوحيد إذا كنت حابب تتخطى جنوب المحيط الهادئ والساحل الغربي لأمريكا الجنوبية. (شوف الخيارات المذكورة تحت). English: هيدي الرحلة مش الخيار الوحيد إذا كنت حابب تتخطى جنوب المحيط الهادئ والساحل الغربي لأمريكا الجنوبية. (شوف الخيارات المذكورة تحت).
طورت سان فرانسيسكو بنية تحتية سياحية كبيرة مع كتير من الاوتيلات والمطاعم ومرافق المؤتمرات من الدرجة الأولى.,Levantine Arabic: طورت سان فرانسيسكو بنية تحتية سياحية كبيرة مع كتير من الاوتيلات والمطاعم ومرافق المؤتمرات من الدرجة الأولى. English: توفر خدمة الواي فاي المجانية في جميع الغرف.
التطوع خلال السفر من أفضل الإشيا اللي ممكن تغير بالعالم. إلا إنه التطوع ما بيعني إنو لازم أعطي بس.,Levantine Arabic: التطوع خلال السفر من أفضل الإشيا اللي ممكن تغير بالعالم. إلا إنه التطوع ما بيعني إنو لازم أعطي بس. English: اتكلم مع نفسك.
يمكن الناس ما تتوقع إنو الصبر والتفاهم ضروريين كمان للمسافرين الراجعين على بلدن.,Levantine Arabic: يمكن الناس ما تتوقع إنو الصبر والتفاهم ضروريين كمان للمسافرين الراجعين على بلدن. English: يمكن للناس ما تتوقع إنو الصبر والتفاهم ضروريين كمان للمسافرين الراجعين على بلدن.
ما تنس تزيد التكاليف الإضافية للتأشيرات الإضافية وضرايب المغادرة والنقل البري وغيرها، لكل الأماكن برّات إفريقيا.,Levantine Arabic: ما تنس تزيد التكاليف الإضافية للتأشيرات الإضافية وضرايب المغادرة والنقل البري وغيرها، لكل الأماكن برّات إفريقيا. English: ما تنس تزيد التكاليف الإضافية للتأشيرات الإضافية وضرايب المغادرة والنقل البري وغيرها، لكل الأماكن برّات إفريقيا.
لام العديد من سكان بيشكيك المتظاهرين من الجنوب بسبب خروجن عن القانون.,Levantine Arabic: لام العديد من سكان بيشكيك المتظاهرين من الجنوب بسبب خروجن عن القانون. English: لام العديد من سكان بيشكيك المتظاهرين من الجنوب بسبب خروجن عن القانون.
كانت الأجزاء الحالية من بلجيكا جزء من لوكسمبورغ بالماضي بس صارت بلجيكية بعد الثورة البلجيكية بتلاتينات القرن التسعتعش.,Levantine Arabic: كانت الأجزاء الحالية من بلجيكا جزء من لوكسمبورغ بالماضي بس صارت بلجيكية بعد الثورة البلجيكية بتلاتينات القرن التسعتعش. English: كانت الأجزاء الحالية من بلجيكا جزء من لوكسمبورغ بالماضي بس صارت بلجيكية بعد الثورة البلجيكية بتلاتينات القرن التسعتعش.
من سنة 1988، لازم تكون صناديق الاقتراع شفافة حتى يقدر الناخبين والمراقبين يشوفو إنو ما في ظروف ببداية التصويت وما ينضاف ظروف غير ظروف الناخبين اللي انفرزت حسب الأصول والناخبين المخولين.,Levantine Arabic: من سنة 1988، لازم تكون صناديق الاقتراع شفافة حتى يقدر الناخبين والمراقبين يشوفو إنو ما في ظروف ببداية التصويت وما ينضاف ظروف غير ظروف الناخبين اللي انفرزت حسب الأصول والناخبين المخولين. English: من سنة 1988، لازم تكون صناديق الاقتراع شفافة حتى يقدر الناخبين والمراقبين يشوفو إنو ما في ظروف ببداية التصويت وما ينضاف ظروف غير ظروف الناخبين اللي انفرزت حسب الأصول والناخبين المخولين.
قالت رئيسة الوزراء المؤقتة جوليا جيلارد خلال حملة الانتخابات الفيدرالية لسنة 2010 أنها بتعتقد أن أستراليا لازم تصير جمهورية بنهاية عهد الملكة إليزابيث التانية.,Levantine Arabic: قالت رئيسة الوزراء المؤقتة جوليا جيلارد خلال حملة الانتخابات الفيدرالية لسنة 2010 أنها بتعتقد أن أستراليا لازم تصير جمهورية بنهاية عهد الملكة إليزابيث التانية. English: قالت رئيسة الوزراء المؤقتة جوليا جيلارد خلال حملة الانتخابات الفيدرالية لسنة 2010 أنها بتعتقد أن أستراليا لازم تصير جمهورية بنهاية عهد الملكة إليزابيث التانية.
وبتأكد الحكومة الأيرلندية على الضرورة الملحة لسن تشريع برلماني لتصحيح الوضع.,Levantine Arabic: وبتأكد الحكومة الأيرلندية على الضرورة الملحة لسن تشريع برلماني لتصحيح الوضع. English: وبتأكد الحكومة الأيرلندية على الضرورة الملحة لسن تشريع برلماني لتصحيح الوضع.
الجدل الدبلوماسي بخصوص المنطقة عم يكمل بإفساد العلاقات بين أرمينيا وأذربيجان.,Levantine Arabic: الجدل الدبلوماسي بخصوص المنطقة عم يكمل بإفساد العلاقات بين أرمينيا وأذربيجان. English: التدخلات الإيرانية في المنطقة تثير الجدل. Arabic: التدخلات الإيرانية في المنطقة تثير الجدل.
"وافق رئيس الوزرا ستيفن هاربر على إرسال ""قانون الهوا النضيف"" للحكومة للجنة من كل الأحزاب للمراجعة قبل قرايتو مرة تانية، بعد اجتماع يوم التلاتا اللي دام 25 دقيقة مع زعيم الحزب الوطني الديمقراطي جاك لايتون بمكتب رئيس الوزرا.","Levantine Arabic: وافق رئيس الوزرا ستيفن هاربر على إرسال ""قانون الهوا النضيف"" للحكومة للجنة من كل الأحزاب للمراجعة قبل قرايتو مرة تانية، بعد اجتماع يوم التلاتا اللي دام 25 دقيقة مع زعيم الحزب الوطني الديمقراطي جاك لايتون بمكتب رئيس الوزرا. English: وافق رئيس الوزرا ستيفن هاربر على إرسال ""قانون الهوا النضيف"" للحكومة للجنة من كل الأحزاب للمراجعة قبل قرايتو مرة تانية، بعد اجتماع يوم التلاتا اللي دام 25 دقيقة مع زعيم الحزب الوطني الديمقراطي جاك لايتون بمكتب رئيس الوزرا."
صار في احتجاجات كبيرة ببولندا الشهر الماضي لما وقّعت الدولة على اتفاقية مكافحة التزوير التجارية، الشي اللي أدى لاتخاذ الحكومة البولندية قرار بعدم التصديق على الاتفاقية حالياً.,Levantine Arabic: صار في احتجاجات كبيرة ببولندا الشهر الماضي لما وقّعت الدولة على اتفاقية مكافحة التزوير التجارية، الشي اللي أدى لاتخاذ الحكومة البولندية قرار بعدم التصديق على الاتفاقية حالياً. English: يبدو أن الحكومة البولندية ترفض الاعتراف بقرار مكافحة التزوير التجاري، وطالبت بوقف التزوير.
الاستشارات هي مجرد ملخص صغير للوضع السياسي ببلد واحد.,Levantine Arabic: الاستشارات هي مجرد ملخص صغير للوضع السياسي ببلد واحد. English: الاستشارات هي مجرد ملخص صغير للوضع السياسي ببلد واحد.
خلال انتخابات سنة 1976، نصح كارتر بخصوص السياسة الخارجية، ومن بعدها عمل مستشار للأمن القومي (NSA) من سنة 1977 لسنة 1981، بعد هنري كيسنجر.,Levantine Arabic: خلال انتخابات سنة 1976، نصح كارتر بخصوص السياسة الخارجية، ومن بعدها عمل مستشار للأمن القومي (NSA) من سنة 1977 لسنة 1981، بعد هنري كيسنجر. English: بعد عام 1981، عمل مستشار للأمن القومي (NSA) من سنة 1981، بعد هنري كيسنجر.
ومن الممكن تتولى تركيا مهمة حراسة مقاتلي داعش اللي تم أسرهم واللي رفضت الدول الأوبية حسب البيان إعادتهم.,Levantine Arabic: ومن الممكن تتولى تركيا مهمة حراسة مقاتلي داعش اللي تم أسرهم واللي رفضت الدول الأوبية حسب البيان إعادتهم. English: من الممكن أن تجري اتصالات مع تركيا لدعم جهود التحالف الدولي في سوريا. Arabic: من الممكن أن تجري اتصالات مع تركيا لدعم جهود التحالف الدولي في سوريا.
صارت هيدي الخطط قديمة بين ليلة وضحاها تقريباً، بس فات أكتر من 800000 جندي من الجيش الأحمر للاتحاد السوفيتي وخلقوا الجبهتين البيلاروسية والأوكرانية بعد غزو المناطق الشرقية من بولندا بانتهاك لمعاهدة ريغا للسلام، معاهدة عدم الاعتداء السوفيتية البولندية، وغيرها من المعاهدات الدولية الثنائية والمتعددة الأطراف.,Levantine Arabic: صارت هيدي الخطط قديمة بين ليلة وضحاها تقريباً، بس فات أكتر من 800000 جندي من الجيش الأحمر للاتحاد السوفيتي وخلقوا الجبهتين البيلاروسية والأوكرانية بعد غزو المناطق الشرقية من بولندا بانتهاك لمعاهدة ريغا للسلام، معاهدة عدم الاعتداء السوفيتية البولندية، وغيرها من المعاهدات الدولية الثنائية والمتعددة الأطراف. English: قامت هيدي بنشر مقاطع فيديو تظهر تطورات الحرب في سوريا، ونشرها في موقعها الإلكتروني، ونشرها في موقعها الرسمي، ونشرها في موقعها الرسمي، ونشرها في موقعها الرسمي، ونشرها في موقعها الرسمي، ونشرها في موقعها الرسمي، ونشرها في موقعها الرسمي، ونشرها في موقعها الرسمي، ونشرها في موقعها الرسمي، ونشرها في موقعها الرسمي، ونشر
بعد هيدي العملية، رح يتم مراجعة HJR-3 مرة تانية من قبل الهيئة التشريعية المنتخبة التالية بـ 2015 أو 2016 للبقاء بالعملية,Levantine Arabic: بعد هيدي العملية، رح يتم مراجعة HJR-3 مرة تانية من قبل الهيئة التشريعية المنتخبة التالية بـ 2015 أو 2016 للبقاء بالعملية English: بعد هيدي العملية، رح يتم مراجعة HJR-3 مرة تانية من قبل الهيئة التشريعية المنتخبة التالية بـ 2015 أو 2016 للبقاء بالعملية
بعد اعتماده من قبل الكونجرس بـ 4 تموز، مسودة مكتوبة بخط اليد وقعها رئيس الكونجرس جون هانكوك والوزير تشارلز طومسون تم ارسالها على بعد بعض البنايات من مطبعة جون دنلاب.,Levantine Arabic: بعد اعتماده من قبل الكونجرس بـ 4 تموز، مسودة مكتوبة بخط اليد وقعها رئيس الكونجرس جون هانكوك والوزير تشارلز طومسون تم ارسالها على بعد بعض البنايات من مطبعة جون دنلاب. English: بعد اعتماده من قبل الكونجرس بـ 4 تموز، مسودة مكتوبة بخط اليد وقعها رئيس الكونجرس جون هانكوك والوزير تشارلز طومسون تم ارسالها على بعد بعض البنايات من مطبعة جون دنلاب.
بعد الساعة 11:00 بشوي، قطع المتظاهرين السير بالعربية المتجهة للشمال بوايتهول.,Levantine Arabic: بعد الساعة 11:00 بشوي، قطع المتظاهرين السير بالعربية المتجهة للشمال بوايتهول. English: بعد الساعة 11:00 بشوي، قطع المتظاهرين السير بالعربية المتجهة للشمال بوايتهول.
بحزيران 1956، انحطت وعود كروتشوف باختبار بس تحولت أعمال الشغب ببولندا، من عمال عم يحتجوا على نقص الأكل وتخفيض الأجور لاحتجاج عام ضد الشيوعية.,Levantine Arabic: بحزيران 1956، انحطت وعود كروتشوف باختبار بس تحولت أعمال الشغب ببولندا، من عمال عم يحتجوا على نقص الأكل وتخفيض الأجور لاحتجاج عام ضد الشيوعية. English: في عام 1956، قامت بريطانيا بإنشاء جيش قومي للدفاع عن بريطانيا، وبدأت حملة عسكرية ضد بريطانيا، وبدأت حملة عسكرية ضد ألمانيا، وبدأت حملة عسكرية ضد فرنسا، وبدأت حملة عسكرية ضد إيطاليا، وبدأت حملة عسكرية ضد إسبانيا، وبدأت حملة عسكرية ضد إيطاليا، وبدأت حملة عسكرية ضد إسبانيا،
كان مفروض تستمر 40 سنة وتخوضها جيوش حقيقية بالوكالة بساحات القتال من أفريقيا لآسيا وأفغانستان وكوبا ومطارح تانية كتيرة.,Levantine Arabic: كان مفروض تستمر 40 سنة وتخوضها جيوش حقيقية بالوكالة بساحات القتال من أفريقيا لآسيا وأفغانستان وكوبا ومطارح تانية كتيرة. English: كان مفروض تستمر 40 سنة وتخوضها جيوش حقيقية بالوكالة بساحات القتال من أفريقيا لآسيا وأفغانستان وكوبا ومطارح تانية كتيرة.
أوصت لجنة رئاسية الشهر الماضي باستقالة حزب المؤتمر الانتخابي السابق كجزء من مجموعة إجراءات لتحريك البلاد نحو انتخابات جديدة.,Levantine Arabic: أوصت لجنة رئاسية الشهر الماضي باستقالة حزب المؤتمر الانتخابي السابق كجزء من مجموعة إجراءات لتحريك البلاد نحو انتخابات جديدة. English: أعلنت لجنة الانتخابات في طرابلس، اليوم، عن ترشيح حزب المؤتمر الانتخابي السابق كجزء من مجموعة إجراءات لتحريك البلاد نحو انتخابات جديدة. Arabic: أعلنت لجنة الانتخابات في طرابلس، اليوم، عن ترشيح حزب المؤتمر الانتخابي السابق كجزء من مجموعة إجراءات لتحريك البلاد نحو انتخابات جديدة.
ومن الموضوعات التانية اللي تمت تغطيتا بحسب ما ورد، حالة القدس المستقبلية المقدسة لدى الشعبين وقضية وادي الأردن.,Levantine Arabic: ومن الموضوعات التانية اللي تمت تغطيتا بحسب ما ورد، حالة القدس المستقبلية المقدسة لدى الشعبين وقضية وادي الأردن. English: The future of the city of Jerusalem.
كمان ما كان عندها سلطة لتجاوز قوانين الضرايب والتعريفات بين الولايات.,Levantine Arabic: كمان ما كان عندها سلطة لتجاوز قوانين الضرايب والتعريفات بين الولايات. English: هكذا كان في السابق.
قانون الانتخاب الفرنسي بتدوّن الإجراءات بدقة.,Levantine Arabic: قانون الانتخاب الفرنسي بتدوّن الإجراءات بدقة. English: The French Election Law.
بعد أسبوع من الخسارة في الانتخابات التجديد النصفي، أخبر بوش الجمهور عن توسع التجارة بآسيا.,Levantine Arabic: بعد أسبوع من الخسارة في الانتخابات التجديد النصفي، أخبر بوش الجمهور عن توسع التجارة بآسيا. English: بعد أسبوع من الخسارة في الانتخابات التجديد النصفي، أخبر بوش الجمهور عن توسع التجارة بآسيا.
أثبتت الاستراتيجية فعاليتها، لأن قطعت الإمدادات العسكرية والمدنية الحيوية، على الرغم من أنّو هيدا الحصار انتهك القانون الدولي المقبول عمومًا يلّي تم تدوينه بعدة اتفاقيات دولية بالقرنين الماضيين.,Levantine Arabic: أثبتت الاستراتيجية فعاليتها، لأن قطعت الإمدادات العسكرية والمدنية الحيوية، على الرغم من أنّو هيدا الحصار انتهك القانون الدولي المقبول عمومًا يلّي تم تدوينه بعدة اتفاقيات دولية بالقرنين الماضيين. English: أثبتت الاستراتيجية فعاليتها، لأن قطعت الإمدادات العسكرية والمدنية الحيوية، على الرغم من أنّو هيدا الحصار انتهك القانون الدولي المقبول عمومًا يلّي تم تدوينه بعدة اتفاقيات دولية بالقرنين الماضيين.
أعيدت الروابط الاقتصادية بين هودي الجزأين من مولدوفا على الرغم من فشل المفاوضات السياسية.,Levantine Arabic: أعيدت الروابط الاقتصادية بين هودي الجزأين من مولدوفا على الرغم من فشل المفاوضات السياسية. English: أعيدت الروابط الاقتصادية بين هودي الجزأين من مولدوفا على الرغم من فشل المفاوضات السياسية.
بمرافقة هودي المسؤولين، أكد لمواطنين تكساس أنه عم يتم أخذ إجراءات لحماية سلامة الشعب.,Levantine Arabic: بمرافقة هودي المسؤولين، أكد لمواطنين تكساس أنه عم يتم أخذ إجراءات لحماية سلامة الشعب. English:
ركز النقد الليبرالي لجهود إعادة الإعمار على منح عقود إعادة الإعمار للمطلعين على بواطن الأمور بواشنطن.,Levantine Arabic: ركز النقد الليبرالي لجهود إعادة الإعمار على منح عقود إعادة الإعمار للمطلعين على بواطن الأمور بواشنطن. English: ركز النقد الليبرالي لجهود إعادة الإعمار على منح عقود إعادة الإعمار للمطلعين على بواطن الأمور بواشنطن.
من بين 1400 شخص شملن الاستطلاع قبل الانتخابات الفيدرالية لسنة 2010، زاد عدد المعارضين لإنو تصير أستراليا جمهورية بنسبة تماني بالمية من سنة 2008.,Levantine Arabic: من بين 1400 شخص شملن الاستطلاع قبل الانتخابات الفيدرالية لسنة 2010، زاد عدد المعارضين لإنو تصير أستراليا جمهورية بنسبة تماني بالمية من سنة 2008. English: من بين 1400 شخص شملن الاستطلاع قبل الانتخابات الفيدرالية لسنة 2010، زاد عدد المعارضين لإنو تصير أستراليا جمهورية بنسبة تماني بالمية من سنة 2008.
