text,translated_text
بتضيف الطفرة تباين جيني جديد، وبيشيلها الاختيار من مجموعة التباين الواضح.,Levantine Arabic: بتضيف الطفرة تباين جيني جديد، وبيشيلها الاختيار من مجموعة التباين الواضح. English: تضيف الطفرة تباين جيني جديد، وبيشيلها الاختيار من مجموعة التباين الواضح.
بتشتغل القنبلة الانشطارية على مبدأ بيتطلب طاقة لتكوين نواة فيها كتير من البروتونات والنيوترونات.,Levantine Arabic: بتشتغل القنبلة الانشطارية على مبدأ بيتطلب طاقة لتكوين نواة فيها كتير من البروتونات والنيوترونات. English: تعتمد القنبلة على طاقة طاقة طاقة طاقة طاقة طاقة طاقة طاقة طاقة طاقة طاقة طاقة طاقة طاقة طاقة طاقة طاقة طاقة طاقة طاقة طاقة طاقة طاقة طاقة طاقة طاقة طاقة طاقة طاقة طاقة طاقة طاقة طاقة طاقة طاقة طاقة طاقة طاقة طاقة طاقة طاقة طاقة طاقة طاقة طاقة طاقة طاقة
بتتكوّن النواة من جسيمين - نيوترونات وبروتونات.,Levantine Arabic: بتتكوّن النواة من جسيمين - نيوترونات وبروتونات. English: تتكون النواة من جسيمين - نيوترونات وبروتونات. Arabic: تتكون النواة من جسيمين - نيوترونات وبروتونات.
الأمر اللي سمح لعدسات الزووم بإنتاج صور بجودة بتتفوق على الصور اللي حققتها العدسات يلي إلها بعد ثابت.,Levantine Arabic: الأمر اللي سمح لعدسات الزووم بإنتاج صور بجودة بتتفوق على الصور اللي حققتها العدسات يلي إلها بعد ثابت. English: فكرة الزووم اللي سمح لعدسات الزووم بإنتاج صور بجودة بتتفوق على الصور اللي حققتها العدسات يلي إلها بعد ثابت.
وبتتفوق على بروكسيات الويب لعدة أسباب: إنها بتعيد توجيه كل حركات السير على الإنترنت مش بس http.,Levantine Arabic: وبتتفوق على بروكسيات الويب لعدة أسباب: إنها بتعيد توجيه كل حركات السير على الإنترنت مش بس http. English: وبتتفوق على بروكسيات الويب لعدة أسباب: إنها بتعيد توجيه كل حركات السير على الإنترنت مش بس http.
التصميم التفاعلي بحاجة لإعادة تقييم افتراضاتك بخصوص الإنتاج الإعلامي وتعلم التفكير بطرق غير خطية.,Levantine Arabic: التصميم التفاعلي بحاجة لإعادة تقييم افتراضاتك بخصوص الإنتاج الإعلامي وتعلم التفكير بطرق غير خطية. English: التصميم التفاعلي يتطلب مراجعة أفكارك وفهم احتياجاتك. Arabic: التصميم التفاعلي يتطلب مراجعة أفكارك وفهم احتياجاتك.
صارت هيدي الممارسة منتشرة، إلا إنه الحديد تسبب بتآكل زيادة على الدواليب الخشب للعربات.,Levantine Arabic: صارت هيدي الممارسة منتشرة، إلا إنه الحديد تسبب بتآكل زيادة على الدواليب الخشب للعربات. English: تسبب تغيرات في اللون في الجلد، وخاصة في المناطق الحساسة. Arabic: تسبب تغيرات في اللون في الجلد، وخاصة في المناطق الحساسة.
بتتكون المجموعات من واحد لتلات ذكور بالغين، بالإضافة لتلاتين أنثى وشبل تقريباً.,Levantine Arabic: بتتكون المجموعات من واحد لتلات ذكور بالغين، بالإضافة لتلاتين أنثى وشبل تقريباً. English: تتكون المجموعات من واحد لتلات ذكور بالغين، بالإضافة لتلاتين أنثى وشبل تقريباً.
على الرغم من أن للذكاء الاصطناعي دلالة قوية على الخيال العلمي، فإن الذكاء الاصطناعي بيشكل فرع مهم كتير من علوم الكمبيوتر، وبيتعامل مع السلوك والتعلم والتكيف الذكي بالآلة.,Levantine Arabic: على الرغم من أن للذكاء الاصطناعي دلالة قوية على الخيال العلمي، فإن الذكاء الاصطناعي بيشكل فرع مهم كتير من علوم الكمبيوتر، وبيتعامل مع السلوك والتعلم والتكيف الذكي بالآلة. English: يعتمد الذكاء الاصطناعي على التكنولوجيا، وتشمل التكنولوجيا الاصطناعية التطبيقات والأجهزة الذكية، وتطبيقات التعلم والتعلم الاصطناعي.
نسبة جوانب هيدا الشكل (مقسمة على تنعش للحصول على أبسط نسبة عدد كامل) هي 3:2.,Levantine Arabic: نسبة جوانب هيدا الشكل (مقسمة على تنعش للحصول على أبسط نسبة عدد كامل) هي 3:2. English: نسبة جوانب هيدا الشكل (مقسمة على تنعش للحصول على أبسط نسبة عدد كامل) هي 3:2.
التلفون يلّي بيشتغل عبر الأقمار الصناعية بشكل عام ما يعتبر بديل عن التلفون المحمول، لأن لازم أن تكون بالهوا الطلق مع وجود خط رؤية واضح للقمر الصناعي لإجراء مكالمة هاتفية.,Levantine Arabic: التلفون يلّي بيشتغل عبر الأقمار الصناعية بشكل عام ما يعتبر بديل عن التلفون المحمول، لأن لازم أن تكون بالهوا الطلق مع وجود خط رؤية واضح للقمر الصناعي لإجراء مكالمة هاتفية. English: يُمكنك تشغيل التلفون على جهازك المحمول، لكن يجب أن يكون لديك هاتف محمول. Arabic: يُمكنك تشغيل التلفون على جهازك المحمول، لكن يجب أن يكون لديك هاتف محمول.
على الرغم من أن العربات كانت مصنوعة بس من ألواح خشبية متوازية، إلا أنها سمحت للخيول بجرّها لتتوصل لسرعة أكبر وتسحب حمل أكبر من الطرق الأكتر وعورة بشوي باليوم.,Levantine Arabic: على الرغم من أن العربات كانت مصنوعة بس من ألواح خشبية متوازية، إلا أنها سمحت للخيول بجرّها لتتوصل لسرعة أكبر وتسحب حمل أكبر من الطرق الأكتر وعورة بشوي باليوم. English: تعتمد العربات على طرق تقليدية، مثل طرق الصيد، وطرق الصيد البحري، وطرق الصيد المائية، وطرق الصيد المائية، وطرق الصيد المائية، وطرق الصيد المائية، وطرق الصيد المائية، وطرق الصيد المائية، وطرق الصيد المائية، وطرق الصيد المائية، وطرق الصيد المائية، وطرق الصيد المائية، وطرق الصيد المائية
عرف الناس عن العناصر الكيميائية الأساسية متل الدهب والفضة والنحاس من العصور القديمة، لإنو ممكن اكتشافها كلها بالطبيعة بشكلها الأصلي وهي بسيطة نسبيًا لاستخراجها باستعمال الأدوات البدائية.,Levantine Arabic: عرف الناس عن العناصر الكيميائية الأساسية متل الدهب والفضة والنحاس من العصور القديمة، لإنو ممكن اكتشافها كلها بالطبيعة بشكلها الأصلي وهي بسيطة نسبيًا لاستخراجها باستعمال الأدوات البدائية. English: يحتوي الزيت على مادة كبريتريك، وهي مادة مهمة في عملية التخلص من الدهون، ولها دور كبير في عملية التخلص من السموم. Arabic: يحتوي الزيت على مادة كبريتريك، وهي مادة مهمة في عملية التخلص من الدهون، ولها دور كبير في عملية التخلص من السموم.
وقدر الدولاب يغير العالم بطريقة مش معقولة. وأهم شي قدمه الدولاب إلنا هو توفير وسيلة نقل أسهل وأسرع.,Levantine Arabic: وقدر الدولاب يغير العالم بطريقة مش معقولة. وأهم شي قدمه الدولاب إلنا هو توفير وسيلة نقل أسهل وأسرع. English: وقدر الدولاب يغير العالم بطريقة مش معقولة. وأهم شي قدمه الدولاب إلنا هو توفير وسيلة نقل أسهل وأسرع.
وانعمل هيدا الشي للتأكد من إنو الصورة بتغطي الشاشة بأكملها. ومنسمي هيدا الشي بالمسح الضوئي الزايد.,"Levantine Arabic: وانعمل هيدا الشي للتأكد من إنو الصورة بتغطي الشاشة بأكملها. ومنسمي هيدا الشي بالمسح الضوئي الزايد. English: انقر على زر ""تكبير"" في شريط اليمين. Arabic: انقر على زر ""تكبير"" في شريط اليمين."
كانت تسمى الغواصات الألمانية U-Boats. كان الألمان بارعين بالإبحار بغواصاتهم وتشغيلها.,Levantine Arabic: كانت تسمى الغواصات الألمانية U-Boats. كان الألمان بارعين بالإبحار بغواصاتهم وتشغيلها. English: كانت تسمى الغواصات الألمانية U-Boats. كان الألمان بارعين بالإبحار بغواصاتهم وتشغيلها.
على الرغم من أن حالته الفيزيائية ممكن تتغير، إلا أن حالته الكيميائية بتضل متل ما هي.,Levantine Arabic: على الرغم من أن حالته الفيزيائية ممكن تتغير، إلا أن حالته الكيميائية بتضل متل ما هي. English: يعاني من مشاكل في النطق، ومشاكل في النطق، ومشاكل في النطق، ومشاكل في النطق، ومشاكل في النطق، ومشاكل في النطق، ومشاكل في النطق، ومشاكل في النطق، ومشاكل في النطق، ومشاكل في النطق، ومشاكل في النطق، ومشاكل في النطق، ومشاكل في النطق، ومشاكل في النطق، ومشاكل في النطق، ومشاكل في النطق، و
بصير التوتر السطحي لأن جزيئات المي الموجودة على سطح المي بتنجذب بقوة لبعضها أكتر ما بتنجذب لجزيئات الهوا فوقها.,Levantine Arabic: بصير التوتر السطحي لأن جزيئات المي الموجودة على سطح المي بتنجذب بقوة لبعضها أكتر ما بتنجذب لجزيئات الهوا فوقها. English: تتحرك جزيئات المي حول بعضها البعض. Arabic: تتحرك جزيئات المي حول بعضها البعض.
وحدة من أكتر المشكال الشائعة لما تجرب تحول فيلم لصيغة الدي في دي هيي المسح الزايد.,Levantine Arabic: وحدة من أكتر المشكال الشائعة لما تجرب تحول فيلم لصيغة الدي في دي هيي المسح الزايد. English: وحدة من أكتر المشكال الشائعة لما تجرب تحول فيلم لصيغة الدي في دي هيي المسح الزايد.
بشكل خاص، بقولوا أن ممكن الشخص يكتشف إذا كان الشخص عم يكذب من خلال تفسير التعبيرات الدقيقة بشكل صحيح.,Levantine Arabic: بشكل خاص، بقولوا أن ممكن الشخص يكتشف إذا كان الشخص عم يكذب من خلال تفسير التعبيرات الدقيقة بشكل صحيح. English: يعتقد أن الشخص الذي يتحدث بلغة أخرى يتحدث بشكل صحيح.
ممكن عمل الذهب بكل الأشكال. ممكن تحويله لأشكال صغيرة.,Levantine Arabic: ممكن عمل الذهب بكل الأشكال. ممكن تحويله لأشكال صغيرة. English: ممكن عمل الذهب بكل الأشكال. English: ممكن تحويله لأشكال صغيرة.
غالبًا بيستعملو نظام الذكا الاصطناعي حاليًا بمجالات الاقتصاد والطب والهندسة والجيش، كمان تم بناؤه بعدة تطبيقات برامج الكمبيوتر وألعاب الفيديو المنزلية.,Levantine Arabic: غالبًا بيستعملو نظام الذكا الاصطناعي حاليًا بمجالات الاقتصاد والطب والهندسة والجيش، كمان تم بناؤه بعدة تطبيقات برامج الكمبيوتر وألعاب الفيديو المنزلية. English: يستعمل نظام التشغيل Windows على أجهزة الكمبيوتر المحمولة، كما يستعمل نظام التشغيل Windows على أجهزة الكمبيوتر المكتبية.
بعدن لليوم عم ينتجوه، بس الأهم من هيك أن نسبة الأبعاد تبعها ورثتها تنسيقات أشكال مستشعر الصور بالكاميرا الرقمية..,Levantine Arabic: بعدن لليوم عم ينتجوه، بس الأهم من هيك أن نسبة الأبعاد تبعها ورثتها تنسيقات أشكال مستشعر الصور بالكاميرا الرقمية.. English:
قاعدة التلت يلّي يُساء استعمالها ويلّي غالبًا بتم الاستهزاء فيها هي مبدأ توجيهي بسيط بيخلق ديناميكية مع الحفاظ على شوي من النظام بالصورة.,Levantine Arabic: قاعدة التلت يلّي يُساء استعمالها ويلّي غالبًا بتم الاستهزاء فيها هي مبدأ توجيهي بسيط بيخلق ديناميكية مع الحفاظ على شوي من النظام بالصورة. English: قاعدة التلت يلّي تُساء استخدامها غالبًا بتم الاستهزاء فيها هي مبدأ توجيهي بسيط بيخلق ديناميكية مع الحفاظ على شوي من النظام بالصورة.
وهيدا مش بس بيأكّد إنو الديناصورات كان عندا ريش، وهي نظرية منتشرة بالفعل، وبتوفر كمان تفاصيل دقيقة ما بتقدر الدراسات تكتشفها متل اللون والترتيب الثلاثي الأبعاد.,Levantine Arabic: وهيدا مش بس بيأكّد إنو الديناصورات كان عندا ريش، وهي نظرية منتشرة بالفعل، وبتوفر كمان تفاصيل دقيقة ما بتقدر الدراسات تكتشفها متل اللون والترتيب الثلاثي الأبعاد. English: هيدا مش بس بيأكّد إنو الديناصورات كان عندا ريش، وهي نظرية منتشرة بالفعل، وبتوفر كمان تفاصيل دقيقة ما بتقدر الدراسات تكتشفها متل اللون والترتيب الثلاثي الأبعاد.
كيف رح تجذبني جاذبية آيو؟ إذا وقفت على سطح آيو، فرح يكون وزنك أقل من وزنك على الأرض.,Levantine Arabic: كيف رح تجذبني جاذبية آيو؟ إذا وقفت على سطح آيو، فرح يكون وزنك أقل من وزنك على الأرض. English: كيف رح تجذبني جاذبية آيو؟ إذا وقفت على سطح آيو، فرح يكون وزنك أقل من وزنك على الأرض.
نكستجن هو نظام بتدعي إدارة الطيران الفيدرالية إنو رح يسمح للطيارات بالطيران بمسارات أقصر وبيوفر ملايين الليترات من الوقود كل سنة وبيقلل من انبعاثات الكربون.,Levantine Arabic: نكستجن هو نظام بتدعي إدارة الطيران الفيدرالية إنو رح يسمح للطيارات بالطيران بمسارات أقصر وبيوفر ملايين الليترات من الوقود كل سنة وبيقلل من انبعاثات الكربون. English: قامت شركة ناسا بتطوير نظام تشغيلي جديد يسمح للطيران بتشغيل الطائرات بدون طيار في الفضاء. Arabic: قامت شركة ناسا بتطوير نظام تشغيلي جديد يسمح للطيران بتشغيل الطائرات بدون طيار في الفضاء.
بتوفر البيانات العصبية الحيوية دليل مادي للنهج النظري للتحقيق بالإدراك. وبالتالي بتضيّق مجال البحث وبتخليه دقيق أكتر.,Levantine Arabic: بتوفر البيانات العصبية الحيوية دليل مادي للنهج النظري للتحقيق بالإدراك. وبالتالي بتضيّق مجال البحث وبتخليه دقيق أكتر. English: يُمكنك إنشاء قاعدة بيانات بيانات بيانات بيانات بيانات بيانات بيانات بيانات بيانات بيانات بيانات بيانات بيانات بيانات بيانات بيانات بيانات بيانات بيانات بيانات بيانات بيانات بيانات بيانات بيانات بيانات بيانات بيانات بيانات بيانات بيانات بيانات بيانات بيانات بيانات بيانات بيانات بيانات بيانات بيانات بيانات بيانات بيانات بيانات بيانات بيانات
"خلال خطابه يلّي دام لساعتين، صرح بأن ""اليوم رح تعيد Apple اختراع التلفون، رح نصنع التاريخ اليوم"".","Levantine Arabic: خلال خطابه يلّي دام لساعتين، صرح بأن ""اليوم رح تعيد Apple اختراع التلفون، رح نصنع التاريخ اليوم"". English: ""Apple قامت بتطوير التلفون، ونحن نريد أن نصنع التاريخ اليوم""."
من سيئات عدسات التكبير هو أنّو التعقيد البؤري وعدد عناصر العدسة المطلوبة لتحقيق أطول نطاق أكبر بكتير من العدسات الأولية.,Levantine Arabic: من سيئات عدسات التكبير هو أنّو التعقيد البؤري وعدد عناصر العدسة المطلوبة لتحقيق أطول نطاق أكبر بكتير من العدسات الأولية. English: من سيئات عدسات التكبير هو أنّو التعقيد البؤري وعدد عناصر العدسة المطلوبة لتحقيق أطول نطاق أكبر بكتير من العدسات الأولية.
يستعمل جهاز التحكم اللي بيشبه جهاز التحكم عن بعد بالتلفزيون، مستشعرين محطوطين حد تلفزيون المستخدم لتثليث موقعو بالفضاء الثلاثي الأبعاد.,Levantine Arabic: يستعمل جهاز التحكم اللي بيشبه جهاز التحكم عن بعد بالتلفزيون، مستشعرين محطوطين حد تلفزيون المستخدم لتثليث موقعو بالفضاء الثلاثي الأبعاد. English: يستعمل جهاز التحكم اللي بيشبه جهاز التحكم عن بعد بالتلفزيون، مستشعرين محطوطين حد تلفزيون المستخدم لتثليث موقعو بالفضاء الثلاثي الأبعاد.
. بيقول العلما إنو ريش هيدا الحيوان كان بني كستنائي من فوق مع ميلة تحتانية مايلة للأصفر.,Levantine Arabic:. بيقول العلما إنو ريش هيدا الحيوان كان بني كستنائي من فوق مع ميلة تحتانية مايلة للأصفر. English:..................................................
وقال باحثين بالجامعة إن المركّبيْن بيتفاعلوا مع بعضهم لتكوين بلورات ممكن تعيق وظايف الكلى.,Levantine Arabic: وقال باحثين بالجامعة إن المركّبيْن بيتفاعلوا مع بعضهم لتكوين بلورات ممكن تعيق وظايف الكلى. English: وقال باحثون بالجامعة إن المركّبيْن بيتفاعلوا مع بعضهم لتكوين بلورات ممكن تعيق وظايف الكلى.
هيدا بيعطي أربع مرات دقة عن دقة شريط الفيلم (نيجاتيف)بطول 35 مم (3136 مم 2 مقابل 864).,Levantine Arabic: هيدا بيعطي أربع مرات دقة عن دقة شريط الفيلم (نيجاتيف)بطول 35 مم (3136 مم 2 مقابل 864). English: هيدا بيعطي أربع مرات دقة عن دقة شريط الفيلم (نيجاتيف)بطول 35 مم (3136 مم 2 مقابل 864).
بفضل روابط كبلات الألياف الضوئية بأوروبا والأقمار الصناعية يلّي نطاقها عريض، غرينلاند متصلة منيح بنسبة 93 ٪ بالسكان يلّي عندن إمكانية بالوصول للإنترنت.,Levantine Arabic: بفضل روابط كبلات الألياف الضوئية بأوروبا والأقمار الصناعية يلّي نطاقها عريض، غرينلاند متصلة منيح بنسبة 93  بالسكان يلّي عندن إمكانية بالوصول للإنترنت. English: يبلغ متوسط معدل القراءة في بريطانيا معدل القراءة في أوروبا معدل القراءة في الولايات المتحدة معدل القراءة في كندا معدل القراءة في الولايات المتحدة الأمريكية معدل القراءة في الولايات المتحدة الأمريكية معدل القراءة في كندا معدل القراءة في الولايات المتحدة الأمريكية معدل القراءة في الولايات المتحدة الأمريكية معدل القراءة في الولايات المتحدة الأمريكية معدل القراءة في الولايات المتحدة الأمريكية معدل القراءة في الولايات المتحدة الأمريكية معدل القراءة في الولايات المتحدة
"واحد من أبرز التطبيقات بهيدي الفئة هو ""غوغل ترانسلايت"" اللي بيسمح بالترجمة من دون إنترنت بعد تنزيل بيانات اللغة المطلوبة.","Levantine Arabic: واحد من أبرز التطبيقات بهيدي الفئة هو ""غوغل ترانسلايت"" اللي بيسمح بالترجمة من دون إنترنت بعد تنزيل بيانات اللغة المطلوبة. English: يسمح لك بترجمة المحتوى العربي إلى اللغة الإنجليزية. Arabic: يسمح لك بترجمة المحتوى العربي إلى اللغة الإنجليزية."
عندو نفس التركيب الجزيئيإذا كان غاز أو سائل أو صلب.,Levantine Arabic: عندو نفس التركيب الجزيئيإذا كان غاز أو سائل أو صلب. English: إذا كان غاز أو سائل أو صلب.
حقق استعمال تسجيل الفيديو اكتشافات مهمة بتفسير التعبيرات الدقيقة وحركات الوجه اللي بتستمر لبضعة أجزاء من الثانية.,Levantine Arabic: حقق استعمال تسجيل الفيديو اكتشافات مهمة بتفسير التعبيرات الدقيقة وحركات الوجه اللي بتستمر لبضعة أجزاء من الثانية. English: حقق استخدام تسجيل الفيديو اكتشافات مهمة بتفسير التعبيرات الدقيقة وحركات الوجه اللي بتستمر لبضعة أجزاء من الثانية.
صنعوا البشر العدسات المكبرة واستعملوها من آلاف وآلاف السنين.,Levantine Arabic: صنعوا البشر العدسات المكبرة واستعملوها من آلاف وآلاف السنين. English: خذوا البشر العدسات المكبرة واستعملوها من آلاف وآلاف السنين. Arabic: خذوا البشر العدسات المكبرة واستعملوها من آلاف وآلاف السنين.
