text,translated_text
منّا وحدها، التجريب، والتجربة هي اختبار يستعمل لإزالة وحدة أو أكتر من الفرضيات المحتملة، وطرح الأسئلة، والمراقبة، كمان بتودي لبحث علمي.,Levantine Arabic: منّا وحدها، التجريب، والتجربة هي اختبار يستعمل لإزالة وحدة أو أكتر من الفرضيات المحتملة، وطرح الأسئلة، والمراقبة، كمان بتودي لبحث علمي. English: منّا وحدها، التجريب، والتجربة هي اختبار يستعمل لإزالة وحدة أو أكتر من الفرضيات المحتملة، وطرح الأسئلة، والمراقبة، كمان بتودي لبحث علمي.
يالنهاية، استُبدلت العجلات الخشبية بعجلات حديدية. بسنة 1767 ، تم تقديم أول سكك حديدية كاملة.,Levantine Arabic: يالنهاية، استُبدلت العجلات الخشبية بعجلات حديدية. بسنة 1767 ، تم تقديم أول سكك حديدية كاملة. English: يالنهاية، استُبدلت العجلات الخشبية بعجلات حديدية. بسنة 1767 ، تم تقديم أول سكك حديدية كاملة.
بالرغم من أنو معظم البطاقات منيحة للاتصال من أي كان، إلا إنو بعضها بيقدم أسعار مكالمات مناسبة لمجموعات محددة من البلدان.,Levantine Arabic: بالرغم من أنو معظم البطاقات منيحة للاتصال من أي كان، إلا إنو بعضها بيقدم أسعار مكالمات مناسبة لمجموعات محددة من البلدان. English: يتوفر في معظم البلدان العربية، إلا أنو بعضها بيقدم أسعار مكالمات مناسبة لمجموعات محددة من البلدان. Arabic: يتوفر في معظم البلدان العربية، إلا أنو بعضها بيقدم أسعار مكالمات مناسبة لمجموعات محددة من البلدان.
معظم تلسكوبات البحث الحديثة هي منشآت ضخمة بالمناطق النائية يلّي عندها ظروف جوية ملائمة.,Levantine Arabic: معظم تلسكوبات البحث الحديثة هي منشآت ضخمة بالمناطق النائية يلّي عندها ظروف جوية ملائمة. English: معظم تلسكوبات البحث الحديثة هي منشآت ضخمة بالمناطق النائية يلّي عندها ظروف جوية ملائمة.
بتفوش الإبرة الفولاذية فوق المي بسبب التوتر السطحي.,Levantine Arabic: بتفوش الإبرة الفولاذية فوق المي بسبب التوتر السطحي. English: The water is so hot that the sand is so hard.
تصميم بــ 35 مم هو بالواقع مربك لحدٍ ما، فيفضل إنّو يكون 36 مم عرض و 24 مم ارتفاع.,Levantine Arabic: تصميم بــ 35 مم هو بالواقع مربك لحدٍ ما، فيفضل إنّو يكون 36 مم عرض و 24 مم ارتفاع. English: تصميم بـ 35 مم هو بالواقع مربك لحدٍ ما، فيفضل إنّو يكون 36 مم عرض و 24 مم ارتفاع.
"تعتبر الخلايا أساسية وحساسة كتير لدراسة الحياة، بالواقع، غالبًا تُسمى ""اللبنات الأساسية للحياة.""","Levantine Arabic: تعتبر الخلايا أساسية وحساسة كتير لدراسة الحياة، بالواقع، غالبًا تُسمى ""اللبنات الأساسية للحياة."" English: تُسمى ""البنات الأساسية للعلم."" Arabic: تُسمى ""البنات الأساسية للعلم."""
بيُعتبر متعهدي الشبكة الافتراضية الخاصة طريقة ممتازة للتحايل على الرقابة السياسية والتصفية الجغرافية التجارية لبروتوكول الإنترنت.,Levantine Arabic: بيُعتبر متعهدي الشبكة الافتراضية الخاصة طريقة ممتازة للتحايل على الرقابة السياسية والتصفية الجغرافية التجارية لبروتوكول الإنترنت. English: يُعتبر متعهدي الشبكة الافتراضية الخاصة طريقة ممتازة للتحايل على الرقابة السياسية والتصفية الجغرافية التجارية لبروتوكول الإنترنت.
حافظت المحطة على موقفها، على الرغم من فقدان جيروسكوب سابقًا بمهمة المحطة الفضائية، حتى نهاية السير بالفضا.,Levantine Arabic: حافظت المحطة على موقفها، على الرغم من فقدان جيروسكوب سابقًا بمهمة المحطة الفضائية، حتى نهاية السير بالفضا. English: حافظت على موقفها، على الرغم من فقدان جيروسكوب سابقًا بمهمة المحطة الفضائية، حتى نهاية السير بالفضا.
الأشخاص اللي بيفكرو بهالطريقة عندن تفكير منطقي وبيقدرو يحفظو الأنماط ويحلّو المشاكل ويشتغلو على الاختبارات العلمية.,Levantine Arabic: الأشخاص اللي بيفكرو بهالطريقة عندن تفكير منطقي وبيقدرو يحفظو الأنماط ويحلّو المشاكل ويشتغلو على الاختبارات العلمية. English: الأشخاص اللي بيفكرو بهالطريقة عندن تفكير منطقي وبيقدرو يحفظو الأنماط ويحلّو المشاكل ويشتغلو على الاختبارات العلمية.
بيحب الأسيلوت أكل الحيوانات الزغيرة. وبيطارد القرود والحيايا والقوارض والطيور إذا قدر. كل الحيوانات اللي بيصطادها الأسيلوت تقريباً أزغر منو بكتير.,Levantine Arabic: بيحب الأسيلوت أكل الحيوانات الزغيرة. وبيطارد القرود والحيايا والقوارض والطيور إذا قدر. كل الحيوانات اللي بيصطادها الأسيلوت تقريباً أزغر منو بكتير. English: بيحب الأسيلوت أكل الحيوانات الزغيرة. وبيطارد القرود والحيايا والقوارض والطيور إذا قدر. كل الحيوانات اللي بيصطادها الأسيلوت تقريباً أزغر منو بكتير.
بتستعمل بعض كاميرات الأفلام متوسطة الحجم تنسيق 6 بـ 6 سنتيمتر، وبصورة أدق 56 بـ 56 ملليمتر سلبي.,Levantine Arabic: بتستعمل بعض كاميرات الأفلام متوسطة الحجم تنسيق 6 بـ 6 سنتيمتر، وبصورة أدق 56 بـ 56 ملليمتر سلبي. English: تستعمل كاميرات الأفلام متوسطة الحجم تنسيق 6 بـ 6 سنتيمتر، وبصورة أدق 56 بـ 56 ملليمتر سلبي. Arabic: تستعمل كاميرات الأفلام متوسطة الحجم تنسيق 6 بـ 6 سنتيمتر، وبصورة أدق 56 بـ 56 ملليمتر سلبي.
لازم المسافرين يكونوا على علم بتغيرات الطقس اللي ممكن تأثر على خطة سفرهم.,Levantine Arabic: لازم المسافرين يكونوا على علم بتغيرات الطقس اللي ممكن تأثر على خطة سفرهم. English: تغيرات الطقس اللي ممكن تأثر على خطة سفرهم.
بتفل الباصات من محطة الباصات بين المناطق (عبر النهر) طول اليوم، على الرغم من أن معظمها، خاصة يلّي متجهة للشرق وجاكار/بومثانج بتفل بين الساعة 06:30 و 07:30.,Levantine Arabic: بتفل الباصات من محطة الباصات بين المناطق (عبر النهر) طول اليوم، على الرغم من أن معظمها، خاصة يلّي متجهة للشرق وجاكار/بومثانج بتفل بين الساعة 06:30 و 07:30. English: تسمح محطة الباصات من محطة الباصات بين المناطق (عبر النهر) بالوصول إلى محطة الباصات من محطة الباصات من محطة الباصات من محطة الباصات من محطة الباصات من محطة الباصات من محطة الباصات من محطة الباصات من محطة الباصات من محطة الباصات من محطة الباصات من محطة الباصات من محطة الباصات من محطة الباصات من محطة الباصات من محطة الباصات
بتوفر قدر كبير من الاستقرار للراكب. إلا إنه ممكن تسبب مشاكل بتتعلق بالسلامة إذا علقت رجلين الفارس فيها.,Levantine Arabic: بتوفر قدر كبير من الاستقرار للراكب. إلا إنه ممكن تسبب مشاكل بتتعلق بالسلامة إذا علقت رجلين الفارس فيها. English: يبدو أن الراكب يعاني من مشاكل في النطق.
بتضم معظم رحلات البلطيق المتميزة بإقامة طويلة بسانت بطرسبرغ بروسيا.,Levantine Arabic: بتضم معظم رحلات البلطيق المتميزة بإقامة طويلة بسانت بطرسبرغ بروسيا. English: تتوفر رحلات البلطيق المتميزة بإقامة طويلة بسانت بطرسبرغ بروسيا.
تفترض النصيحة أن المسافرين ما بيسرقوا أو بيتعدوا على ممتلكات الغير أو بشاركوا بالسَوق غير القانوني أو التسول أو بيستغلوا التانيين لتحقيق ارباح الهم.,Levantine Arabic: تفترض النصيحة أن المسافرين ما بيسرقوا أو بيتعدوا على ممتلكات الغير أو بشاركوا بالسَوق غير القانوني أو التسول أو بيستغلوا التانيين لتحقيق ارباح الهم. English: تُفترض النصيحة أن المسافرين ما بيسرقوا أو بيتعدوا على ممتلكات الغير أو بشاركوا بالسَوق غير القانوني أو التسول أو بيستغلوا التانيين لتحقيق ارباح الهم.
في عدة أشيا يلّي لازم تاخدها بعين الاعتبار قبل ولمّا تسافر لأي مطرح.,Levantine Arabic: في عدة أشيا يلّي لازم تاخدها بعين الاعتبار قبل ولمّا تسافر لأي مطرح. English: لا تسافر لأي مطرح.
بشوب النهار، ممكن يجربوا المسافرين السراب يلّي بيعطي وهم المي (أو أشيا تانية),Levantine Arabic: بشوب النهار، ممكن يجربوا المسافرين السراب يلّي بيعطي وهم المي (أو أشيا تانية) English: يلا، يلا، يلا، يلا، يلا، يلا، يلا، يلا، يلا، يلا، يلا، يلا، يلا، يلا، يلا، يلا، يلا، يلا، يلا، يلا، يلا، يلا، يلا، يلا، يلا، يلا، يلا، يلا، يلا، يلا، يلا، يلا، يلا،
تعتبر العيل يلّي عندها أطفال شي كتير نادر، بس بعض المساكن بتعطيهم غرف خاصة.,Levantine Arabic: تعتبر العيل يلّي عندها أطفال شي كتير نادر، بس بعض المساكن بتعطيهم غرف خاصة. English: تُعتبر العيل يلّي عندها أطفال شي كتير نادر، بس بعض المساكن بتعطيهم غرف خاصة.
مثلاً زيارة القلاع بوادي لوار أو وادي الراين أو عمل رحلة بحرية لمدن مثيرة للاهتمام على نهر الدانوب أو ركوب الزوارق على طول قناة إيري.,Levantine Arabic: مثلاً زيارة القلاع بوادي لوار أو وادي الراين أو عمل رحلة بحرية لمدن مثيرة للاهتمام على نهر الدانوب أو ركوب الزوارق على طول قناة إيري. English: زيارة مدن تاريخية مثل مدن ليون أو مدن ليون الفرنسية أو مدن ليون الفرنسية أو مدن ليون الفرنسية أو مدن ليون الفرنسية أو مدن ليون الفرنسية أو مدن ليون الفرنسية أو مدن ليون الفرنسية أو مدن ليون الفرنسية أو مدن ليون الفرنسية أو مدن ليون الفرنسية أو مدن ليون الفرنسية أو مدن ليون الفرنسية أو مدن ليون الفرنسية أو مدن ليون الفرنسية أو مدن ليون الفرنسية
ممكن يكون من الأفضل الاستعانة بوكيل بيحجز كتير رحلات متل رحلتك.,Levantine Arabic: ممكن يكون من الأفضل الاستعانة بوكيل بيحجز كتير رحلات متل رحلتك. English: ممكن يكون من الأفضل الاستعانة بوكيل بيحجز كتير رحلات متل رحلتك.
تأسست Couchsurfing بكانون التاني 2004 بعد ما لاقى مبرمج الكمبيوتر كيسي فينتون رحلة رخيصة لأيسلندا بس ما كان عند ه محل للإقامة.,Levantine Arabic: تأسست Couchsurfing بكانون التاني 2004 بعد ما لاقى مبرمج الكمبيوتر كيسي فينتون رحلة رخيصة لأيسلندا بس ما كان عند ه محل للإقامة. English: تأسست Couchsurfing بكانون التاني 2004 بعد ما لاقى مبرمج الكمبيوتر كيسي فينتون رحلة رخيصة لأيسلندا بس ما كان عند ه محل للإقامة.
بتتطلب تأشيرات الطلاب عمومًا متطلبات وإجراءات تقديم مختلفة عن تأشيرات السياحة أو العمل العادية.,Levantine Arabic: بتتطلب تأشيرات الطلاب عمومًا متطلبات وإجراءات تقديم مختلفة عن تأشيرات السياحة أو العمل العادية. English: يتطلب تأشيرة الطلاب إجراءات تقديم مختلفة عن تأشيرات السياحة أو العمل العادية.
كل دولة عندها كمان قوانين فريدة بتحدد شو عناصر الطوارئ يلّي من المفترض تكون بالسيارة.,Levantine Arabic: كل دولة عندها كمان قوانين فريدة بتحدد شو عناصر الطوارئ يلّي من المفترض تكون بالسيارة. English: كل دولة عندها قوانين فريدة بتحدد شو عناصر الطوارئ يلّي من المفترض تكون بالسيارة.
على الرغم من أن معظم الوكالات مستعدة لإجراء معظم الحجوزات المنتظمة، إلا أن عدة وكلا متخصصين بأنواع معينة من السفر أو نطاقات الميزانية أو الوجهات.,Levantine Arabic: على الرغم من أن معظم الوكالات مستعدة لإجراء معظم الحجوزات المنتظمة، إلا أن عدة وكلا متخصصين بأنواع معينة من السفر أو نطاقات الميزانية أو الوجهات. English: يسمح لك أن تختار من بين خيارات السفر التي ترغب في القيام بها.
ممكن يواجه المسافرين حيوانات خطيرة مش متعودين عليها ببلدهم الأساسي.,Levantine Arabic: ممكن يواجه المسافرين حيوانات خطيرة مش متعودين عليها ببلدهم الأساسي. English: يبدو أن حيوانات الخطيرة في بريطانيا تعاني من نقص في الغذاء. Arabic: يبدو أن حيوانات الخطيرة في بريطانيا تعاني من نقص في الغذاء.
وكمان بالشمال زور الحرم العظيم لسيدة فاطيمة (ضريح)، وهو مكان للظهورات المريمية الشهيرة بكل أنحاء العالم.,Levantine Arabic: وكمان بالشمال زور الحرم العظيم لسيدة فاطيمة (ضريح)، وهو مكان للظهورات المريمية الشهيرة بكل أنحاء العالم. English: The Temple of the Holy Sepulchre (ضريح)، وهو مكان للظهورات المريمية الشهيرة بكل أنحاء العالم.
ممكن استعمال بودا بودا (موتوسيكل تاكسي) للتجول بغوما. والسعر العادي (المحلي) هو حوالي 500 فرنك كونغولي للرحلة القصيرة.,Levantine Arabic: ممكن استعمال بودا بودا (موتوسيكل تاكسي) للتجول بغوما. والسعر العادي (المحلي) هو حوالي 500 فرنك كونغولي للرحلة القصيرة. English: يمكن استخدام بودا بودا (موتوسيكل تاكسي) للوصول إلى مطار فرانكفورت الدولي.
بالنسبة للأشخاص يلّي بيستمتعوا بالأنشطة بالهوا الطلق، فعمل برحلة عبر ممر Sea to Sky هي أمر ضروري.,Levantine Arabic: بالنسبة للأشخاص يلّي بيستمتعوا بالأنشطة بالهوا الطلق، فعمل برحلة عبر ممر Sea to Sky هي أمر ضروري. English: تجربة تجربة تجربة تجربة تجربة تجربة تجربة تجربة تجربة تجربة تجربة تجربة تجربة تجربة تجربة تجربة تجربة تجربة تجربة تجربة تجربة تجربة تجربة تجربة تجربة تجربة تجربة تجربة تجربة تجربة تجربة تجربة تجربة تجربة تجربة تجربة تجربة تجربة تجربة تجربة تجربة تجربة تجربة تجربة تجربة تجربة تجربة تجربة تجربة تجربة
"رحلة سفاري مشي (تُسمى كمان ""المشي يالأدغال""، أو ""سفاري المشي لمسافات طويلة""، أو ""التمشاية"") بتضمن المشي لمسافات طويلة أو لبضع ساعات أو عدة أيام.","Levantine Arabic: رحلة سفاري مشي (تُسمى كمان ""المشي يالأدغال""، أو ""سفاري المشي لمسافات طويلة""، أو ""التمشاية"") بتضمن المشي لمسافات طويلة أو لبضع ساعات أو عدة أيام. English: رحلة مشي (تُسمى كمان ""المشي يالأدغال""، أو ""سفاري المشي لمسافات طويلة""، أو ""التمشاية"") بتضمن المشي لمسافات طويلة أو لبضع ساعات أو عدة أيام."
كانت الطريقة الوحيدة للحصول عليها بشكل أسرع هي بعتها كأمتعة مسجلة. ما رح تسمح لوائح شركات الطيران ببعت أمتعة بدون راكب، يعني بنفس المطرح يلّي انت في.,Levantine Arabic: كانت الطريقة الوحيدة للحصول عليها بشكل أسرع هي بعتها كأمتعة مسجلة. ما رح تسمح لوائح شركات الطيران ببعت أمتعة بدون راكب، يعني بنفس المطرح يلّي انت في. English:.
"300 عربة إضافية بترفع العدد الإجمالي لـ 1,300عربة يتم شراؤها لتخفيف الازدحم.","Levantine Arabic: 300 عربة إضافية بترفع العدد الإجمالي لـ 1,300عربة يتم شراؤها لتخفيف الازدحم. English: 300 عربة إضافية ترفع العدد الإجمالي لـ 1,300عربة يتم شراؤها لتخفيف الازدحم."
ممكن تحتاج العيل يلّي عنها أطفال صغار لاستعدادات أكتر، بس من السهل قضاء يوم بالهواء الطلق حتى مع الأطفال الرضع والأطفال بعمر قبل المدرسة.,Levantine Arabic: ممكن تحتاج العيل يلّي عنها أطفال صغار لاستعدادات أكتر، بس من السهل قضاء يوم بالهواء الطلق حتى مع الأطفال الرضع والأطفال بعمر قبل المدرسة. English: ممكن تحتاج العيل يلّي عنها أطفال صغار لاستعدادات أكتر، بس من السهل قضاء يوم بالهواء الطلق حتى مع الأطفال الرضع والأطفال بعمر قبل المدرسة.
لازم كل شخص عم يسوق سيارته على خطوط العرض العالية أو فوق الممرات الجبلية أن يفكر بإمكانية نزول الثلج أو الجليد أو درجات الحرارة العالية.,Levantine Arabic: لازم كل شخص عم يسوق سيارته على خطوط العرض العالية أو فوق الممرات الجبلية أن يفكر بإمكانية نزول الثلج أو الجليد أو درجات الحرارة العالية. English: لا يوجد شيء يمنع من الخروج من المنزل. Arabic: لا يوجد شيء يمنع من الخروج من المنزل.
ليوم ، تمبكتو مدينة فقيرة، بالرغم من إنو سمعتها وامتلاكها لمطار بخلوها منطقة جذب سياحي.,Levantine Arabic: ليوم ، تمبكتو مدينة فقيرة، بالرغم من إنو سمعتها وامتلاكها لمطار بخلوها منطقة جذب سياحي. English: مطار طرابلس الدولي. Arabic: مطار طرابلس الدولي.
بالعواصف التلجية، ممكن ينزل كمية كافية من التلج تخليك تعلق بوقت كتير قصير.,Levantine Arabic: بالعواصف التلجية، ممكن ينزل كمية كافية من التلج تخليك تعلق بوقت كتير قصير. English: ممكن ينزل كمية كافية من التلج تخليك تعلق بوقت كتير قصير.
إذا كنت حابب تسافر حول العالم بنصف الكرة الجنوبي بالكامل، فاختيار الرحلات والوجهات محدود بسبب عدم وجود طرق عبر المحيط.,Levantine Arabic: إذا كنت حابب تسافر حول العالم بنصف الكرة الجنوبي بالكامل، فاختيار الرحلات والوجهات محدود بسبب عدم وجود طرق عبر المحيط. English: إذا كنت حابب تسافر حول العالم بنصف الكرة الجنوبي بالكامل، فاختيار الرحلات والوجهات محدود بسبب عدم وجود طرق عبر المحيط.
وسعت شركات الطيران متل طيران الإمارات، والاتحاد للطيران، والخطوط الجوية القطرية، والخطوط الجوية التركية بشكل كبير خدماتها على إفريقيا، وبتوفر رحلات للعديد من المدن الأفريقية الكبرى بأسعار تنافسية مقارنة بشركات الطيران الأوروبية التانية.,Levantine Arabic: وسعت شركات الطيران متل طيران الإمارات، والاتحاد للطيران، والخطوط الجوية القطرية، والخطوط الجوية التركية بشكل كبير خدماتها على إفريقيا، وبتوفر رحلات للعديد من المدن الأفريقية الكبرى بأسعار تنافسية مقارنة بشركات الطيران الأوروبية التانية. English: تتوفر خدمة الخطوط الجوية القطرية، والخطوط الجوية التركية، والخطوط الجوية البريطانية، والخطوط الجوية البريطانية، والخطوط الجوية البريطانية، والخطوط الجوية البريطانية، والخطوط الجوية البريطانية، والخطوط الجوية البريطانية، والخطوط الجوية البريطانية، والخطوط الجوية البريطانية، والخطوط الجوية البريطانية، والخطوط الجوية البريطانية، والخطوط الجوية البريطانية، والخطوط الجوية البريطانية، والخطوط الجوية البريطانية، والخطوط الجوية البريطانية، والخطوط الجوية البريطانية، والخطوط الجوية البريطانية، والخطوط الجوية البريطانية،
ما رح تنزاد وسائل نقل إضافية وما رح تتوقف القطارات فوق الأرض بويمبلي، ومواقف السيارات ومرافق الركن والركوب مش متوفرة على الأرض كمان.,Levantine Arabic: ما رح تنزاد وسائل نقل إضافية وما رح تتوقف القطارات فوق الأرض بويمبلي، ومواقف السيارات ومرافق الركن والركوب مش متوفرة على الأرض كمان. English: ما رح تتوقف القطارات فوق الأرض بويمبلي، ومواقف السيارات ومرافق الركن والركوب مش متوفرة على الأرض كمان.
