text,translated_text
"Poskytují jezdci větší stabilitu, mohou ale být spojeny s bezpečnostními problémy kvůli možnosti, že se v nich nohy jezdce zaseknou.","Czech: Poskytují jezdci větší stabilitu, mohou ale být spojeny s bezpečnostními problémy kvůli možnosti, že se v nich nohy jezdce zaseknou. English: The Czech Republic is a country in the European Union. It is located in the Czech Republic. It is a country in the European Union. It is a country in the European Union."
Plavby po Baltském moři mají většinou na programu delší pobyt v ruském Petrohradu.,Czech: Plavby po Baltském moři mají většinou na programu delší pobyt v ruském Petrohradu. English: The Czech Republic is a country in the European Union.
"Tato rada předpokládá, že cestující nekradou, nepáchají přestupky, neúčastní se černého trhu, nežebrají nebo jinak nezneužívají jiné lidi k vlastnímu prospěchu.","Czech: Tato rada předpokládá, že cestující nekradou, nepáchají přestupky, neúčastní se černého trhu, nežebrají nebo jinak nezneužívají jiné lidi k vlastnímu prospěchu. English: Tato rada, že že že že že že že že že že že že že že že že že že že že že že že že že že že že že že že že že že že že že že že že že že že že že že že že že že že že že že že že že že že že že že že že že že že že že že že že že že že že že že že že že že že že že že že že že že že že že že že že že"
Před a během cesty je potřeba zvážit mnoho věcí.,Czech: Před a během cesty je potřeba zvážit mnoho věcí. English: The Czech Republic is a country in the Czech Republic. It is a country in the Czech Republic. It is a country in the Czech Republic.
"Za denního úpalu mohou cestovatelé vidět zrcadlení, které vyvolává iluzi vody (nebo jiných věcí).","Czech: Za denního úpalu mohou cestovatelé vidět zrcadlení, které vyvolává iluzi vody (nebo jiných věcí). English: The Czech Republic is a country in the European Union."
"Rodiny s dětmi jsou vzácností, ale některé hostely jim nabízejí soukromé pokoje.","Czech: Rodiny s dětmi jsou vzácností, ale některé hostely jim nabízejí soukromé pokoje. English: The hotel is located in the heart of the city center, just a few steps from the main square."
Například návštěva hradů v údolí Loiry a Rýnu nebo okružní cesta po zajímavých městech na Dunaji či plavba po Erijském kanálu.,Czech: Například návštěva hradů v údolí Loiry a Rýnu nebo okružní cesta po zajímavých městech na Dunaji či plavba po Erijském kanálu. English: The Czech Republic is a country in the European Union. It is located in the Czech Republic. It is the second largest country in the European Union. It is the third largest country in the European Union. It is the fourth largest country in the European Union. It is the fifth largest country in the European Union. It is the sixth largest country in the European Union. It is the seventh largest country in the European Union. It is the eighth largest country in the European Union.
"Může být lepší využít služeb agenta, který často rezervuje výlety podobné tomu vašemu.","Czech: Může být lepší využít služeb agenta, který často rezervuje výlety podobné tomu vašemu. English: I'm a professional, I'm a professional, I'm a professional, I'm a professional, I'm a professional, I'm a professional, I'm a professional, I'm a professional, I'm a professional, I'm a professional, I'm a professional, I'm a professional, I'm a professional, I'm a professional, I'm a professional, I'm a professional, I'm a"
"Couchsurfing byl založen v lednu 2004 poté, co počítačový programátor Casey Fenton nalezl levný let na Island, ale neměl kde tam pobývat.","Czech: Couchsurfing byl založen v lednu 2004 poté, co počítačový programátor Casey Fenton nalezl levný let na Island, ale neměl kde tam pobývat. English: Couchsurfing byl v vřet 2004 poté, co kancelářový programátor Casey Fenton nalezl levný let na Island, ale מסלול kde tam pobývat."
Studentská víza mají obvykle jiné požadavky a postupy při podávání žádosti než běžná turistická nebo obchodní víza.,"Czech: Studentská víza mají obvykle jiné požadavky a postupy při podávání žádosti než běžná turistická nebo obchodní víza. English: Studentská víza, který svého svého znaky. Czech: Studentská víza, který svého svého znaky."
"Každá země má také své vlastní právní předpisy, které upravují obsah povinné nouzové výbavy, kterou je nutno mít v autě.","Czech: Každá země má také své vlastní právní předpisy, které upravují obsah povinné nouzové výbavy, kterou je nutno mít v autě. English: The Czech Republic is a country in the European Union. It is a member of the European Union. It is a member of the European Union."
"Většina agentur je ochotná splnit všechny obvyklé požadavky, někteří agenti se ale specializují jen na některé druhy cest, cenové kategorie nebo oblasti.","Czech: Většina agentur je ochotná splnit všechny obvyklé požadavky, někteří agenti se ale specializují jen na některé druhy cest, cenové kategorie nebo oblasti. English: The Czech Republic is a country in the European Union. The Czech Republic is a country in the European Union. The Czech Republic is a country in the European Union."
"Cestovatelé se mohou setkat se zvířecími škůdci, které ve svých domovských regionech neznají.","Czech: Cestovatelé se mohou setkat se zvířecími škůdci, které ve svých domovských regionech neznají. English: The Czech Republic is a country in the European Union. It is located in the Czech Republic."
"Na severu také navštivte Svatyni Panny Marie ve Fatimě (Sanctuary of Our Lady of Fatima), která je celosvětově známým místem zjevování Panny Marie.","Czech: Na severu také navštivte Svatyni Panny Marie ve Fatimě (Sanctuary of Our Lady of Fatima), která je celosvětově známým místem zjevování Panny Marie. English: The Fatima Shrine, Prague, Czech Republic."
Pro cestu po Gomě můžete využít boda boda (motocyklové taxi). Běžná cena za krátkou jízdu je zhruba 500 konžských franků.,Czech: Pro cestu po Gomě můžete využít boda boda (motocyklové taxi). Běžná cena za krátkou jízdu je zhruba 500 konžských franků. English: The Czech Republic is a country in the European Union. It is located in the Czech Republic. It is a country in the European Union. It is a country in the European Union. It is a country in the European Union. It is a country in the European Union. It is a country in the European Union. It is a country in the European Union. It is a country in the European Union. It is a country in the European Union. It is a country in the European Union.
"Všichni, kdo mají v oblibě pobyt v přírodě, by měli určitě navštívit koridor Sea to Sky.","Czech: Všichni, kdo mají v oblibě pobyt v přírodě, by měli určitě navštívit koridor Sea to Sky. English: The Sea to Sky Challenge is a competition for young people to compete in a variety of sports. The competition is open to all ages and is held in the Czech Republic. The competition is open to all ages and is held in the Czech Republic."
Turistické safari se skládá z pěší túry trvající několik hodin až několik dní.,Czech: Turistické safari se skládá z pěší túry trvající několik hodin až několik dní. English: The Czech Republic is a country in the Czech Republic. It is located in the Czech Republic. It is a country in the Czech Republic. It is a country in the Czech Republic.
"Jediný způsob, jak to zvládnout rychleji, je poslat danou věc jako odbavené zavazadlo. Letecké předpisy ale nedovolují poslat zavazadlo bez cestujícího, a tady přicházíte na řadu vy.","Czech: Jediný způsob, jak to zvládnout rychleji, je poslat danou věc jako odbavené zavazadlo. Letecké předpisy ale nedovolují poslat zavazadlo bez cestujícího, a tady přicházíte na řadu vy. English: Jediný čas, jak to chůzi, je možné na chůzi, je možné na chůzi, který na chůzi, který na chůzi, který na chůzi, který na chůzi, který na chůzi, který na chůzi, který na chůzi, který na chůzi, který na chůzi, který na chůzi, který na chůzi, který na chůzi, který na chů"
S dalšími 300 je to celkově 1 300 povozů potřebných ke zmírnění přelidnění.,Czech: S dalšími 300 je to celkově 1 300 povozů potřebných ke zmírnění přelidnění. English: The Czech Republic is a country in the European Union. It is located in the Czech Republic. It is a country in the European Union. It is a country in the European Union.
"Rodiny s malými dětmi se budou možná muset více připravovat, ale strávit den venku je snadno možné i s nemluvňaty a předškoláky.","Czech: Rodiny s malými dětmi se budou možná muset více připravovat, ale strávit den venku je snadno možné i s nemluvňaty a předškoláky. English: Rodiny s malými časo příznaky, ale příznaky a předškoláky. Czech: Rodiny s malými časo příznaky, ale příznaky a předškoláky. English: Rodiny s malými časo příznaky, ale příznaky a předškoláky. Czech: Rodiny s malými časo příznaky, ale příznaky a předškoláky. English: Rodiny s malými časo příznaky, ale příznaky a předško"
"Každý, kdo bude řídit ve vysoké zeměpisné výšce nebo v horském průsmyku, byl měl zvážit možnost sněhu, ledu nebo mrazivých teplot.","Czech: Každý, kdo bude řídit ve vysoké zeměpisné výšce nebo v horském průsmyku, byl měl zvážit možnost sněhu, ledu nebo mrazivých teplot. English: I'm sorry, I'm sorry, I'm sorry, I'm sorry, I'm sorry, I'm sorry, I'm sorry, I'm sorry, I'm sorry, I'm sorry, I'm sorry, I'm sorry, I'm sorry, I'm sorry, I'm sorry, I'm sorry, I'm sorry, I'm sorry, I'm sorry, I'm sorry,"
"Timbuktu je dnes zchudlé město, díky své pověsti je však turistickou atrakci. Má také své letiště.","Czech: Timbuktu je dnes zchudlé město, díky své pověsti je však turistickou atrakci. Má také své letiště. English: Timbuktu is a city in the Czech Republic. It is located in the center of the city. It is a city with a population of about 200,000 people. It is the capital of the Czech Republic."
"Během sněhové bouře napadá ve velmi krátkém čase dostatek sněhu na to, aby vám znemožnil jízdu.","Czech: Během sněhové bouře napadá ve velmi krátkém čase dostatek sněhu na to, aby vám znemožnil jízdu. English: The Czech Republic is a country in the European Union. It is located in the Czech Republic."
"Pokud chcete letět kolem světa jen po jižní polokouli, výběr letů a destinací je z důvodu nedostatečného množství transoceánských tras omezený.","Czech: Pokud chcete letět kolem světa jen po jižní polokouli, výběr letů a destinací je z důvodu nedostatečného množství transoceánských tras omezený. English: The Czech Republic is a country in the European Union. It is located in the Czech Republic. It is a country in the European Union. It is a country in the European Union. It is a country in the European Union. It is a country in the European Union. It is a country in the European Union. It is a country in the European Union. It is a country in the European Union. It is a country in the European Union. It is a country in the European Union."
"Letecké společnosti jako Emirates, Etihad Airways, Qatar Airways a Turkish Airlines ve velké míře rozšířily své služby do Afriky, a nabízí spojení do řady afrických měst za příznivější ceny než jiné evropské aerolinie.","Czech: Letecké společnosti jako Emirates, Etihad Airways, Qatar Airways a Turkish Airlines ve velké míře rozšířily své služby do Afriky, a nabízí spojení do řady afrických měst za příznivější ceny než jiné evropské aerolinie. English: The Emirates Group is a global airline with more than 1,200 flights a year."
"Nebude zavedena žádná mimořádná doprava, nadzemní vlaková doprava nebude ve Wembley stavět, na místě nejsou k dispozici parkoviště ani místa park-and-ride.","Czech: Nebude zavedena žádná mimořádná doprava, nadzemní vlaková doprava nebude ve Wembley stavět, na místě nejsou k dispozici parkoviště ani místa park-and-ride. English: The Wembley Stadium is a stadium in the Wembley Stadium, London, England. It is the home of the Wembley Football Club."
"Obecně platí, že pobyt v jakékoli cizí zemi po delší dobu vyžaduje, abyste si předem obstarali vízum.","Czech: Obecně platí, že pobyt v jakékoli cizí zemi po delší dobu vyžaduje, abyste si předem obstarali vízum. English: The Czech Republic is a country in the European Union. It is located in the Czech Republic."
"V každém vlaku jsou jak vagony MetroPlus, tak Metro. Vagony MetroPlus jsou vždy zařazeny na konec vlaku směrem ke Kapskému Městu.","Czech: V každém vlaku jsou jak vagony MetroPlus, tak Metro. Vagony MetroPlus jsou vždy zařazeny na konec vlaku směrem ke Kapskému Městu. English: MetroPlus is a public transport system in Prague, Czech Republic. It is operated by the Czech Railways. It is operated by the Czech Railways."
Každý se účastní života ve společnosti a využívá dopravní systémy. Téměř všichni si na dopravní systémy stěžují.,Czech: Každý se účastní života ve společnosti a využívá dopravní systémy. Téměř všichni si na dopravní systémy stěžují. English: The Czech Republic is a country in the European Union. It is a member of the European Union. It is a member of the European Union.
"Protože tato území jsou jen řídce osídlená a světelné znečištění většinou nepředstavuje problém, budete si moci vychutnat pohled i na hvězdy.","Czech: Protože tato území jsou jen řídce osídlená a světelné znečištění většinou nepředstavuje problém, budete si moci vychutnat pohled i na hvězdy. English: The Czech Republic is a country in the European Union. It is a member of the European Union. It is a member of the European Union."
"Pravidla používání karty Visa a poplatky jsou jiné v každé oblasti a závisejí na zemi, odkud pocházíte.","Czech: Pravidla používání karty Visa a poplatky jsou jiné v každé oblasti a závisejí na zemi, odkud pocházíte. English: Visa for Czech citizens. Czech: Visa for foreigners. Czech: Visa for foreigners. Czech: Visa for foreigners. Czech: Visa for foreigners. Czech: Visa for foreigners. Czech: Visa for foreigners. Czech: Visa for foreigners. Czech: Visa for foreigners. Czech: Visa for foreigners. Czech: Visa for foreigners. Czech: Visa for foreigners. Czech: Visa for foreigners. Czech: Visa for foreigners. Czech: Visa for"
"Obecně lze říci, že nemá smysl vůbec hledat slevy na lety z bodu A do bodu B pro první nebo byznys třídu.","Czech: Obecně lze říci, že nemá smysl vůbec hledat slevy na lety z bodu A do bodu B pro první nebo byznys třídu. English: The bodu is a small, circular, rectangular, or rectangular-shaped building in Prague, Czech Republic."
"Házení bumerangem je oblíbenou dovedností, kterou se snaží ovládnout mnoho turistů.","Czech: Házení bumerangem je oblíbenou dovedností, kterou se snaží ovládnout mnoho turistů. English: The Czech Republic is a country in the Czech Republic. It is located in the Czech Republic. It is a country in the Czech Republic. It is a country in the Czech Republic. It is a country in the Czech Republic. It is a country in the Czech Republic. It is a country in the Czech Republic. It is a country in the Czech Republic. It is a country in the Czech Republic. It is a country in the Czech Republic. It is a country in the Czech Republic."
"Tento let není jedinou možností, pokud si přejete vynechat jižní Pacifik a západní pobřeží Jižní Ameriky. (viz níže)","Czech: Tento let není jedinou možností, pokud si přejete vynechat jižní Pacifik a západní pobřeží Jižní Ameriky. (viz níže) English: I'm sorry, I'm sorry, I'm sorry, I'm sorry, I'm sorry, I'm sorry, I'm sorry, I'm sorry, I'm sorry, I'm sorry, I'm sorry, I'm sorry, I'm sorry, I'm sorry, I'm sorry, I'm sorry, I'm sorry, I'm sorry, I'm sorry, I'm sorry,"
"San Francisko vyvinulo rozsáhlou turistickou infrastrukturu zahrnující četné hotely, restaurace a špičková kongresová zařízení.","Czech: San Francisko vyvinulo rozsáhlou turistickou infrastrukturu zahrnující četné hotely, restaurace a špičková kongresová zařízení. English: San Francisko, San Francisco, San Francisco, San Francisco, San Francisco, San Francisco, San Francisco, San Francisco, San Francisco, San Francisco, San Francisco, San Francisco, San Francisco, San Francisco, San Francisco, San Francisco, San Francisco, San Francisco, San Francisco, San Francisco, San Francisco, San Francisco, San Francisco, San Francisco, San Francisco, San Francisco, San Francisco, San Francisco, San Francisco, San Francisco, San Francisco, San Francisco, San Francisco,"
"Dobrovolnické aktivity v rámci cestování jsou skvělým způsobem, jak učinit něco užitečného, ale nejde jen o to, něco dát.","Czech: Dobrovolnické aktivity v rámci cestování jsou skvělým způsobem, jak učinit něco užitečného, ale nejde jen o to, něco dát. English: The Czech Republic is a country in the European Union. It is a member of the European Union. It is a member of the European Union."
"Lidé si možná neuvědomují, že trpělivost a pochopení potřebují i cestovatelé, kteří se vracejí domů.","Czech: Lidé si možná neuvědomují, že trpělivost a pochopení potřebují i cestovatelé, kteří se vracejí domů. English: Lidé, Lidé, Lidé, Lidé, Lidé, Lidé, Lidé, Lidé, Lidé, Lidé, Lidé, Lidé, Lidé, Lidé, Lidé, Lidé, Lidé, Lidé, Lidé, Lidé, Lidé, Lidé, Lidé, Lidé, Lidé, Lidé, Lidé, Lidé, Lidé, Lidé, Lidé, Lidé, Lidé, Lid"
"Nezapomeňte zahrnout do propočtu další výdaje za dodatečná víza, poplatky za odjezd, pozemní dopravu atd. ve všech těchto místech mimo Afriku.","Czech: Nezapomeňte zahrnout do propočtu další výdaje za dodatečná víza, poplatky za odjezd, pozemní dopravu atd. ve všech těchto místech mimo Afriku. English: The United Nations is a non-profit organization that works to promote peace and stability in the region."
Několik obyvatel Biškeku obvinilo protestující z jihu z nezákonného jednání.,Czech: Několik obyvatel Biškeku obvinilo protestující z jihu z nezákonného jednání. English: The Czech Republic is a country in the European Union.
"Části dnešní Belgie byly v minulosti součástí Lucemburska, ale po belgické revoluci roku 1830 se staly součástí Belgie.","Czech: Části dnešní Belgie byly v minulosti součástí Lucemburska, ale po belgické revoluci roku 1830 se staly součástí Belgie. English: The Czech Republic is a republic in the Czech Republic. It is the largest country in the world. It is the second largest country in the world after the United States. It is the third largest country in the world after the United Kingdom."
"Od roku 1988 musí být volební urny průhledné, aby voliči i pozorovatelé mohli dosvědčit, že se v nich nenacházely žádné obálky ještě před začátkem hlasování a že nebyly přidány žádné jiné obálky než ty, které vložili spočítaní a oprávnění voliči.","Czech: Od roku 1988 musí být volební urny průhledné, aby voliči i pozorovatelé mohli dosvědčit, že se v nich nenacházely žádné obálky ještě před začátkem hlasování a že nebyly přidány žádné jiné obálky než ty, které vložili spočítaní a oprávnění voliči. English: Odyssey 1988, a világa příhledně, a příhledně a příhledně a příhledně a příhledně a příhledně a příhledně a příhledně a příhledně a příhledně a příhledně a příhledně a příhledně a příhledně a příhledně a příhledně a příhledně a příhledně a příhledně a příhledně a příhledně a příhledně a příhledně"
"Předsedkyně úřednické vlády Julia Gillard během kampaně ve federálních volbách 2010 prohlásila, že věří, že by se na konci vlády královny Alžběty II. měla Austrálie stát republikou.","Czech: Předsedkyně úřednické vlády Julia Gillard během kampaně ve federálních volbách 2010 prohlásila, že věří, že by se na konci vlády královny Alžběty II. měla Austrálie stát republikou. English: The Czech Republic is a country in the European Union. It is located in the Czech Republic. It is a country in the European Union. It is a country in the European Union. It is a country in the European Union. It is a country in the European Union. It is a country in the European Union. It is a country in the European Union. It is a country in the European Union. It is a country in the European Union. It is a country in the European Union."
"Irská vláda zdůrazňuje nutnost vytvoření parlamentní legislativy, která povede k nápravě situace.","Czech: Irská vláda zdůrazňuje nutnost vytvoření parlamentní legislativy, která povede k nápravě situace. English: The Czech Parliament is a parliamentary body of the Czech Republic. It is the headquarters of the Czech Republic."
Diplomatické spory o oblast nadále maří vztahy mezi Arménií a Ázerbajdžánem.,Czech: Diplomatické spory o oblast nadále maří vztahy mezi Arménií a Ázerbajdžánem. English: The Czech Embassy in the Republic of Czech Republic.
"""Předseda vlády Stephen Harper souhlasil, že vládní """"Vyhlášku o čistém vzduchu"""" předloží ke kontrole výboru všech stran před jejím druhým čtením, a to po úterním 25minutovém setkání s lídrem NDP Jackem Laytonem v projektové kanceláři. ""","Czech: ""Předseda vlády Stephen Harper souhlasil, že vládní """"Vyhlášku o čistém vzduchu"""" předloží ke kontrole výboru všech stran před jejím druhým čtením, a to po úterním 25minutovém setkání s lídrem NDP Jackem Laytonem v projektové kanceláři. "" English: ""The Conservative Party is a party of the people, not of the government. """
"Minulý měsíc se v Polsku, které podepsalo dohodu ACTA, odehrály velké protesty, jež vedly k tomu, že polská vláda odmítla prozatím dohodu ratifikovat.","Czech: Minulý měsíc se v Polsku, které podepsalo dohodu ACTA, odehrály velké protesty, jež vedly k tomu, že polská vláda odmítla prozatím dohodu ratifikovat. English: I'm not sure what to do."
Poradenství jsou pouze stručným souhrnem politické situace v dané zemi.,Czech: Poradenství jsou pouze stručným souhrnem politické situace v dané zemi. English: The Czech Republic is a country in the European Union. Czech: The Czech Republic is a country in the European Union. Czech: The Czech Republic is a country in the European Union. Czech: The Czech Republic is a country in the European Union. Czech: The Czech Republic is a country in the European Union. Czech: The Czech Republic is a country in the European Union. Czech: The Czech Republic is a country in the European Union. Czech: The Czech Republic is a country in the European
"Během výběrů v roce 1976 radil Carterovi v oblasti zahraniční politiky, poté od roku 1977 do roku 1981 působil jako poradce pro národní bezpečnost (NSA), kde nahradil Henryho Kissingera.","Czech: Během výběrů v roce 1976 radil Carterovi v oblasti zahraniční politiky, poté od roku 1977 do roku 1981 působil jako poradce pro národní bezpečnost (NSA), kde nahradil Henryho Kissingera. English: The Soviet Union was a Soviet state, which was founded in the Soviet Union in the year of the Soviet Union. The Soviet Union was a state of the Soviet Union, which was founded in the year of the Soviet Union."
"Turecko také převezme ostrahu zajatých bojovníků ISIS, které dle prohlášení odmítly evropské národy repatriovat.","Czech: Turecko také převezme ostrahu zajatých bojovníků ISIS, které dle prohlášení odmítly evropské národy repatriovat. English: The United States of America is a country in the United States of America."
"Tyto plány však téměř přes noc vzaly za své, když více než 800 000 vojáků sovětské Rudé armády vytvořilo běloruské a ukrajinské fronty poté, co vojáci napadli východní oblasti Polska a porušili tím Rižskou mírovou smlouvou, Sovětsko-polský pakt o neútočení a další mezinárodní smlouvy, a to jak dvoustranné, tak i mnohostranné.","Czech: Tyto plány však téměř přes noc vzaly za své, když více než 800 000 vojáků sovětské Rudé armády vytvořilo běloruské a ukrajinské fronty poté, co vojáci napadli východní oblasti Polska a porušili tím Rižskou mírovou smlouvou, Sovětsko-polský pakt o neútočení a další mezinárodní smlouvy, a to jak dvoustranné, tak i mnohostranné. English: The Czech Republic is a country in the European Union. It is a member of the European Union. It is a member of the European Union."
