text,translated_text
"Mutace přidávají novou genetickou variaci, a výběr je odstraňuje ze souboru vyjádřených variací.","Czech: Mutace přidávají novou genetickou variaci, a výběr je odstraňuje ze souboru vyjádřených variací. English: The Czech Republic is a country in the European Union. It is a member of the European Union. It is a member of the European Union."
"Štěpná jaderná bomba funguje na principu, že k udržení jádra s mnoha protony a neutrony pohromadě je zapotřebí energie.","Czech: Štěpná jaderná bomba funguje na principu, že k udržení jádra s mnoha protony a neutrony pohromadě je zapotřebí energie. English: The Czech Republic is a country in the Czech Republic."
Jádro se skládá ze dvou částic – neutronů a protonů.,Czech: Jádro se skládá ze dvou částic – neutronů a protonů. English: The Czech Republic is a country in the Czech Republic.
"To umožnilo objektivům s přiblížením produkovat snímky srovnatelné kvality s tou, kterou dosahují objektivy s fixní ohniskovou vzdáleností.","Czech: To umožnilo objektivům s přiblížením produkovat snímky srovnatelné kvality s tou, kterou dosahují objektivy s fixní ohniskovou vzdáleností. English: To the Czech Republic, the Czech Republic is a country of the European Union."
"Jsou lepší než webové proxy servery z několika důvodů: přesměrují veškerý internetový provoz, nejen http.","Czech: Jsou lepší než webové proxy servery z několika důvodů: přesměrují veškerý internetový provoz, nejen http. English: The Internet is a global network of information and communication technologies."
"Interaktivní design vyžaduje, abyste přehodnotili své domněnky o mediální produkci a naučili se přemýšlet nelineárně.","Czech: Interaktivní design vyžaduje, abyste přehodnotili své domněnky o mediální produkci a naučili se přemýšlet nelineárně. English: Interately designed interiors, interior design, interior design, interior design, interior design, interior design, interior design, interior design, interior design, interior design, interior design, interior design, interior design, interior design, interior design, interior design, interior design, interior design, interior design, interior design, interior design, interior design, interior design, interior design, interior design, interior design, interior design, interior design, interior design, interior design, interior design, interior design,"
"To se stalo běžným jevem, ale železo způsobilo větší opotřebení dřevěných kol vozů.","Czech: To se stalo běžným jevem, ale železo způsobilo větší opotřebení dřevěných kol vozů. English: To be careful of the unwanted foreign objects. Czech: To be careful of the unwanted foreign objects."
Smečku tvoří jeden až tři příbuzní dospělí samci spolu s až třiceti samicemi a mláďaty.,Czech: Smečku tvoří jeden až tři příbuzní dospělí samci spolu s až třiceti samicemi a mláďaty. English: The Czech Republic is a country in the Czech Republic. It is located in the Czech Republic.
"Ačkoliv má umělá inteligence silnou konotaci se science fiction, tvoří velmi důležitou oblast počítačové vědy zabývající se chováním, učením a inteligenční adaptací strojů.","Czech: Ačkoliv má umělá inteligence silnou konotaci se science fiction, tvoří velmi důležitou oblast počítačové vědy zabývající se chováním, učením a inteligenční adaptací strojů. English: The Czech Republic is a country in the European Union. It is a country in the European Union. It is a country in the European Union."
Poměr stran tohoto formátu (vyděleno dvanácti pro získání nejjednoduššího poměru v celých číslech) je tedy 3:2.,"Czech: Poměr stran tohoto formátu (vyděleno dvanácti pro získání nejjednoduššího poměru v celých číslech) je tedy 3:2. English: Poměr stran tohoto přestat (vyděleno dvanácti pro spojní nejbližšího), je tedy 3:2."
"Satelitní telefon není obecně náhradou za mobilní telefon, protože abyste mohli volat, musíte se nacházet venku bez překážek mezi vámi a satelitem.","Czech: Satelitní telefon není obecně náhradou za mobilní telefon, protože abyste mohli volat, musíte se nacházet venku bez překážek mezi vámi a satelitem. English: The phone is not working."
"Přestože se dostavníkové cesty většinou skládaly pouze z rovnoběžných prken, umožňovaly tažným koním dosáhnout větší rychlosti a uvézt těžší břemeno než na ostatních tehdejších cestách, které byly o něco hrubší.","Czech: Přestože se dostavníkové cesty většinou skládaly pouze z rovnoběžných prken, umožňovaly tažným koním dosáhnout větší rychlosti a uvézt těžší břemeno než na ostatních tehdejších cestách, které byly o něco hrubší. English: The Czech Republic is a country in the European Union."
"Lidé znají už od pradávna základní chemické prvky jako zlato, stříbro a měď, jelikož se tyto prvky nalézají v přírodě ve své ryzí formě a dají se relativně snadno těžit i za použití jednoduchých nástrojů.","Czech: Lidé znají už od pradávna základní chemické prvky jako zlato, stříbro a měď, jelikož se tyto prvky nalézají v přírodě ve své ryzí formě a dají se relativně snadno těžit i za použití jednoduchých nástrojů. English: Lidé znají už od pradávna, které jsou jsou jsou jsou jsou jsou jsou jsou jsou jsou jsou jsou jsou jsou jsou jsou jsou jsou jsou jsou jsou jsou jsou jsou jsou jsou jsou jsou jsou jsou jsou jsou jsou jsou jsou jsou jsou jsou jsou jsou jsou jsou jsou jsou jsou jsou jsou jsou jsou jsou jsou jsou jsou jsou jsou jsou jsou jsou jsou jsou jsou jsou jsou jsou jsou jsou jsou jsou jsou jsou jsou jsou jsou jsou jsou jsou jsou jsou jsou jsou jsou jsou jsou jsou jsou jsou jsou jsou jsou"
"Kolo změnilo svět nevídaným způsobem. To nejvýznamnější, co způsobilo, bylo podstatné usnadnění a zrychlení přepravy.","Czech: Kolo změnilo svět nevídaným způsobem. To nejvýznamnější, co způsobilo, bylo podstatné usnadnění a zrychlení přepravy. English: The Czech Republic is a country in the European Union."
"Je to pro ujištění, že obrázek zakrývá celou obrazovku. To se nazývá overscan.","Czech: Je to pro ujištění, že obrázek zakrývá celou obrazovku. To se nazývá overscan. English: To be careful, not to be foolish."
Německé ponorky se nazývaly U-Boot. Němci byli v navigaci a řízení svých ponorek velice zdatní.,Czech: Německé ponorky se nazývaly U-Boot. Němci byli v navigaci a řízení svých ponorek velice zdatní. English: The Czech Republic is a country in the Czech Republic. It is located in the Czech Republic. It is the second largest country in the world after the United States. It is the largest country in the world after the United States.
"Ačkoliv se fyzický stav může měnit, chemická podoba zůstává stejná.","Czech: Ačkoliv se fyzický stav může měnit, chemická podoba zůstává stejná. English: Alcoholism is a serious problem in the Czech Republic. Czech: Alcoholism is a serious problem in the Czech Republic."
"K povrchovému napětí dochází proto, že molekuly vody na vodní hladině jsou k sobě přitahovány silněji než k molekulám vzduchu nad sebou.","Czech: K povrchovému napětí dochází proto, že molekuly vody na vodní hladině jsou k sobě přitahovány silněji než k molekulám vzduchu nad sebou. English: The Czech Republic is a country in the European Union. It is located in the Czech Republic."
Jedním z nejčastějších problémů při pokusu konvertovat film do formátu DVD je takzvaný overscan.,Czech: Jedním z nejčastějších problémů při pokusu konvertovat film do formátu DVD je takzvaný overscan. English: The Czech Republic is a country in the Czech Republic. It is the largest country in the Czech Republic. It is the largest country in the Czech Republic. Czech Republic is a country in the Czech Republic. Czech Republic is a country in the Czech Republic. Czech Republic is a country in the Czech Republic. Czech Republic is a country in the Czech Republic. Czech Republic is a country in the Czech Republic. Czech Republic is a country in the Czech Republic. Czech Republic is a country in the Czech Republic
"Konkrétně můžete díky správné interpretaci mikrovýrazů zjistit, jestli vám druhý člověk lže.","Czech: Konkrétně můžete díky správné interpretaci mikrovýrazů zjistit, jestli vám druhý člověk lže. English: The Czech Republic is a country in the European Union. It is located in the Czech Republic. It is the second largest country in the European Union. It is the third largest country in the European Union. It is the fourth largest country in the European Union. It is the fifth largest country in the European Union. It is the sixth largest country in the European Union. It is the seventh largest country in the European Union. It is the eighth largest country in the European Union."
Zlato se dá zpracovat do všemožných tvarů. Je možné ho srolovat do miniaturních kousků.,Czech: Zlato se dá zpracovat do všemožných tvarů. Je možné ho srolovat do miniaturních kousků. English: Zlato se dá patyných časů. Je možné ho srolovat do miniaturních časů.
"Systém umělé inteligence je nyní často používán v oblastech ekonomiky, medicíny, strojírenství a vojenství a je vestavěn v řadě aplikací domácích počítačů a softwaru videoher.","Czech: Systém umělé inteligence je nyní často používán v oblastech ekonomiky, medicíny, strojírenství a vojenství a je vestavěn v řadě aplikací domácích počítačů a softwaru videoher. English: The Czech Republic is a country in the European Union. It is a member of the European Union. It is a member of the European Union. It is a member of the European Union."
"Vyrábějí se dodnes, ale důležitější je, že jejich poměr stran převzaly i formáty snímače digitálních fotoaparátů.","Czech: Vyrábějí se dodnes, ale důležitější je, že jejich poměr stran převzaly i formáty snímače digitálních fotoaparátů. English: Vyrábrábrábé se dodnes, ale výbornější je, že jejich הגוávání stran převzaly iřízeny výsledy."
"Často zneužívané a zesměšňované „pravidlo třetin“ je prostým vodítkem, které v obraze vytváří dynamiku při zachování určitého pořádku.","Czech: Často zneužívané a zesměšňované „pravidlo třetin“ je prostým vodítkem, které v obraze vytváří dynamiku při zachování určitého pořádku. English: The Czech Republic is a country in the European Union. It is located in the Czech Republic."
"Tato skutečnost nejen potvrzuje, že přinejmenším někteří dinosauři měli peří (tato teorie je již rozšířená), ale také poskytuje podrobnosti, které fosílie obecně nemohou poskytnout, například o barevném a trojrozměrném uspořádání.","Czech: Tato skutečnost nejen potvrzuje, že přinejmenším někteří dinosauři měli peří (tato teorie je již rozšířená), ale také poskytuje podrobnosti, které fosílie obecně nemohou poskytnout, například o barevném a trojrozměrném uspořádání. English: Tato Tato, Tato, Tato, Tato, Tato, Tato, Tato, Tato, Tato, Tato, Tato, Tato, Tato, Tato, Tato, Tato, Tato, Tato, Tato, Tato, Tato, Tato, Tato, Tato, Tato, Tato, Tato, Tato, Tato, Tato, Tato, Tato, Tato, Tato, Tato, Tato, Tato, Tato, Tato, Tato, Tato, Tato, Tato, Tato, Tato, Tato, Tato, Tato, Tato, Tato"
"Jak by mě přitahovala gravitace měsíce Io? Pokud byste stáli na povrchu Io, vážili byste méně než na Zemi.","Czech: Jak by mě přitahovala gravitace měsíce Io? Pokud byste stáli na povrchu Io, vážili byste méně než na Zemi. English: The Book of Mormon: A Study in the Book of Mormon, by Joseph Campbell."
"NextGen je systém, který by podle agentury FAA umožnil letadlům létat kratšími trasami a každý rok tak ušetřit miliony galonů paliva a snížit uhlíkové emise.","Czech: NextGen je systém, který by podle agentury FAA umožnil letadlům létat kratšími trasami a každý rok tak ušetřit miliony galonů paliva a snížit uhlíkové emise. English: The Czech Republic is a country in the European Union."
Neurobiologické údaje poskytují fyzickou evidenci teoretickému přístupu ke zkoumání kognice. Tuto výzkumnou oblast tak zužují a upřesňují.,"Czech: Neurobiologické údaje poskytují fyzickou evidenci teoretickému přístupu ke zkoumání kognice. Tuto výzkumnou oblast tak zužují a upřesňují. English: The Czech National Institute of Neuroscience, Prague, Czech Republic."
"Během své dvouhodinové řeči prohlásil, že „Apple dnes znovu vynalezne telefon, dnes se zapíšeme do historie“.","Czech: Během své dvouhodinové řeči prohlásil, že „Apple dnes znovu vynalezne telefon, dnes se zapíšeme do historie“. English: Apple is a computer program that allows you to create and share photos, videos, and other content."
"Nevýhodou objektivů s přiblížením je, že ohnisková složitost a počet prvků čoček potřebných k dosažení rozsahu ohniskových vzdáleností je mnohem větší než u fixních objektivů.","Czech: Nevýhodou objektivů s přiblížením je, že ohnisková složitost a počet prvků čoček potřebných k dosažení rozsahu ohniskových vzdáleností je mnohem větší než u fixních objektivů. English: The Czech Republic is a country in the European Union. It is located in the Czech Republic."
"Ovladač podobný televiznímu ovládání používá dva senzory umístěné poblíž uživatelovy televize, které triangulují jeho polohu v trojrozměrném prostoru.","Czech: Ovladač podobný televiznímu ovládání používá dva senzory umístěné poblíž uživatelovy televize, které triangulují jeho polohu v trojrozměrném prostoru. English: The Czech Republic is a country in the European Union. It is located in the Czech Republic. It is a country in the European Union. It is a country in the European Union."
"Vědci tvrdí, že peří tohoto zvířete bylo kaštanově hnědé svrchu s bledou nebo karotenově zbarvenou spodní stranou.","Czech: Vědci tvrdí, že peří tohoto zvířete bylo kaštanově hnědé svrchu s bledou nebo karotenově zbarvenou spodní stranou. English: The Czech Republic is a country in the European Union. It is located in the Czech Republic. It is the second largest country in the European Union. It is the third largest country in the European Union. It is the fourth largest country in the European Union. It is the fifth largest country in the European Union. It is the sixth largest country in the European Union. It is the seventh largest country in the European Union. It is the eighth largest country in the European Union."
"Výzkumníci z univerzity uvedli, že tyto dvě sloučeniny na sebe vzájemně reagují a formují krystaly, které mohou blokovat funkci ledvin.","Czech: Výzkumníci z univerzity uvedli, že tyto dvě sloučeniny na sebe vzájemně reagují a formují krystaly, které mohou blokovat funkci ledvin. English: The Czech Republic is a country in the European Union. It is located in the Czech Republic."
Ten poskytuje téměř čtyřikrát vyšší rozlišení než 35mm negativ (3136 mm2 oproti 864 mm2).,"Czech: Ten poskytuje téměř čtyřikrát vyšší rozlišení než 35mm negativ (3136 mm2 oproti 864 mm2). English: Ten ten příznaky, který říříříříříříříříříříříříříříříříříříříříříříříříříříříříříříříříříříříříříříříříříříříříříříříříříříříříříříříříříříříříříříříříříříříříříříříříříříříříříříříříříříříříříříříříříříříříří"
Díky spojení s Evropou podmořským optickým kabelem a širokopásmovému satelitnímu signálu je v Grónsku k dispozici dobré připojení a 93 % obyvatel má přístup k internetu.,Czech: Díky spojení s Evropou podmořským optickým kabelem a širokopásmovému satelitnímu signálu je v Grónsku k dispozici dobré připojení a 93 % obyvatel má přístup k internetu. English: The Czech Republic is a country in the European Union. It is a member of the European Union. It is a member of the European Union. It is a member of the European Union. It is a member of the European Union. It is a member of the European Union. It is a member of the European Union. It is a member of the European Union. It is a member of the European Union. It is a member of the European Union. It is a member of the European Union
"Jednou z nejvýznamnějších aplikací v této kategorii je Google Translate, která po stažení požadovaných jazykových dat umožňuje offline překlad.","Czech: Jednou z nejvýznamnějších aplikací v této kategorii je Google Translate, která po stažení požadovaných jazykových dat umožňuje offline překlad. English: The best way to find out what is happening in your area is to use the map."
"Má stejnou molekulární strukturu bez ohledu na to, zda je ve skupenství plynném, kapalném nebo pevném.","Czech: Má stejnou molekulární strukturu bez ohledu na to, zda je ve skupenství plynném, kapalném nebo pevném. English: The Czech Republic is a country in the European Union."
Používání videozáznamů vedlo k důležitým objevům při interpretaci mikrosdělení – pohybů obličeje trvajících pouhých několik mikrosekund.,Czech: Používání videozáznamů vedlo k důležitým objevům při interpretaci mikrosdělení – pohybů obličeje trvajících pouhých několik mikrosekund. English: The Czech Republic is a country in the European Union. It is located in the Czech Republic. It is a country in the European Union. It is a country in the European Union. It is a country in the European Union. It is a country in the European Union. It is a country in the European Union. It is a country in the European Union. It is a country in the European Union. It is a country in the European Union. It is a country in the European Union.
Lidé vyrábějí a používají zvětšovací čočky již po tisíce let.,Czech: Lidé vyrábějí a používají zvětšovací čočky již po tisíce let. English: Lidé Lidé Lidé Lidé Lidé Lidé Lidé Lidé Lidé Lidé Lidé Lidé Lidé Lidé Lidé Lidé Lidé Lidé Lidé Lidé Lidé Lidé Lidé Lidé Lidé Lidé Lidé Lidé Lidé Lidé Lidé Lidé Lidé Lidé Lidé Lidé Lidé Lidé Lidé Lidé Lidé Lidé Lidé Lidé Lidé Lidé Lidé Lidé Lidé Lidé
"Není to však samo o sobě experimentování. Experiment je test, který se používá k popření jedné nebo více možných hypotéz, ale pro vědecký výzkum je důležité také kladení otázek a pozorování.","Czech: Není to však samo o sobě experimentování. Experiment je test, který se používá k popření jedné nebo více možných hypotéz, ale pro vědecký výzkum je důležité také kladení otázek a pozorování. English: I'm not sure what you mean by ""I'm not sure what you mean by ""I'm not sure what you mean by ""I'm not sure what you mean by ""I'm not sure what you mean by ""I'm not sure what you mean by ""I'm not sure what you mean by ""I'm not sure what you mean by ""I'm not sure what you mean by ""I'm not sure what you mean by """
Nakonec byla dřevěná kola nahrazena železnými. V roce 1767 byly představeny první celoželezné kolejnice.,Czech: Nakonec byla dřevěná kola nahrazena železnými. V roce 1767 byly představeny první celoželezné kolejnice. English: The Czech Republic is a country in the European Union. It is located in the Czech Republic. It is a country in the European Union. It is a country in the European Union.
"Zatímco většina karet je vhodná pro volání na celém světě, některé se specializují na poskytování příznivých sazeb za volání do konkrétních skupin zemí.","Czech: Zatímco většina karet je vhodná pro volání na celém světě, některé se specializují na poskytování příznivých sazeb za volání do konkrétních skupin zemí. English: The Czech Republic is a country in the European Union. It is a member of the European Union. It is a member of the European Union."
Většina moderních výzkumných teleskopů jsou obrovská zařízení v odlehlých oblastech s příznivými atmosférickými podmínkami.,Czech: Většina moderních výzkumných teleskopů jsou obrovská zařízení v odlehlých oblastech s příznivými atmosférickými podmínkami. English: The Czech Republic is a country in the European Union. The Czech Republic is a country in the European Union. The Czech Republic is a country in the European Union.
Ocelová jehla se udrží na vodní hladině díky povrchovému napětí.,Czech: Ocelová jehla se udrží na vodní hladině díky povrchovému napětí. English: Ocelová jehla se urzeka na vlastní prostředí.
"Ačkoliv je to poněkud matoucí, formát 35mm má ve skutečnosti šířku 36mm a výšku 24mm.","Czech: Ačkoliv je to poněkud matoucí, formát 35mm má ve skutečnosti šířku 36mm a výšku 24mm. English: Ačkoliv je to poněkud matoucí, корпус 35мм má veכיוון šířku 36mm a szobáu 24mm."
"Buňky hrají při studii života tak základní a zásadní roli, že se o nich často hovoří jako o „stavebních kamenech života“.","Czech: Buňky hrají při studii života tak základní a zásadní roli, že se o nich často hovoří jako o „stavebních kamenech života“. English: The Czech Republic is a country in the European Union."
"Osobní VPN (virtuální privátní síť) poskytuje excelentní způsob, jak obejít politickou cenzuru i komerční IP geofiltrování.","Czech: Osobní VPN (virtuální privátní síť) poskytuje excelentní způsob, jak obejít politickou cenzuru i komerční IP geofiltrování. English: The Czech Republic is a country in the European Union. It is a member of the European Union. It is a member of the European Union. It is a member of the European Union. It is a member of the European Union. It is a member of the European Union. It is a member of the European Union. It is a member of the European Union. It is a member of the European Union. It is a member of the European Union. It is a member of the European Union"
Stanice udržovala svou polohu až do konce výstupu do volného kosmického prostoru navzdory dřívější ztrátě gyroskopu během mise vesmírné stanice.,Czech: Stanice udržovala svou polohu až do konce výstupu do volného kosmického prostoru navzdory dřívější ztrátě gyroskopu během mise vesmírné stanice. English: The Czech Republic is a country in the European Union. It is a member of the European Union. It is a member of the European Union.
"Lidé s tímto typem přemýšlení mají logické smýšlení, jsou schopni zapamatovat si vzorce, řešit problémy a pracovat na vědeckých testech.","Czech: Lidé s tímto typem přemýšlení mají logické smýšlení, jsou schopni zapamatovat si vzorce, řešit problémy a pracovat na vědeckých testech. English: Lidé s věku typem přečteno, který chůzi a věku a věku. Czech: Lidé s věku typem přečteno, který chůzi a věku a věku. English: Lidé s věku typem přečteno, který chůzi a věku a věku. Czech: Lidé s věku typem přečteno, který chůzi a věku a věku. English: Lidé s"
"Oceloti rádi jedí malá zvířata. Pokud mají možnost, chytají opice, hady, hlodavce a ptáky. Skoro všechna zvířata, která ocelot loví, jsou mnohem menší než on sám.","Czech: Oceloti rádi jedí malá zvířata. Pokud mají možnost, chytají opice, hady, hlodavce a ptáky. Skoro všechna zvířata, která ocelot loví, jsou mnohem menší než on sám. English: Oceloti rádi jedí malá zvířata. Pokud mají, chytají opice, hady, hlodavce a ptáky. Skoro všechna zvířata, která ocelot loví, jsou přest přestat sledovat."
"Některé fotoaparáty z kategorie středního formátu využívají formát 6 × 6 cm, přesněji negativ o rozměrech 56 × 56 mm.","Czech: Některé fotoaparáty z kategorie středního formátu využívají formát 6 × 6 cm, přesněji negativ o rozměrech 56 × 56 mm. English: The Czech National Museum of Art, Prague, Czech Republic."
"Cestovatelům se důrazně doporučuje mít přehled o všech možných rizicích nepříznivého počasí v jejich oblasti, protože to může ovlivnit veškeré cestovní plány.","Czech: Cestovatelům se důrazně doporučuje mít přehled o všech možných rizicích nepříznivého počasí v jejich oblasti, protože to může ovlivnit veškeré cestovní plány. English: The Czech Republic is a country in the European Union. It is located in the Czech Republic. It is a country in the European Union. It is located in the Czech Republic. It is a country in the European Union. It is located in the Czech Republic. It is a country in the European Union. It is located in the Czech Republic. It is a country in the European Union. It is located in the Czech Republic. It is a country in the European Union. It is located in"
"Autobusy odjíždějí z meziměstského autobusového nádraží (přes řeku) po celý den, ale většina z nich, zejména ty, které míří na východ a Jakar/Bumthang, odjíždí mezi 6:30 a 7:30.","Czech: Autobusy odjíždějí z meziměstského autobusového nádraží (přes řeku) po celý den, ale většina z nich, zejména ty, které míří na východ a Jakar/Bumthang, odjíždí mezi 6:30 a 7:30. English: Busy odjíždecké z meziměstského autobusového nádraží (přes řeku) po celý den, alerašanās ty, které míří na východ a Jakar/Bumthang, odjíždí mezi 6:30 a 7:30."
