text,translated_text
"Born med ADD finn det vanskeleg å konsentrere seg om ting som skulearbeid, men dei kan konsentrere seg om ting det likar å gjere som å spele spel, eller sjå på sine favoritt-teikneseriar, eller skrive setningar utan punktum.","Nynorsk: Born med ADD finn det vanskeleg å konsentrere seg om ting som skulearbeid, men dei kan konsentrere seg om ting det likar å gjere som å spele spel, eller sjå på sine favoritt-teikneseriar, eller skrive setningar utan punktum. English: Born in the Netherlands, born in the Netherlands, born in the Netherlands, born in the Netherlands, born in the Netherlands, born in the Netherlands, born in the Netherlands, born in the Netherlands, born in the Netherlands, born in the Netherlands, born in the Netherlands, born in the Netherlands, born in the Netherlands, born in the Netherlands, born in the Netherlands, born in the Netherlands, born in the Netherlands, born in the Netherlands, born in the Netherlands, born in the Netherlands,"
I løpet av eit år kan ein smitta person smitte 10 til 15 nære personar.,"Nynorsk: I løpet av eit år kan ein smitta person smitte 10 til 15 nære personar. English: I'm a girl, I'm a girl, I'm a girl, I'm a girl, I'm a girl, I'm a girl, I'm a girl, I'm a girl, I'm a girl, I'm a girl, I'm a girl, I'm a girl, I'm a girl, I'm a girl, I'm a girl, I'm a girl, I'm a"
"Når valden opphøyrde etter at dei skadde vart frakta til sjukehuset, stod omkring 40 gjenverande fangar i fengselsgarden og nekta å returnere til cellene sine.","Nynorsk: Når valden opphøyrde etter at dei skadde vart frakta til sjukehuset, stod omkring 40 gjenverande fangar i fengselsgarden og nekta å returnere til cellene sine. English: The Norwegian Academy of Sciences is a non-profit organization that promotes the scientific and technological development of the Norwegian language and culture."
"Doktorar byrja å verte rekrutterte av keisaren Augustus, og forma til og med det første romerske medisinkorpset for bruk i tida etter slaga.","Nynorsk: Doktorar byrja å verte rekrutterte av keisaren Augustus, og forma til og med det første romerske medisinkorpset for bruk i tida etter slaga. English: The University of Edinburgh, Edinburgh, United Kingdom."
Sjåføren i bilen fekk likevel alvorlege hovudskader.,Nynorsk: Sjåføren i bilen fekk likevel alvorlege hovudskader. English: The Norwegian Bokmål: The Norwegian Bokmål is a language spoken in Norway. It is the official language of Norway.
"“Vi har 4 månadar gamle mus som no er ikkje-diabetikarar, som tidlegare var diabetikarar” la han til.","Nynorsk: “Vi har 4 månadar gamle mus som no er ikkje-diabetikarar, som tidlegare var diabetikarar” la han til. English: “Vi har 4 månadar gamle mus som no er meget-diabetikarar, som tidlegare var diabetikarar”"
Indre forgifting er ikkje alltid lett å oppdage. Symptoma (for eksempel oppkast) kan vere såpass diffuse at det ikkje er mogleg å gi ein diagnose med ein gong.,Nynorsk: Indre forgifting er ikkje alltid lett å oppdage. Symptoma (for eksempel oppkast) kan vere såpass diffuse at det ikkje er mogleg å gi ein diagnose med ein gong. English: The New York Times.
"Som eit resultat røyka artistane cannabis joints på scena, og teateret oppfordra publikumet til å delta.","Nynorsk: Som eit resultat røyka artistane cannabis joints på scena, og teateret oppfordra publikumet til å delta. English: The makers of the cannabis joints are the same as the producers of the cannabis joints. The cannabis joints are made from cannabis seeds, which are then ground into a powder. The cannabis joints are sold in a variety of forms, including edibles, tinctures, and tinctures."
Aerosmith har avlyst dei gjenverande konsertane av turneen deira.,"Nynorsk: Aerosmith har avlyst dei gjenverande konsertane av turneen deira. English: Aerosmith, Aerosmith, Aerosmith, Aerosmith, Aerosmith, Aerosmith, Aerosmith, Aerosmith, Aerosmith, Aerosmith, Aerosmith, Aerosmith, Aerosmith, Aerosmith, Aerosmith, Aerosmith, Aerosmith, Aerosmith, Aerosmith, Aerosmith, Aerosmith, Aerosmith, Aerosmith, Aerosmith, Aerosmith, Aerosmith, Aerosmith, Aerosmith, Aerosmith, Aerosmith, Aerosmith, Aerosmith, Aerosmith, Aero"
"Viss du vil vere nær det som skjer, må du komme tidleg for å få teltplass i nærleiken av musikken.","Nynorsk: Viss du vil vere nær det som skjer, må du komme tidleg for å få teltplass i nærleiken av musikken. English: The Norwegian Folk Song: The Norwegian Folk Song is a folk song written by Norwegian folk singer and songwriter, Einar Bjørndalen. It is the first Norwegian folk song written in English. The song is a folk song written by Norwegian folk singer and songwriter, Einar Bjørndalen. It is the first Norwegian folk song written in English."
Mange ulike filmformat er blitt brukte opp gjennom åra. Standard 35 mm film (36 x 24 mm negativ) er nok det vanlegaste.,Nynorsk: Mange ulike filmformat er blitt brukte opp gjennom åra. Standard 35 mm film (36 x 24 mm negativ) er nok det vanlegaste. English: Standard 35 mm film (36 x 24 mm negativ) er nok det vanlegaste. Standard 35 mm film (36 x 24 mm negativ) er nok det vanlegaste. Standard 35 mm film (36 x 24 mm negativ) er nok det vanlegaste. Standard 35 mm film (36 x 24 mm negativ) er nok det vanlegaste. Standard 35 mm film (36 x 24 mm negativ) er nok det vanlegaste. Standard 35 mm film (36 x 24 mm negativ) er nok det vanlega
"Sjølv om dette er svært vanleg praksis, er det forbode av Disney, ettersom dei ikkje tillèt overføring av billettar.","Nynorsk: Sjølv om dette er svært vanleg praksis, er det forbode av Disney, ettersom dei ikkje tillèt overføring av billettar. English: The best way to get to the airport is by taxi."
"Kvar episode i programmet tok føre seg temaet i ei bestemt bok, og deretter gjekk ein nærmare inn på dette temaet i fleire andre historier.","Nynorsk: Kvar episode i programmet tok føre seg temaet i ei bestemt bok, og deretter gjekk ein nærmare inn på dette temaet i fleire andre historier. English: The Norwegian version of the song is called ""The Last Song"" and is the first song written by the Norwegian singer-songwriter, songwriter and composer, Nils Lofgren. The song was written in Norwegian and was released in Norway in the year of."
Fleire store fjernsynsskjermar var installert på ulike punkt i Roma for at folk skulle kunne sjå seremonien.,Nynorsk: Fleire store fjernsynsskjermar var installert på ulike punkt i Roma for at folk skulle kunne sjå seremonien. English: The best online casino games for real money. The best online casino games for real money. The best online casino games for real money. The best online casino games for real money. The best online casino games for real money. The best online casino games for real money.
"Sofokles og Aristofanes er framleis populære dramatikarar, og stykka deira vert sett på som nokon av dei største verka av verdslitteraturen.","Nynorsk: Sofokles og Aristofanes er framleis populære dramatikarar, og stykka deira vert sett på som nokon av dei største verka av verdslitteraturen. English: The New York Times, The New Yorker, The New Yorker, The New Yorker, The New Yorker, The New Yorker, The New Yorker, The New Yorker, The New Yorker, The New Yorker, The New Yorker, The New Yorker, The New Yorker, The New Yorker, The New Yorker, The New Yorker, The New Yorker, The New Yorker, The New Yorker, The New Yorker,"
I kvart program blei barna dessutan tipsa om ulike bøker dei kunne sjå etter når dei skulle på biblioteket.,Nynorsk: I kvart program blei barna dessutan tipsa om ulike bøker dei kunne sjå etter når dei skulle på biblioteket. English: I am a student at the University of Oslo. I am a student at the University of Oslo. I am a student at the University of Oslo. I am a student at the University of Oslo. I am a student at the University of Oslo. I am a student at the University of Oslo. I am a student at the University of Oslo. I am a student at the University of Oslo. I am a student at the University of Oslo. I am a student at the University of Oslo.
For å få ekstra volum på eit trekkspel nyttar du belgane med meir kraft eller fart.,Nynorsk: For å få ekstra volum på eit trekkspel nyttar du belgane med meir kraft eller fart. English: For å få ekstra volum på eit trekkspel nyttar du belgane med meir kraft eller fart.
"Du kan sjå pyramidane i mørket, og du kan sjå dei i stilla før showet startar.","Nynorsk: Du kan sjå pyramidane i mørket, og du kan sjå dei i stilla før showet startar. English: I'm not a big fan of the word ""snowflake"" but I'm not a big fan of the word ""snowflake"" either."
"Eksempel på aktivitetar er jakt, fiske, fotografering, fuglekikking samt å besøke parkar og studere informasjon om økosystemet.","Nynorsk: Eksempel på aktivitetar er jakt, fiske, fotografering, fuglekikking samt å besøke parkar og studere informasjon om økosystemet. English: The Norwegian Language."
Sfinksen dannar eit bakteppe og står som forteljaren av ei lang historie.,Nynorsk: Sfinksen dannar eit bakteppe og står som forteljaren av ei lang historie. English: The owl is a bird of prey.
"Det er ofte spesialprisar på mat, drikke og underhaldning for at gjestene skal halde humøret oppe og bli verande.","Nynorsk: Det er ofte spesialprisar på mat, drikke og underhaldning for at gjestene skal halde humøret oppe og bli verande. English: The best way to find out about the best places to stay in Oslo is to check out the Oslo Hotels and Hostels."
"Den globale organisasjonen, som allereie rapporterer på engelsk og japansk, lanserer spansk, italiensk og koreansk språkprogram, for fjernsyn, internett og mobileiningar.","Nynorsk: Den globale organisasjonen, som allereie rapporterer på engelsk og japansk, lanserer spansk, italiensk og koreansk språkprogram, for fjernsyn, internett og mobileiningar. English: The International Association of Norwegians (IAN) is a non-profit organization that promotes the Norwegian language and culture."
Før The Simpsons hadde Simon tidlegare jobba med fleire ulike program i ei variasjon av stillingar.,Nynorsk: Før The Simpsons hadde Simon tidlegare jobba med fleire ulike program i ei variasjon av stillingar. English: The Simpsons: The Simpsons: The Simpsons: The Simpsons: The Simpsons: The Simpsons: The Simpsons: The Simpsons: The Simpsons: The Simpsons: The Simpsons: The Simpsons: The Simpsons: The Simpsons: The Simpsons: The Simpsons: The Simpsons: The Simpsons: The Simpsons: The Simpsons: The Simpsons: The Simpsons: The Simpsons: The Simpsons: The Simpsons:
Dette vil gjere det mogleg for spelarar å kontrolle handlingar og rørsle i videospelet ved å røyre seg gjennom lufta.,Nynorsk: Dette vil gjere det mogleg for spelarar å kontrolle handlingar og rørsle i videospelet ved å røyre seg gjennom lufta. English: The Norwegian Airline has been the leading airline in Norway since the beginning of the 20th century. The Norwegian Airline is the largest airline in Norway. The Norwegian Airline is the largest airline in Norway. The Norwegian Airline is the largest airline in Norway.
Minst 100 personar hadde delteke på festen som feira det første jubileet til paret som hadde hatt bryllaupet sitt i fjor.,Nynorsk: Minst 100 personar hadde delteke på festen som feira det første jubileet til paret som hadde hatt bryllaupet sitt i fjor. English: The Norwegian Cruise Line is a Norwegian cruise line owned by Norwegian Cruise Line. Norwegian Cruise Line is a Norwegian cruise line owned by Norwegian Cruise Line. Norwegian Cruise Line is a Norwegian cruise line owned by Norwegian Cruise Line. Norwegian Cruise Line is a Norwegian cruise line owned by Norwegian Cruise Line. Norwegian Cruise Line is a Norwegian cruise line owned by Norwegian Cruise Line. Norwegian Cruise Line is a Norwegian cruise line owned by Norwegian Cruise Line. Norwegian Cruise Line is a Norwegian cruise line owned by Norwegian Cruise Line. Norwegian
"To songar frå filmen, Audition (The Fools Who Dream) og City of Stars, mottok nominasjonar for beste originalsong. Lionsgate studio mottok 26 nominasjonar — meir enn noko anna studio.","Nynorsk: To songar frå filmen, Audition (The Fools Who Dream) og City of Stars, mottok nominasjonar for beste originalsong. Lionsgate studio mottok 26 nominasjonar — meir enn noko anna studio. English: To songar frå filmen, Audition (The Fools Who Dream) og City of Stars, mottok nominasjonar for beste originalsong. Lionsgate studio mottok 26 nominasjonar — meir enn noko anna studio."
Skorpa er omtrent 70 km tjukk på den nærmaste sida og 100 km tjukk på den fjernaste sida.,Nynorsk: Skorpa er omtrent 70 km tjukk på den nærmaste sida og 100 km tjukk på den fjernaste sida. English: The Norwegian Airline has been awarded the Norwegian Airline of the Year award for the second year in a row. The Norwegian Airline has been awarded the Norwegian Airline of the Year award for the second year in a row.
"Lenger sør ligg Niagara Falls, og den nordlege delen husar blant anna det uutnytta og naturskjønne Muskoka.","Nynorsk: Lenger sør ligg Niagara Falls, og den nordlege delen husar blant anna det uutnytta og naturskjønne Muskoka. English: The Niagara Falls are a major tourist attraction in the United States. The Niagara Falls are located in the Niagara Region of Canada. The Niagara Falls are a major tourist attraction in the United States. The Niagara Falls are located in the Niagara Region of Canada. The Niagara Falls are a major tourist attraction in the United States."
Ellsworth Land er området sør for halvøya og grensar til Bellingshausenhavet.,"Nynorsk: Ellsworth Land er området sør for halvøya og grensar til Bellingshausenhavet. English: The Bellingshausen, a town in the North Sea, is a town in the North Sea, in the Baltic Sea, in the Baltic Sea, in the Baltic Sea, in the Baltic Sea, in the Baltic Sea, in the Baltic Sea, in the Baltic Sea, in the Baltic Sea, in the Baltic Sea, in the Baltic Sea, in the Baltic Sea, in the Baltic Sea, in the Baltic Sea, in the Baltic Sea, in the Baltic Sea, in the Baltic Sea,"
Sørpoltraversen (eller South Pole Highway) er ei 1600 km lang rute frå McMurdo Station i Rosshavet til Sørpolen.,Nynorsk: Sørpoltraversen (eller South Pole Highway) er ei 1600 km lang rute frå McMurdo Station i Rosshavet til Sørpolen. English: Sørpoltraversen (der South Pole Highway) er nicht 1600 km lang rute frå McMurdo Station i Rosshavet til Sørpolen.
"Dette bratte fjellet tårnar over den nordlege delen av Machu Picchu, og det er ofte å sjå i bakgrunnen på mange bilete av ruinane.","Nynorsk: Dette bratte fjellet tårnar over den nordlege delen av Machu Picchu, og det er ofte å sjå i bakgrunnen på mange bilete av ruinane. English: The Machu Picchu ruins are a UNESCO World Heritage Site. The ruins are located in the northwest corner of Machu Picchu, in the area of the Machu Picchu ruins. The ruins are located in the northwest corner of Machu Picchu, in the area of the Machu Picchu ruins."
Enceladus er det mest refleksive objektet i solsystemet og reflekterer omkring 90 prosent av solskinet som treff det.,Nynorsk: Enceladus er det mest refleksive objektet i solsystemet og reflekterer omkring 90 prosent av solskinet som treff det. English: The New York Times. The New York Times. The New York Times. The New York Times. The New York Times. The New York Times. The New York Times. The New York Times. The New York Times. The New York Times. The New York Times. The New York Times. The New York Times. The New York Times. The New York Times. The New York Times. The New York Times. The New York Times. The New York Times. The New York Times.
"Det kan ikkje sjåast noko anna enn klår, nydeleg sky over, og dei mange fjella omkring. Svært lite av denne verda kan sjåast eller høyrast frå innsida av gruva.","Nynorsk: Det kan ikkje sjåast noko anna enn klår, nydeleg sky over, og dei mange fjella omkring. Svært lite av denne verda kan sjåast eller høyrast frå innsida av gruva. English: I'm not sure what to do. I'm not sure what to do. I'm not sure what to do. I'm not sure what to do. I'm not sure what to do. I'm not sure what to do. I'm not sure what to do. I'm not sure what to do. I'm not sure what to do. I'm not sure what to do. I'm not sure what to do. I"
"No til Japan. Japan var eit øyland, akkurat som Storbritannia.","Nynorsk: No til Japan. Japan var eit øyland, akkurat som Storbritannia. English: No til Japan."
"På sitt høgste nådde den tropiske syklonen Gonu, namngjeven frå ein sekk med palmeblad i språket på Maldivene, ein vind på 240 kilometer i timen (149 mil i timen).","Nynorsk: På sitt høgste nådde den tropiske syklonen Gonu, namngjeven frå ein sekk med palmeblad i språket på Maldivene, ein vind på 240 kilometer i timen (149 mil i timen). English: The Norwegian Meteorological Service (NMS) is the official meteorological agency of the Norwegian Meteorological Service (NMS)."
"Tyrkias territorium, inkludert innsjøar, dekkjer 783 562 kvadratkilometer, med 755 688 kvadratkilometer i Sørvest-Asia og 23 764 kvadratkilometer i Europa.","Nynorsk: Tyrkias territorium, inkludert innsjøar, dekkjer 783 562 kvadratkilometer, med 755 688 kvadratkilometer i Sørvest-Asia og 23 764 kvadratkilometer i Europa. English: Tyrkias territorium, også det det, det det, det, det, det, det, det, det, det, det, det, det, det, det, det, det, det, det, det, det, det, det, det, det, det, det, det, det, det, det, det, det, det, det, det, det, det, det, det, det, det, det, det, det, det, det"
"Sør-Shetlandsøyane, som blei oppdaga i 1819, blir gjort krav på av fleire nasjonar. Dei har flest stasjonar, der seksten av dei var aktive i 2020.","Nynorsk: Sør-Shetlandsøyane, som blei oppdaga i 1819, blir gjort krav på av fleire nasjonar. Dei har flest stasjonar, der seksten av dei var aktive i 2020. English: The Norwegian National Museum of Natural History is located in the Norwegian capital Oslo. The museum is open to the public. The museum is located in the Norwegian capital Oslo. The museum is open to the public. The museum is located in the Norwegian capital Oslo. The museum is located in the Norwegian capital Oslo. The museum is located in the Norwegian capital Oslo. The museum is located in the Norwegian capital Oslo. The museum is located in the Norwegian capital Oslo. The museum is located in the Norwegian capital Oslo"
Apia er hovudstaden i Samoa. Byen ligg på øya Upolu og har ein populasjon på rett under 40 000.,Nynorsk: Apia er hovudstaden i Samoa. Byen ligg på øya Upolu og har ein populasjon på rett under 40 000. English: Apia er hovudstaden i Samoa. Byen ligg på øya Upolu og har ein populasjon på rett under 40 000.
"Sidan stormen er langt frå landområde, er det vanskeleg å avgjere potensiale for at den vil kome til påverke USA eller Karibien.","Nynorsk: Sidan stormen er langt frå landområde, er det vanskeleg å avgjere potensiale for at den vil kome til påverke USA eller Karibien. English: The United States is a country in the United States. The United States is a country in the United States. The United States is a country in the United States. The United States is a country in the United States."
Ho er tynnare under marene (dei mørke områda) og tjukkare under dei lyse områda.,"Nynorsk: Ho er tynnare under marene (dei mørke områda) og tjukkare under dei lyse områda. English: The Norwegian word for ""snow"" is ""snow""."
Skogane er ikkje berre mangrovesumpar. Dei omfattar nokre av dei siste gjenverande bestandane av dei enorme junglane som ein gong dekte Gangessletta.,"Nynorsk: Skogane er ikkje berre mangrovesumpar. Dei omfattar nokre av dei siste gjenverande bestandane av dei enorme junglane som ein gong dekte Gangessletta. English: The Gangessletta is a small island in the Ganges River, in the Indian Ocean. The Gangessletta is a small island in the Ganges River, in the Indian Ocean. The Gangessletta is a small island in the Ganges River, in the Indian Ocean. The Gangessletta is a small island in the Ganges River, in the Indian Ocean."
"Det internasjonale jordskjelvkartet frå USGS, det amerikanske jordskjelvinstituttet, viste at det ikkje var jordskjelv på Island veka før.","Nynorsk: Det internasjonale jordskjelvkartet frå USGS, det amerikanske jordskjelvinstituttet, viste at det ikkje var jordskjelv på Island veka før. English: The National Oceanic and Atmospheric Administration (NOAA) is the agency responsible for the management of the oceans and the environment."
"Gruva sit på toppen av fjella nord for mekka, og er fullstendig isolert frå resten av verda.","Nynorsk: Gruva sit på toppen av fjella nord for mekka, og er fullstendig isolert frå resten av verda. English: The best way to get to the top of the mountain is to take a ride on a horse."
