text,translated_text
"Du kan for eksempel besøke slott i Loire-dalen eller Rhindalen, du kan ta eit cruise til interessante stader ved Donau eller ein båttur langs Eriekanalen.","Nynorsk: Du kan for eksempel besøke slott i Loire-dalen eller Rhindalen, du kan ta eit cruise til interessante stader ved Donau eller ein båttur langs Eriekanalen. English: The Rivers of the Loire, the Loire River, the Loire Valley, the Loire Valley, the Loire Valley, the Loire Valley, the Loire Valley, the Loire Valley, the Loire Valley, the Loire Valley, the Loire Valley, the Loire Valley, the Loire Valley, the Loire Valley, the Loire Valley, the Loire Valley, the Loire Valley, the Loire Valley, the Loire Valley, the Loire Valley, the Loire Valley, the Loire Valley, the Loire Valley, the Loire Valley, the"
Det kan vere betre å bruke eit reisebyrå som ofte bestiller turar som liknar på den du har tenkt deg på.,Nynorsk: Det kan vere betre å bruke eit reisebyrå som ofte bestiller turar som liknar på den du har tenkt deg på. English: The best way to find out about the best way to find out about the best way to find out about the best way to find out about the best way to find out about the best way to find out about the best way to find out about the best way to find out about the best way to find out about the best way to find out about the best way to find out about the best way to find out about the best way to find out about the best way to find out about the best
"Couchsurfing blei grunnlagt i januar 2004 etter at programmeraren Casey Fenton fann ein billig flytur til Island, men ikkje hadde nokon stad å bu.","Nynorsk: Couchsurfing blei grunnlagt i januar 2004 etter at programmeraren Casey Fenton fann ein billig flytur til Island, men ikkje hadde nokon stad å bu. English: The best way to find out about the latest news and information about the Island of Malta."
Det gjeld vanlegvis andre krav og søknadsprosedyrar for studentvisum enn for vanlege turist- eller forretningsvisum.,"Nynorsk: Det gjeld vanlegvis andre krav og søknadsprosedyrar for studentvisum enn for vanlege turist- eller forretningsvisum. English: The Norwegian Embassy in Oslo is a Norwegian embassy in Oslo, Norway. It is located in the city centre of Oslo, Norway."
Kvart land har òg eigne reglar når det gjeld kva slags førstehjelpsutstyr du må ha med deg i bilen.,Nynorsk: Kvart land har òg eigne reglar når det gjeld kva slags førstehjelpsutstyr du må ha med deg i bilen. English: The Norwegian language is a language of the Norwegian people. The Norwegian language is a language of the Norwegian people. The Norwegian language is a language of the Norwegian people.
"Sjølv om dei fleste byråa vil ta på seg dei fleste vanlege bestillingane, er det mange av dei som spesialiserer seg på bestemde typar reiser, prisklassar eller destinasjonar.","Nynorsk: Sjølv om dei fleste byråa vil ta på seg dei fleste vanlege bestillingane, er det mange av dei som spesialiserer seg på bestemde typar reiser, prisklassar eller destinasjonar. English: The New York Times, The New York Times, The New York Times, The New York Times, The New York Times, The New York Times, The New York Times, The New York Times, The New York Times, The New York Times, The New York Times, The New York Times, The New York Times, The New York Times, The New York Times, The New York Times, The New York Times, The New York Times, The New York Times, The New York Times,"
Reisande kan møte skadedyr dei ikkje er kjende med heimefrå.,"Nynorsk: Reisande kan møte skadedyr dei ikkje er kjende med heimefrå. English: The Norwegian Cruise Line is a Norwegian cruise line, a Norwegian airline, and a Norwegian airline."
"I nord kan du besøke den store heilagdommen Vår Frue av Fatima (heilag stad), der Maria openberra seg fleire gonger, historier som er kjende over heile verda.","Nynorsk: I nord kan du besøke den store heilagdommen Vår Frue av Fatima (heilag stad), der Maria openberra seg fleire gonger, historier som er kjende over heile verda. English: The New York Times, the New York Times, the New York Times, the New York Times, the New York Times, the New York Times, the New York Times, the New York Times, the New York Times, the New York Times, the New York Times, the New York Times, the New York Times, the New York Times, the New York Times, the New York Times, the New York Times, the New York Times, the New York Times, the New York Times,"
Du kan bruke boda-boda (motorsykkeldrosje) for å kome deg rundt i Goma. Vanleg (lokal) pris er ~500 kongolesiske franc for ein kort tur.,Nynorsk: Du kan bruke boda-boda (motorsykkeldrosje) for å kome deg rundt i Goma. Vanleg (lokal) pris er ~500 kongolesiske franc for ein kort tur. English: The Norwegian government has been trying to stop the Norwegians from buying the land in the area.
"Dei som likar utandørsaktivitetar, bør få med seg ein tur langs Sea to Sky Corridor.","Nynorsk: Dei som likar utandørsaktivitetar, bør få med seg ein tur langs Sea to Sky Corridor. English: The Sea to Sky Corridor is a railway line that connects the coastal cities of the Norwegian Sea to the mainland. It is the only railway line in the world that connects the coastal cities of the Norwegian Sea to the mainland. It is the only railway line in the world that connects the coastal cities of the Norwegian Sea to the mainland."
"Ein vandresafari (òg kalla ein «bush walk», «hiking safari» eller «footing») omfattar fotturar som kan vare i nokre timar eller i fleire dagar.","Nynorsk: Ein vandresafari (òg kalla ein «bush walk», «hiking safari» eller «footing») omfattar fotturar som kan vare i nokre timar eller i fleire dagar. English: A walk in the woods (a walk in the woods) is a walking tour of the woods."
"Det einaste som fungerte for å få dei gjennom raskare, var å sende dei som innsjekka bagasje. Flyselskapet sitt regelverk tillèt ikkje å sende bagasje utan ein passasjer, og det er der du kjem inn.","Nynorsk: Det einaste som fungerte for å få dei gjennom raskare, var å sende dei som innsjekka bagasje. Flyselskapet sitt regelverk tillèt ikkje å sende bagasje utan ein passasjer, og det er der du kjem inn. English: The Norwegian Airline is a private airline operating from Oslo, Norway. Norwegian Airline is a private airline operating from Oslo, Norway. Norwegian Airline is a private airline operating from Oslo, Norway. Norwegian Airline is a private airline operating from Oslo, Norway. Norwegian Airline is a private airline operating from Oslo, Norway. Norwegian Airline is a private airline operating from Oslo, Norway. Norwegian Airline is a private airline operating from Oslo, Norway. Norwegian"
Eit tillegg av 300 bringar totalen til 1300 vogner for å unngå for store folkemassar.,Nynorsk: Eit tillegg av 300 bringar totalen til 1300 vogner for å unngå for store folkemassar. English: The french language is a language of the world.
"Familiar med små barn må kanskje ordne litt meir på førehand, men ein dag utandørs skal gå greitt å få til, sjølv med spedbarn og førskolebarn.","Nynorsk: Familiar med små barn må kanskje ordne litt meir på førehand, men ein dag utandørs skal gå greitt å få til, sjølv med spedbarn og førskolebarn. English: The Norwegian language is a very popular language in Norway. The Norwegian language is a very popular language in Norway. The Norwegian language is a very popular language in Norway. The Norwegian language is a very popular language in Norway. The Norwegian language is a very popular language in Norway. The Norwegian language is a very popular language in Norway. The Norwegian language is a very popular language in Norway. The Norwegian language is a very popular language in Norway. The Norwegian language is a very popular language in Norway. The"
"Alle som skal køyre på høgare breiddegrader eller over fjellovergangar, må vite at ein kan møte på snø, is eller kuldegrader.","Nynorsk: Alle som skal køyre på høgare breiddegrader eller over fjellovergangar, må vite at ein kan møte på snø, is eller kuldegrader. English: The Norwegian language is a language of the Nordic countries. It is a language of the Nordic countries. It is a language of the Nordic countries. It is a language of the Nordic countries. It is a language of the Nordic countries. It is a language of the Nordic countries. It is a language of the Nordic countries. It is a language of the Nordic countries. It is a language of the Nordic countries. It is a language of the Nordic countries. It is a language of the Nordic countries"
"I dag er Timbuktu ein by med mykje fattigdom, sjølv om ryktet gjer han til ein turistattraksjon, og han har ein flyplass.","Nynorsk: I dag er Timbuktu ein by med mykje fattigdom, sjølv om ryktet gjer han til ein turistattraksjon, og han har ein flyplass. English: I'm a Norwegian, I'm a Norwegian. I'm a Norwegian. I'm a Norwegian. I'm a Norwegian. I'm a Norwegian. I'm a Norwegian. I'm a Norwegian. I'm a Norwegian. I'm a Norwegian. I'm a Norwegian. I'm a Norwegian. I'm a Norwegian. I'm a Norwegian. I'm a Norwegian. I'm a Norwegian. I'm a"
Under ein snøstorm kan det komme så mykje snø på kort tid at du kan køyre deg fast.,Nynorsk: Under ein snøstorm kan det komme så mykje snø på kort tid at du kan køyre deg fast. English: The Norwegian word for a storm is a storm.
"Viss du ønsker å fly verda rundt på den sørlege halvkula, finst det få flyreiser og destinasjonar på grunn av manglande transoseaniske ruter.","Nynorsk: Viss du ønsker å fly verda rundt på den sørlege halvkula, finst det få flyreiser og destinasjonar på grunn av manglande transoseaniske ruter. English: The Norwegian Airline is a global airline with more than 1,200 destinations in more than 100 countries. Norwegian Airline is a global airline with more than 1,200 destinations in more than 100 countries. Norwegian Airline is a global airline with more than 1,200 destinations in more than 100 countries."
"Flyselskap som Emirates, Etihad Airways, Qatar Airways og Turkish Airlines har i stor grad utvida tilbodet til Afrika, og dei flyr til mange store afrikanske byar til betre prisar enn andre europeiske flyselskap.","Nynorsk: Flyselskap som Emirates, Etihad Airways, Qatar Airways og Turkish Airlines har i stor grad utvida tilbodet til Afrika, og dei flyr til mange store afrikanske byar til betre prisar enn andre europeiske flyselskap. English: The Emirates Group is a global airline group with a fleet of more than 30,000 aircraft. The company operates a fleet of more than 30,000 aircraft. The company operates a fleet of more than 30,000 aircraft."
"Det har ikkje vorte sett inn noko ekstra transporttilbod og tog over bakken kjem ikkje til å stogge ved Wembley, i tillegg er parkering og parkering med transport er ikkje tilgjengelig på staden.","Nynorsk: Det har ikkje vorte sett inn noko ekstra transporttilbod og tog over bakken kjem ikkje til å stogge ved Wembley, i tillegg er parkering og parkering med transport er ikkje tilgjengelig på staden. English: The United States of America is a country in the United States of America, located in the western United States. It is the largest country in the world. It is the largest country in the world."
Stort sett må ein søke om visum på førehand viss ein skal opphalde seg i eit framand land over lengre tid.,Nynorsk: Stort sett må ein søke om visum på førehand viss ein skal opphalde seg i eit framand land over lengre tid. English: The Norwegian language is a language of the Norwegian people. It is a language of the Norwegian people. It is a language of the Norwegian people. It is a language of the Norwegian people. It is a language of the Norwegian people. It is a language of the Norwegian people. It is a language of the Norwegian people. It is a language of the Norwegian people. It is a language of the Norwegian people. It is a language of the Norwegian people. It is a language of the Norwegian people
"Kvart tog har både MetroPlus- og Metro-vogner. MetroPlus-vognene ligg alltid lengst bak i toget, nærmast Cape Town.","Nynorsk: Kvart tog har både MetroPlus- og Metro-vogner. MetroPlus-vognene ligg alltid lengst bak i toget, nærmast Cape Town. English: MetroPlus-vogner."
Alle deltar i samfunnet og brukar transportsystem. Nesten alle klagar på transportsystem.,Nynorsk: Alle deltar i samfunnet og brukar transportsystem. Nesten alle klagar på transportsystem. English: The best online dating sites for singles in the UK.
"Ettersom befolkninga er spreidd utover områda og lysforureining derfor ofte ikkje er eit problem, vil du òg kunne sjå på stjernene.","Nynorsk: Ettersom befolkninga er spreidd utover områda og lysforureining derfor ofte ikkje er eit problem, vil du òg kunne sjå på stjernene. English: The Norwegian language is a very popular language in Norway. The Norwegian language is a very popular language in Norway. The Norwegian language is a very popular language in Norway."
Visa-krav og -prisar varierer frå land til land og avheng òg av kva land du kjem frå.,Nynorsk: Visa-krav og -prisar varierer frå land til land og avheng òg av kva land du kjem frå. English: Visa-krav og -prisar.
Det er generelt sett ikkje noko poeng å leite etter billigbillettar til businessklasse eller første klasse på direkteruter frå A til B med fly.,Nynorsk: Det er generelt sett ikkje noko poeng å leite etter billigbillettar til businessklasse eller første klasse på direkteruter frå A til B med fly. English: The best way to find out if you are a good fit for a job is to ask for a job offer. The best way to find out if you are a good fit for a job is to ask for a job offer.
Bumerangkasting er svært populært blant turistar.,Nynorsk: Bumerangkasting er svært populært blant turistar. English: The New York Times.
Denne flyturen er ikkje det einaste alternativet viss du vil hoppe over Sør-Stillehavet og vestkysten av Sør-Amerika (sjå under).,Nynorsk: Denne flyturen er ikkje det einaste alternativet viss du vil hoppe over Sør-Stillehavet og vestkysten av Sør-Amerika (sjå under). English: The Norwegian way of life is a very different one from the Norwegian way of life.
"San Francisco har utvikla ein stor turistinfrastruktur og har ei rekke hotell, restaurantar og møtefasilitetar av ypparste kvalitet.","Nynorsk: San Francisco har utvikla ein stor turistinfrastruktur og har ei rekke hotell, restaurantar og møtefasilitetar av ypparste kvalitet. English: The best way to find out about the best places to stay in San Francisco is to check out TripAdvisor."
"Frivillig arbeid på reise er flott viss ein vil gjere ein forskjell, men det handlar ikkje berre om å gi.","Nynorsk: Frivillig arbeid på reise er flott viss ein vil gjere ein forskjell, men det handlar ikkje berre om å gi. English: The Norwegian Airline is a private airline operating from Oslo, Norway. The Norwegian Airline is a private airline operating from Oslo, Norway. The Norwegian Airline is a private airline operating from Oslo, Norway."
"Alle er kanskje ikkje like tolmodige og imøtekomande når dei reisande kjem heim att, men dette er vel så viktig.","Nynorsk: Alle er kanskje ikkje like tolmodige og imøtekomande når dei reisande kjem heim att, men dette er vel så viktig. English: The best free dating site for singles in the UK. Join free to find a date today."
"Men ikkje gløym ekstrakostnadar til tilleggsvisum, flyskatt, transport på bakken osv. for alle stadene utanfor Afrika.","Nynorsk: Men ikkje gløym ekstrakostnadar til tilleggsvisum, flyskatt, transport på bakken osv. for alle stadene utanfor Afrika. English: The Norwegian government has announced that it will not allow the sale of the Norwegian flag to the United States."
Fleire Bishkek-innbyggjarar skulda demonstrantane frå sør for ulydnaden.,"Nynorsk: Fleire Bishkek-innbyggjarar skulda demonstrantane frå sør for ulydnaden. English: Fleir, a.k.a. adrift."
"Dagens delar av Belgium var før delar av Luxemburg, men vart til Belgia etter den belgiske revolusjonen i 1830.","Nynorsk: Dagens delar av Belgium var før delar av Luxemburg, men vart til Belgia etter den belgiske revolusjonen i 1830. English: The British Revolution in Belgium was a series of events that took place between 1815 and 1830. The British Revolution in Belgium was a series of events that took place between 1815 and 1830. The British Revolution in Belgium was a series of events that took place between 1815 and 1830."
Sidan 1988 har røysteboksar vert nøydd til å vere gjennomsiktige slik at veljarar og observatørar kan sjå at det ikkje finnast nokon konvoluttar der ved byrjinga av røystingsprosedyren og at ingen konvoluttar vert lagt til bortsett frå dei frå nøye talde og autoriserte veljarar.,Nynorsk: Sidan 1988 har røysteboksar vert nøydd til å vere gjennomsiktige slik at veljarar og observatørar kan sjå at det ikkje finnast nokon konvoluttar der ved byrjinga av røystingsprosedyren og at ingen konvoluttar vert lagt til bortsett frå dei frå nøye talde og autoriserte veljarar. English: Sidan 1988 har røysteboksar vert virkelige røytagetsbokar og det det ikke blivet.
Den mellombelse statsministeren Julia Gillard påsto under kampanjen 2010 for det føderale valet at ho meinte at Australia burde verte ein republikk ved utangen av dronning Elizabeth IIs styre.,"Nynorsk: Den mellombelse statsministeren Julia Gillard påsto under kampanjen 2010 for det føderale valet at ho meinte at Australia burde verte ein republikk ved utangen av dronning Elizabeth IIs styre. English: The new government is expected to be called on Monday, May 20, 2010, to take up the issue of the new constitution. The new constitution will be signed by the prime minister and the president. The new constitution will be signed by the prime minister and the president."
Den irske regjeringa understrekar hastverket av parlamentarisk lovfesting for å rette opp i situasjonen.,Nynorsk: Den irske regjeringa understrekar hastverket av parlamentarisk lovfesting for å rette opp i situasjonen. English: The Norwegian language is a language of the Nordic countries.
Diplomatiske argument om regionen er framleis med på å øydelegge forholdet mellom Armenia og Aserbajdsjan.,Nynorsk: Diplomatiske argument om regionen er framleis med på å øydelegge forholdet mellom Armenia og Aserbajdsjan. English: The Armenian language is a language of the Armenian people. The Armenian language is a language of the Armenian people. The Armenian language is a language of the Armenian people.
"Statsminister Stephen Harper har sagt seg eining i å sende regjeringas ‘rein-luft-handling’ til alle partia i komiteen for vurdering, før den andre opplesinga, etter tysdags 25 minutt lange møte med den nasjonal demokratisk partiet sin leiar Jack Layton på statsministerens kontor.","Nynorsk: Statsminister Stephen Harper har sagt seg eining i å sende regjeringas ‘rein-luft-handling’ til alle partia i komiteen for vurdering, før den andre opplesinga, etter tysdags 25 minutt lange møte med den nasjonal demokratisk partiet sin leiar Jack Layton på statsministerens kontor. English: The National Party of Canada (NPC) is a party of Canadians who believe in the principles of the Canadian Constitution. The NPC is a party of Canadians who believe in the principles of the Canadian Constitution. The NPC is a party of Canadians who believe in the principles of the Canadian Constitution."
"Sist månad var det store demonstrasjonar i Polen då landet signerte ACTA-lova, noko som har ført til at den polske regjeringa enn så lenge ikkje vil ratifisere avtalen.","Nynorsk: Sist månad var det store demonstrasjonar i Polen då landet signerte ACTA-lova, noko som har ført til at den polske regjeringa enn så lenge ikkje vil ratifisere avtalen. English: The United States of America is a sovereign state of the United States of America. The United States of America is a sovereign state of the United States of America. The United States of America is a sovereign state of the United States of America."
Råda er berre eit kort samandrag av den politiske situasjonen i landet.,Nynorsk: Råda er berre eit kort samandrag av den politiske situasjonen i landet. English: The New York Times.
"Under valet i 1976 var han rådgjevar for Carter i saker om utanrikspolitikk, og tena seinare som nasjonal sikkerheitsrådgjevar (NSA) frå 1977 til 1981, etter Henry Kissinger.","Nynorsk: Under valet i 1976 var han rådgjevar for Carter i saker om utanrikspolitikk, og tena seinare som nasjonal sikkerheitsrådgjevar (NSA) frå 1977 til 1981, etter Henry Kissinger. English: Under the valet of 1976, under the NSA, and under the NSA-medlemmar."
"Tyrkia ville også overta ansvaret om å vakte over fanga ISIS kjemparar som, sagt i kunngjeringa, europeiske nasjonar har nekta å repatriere.","Nynorsk: Tyrkia ville også overta ansvaret om å vakte over fanga ISIS kjemparar som, sagt i kunngjeringa, europeiske nasjonar har nekta å repatriere. English: The best way to get to the airport is by taxi. The airport is located in the city of Oslo, Norway. The airport is located in the city of Oslo, Norway. The airport is located in the city of Oslo, Norway."
"Desse planane vart likevel forelda over natta, då over 800,000 soldatar frå den Sovjetiske Samveldet sin raude hær entra og skapte dei kviterussiske og ukrainske frontane, etter å ha invadert dei austlege regionane av polen i brot med Riga-freden, den sovjetisk-polske ikkje-aggressiv pakta og andre internasjonale traktatar, både bilaterale og multilaterale.","Nynorsk: Desse planane vart likevel forelda over natta, då over 800,000 soldatar frå den Sovjetiske Samveldet sin raude hær entra og skapte dei kviterussiske og ukrainske frontane, etter å ha invadert dei austlege regionane av polen i brot med Riga-freden, den sovjetisk-polske ikkje-aggressiv pakta og andre internasjonale traktatar, både bilaterale og multilaterale. English: The Norwegian Foreign Office has been working with the Norwegian Government to develop a new policy for the Norwegian economy."
Som resultat av prosessen vil HJR-3 verte vurdert på nytt av den neste valde lovgjevaren i 2015 eller 2016 for å haldast aktiv.,"Nynorsk: Som resultat av prosessen vil HJR-3 verte vurdert på nytt av den neste valde lovgjevaren i 2015 eller 2016 for å haldast aktiv. English: The Norwegian Airline Company (NACA) is a privately owned airline company that operates a fleet of more than 1,200 airplanes. The company operates a fleet of more than 1,200 airplanes. The company operates a fleet of more than 1,200 airplanes."
"Etter at kongressen vedtok erklæringa 4. juli, blei eit handskrive utkast signert av presidenten av kongressen, John Hancock, og sekretæren, Charles Thomson, sendt nokre kvartal lenger unna til trykkeriet til John Dunlap.","Nynorsk: Etter at kongressen vedtok erklæringa 4. juli, blei eit handskrive utkast signert av presidenten av kongressen, John Hancock, og sekretæren, Charles Thomson, sendt nokre kvartal lenger unna til trykkeriet til John Dunlap. English: The United States of America is a sovereign state of the United States of America."
Rett etter klokka 11:00 blokkerte demonstrantar trafikken på den nordgåande vegen i Whitehall.,Nynorsk: Rett etter klokka 11:00 blokkerte demonstrantar trafikken på den nordgåande vegen i Whitehall. English: The Whitehall Museum of Art is a museum of art located in the Whitehall neighborhood of New York City. The museum is open to the public.
"I juni 1956 vart derimot Krushchevs lovnadar sett på prøve då opprør i Polen, der arbeidarar protesterte mot matmangel og kutt i løn, utvikla seg til ein generell protest mot kommunisme.","Nynorsk: I juni 1956 vart derimot Krushchevs lovnadar sett på prøve då opprør i Polen, der arbeidarar protesterte mot matmangel og kutt i løn, utvikla seg til ein generell protest mot kommunisme. English: The United States of America is a country in the United States of America. The United States of America is a country in the United States of America. The United States of America is a country in the United States of America. The United States of America is a country in the United States of America. The United States of America is a country in the United States of America."
"Den skulle vare i dei neste 40 åra og vart kjempa på ekte, av avløysarstyrkar, på slagmarkar frå Amerika til Asia, i Afghanistan, Cuba og mange andre stadar.","Nynorsk: Den skulle vare i dei neste 40 åra og vart kjempa på ekte, av avløysarstyrkar, på slagmarkar frå Amerika til Asia, i Afghanistan, Cuba og mange andre stadar. English: The United States is a country in the United States of America. The United States is a country in the United States of America. The United States is a country in the United States of America. The United States is a country in the United States of America."
Forrige månad anbefalte ein presidentkommisjon det førre provisoriske valrådets avgang som del av ein pakke av tiltak for å leie landet mot nye val.,Nynorsk: Forrige månad anbefalte ein presidentkommisjon det førre provisoriske valrådets avgang som del av ein pakke av tiltak for å leie landet mot nye val. English: Forrige månad og det førre provisoriske valrådets avgang som del av.
"Andre emne som vart dekkja, i følgje rapportar, inkluderer framtida til staten Jerusalem, som er heilag for begge nasjonane, og konflikten om Jordan-dalen.","Nynorsk: Andre emne som vart dekkja, i følgje rapportar, inkluderer framtida til staten Jerusalem, som er heilag for begge nasjonane, og konflikten om Jordan-dalen. English: The Bible is the Word of God."
Den hadde heller ikkje autoritet til å overstyre skattelov og tariffar mellom statar.,Nynorsk: Den hadde heller ikkje autoritet til å overstyre skattelov og tariffar mellom statar. English: The Norwegian government has been in the process of replacing the Norwegian flag with a new one.
