text,translated_text
Fransk vallov kodifiserer behandlinga relativt strengt.,"Nynorsk: Fransk vallov kodifiserer behandlinga relativt strengt. English: The French-speaking people of the Netherlands, the Netherlands, and the Netherlands."
"Etter ei veke med tap i mellomvalet fortalde Bush om ekspansjonen av handel i Asia, til eit publikum.","Nynorsk: Etter ei veke med tap i mellomvalet fortalde Bush om ekspansjonen av handel i Asia, til eit publikum. English: The United States of America is a sovereign state of the United States of America."
"Strategien viste seg å vere effektiv då den kutta av vitale militære og sivile forsyningar, sjølv om denne blokaden braut med dei generelt aksepterte internasjonale lovane, kodifisert av fleire små internasjonale avtalar gjennom dei to siste tiåra.","Nynorsk: Strategien viste seg å vere effektiv då den kutta av vitale militære og sivile forsyningar, sjølv om denne blokaden braut med dei generelt aksepterte internasjonale lovane, kodifisert av fleire små internasjonale avtalar gjennom dei to siste tiåra. English: The best way to get started is to sign up for a free trial."
"Økonomiske samarbeid er retta opp att mellom desse to delane av Moldova, trass svikt i dei politiske forhandlingane.","Nynorsk: Økonomiske samarbeid er retta opp att mellom desse to delane av Moldova, trass svikt i dei politiske forhandlingane. English: The United States of America is a country in the United States of America."
Saman med tenestemenn forsikra han innbyggjarar i Texas om at dei rette stega vart tekne for å sikre offentlegheitas tryggleik.,Nynorsk: Saman med tenestemenn forsikra han innbyggjarar i Texas om at dei rette stega vart tekne for å sikre offentlegheitas tryggleik. English: The United States of America is a country in the United States of America. The United States of America is a country in the United States of America. The United States of America is a country in the United States of America.
Liberal kritikk av gjennoppbyggingsinnsatsen har vore retta mot gevinsten kontraktane for gjenoppbygginga har gjeve til dei gjeldande personane på innsida av Washington.,Nynorsk: Liberal kritikk av gjennoppbyggingsinnsatsen har vore retta mot gevinsten kontraktane for gjenoppbygginga har gjeve til dei gjeldande personane på innsida av Washington. English: The New York Times.
"Ut frå ei meiningsmåling av 1400 menneske før det føderale valet i 2010 kom det fram at talet på dei som er imot at Australia skal verte ein republikk, har auka med 8 prosent sidan 2008.","Nynorsk: Ut frå ei meiningsmåling av 1400 menneske før det føderale valet i 2010 kom det fram at talet på dei som er imot at Australia skal verte ein republikk, har auka med 8 prosent sidan 2008. English: The United States of America is a country in the United States of America, located in the United States of America, the United States of America, the United States of America, the United States of America, the United States of America, the United States of America, the United States of America, the United States of America, the United States of America, the United States of America, the United States of America, the United States of America, the United States of America, the United States of America"
Diplomatar sa at dei hadde funne nok ambiguitet i den afghanske grunnlova til å avgjere om preferansevalet var unødig.,Nynorsk: Diplomatar sa at dei hadde funne nok ambiguitet i den afghanske grunnlova til å avgjere om preferansevalet var unødig. English: The United States of America is a sovereign state of the United States of America.
"Etter at resultat kom inn hylla Gingrich Santorum, men hadde krasse ord til Romney som hadde vore årsaka til at det hadde vorte sendt ut negative marknadsføringskampanjar mot Gingrich i Iowa.","Nynorsk: Etter at resultat kom inn hylla Gingrich Santorum, men hadde krasse ord til Romney som hadde vore årsaka til at det hadde vorte sendt ut negative marknadsføringskampanjar mot Gingrich i Iowa. English: The New York Times, the New York Times, the New York Times, the New York Times, the New York Times, the New York Times, the New York Times, the New York Times, the New York Times, the New York Times, the New York Times, the New York Times, the New York Times, the New York Times, the New York Times, the New York Times, the New York Times, the New York Times, the New York Times, the New York Times,"
Dette er Martellys femte provisoriske valråd på fire år.,Nynorsk: Dette er Martellys femte provisoriske valråd på fire år. English: The Finnish language is a very important part of the Finnish language.
"Den olympiske gullmedaljevinnaren skulle symje i 100m og 200m fristil og i tre stafettar i samveldeleikane, men som følgje av klagene hans har det vorte sett spørjeteikn ved forma hans.","Nynorsk: Den olympiske gullmedaljevinnaren skulle symje i 100m og 200m fristil og i tre stafettar i samveldeleikane, men som følgje av klagene hans har det vorte sett spørjeteikn ved forma hans. English: The Olympic Games are the world's largest sporting event, and the largest international sporting event in the world. The Games are held in the United States, Canada, Australia, New Zealand, the United Kingdom, and the United States of America. The Games are held in the United States, Canada, Australia, New Zealand, the United Kingdom, and the United States of America."
I tillegg til å vere ein tidlegare olympisk og verdsmeister var Saito leiar i heile Japan judo treningsforbund på tidspunktet for bortgangen hans.,Nynorsk: I tillegg til å vere ein tidlegare olympisk og verdsmeister var Saito leiar i heile Japan judo treningsforbund på tidspunktet for bortgangen hans. English: I'm a very good student and I'm looking for a good job. I'm a very good student and I'm looking for a good job. I'm a very good student and I'm looking for a good job. I'm a very good student and I'm looking for a good job.
"Den internasjonale olympiske komiteen røysta for å inkludere idrettane på eit styreleiarmøte i Berlin i dag. Rugby, særleg rugby union, og golf vart vald over fire andre idrettar for å bli vurdert til å delta i dei olympiske leikane.","Nynorsk: Den internasjonale olympiske komiteen røysta for å inkludere idrettane på eit styreleiarmøte i Berlin i dag. Rugby, særleg rugby union, og golf vart vald over fire andre idrettar for å bli vurdert til å delta i dei olympiske leikane. English: The National Rugby Union is a professional rugby union club in the United Kingdom. The National Rugby Union is a professional rugby union club in the United Kingdom. The National Rugby Union is a professional rugby union club in the United Kingdom. The National Rugby Union is a professional rugby union club in the United Kingdom. The National Rugby Union is a professional rugby union club in the United Kingdom. The National Rugby Union is a professional rugby union club in the United Kingdom. The National Rugby Union is a professional rugby union club"
Den største turneringa i året finn stad på polobanene i Las Cañitas i desember.,Nynorsk: Den største turneringa i året finn stad på polobanene i Las Cañitas i desember. English: The latest Tweets from Las Cañitas (@las_canchitas). Las Cañitas is a Spanish-language community for the Las Cañitas community.
Etter at han flytta til den hovudstaden Catalonia hadde Vidal spelt 49 kampar for klubben.,"Nynorsk: Etter at han flytta til den hovudstaden Catalonia hadde Vidal spelt 49 kampar for klubben. English: The New York Times, The New York Times, The New York Times, The New York Times, The New York Times, The New York Times, The New York Times, The New York Times, The New York Times, The New York Times, The New York Times, The New York Times, The New York Times, The New York Times, The New York Times, The New York Times, The New York Times, The New York Times, The New York Times, The New York Times,"
"Når idrettsutøvarar klarer å oppretthalde ein god energibalanse, har gode vanar for å tilføre kroppen væske og forstår dei ulike aspekta ved kosttilskott, kan det gjere at dei presterer betre og får auka glede av sporten.","Nynorsk: Når idrettsutøvarar klarer å oppretthalde ein god energibalanse, har gode vanar for å tilføre kroppen væske og forstår dei ulike aspekta ved kosttilskott, kan det gjere at dei presterer betre og får auka glede av sporten. English: The Norwegian National Language is the official language of Norway. The Norwegian National Language is the official language of Norway. The Norwegian National Language is the official language of Norway. The Norwegian National Language is the official language of Norway."
"På tredje er Hamlin tjue poeng bak, men fem framfor Bowyer. Kahne og Truex, Jr. er nummer fem og seks med 2220 og 2207 poeng.","Nynorsk: På tredje er Hamlin tjue poeng bak, men fem framfor Bowyer. Kahne og Truex, Jr. er nummer fem og seks med 2220 og 2207 poeng. English: The following is a list of the most common English words used in the English language."
Nadals rekord i møte mot kanadiaren er 7-2.,Nynorsk: Nadals rekord i møte mot kanadiaren er 7-2. English: The New York Times.
"Jarque trente under førsesongens trening, på Coverciano i Italia, tidlegare i dag. Han budde på laget sitt hotell før den planlagde kampen mot Bolivia på sundag.","Nynorsk: Jarque trente under førsesongens trening, på Coverciano i Italia, tidlegare i dag. Han budde på laget sitt hotell før den planlagde kampen mot Bolivia på sundag. English: The National Museum of Wales, Cardiff, Wales."
Frykt for mangel på transport har ymta om moglegheita for at kampane vil gå føre seg bak lukka dører utan laget sine supporterar.,Nynorsk: Frykt for mangel på transport har ymta om moglegheita for at kampane vil gå føre seg bak lukka dører utan laget sine supporterar. English: The Norwegian Bokmål Dictionary.
"Tommy Dreamer sa “Luna var den første dronninga av ekstrem. Min første manager. Luna døydde på ei natt med to månar. Ganske unikt, akkurat som ho. Sterk Kvinne.”","Nynorsk: Tommy Dreamer sa “Luna var den første dronninga av ekstrem. Min første manager. Luna døydde på ei natt med to månar. Ganske unikt, akkurat som ho. Sterk Kvinne.” English: “I’m not a mindreader. I’m not a mindreader. I’m not a mindreader. I’m not a mindreader. I’m not a mindreader. I’m not a mindreader. I’m not a mindreader. I’m not a mindreader. I’m not a mindreader. I’m not a mindreader. I’m not a mindreader. I’m not a mindreader. I’m"
"Polens menn for synshemma skigåarar, Maciej Krezel og guide Anna Ogarzynska endte på trettande plass i Super-G. Sør Koreas Jong Seork endte på tjuefjerde plass i menns sittande Super-G.","Nynorsk: Polens menn for synshemma skigåarar, Maciej Krezel og guide Anna Ogarzynska endte på trettande plass i Super-G. Sør Koreas Jong Seork endte på tjuefjerde plass i menns sittande Super-G. English: The Korean War was a war of independence between the United States and the Korean People's Republic of Korea. The Korean War was a war of independence between the United States and the Korean People's Republic of Korea. The Korean War was a war of independence between the United States and the Korean People's Republic of Korea."
Ta kontakt med Asociación Argentina de Polo for å få vite meir om turneringar og kvar du kan kjøpe billettar til polokampar.,Nynorsk: Ta kontakt med Asociación Argentina de Polo for å få vite meir om turneringar og kvar du kan kjøpe billettar til polokampar. English: The Association of Polo Players of America (AOPA) is a non-profit organization that promotes the sport of polo.
"Kampen starta klokka 10:00 i nydeleg vêr, og bortsett frå litt yr om morgonen, som raskt tørka opp, var det ein perfekt dag for sjumannsrugby.","Nynorsk: Kampen starta klokka 10:00 i nydeleg vêr, og bortsett frå litt yr om morgonen, som raskt tørka opp, var det ein perfekt dag for sjumannsrugby. English: The best way to get to the beach is by boat. The best way to get to the beach is by boat. The best way to get to the beach is by boat."
Arly Velasquez frå Mexico endte på femtande plass i menns sittande Super-G. New Zealands Adam Hall endte på niande plass i menns ståande Super-G.,Nynorsk: Arly Velasquez frå Mexico endte på femtande plass i menns sittande Super-G. New Zealands Adam Hall endte på niande plass i menns ståande Super-G. English: The New Zealanders are the first team to win the Super-G.
"Den siste kampen i serien vil finne stad på Ellis Park i Johannesburg neste veke, når Springboks spelar mot Australia.","Nynorsk: Den siste kampen i serien vil finne stad på Ellis Park i Johannesburg neste veke, når Springboks spelar mot Australia. English: The Springboks are the only team in the world to have won the World Cup. The Springboks are the only team in the world to have won the World Cup. The Springboks are the only team in the world to have won the World Cup."
"Under gode forhold vil du kunne legge bak deg større avstandar enn om du går, men berre svært sjeldan går det like fort som på langrenn i preparerte løyper utan ein tung sekk på ryggen.","Nynorsk: Under gode forhold vil du kunne legge bak deg større avstandar enn om du går, men berre svært sjeldan går det like fort som på langrenn i preparerte løyper utan ein tung sekk på ryggen. English: The best way to get to know the people you're dating is to meet them in person."
"Sju poeng bak, er Johnson nummer to med 2,243.","Nynorsk: Sju poeng bak, er Johnson nummer to med 2,243. English: The New York Times, the New York Times, the New York Times, the New York Times, the New York Times, the New York Times, the New York Times, the New York Times, the New York Times, the New York Times, the New York Times, the New York Times, the New York Times, the New York Times, the New York Times, the New York Times, the New York Times, the New York Times, the New York Times, the New York Times,"
Juving (òg kalla juvvandring) handlar om å ta seg ned i botnen av eit juv som enten er tørt eller fullt av vatn.,Nynorsk: Juving (òg kalla juvvandring) handlar om å ta seg ned i botnen av eit juv som enten er tørt eller fullt av vatn. English: The Norwegian Bokmål: The Norwegian Bokmål is a language spoken in Norway. It is the official language of Norway. It is the official language of the United Kingdom. It is the official language of the United States. It is the official language of the United States of America.
"Robin Uthappa scora høgst i inneomgangen, 70 laup på berre 41 ballar ved å slå 11 firarar og 2 seksarar.","Nynorsk: Robin Uthappa scora høgst i inneomgangen, 70 laup på berre 41 ballar ved å slå 11 firarar og 2 seksarar. English: Robin Uthappa, 70 laup på berre 41 ballar ved å slå 11 firarar og 2 seksarar."
"Vintersportar er mest populære i dei nordlege regionane, med italienarar som konkurrerer i dei internasjonale leikane og olympiske arrangement.","Nynorsk: Vintersportar er mest populære i dei nordlege regionane, med italienarar som konkurrerer i dei internasjonale leikane og olympiske arrangement. English: The Norwegian Bokmål Language is a language spoken in Norway. The Norwegian Bokmål Language is a language spoken in Norway. The Norwegian Bokmål Language is a language spoken in Norway. The Norwegian Bokmål Language is a language spoken in Norway. The Norwegian Bokmål Language is a language spoken in Norway. The Norwegian Bokmål Language is a language spoken in Norway. The Norwegian Bokmål Language is a language spoken in Norway. The Norwegian Bokmål Language is a language spoken in Norway. The Norwegian Bokmål"
"Maroochydore hadde fullført på toppen av stigen, seks poeng framfor Noosa på andre plass.","Nynorsk: Maroochydore hadde fullført på toppen av stigen, seks poeng framfor Noosa på andre plass. English: The best free dating sites for singles in the world."
"Michael Schumacher endte laupet sitt ikkje lenge etter Alonso, som følgje av skade på hjulopphenget, etter dei mange kampane gjennom laupet.","Nynorsk: Michael Schumacher endte laupet sitt ikkje lenge etter Alonso, som følgje av skade på hjulopphenget, etter dei mange kampane gjennom laupet. English: Michael Schumacher, Michael Schumacher, Michael Schumacher, Michael Schumacher, Michael Schumacher, Michael Schumacher, Michael Schumacher, Michael Schumacher, Michael Schumacher, Michael Schumacher, Michael Schumacher, Michael Schumacher, Michael Schumacher, Michael Schumacher, Michael Schumacher, Michael Schumacher, Michael Schumacher, Michael Schumacher, Michael Schumacher, Michael Schumacher, Michael Schumacher, Michael Schumacher, Michael Schumacher, Michael Schumacher, Michael Schumacher, Michael Schumacher, Michael Schumacher, Michael Schumacher, Michael Schumacher, Michael Schumacher, Michael Schumacher, Michael Schumacher, Michael Schumacher, Michael"
"Det å ha eit godt og næringsrikt kosthald aleine gir ikkje prestasjonar på elitenivå, men det har stor innverknad på den generelle forma til unge idrettsutøvarar.","Nynorsk: Det å ha eit godt og næringsrikt kosthald aleine gir ikkje prestasjonar på elitenivå, men det har stor innverknad på den generelle forma til unge idrettsutøvarar. English: The best way to get started is to sign up for a free trial."
"Han har ikkje vore i stand til å ta dei nødvendige legemidla for å kome over smertene, då dei er ulovlege i leikane.","Nynorsk: Han har ikkje vore i stand til å ta dei nødvendige legemidla for å kome over smertene, då dei er ulovlege i leikane. English: I'm not sure if this is a good idea, but I'm sure it's a good idea."
Ifølge forsking har kvinner dobbelt så stor sjanse for å få MS som menn.,Nynorsk: Ifølge forsking har kvinner dobbelt så stor sjanse for å få MS som menn. English: The best online dating sites for over 50. The best online dating sites for over 50. The best online dating sites for over 50. The best online dating sites for over 50. The best online dating sites for over 50.
"Ulovleg brennevin kan innehalde farlege stoff, inkludert metanol, noko som kan føre til synstap eller død, sjølv i små dosar.","Nynorsk: Ulovleg brennevin kan innehalde farlege stoff, inkludert metanol, noko som kan føre til synstap eller død, sjølv i små dosar. English: The FDA has approved the use of a new drug called rosuvastatin, which is used to treat high blood pressure."
"Berre effektane av krisemaksimering, ikkje depresjon og redsel, kravde vekentlege strukturerte økter med fysisk aktivitet.","Nynorsk: Berre effektane av krisemaksimering, ikkje depresjon og redsel, kravde vekentlege strukturerte økter med fysisk aktivitet. English: The Norwegian Language: The Norwegian language is a language spoken by Norwegians in the North Sea. The Norwegian language is a language spoken by Norwegians in the North Sea. The Norwegian language is a language spoken by Norwegians in the North Sea."
"Ålmennt bileigarskap fører også til høgare førekomst av ulykker på vegane, som i sin tur fører til at helsevesenet oppdagar nye teknikkar for behandling av skada personar.","Nynorsk: Ålmennt bileigarskap fører også til høgare førekomst av ulykker på vegane, som i sin tur fører til at helsevesenet oppdagar nye teknikkar for behandling av skada personar. English: The Norwegian government has announced that it will not allow the sale of the Norwegian flag to the United States."
"Leiande forskarar seier at dette kan føre til tidleg oppdaging av kreft, tuberkulose, HIV og malaria for pasientar i låginntekstland, der overlevingsraten for sjukdomar som brystkreft kan vere halvert i samhøve med dei frå rikare land.","Nynorsk: Leiande forskarar seier at dette kan føre til tidleg oppdaging av kreft, tuberkulose, HIV og malaria for pasientar i låginntekstland, der overlevingsraten for sjukdomar som brystkreft kan vere halvert i samhøve med dei frå rikare land. English: The National Institute of Health (NIH) is a federal agency that is responsible for the development and use of the National Institutes of Health (NIH) programs. The NIH is a federal agency that is responsible for the development and use of the National Institutes of Health (NIH) programs."
"Dr. Ehud Ur, professor i medisin ved Dalhousie-universitetet i Halifax, Nova Scotia, og styreleiar av den kliniske og vitskapelege avdelinga for den kanadiske diabetesforeininga åtvara om at forskinga framleis er på eit tidleg stadium.","Nynorsk: Dr. Ehud Ur, professor i medisin ved Dalhousie-universitetet i Halifax, Nova Scotia, og styreleiar av den kliniske og vitskapelege avdelinga for den kanadiske diabetesforeininga åtvara om at forskinga framleis er på eit tidleg stadium. English: Dr. Ehud Ur, professor i medisin ved Dalhousie-universitetet i Halifax, Nova Scotia, og styreleiar av den kliniske og vitskapelege samarbeida for den kanadiske diabetesforeininga åtvara om at forskinga framleis er på eit tidleg stadium."
"Desse borna har ein tendens til å komme i mykje bråk, då dei “engasjerer seg i risikabel åtferd, hamnar i slagsmål og utfordrar autoritetar” for å stimulere hjernen sin, sidan hjernen deira ikkje kan verte stimulert ved hjelp av vanlege metodar.","Nynorsk: Desse borna har ein tendens til å komme i mykje bråk, då dei “engasjerer seg i risikabel åtferd, hamnar i slagsmål og utfordrar autoritetar” for å stimulere hjernen sin, sidan hjernen deira ikkje kan verte stimulert ved hjelp av vanlege metodar. English: The Norwegian language is a very popular language in Norway. It is a very popular language in Norway. It is a very popular language in Norway. It is a very popular language in Norway. It is a very popular language in Norway. It is a very popular language in Norway. It is a very popular language in Norway. It is a very popular language in Norway. It is a very popular language in Norway. It is a very popular language in Norway. It is a very popular language in Norway"
Menneskje kan verte påverka ved å puste inn påverka vatn som ender opp i lufta som følgje av vind og bølgjer.,"Nynorsk: Menneskje kan verte påverka ved å puste inn påverka vatn som ender opp i lufta som følgje av vind og bølgjer. English: The Norwegian Airline is a private airline operating from Oslo, Norway. The Norwegian Airline is a private airline operating from Oslo, Norway."
Nokre menneske trur at å oppleve mange kunstig framstilte klåre draumar ofte kan vere svært slitsamt.,Nynorsk: Nokre menneske trur at å oppleve mange kunstig framstilte klåre draumar ofte kan vere svært slitsamt. English: The Norwegian language is a language of the Nordic people. The Norwegian language is a language of the Nordic people. The Norwegian language is a language of the Nordic people. The Norwegian language is a language of the Nordic people.
"Porto vart på dette punktet behandla for akselen sin, men klarde å returnere til kampen.","Nynorsk: Porto vart på dette punktet behandla for akselen sin, men klarde å returnere til kampen. English: The best way to get a job is to work for a company that offers a good salary."
"Dessuten har det alvorlege konsekvensar dersom ein mislykkast med dette: vekst depresjon, feilernæring, og til sjuande og sist daud.","Nynorsk: Dessuten har det alvorlege konsekvensar dersom ein mislykkast med dette: vekst depresjon, feilernæring, og til sjuande og sist daud. English: The best way to get started is to sign up for a free trial."
Tenestemenn for byen Amsterdam og Anne Frank museet fortel at treet er infisert med sopp og utgjer ein offentleg helserisiko då dei hevdar at det er i umiddelbar fare for å falle ned.,Nynorsk: Tenestemenn for byen Amsterdam og Anne Frank museet fortel at treet er infisert med sopp og utgjer ein offentleg helserisiko då dei hevdar at det er i umiddelbar fare for å falle ned. English: The Dutch are the only people who can read the English language.
"Sjukehuset har følgt prosedyren for infeksjonskontroll, inkludert å skilje pasienten frå andre for å hindre mogleg smitte.","Nynorsk: Sjukehuset har følgt prosedyren for infeksjonskontroll, inkludert å skilje pasienten frå andre for å hindre mogleg smitte. English: The New York Times, the New York Times, the New York Times, the New York Times, the New York Times, the New York Times, the New York Times, the New York Times, the New York Times, the New York Times, the New York Times, the New York Times, the New York Times, the New York Times, the New York Times, the New York Times, the New York Times, the New York Times, the New York Times, the New York Times,"
Instituttet for rettferd og demokrati på Haiti refererer til uavhengige undersøkingar som ymtar om at ein nepalsk kontingent frå dei fredsbevarande styrkane bringa med seg sjukdommen til Haiti utan at dei visste om det.,Nynorsk: Instituttet for rettferd og demokrati på Haiti refererer til uavhengige undersøkingar som ymtar om at ein nepalsk kontingent frå dei fredsbevarande styrkane bringa med seg sjukdommen til Haiti utan at dei visste om det. English: The Haitian government has been in the process of rebuilding the country after the earthquake. The government has been in the process of rebuilding the country after the earthquake. The government has been in the process of rebuilding the country after the earthquake.
"Infeksjonssjukdommar i seg sjølv, eller farlege dyr som kan skade eller drepe menneske med makt, kvalifiserer normalt sett ikkje som skadedyr.","Nynorsk: Infeksjonssjukdommar i seg sjølv, eller farlege dyr som kan skade eller drepe menneske med makt, kvalifiserer normalt sett ikkje som skadedyr. English: The Norwegian Government has announced that it will not allow the sale of the Norwegian flag to any foreign company."
