text,translated_text
"Mutasjonar legg til ny genetisk variasjon, og seleksjon fjernar den frå forrådet av uttrykt variasjon.","Nynorsk: Mutasjonar legg til ny genetisk variasjon, og seleksjon fjernar den frå forrådet av uttrykt variasjon. English: The Norwegian language is a language of the Nordic countries. It is a language of the Nordic countries. It is a language of the Nordic countries. It is a language of the Nordic countries. It is a language of the Nordic countries. It is a language of the Nordic countries. It is a language of the Nordic countries. It is a language of the Nordic countries. It is a language of the Nordic countries. It is a language of the Nordic countries. It is a language of the Nordic countries"
Atombomba fungerer etter prinsippet om at det krev energi å sette saman ein kjerne med mange proton og nøytron.,Nynorsk: Atombomba fungerer etter prinsippet om at det krev energi å sette saman ein kjerne med mange proton og nøytron. English: The Atom Bomb is a nuclear bomb that exploded in the United States in the early 1980s. It was the first nuclear bomb to be launched by a man.
Kjernen består av to partiklar – nøytron og proton.,Nynorsk: Kjernen består av to partiklar – nøytron og proton. English: The Norwegian language is a language of the Nordics.
Dette har gjort det mogleg for zoomobjektiv å produsere bilete av ein kvalitet som kan samanliknast med dei tatt av eit objektiv med fast brennvidde.,Nynorsk: Dette har gjort det mogleg for zoomobjektiv å produsere bilete av ein kvalitet som kan samanliknast med dei tatt av eit objektiv med fast brennvidde. English: The best way to find out if your credit score is good is to check your credit report. The best way to find out if your credit score is good is to check your credit report.
"Det er fleire grunnar til at dei er betre enn webproxyar: Dei dirigerer om all Internett-trafikk, ikkje berre http.","Nynorsk: Det er fleire grunnar til at dei er betre enn webproxyar: Dei dirigerer om all Internett-trafikk, ikkje berre http. English: The Internet is a network of computers, networks, and other devices that connect people, places, and things."
Interaktive design krev at du revurderer dine fordomar om medieproduksjon og lærer å tenkje på ikkje-tradisjonelle vis.,Nynorsk: Interaktive design krev at du revurderer dine fordomar om medieproduksjon og lærer å tenkje på ikkje-tradisjonelle vis. English: The best way to learn is to practice.
"Dette blei dermed vanleg, men jernet førte til større slitasje på trehjula på vognene.","Nynorsk: Dette blei dermed vanleg, men jernet førte til større slitasje på trehjula på vognene. English: The New York Times. The New York Times is a leading English-language daily newspaper published in New York City. The New York Times is the world's largest daily newspaper."
"Flokkar er forma av ein til tre vaksne hannløver, saman med so mange som tretti løvinner og ungane deira.","Nynorsk: Flokkar er forma av ein til tre vaksne hannløver, saman med so mange som tretti løvinner og ungane deira. English: The Norwegian Bokmål Dictionary."
"Sjølv om «science fiction» gir kraftige assosiasjonar til kunstig intelligens (KI), utgjer KI ein svært viktig del av datavitskapen når det gjeld å hanskast med verkemåte, læring og intelligent tilpassing i ei maskin.","Nynorsk: Sjølv om «science fiction» gir kraftige assosiasjonar til kunstig intelligens (KI), utgjer KI ein svært viktig del av datavitskapen når det gjeld å hanskast med verkemåte, læring og intelligent tilpassing i ei maskin. English: The New York Times, The New York Times, The New York Times, The New York Times, The New York Times, The New York Times, The New York Times, The New York Times, The New York Times, The New York Times, The New York Times, The New York Times, The New York Times, The New York Times, The New York Times, The New York Times, The New York Times, The New York Times, The New York Times, The New York Times,"
Sideforholdet av dette formatet (delt på tolv for å oppnå det enklaste fullstendige forholdet) er difor 3:2.,Nynorsk: Sideforholdet av dette formatet (delt på tolv for å oppnå det enklaste fullstendige forholdet) er difor 3:2. English: Side-Freundship (side-friendship) is a term used in the English language to refer to a relationship between two people.
"Ein satellittelefon er vanlegvis ikkje ei god erstatning for ein mobiltelefon, ettersom du må vere utandørs og ha fri sikt til satellitten for å kunne ringe.","Nynorsk: Ein satellittelefon er vanlegvis ikkje ei god erstatning for ein mobiltelefon, ettersom du må vere utandørs og ha fri sikt til satellitten for å kunne ringe. English: The phone is a mobile phone."
"Sjølv om desse skinnene berre bestod av parallelle treplankar, gjorde dei det mogleg for hestane som trekte vognene, å oppnå høgare fart og trekke tyngre laster enn på dei noko grovare vegane som var på den tida.","Nynorsk: Sjølv om desse skinnene berre bestod av parallelle treplankar, gjorde dei det mogleg for hestane som trekte vognene, å oppnå høgare fart og trekke tyngre laster enn på dei noko grovare vegane som var på den tida. English: The Norwegian Forest is a national park in Norway. It is located in the northeastern part of the Norwegian archipelago. It is part of the National Park of Norway. The park is located in the northeastern part of the Norwegian archipelago. It is part of the National Park of Norway. The park is located in the northeastern part of the Norwegian archipelago. It is part of the National Park of Norway. The park is located in the northeastern part of the Norwegian archi"
"Folk har kjent til grunnleggande kjemiske element som gull, sølv og kopar frå antikken, ettersom alle desse finst i naturleg form og er relativt enkle å utvinne med primitive verktøy.","Nynorsk: Folk har kjent til grunnleggande kjemiske element som gull, sølv og kopar frå antikken, ettersom alle desse finst i naturleg form og er relativt enkle å utvinne med primitive verktøy. English: The Norwegian Folk Song is a popular song in Norway. It is a popular song in Norway. It is a popular song in Norway. It is a popular song in Norway. It is a popular song in Norway. It is a popular song in Norway. It is a popular song in Norway. It is a popular song in Norway. It is a popular song in Norway. It is a popular song in Norway. It is a popular song in Norway. It is a popular song in Norway. It"
Hjulet har endra verda på utrulege vis. Det største hjulet har gjort for oss er å gje oss mykje enklare og raskare moglegheiter for transport.,Nynorsk: Hjulet har endra verda på utrulege vis. Det største hjulet har gjort for oss er å gje oss mykje enklare og raskare moglegheiter for transport. English: The Norwegian Bokmål Dictionary.
"Dette er laga for å sikre at biletet dekkjer heile skjermen, og blir kalla for «overscan».","Nynorsk: Dette er laga for å sikre at biletet dekkjer heile skjermen, og blir kalla for «overscan». English: I’m not sure if this is a good idea, but I’m not sure if this is a good idea."
Tyske ubåtar vart kalla U-båtar. Tyskarane var svært gode til å navigere og operere ubåtane sine.,Nynorsk: Tyske ubåtar vart kalla U-båtar. Tyskarane var svært gode til å navigere og operere ubåtane sine. English: Tyske ubåtar vart kalla U-båtar. Tyskarane var svært gode til å navigere og operere ubåtane sine.
"Sjølv om den fysiske tilstanden kan endre seg, er den kjemiske tilstanden framleis den same.","Nynorsk: Sjølv om den fysiske tilstanden kan endre seg, er den kjemiske tilstanden framleis den same. English: The best way to get a good night's sleep."
"Overflatespenning hender som følgje av at vatnmolekyl på overflata av vatnet trekkast mot kvarandre, meir enn dei gjer mot luftmolekyl over dei.","Nynorsk: Overflatespenning hender som følgje av at vatnmolekyl på overflata av vatnet trekkast mot kvarandre, meir enn dei gjer mot luftmolekyl over dei. English: Overflatespenning hender som følgje av at vatnmolekyl på overflata av vatnet trekkast mot kvarandre, meir enn dei gjer mot luftmolekyl over dei."
"Eit av dei vanlegaste problema som kan oppstå når du prøver å konvertere ein film til DVD-format, er overscan.","Nynorsk: Eit av dei vanlegaste problema som kan oppstå når du prøver å konvertere ein film til DVD-format, er overscan. English: The film is a film about a man who is a man who is a man who is a man who is a man who is a man who is a man who is a man who is a man who is a man who is a man who is a man who is a man who is a man who is a man who is a man who is a man who is a man who is a man who is a man who is a man who is a man who is a man who is a man"
Det vert særleg påstått at ein kan oppdage om ein person ljug ved å tolke mikro-uttrykka riktig.,Nynorsk: Det vert særleg påstått at ein kan oppdage om ein person ljug ved å tolke mikro-uttrykka riktig. English: The best free dating site for singles in the world. The best free dating site for singles in the world.
Gull kan verte utarbeidd til ein kvar formasjon. Det kan verte rulla til svært små former.,Nynorsk: Gull kan verte utarbeidd til ein kvar formasjon. Det kan verte rulla til svært små former. English: The word is used in the following ways:
"KI-​​systemet blir no ofte brukt innan økonomi, medisin, teknikk og militæret og er innebygd i fleire PC-appar og videospel-appar.","Nynorsk: KI- systemet blir no ofte brukt innan økonomi, medisin, teknikk og militæret og er innebygd i fleire PC-appar og videospel-appar. English: The Norwegian language is a language of the Nordic countries. The Norwegian language is a language of the Nordic countries. The Norwegian language is a language of the Nordic countries. The Norwegian language is a language of the Nordic countries. The Norwegian language is a language of the Nordic countries."
"Den vert framleis framstilt i dag, men endå viktigare er at dens sideforhold har vorte arva av digitale kamera sine sensorformat.","Nynorsk: Den vert framleis framstilt i dag, men endå viktigare er at dens sideforhold har vorte arva av digitale kamera sine sensorformat. English: The best way to get to the beach is by car."
Den mykje kritiserte og ofte latterleggjorde regelen om at tredjedelar er ei enkel retningslinje som skapar dynamikk medan den held eit mål av orden i bilete.,Nynorsk: Den mykje kritiserte og ofte latterleggjorde regelen om at tredjedelar er ei enkel retningslinje som skapar dynamikk medan den held eit mål av orden i bilete. English: The Norwegian Airline is a Norwegian airline that operates flights from Oslo to Oslo.
"Dette stadfesta, ikkje berre at i alle fall nokon dinosaurar hadde fjør, en allereie utbreidd teori, men gjev detaljar som fossil generelt sett ikkje kan, som fargar og tredimensjonale arrangement.","Nynorsk: Dette stadfesta, ikkje berre at i alle fall nokon dinosaurar hadde fjør, en allereie utbreidd teori, men gjev detaljar som fossil generelt sett ikkje kan, som fargar og tredimensjonale arrangement. English: The New York Times, The New York Times, The New York Times, The New York Times, The New York Times, The New York Times, The New York Times, The New York Times, The New York Times, The New York Times, The New York Times, The New York Times, The New York Times, The New York Times, The New York Times, The New York Times, The New York Times, The New York Times, The New York Times, The New York Times,"
Korleis hadde dragninga av Io si tyngdekraft verka på meg? Dersom du stod på overflata av Io hadde du vege mindre enn du gjer på jorda.,Nynorsk: Korleis hadde dragninga av Io si tyngdekraft verka på meg? Dersom du stod på overflata av Io hadde du vege mindre enn du gjer på jorda. English: The Norwegian Bokmål Dictionary.
NextGen er eit system som det amerikanske luftfartskontrollen hevdar at kan tillate fly å fly kortare ruter og spare millionar med gallon av drivstoff kvart år og redusere utslepp av karbondioksid.,Nynorsk: NextGen er eit system som det amerikanske luftfartskontrollen hevdar at kan tillate fly å fly kortare ruter og spare millionar med gallon av drivstoff kvart år og redusere utslepp av karbondioksid. English: The New York Times.
Nevrobiologiske data gir fysiske bevis for ei teoretisk tilnærming til undersøking av kognisjon. Forskingsområdet blir dermed innsnevra og mykje meir nøyaktig.,Nynorsk: Nevrobiologiske data gir fysiske bevis for ei teoretisk tilnærming til undersøking av kognisjon. Forskingsområdet blir dermed innsnevra og mykje meir nøyaktig. English: The biology of the human genome.
"I løpet av den 2 timar lange tala uttalte han at “I dag kjem Apple til å gjenoppfinne telefonen, vi kjem til å skrive historie i dag”.","Nynorsk: I løpet av den 2 timar lange tala uttalte han at “I dag kjem Apple til å gjenoppfinne telefonen, vi kjem til å skrive historie i dag”. English: I dag, i dag, i dag, i dag, i dag, i dag, i dag, i dag, i dag, i dag, i dag, i dag, i dag, i dag, i dag, i dag, i dag, i dag, i dag, i dag, i dag, i dag, i dag, i dag, i dag, i dag, i dag, i dag, i dag, i dag, i dag, i dag, i dag, i"
"Ulempa med zoomobjektiv er at den fokale kompleksiteten og talet på objektivelement som krevst for å oppnå ei rekkje brennvidder, er mykje høgare enn med eit objektiv med fast brennvidde.","Nynorsk: Ulempa med zoomobjektiv er at den fokale kompleksiteten og talet på objektivelement som krevst for å oppnå ei rekkje brennvidder, er mykje høgare enn med eit objektiv med fast brennvidde. English: The use of the word ""objective"" in the English language is not restricted to the use of the word ""objective"" in the English language."
"Likt som med ein fjernsynskontroll nyttar konsollen to sensorar nær brukarens fjernsyn, for å triangulere sin posisjon i tredimensjonalt rom.","Nynorsk: Likt som med ein fjernsynskontroll nyttar konsollen to sensorar nær brukarens fjernsyn, for å triangulere sin posisjon i tredimensjonalt rom. English: The Norwegian Airline is a Norwegian airline, operated by Norwegian Air Shuttle. The Norwegian Airline is a Norwegian airline, operated by Norwegian Air Shuttle. The Norwegian Airline is a Norwegian airline, operated by Norwegian Air Shuttle."
Forskarar seier at dette dyret si fjørdrakt var kastanjebrunt på overdelen med ein bleik eller karotenoid-farga underdel.,"Nynorsk: Forskarar seier at dette dyret si fjørdrakt var kastanjebrunt på overdelen med ein bleik eller karotenoid-farga underdel. English: Forskarar, forskarer, forskarer, forskarer, forskarer, forskarer, forskarer, forskarer, forskarer, forskarer, forskarer, forskarer, forskarer, forskarer, forskarer, forskarer, forskarer, forskarer, forskarer, forskarer, forskarer, forskarer, forskarer, forskarer, forskarer,"
Forskarar ved universitetet sa at dei to samansetningane reagerer med kvarandre for å forme krystallar som kan blokkere nyrefunksjonen.,Nynorsk: Forskarar ved universitetet sa at dei to samansetningane reagerer med kvarandre for å forme krystallar som kan blokkere nyrefunksjonen. English: Forskarar ved universitetet sa at dei to samansetningane reagerer med kvarandre for å forme krystallar som kan blokkere nyrefunksjonen.
Dette gir ei oppløysing som er nesten fire gonger så høg som eit 35 mm negativ (3136 mm2 mot 864).,Nynorsk: Dette gir ei oppløysing som er nesten fire gonger så høg som eit 35 mm negativ (3136 mm2 mot 864). English: The fire gonger is a fire-making device that is used to make fires.
"Takka vere ein undersjøisk fiberoptisk kabel til Europa og breibandssatellitt er Grønland godt tilkopla, og 93 % av folket har tilgang til internett.","Nynorsk: Takka vere ein undersjøisk fiberoptisk kabel til Europa og breibandssatellitt er Grønland godt tilkopla, og 93 % av folket har tilgang til internett. English: The Norwegian government has been working on a new version of the Norwegian language, which is now called Norwegian."
"Google Translate er ein av dei mest leiande appane i denne kategorien, der det er mogleg med omsetjing utan nettilgang viss ein har lasta ned ønskte språkdata.","Nynorsk: Google Translate er ein av dei mest leiande appane i denne kategorien, der det er mogleg med omsetjing utan nettilgang viss ein har lasta ned ønskte språkdata. English: Google Translate is a free online translation service that translates text from English to Norwegian."
"Det har den same molekylstrukturen uansett om det er i gassform, flytande form eller fast form.","Nynorsk: Det har den same molekylstrukturen uansett om det er i gassform, flytande form eller fast form. English: The same is true for the same."
"Bruken av videoopptak har leia til viktige oppdagingar i tolkinga av mikro-uttrykk, rørsler i andlet som varer nokre millisekund.","Nynorsk: Bruken av videoopptak har leia til viktige oppdagingar i tolkinga av mikro-uttrykk, rørsler i andlet som varer nokre millisekund. English: The Norwegian Bokmål Dictionary."
Menneska har laga og brukt linser for forstørring i mange tusen år.,Nynorsk: Menneska har laga og brukt linser for forstørring i mange tusen år. English: The Norwegian language is a language of the Nordic countries.
Men ikkje berre dette. Eksperimentering blir òg brukt. Eit eksperiment er ein test som blir brukt til å eliminere ein eller fleire moglege hypotesar ved å stille spørsmål og gjere observasjonar.,Nynorsk: Men ikkje berre dette. Eksperimentering blir òg brukt. Eit eksperiment er ein test som blir brukt til å eliminere ein eller fleire moglege hypotesar ved å stille spørsmål og gjere observasjonar. English: The test is a test of the ability to read and write.
"Til slutt blei trehjula erstatta av jernhjul. I 1767 blei dei første skinnene som var laga utelukkande av jern, introduserte.","Nynorsk: Til slutt blei trehjula erstatta av jernhjul. I 1767 blei dei første skinnene som var laga utelukkande av jern, introduserte. English: I'm a very nice girl, I'm very."
"Mens dei fleste korta kan brukast til å ringe kvar som helst, er det nokre som spesialiserer seg på å tilby gunstige samtaleprisar til bestemte grupper land.","Nynorsk: Mens dei fleste korta kan brukast til å ringe kvar som helst, er det nokre som spesialiserer seg på å tilby gunstige samtaleprisar til bestemte grupper land. English: The best way to get started is to sign up for a free trial."
Dagens moderne forskingsteleskop er ofte enorme anlegg på avsidesliggande område med gunstige atmosfæriske forhold.,Nynorsk: Dagens moderne forskingsteleskop er ofte enorme anlegg på avsidesliggande område med gunstige atmosfæriske forhold. English: The best way to find out about the latest news and information about the NFL is to follow the NFL on Twitter.
Stålnåla flyt på toppen av vatnet som følgje av overflatespenning.,Nynorsk: Stålnåla flyt på toppen av vatnet som følgje av overflatespenning. English: The Norwegian Airline Company.
"35mm formatet er faktisk, litt forvirrande, 36mm i vidda og 24mm i høgda.","Nynorsk: 35mm formatet er faktisk, litt forvirrande, 36mm i vidda og 24mm i høgda. English: The Norwegian version of the Norwegian language is the Norwegian version of the English language."
Celler er faktisk så grunnleggande og viktige for studien av alt liv at dei ofte blir kalla «livets byggesteinar».,Nynorsk: Celler er faktisk så grunnleggande og viktige for studien av alt liv at dei ofte blir kalla «livets byggesteinar». English: The best way to learn is to read.
Leverandørar av personleg VPN (virtuelt privat nettverk) er ein framifrå god måte å omgå både politisk sensur og kommersiell IP-geofiltrering på.,Nynorsk: Leverandørar av personleg VPN (virtuelt privat nettverk) er ein framifrå god måte å omgå både politisk sensur og kommersiell IP-geofiltrering på. English: The Internet is a global network of information and communication technologies. The Internet is a global network of information and communication technologies. The Internet is a global network of information and communication technologies. The Internet is a global network of information and communication technologies. The Internet is a global network of information and communication technologies. The Internet is a global network of information and communication technologies. The Internet is a global network of information and communication technologies. The Internet is a global network of information and communication technologies. The Internet is a
"Stasjonen haldt fast retninga si, til tross for tapet av eit gyroskop tidlegare i romstasjonsoppdraget, heilt til enden av romvandringa.","Nynorsk: Stasjonen haldt fast retninga si, til tross for tapet av eit gyroskop tidlegare i romstasjonsoppdraget, heilt til enden av romvandringa. English: The Norwegian Airline is a Norwegian airline that operates flights from Oslo to Oslo."
"Personar med denne typen tenking har logisk tenking, og er i stand til å hugse mønster, løyse problem og jobbe med vitskaplege testar.","Nynorsk: Personar med denne typen tenking har logisk tenking, og er i stand til å hugse mønster, løyse problem og jobbe med vitskaplege testar. English: The best way to get a job is to work for a company that offers a good salary and benefits."
"Ozelotar likar å ete smådyr. Dei fangar gjerne aper, slangar, gnagarar og fuglar om dei kan. Nesten alle dyra som ozeloten jaktar på er mykje mindre enn desse.","Nynorsk: Ozelotar likar å ete smådyr. Dei fangar gjerne aper, slangar, gnagarar og fuglar om dei kan. Nesten alle dyra som ozeloten jaktar på er mykje mindre enn desse. English: Ozelot, ozelot, ozelot, ozelot, ozelot, ozelot, ozelot, ozelot, ozelot, ozelot, ozelot, ozelot, ozelot, ozelot, ozelot, ozelot, ozelot, ozelot, ozelot, ozelot, ozelot, ozelot, ozelot, ozelot, ozelot,"
"Nokre filmkamera i mellomformat brukar eit format på 6 x 6 cm, nærmare bestemt eit negativ på 56 x 56 mm.","Nynorsk: Nokre filmkamera i mellomformat brukar eit format på 6 x 6 cm, nærmare bestemt eit negativ på 56 x 56 mm. English: No-Kre filmkamera i mellomformat skall ut ut ut ut ut ut ut ut ut ut ut ut ut ut ut ut ut ut ut ut ut ut ut ut ut ut ut ut ut ut ut ut ut ut ut ut ut ut ut ut ut ut ut ut ut ut ut ut ut ut ut ut ut ut ut ut ut ut ut ut ut ut ut ut ut ut ut ut ut ut ut ut ut ut ut ut ut ut ut ut ut ut ut ut ut ut ut ut ut ut"
"Reisande bør òg halde seg informert om risiko for dårleg vêr som påverkar området, ettersom dette kan verke inn på reiseplanane.","Nynorsk: Reisande bør òg halde seg informert om risiko for dårleg vêr som påverkar området, ettersom dette kan verke inn på reiseplanane. English: The Norwegian Airline is a private airline operating on Norwegian Airway routes. The company operates a fleet of aircraft, including the Boeing 737-800, the Boeing 737-800i, the Boeing 737-800ii family, and the Boeing 737-800i family. The company operates a fleet of aircraft, including the Boeing 737-800, the Boeing 737-800i, the Boeing 737-800i family, and the Boeing 737-800i family."
"Bussar går frå busstasjonen (på andre sida av elva) heile dagen, sjølv om dei fleste, spesielt dei som har kurs mot aust og Jakar/Bumthang, går mellom 06.30 og 07.30.","Nynorsk: Bussar går frå busstasjonen (på andre sida av elva) heile dagen, sjølv om dei fleste, spesielt dei som har kurs mot aust og Jakar/Bumthang, går mellom 06.30 og 07.30. English: Buses are running from the airport to the city centre."
"Dei gir større stabilitet for ryttaren, men dette kan vere ein tryggleiksrisiko, fordi føtene kan sette seg fast i dei.","Nynorsk: Dei gir større stabilitet for ryttaren, men dette kan vere ein tryggleiksrisiko, fordi føtene kan sette seg fast i dei. English: The most common form of the word is'sweat'. The word'sweat' is also used in the following other languages: English, French, German, Italian, Spanish, Swedish, and Norwegian."
Dei fleste vanlege cruiseturane i Baltikum har eit lengre opphald i St. Petersburg i Russland.,"Nynorsk: Dei fleste vanlege cruiseturane i Baltikum har eit lengre opphald i St. Petersburg i Russland. English: The Baltic Sea is a large, open-water area of the Baltic Sea, in the Baltic Sea."
"Råda er baserte på at dei reisande ikkje skal stele, krenke eigedommar eller personar, ta del i den ulovlege marknaden, tigge eller på andre måtar utnytte andre menneske for eiga vinning.","Nynorsk: Råda er baserte på at dei reisande ikkje skal stele, krenke eigedommar eller personar, ta del i den ulovlege marknaden, tigge eller på andre måtar utnytte andre menneske for eiga vinning. English: The Norwegian Language is a language of the Norwegian people."
Det er mange ting du må tenke på før og når du skal reise ein stad.,Nynorsk: Det er mange ting du må tenke på før og når du skal reise ein stad. English: The Norwegian language is a language of the Norwegian people.
I varmen på dagtid kan dei reisande oppleve luftspeglingar som gir ein illusjon av vatn (eller andre ting).,"Nynorsk: I varmen på dagtid kan dei reisande oppleve luftspeglingar som gir ein illusjon av vatn (eller andre ting). English: I am a man, I am a woman, I am a man."
"Barnefamiliar er eit sjeldan syn, men nokre herberge lèt dei bu på privatrom.","Nynorsk: Barnefamiliar er eit sjeldan syn, men nokre herberge lèt dei bu på privatrom. English: Barnefamiliar er eit sjeldan syn, men nokre herberge lèt dei bu på privatrom."
