62003016	Faith	Cristuqui uc̈hum laycu ticzic̈ha . Nekztan jaknuz̈ munazizlaja , jalla nii uc̈humqui zizza . Uc̈humqui Yooz criichi jilanacz̈tan zuma munazizpanc̈ha , ticzcama .
43013001	Grace	Ima pascua pjijzta tjonan , Jesusaqui zizzic̈ha niiz̈ ticz ora wajitac̈ha , jalla nii . Niz̈aza zizzic̈ha , tii muntu eccu niiz̈ Ejpz̈quinz̈ okaquic̈ha , nii . Tii muntuquiz z̈ejlcan Jesusaqui niiz̈ pecta mazinaca walja k'aachichic̈ha , ultim werarapan . Ticzcama k'aachichic̈ha .
58003017	Sin	Nekztan Yoozqui pusi tunc wata ninacz̈tajapa z̈awjchic̈ha . Ninacaz̈ uj paatiquiztan z̈awjchic̈ha . Nekztan ninacaqui ch'ekti yokquin walja ticzic̈ha .
60001014	Recommendation	Anc̈hucc̈ha Yooz zuma cazñi maatinacaqui . Jaziqui zuma kamañchiz cjee . Ima Yooz maati cjican , tuquita ana wali paaz pecñi kuz jaru kamchinc̈hucc̈ha . Yooz kamaña ana pajchinc̈hucc̈ha .
45011032	Grace	Yoozqui tsjii pariju tjapa z̈oñinacz̈ ujnaca tjeezic̈ha , niiz̈quiz ana cazta , jalla nii . Jalla nuz̈ tjeezic̈ha tjapa z̈oñinacz̈quiz tsjii pariju niiz̈ okzñi kuz tjeezjapa .
66006006	Description	Nekztanaqui z̈ejtñinacz̈ taypiquiz tsjii jora nonzinc̈ha . Nii joraqui tuz̈ cjichic̈ha : — Pajk paaztan tsjii kilo trigo kjayasac̈ha . Niz̈aza pajk paaztan c̈hjep kilo siwatu kjayasac̈ha . Aceitimi vinumi tira z̈elaquic̈ha .
59004010	Recommendation	Yooz Jilirz̈ yujcquiziqui humilde kuzziz cjee . Nekztan Yoozqui anc̈hucaquiz honorchiz cjiskataquic̈ha .
44017031	Grace	Nekztanaqui Yoozqui tsjii tjuñi utchic̈ha , tjapa tii muntuquiz z̈ejlñi z̈oñinaca werara pjalzjapa . Tsjii Yooziz̈ illzta z̈oñiqui tjapa z̈oñinaca pjalaquic̈ha , Yooz Ejpz̈ cuntiquiztan . Yoozqui nii illzta z̈oñi ticziquiztan jacatatskatchic̈ha . Jalla niz̈tiquiztan Yoozqui kjanapacha tjeezic̈ha , nii z̈oñiqui illztatac̈ha pjalñijapa , jalla nii . Jaziqui niiz̈quin criya . — Nuz̈ paljaychic̈ha Pabluqui .
43019002	Description	Nekztan zultatunacaqui ch'apquiztan tsjii pilluz̈takaz paachic̈ha . Jalla nii paatiz̈tan Jesusiz̈ achquiz tewz̈inchic̈ha . Niz̈aza jilirz̈ murat zquiti tjutzic̈ha .
54005014	Recommendation	Jalla niz̈tiquiztan tur z̈ew maatakanacaqui zalz waquizic̈ha . Zalzcu , ocjalchiz cjesac̈ha . Niz̈aza kjuya luraña cwitiñi cjesac̈ha . Jalla niz̈ta zuma kamañ quintra z̈oñinacaqui icliz z̈oñinacz̈quiz anaz̈ iñarasac̈ha .
43014011	Faith	Wejrmi Yooz Ejpmi tsjii kuzzizza . Jalla nii criyaquic̈ha , jaziqui . Weriz̈ chiitiquiztan ana criyasaz̈ niiqui , weriz̈ paata obranaca cherz̈cu mekaz criyalla .
66020014	Violence	Ticzmi niz̈aza ticzi z̈oñinacz̈ yokami ana iya z̈elaquic̈ha . Asñi ujquin tjojttatac̈ha . Nii asñi uj kotquin sufrisqui segundo ticz cjic̈ha .
58009026	Description	Wilta wilta wilana cunta ticztasaz̈ niiqui , tii muntu kalltiquiztanpacha wilta wilta sufrican ticztasac̈ha . Tuquita timpu tucuzinta cjiscu tsjii wiltakaz Jesucristuqui parizquichic̈ha . Nekztan niiz̈ ljoc tjawkz̈cu ticzic̈ha , tjapa ujnacquiztan z̈oñinaca liwriizjapa .
44013018	Description	Pusi tunc watanaca ch'ekti yokaran ojklayan , Yoozqui ninacz̈ anawali kamzquiztan awantichic̈ha .
46011033	Recommendation	Wejt jilanaca , cullaquinaca , c̈hjeri lujlzjapami niz̈aza Santa Cena paazjapami ajcz̈cu , zapa mayni tjewz waquizic̈ha parti criichi z̈oñinacaz̈ zumpacha ajczquiscama .
66006012	Violence	Jalla nekztanaqui nii Uuzaz̈takazqui sexta estampilla wjajrzic̈ha . Jalla nuz̈ wjajrtan , wejrqui cherchinc̈ha , yoka ancha chekjinskatatc̈ha . Niz̈aza tjuñimi tsokchi cjissic̈ha , lut zquitiz̈takaz . Niz̈aza jiizmi ljok cjissic̈ha .
58011035	Violence	Yoozquin kuzziz cjen Yoozqui yekjap maatakanacz̈tajapa ticzinaca jacatatskatchic̈ha . Yoozquin kuzziz cjen yekjap z̈oñinacazti sufriskattac̈ha . Pero ninacaqui ana Jesucristo nicchic̈ha , sufrisquiztan liwriita cjisjapa . Antiz tirapan tjurt'ichic̈ha , ticz cjenami . Jalla nuz̈ ticzic̈ha , jacatatz̈cu juc'ant zuma kamañchiz cjisjapa .
44016037	Violence	Pabluzti nii zultat policianacz̈quiz paljaychic̈ha , tuz̈ cjican : — Wejrnacqui roman parti z̈oñinactc̈ha . Tjapa tii wajtquiz z̈ejlñinacz̈ yujcquiz wejrnaca wjajtchic̈ha , ana wejtnacaquiz zumpacha pewcz̈cu . Nekztanaqui inapacha wejrnac carsilquiz majcchic̈ha . ¿ Jaziqui anc̈hucqui wejrnaca chjojzaka cuts pecya ? ¡ Anaz̈ cjesac̈ha ! Antiz ninacaj persuna wejrnac tii carsilquiztan jwesi tjonla .
45013009	Recommendation	Yooz mantita ortinanacaqui tuz̈ cjic̈ha : “ Anac̈ha adulteriuquiz z̈ejlzqui . Anac̈ha z̈oñi conzqui . Anac̈ha tjañi zaazqui . Anac̈ha toscara chiizqui . Anac̈ha yekja z̈oñz̈ta cusasa zmazqui ” . Jalla nii mantita ortinanacami niz̈aza tjapa mantitanacami cumplitaz̈ cjequic̈ha , tuz̈ kamcan : “ Jaknuz̈ta am persun kuztan zuma munazic̈haja , jalla nuz̈ z̈oñinacz̈tan zuma munaziz waquizic̈ha ” .
62003003	Faith	Jakziltat Jesucristo tjewz̈aja , jalla niiqui c̈hjul uj paaznacami ecc̈ha , ana ujchiz cjisjapa ; Jesucristuqui ana ujchizza , jalla niz̈tapacha cjisjapa .
45007022	Faith	Wejt kuzquizpacha Yooz kuzcamapan paaz ancha pecuc̈ha .
50004004	Recommendation	Jesucristo Jiliriz̈ cjen cuntintupanz̈ cjee c̈hjulorami . Wilta cjiwc̈ha : cuntintuz̈ cjee .
66001012	Description	Jalla nekztanaqui wir kjutñi kjutzinc̈ha cherzjapa , jectpan niz̈ta paljayzqui , nuz̈ cjican . Jalla nuz̈ kjutz̈cu tsjii pakallawk kor cantilero cherzinc̈ha .
58003018	Sin	Niz̈aza Yoozqui tsjii juramentuz̈tan chiiz̈inchic̈ha , “ Anapan wejt famillquiz luzkatac̈ha anc̈hucqui wejttan chica jeejzjapa ” , cjican . Jalla ninacac̈ha Yooz taku ana cazñinacaqui .
43010008	Sin	Ima weriz̈ tjonan , z̈oñinacaqui tjonchic̈ha , “ Yoozquiztan tjonuc̈ha ” , cjicanaqui . Pero tjañicamac̈ha tjapa nii tjonchi z̈oñinacaqui . Uuza tjangzñinacac̈ha ninacaqui . Pero ninacz̈ wirquiziqui wejt uuzanacaqui ana apzic̈ha .
60002018	Recommendation	Piyunanaca , anc̈hucqui patrunanacz̈ mantuquiz cjee , ninacz̈quiz rispitcan . Zuma kuzziz , niz̈aza okzñi kuzziz patrunchizlaj niiqui , niiz̈ mantuquiz cjee . Niz̈aza ana zuma patrunchizlaj niiqui , niiz̈ mantuquiz zakaz cjee .
44006013	Description	Niz̈aza toscar tisticunaca apantiz̈quichic̈ha . Nii toscar tisticunacaqui tuz̈ cjichic̈ha : — Tii z̈oñiqui tirapan tii Yooz timplu quintra chiiñic̈ha , niz̈aza Yooz lii quintra chiiñic̈ha . Nuz̈upanz̈ parliñic̈ha .
47005018	Faith	Ew kuzmi niz̈aza ew kamañami Yooziz̈ tjaatapanc̈ha . Cristuz̈ cjen Yoozqui uc̈humnaca pertunchic̈ha , niiz̈tan uc̈humnacatan zuma cjisjapa . Niz̈aza Yoozqui wejrnaca utchic̈ha parti z̈oñinacz̈quiz Yooz pertunz puntu paljayajo , Cristuz̈ cjen z̈oñinacz̈tan Yooztan zuma cjesac̈ha , cjican .
59005010	Recommendation	Jilanaca , tuquita Yooztajapa chiiñi z̈oñinacaz̈ puntu cjuñzna . Kjaz̈ta sufriz cjenami , Yoozquin tjurt'ichic̈ha pasinziz kuztan . Niz̈tapacha cjee .
44002021	Faith	Nii timpuquiziqui jakziltat liwriita cjisjapa Yooz Jilirz̈quin mayizic̈haja , jalla niiqui liwriitaz̈ cjequic̈ha ” . Jalla nuz̈ cjijrchic̈ha Joelqui .
66007012	Faith	Nii anjilanacaqui Yooz rispitcan tuz̈ cjichic̈ha : “ Jalla nuz̈oj cjila . Uc̈hum Yooztajapa watay wata honora waytiz̈intaj cjila , niz̈aza wiñaya rispittaj cjila . Uc̈hum Yoozza zizñi zizñipanqui . Niiz̈quiz wiñaya gracias cjila . Niz̈aza niiz̈quiz honora waytiz̈intaj cjila . Uc̈hum Yoozqui wiñayjapa tjapa azziz cjila , nizaza poderchiz . Jalla nuz̈oj cjila . Amén ” .
60003003	Recommendation	Zawnctan zquiti ist'asnacquiz anac̈ha kuz tjaazqui . Persun c'achja chjijcz̈ta ach charquiz , niz̈aza zquiti ist'asnacquiz , niz̈aza ancha c'achja zquitinacquiz , jalla niz̈tanacquiz anac̈ha kuz tjaasqui .
55001008	Faith	Jaziqui amqui anapanim azaquic̈ha , uc̈hum Jesucristo Jilirz̈ favora paljaycan . Wejrqui Jesucristuz̈ cjen carsilquiz chawjctitc̈ha . Jalla nuz̈ cjenami amqui ana wejtquiztan azaquic̈ha . Amqui Yooz zuma liwriiñi taku paljayñiz̈ cjen zakam sufric̈ha . Nii sufrisquiztan ana jiwjatalla . Yoozqui amquiz azi tjaaz̈caquic̈ha tjurt'izjapa .
43017019	Description	Wejtquiz criichi z̈oñinacz̈tajapa ancha kuztanc̈ha wejrqui ticzjapa . Niz̈aza am werar tawk jaru kamtiquiztan tii z̈oñinaca t'akz̈inuc̈ha amta cjeyajo .
66003002	Recommendation	Anc̈hucqui ana zuma kamañanaca eca . Zuma kamañquiz tjurt'iñi kuzziz cjee . Tira anawali kamañchizlaj niiqui , castictaz̈ cjequic̈ha . Wejrqui anc̈huca paata obranaca yatisinzinc̈ha , Yooz yujcquiz anawalic̈ha , nii .
66016004	Description	Jalla nekztanaqui tercer anjilaqui niiz̈quiz intirjita anawalinaca cutzic̈ha pujunacquizimi jalzurinacquizimi . Tjapa kjazqui ljoc tucchic̈ha .
45005002	Faith	Jesucristuz̈quin kuzziz cjen uc̈humqui Yooz partiquiz luzzinc̈humc̈ha . Jalla nii partiquiz uc̈humnacaqui panz̈ z̈ejlc̈ha . Jalla nuz̈ z̈ejlcan cuntintuz̈ tjewz̈a , Yooziz̈ tjaata honora tanz ora , Yooztan honorchiz cjisjapa .
49005005	Sin	Anc̈hucqui tuz̈ zizza . Jakziltat adulteriuquiz ojklayñi cjec̈haja , jalla niiqui anaz̈ arajpach wajtquin luzasac̈ha , Cristuz̈tanami Yooz Ejpz̈tanami chica kamzjapa . Niz̈aza ana zuma kamñinacami , niz̈aza zmazñinacami , jalla ninaca zakaz ana arajpach wajtquin luzasac̈ha . Ninacaqui Cristuz̈ partiquizimi Yooz partiquizimi anapanz̈ cjesac̈ha . Tsjii zmazñi z̈oñiqui , tsjii z̈oñiz̈ paata yooz rispitñi z̈oñi iratac̈ha .
58011008	Faith	Niz̈aza Abrahamqui Yoozquin kuzziz cjen , Yooz mantita ana jayrazcu cazzic̈ha . Yoozqui Abrahamz̈quiz cuchanzjapa kjawzic̈ha , yekja yokquin okajo . Niz̈aza Yoozqui Abrahamz̈quiz tuz̈ cjichic̈ha : “ Wiruñ wejrqui amquiz nii yoka tjaac̈ha , irinsa cunta ” . Yooz mantita jaru ojkchic̈ha . Jakziquin ojktc̈haja , jalla nii ana zizatc̈ha . Jalla nuz̈ cjenami Abrahamqui Yooz tawk jaru ana jayrazcu ojkñi z̈elatc̈ha .
49005018	Recommendation	Niz̈aza anac̈ha vinz̈tan licchi cjisqui . Jalla nuz̈ licasaz̈ niiqui , zuma kamañquiztan tsjii kjutñi chjichta cjesac̈ha . Antiz anc̈huca kuztan Espíritu Santuz̈tan tsjii kuzziz cjee .
61002002	Sin	Niz̈ta anawali tjaajintiquiz walja criichi z̈oñinacaqui kuz tjaaquic̈ha . Nekztan anazuma kamaquic̈ha . Jalla ninacaz̈ anazuma kamtiquiztan z̈oñinacaqui werar Yooz kamañ quintra iñaraquic̈ha .
49002018	Faith	Jesucristuz̈ cjen niz̈aza Yooz Espíritu Santuz̈ cjen judío z̈oñinacami ana judío z̈oñinacami , tjapa z̈oñinacaqui Yooz Ejpz̈quin macjatz atc̈ha .
44021025	Recommendation	Niz̈aza wejrnacqui nacjuñta wajtchiz ana judío criichinacz̈quiz cjijrchinc̈ha , tuz̈ cjican : “ Z̈oñiz̈ paata yoozquiz wilana jawkta chjizwi anac̈ha lujlsqui . Niz̈aza jora zkenzcu conta animal chjizwimi anac̈ha lujlsqui . Niz̈aza luctakz̈tanami maatakz̈tanami anac̈ha adulteriuquiz ojklayzqui ” . — Jalla nuz̈ Pabluz̈quiz chiichic̈ha nii icliz jilirinacaqui .
44005003	Sin	Jalla nekztanaqui Pedruqui cjichic̈ha : — Ananías , ¿ kjaz̈tiquiztan am kuzquiz Satanás luzzita ? ¿ Espíritu Santuz̈quiz tiz̈ta k'otsjapaqui ? Nii yok tuyta paazqui t'ecsamc̈ha .
49004014	Recommendation	Jalla niz̈ta zuma kamñi intintazñi cjican , uc̈humqui anaz̈ tsjii ocjalaz̈takaz cjequic̈ha , c̈hjul ew tjaajintiquizimi criizjapaqui . Niz̈aza uc̈humqui anaz̈ tsjii kjutñi chjichta cjesac̈ha . Niz̈aza uc̈humqui nii ana wal mañuz z̈oñinacz̈quiz ana incallskataquic̈ha . Nii ana wal z̈oñinacaqui c̈hjulumi paac̈ha , niz̈aza chiic̈ha , parti z̈oñinaca incallzjapa , niz̈aza tsjii kjutñi chjichjapaqui .
46006009	Sin	Ana wali kamañchiz z̈oñinacaqui anaz̈ arajpach wajtquin Yooztan chica kamasac̈ha . ¿ Jalla nii ana ziz anc̈hucjo ? Jaziqui anc̈hucqui anac̈ha incallta cjisqui . Arajpachquin anaz̈ okaquic̈ha tii z̈oñinacaqui : adulteriuquiz ojklayñinaca , niz̈aza z̈oñiz̈ paata yooz sirwiñinaca , niz̈aza pampa cjicjiñi zultirunaca , niz̈aza luctakpora tsjii luctakz̈tan tsjii maatakz̈tantakaz cjeyasñinaca .
58010025	Recommendation	Niz̈aza yekjap criichi z̈oñinacaqui zapa domingo ana ajcajczñic̈ha . Ana niz̈ta irata kama . Antiz uc̈humqui porapat zumpacha p'ekinchayasa , zuma kamzjapa . Jesucristuz̈ tjonz tjuñi z̈catz̈inz̈quic̈ha . Jalla niz̈tiquiztan juc'anti uc̈humqui porapat p'ekinchayastanc̈ha .
51003005	Sin	Jalla niz̈tiquiztan anc̈huca tuquita ana wal kamaña liwj jayta . Anaz̈ adulteriuquiz ojklayzqui . Anac̈ha luctak z̈oñiqui yekja maatak z̈onatan ojklayzqui . Anac̈ha anc̈huca ana wal paaz pecñi kuz jaru ojklayzqui . Anac̈ha c̈hjul ana walimi peczqui . Anac̈ha yekja z̈oñz̈ c̈hjultakimi zmazqui . Jalla nuz̈ zmaznaquiz̈ niiqui , z̈oñiz̈ paata yoozquiz rispitaz̈okazza . Jalla nii anawali paaznacquiztan liwj jayta .
52005008	Faith	Anc̈hucqui ana niz̈ta cjee . Uc̈humnacaqui Yooz kjan jiczquiz kamiñc̈humc̈ha . Jalla niz̈tiquiztan persun kuz zuma Yooz jiczquiz kamzjapa , cwitasa . Yoozquin tjapa kuztan cjee , Yooz anc̈huc Satanasquiztan tsijtsinajo . Niz̈aza criichi z̈oñinacz̈tan zuma munaziza . Niz̈aza anc̈hucqui liwriiz tjuñi zuma listuz̈ tjewz̈naquic̈ha . Jalla nuz̈ kaman armichiztakaz cjequic̈ha . Jalla niz̈tiquiztan Satanasaqui anc̈huc ana atipasac̈ha .
55001007	Grace	Yoozqui uc̈humquiz eksñi kuzziz ana cjiskatchic̈ha . Antiz tjup kuzziz cjiskatchic̈ha , niz̈aza zuma munaziñi kuzziz cjiskatc̈hic̈ha , niz̈aza zuma pinsiñi kuzziz cjiskatchic̈ha .
62002004	Sin	Jakzilta z̈oñit ana Yooz mantita jaru kamc̈haj niiqui , anaz̈ chii atasac̈ha “ Yooz pajuc̈ha ” , cjicanaqui . “ Yooz pajuc̈ha ” , cjesaz̈ niiqui , toscaraz̈ chiic̈ha . Anazum kuzzizza nii z̈oñiqui .
50002002	Faith	Jalla niz̈tiquiztan anc̈hucqui tsjii kuzziz cjee , porapat zuma munazican , niz̈aza zuma kamcan . Jalla nuz̈ anc̈hucqui kamaquiz̈ niiqui , nekztan wejrqui juc'ant cuntintul cjeec̈ha .
43007030	Description	Jalla niz̈ta chiitiquiztan ninacaqui preso tanz pecatc̈ha . Jesusiz̈ preso tanta cjis oraqui imazitac̈ha . Jalla niz̈tiquiztan ana jakziltami tanzñi atchic̈ha .
54006018	Recommendation	Niz̈aza nii wali jiru kamñi z̈oñinacz̈quiz mantaquic̈ha tuz̈ kamajo . Ninacaqui zuma obranaca paaz waquizic̈ha . Nekztan zuma obranacaz̈ paachiz̈ cjen ultim werar wali jiruz̈ cjequic̈ha Yooz yujcquinaqui . Niz̈aza ninacaqui zuma kuztan ninacz̈ cusasanacz̈tan z̈oñinacz̈quiz yanapz waquizic̈ha . Ana zkutu kuzziz cjis waquizic̈ha .
43018030	Description	Z̈oñinacaqui tuz̈ kjaazic̈ha : — Tii z̈oñiqui ana c̈hjul pajk ujnacami paatasaz̈ niiqui , anal wejrnacqui tii intirjitasac̈ha .
45014006	Faith	Tsjii criichi z̈oñiqui tsjii chawc tjuñi wartaquiz̈ niiqui , Yooz honora waytita cjisjapa wartiyaquic̈ha . Tsjii criichi z̈oñizti nii tjuñi ana wartc̈haja , jalla niiqui Yooz honora waytita cjisjapa niz̈ta ana wartc̈ha . Niz̈aza tsjii c̈hjulumi lujlñi z̈oñiqui Yoozquin gracias cjiz̈cu jalla nuz̈ lulaquiz̈ niiqui , Yooz honora waytita cjisjapa lulaquic̈ha . Niz̈aza yekja criichi z̈oñiqui ana chjizwi lulaquiz̈ niiqui , Yooz honora waytita cjisjapa ana lujlc̈ha . Niz̈aza ana lujlchiz̈ cjen niiqui Yoozquin gracias cjican chiiz waquizic̈ha .
45012012	Recommendation	Arajpach zumanaca tjewz̈can , cuntintuz̈ kama . Llaquinacaz̈ tjonanami pasinziz kuzziz kama . Yoozquin parlicanpan z̈ela .
44024023	Description	Nekztanaqui Félix chawc jiliriqui teniente capitanz̈quin mantichic̈ha Pablo tira kjuyquiz chawjcta cwitajo . Pero Pabluz̈ amigonacz̈quiz permiso tjaachic̈ha , Pablo atintizjapa .
46013007	Description	C̈hjul pruebanaca tjonanami zuma munaziñi kuzziz z̈oñiqui awantic̈ha . Niz̈aza zuma munaziñi kuzziz z̈oñiqui parti criichinacz̈ puntuquiztan persun kuzquiz cjic̈ha ; “ Zuma kuzzizlan ” , cjican . Niz̈aza zuma munaziñi kuzziz z̈oñiqui parti criichinacz̈ puntuquiztan persun kuzquiz : “ Zuma kamac̈han ” , cjic̈ha . Niz̈aza c̈hjul pruebanacaz̈ tjonanami Yoozquin tjurt'iñi kuzziz cjequic̈ha zuma munaziñi kuzziz z̈oñiqui .
47004013	Faith	Yooz takuqui tuz̈ cjic̈ha : “ Yoozquin kuzziz cjen , wejrqui chiyuc̈ha ” . Jalla niz̈ta irata wejrqui Yoozquin kuzzizza , sufrita kamcanami . Jalla niz̈ta kuzziz cjen , chiichiyuc̈ha , Cristuz̈ puntu paljaycan .
52005014	Recommendation	Jilanaca , cullaquinaca , anc̈hucaquiz chiiz̈inz̈cuc̈ha , jayrazñi criichinacz̈quiz zumpacha trabajzjapa chiiz̈inajo , niz̈aza ururñi kuzziz criichinaca tjup kuzziz cjeyajo , niz̈aza llajllasñi kuzziz criichinaca tjurt'iñi kuzziz cjiskatajo . Niz̈aza tjapa criichinacz̈tanami pasinziz kuzziz cjee .
66016010	Description	Jalla nekztanaqui quinto anjilaqui niiz̈quiz intirjita anawali cutzic̈ha , jakziquin nii anawal animalaqui mantiñi julzic̈haja , jalla nicju . Jalla nekztanaqui nii mantita yokaqui ancha zumchi cjissic̈ha . Jalla nuz̈ cjen z̈oñinacaqui persun las ch'atsic̈ha ; ancha t'akjizichic̈ha .
48006016	Grace	Jakziltat ew lii kamañ jaru kamc̈haja , jalla ninacaqui ultim werar Yooz partir z̈oñinacac̈ha . Jalla ninacz̈tan Yooztan zumaj cjila , niz̈aza Yoozqui ninacz̈quiz okz̈la .
44018025	Faith	Nii Apoloz̈quiz Yooz kamañ puntu walja tjaajintatac̈ha . Jaziqui walja tjapa kuztan Yooz taku parliñitac̈ha . Juanz̈ bautistakaz cjenami Jesucristuz̈ puntuquiztan walja kjana tjaajinchic̈ha .
46010031	Recommendation	Anc̈hucaquiz tuz̈ kjaaznuc̈ha . C̈hjeri lujlzmi , c̈hjulumi paazmi Yooztajapa honora waytiz waquizic̈ha .
62002027	Recommendation	Jesucristuqui Yooz Espíritu Santo anc̈huca kuzquiz cuchanz̈quichic̈ha . Jalla niz̈tiquiztan nii Espíritu Santuqui anc̈hucaquiz tjaajinc̈ha . Jaziqui yekja tjaajiñi espíritu anaz̈ pecsa anc̈hucqui . Yooz Espíritu Santuz̈ chekan weraraqui tjaajinc̈ha . Anaz̈ toscaranaca tjaajnasac̈ha . Cristuz̈tan tsjii kuzziz kama ; jalla nuz̈ tjaajinc̈ha Espíritu Santuqui . Niz̈taqui niiz̈ tjaajintacama kama .
59002026	Faith	Tsjiillazakaz cjiwc̈ha . Tsjii z̈oñiqui ticz̈cu , animu ojkc̈ha , janchi inakazza . Niz̈tapachaz̈ tsjii ana zuma kamñi z̈oñiqui ticziz̈takaz z̈ejlc̈ha . Ana z̈ejtz wirchizza . Inakaz chiic̈ha , “ Yoozquin kuzziztc̈ha ” cjicanaqui .
44027035	Description	Jalla nuz̈ chiiz̈cu Pabluqui tsjii t'anta tanzic̈ha . Niz̈aza Yooz Ejpz̈quin sparaquiz̈ cjichic̈ha tjapa nii z̈ejlñi z̈oñinacz̈ yujcquiz . Jalla nekztanaqui nii t'anta kjolz̈cu lujlchic̈ha .
44015020	Sin	Tiikaz uc̈humqui ninacz̈quin cjijrasac̈ha , tuz̈ cjican : “ Z̈oñiz̈ paata yoozquin wilana jawkta chjizwi anac̈ha lujlsqui . Niz̈aza anac̈ha adulteriuquiz ojklayzqui . Niz̈aza jora zkenzcu conta animal chjizwimi anac̈ha lujlsqui . Niz̈aza c̈hjul animal ljocmi anac̈ha lujlsqui ” . Jalla niikaz cumplistanc̈ha nii yekja wajtchiz criichinacaqui .
44023003	Sin	Pabluzti kjaazic̈ha , tuz̈ cjican : — Pizc kuzziz z̈oñi , Yoozqui am casticaquic̈ha . Amqui tekz julzamc̈ha , uc̈hum lii jaru wejr jusjizjapa . Jaziqui , ¿ kjaz̈tiquiztan amqui uc̈hum lii quintra wejr kijchnajo mantichamtajo ?
45008001	Description	Jesucristuz̈ partiquiz z̈ejlñi z̈oñinacaqui ana Yooziz̈ casticta cjequic̈ha . Ninacaqui Yooz Espíritu Santuz̈ kuzcama kamc̈ha ; uj paaz pecñi kuzcama ana kamc̈ha .
52005009	Grace	Yoozqui uc̈humnaca ana utchic̈ha casticta cjisjapa . Pero Yoozqui uc̈humnaca utchic̈ha , zuma liwriita wira tanzjapa Jesucristo Jilirz̈ cjenaqui .
66020008	Violence	Jalla nuz̈ cutztiquiztan Satanás diabluqui ulnaquic̈ha tjapa tii yokquiz z̈ejlñi nacionanaca incallzjapa . Gog cjita naciona , niz̈aza Magog cjita naciona niz̈aza tjapa nacionanacz̈quiz incallz̈cu , quira zalzjapa ajcskataquic̈ha . Jalla nii nacionanacchiz zultatunacaqui walja tamac̈ha , kot at pjilaz̈takaz . Nuz̈ cherchinc̈ha .
46006011	Grace	Ima Yoozquin criicanaqui yekjap anc̈hucqui niz̈tatac̈ha . Anziqui Jesucristo Jiliriz̈ cjen , niz̈aza Yooz Espíritu Santuz̈ cjen anc̈huca ujnacaqui pertuntac̈ha . Jalla niz̈tiquiztan anc̈hucqui Yooz partiquiz cjissic̈ha , niz̈aza Yooz yujcquiziqui walikaz ana ujchiz cjissic̈ha anc̈huca ujquiztan liwriita .
55001012	Faith	Jalla niz̈tiquiztanpacha wejrqui ancha sufruc̈ha tii carsilquiz chawjckatzcama . Jalla nuz̈ cjenami wejrqui anapan azuc̈ha , werar Yooztan tsjii kuzziz cjen . Werar arajpach Yoozquinpanz̈ kuz tjaachinc̈ha . Niz̈aza tuz̈ cjiwc̈ha , wejt Yoozqui walja azzizza . Jaziqui niiqui weriz̈ cumpjiita wira cuitaquic̈ha Jesucristo tjonz tjuñicama . Jalla niic̈ha zuma werar razunaqui .
49006018	Faith	Espíritu Santuz̈ anc̈huca kuzquiz z̈elan , anc̈hucqui Yoozquin tirapan mayiza , niiz̈quin tjurt'ichi cjisjapa . Jalla nuz̈ tjurt'ichi cjisjapaqui , naynay z̈ela , ana llajlli kuzziz cjee . Niz̈aza tjapa Yooz partiquiz z̈ejlñi z̈oñinacz̈tajapa mayizina .
52001001	Grace	Wejr Pabluqui , Silvanuz̈tan , Timoteoz̈tan , tii cartal cjijrz̈cuc̈ha anc̈huc Tesalónica wajtchiz z̈oñinacz̈quin . Nii wajtquiz icliz z̈oñinacc̈hucc̈ha anc̈hucqui . Niz̈aza Yooz Ejpz̈tan Yooz Majchtan tsjii kuzzizc̈hucc̈ha . Jalla niz̈tiquiztan uc̈hum Yooz Ejpz̈tan , niz̈aza uc̈hum Jesucristo Jiliriz̈tan anc̈hucaquiz yanapt'ila . Niz̈aza zuma cuntintu kuzziz walikaj kamkatla .
50004005	Faith	Tjapa z̈oñinacaqui anc̈huc zuma kuzziz pajla . Jesucristo Jiliriqui wajillaz̈ tjonaquic̈ha .
46011026	Faith	C̈hjulorat tii Santa Cena cuzturumpi paachaj niiqui , anc̈hucqui tjeez̈a Jesucristo ticzic̈ha anc̈huca laycu , jalla nii . Jalla nii cuzturumpi paaz waquizic̈ha , Jesucristo Jiliriz̈ tjonzcama .
59005015	Faith	Yoozquin tjapa kuztan mayizaquiz̈ niiqui , nii laa z̈oñi c̈hjetnaquic̈ha . Jesucristo Jiliriqui nii laa z̈oñi z̈aazkataquic̈ha . Niz̈aza nii laa z̈oñiqui ujchiz z̈elaquiz̈ niiqui , pertuntaz̈ cjequic̈ha .
55001003	Faith	Wejrqui majiñami weenami Yoozquin mayizican , am cjuñuc̈ha . Am cjuñz̈cu , wejrqui amiz̈ cjen tirapan Yoozquin sparaquiz̈ cjiwc̈ha . Yoozquin tjapa kuztan lijituma sirwuc̈ha . Jaknuz̈t wejt tuquita atchi ejpnaca Yoozquin zuma sirwitc̈haja , jalla nuz̈ Yoozquin sirwuc̈ha .
66006016	Description	Jalla ninacaqui kjawchic̈ha , tuz̈ cjican : — Curunaca , maznaca , wejtnaca juntuñ tjojtz̈ca . Wejrnac chjojzna , julzi mantiñiz̈ yujcquiztan . Niz̈aza wejrnac chjojzna nii z̈awjchi Uuzaz̈takazquiztan , ana casticta cjisjapa .
66002017	Description	Jakziltat nonzñi cjuñchiz cjec̈haja , nonz̈la , Espíritu Santuz̈ icliz z̈oñinacz̈quiz chiitaqui . Jakziltat anawalinacquiztan atipac̈haja , jalla niiz̈quin ana pajta maná tjaa-ac̈ha , lujlzjapa . Niz̈aza niiz̈quin tsjii chiw maz tjaa-ac̈ha . Niz̈aza chiw mazquiz niiz̈ ew tjuu cjijrtaz̈ cjequic̈ha . Nii ew tjuuqui ana jakziltami zizza , nii tanzñi z̈oñikaz zizaquic̈ha ” .
61002003	Sin	Ancha paaz paca peccu , nii anawali tjaajiñi z̈oñinacaqui toscar tawkz̈tan anc̈hucaquiz incallaquic̈ha . Nekztan anc̈huca paaz tanznaquic̈ha . Jalla nuz̈ cjen ninacaqui ultimupan tantaz̈ cjequic̈ha . Tuquitanpacha Yoozqui ninaca utchic̈ha casticta cjisjapa .
53002011	Sin	Jalla niz̈tiquiztan Yoozqui ninaca jakjurpaychic̈ha , incallta cjeyajo werar Yooz taku ana criiñiz̈ cjen . Niz̈aza nii ana liwriita z̈oñinacaqui toscar takupan criyaquic̈ha .
45002024	Sin	Cjijrta Yooz takuqui razunapanz̈ chiic̈ha . Yooz takuqui tuz̈ cjic̈ha : “ Anc̈hucaz̈ uj paachiz̈ cjen yekja wajtchiz z̈oñinacaqui ultim werar Yooz quintraz̈ chiic̈ha ” .
55003008	Sin	Jalla niz̈takaztac̈ha pucultan yatirinacaqui , Janes cjita z̈oñz̈tan niz̈aza Jambres cjita z̈oñz̈tan . Jalla ninacaqui Moisés quintra paachic̈ha . Jalla niz̈ta irata nii ana wal kamñinacaqui werar Yooz tawk quintra paac̈ha . Niz̈aza nii ana wal kamñi z̈oñinacaqui ana zum pinsamintuchiz tsjii kjutñipan chiiñic̈ha “ Yoozquin kuzziztc̈ha ” cjicanaqui . Pero zumpacha tantiita cjequic̈ha . Nekztan ninacz̈ ana zuma kuz kjanapacha tjeez̈ta cjequic̈ha , tjapa z̈oñinacaz̈ ninacz̈ puntuquiztan werara zizajo .
66003019	Recommendation	Jakziltiz̈tan wejrqui zuma munazic̈haja , jalla niiz̈quiz chiiz̈inac̈ha . Niz̈aza zuma ewjt'uc̈ha , niiz̈ kamaña azquichta cjeyajo . Jalla niz̈tiquiztan weriz̈ chiiz̈intiquiztan , anc̈hucqui ‘ ujchizpantc̈ha ’ cjis waquizic̈ha . Niz̈aza wejtquiz tjapa kuztan cjis waquizic̈ha .
45005001	Faith	Jalla niz̈tiquiztan Yooz yujcquiz ana ujchiz , niz̈aza zuma kuzziz cjen , Yoozqui anac̈ha uc̈hum quintra . Jesucristo Jiliriz̈ cjen , niz̈aza niiz̈quiz kuzziz cjen uc̈humtan Yooztan walikazza .
54004016	Recommendation	Jaziqui am persun kuzquizimi niz̈aza amiz̈ tjaajintanacquizimi cuitaza , zumapan cjisjapa . Weriz̈ chiiz̈intanaca tirapan cjuñzna . Jalla nuz̈ zuma cjuñznaquiz̈ niiqui , ultimquiziqui liwriitam cjequic̈ha . Niz̈aza amiz̈ tjaajinta catokchi z̈oñinacaqui liwriitaz̈ zakaz cjequic̈ha .
44026011	Violence	Niz̈aza kjaz̈ wilta criichi z̈oñinaca sufriskatchinc̈ha , Jesucristuz̈ quintra chiikatzjapa , niz̈aza Jesucristuz̈quiztan quejpskatzjapa . Wejrqui niz̈tapacha paachinc̈ha judionacz̈ ajcz kjuyquizimi . Niz̈aza walja z̈awjwiñtac̈ha nii criichinacz̈ kjutñi . Jalla nuz̈ z̈awjz̈cu wejrqui criichinaca tani ojklayiñtac̈ha yekja watjaranami .
48005019	Sin	Nii ana zuma kamaña pecñi kuzqui jalla tiz̈ta paaz pecc̈ha : adulterio paaz , yekja maatakz̈tan yekja luctakz̈tan ana wali paaz , azzucanaca paaz ,
46003007	Grace	Jalla niz̈tiquiztan nii c̈hjacñimi nii jawiiñimi anaz̈ c̈hjulumi . Yoozpanc̈ha chekanaqui . Yoozqui z̈oñinacz̈ kuzquiz langz̈a , tsjii c̈hjacta z̈kalaz̈takaz zuma pakzjapa .
46001007	Faith	Jalla niz̈tiquiztan anc̈hucqui tjapaman Yooziz̈ tjaata kamañchizza . Jalla nuz̈ kamcan , Jesucristo Jiliriz̈ tjonz tjuñi tjewz̈a anc̈hucqui .
