44003014	Sin	Jesusaqui ana c̈hjul ujchizza . Yooz Ejpz̈ kuzcama kamñic̈ha . Nii Jesusa cuts cjenpacha , anc̈hucqui tsjii pajk ujchiz z̈oñi cutskatz pecchinc̈hucc̈ha .
44015009	Faith	Yoozqui ninacz̈tan uc̈humnacatan ana pjalpjalzic̈ha . Yoozquin tjapa kuz cjen ninacaqui kuz campiichic̈ha . Niz̈aza Yoozqui ninaca pertunchic̈ha , zuma kuzziz cjeyajo .
46011028	Recommendation	Ima Santa Cena paacan , zapa mayni persun kuzquiz amayt'asaquic̈ha , kjaz̈tiquiztan Santa Cena cuzturumpi paa , jalla nii . Nekztan Santa Cena cuzturumpi paasac̈ha .
46015058	Faith	Jalla niz̈tiquiztan , weriz̈ pecta jilanaca , Yoozquin tjurt'iñi kuzziz cjee , niz̈aza Yoozquin tjup kuzziz cjee , niz̈aza Jesucristo Jilirz̈ tjaata kamañquin juc'anti juc'anti kuz tjaa . Anc̈hucqui zizza , Jesucristo Jilirz̈tajapa langzqui anac̈ha inaqui .
46004016	Recommendation	Jalla niz̈tiquiztan jaknuz̈t wejr zuma kamuc̈haja , jalla niz̈ta anc̈hucqui zuma kamz waquizic̈ha .
46001021	Faith	Tii muntuquiz z̈ejlñi z̈oñinacaqui persun kuzquiz pinsican anapan Yooz pajasac̈ha . Jalla nuz̈ Yoozqui munchic̈ha . ¿ Jaknuz̈t z̈oñinacaqui Yooz pajasajo ? Jalla tiz̈tac̈ha . Wejrnacqui Jesucristuz̈ puntuquiztan paljayuc̈ha . Nii paljayta taku catokz̈cu z̈oñinacaqui werar Yooz pajasac̈ha . Niz̈aza liwriita cjesac̈ha . Ana criichi z̈oñinacaqui nii liwriiñi taku zumzu takuz̈takaz nayc̈ha . Jalla nuz̈ ninacaz̈ zumzu taku nayanami , Yoozqui munc̈ha , paljayta Yooz taku criiz̈cu , z̈oñinacaqui liwriita cjequic̈ha , nii .
60003001	Recommendation	Maatakanaca , anc̈hucqui persun luctakz̈ jaru kama . Tsjii luctakanacaqui Yooz taku ana criic̈ha , niz̈aza Yooz tawk jaru ana kamc̈ha . Pero anc̈huc criichin maatakanacaqui zuma kamaña tjeez waquizic̈ha . Anc̈huca zuma kamaña tjeeztiquiztan , anc̈huca ana criichi luctakanacaqui Yooz taku criichiz̈ cjec̈hani , anc̈huc ana ancha tawkz̈tan atipchiz̈ cjen .
47005020	Recommendation	Jalla niz̈tiquiztan Cristuz̈ cuntiquiztan ojklayuc̈ha niiz̈ takunaca paljaycan . Jalla nuz̈ ojklayan Yoozqui weriz̈ cjen anc̈hucaquiz paljayc̈ha . Jaziqui Cristuz̈tajapa anc̈hucaquiz chiiz̈inuc̈ha , Yoozquin kuz tjaalla , niiz̈tan anc̈hucatan zuma cjisjapa . Jalla nuz̈ chiiz̈inuc̈ha .
44002024	Description	Anc̈hucqui Jesusa conkatchinc̈hucc̈ha . Yooz Ejpzti Jesusa jacatatskatchic̈ha . Anawal ticzquiztan liwriichic̈ha . Nii ticzqui Jesusiz̈quiztanaqui anapantac̈ha atipchuca .
59002007	Sin	Niz̈aza ricachunacaqui Jesucristuz̈ quintra ana zuma chiichiic̈ha . Pero zuma Jesucristuz̈ cjen uc̈humqui cristiano cjita tjuuchizc̈humc̈ha .
54003003	Description	Niz̈aza anapan licñi kuzziz cjispanc̈ha . Niz̈aza ana kichjasñi kuzziz cjispanc̈ha , antiz pasinziz kuzzizpan cjispanc̈ha . Niz̈aza anapan ch'aazñi kuzziz cjispanc̈ha . Niz̈aza paaz pecñi kuzziz anapan cjispanc̈ha .
43004014	Grace	Pero jakziltat weriz̈ tjaata kjaz licc̈haja , jalla niiqui anaz̈ iya kjaz pecñiz̈ cjequic̈ha . Weriz̈ tjaata kjazqui niiz̈ persun kuzquiz tsjii jalzuriz̈takaz cjisnaquic̈ha wiñaya z̈ejtzjapa .
62002005	Faith	Jakzilta z̈oñit Yooz tawk jaru kamc̈haj niiqui , Yooztan ancha zuma munaziñi kuzzizza . Yoozquin tjapa kuzzizpanc̈ha . Jilanaca , tii zuma cjuñzna .
66016013	Description	Nekztanaqui cherchinc̈ha anawal dragonz̈ atquiztan anawal ispiritu ulanchic̈ha . Jalla niz̈tazakaz ulanchic̈ha anawal animalz̈ atquiztanami , niz̈aza falso profetz̈ atquiztanami . Nii c̈hjep ulanchi ispiritunacaqui zcaranacaz̈takaztac̈ha .
59002008	Recommendation	Jilanaca , cjijrta zuma Yooz takuqui tuz̈ cjic̈ha : “ Jaknuz̈t persunpachquiz okzñamz̈laja , jalla niz̈ta okzñi kuzziz cjistanc̈ha z̈oñinacz̈quizimi , lijitum maziz̈takaz ” . Niicama kamcanaqui zuma kamsa .
47004005	Faith	Jilanaca , cullaquinaca , nonz̈na . Wejrqui Jesucristuz̈ puntuquiztankaz paljayuc̈ha . Ultim chawjc Jiliripankazza Jesucristuqui . Nuz̈ cjiwc̈ha . Jesucristuz̈ honora waytuc̈ha ; anac̈ha wejt persun honora waytuc̈ha . Niz̈aza Jesucristuz̈ mantuquiz ojklaycan wejrqui anc̈huca piyunitc̈ha , anc̈huc yanapzjapa .
46015033	Recommendation	Jaziqui anc̈hucqui anaz̈ incallskata . Ana zuma kamañchiz mazinacchizc̈hucc̈halaj niiqui , anc̈hucqui zuma kamañquiztan tsjii kjutñi chjichtaz̈ cjesac̈ha .
58013020	Grace	Yoozza z̈oñinacz̈ kuznaca walikaz cjiskatñiqui . Jalla niiqui uc̈hum Jesucristo Jiliriz̈ ticziquiztan jacatatskatchic̈ha . Jesucristuc̈ha uc̈hum chawjc Awatiriqui uuzanaca itzñiz̈takaz . Niiqui persun ljocz̈tan ew acta ut'aychic̈ha wiñayjapa .
50001027	Recommendation	Jilanaca , cullaquinaca , jalla tuz̈uc̈ha chekanaqui . Anc̈huca cristian kamzqui Cristuz̈quiz honorchiz cjiskatz waquizic̈ha , Cristuz̈ tjaajinta jaru kama . Jalla nuz̈ kamaquiz̈ niiqui , anc̈huca puntuquiztan zuma quintu okaquic̈ha . Nekztanaqui wejrqui anc̈hucaquin cherzñi tjonznaz̈ niiqui , uz̈ ana cherzñi tjoni ataz̈ niiqui , wejrqui anc̈huca puntuquiztan zuma quintu nonznac̈hani . Anc̈hucqui tsjii kuzziz tjurt'ichi z̈elac̈hani . Niz̈aza tjapa anc̈hucqui tsjii kuzziz Yooz tawk favora langzcan z̈elac̈hani .
46006014	Grace	Yooz Ejpqui Jesucristo Jiliri jacatatskatchic̈ha . Niz̈aza Yoozqui niiz̈ persun aztan uc̈hum curpunaca jacatatskataquic̈ha .
55001006	Recommendation	Yoozqui amquiz tsjii zuma kamaña tjaachic̈ha , weriz̈ am juntuñ kjarz̈tan lanz̈tan . Jalla niz̈tiquiztan amquin chiiz̈inuc̈ha , nii zuma kamañquiz tira kamajo .
60004006	Grace	Tii muntuquiz z̈ejlñi z̈oñinacz̈quiz liwriiñi Yooz takuqui paljaytatac̈ha , ninaca criyajo , niz̈aza liwriita cjeyajo . Z̈oñz̈ curpuchiz cjen criichinacaqui tjapa z̈oñinaca irata ticz̈a . Pero ninacz̈ animunacaqui Yooziz̈ arajpachquin kjawz̈ta cjen zumapan kamc̈ha Yooz irat kamañchiz .
46007023	Recommendation	Yoozqui anc̈huc kjaychic̈ha wali jila preciuz̈tan . Cristuz̈ ljokc̈ha nii preciuqui . Jalla niz̈tiquiztan z̈oñz̈ mantuquiz anac̈ha cjiskatsqui .
46010010	Recommendation	Niz̈aza yekjap tuquita ejpnacaqui Yooz quintra chutchic̈ha . Jalla niz̈tiquiztan Yoozqui anjila cuchanz̈quichic̈ha ninaca conzjapa . Jalla nii cjuñz̈cu , anc̈hucqui Yooz quintra chuch anaz̈ waquizic̈ha .
47002017	Faith	Wejrqui Cristuz̈ puntu paljaycan anal negocio paa-uc̈ha ; niz̈aza Yooz taku anal queruc̈ha yekjap z̈oñinacaz̈takaz . Wejrzti zuma lijituma paljayuc̈ha zuma kuzziz . Yooz uchta apostultc̈ha . Cristuz̈tan wejttan tsjii kuzziz cjen , Yooz Ejpqui zizza , liwriiñi Yooz taku lijituma paljayuc̈ha .
45015001	Recommendation	Yekjap uc̈humqui tjapa kuztanpan Yoozquinc̈ha . Yekjapanacaqui Yooztan kamcan llajlla kuzzizza . Uc̈hum kuzquiz pecta jarukaz anaz̈ kamz waquizic̈ha . Nii llajlla kuzziz criichi z̈oñinacaz̈ pinsitanaca panz̈ cjuñzna , zuma kami yanapajo .
50002024	Faith	Niz̈aza Jesucristo Jiliriz̈ munan , wejrpacha upaquiztan anc̈huc cherzñi tjonz pecuc̈ha .
66007001	Description	Jalla nekztanaqui wejrqui cherchinc̈ha , pajkpic anjilanacaqui tii muntuz̈ pajkpic latuquiztan tsijtsi z̈elatc̈ha . Jalla nuz̈ z̈ejlcan pajkpic puntu tjaminacaqui atajatc̈ha , ana zinta tjamzjapa yokquizimi kotquizimi muntinacquizimi .
60004003	Sin	Anc̈hucaquiz cjiwc̈ha , anc̈huca tuquita kamtaqui ana walitac̈ha . Nuz̈quizkaj cjila nii anawal kamtaqui . Jalla niz̈ta anawal kamtaqui ana criichi z̈oñinacaqui juztazza . Anc̈hucqui zuma zizza nii anawal kamta puntu . Tuquiqui anc̈hucqui anawal kuz pinziz jaru ojklayatc̈ha ; niz̈aza adulteriuquiz ojklayatc̈ha ; niz̈aza c̈hjul kuz pecta jarumi paatc̈ha , niz̈aza kuz katchi licatc̈ha , niz̈aza ancha pjijstanaca paatc̈ha , niz̈aza mazinacz̈tan licz pecatc̈ha . Niz̈aza z̈oñiz̈ paata yooznacquiz rispitatc̈ha . Werar Yooz mantita quintrac̈ha niiqui .
66011005	Violence	Jakziltat Yooz taku paljayñi z̈oñinacz̈quiz sufriskatz yanznac̈haja , jalla niiqui contaz̈ cjequic̈ha . Nii pucultan tisticunacz̈ atquiztan asñi uj ulnaquic̈ha ninacz̈ quintra z̈oñinaca liwj ujzjapa . Nekztan ninacz̈quiz sufriskatz pecñinacaqui contaz̈ cjequic̈ha .
44023005	Recommendation	Nekztan Pabluqui cjichic̈ha : — Jilanaca , anal wejrqui zizatuc̈ha tiiqui Yooz chawc jiliriz̈laja , jalla nii . Cjijrta Yooz takuqui tuz̈ cjic̈ha : “ Tsjii wajt jilirz̈ quintraqui anac̈ha chiizqui ” .
66022015	Sin	Pero wajt zancu jalla tiz̈ta z̈oñinacaz̈ eclaquic̈ha : tsjii kjutñi kuz tjaañi z̈oñinaca , yat'irinaca , adulteriuquiz ojklayñinaca , z̈oñi conñinaca , z̈oñiz̈ paata yooznacz̈quin rispitñinaca , niz̈aza tjapa incallñinaca , niz̈aza tjapa toscar taku pecñinaca . Jalla nii anazuma z̈oñinacaz̈ wajt zancu eclaquic̈ha .
66002014	Sin	Nonz̈na ; tsjii kjaz̈ ujnaca anc̈hucz̈ quintra tjeeznuc̈ha . Yekjap anc̈hucaquiztan anawal tjaajintanaca catokchinc̈hucc̈ha . Nii tjaajintanacaqui Balaamz̈ cjita tjaajintaz̈takazza . Tuquita timpuqui nii Balaamqui Balak cjita z̈oñz̈quiz̈ tjaajzic̈ha , jaknuz̈t Israel z̈oñinaca ujquiz tjojtskatchucaz̈laja , jalla nii . Nekztanaqui Balak cjitaqui Israel z̈oñinaca ujnacquiz tjojskatchic̈ha . Jaziqui Israel z̈oñinacaqui adulterio paachic̈ha , niz̈aza z̈oñiz̈ paata yooznacquiz tjaata c̈hjeri lujlchic̈ha . Jalla niz̈ta ujnacquiz tjojtskatchic̈ha Balak cjitaqui .
53001003	Faith	Jilanaca , cullaquinaca , wejrnacqui anc̈hucaz̈ zuma kamtiquiztan tirapan Yoozquin sparaquiz̈ cjiwc̈ha . Jalla nuz̈upan chiiz waquizuc̈ha . Anc̈hucqui juc'anti juc'anti Yoozquin kuzziz cjissa , niz̈aza juc'anti juc'anti porapat zuma munaziñi kuzziz cjissa .
46012002	Sin	Tuquiqui ima anc̈hucaz̈ Yoozquin criican anc̈hucqui ana criiñi z̈oñiz̈ paata yooznacz̈quiz tsjii kjutñi irpitatac̈ha , jalla niz̈ta irpiskatchinc̈hucc̈ha anc̈hucqui . Jalla nii anc̈hucqui zuma zizza .
49005025	Recommendation	Luctakanaca , persun maatakz̈tan zuma munaza . Jaknuz̈t Cristuqui criichi z̈oñinacz̈tan zuma munazic̈haja , niz̈aza ninacz̈ laycu ticztc̈haja , jalla niz̈ta irata persun maatakz̈tan zuma munaza .
45012017	Recommendation	Tsjiiqui anc̈huca quintra paachiz̈ cjen , anc̈hucqui anac̈ha niz̈tapacha quintra tjepunzqui . Zumapanz̈ paazjapa tjapa kuz tjaa .
60005006	Recommendation	Jalla niz̈tiquiztan tjapa azziz Yooz Jilirz̈ mantuquiz humilde kuzziz cjee , nekztan Yoozqui anc̈hucaquiz honorchiz cjiskataquic̈ha .
44014017	Grace	Yoozqui chijñi apayz̈quic̈ha , zuma zkala pookajo . Niz̈aza Yooz cjen wali c̈hjeri z̈ejlc̈ha , uc̈humnaca lujlzjapami , niz̈aza cuntintu kamzjapami . Jalla nuz̈ zumanaca tjaac̈ha Yoozqui . Niz̈tiquiztan z̈oñinacaqui Yooz pajz waquizic̈ha .
54003011	Recommendation	Jalla niz̈ta zuma kamañchiz cjispanc̈ha iclizquiz yanapñi maatakanacami . Nii maatakanacami walja rispitta kamañchiz cjispanc̈ha . Niz̈aza anapan ana wal quintu joojooñi kuzziz cjispanc̈ha . Niz̈aza ewjazñi kuzziz cjispanc̈ha . Niz̈aza tjapa cumpliñi kuzziz cjispanc̈ha .
66002021	Sin	Wejrqui pasinsis kuz tjewzinc̈ha , naaqui ‘ ujchizpantc̈ha ’ cjican ujnacquiztan jaytizjapa . Pero naaqui uj paaznacquiztan anapan jaytiz pecc̈ha ; uj paaz pecc̈ha .
44012020	Description	Herodesqui z̈awjchic̈ha Tiro Sidón wajtchiz z̈oñinacz̈ quintra . Jalla niz̈tiquiztanaqui ninacaqui acuerdo palt'ichic̈ha Herodes yujcquiz prisintisjapa . Nii Tiro Sidón watjanacchiz z̈oñinacaqui Herodes tjaata c̈hjerz̈tan kamñitakalc̈ha . Niz̈aza tsjii Blasto cjita z̈oñi z̈elatc̈ha . Niiqui Herodes secretariotac̈ha . Jalla nii z̈oñinacaqui Blasto cjita secretario roct'ichic̈ha ninacz̈ta favora tjurt'iz̈inajo , Herodes ana quintra cjeyajo .
43008049	Sin	Jesusaqui ninacz̈quiz tuz̈ kjaazic̈ha : — Wejrqui anac̈ha zajraz̈ tantitqui . Wejt Yooz Ejpz̈ honora waytuc̈ha . Anc̈huczti wejr iñarcan wejtquiz anaz̈ honora tjaac̈ha .
43006018	Description	Kotquiz okan tsjii pjursant tjamiqui tjamz̈quichic̈ha . Jalla niz̈tiquiztan kjaz ljojkjinacaqui waljaz̈ ljojkinz̈quichic̈ha .
45008018	Faith	Tii timpuquiz sufrisnacaqui anac̈ha ancha . Cjuñzna , Yooziz̈ tjaata honorac̈ha ancha zuma . Jalla nuz̈ cjuñznuc̈ha wejrqui . Jesucristuz̈ tjonz tjuñquiziqui uc̈humnacaqui zuma honorchiz cjequic̈ha . Jalla nii tjeez̈taz̈ cjequic̈ha .
62002012	Grace	Jilanaca , cullaquinaca , anc̈hucaquin cjijrz̈cuc̈ha . Jesucristuz̈ ticzi nekztan anc̈huca uj pertunchic̈ha Yoozqui .
55001009	Grace	Nii azi tjaañi Yoozza uc̈hum liwriichiqui . Nekztan uc̈hum kjawzic̈ha niiz̈quin tjapa kuztan kamzjapa . Yoozqui uc̈hum ana kjawzic̈ha uc̈humnacaz̈ zuma paatiquiztan . Antiz Yoozqui uc̈hum kjawzic̈ha niiz̈ persun kuz munañpi jaru , niz̈aza niiz̈ persun okzñi kuzziz cjen . Ima tii muntu z̈elan Yoozqui tantiichic̈ha , Jesucristuz̈quin kuzziz z̈oñinacz̈quiz niiz̈ okzñi kuz tjeeznaquic̈ha , nii .
43019006	Violence	Timplu jilirinacami , niz̈aza timplu wijilñi zultatunacami nii cherz̈cu , alto jorz̈tan kjawcan , chiichic̈ha : — ¡ Cruzquizkaz ch'awczna ! ¡ Cruzquizkaz ch'awczna ! — cjican . Pilatuqui ninacz̈quiz cjichic̈ha : — Way , niz̈tacz̈ chjicha anc̈hucqui , niz̈aza cruzquiz ch'awcz̈ca . Pero wejrqui ana c̈hjul ujmi tiiz̈quiz jwesi atchinc̈ha .
60001010	Grace	Yoozqui niiz̈ okzñi kuzziz cjen anc̈hucaquiz yanapc̈ha niiz̈tan zuma kamajo . Uc̈humnacaltajapac̈ha nii Yooziz̈ yanaptaqui . Jalla nii Yooziz̈ yanaptaqui mazinchic̈ha tuquita profetanacaqui . Nii Yooztajapa chiiñi profetanacaqui Yooztan kamz puntu walja istutiichic̈ha nii puntu iya iya zizjapa . Walja kuzquiz pinsichic̈ha tsjan zuma intintajo .
63001007	Sin	Tii muntuquiz muzpa z̈oñinacaqui ojklayc̈ha , z̈oñi incallcan . Ninacaqui anaz̈ criic̈ha , Jesucristuz̈ z̈oñz̈ curpuchiz kamchic̈ha tii muntuquiz , nii . Jalla ninacac̈ha incallñinacaqui . Niz̈aza Cristuz̈ quintranacac̈ha .
44024005	Sin	Nuc az̈ka kamcan , wejrnacqui zizzinc̈ha , tii z̈oñiqui wira anawalipanc̈ha . Niz̈aza tjapa kjutñi judío z̈oñinacaz̈ aptjapc̈ha , t'aka t'aka . Niz̈aza tiiqui walja achac̈ha nii nazaren cjita t'akquiztan .
54003016	Grace	Anaz̈ jecmi kjaz̈ cjesac̈ha tii puntuquiztan . Tuquiqui Jesucristuz̈ puntumi , niz̈aza Yooz kamañ puntumi ana tjapa ziztatac̈ha . Anziqui nii puntunacami kjanacama ziztac̈ha . Tii Jesucristuz̈ puntunacac̈ha chekanaqui . Jesucristuqui uc̈hum irat curpuchiz tjonchic̈ha tii muntuquiziqui . Jacatattiquiztan Yooz Espíritu Santuqui ticlarchic̈ha niiz̈ puntuquiztan , lijituma Yooz kamañchizza , jalla nii . Niz̈aza Yooz anjilanacaqui Jesucristo cherchic̈ha . Niz̈aza tjapa tii muntuquiz z̈ejlñi z̈oñinacz̈quiz Jesucristuz̈ puntuquiztan paljaytac̈ha . Niz̈aza tjapaman z̈oñinacaqui niiz̈quiz criichic̈ha . Niz̈aza Jesucristuqui tsewc arajpachquin wilta quejpchic̈ha . Jalla nii puntunacac̈ha chekanaqui .
66016021	Violence	Niz̈aza arajpachquiztan z̈oñinacz̈ juñtuñ pajk caranuza tjojtz̈cu , ojkchic̈ha . Tsjii caranuzaqui quintal jilatac̈ha , ancha liczitac̈ha . Nekztanaqui z̈oñinacaqui Yooz quintra chiichic̈ha nii caranuzaz̈ nuz̈ ojktiquiztan . Jalla nii anawaliquiztan ancha sufrichic̈ha .
61003013	Faith	Pero uc̈humzti ew arajpachami yokami tjewz̈a , Yooz chiita tawk jaru . Nii ew arajpachquinami yokquinami tjappacha Yooz irata zumacamaz̈ cjequic̈ha . Ana zinta anawaliqui cjequic̈ha .
66006014	Description	Nekztanaqui pachaqui katchic̈ha tjuuz̈ta papilaz̈takaz . Niz̈aza tii muntuquiz tjapa curunacami tjapa kot taypiquiz z̈ejlñi yokanacami kizkattatac̈ha .
58010010	Grace	Yooz kuzcama kamcan Jesucristuqui tsjii wiltakaz persun curpu wilana cunta intirjichic̈ha , z̈oñinacz̈ ujquiztan ticzjapa . Jalla niz̈tiquiztan Yoozqui uc̈humnacaquiz zuma kamañchiz cjiskatchic̈ha .
52001002	Faith	Wejrnacqui tjapa anc̈hucaz̈ cjen tirapan Yoozquin sparaquiz̈ cjiwc̈ha . Yoozquin mayizican anc̈hucaltajapa wiltan wiltan mayizuc̈ha .
66006004	Violence	Nekztan yekja cawalluqui ulanchic̈ha , ljok cawallu . Nii cawallz̈ juñtun yawchi z̈oñiqui poder tjaatac̈ha , z̈oñinacpora kichanasjapa , niz̈aza porapat conasjapa . Niiz̈quiz tsjii pajk cuchillu tjaatac̈ha .
54006001	Recommendation	Criichi z̈oñinacz̈quiz chiiz̈ina , tuz̈ cjican : Patrunz̈ mantuquiz kamñi piyunanacaqui persun patrunz̈quiz rispitla , parti z̈oñinacaz̈ werar Yooz quintra ana chiyajo , niz̈aza tjaajinta Yooz taku ana iñarajo .
51003009	Recommendation	Anac̈ha toscar taku chiizqui . Anc̈hucqui tuquita ana wal kamaña ecchinc̈hucc̈ha . Jalla niz̈tiquiztan anc̈hucqui nii ana wal paaznacquiz ana iya ojklayz waquizic̈ha .
66002020	Sin	Wejrqui cjiwc̈ha , tii ujchizza anc̈hucqui . Tsjaa anawal maataka z̈ejlc̈ha , Jezabel cjiti maatakaz̈takaz . Naaqui cjiñc̈ha , ‘ Wejrtc̈ha Yooz taku parliñtqui ’ . Jalla nuz̈ cjican , wejtquiz sirwiñinacz̈quiz incallc̈ha . Naaz̈a incalltiquiztanaqui criichi z̈oñinacaqui adulteriuquiz ojklayc̈ha ; niz̈aza z̈oñiz̈ paata yooznacquiz tjaata c̈hjerinaca lujlc̈ha . Jalla nuz̈ ana zuma tjaajnan , anc̈hucqui naaz̈a puntuquiztan ana kjaz̈ cjiñc̈hucc̈ha . Pero nii anawal tjaajintaz̈ quintra chiiz waquizic̈ha .
48003008	Grace	Yoozqui tuquitanpacha tuz̈ tantiichic̈ha , Jesucristuz̈quin kuz tjaañi z̈oñinaca Yooz yujcquiz zuma cjiskattaz̈ cjesac̈ha , jalla nuz̈ tantiichic̈ha . Jalla niz̈tiquiztan tuquitanpacha liwriiñi Yooz puntuqui Abrahamz̈quiz chiitatac̈ha , tuz̈ cjican : “ Amiz̈ cjen tjapa wajtquiztan z̈oñinaca zumaz̈ cjiskattaz̈ cjequic̈ha ” . Jalla nuz̈ cjic̈ha cjijrta Yooz takuqui .
58012005	Recommendation	Yoozqui anc̈hucaquiz chiiz̈inchic̈ha , niiz̈ maatinacaz̈takaz . Jalla nii ewjt'iñi chiiz̈inta ana tjatzna . Yooz takuqui tuz̈ anc̈hucaquiz chiiz̈inc̈ha : “ Wejt maati , Yooz Jiliriz̈ ewjt'iñi chiiz̈inta ana chjaya . Niz̈aza niiz̈quiz casticta cjenami ana llajlla kuzziz cjee .
58013017	Recommendation	Anc̈hucqui icliz irpiñinaca cazpanc̈ha , niz̈aza ninacz̈ jaru cjee . Ninacaqui anc̈huc cuitiñic̈ha . Niz̈aza nii icliz irpiñinacaqui , jaknuz̈t criichi z̈oñinaca cuitiñiz̈laja , jalla nii Yooz yujcquin cuenta tjaastanc̈ha . Anc̈huc zuma kaman , irpiñinacaqui cuntintuz̈ anc̈huc cuitaquic̈ha , ana llaquizcu . Anc̈hucqui anc̈huca irpiñinacz̈quiz llaquiskataquiz̈ niiqui , anapanz̈ cusa cjesac̈ha anc̈hucaltajapaqui .
44013019	Description	Nii timpupacha pakallak nacionanacaqui Canaán yokquin z̈ejlñitac̈ha . Jalla tjappacha nii yokquiz z̈ejlñinaca tjatanchic̈ha Yoozqui , niz̈aza ninacz̈ yoka tjaachic̈ha uc̈hum tuquita atchi ejpnacz̈quiz , tsjii irinsaz̈takaz .
54006003	Faith	Tsjii z̈oñiqui tsjemat pinsita takunacz̈tan tsjii kjutñi tjaajnac̈hani . Jalla niz̈ta ana wali tjaajnaquiz̈ niiqui , Jesucristo Jiliriz̈ zuma tjaajintanacquiztan tsjemataz̈ tjaajinc̈ha . Niz̈aza nii z̈oñiqui Yooz mantita kamañquiztan tsjemata kamaña tjaajinc̈ha .
63001010	Recommendation	Jakziltat anc̈hucaquiz tjonz̈cu Cristuz̈ tjaajinta ana niicama tjaajinc̈haj niiqui , anaz̈ Yooztan tsjii kuzziz nii jilaqui . Anc̈hucqui nii z̈oñi ana kjuyquiz kjawznaquic̈ha . Anazaz̈ tsaanaquic̈ha .
47001005	Grace	Jesucristuz̈quin criichiz̈ cjen Jesucristuz̈ irata ancha sufruc̈ha . Niz̈aza Jesucristuc̈ha wejrnacaquiz zumpacha kuzñiqui .
65001011	Sin	Ninacz̈taqui ana wali cjequic̈ha . Cainz̈ irata Yooz kamañquiz ana kamz pecc̈ha . Paaz ganz peccu , Balaam irata tsjii kjutñi ojklayc̈ha . Niz̈aza Corez̈ irataz̈takazza casticu zjijcc̈ha . Korequi Yooz uchta z̈oñinacz̈ quintra paaz̈cu ticzic̈ha .
65001010	Sin	Pero nii anc̈hucatan kamñi anawali z̈oñinacaqui ana intintazñi kuzzizza . Poderchiz zajranacz̈ quintra chiican , chjaawjkatc̈ha . Animalaz̈takaz persun kuzcamakaz ojklayñic̈ha . Jalla nuz̈ ojklaytiquiztan persunjapa casticu zjijcc̈ha .
58011007	Faith	Niz̈aza Yoozquin kuzziz cjen Noequi kjaz juyzuquiztan liwriitatac̈ha . Ima kjaz juyzu tjonan Yoozqui Noez̈quiz chiiz̈inchic̈ha , “ Kjaz juyzul cuchanz̈cac̈ha ” , cjican . Jalla nii Yooz chiiz̈intaqui Noequi catokchic̈ha . Nekztan Yooz chiita jaru tsjii pajk warcu kjuya irata kjuychic̈ha , niiz̈ familianacz̈tanpacha liwriita cjisjapa . Jalla nuz̈ Yoozquin kuzziz cjen Noequi tjeezic̈ha , parti z̈oñinacaqui ancha ujchizza , jalla nii . Niz̈aza Yoozquin kuzziz cjen Noequi Yooz zuma kamaña tanchic̈ha , tsjii irinsaz̈takaz .
58009006	Description	Jalla nuz̈ tjacz̈cu timplu jilirinacaqui zawncchuc kjuyquiz luzluzñitac̈ha , lii jaru cuzturumpinaca paacan .
44007051	Sin	Niz̈aza Estebanqui tira chiichic̈ha , tuz̈ cjican : — Anc̈hucqui ancha chojru kuzzizc̈hucpanc̈ha , ana Yoozquin kuzzizc̈hucc̈ha . Cjuñchizc̈hucc̈ha pero ana Yooz taku nonzinc̈hucc̈ha . Niz̈aza anc̈hucqui Yooz Espíritu Santuz̈quiz anapan caziñc̈hucc̈ha . Tuquita ejpz̈ niz̈tazakazza anc̈hucqui .
54001009	Sin	Niz̈aza lii puntuqui tuz̈uc̈ha : Moisés liinacaqui anatac̈ha ut'ayta zuma kamñi z̈oñinacz̈tajapa . Antiz ana zuma kamñi z̈oñinacz̈tajapa ut'aytatac̈ha . Zuma paaznaca ana juyzu paañi z̈oñinacz̈ta , niz̈aza Yooz kuzcama ana kamñi z̈oñinacz̈ta , niz̈aza ana Yooz sirwiñinacz̈ta , niz̈aza uj paañinacz̈ta , niz̈aza Yooz kamañ jicz ana pecñinacz̈ta , niz̈aza ana Yooz rispitñinacz̈ta , niz̈aza persun maa ejp conñinacz̈ta , niz̈aza z̈oñi conñinacz̈ta ,
46005009	Recommendation	Tuquiqui cartiquiz cjijrz̈quichinc̈ha tuz̈ cjican : “ Adulterio paañinacz̈quiztan jaytaquic̈ha , niz̈aza niz̈ta paañinacz̈tan anaz̈ cumpant'iz waquizic̈ha ” .
48001015	Grace	Jalla nuz̈ cjenami Yoozqui wejr t'akzic̈ha , niiz̈ apóstol cjisjapa . Ima weriz̈ maaquiztan nasan , Yoozqui wejr t'akzjapa tantiichic̈ha . Niz̈aza Yoozqui wejtquiz ancha okzñiz̈ cjen , wejr kjawzic̈ha , liwriita cjisjapa . C̈hjulorat wejr kjawz tantiitc̈haja , jalla nii ora wejr kjawzic̈ha ,
45007015	Description	¿ Kjaz̈tiquiztan niz̈ta ana zuma paatojo ? Anal intintazuc̈ha . Jesucristuz̈quin kuz tjaaz̈cu , jalla nekztanpacha zuma paaz pecñi kuzziz cjissinc̈ha . Jalla niz̈ta kuzziz cjenami , uj paaz pecñi kuzzizpanc̈ha . Zuma paaz peccumi , anal zuma payi atuc̈ha . Ana pecta uj paaznaca , jalla niikal wilta wilta paa-uc̈ha .
61003018	Faith	Anc̈hucqui uc̈hum liwriiñi Jesucristo Jilirz̈quiz juc'ant zumaz̈ pajaquic̈ha . Niz̈aza niiz̈ puntu juc'ant zizaquic̈ha . Niz̈aza juc'ant zuma kamañchiz cjee . Uc̈hum Jesucristo Jiliriqui honorchizkaj cjila anztajapami wiñayajapami . Jalla nuz̈oj cjila . Amén .
46004010	Description	Wejrnacaz̈ Jesucristuz̈ puntuquiztan paljayan ana criichi z̈oñinacaqui cjiñic̈ha , “ Zumzu z̈oñinacc̈hucc̈ha ” . Nuz̈ cjicanz̈ wejtnacaquiz iñarc̈ha . Anc̈huczti persun puntuquiztan pinsiñc̈hucc̈ha , “ Cristuz̈ cjen zuma zizñi z̈oñinactc̈ha wejrnacqui ” , cjicanaqui . Wejrnac apostolanacaqui humilde kuzziztc̈ha . Anc̈huczti persun puntuquiztan pinsiñc̈hucc̈ha , “ Tjup kuzziztc̈ha ” , cjicanaqui . Wejrnacqui iñartac̈ha . Anc̈huczti rispitta z̈oñiz̈takazza . Ultimquiziqui anc̈hucqui anac̈ha niz̈ta .
60005009	Faith	Jalla niz̈tiquiztan niiz̈ quintra tjurtichi z̈ela . Jesucristuz̈quin kuzziz tjurt'ichi z̈ela . Anc̈hucqui zizza , tii muntuquiz kamcan tjapa criichi jilanacaqui sufristanc̈ha . Jalla niz̈ta zizcu , Jesucristuz̈quin tjapa kuzziz cjen tjurt'ichi z̈ela .
51003022	Recommendation	Piyunanaca , am persun patruna c̈hjulu mantanami caspanc̈ha . Anac̈ha cherankaz c'unchikaz tuczqui . Pero tjapa kuztan niiz̈tajapa langz waquizic̈ha . Yooz patruna cjuñz̈cu , zuma langz waquizic̈ha . Anac̈ha langzqui anc̈huca patrunz̈ kuz wali cjiskatzjapakaz .
66017012	Description	‛ Niz̈aza nii amiz̈ cherta tunca wajranacaqui tunca mantiñi jilirinaca cjic̈ha . Nii tunca mantiñinacaqui imaz̈ mantiz poder tanz̈a . Nii anawal animalz̈tan chica tsjii orakaz mantaquic̈ha .
46002012	Grace	Yoozqui uc̈hum kuznacquiz niiz̈ persun Espíritu Santo luzkatchic̈ha , niiz̈ persun pinsita intintazkatajo . Ana criichi z̈oñz̈ kuzqui Yooz pinsitanaca anapan intintazkati atasac̈ha . Jalla niz̈ta kuz uc̈humnacaltaqui ana z̈ejlc̈ha .
59005001	Recommendation	Ricachunaca , nonz̈na . Anc̈hucaquiz ana walinacaz̈ tjonaquic̈ha . Nii zizcu , kjawcan kaacan z̈ejlz waquizic̈ha .
66002010	Recommendation	Jaknuz̈t anc̈hucqui sufrac̈haja , nuz̈ sufrisquiztan ana tsuca . Cwitasa , diabluqui yekjapanaca anc̈hucaquiztan carsilquiz chawckataquic̈ha , anc̈hucaz̈ ujquiz tjojtskatzjapa . Anc̈hucqui tunca tjuñi intiru ancha sufraquic̈ha . Ticzcama wejtquiz tjurt'iñi kuzziz cjee . Nekztanaqui wejrqui anc̈hucaquiz wiñayjapa z̈eti tjaa-ac̈ha , tsjii premiuz̈takaz .
54006011	Recommendation	Timoteo jila , amqui Yooz z̈oñimc̈ha . Jaziqui ana walinacz̈quiz anapan kuz tjaaquic̈ha . Antiz zuma kamzquin kuz tjaaquic̈ha . Yooz kuzcama kama . Niz̈aza Yoozquin kuzzizpan cjee . Niz̈aza zuma munaziñi kuzziz cjee . Niz̈aza pasinziz kuzziz tjurt'a . Niz̈aza humilde kuzziz cjee .
59005005	Sin	Anc̈huc ricachu patrunanacaqui , tii muntuquiz ancha cusasanacchiz kamiñc̈hucc̈ha . C̈hjuluz̈ pectanacami z̈ejlc̈ha anc̈hucaltaqui . Jaziqui tsjii cjew animalaz̈takaz cjissinc̈hucc̈ha . Z̈oñiqui cjew animala illza conzjapa . Niz̈tapacha Yoozqui anc̈huc illzic̈ha casticta cjisjapaqui .
66004004	Description	Jalla nii chawc mantiz julz muytata paatunc pusin mantiz puestunaca cherchinc̈ha , zapa puestuquiz tsjii z̈oñi julzi z̈elatc̈ha . Niz̈aza ninacatac̈ha chiw tol zquiti cutchi ; niz̈aza ninacz̈ achquiz kor pilluz̈takaz tewz̈inta .
66018007	Description	Jaknuz̈t nii wajtchiz z̈oñinacaqui ancha persun honora waytitc̈haja , niz̈aza jaknuz̈t ninacaqui persun kuzcama kamtc̈haja , jalla nuz̈ anawali kamtiquiztan jama sufriskattaj cjila . Ninacz̈ kuzquiz tuz̈ cjiñitac̈ha : “ Wejrnacqui juc'ant zumtc̈ha . Anawalinaca wejtquiz anapan cjisnasac̈ha . Anal wira tsjaa z̈ewaz̈takaz kaaznasac̈ha ” .
