58010023	Faith	Yoozquin macjatz̈cu Yooz famillquiz luzzinc̈humc̈ha . Jaziqui ana jiwjatcan tirapan Yoozquin tjurt'ichi kuzziz cjequic̈ha . Nekztan Yooztan chica kamaquic̈ha . Nii Yooztan kamzqui , jalla nii Yoozqui uc̈humnacaquiz compromitchic̈ha . Niz̈aza nii compromitchi Yoozza taku cumpliñiqui .
43014027	Grace	‛ Wejrqui anc̈huca kuznaca jeejzkatuc̈ha . Anc̈huca kuznaca jeejzkatz̈cuqui okac̈ha . Z̈oñinacaqui anapanz̈ z̈oñz̈ kuz niz̈ta jeejzkatasac̈ha . Anc̈huca kuznacaqui anac̈ha turwaysi cjee , niz̈aza anac̈ha eksna .
47005006	Faith	Jalla niz̈tiquiztan wejrqui tjup kuzzizpanc̈ha . Tii curpuchiz kamcan , arajpachquin Yooztan chica ima z̈ejlc̈ha . Pero arajpach wajtchiz z̈oñtc̈ha wejrqui . Jalla niil zizuc̈ha .
43012047	Grace	Jakziltat weriz̈ chiita nonz̈cu ana catokac̈haja , jalla niiz̈ quintra tii ora anal chiyuc̈ha . Wejrqui z̈oñinacz̈ quintra chiizjapa ana tjonchinc̈ha . Antiz z̈oñinaca liwriizjapa tjonchinc̈ha .
62003012	Sin	Tsjii z̈oñi z̈elatc̈ha , Caín cjita . Jalla nii Cainqui niiz̈ lajk conchic̈ha . ¿ Kjaz̈tiquiztan conchit niijo ? Jalla niiz̈ paatanacaqui anawalinacatac̈ha ; niiz̈ lajkz̈ paatanacazti walinacatac̈ha . Jalla nekztan niiz̈ lajk conchic̈ha . Cainqui diabluz̈ maatitac̈ha . Ana nii Cainz̈ kuz cherchi kuzziz cjee anc̈hucqui .
66016020	Description	Jalla nuz̈ castican tjapa kot taypiquiz z̈ejlñi yokanacami , niz̈aza curunacami katchic̈ha .
58011012	Description	Jalla niz̈tiquiztan Abrahamqui ticz irarchiz cjenami tsjii majchchiz cjissic̈ha . Jalla nii majchquiztan walja tama mirchic̈ha , walja tama arajpach warawaranacaz̈takaz niz̈aza walja tama kot at pjilanacaz̈takaz , jalla niz̈ta mirchic̈ha . Ancha tamaz̈ cjen , anac̈ha kanchuca Abrahamz̈quiztan tjonñi majch maatinaca .
54001017	Faith	Jalla niz̈tiquiztan tjapa mantiñi Yooz honoraz̈ wiñayjapa waytitaj cjila . Yoozqui wiñaya z̈ejlc̈ha , niz̈aza ana ticznasac̈ha , z̈oñz̈ c̈hjujcquiz anaz̈ cherta cjesac̈ha . Tsjiillapanikazza Yoozqui , niz̈aza niipanc̈ha juc'ant tjappacha zizñiqui . Jalla nii Yooz honora wiñay wiñaya tirapan waytitaj cjila . Jalla nuz̈oj cjila . Amén .
66014007	Faith	Jalla nii anjilaqui altu jorz̈tan tuz̈ chiichic̈ha : — Yoozquin rispitñiz̈ cjee . Niiz̈quin honora waytiñiz̈ cjee . Niiz̈ ultim casticz ora tjonc̈ha . Niiqui arajpachami , yokami , kot kjaznacami , niz̈aza kjaz jalzurinacami paachic̈ha . Jalla niz̈tiquiztan niiz̈quiz rispitñiz̈ cjee .
44006001	Description	Nii timpuquiz Yoozquin criichinacaqui waljaz̈ yapatc̈ha . Nuz̈ yaptiquiztan tsjii quija z̈ejlchic̈ha . Griego taku chiiñi judionacaqui hebreo taku chiiñi judionacz̈ quintra quijzic̈ha , tuz̈ cjican : — Wejtnaca z̈ew maatakanaca ana cusa atintitac̈ha . Zapuru c̈hjeri tojzquiz upa c̈hjeri onantac̈ha .
60002021	Grace	Jalla niz̈ta pasinziz kuzziz sufraquiz̈ niiqui , kjana tjeez̈a , Jesucristuz̈ z̈oñinacc̈hucc̈ha , nii . Yoozqui anc̈huc kjawzic̈ha , zuma kuz tjeezjapa . Cristuqui anc̈huc laycu sufrichizakazza . Cristuqui sufrican ancha pasinziz kuz tjeezic̈ha . Niz̈ta irata anc̈hucqui sufrican , niz̈tazakaz pasinziz kuz tjeez waquizic̈ha .
53003010	Recommendation	Anc̈hucatan z̈ejlcan , chiiz̈inchinc̈ha . “ Jakziltat ana langz pecc̈haja , jalla niiqui anaz̈ lujlz waquizic̈ha yejkz̈ c̈hjerquiztan ” .
43003016	Grace	Yooz Ejpqui tii muntuquiz z̈ejlñi z̈oñinacz̈quiz ancha okz̈quichipanc̈ha . Jalla niz̈tiquiztan niiz̈ zinta Majch cuchanz̈quichic̈ha , z̈oñinacz̈quiz ew kamañchiz cjiskatzjapa . Jakziltat niiz̈ zinta Majchquiz criyac̈haja , ew kamañchiz cjequic̈ha Yooztan wiñaya kamzjapa ana infiernuquin sufrajo .
44019015	Description	Nii pakallawk jilazullca niz̈ta paan , tsjii z̈oñi tanñi zajraqui ninacz̈quiz cjichic̈ha : — Jesús pajuc̈ha . Niz̈aza Pablo pajuc̈ha . Anc̈hucqui ¿ jectc̈huctajo ?
66019019	Violence	Jalla nekztanaqui cherchinc̈ha , nii anawal animalz̈tan yokquiz mantiñi reynacz̈tanami ninacz̈ zultatunacz̈tanami ajcsitac̈ha , chiw cawallquiz yawchi z̈oñz̈ quintra kichjasjapa , niiz̈ zultatunacz̈tanpacha .
44027002	Description	Adramitio cjita wajtquiz tsjii warcu z̈elatc̈ha . Nii oraqui nii warcuqui ojkzpachatac̈ha Asia kjutñi . Jalla nuz̈ cjen nii warcuquiz luzzinc̈ha . Niz̈aza wejtnacatan Aristarco cjita z̈oñitac̈ha . Niiqui Tesalónica wajtchiz z̈oñitac̈ha . Tesalónica watjaqui Macedonia yokquintac̈ha .
58013003	Recommendation	Carsilquiz chawcta jilanaca panz̈ cjuñzna . Anc̈hucazakaz persun kuzquiz ninacaz̈ chawctiquiztan sint'iz waquizic̈ha . Niz̈aza sufriskatta jilanacz̈quiz cjuñzna . Anc̈hucqui curpuchiz cjicanaqui zakaz sufriskatta cjesac̈ha .
51003017	Recommendation	Anc̈hucqui Cristuz̈ partir z̈oñinacc̈hucc̈ha . Jalla niz̈tiquiztan c̈hjulu paacanami chiicanami , zuma kamañchiz kamz waquizic̈ha . Niz̈aza c̈hjulu watanami Jesucristuz̈ cjen Yooz Ejpz̈quin sparaquiz̈ cjican tjaaz waquizic̈ha .
48006006	Recommendation	Yooz puntu tjaajinta z̈oñiqui persun cusasanacquiztan tjaaz waquizic̈ha Yooz puntu tjaajiñinacz̈quiz .
44007005	Description	Jalla tekz kaman , Yoozqui ana c̈hjul yok irinsami tjaachic̈ha . Abrahamz̈tajapa persun yoka ana z̈elatc̈ha . Jalla nuz̈ cjenami Yoozqui taku ecchic̈ha , tuz̈ cjican : “ Tii yoka amtapanz̈ cjequic̈ha . Niz̈aza am ticz̈tanaqui tii yokaqui am maatinacaz̈ tanznaquic̈ha ” . Jalla nuz̈ cjican Yoozqui Abrahamz̈quiz taku tjaachic̈ha . Nii oraqui Abraham ana ocjalchiz cjenami , Yoozqui nuz̈ chiichic̈ha .
44007019	Description	Nii jiliriqui uc̈hum wajtchiz z̈oñz̈ quintra pinsichic̈ha . Nekztan anawal quintra paachic̈ha uc̈hum tuquita atchi ejpnacz̈quiz . Nii jiliriqui mantichic̈ha , Israel lucmajch maatinaca majttan zawnc uchla , ticzi cjisjapa .
43020003	Description	Jalla nekztanaqui Pedruz̈tan nii tsjii pecta tjaajinta z̈oñz̈tan ulanz̈cu sepultura cherzñi ojkchic̈ha .
44024016	Faith	Jalla nuz̈ tjewz̈can , Yooz yujcquizimi z̈oñz̈ yujcquizimi wejt kuz zuma iwjt'ican persunpacha cwitasuc̈ha , ana ujchiz cjisjapa .
65001013	Description	Tjamiz̈ chjichta kjaz ljojkjinacaz̈takazza . Ninacaz̈ azzuca paatanacaqui kot anazum ch'utunacaz̈takazza . Niz̈aza ninacaqui tsjii kjutñi pertissi warawaranacaz̈takazza . Anawal zumchiquiz wiñayjapa castictaz̈ cjequic̈ha . Casticta cjisjapa , nii anawal tjaajiñinacaqui chjojtac̈ha .
48001012	Description	Ana jec z̈oñz̈quiztanami nii liwriiñi taku nonzinc̈ha , niz̈aza anaz̈ jec z̈oñimi wejtquiz nii liwriiñi taku tjaajinchiqui . Jesucristupachac̈ha wejtquiz tjaajinchiqui .
45007005	Sin	Tuquiqui uc̈hum persun kuzcama kamcan , uc̈hum uj paaz pecñi kuzqui uc̈humnacaquiz mantiñitac̈ha , ujnaca paajo . Jalla niz̈ta ujnaca paatiquiztan infiernuquin Yooziz̈ casticta cjichucatac̈ha . Moisés liiquiz “ Anac̈ha uj paazqui ” cjican cjenami uc̈hum uj paaz pecñi kuzqui juc'anti uj paazquin uc̈hum chjitchic̈ha .
54002007	Faith	Jalla nii Jesucristuz̈ z̈oñinacz̈ laycu ticzi quintu wejrzakaz paljayuc̈ha . Niz̈ta paljayajo , Yoozqui wejr apóstol puestuquiz utchic̈ha . Wejr utchic̈ha werar liwriiñi Yooz taku tjaajnajo ana judío z̈oñinacz̈quin . Ninacz̈quin Yooz taku paljayiñc̈ha , ninaca Jesucristuz̈quin kuzziz cjeyajo . Wejrqui Jesucristuz̈quin criichiz̈ cjen weraral chiyuc̈ha . Ana toscaral chiyuc̈ha .
62003024	Faith	Jakziltat nii mantitacama kamc̈haja , jalla niiqui Yooztan tsjii kuzzizza . Niz̈aza Yooztan tsjii kuzzizza nii z̈oñinacz̈tan . Yooz tjaata Espíritu Santuqui uc̈hum kuzquiz z̈ejlc̈ha . Jalla nekztan zizza uc̈humqui , Yooztan uc̈humtan tsjii kuzziz , jalla nii .
46010024	Recommendation	Parti criichinacaz̈ zuma kamañchiz cjisjapac̈ha kuz tjaazqui . Anac̈ha persun kamañjapakaz kuz tjaazqui .
45012016	Recommendation	Porapat zuma munazican kama . Anac̈ha mitarazi kuzziz tucquin cjis pecsqui . Pero humilde kuzziz wirquin cjican cuntintuz̈ cjee . Anac̈ha “ Wejrqui zuma ziziñ z̈oñtc̈ha ” cjee .
49004031	Recommendation	C̈hjaawjkatñi kuz jayta , niz̈aza culirazñi kuz jayta , niz̈aza z̈awjz̈awjz kuz jayta , niz̈aza z̈oñi ararñi kuz jayta , niz̈aza z̈oñz̈ quintra ana wali chiiñi kuz jayta , niz̈aza tjapa ana wali kuznaca jayta .
51001025	Faith	Wejrqui Cristuz̈ partir z̈oñinacz̈quin sirwizjapa , apóstol oficiuquiz uchtac̈ha . Yoozqui anc̈hucaltajapa nii oficiuquiz wejr utchic̈ha . Wejrqui uchtac̈ha Yooz taku zumpacha zizkatzjapa ,
66001014	Description	Niz̈aza niiz̈ ach charami chiwitac̈ha , chiw chomaz̈takaz , niz̈aza chiw kjatñiz̈takaz . Niiz̈ c̈hjujcquinacaqui ujz̈takaz c'ajatc̈ha .
47004015	Grace	Tjapa wejtquiz watchinacaqui anc̈hucaltajapac̈ha . Liwriiñi Yooz taku paljayuc̈ha , juc'anti juc'anti z̈oñinaca Yoozquin kuzziz cjiskatzjapa , niz̈aza ninaca Yooziz̈ yanapta cjiskatzjapa . Jalla nuz̈ cjen tsjan tsjan z̈oñinacaqui Yoozquin gracias cjican chiyaquic̈ha , niz̈aza Yoozqui juc'anti honorchiz cjequic̈ha . Jalla nuz̈ pecuc̈ha .
43006056	Faith	Jequit wejt z̈ejtkatñi curpu lujlc̈haja , niz̈aza wejt z̈ejtkatñi ljoc licc̈haja , jalla ninacac̈ha wejttan tsjii kuzzizqui . Niz̈aza wejrtc̈ha ninacz̈tan tsjii kuzzizqui .
43011027	Faith	Naaqui tuz̈ kjaazinc̈ha : — Criyuc̈ha , wejt Jiliri . Niz̈aza criyuc̈ha , amqui Cristumc̈ha ; niz̈aza Yooz Maatimc̈ha tii muntuquiz tjonchiqui . Jalla niiqui criyuc̈ha .
44002042	Faith	Tjapa nii criichi z̈oñinacaqui apostolonacaz̈ tjaajintanacz̈quiz walja tjapa kuztac̈ha . Ninacaqui tsjii kuzzizpan cjissic̈ha . Chica juntasñitac̈ha Yoozquin mayizizjapa , niz̈aza c̈hjeri lujlzjapa .
58001009	Grace	Amqui zuma lijituma mantiz pecñampanc̈ha . Yooz kuz quintra paañinaca panz̈ chjaawjñamc̈ha amqui . Wejrtc̈ha am Yoozqui . Amquiz juc'ant honorchiz cjiskatchinc̈ha , c̈hjul z̈ejlñinacz̈quiztanami ” .
44012002	Violence	Niz̈aza Herodesqui Jacobo conkatchic̈ha pajk cuchillz̈tan . Jacobqui Juanz̈ jilatac̈ha .
55002016	Recommendation	Ina z̈oñz̈ takunacaqui anac̈ha chiizqui . Jalla nii ina takunaca chiyasaz̈ niiqui , tsjan tsjan tsjii kjutñi z̈oñinacz̈quiz irpaquic̈ha .
62003015	Sin	Jakziltat niiz̈ jilz̈tan chjaawjkatc̈haja , jalla niiqui z̈oñi conchiz̈ cjes , jalla niz̈taz̈ ninacaqui . Niz̈aza z̈oñi conñinacami ana Yooz kuz cherchi kuzzizza . Anaz̈ wiñaya Yooztan kamasac̈ha .
43021015	Faith	Jalla nuz̈ c̈hjeri lujltiquiztan , Jesusaqui Simón Pedruz̈quiz pewczic̈ha , tuz̈ cjican — Simón , Jonás maati , ¿ amqui tii z̈oñinacz̈quiztan wejttan juc'anti munazkaya ? Pedruqui tuz̈ kjaazic̈ha : — Jesalla , wejt Jiliri . Amqui zizza , wejr am pecuc̈ha , jalla nii . Nekztan Jesusaqui niiz̈quiz cjichic̈ha : — Wejt z̈oñinacz̈quiz arajpach c̈hjeri tjaa . Ninacac̈ha uuzanacaz̈takazqui .
46012008	Grace	Tiz̈ta kamañanacaqui tjaatac̈ha : Espíritu Santuqui yekjap criichinacz̈quiz zuma pinsita razunanacchiz chiikatc̈ha . Niz̈aza Yooz Espíritu Santuqui yekjap criichinacz̈quiz zizñi zizñi chiikatc̈ha .
44007013	Description	Nekztanaqui pizc wilta ojkz̈cu , Josequi niiz̈ jilanacz̈quiz pajkatchic̈ha . Jalla niz̈tiquiztan Egipto chawc jiliriqui Josiz̈ familia pajchic̈ha .
60003010	Recommendation	Yooz takuqui tuz̈ cjic̈ha : “ Jakziltat zuma kamañchizpan pecc̈haja , niz̈aza cuntintupan kamz pecc̈haja , jalla niiqui persun chiiñi ata ewjt'istanc̈ha , anawal taku ana chiizjapa , niz̈aza ana incallñi toscar taku ana chiizjapa .
44004032	Description	Tjapa nii wacchi criichinacaqui tsjii kuzziztac̈ha . Niz̈aza ninacz̈ pinsamintuqui tsjiipanikaztac̈ha . Jakzilta z̈oñit cusasanacchiz z̈elatc̈haja , nii z̈oñinacaqui ana cusasquiztan chiiñitac̈ha , “ Wejt cusasaz̈ tiic ” cjicanaqui . Antis tjapa ninacz̈ cusasanacaqui tsjiiz̈takaz z̈elatc̈ha , tjapa criichi z̈oñinacz̈tajapa .
46015003	Grace	Wejrqui anc̈hucaquiz juc'ant chekan takunaca tjaajinchinc̈ha . Tuquiqui wejtquiz zakaz nii zuma takunacaqui tjaajintatac̈ha . Jalla tuz̈uc̈ha nii tjaajinta takunacaqui . Jesucristuqui uc̈hum uj laycu ticzic̈ha . Jaknuz̈t Yooz tawk liwruquiz cjijrtataz̈laja , jalla nii cjijrta jaru cumplissic̈ha .
66018024	Violence	Niz̈aza tii wajtchiz z̈oñinacaqui Yooz parti z̈oñinaca , niz̈aza Yooz puntu parliñinaca conchic̈ha . Tjapaman z̈oñinaca contac̈ha .
44013048	Faith	Jalla nuz̈ nonz̈cu , nii ana judío ejpchiz z̈oñinacaqui ancha chipchic̈ha . Niz̈aza Yooz tawk puntuquiztan , tuz̈ cjichic̈ha : “ Tii Yooz takuqui zumapanc̈ha ” . Jakziltat arajpachquin wiñaya kamzjapa Yoozqui illzaja , tjapa ninacaqui nii parlita Yooz taku criichic̈ha .
66022020	Description	Jalla tii takunaca ticlarñiqui tuz̈ cjic̈ha : — Ultimupan wejrqui wajillal tjonac̈ha . Wejrzakaz cjiwc̈ha : — Jalla nuz̈oj cjila . Amén . Jesucristo Jiliri , jalla nuz̈ tjona .
50004009	Recommendation	Weriz̈ tjaajinta jarumi , niz̈aza weriz̈ chiita jarumi , jalla nii jarupan kama . Niz̈aza jaknuz̈t weriz̈ kamta puntuquiztan nonz̈inc̈hucc̈halaj niiqui , niz̈aza cherchinc̈hucc̈halaj niiqui , jalla niz̈ta iratapan kama . Jalla nuz̈ zuma kamtiquiztan Yoozqui anc̈hucatan chicapachaz̈ cjequic̈ha . Nekztan anc̈hucqui walikaz cjequic̈ha .
53003015	Recommendation	Anaza niiz̈japa quintra cjee , antiz nii criichi jilz̈quiz zuma tawkz̈tan chiiz̈ina .
51002008	Recommendation	Anc̈hucqui cwitazaquic̈ha , tsjii kjutñi ana chjichta cjisjapa . Yekjapanacaqui anc̈huc incallskatz pecc̈ha , zuma razunanacaz̈takaz chiican , niz̈aza toscar takunacz̈tan chiican . Jalla niz̈ta tawkchiz z̈oñinacaqui Cristuz̈ pinsita jaru anaz̈ chiic̈ha . Pero z̈oñiz̈ pinsita jarukaz chiic̈ha . Niz̈aza zajranacz̈ pinsitanac jarukaz chiic̈ha . Jaziqui niz̈ta chiiñi z̈oñinacz̈quiztan cwitazaquic̈ha .
50003014	Faith	Tira tjurt'uc̈ha , Yooz irata zuma kamañchiz cjisjapa , niz̈aza Yoozquiztan tsjii zuma premio ganzjapa . Jesucristuz̈ partiquiz z̈ejlc̈hiz̈ cjen Yoozqui wejr arajpachquin kjawznaquic̈ha . Nekztan juc'ant zuma kamañaz̈ tjaaquic̈ha .
56002014	Faith	Nii tjonzñi Jesucristuqui uc̈hum laycu ticzic̈ha , tjapa ana walinacquiztan liwriizjapa . Ana walinacquiztan uc̈hum liwriichic̈ha , niiz̈ partir z̈oñi cjiskatzjapa , niz̈aza uc̈humnacaquiz tjapaman zumanaca paaz ancha pecñi kuzziz cjiskatzjapa .
43005024	Faith	‛ Anc̈hucaquiz weraral chiyuc̈ha . Jakziltat weriz̈ chiita taku nonz̈cu tjapa kuztan catokc̈haja , niz̈aza wejr cuchanz̈quiñiz̈quiz kuz tjaac̈haja , jalla niiqui Yooztan wiñaya kamc̈ha . Niz̈aza ana casticta cjequic̈ha . Infiernuquin ojkñi jiczquiz eccu , arajpach ojkñi jiczquiz kamc̈ha , Yooztan wiñaya kamzjapa .
66021015	Description	Jalla nii wejtquiz chiiñi anjilaqui kor miriis parchizza , nii watja miriisjapa , zanami pirkanacami .
50003019	Sin	Ultimquiziqui nii ana Cristuz̈quiz juyzu paañi z̈oñinacaqui Yooziz̈ castictaz̈ cjequic̈ha . Ninacaz̈ persun kuzquiztan pectanaca rispitc̈ha , tsjii yooztakaz . Azzucanaca paacan , mit kuzzizkazza . Niz̈aza tii muntu yokquiz z̈ejlñi cusasanacz̈quizkaz pinsic̈ha .
54003006	Sin	Niz̈aza tsjii icliz jiliriqui anaz̈ uzca criichi z̈oñi cjesac̈ha . Uzca criichi cjesaz̈ niiqui , mitarazi kuzziz cjisnasac̈ha , nekztanaqui ujquiz tjojtsnasac̈ha . Niz̈aza jaknuz̈t diabluqui niiz̈ ujquiztan casticta cjec̈haja jalla niz̈ta irata nii z̈oñiqui uj paatiquiztan casticta cjequic̈ha .
65001003	Recommendation	Pecta jilanaca , cullaquinaca , wejrqui anc̈hucaquin anchal cjuñchinc̈ha . Jalla nuz̈ cjuñz̈cu liwriiñi puntuquiztan anc̈hucaquin anchal cjijrz pecuc̈ha . Anc̈hucatan wejttan liwriita z̈oñinacac̈ha . Anawal tjaajiñinacaz̈ anc̈hucaquiz incallz pecchiz̈ cjen tii cartal urgente apayz̈cac̈ha , anc̈hucaquiz chiiz̈inzjapa . Yoozquin kuz tjaaz puntu werara tjaajintatac̈ha . Tsjemata tjaajintanacaqui anac̈ha werara niiqui . Werar tjaajintanacz̈quizkaz tjurt'iñi kuzziz cjee .
44004002	Description	Pedruz̈tan Juanz̈tan z̈oñinaca tjaajnatc̈ha , tuz̈ cjican : — Jesusaqui ticziquiztan jacatatchic̈ha . Jalla nuz̈ kjanapacha tjeez̈a , tjapa ticzi z̈oñinacaqui jacatataquic̈ha , jalla nuz̈ . — Jalla niz̈ta chiitiquiztan ancha z̈awjchic̈ha nii jilirinacaqui .
66018005	Sin	Nii wajtchiz z̈oñinacz̈ ujnacaqui juc'anti muntunacz̈takaz yapchic̈ha arajpacha irantizcamaz̈takaz . Juc'anti ujnaca paachic̈ha . Jaziqui Yoozqui ninacaz̈ paata ujnaca naychic̈ha .
43004046	Description	Galilea yokquin z̈ejlcan , Jesusaqui Caná cjita watja wilta ojkchic̈ha . Tuquiqui nii wajtquiz kjazquiztan vino tuckatchic̈ha . Tsjii pajk jilirz̈ secretariuqui Capernaum wajtquiz z̈elatc̈ha . Nii secretariuz̈ majchqui laatac̈ha .
45012011	Recommendation	Ana jayrazñi kuzziz cjee , pero c'unchi kuzziz cjee Yooz sirwizjapa . Niz̈aza tjapa kuztanpan Yooz sirwa .
60001008	Faith	Anc̈hucqui Jesucristuz̈tan munazic̈ha , kjaz̈ta ana cherz̈cumi . Niz̈aza ana cherz̈cumi niiz̈quin kuzzizza . Jalla niz̈tiquiztan anc̈hucqui ancha cuntintuz̈ chipz̈a . Z̈oñz̈ takunacz̈tan uc̈hum cuntintu kuz puntuquiztan ana zuma intintaskati atasac̈ha . Niz̈ta cuntintu kuzqui Yoozpachaz̈ chipskatc̈ha .
62004013	Grace	Yooz Ejpqui niiz̈ Espíritu Santo uc̈humquiz tjaachic̈ha . Jalla nekztan Yooztan uc̈humtan tsjii kuzzizza , nii zizza uc̈humqui .
43019029	Description	Jalla nekzi tsjii ojch z̈elatc̈ha jar vinchiz . Jalla nekztanaqui kjaz ch'umñi esponja t'awzic̈ha nii vinquiz . Nekztan hisopo cjita munti parquiz chjapz̈cu , Jesusiz̈ atquin ch'iiz̈inchic̈ha .
51001013	Grace	Yoozqui uc̈hum liwriichic̈ha , jalla niz̈tiquiztan uc̈humqui ana wal Satanás mantuquiz ana iya zejlc̈ha . Yoozqui uc̈hum niiz̈ pecta Majch Jesucristuz̈ mantuquiz utchic̈ha .
45016017	Recommendation	Jilanaca , cullaquinaca , anc̈hucaquiz rocuc̈ha , zumapanz̈ anc̈hucqui cwitazaquic̈ha , nii t'akt'aksñi z̈oñinacz̈quiztan . Niz̈aza zumpacha cwitazaquic̈ha tsjii kjutñi tjaajiñi z̈oñinacz̈quiztan . Nii z̈oñinacaqui , jaknuz̈t anc̈hucaquiz Yooz puntu tjaajinta cjec̈haja , jalla nii tjaajinta quintra tjaajinc̈ha . Ninacz̈quiztan anc̈hucqui zaraka .
45012007	Recommendation	Iclizquiz yanapñi kamañchiz̈laj niiqui , zuma yanapz waquizic̈ha . Yooz puntu tjaajiñi kamañchiz̈laj niiqui , zumapan tjaajinz waquizic̈ha .
43016023	Faith	‛ Nii orquiztan najwcchuc anc̈hucqui zizñi cjiscu wejr anaz̈ iya pewcnaquic̈ha . Anc̈hucaquiz weraral chiyuc̈ha . Wejtquiz tjapa kuztan cjen , anc̈hucqui Yooz Ejpz̈quiztan c̈hjulumi mayac̈haja , jalla nekztan weriz̈ cjen nii mayiztaqui tjaataz̈ cjequic̈ha .
66021019	Description	Niz̈aza wajt muytat pirkiz̈ simintunacaqui c'achja maznacz̈tan alajitatac̈ha . Primiruqui jaspe maztan , segunduqui zafiro maztan , terceruqui ágata maztan , cuartuqui esmeralda maztan ,
59004017	Sin	Jakziltat Yooz kuz zizzaj niiqui , Yooz kuzcama kamz waquizic̈ha . Ana nii Yooz kuzcama kamc̈haj niiqui , uj paac̈ha .
66019005	Faith	Nekztanaqui mantiz puestuquiztan tsjii jora nonzinc̈ha tuz̈ chiiz̈quiñi : “ Tjapa Yoozquin sirwiñinaca , Yoozquiz honora waytila . Koltami pakjimi tjapa Yoozquin rispitñinacami , Yoozquiz honora waytila ” .
47005002	Faith	Tii muntuquiz sufricanaqui anchal pasnuc̈ha ayincan . Ew arajpach curpu anchal pecuc̈ha , nekz kamzjapa .
48006004	Recommendation	Zapa mayni persun kamtanaca tantiistanc̈ha , zuma ana zuma kamta , jalla nii . Jakziltat zuma kamchiz̈laj niiqui , cuntintuz̈ cjesac̈ha , persuna zuma kamtaz̈ cjen . Criichi z̈oñinacaqui yekja z̈oñz̈ kamaña iñarz̈cu , anaz̈ mitarazi kuzziz cjis waquizic̈ha , “ Wejrqui juc'ant zuma kamañchiztc̈ha ” cjican .
46007036	Recommendation	Tsjiilla cjesac̈ha , zalz puntuquiztan zakaz . Jakzilta z̈oñz̈tat tsjaa majt z̈elac̈haja , zalz irarquiz tjonchiñ , niz̈aza ancha zalz pecchiñ . Ana chajalztiquiztan niiz̈ kuz turwayskatc̈haj niiqui , tuz̈ chiiz̈inuc̈ha . Niiz̈ tur chjalz wali tantiiz̈cu , chjalznasac̈ha . Nii chjalzqui anac̈ha ujqui .
43016002	Violence	Jazta timpuquiz anc̈hucqui ajcz kjuyanacquiztan chjatkattaz̈ cjequic̈ha . Niz̈aza tsjii sufris ora tjonaquic̈ha . Jalla nii oraqui jecmit anc̈huc conac̈haja , jalla nii conñi z̈oñiqui cjequic̈ha , “ Wejrtc̈ha Yooz sirwintqui . Jalla niz̈tiquiztan nii z̈oñi conchinc̈ha ” , nuz̈ cjequic̈ha .
66015001	Description	Jalla nekztanaqui arajpachquin tsjii siñala cherchinc̈ha . Nii pajk siñalaqui ancha ispantichucatac̈ha . Pakallawk anjilanacaqui z̈elatc̈ha , pakallawk anawalinacchiz . Jalla nii anawalinaca wattan Yooz casticz z̈erzta cjequic̈ha .
43018023	Description	Jesusaqui nii zultatz̈quiz kjaazic̈ha , tuz̈ cjican : — Wejr ana zuma chiituc̈haj niiqui , ¿ jaknuz̈t cjican ana zuma chiichintajo ? Zumal chiyuc̈ha . ¿ Kjaz̈tiquiztan am wejr tsjajpjo ?
50004003	Recommendation	Wejt lijitum Cristuz̈quiz sirwiñi mazi , amquiz rocuc̈ha , tii pucultan cullaquinacz̈quiz yanapt'alla , porapat zuma munaziñi kuzziz kamzjapa . Nii pucultan cullaquinacaqui wejttan chica liwriiñi taku paljaycan langzic̈ha . Niz̈aza nii cullaquinacaqui Clementiz̈tan , niz̈aza parti wettan chica paljayñi mazinacz̈tan langzic̈ha . Tjapa ninacz̈ tjuunacaqui listitac̈ha arajpach z̈ejtz liwruquiz .
66016006	Sin	Nii casticta z̈oñinacaqui am parti z̈oñinacami , niz̈aza am parti parliñi z̈oñinacami conchic̈ha . Jaziqui amqui nii z̈oñinacz̈quiz ljoc lickatchamc̈ha . Jalla nuz̈upan ninacz̈ta waquizic̈ha .
45006002	Sin	Pero wejr cjiwc̈ha , anapanz̈ uj paaz waquizic̈ha . Tuquitan ticzi z̈oñinacaz̈takaztac̈ha uc̈humqui , anazum kamañchiz kamcan . Pero uc̈humz̈ tuquitan anazuma uj paañi kamañquiztan jaytichinc̈humc̈ha . Jalla niz̈tiquiztan uj paañi kamañchiz anapanz̈ kamz waquizic̈ha .
66017011	Violence	Nii tuqui z̈ejlñi , nekztan ana z̈ejlñi animalaqui octavo mantiñi jiliric̈ha . Pero nii pakallawk mantiñinacz̈ partiquiztankalc̈ha . Niz̈aza ultimquiziqui infiernuquin chjatkattaz̈ cjequic̈ha .
48004030	Recommendation	Cjijrta Yooz takuqui tuz̈ cjic̈ha : “ Naa piyuni majchtanpacha chjatkata . Naa piyunaz̈ majtta majchqui anaz̈ irinsa tanznaquic̈ha . Antiz zalz̈ta tjunaz̈ majtta majch , jalla niikaz irinsa tanznaquic̈ha ” .
54006009	Sin	Jakziltat wali jiru cjis pecc̈haja , ujquiz tjojtsnasac̈ha , niz̈aza ana wal jiczquiz lusasac̈ha . Nekztan zumzu pinsamintuchiz cjesac̈ha . Niz̈aza persun quintra ana wal kamzquizkaz pecasac̈ha . Nekztan nii ana wal kamtiquiztan tjappacha pertaquic̈ha . Liwj akztaz̈ cjisnaquic̈ha nii z̈oñiqui .
66017016	Violence	Niz̈aza nii amiz̈ cherta tunca wajranacaz̈takaz mantiñinacaqui anawal animalz̈tan naa puturii maatak quintra chjaawjkataquic̈ha . Nekztan naa maataka akznaquic̈ha , niz̈aza ana zquitchiztakaz cjiskataquic̈ha . Niz̈aza naaz̈a curpu lujlznaquic̈ha . Niz̈aza ujz̈tan ujznaquic̈ha .
46008003	Faith	Jakziltat Yoozquin tjapa kuz tjaac̈haja , Yoozqui nii z̈oñi pajc̈ha niiz̈ maati cunta .
45003009	Sin	Nekztan , ¿ kjaz̈ cjii ? ¿ Uc̈hum judío z̈oñinacaqui parti z̈oñinacz̈quiztan tsjan wali z̈oñinacajo ? Anapanz̈ cjesac̈ha . Wejrqui kjanapacha tjeezinc̈ha , judío wajtchiz z̈oñinacami niz̈aza yekja wajtchiz z̈oñinacami tjappacha ujz̈ mantuquiz z̈ejlc̈ha , nii . Tjapa z̈oñinacami uj paazquin kuz tjaac̈ha .
44007041	Sin	Jalla nekztanaqui nii z̈oñinacaqui korquiztan tsjii wac chul turu paakatchic̈ha ninacz̈tajapa , tsjii yooz cjisjapa . Nekztan nii paata yoozquiz wilana conchic̈ha . Niz̈aza ninacaz̈ paata yoozquiztan ancha cuntintutac̈ha .
66009020	Sin	Nii anawalinacaz̈ ana conta z̈oñinacazti Yoozquin anapanz̈ kuz tjaachic̈ha . Z̈oñiz̈ paata yooznacz̈quin rispitzquiztan anapan jaytichic̈ha . Tirapan rispitchic̈ha zajranacz̈quizimi niz̈aza z̈oñiz̈ paata yooznacz̈quizimi . Ninacz̈ yooznacaqui paatatac̈ha korquiztan , paazquiztan , mazquiztan , tabliquiztan , jalla niz̈tanaca . Nii z̈oñiz̈ paata yooznacatac̈ha ana cherñimi , niz̈aza ana nonzñimi , niz̈aza ana ojklayñimi .
47005011	Faith	Jalla niz̈tiquiztan Jesucristo Jiliri ekscan zuma razunz̈tan anc̈hucaquiz chiyuc̈ha , zuma kamanchiz kamiñc̈ha , cjican . Toscara anal chiyuc̈ha . Wejt kamaña Yooz zizza . Wejr cjiwc̈ha , anc̈hucqui zakaz zizza zuma kamañchiz kamiñc̈ha , jalla nii .
49002003	Sin	Tuquiqui uc̈humqui ana wal kamañchiz zakaz kamatc̈ha , Yooz kuzcama ana kamcan . Uc̈humqui persun kuzcamakaz kamatc̈ha . Niz̈aza uc̈hum ana wali pecñi kuz jaru kamatc̈ha . Niz̈aza uc̈hum ana wali pinsitanacz̈ jaru kamatc̈ha . Jalla niz̈tiquiztan uc̈humqui Yooz casticta cjichucapantac̈ha , jaknuz̈t Yoozqui parti ujchiz z̈oñinaca casticac̈haja , jalla niz̈ta .
44002040	Recommendation	Wacchi takunacz̈tan Pedruqui ninacz̈quiz chiiz̈inchic̈ha , tuz̈ cjican : — Liwriita cjis waquizic̈ha , Cristuz̈ quintra uj paañi z̈oñinacz̈tan ana casticta cjisjapa .
45008013	Faith	Jakziltat persun kuzcamakaz kamchiz̈ cjec̈haja , jalla niiqui Yooziz̈ wiñaya castictaz̈ cjequic̈ha . Pero jakziltat Espíritu Santuz̈ mantuquiz z̈ejlc̈haja , jalla niiqui uj paaznaca jaytic̈ha . Jalla nuz̈ ujnaca jaytichiz̈ cjen , Yooz kamañchiz kamaquic̈ha .
45010011	Faith	Cjijrta Yooz takuqui tuz̈ cjic̈ha : “ Jakziltat Yoozquin kuz tjaac̈haja , jalla niiqui ana inakaz kuz tjaaquic̈ha ” .
45001008	Faith	Jaziqui anc̈hucaz̈ zuma kamtiquiztan Yooz Ejpz̈quin ancha gracias cjican chiyuc̈ha . Tjapa wajtchiz z̈oñinacaqui anc̈huc puntu chiic̈ha , anc̈hucqui ancha Jesucristuz̈quin kuzzizza , nii . Jesucristuz̈ cjen Yoozquin gracias cjican chiyuc̈ha .
52001004	Faith	Jilanaca , cullaquinaca , Yooziz̈ pectanaca , Yoozqui anc̈huc illzic̈ha . Jalla nuz̈ zizcu , wejrnacqui Yoozquin sparaquiz̈ cjiwc̈ha .
60004008	Recommendation	Jalla tuz̈uc̈ha chekanaqui , porapat zuma munaziñi kuzzizpankaz cjee . Zuma munazican , parti z̈oñinacz̈ ujnac puntuquiztan ana ancha cjuñasac̈ha .
