56003001	Recommendation	Tiɛre Kristo yaab kí ye bɛ ń li tuonh gobina nin tibuur ya ciɛnb ya ñuɔn bó , kí li boh bɛ , kí li yé binib bà bonde ' bɛ ń li teh nà mɔn ,
61003005	Sin	Bi lienh nnɔ ma nnɔ bi sunde ' ŋɔ ki ye Uwien là len ' nɛ kutaaku nin kitink ñɛn ' haali uyoyo . U taan ' miñunm bùol liba ki cère ' kitink ñɛn ' upaan bo .
60003018	Grace	Kristo nin uʼyul kpo ' bolm miba kpein nɛ binib ya biɛre bo . Wɔn wà ŋa tien ' nà bre nnɔ tuo ' ki teke ' bà teh nà bre ya kuum ki kpo ' ŋɔ wɔ ń taa nɛ kí baa Uwien saan . Bi ku ' uʼnisaalgbɛnɛnt ama *Mifuoñaanm cère ' u mɛkre ' ki fuobe .
61002021	Sin	Kimɛ ba bi bɛnde ' tigbɛmɔ̀nt ya sɛn la , nì bi tu nin bɛ ń bɛnde wù ŋɔ kí wiɛ Uwien ya gbɛr tà bi là wɔkn ' bɛ tù nnɔ .
53003006	Recommendation	Tiʼyaabɛ , ti tɔkeh nɛ Yonbdaan *Yesu Kristo ya yel bo nɛ ki teh : niʼyɔ wà kɛ ŋa yíe tuonl ya gbɛr , ka pɛ ti là wɔkn ' nɛ miwɔknm mà nnɔ bo la , ní wiɛ uʼgbɛr .
45005012	Sin	Unibaab bo nɛ ibiɛre cin ' uŋɛndun ni . Ibiɛre nnɔ nɛ tuke ' mikuum ki baa ' , nɛ binib kɛ kpuokeh kimɛ biʼkɛ teh ibiɛre nɛ .
58011033	Faith	Biʼni biba là teke ' Uwien ki jin ' , nɛ ki faake ' nin bibɛrb ki fie ' biʼdu ki tien ' biʼyi , bitɔb cère ' binib kpìen ' tigbɛmɔ̀nt ya sɛn , bitɔb laa ' Uwien là pùon ' nà nnɔ , bitɔb pi ' icind ya ñuɔn ya fre ' ki tien ' bɛ niba ,
47004009	Faith	Bi bùuh tɛ , ama ba nɛ̀ndeh tɛ . Bi gbɔ̀breh tɛ , ama ba freh ki gbendeh tiʼgbɛr .
59004004	Sin	Ni yé binib bà ŋa cuube Uwien saan nɛ . Na bɛn ki ye unil yíe uŋɛndun la , u yé Uwien ya nɛnnɛnd nɛ-ɛɛ ? Wà nuunh wɔ ń jɔre nin uŋɛndun la , u kpɛndeh Uwien ya nɛnnɛnd nɛ .
44016006	Description	*Mifuoñaanm pien ' Pɔl nin uʼtɔntɔknlieb bi la tɔke Uwien ya gbɛr Asi ya tinfɛnm ni . Nɛn bo nɛ bi gɛ̀bre ' Friji nin Galasi ya tinfɛnm ,
45010006	Faith	Ama bà nuunh bɛ ń li yé bigbɛmɔ̀ndɛnb mitekjim bo nnɔ ya gbɛr wɔn , nì kɛle ' *Uwien ya gbɔnku ni ki ye bi la li maaleh biʼyɛnm ni ki teh : « Ŋmɛ li dùo paaki bó ? » Niʼtingi si : ŋmɛ li jiin Kristo ní ?
66016002	Violence	Ukpiɛk bure ' ki tì taa ' nà te uʼsɛnl ni nnɔ ki wule ' kitink bo . Nɛ inɛl yà bre ki wi ki gbien ' yèyèke ' binib bà ŋmɔbe kiwɛnk nnɔ ya dìɛku ki gbaandeh ki pukeh kiʼnɛnnɛnku nnɔ .
66005008	Description	Kì teke ' kugbɔnku nnɔ uyo wà nnɔ , nɛ tiwɛnfuobt tunan nin biciɛnb pile nin binan nnɔ gbaan ' kiʼnintuɔli . Wà kɛ ŋuuke kubìɛku nin miñɔ̀km ya sɛ̀n nɛ , ì gbe lɛfina . Isɛ̀n nnɔ yé Uwien ya nib ya kaare nɛ .
62005001	Faith	Wà kɛ teke ' ki jin ' ki ye *Yesu yé Uwien ya Nigɛndkɛ Kristo la , udaan yé Uwien ya buk nɛ . Wà kɛ yíe kibuk ya baa la , u yíe uʼbuk mɔ nɛ .
48005026	Recommendation	Cère mɛn ti la li ŋmɔbe nacenkpekuont , ki la li dɛlkeh tɔb , ki la li ŋmɔbe ponponbe tɔb bo .
54005001	Recommendation	La gbiereh jɛciɛn nin jɛr , ama li gbiereh wɔ tɛn aʼbaa , kí li gbiereh binacenfɛ̀nb tɛn aʼninjiɛb ,
60002012	Recommendation	Ní li ŋmɔbe mitetemɔnmɔnm bà ŋa pɛ Wien bo ya nun bó , ŋɔ nì yé bi lienh ki saah nɛ isɛn iba ni ki teh ni teh nà bre mɔnɔn la , bɛ ń lɛ niʼtùonmɔnmɔn kí pɛ̀ke Uwien u li baa lidaali là .
50003006	Sin	Nʼtùon ya sɔnm ni , nʼnun là mɔ́n ń jɛ̀nde Kristo ya taanl yaab nɛ . Yiko ya sɛn ni mɔ la , ma là ŋmɔbe biil yiko uba bo .
43004052	Description	Nɛ u niire ' bɛ ki ye : « U lɛ yo ba nɛ uʼgbɛnɛnt tunge ' ? » Nɛ bi tɔke ' wɔ ki ye : « Wenli kutaajuɔku kukurku kuba ya yo nɛ uʼgbɛnɛnt wun sɔnge ' . »
43019031	Violence	Nì là yé lidaali là *Sufmbɛ bondeh biʼSaba nɛ . U ya *Saba là yé uwengbenge nɛ . Nɛn bo nɛ *Sufmbɛ ya ciɛnb ŋa là yíe nikpil ń li te dɔpɔnpɔn bo , nɛ ki tɔke ' Pilat ki ye wɔ ń cère uʼsojambɛ ń ñì kí kuɔ bi kpɛ ' binib bà nnɔ ya tàan , kí jiin bɛ .
43019012	Description	Nɛn saan nɛ Pilat nuunh u li tien ma kí wiɛ Yesu , ama *Sufmbɛ wuureh nɛ ki teh : « A wiɛ ' wɔ la , ŋa ji yé ubɛrciɛn Sesa ya jɔ , kimɛ unil wà kɛ yih uʼba ubɛr la , u yé Sesa ya nɛnnɛnd nɛ . »
43014001	Faith	*Yesu tɔke ' uʼpanpaankaab ki ye : « La cère mɛn niʼyɛnm ń saa . Teke mɛn Uwien kí ji , kí teke nʼmɔ kí ji .
50001028	Faith	La sɛn mɛn niʼnɛnnɛndb jɛwaanbu . Nɛn nɛ li wuɔn bɛ kí ye bi joh mibolm nɛ , kí wuɔn niʼmɔ kí ye ni li ŋmɛre . Nì yé Uwien yaam nɛ .
43015016	Grace	Na yé ninbi nɛ gɛ̀nde ' nni , min nɛ gɛ̀nde ' nɛ , ki de ' nɛ lituonl kí ye ní li joh , kí li te tɛn isigben yà lùonh isibii yà li tuu ki te . Nɛn bo , ni miɛ ' nʼBaa nibonn nà kɛ nʼyel bo la , u li de nɛ nɛ̀ nɛ .
58011004	Faith	Abɛl là teke ' Uwien ki jin ' , nɛ ki tien ' lituɔrl là mɔn ki cɛn ' Kayɛn yaal , ki de ' wɔn Uwien . Nɛn bo nɛ Uwien bù ' Abɛl ugbɛmɔ̀ndaan ki tuo ' uʼpaabu . Nin Abɛl kpo ' ma kɛ nnɔ , mitekjim nnɔ bo nɛ u biɛ ki lienh .
46004001	Recommendation	Nɛn bo , unil kɛ ń li bɛn kí ye ti yé Kristo ya tonsɔnb nɛ , ki yé binib bà Uwien taa ' uʼgbɛbɔlkaar kɛ ya bol ki ŋukn ' tɛ tí taa tù kí tɔke binib .
66006013	Description	Iŋmaabii cienh paaki bó ki lá luh kitink bo tɛn kutafaabiiku nɛ yòkreh ikɛnkɛnkaab .
46010014	Recommendation	Nɛn bo , nʼjɔtiebɛ , wiɛ mɛn ibule nin ituɔrɛ ya gbɛr .
45012021	Recommendation	La cère mibiɛrm ń faake nin ŋɛ . Li faa nin mibiɛrm aʼmɔnm bo .
55002014	Recommendation	Tiɛre binib tigbɛr tuu nɔ , kí tɔke bɛ Uwien ya nun bó , kí ye bi la li findeh ñɔbon bo , kimɛ ifinfinde nnɔ ŋa pukndeh niba , ì tulndeh bà cengeh yì nnɔ nɛ .
59004008	Recommendation	Nɛkn mɛn Uwien , uʼmɔ li nɛkn nɛ . Bibiɛrdɛnbɛ , tùɔre mɛn niʼba . Ninbi iñuɔn ilele ya nibɛ , wende mɛn niʼfɛ̀l .
59002009	Sin	Ama ni ŋmɔbe igɛ̀ngɛ̀nde niʼni la , ni teh ibiɛre nɛ . Nɛ yiko nnɔ li cère bɛ ń biin nɛ , kimɛ na bon ' wɔ .
52004007	Grace	Kimɛ Uwien ŋa yin ' tɛ , tí li teh nà kuɔndeh tɛ jɔknt , u yin ' tɛ tí li ŋmɔbe mitetem mà mɔn nɛ .
45001018	Sin	Uwien wɔngeh haali paaki bó nɛ ki teh uʼmutuol fii ' binib bo . Kimɛ bi sɔnh itùonbiɛrɛ nɛ ka pɛ uʼbo , ki piendeh tigbɛmɔ̀nt ya sɛn biʼtùonbiɛrɛ nnɔ bo .
62004007	Faith	Nʼjɔtiebɛ , cère mɛn tí li yíe tɔb , kimɛ miyíem ñɛn ' Uwien saan nɛ . Wà kɛ ŋmɔbe miyíem la , u yé Uwien ya buk nɛ , ki bɛn Uwien .
62002009	Sin	Wà kɛ ye u te kuwenwenku ni , ki nɛn uʼtɔ la , u biɛ ki te licinñunl ni nɛ .
60004014	Grace	Bi sukreh nɛ , kimɛ ni yé Kristo yaab la , Uwien ya mɔnm te niʼbo , kimɛ *Uwien ya Fuoñaanm mà ŋmɔbe ukpiɛke nnɔ te niʼbo .
44021019	Grace	Pɔl fuonde ' bɛ ki tì gben ' , nɛ ki tɔke ' bɛ niʼkɛ dokdoki kí ñɛ uʼtuonl bo Uwien tien ' nà bà ŋa yé *Sufmbɛ ya siik ni .
43008046	Sin	Niʼni , ŋmɛ li fre kí wuɔn kí ye n fii ' ma , n tien ' ibiɛre ? N tɔkeh tigbɛmɔ̀nt nɛ . Bɛ tien ' na teknh nʼgbɛr ki jinh-i ?
58010017	Grace	
46001005	Grace	Kimɛ ni yé uʼyaab ma nnɔ nɛ Uwien tien ' nɛ mimɔnm ki gbien ' isɛn kɛ ni , milenm nin mibɛnm kɛ ni ,
45015030	Recommendation	Nʼyaabɛ , tiʼYonbdaan *Yesu Kristo bo nin *Mifuoñaanm ya yíem bo , nɛ n gbáanh nɛ , ní tore nni kí li kàareh Uwien ki dienh nni ,
43007020	Violence	Nɛ linigol nnɔ tɔke ' wɔ ki ye : « Usɛnpol nɛ ŋaake ŋɛ ! Ŋmɛ nuunh wɔ ń ku ŋɛ ? »
45003025	Grace	Uwien taa ' wɔn nɛ ki tien ' lituɔrl uʼsɛ̀m bo , ki dɛ ' bà kɛ teke ' wɔ ki jin ' ki wiɛ ' , ki wuɔn ' wɔn Uwien ya gbɛmɔ̀nt , ka dɛre ' binib ya tub biʼbiɛre bo uyo bo ,
43018018	Description	Tiwɔr là te , nɛ bitɔtuɔrciɛnb ya ciɛn ya tonsɔnb nin biguguurb sɛ̀re ' umu , ki lokreh . Nɛ Piɛr mɔ te biʼsaan ki lokreh .
49006011	Recommendation	Taa mɛn Uwien dienh tijɛkɔnwɛnt tà kɛ nnɔ ŋɔ kí li faa kí fre kí tuobe usɛnpol nin uʼcekn ya sɛn kɛ .
43013037	Faith	Nɛ Piɛr niire ' wɔ ki ye : « Yonbdaan , bɛ bo nɛ ma ń fre kí paan aʼbo fɛnfɛnnɔ ? N li tuo kí kpo aʼbo-a ! »
50004007	Faith	Nnɔ nɛ Uwien ya yɛnduɔn wà cɛn ' unisaal ya bɛnm kɛ nnɔ , li de nɛ lifɛ̀sɔngl , kí cère niʼyɛnm ń li dɔ kí ñɛ *Yesu Kristo bo .
59003009	Faith	Ti taah lilɛnl nɛ ki pɛ̀keh Baa Yonbdaan , ki liɛbe ' ki taah lɛn nɛ ki wiɛnh binib bà wɔn Yonbdaan Uwien ñɛn ' bɛ , bi naan wɔ nnɔ miŋùum .
46005010	Sin	Ma niireh kutataaku ni uŋɛndun ya nib bà yé isɔnsɔnd nin binunfɔkdɛnb nin binasub nin bà pɛ ibule bo nnɔ . Nì bi yé bɛn la , ni bi li ñɛ uŋɛndun wuu ni nɛ .
44026009	Sin	Min mɔnɔn là maaleh ki teh nì kpɛ , nì tuo ' la , ń ñɛ isɛn kɛ kí saa Nasarɛt ya *Yesu ya yel nɛ .
61002014	Sin	Biʼyɛnmaale kɛ pɛ bipiib bo nɛ . Bi teh ibiɛre nɛ ka jiireh , ki lɛreh ki coh bà ya tekjim ŋa faa . Ba gbuokeh bont nɛ biʼyɛnmaale kɛ pɛ tuʼbo , ki yé binib bà te miŋùum ni .
43010012	Description	Unil wà ŋa cinbe ki yé pekpaal ki kpaah ipe ilike bo , ŋɔ ka yé pedaan mɔ nnɔ , laa ' ukɛ̀r we ní la , u li sɛn kí cère yɛ̀ nɛ . Ukɛ̀r li cuo iba , nɛ yà sìen ' ń yɛyɛre .
59001019	Recommendation	Nʼyaab bà n yíe bɛ , bɛnde mɛn kí ye nì mɔn unil kɛ ń pele itub kí li cengeh nɛ , ama wɔ ń cuo uʼlɛnl , ki la cère uʼbenku ni mɔ ń li beh tontonm ,
46009014	Recommendation	Nnɔ nɛ Yonbdaan là de ' usɛn ki ye binib bà kpaandeh tigbɛmɔnmɔnt nnɔ , ń li fuobe tun bo .
43012046	Grace	Min yé kuwenwenku nɛ ki baa ' uŋɛndun ni , ŋɔ unil wà kɛ teke ' nni ki jin ' la , u la juore cinñunl ni .
43005014	Description	Uyo uba nɛ *Yesu lá laa ' wɔ Uwien ya duku ya luo bo , nɛ ki tɔke ' wɔ ki ye : « Liike , fɛnfɛnnɔ a faake ' - a ! A la ji ń tien biɛre ŋɔ ijɛnd yà cɛn ' yiɛ nɔ la tu ŋɛ . »
46016014	Recommendation	Li teh mɛn tibont kɛ nin miyíem .
43014015	Recommendation	Ni yíe nni la , ni li boh nʼwɔb nɛ ,
58012025	Recommendation	Liike mɛn niʼyul bo , ki la yìe ka ń cenge wà lienh nɛ nnɔ bó . Moyis là tɔke ' binib Uwien ya gbɛr kitink bo , ba cenge ' uʼbó nɛ ka ñɛn ' utudɛre ni . Nì li tien mila ŋɔ tinbi bà Uwien lienh tɛ haali paaki bó nnɔ ta tɔnge ' uʼgbɛr la , ti li ñɛ utudɛre ni ?
48004008	Sin	Na laan là bɛn Uwien ma nnɔ , ni là pɛ ibule bo nɛ ì co nɛ tiyonbt . Ibule nnɔ ŋa yé Wien .
44003026	Grace	Mikpiɛkm , ninbi bo nɛ Uwien là gɛ̀nde ' uʼtonsɔnl Yesu , ki sɔn ' wɔ niʼsaan wɔ ń lá tien nɛ Uwien ya mɔnm , kí ñɛn niʼni wà kɛ uʼtùonbiɛrɛ ni . »
44010039	Violence	U tien ' tibont tà kɛ *Sufmbɛ ya du ni nin Yerusalɛm ni nnɔ , tinbi nɛ yé tuʼmɔ̀nkunb . U ya *Yesu nɛ bi kpɛ ' wɔ udɔpɔnpɔn bo , ki ku ' wɔ .
46001010	Recommendation	Nʼyaabɛ , tiʼYonbdaan *Yesu Kristo ya yel bo nɛ n sureh nɛ ní li lienh ki ciih tɔb bó , ki la cère borm ń li te niʼni . Ama ní li kpɛ buñɔbu mɔnmɔnm , kí li ŋmɔbe iyɛnmaale iba , kí li kpe usɛn uba .
51001021	Sin	Uyo uba niʼmɔ là yé binib bà jɛnde ' Uwien nɛ , ki yé uʼnɛnnɛndb kí ñɛ ni là ŋmɔbe iyɛnmaale yà ì cèreh ni teh nà bre nnɔ bo .
55002022	Recommendation	La paan bifɛ̀nb fɛ tibonbiɛrt tà nnɔ bo . Li nuunh á li teh nà cuube , kí li ŋmɔbe mitekjim nin miyíem , kí li kpe uyɛnduɔn ya sɛn . Li te nnɔ nin bà muɔh ki yih Yonbdaan biʼfɛ̀l bo ŋa ŋmɔbe jɔknt nnɔ .
51003001	Faith	Ni taan ' ki mɛkre ' nin Kristo ma nnɔ , li nuunh mɛn paaki bó ya bont Kristo kɛ nà saan Uwien ya jie bó nnɔ .
66008007	Violence	Ukpiɛk piebe ' uʼnatunl , nɛ bi taa ' itɛtɛn ki taan ' nin umu nin misɛ̀m ki wiɛ ' kitink bo . Nɛ kitink ya gbiirm mita ya miba wìn ' , isiin mɔ ya gbiirm mita ya miba wìn ' , nɛ timɔsɔngt kɛ mɔ wìn ' .
66011017	Faith	ki teh : « Yonbdaan Uwien , mituɔm kɛ ya daan . Sin wà là te , ki biɛ ki te nnɔ , ti faareh ŋɛ , kimɛ a taa ' aʼtɔciɛnm nɛ ki jin ' aʼbɛl .
43004010	Grace	Nɛ *Yesu ye : « A bi bɛn Uwien ya paabu , ki tí bi bɛn wà miɛh ŋɛ miñunm nɔ la , sin nɛ bi li miɛ wɔ , nɛ u bi li de ŋɛ mifuobm ya ñunm . »
51003004	Grace	Kristo nɛ yé niʼmiɛl . U lá li ñɛn uʼba upaan bo uyo wà nnɔ niʼmɔ li taan nin wɔ kí ñɛ upaan bo , kí lɛ uʼkpiɛke .
43020031	Faith	Bi kɛle ' tuu nɔ ŋɔ ní teke kí ji kí ye *Yesu yé Uwien ya Nigɛndkɛ Kristo , ki yé Uwien ya Bijɛ nɛ . Ni teke ' wɔ ki jin ' la , wɔn bo nɛ ni li lɛ limiɛl .
62004006	Faith	Tinbi bɛn wɔn , ti yé Uwien yaab nɛ . Wà kɛ bɛn Uwien nɛ cengeh tiʼbó . Wà kɛ ŋa yé Wien yɔ ŋa cengeh tiʼbó . Nɛn nɛ cère ' ti bɛnde ' *Mifuoñaanm , mɛn mà yé tigbɛmɔ̀nt nnɔ te binib bà ni , ki cère ' ti bɛnde ' usɛnpol utonnɛndaan mɔ te binib bà ni .
65001012	Description	Ninbi Kristo yaab taan ' ní ji tijier la , bi saake niʼni tɛn tijɔknt nɛ ki saah niʼjiejin , ki jinh fuɔlfuɔl , fɛ ŋa ŋmɔbe bɛ , ki maaleh bɛn baba bó . Bi te tɛn utaa wà yin ' ki bɔnde ' ki juore ' nin kutafaaku ka nii ' nɛ ; ki te tɛn isiin yà ŋa lùonh haali iʼlònlùonyo mɔnɔn , ki kpìkre ' ki lu ' , ki kpo ' kɛkɛ nɛ .
44005015	Description	*Yesu ya tondb teh miyɔkm ya bont ma nnɔ , nɛ binib yuunh biwiɛnb ki là blinh tikaagbɔnt nin igado bo isɛngbɛ , ŋɔ Piɛr lá gɛ̀breh , uʼjinjinku mɔnɔn lu ' biʼbo la , bɛ ń faake .
49006016	Faith	Li taah mɛn mitekjim ki teh tɛn lipikl uyo kɛ . Ni li taa lɛn nɛ kí fre kí kpiin usɛnpol ubiɛrɔ ya pien yà teknh umu nnɔ ,
51003023	Recommendation	Ni teh nà kɛ la , ní li teh nɛ̀ nin niʼfɛ̀l kɛ tɛn ni teh ki dienh Yonbdaan nɛ , na teh ki dienh nib ,
58012016	Recommendation	Li bɛn mɛn , ki la li teh sɔnsɔndl , ki la li likeh Uwien ya bont fɛnm tɛn Esawu là tien ' ma ki kuɔre ' u ŋmɔbe kibuciɛnk ya kpɛle wà nnɔ , ki teke ' tijier ki jin ' nɛn saan .
43018040	Sin	Nɛ bi wuure ' ki ye : « La wiɛ wɔn , wiɛ Barabas . » Barabas nnɔ là yé unil wà yìe ' Erom yaab ya ñɔbu bó nɛ .
55003004	Sin	kí li yé binikuɔrb , kí li ŋmɔbe lifɛ̀tònl . Tigbengt li cère bɛ ń li te tɛn ijùɔn , kí li fɛ uŋɛndun wuu ni ya bont ki cɛn ' Uwien .
50002009	Grace	
61001016	Description	Tɔ , na yé ti taa ' unisaal ya yɛnfuom ya gbɛyiɛnkaar nɛ ki tɔke ' nɛ tiʼYonbdaan *Yesu Kristo ya baam nin uʼtuɔm ya gbɛr , ama tiʼnunbu nɛ laa ' uʼyɛbn .
61003016	Sin	Uʼgbɔnt kɛ ni , u ye wɔ ń len tuu ya gbɛr bo la , u lienh nnɔ nɛ . Nibɛmbɛ saan ya ciim faa nɛ , nɛ binib bà ŋa bɛn niba , ka tukn ' wɔknm miba bo coh tuʼtingi ki lèbreh tɛn bi lèbreh *Uwien ya gbɔnku ni ya gbɛtɔr ya tingi ma bo , ki tulndeh biʼba .
44014014	Description	Ama *Yesu ya tondb Banabas nin Pɔl cii ' nnɔ ma nnɔ , biʼyɛnm saa ' ki gbien ' , nɛ bi cuo ' biʼliɛr ki kɛre ' , ki sɛn ' ki kɔn ' linigol nnɔ ya siik ni , nɛ ki wuureh
45015008	Faith	N tɔkeh nɛ nɛ , Kristo là tien ' *Sufmbɛ ya tonsɔnl , ŋɔ Uwien là pùon ' biʼyaajɛb nà nnɔ nɛ̀ ń tien nɛ . Nɛn nɛ wɔngeh ki teh Uwien yé umɛmɔ̀ndaan .
59001026	Sin	Unil ye u pɛ Uwien ya sɛn bo , ka coh uʼlɛnl la , u lɛreh uʼba nɛ . Nɛ uʼWien ya sɛn bo ya paanm nnɔ mɔ yé fɛnm nɛ .
43015020	Recommendation	Li tiɛn mɛn n là tɔke ' nɛ nà ki ye : ‹ Utonsɔnl ŋa cɛn ' uʼcɛnbaa nnɔ . › Bi jɛ̀nde ' min la , bi li jɛ̀nde niʼmɔ nɛ . Bi tuo ' nʼgbɛr la , bi li tuo niʼmɔ yaar nɛ .
43008031	Faith	Nɛ *Yesu tɔke ' *Sufmbɛ bà teke ' wɔ ki jin ' nnɔ ki ye : « Ni pɛ nʼgbɛr bo ka dàan ' tù la , ni mɔnbe ki yé nʼpanpaankaab nɛ ,
44007011	Description	Tɔ , mikònm miba ya bol lu ' Esipt nin Kanaan ya du ni niʼkɛ saan . Nì là yé micɛcɛkciɛnm nɛ binib bo . Tiʼyaajɛb ŋa ji là ŋmɔbe bi li ji bà .
63001004	Faith	N laa ' aʼbumu muba pɛ tigbɛmɔ̀nt bo tɛn Baa Uwien de ' tɛ liwɔbl ma bo nnɔ , nɛ nʼyɛnm sɔnge ' ki gbien ' .
54005008	Faith	Wà ŋa toreh uʼyaab , niʼkɛ tu nin wa toreh uʼtiɛma dencɛnl ni yaab la , u wiɛ ' mitekjim ya sɛn nɛ , ki bre ki cɛn ' wà ŋa teke ' Kristo ki jin ' .
58010022	Faith	Nɛn bo , cère mɛn tí nɛkn Uwien , kí li ŋmɔbe iyɛnmaale yà cuube , kí li ŋmɔbe mitekjim kí tì gben . Yesu bo , tiʼfɛ̀l bo wien nɛ , ka ji ŋmɔbe biil liba nin litɔl . Nì te tɛn bi taa ' miñunm mà ŋa ŋmɔbe jɔknt nɛ ki sìi ' tɛ .
48001023	Description	Ama bi là cii ' nà baba si : « Ujɛ wà là jɛ̀ndeh tɛ nnɔ , ji cuonh ki tɔkeh binib mitekjim ya gbɛmɔnmɔnt tà uʼnun là mɔ́n wɔ ń gben tù nnɔ nɛ . »
44027034	Recommendation	Nɛn bo ñikn mɛn kí ji tijier , kimɛ nì li tore nɛ ní ŋmɛre . Niʼni uba mɔnɔn ya yul ŋa ń gàare »
66002003	Faith	A ŋmɔbe kuminku , ki jin ' ijɛnd nʼbo , aʼfɛ̀l ŋa wɔ̀re ' ,
56002002	Recommendation	Tɔke ijɛciɛn kí ye yɛ̀ ń li coh iʼba tibont kɛ ni , kí li yé binib bà bi boh bɛ , kí li ŋmɔbe miyɛnm , kí li ŋmɔbe mitekjimɔ̀nm nin miyíem nin kuminku .
44017030	Recommendation	Uwien ŋa tɔnge binib ŋa laan là bɛn wɔ ki teh tibont tà nnɔ . Ama fɛnfɛnnɔ u ji tɔkeh uŋɛndun ya nib kɛ nɛ ki teh bɛ ń lèbre biʼtetem .
43019025	Description	*Yesu ya naa nin uʼnaa ya ninsɛ nin Klopas ya po Mari nin Mari Madelɛnn se uʼdɔpɔnpɔn saan .
66019013	Description	U guo kuliɛrku kuba nɛ kuʼkɛkɛ yé misɛ̀m , bi yih wɔ Uwien ya ñɔbonl .
46008009	Recommendation	Ama ní liike niʼyul bo , ki la cère wà ya tekjim ŋa faa ń lu Uwien ya sɛn ni , kí ñɛ ni ŋmɔbe usɛn ní li teh tibont tà nnɔ bo .
44013034	Grace	
43014020	Faith	Niʼdaali baa ' la , ni li bɛnde kí ye min nin nʼBaa taan ' ki yé unibaab nɛ , nɛ ninbi nin min mɔ taan ' ki yé unibaab .
62002003	Faith	Ti tuo ' Uwien ye nà la , nɛn nɛ wɔngeh tɛ ki teh ti mɔnbe ki bɛn Uwien .
43008024	Sin	Nɛn bo nɛ n tɔke ' nɛ ki ye ni li kpo nin niʼbiɛre . Kimɛ na teke ' ki jin ' ki ye n yé n yé wà ma nnɔ ni li kpo nin niʼbiɛre nɛ . »
66017006	Sin	Nɛ n laa ' upii nnɔ ñun ' Uwien ya nib ya sɛ̀m nin binib bà bi ku ' bɛ *Yesu bo nnɔ ya sɛ̀m ki yibe ' tɛn u ñun ' midaam nɛ . N laa ' wɔ ma nnɔ nɛ nì cuo ' nni miyɔkm cɛɛn .
58012017	Description	Ni bɛn ki ye ni ya puoli bó nɛ u ji là lá nuunh uʼbaa ń tien wɔ Uwien ya mɔnm nɛ wa cenge ' uʼbó . Nin u muɔ ' ki gbáan ' ma kɛ nnɔ uʼbaa ŋa lèbre ' yɛnmaale .
43007012	Description	Nɛ linigol nnɔ bunbeh ki tɔkeh tɔb uʼgbɛr . Biba teh u yé unimɔ̀n , nɛ bitɔb teh wa yé nimɔ̀n , u tulndeh binib nɛ .
44011021	Faith	Bi là ŋmɔbe Yonbdaan ya tuɔm nɛ . Nɛn bo nɛ binib teke ' Yonbdaan ki jin ' , ki lèbre ' biʼtetem , ki paan ' uʼsɛn bo ki yɛbe .
52002004	Faith	Ama Uwien bikn ' tɛ ki laa ' ti kpɛ tí tɔke binib uʼgbɛmɔnmɔnt nɛ ki taa ' tù ki ŋukn ' tɛ . Nɛn bo nɛ ta nuunh ti tɔkeh tù la , binib ya yɛnm ń li sɔnge tiʼbo , ti nuunh Uwien wà bɛn tiʼfɛ̀l ni te ma bo nnɔ ya yɛnm nɛ ń li sɔnge tiʼbo .
46015057	Grace	Nin nɛn kɛ tí faare mɛn Uwien , kimɛ wɔn nɛ dienh tɛ ufaa kí ñɛ Yonbdaan *Yesu Kristo bo .
54005005	Faith	Ukpopii wà ŋa ŋmɔbe wà li likeh wɔ , ki juore ' ki te uʼba kpein la , u du Uwien bo nɛ , ki tuu ki kàareh ki miɛh wɔ ñɔnku nin wien ni .
43016024	Grace	Na laan miɛ ' bonn nʼyel bo haali nin fɛnfɛnnɔ . Miɛ mɛn , ní li lɛ ŋɔ kí lɛ uyɛnsɔnge kí tì gben . »
46007021	Recommendation	Uwien yin ' ŋɛ ki laa ' a yé uyonb la , la cère nɛ ń li wi ŋɛ . Ama a laa ' usɛn á fre kí ñɛ tiyonbt nnɔ ni la , la cère nɛ̀ ń ŋmɛre ŋɛ .
65001019	Sin	Bɛn nɛ boreh binib , ki pɛ unisaal yíe nà bo , ka ŋmɔbe *Fuoñaanm .
48001006	Sin	Nì jin ' nni nɛ nin ni wiɛnh Uwien wà yin ' nɛ Kristo ya juokm bo ya gbɛr tontonm ma ki sikreh ki paakeh tigbɛtɔr bo nnɔ .
58012014	Recommendation	Li nuunh mɛn ní li ŋmɛ nin unil kɛ , kí li pɛ Uwien ya sɛn bo nin niʼfɛ̀l kɛ . Nnɔ ŋa ñí la , uba mɔnɔn ŋa ń lɛ wɔ .
43021006	Description	Nɛ u tɔke ' bɛ ki ye : « Wiɛ mɛn bubɛbu buñɛrbu ya jie bó , ni li lɛ . » Bi wiɛ ' ki cuo ' ijɛn ì yɛbe cɛɛn nɛ ka fre ' ki dɛre ' bubɛbu nnɔ ki jiin ' ní .
46007019	Recommendation	Unil jiɛ ' uʼpunl bii wa jiɛ ' la , nà yé nɛn nɛ yé nibonmɔ̀nn . Ama Uwien ya wɔb ya bom nɛ yé nibonmɔ̀nn .
45012008	Recommendation	Uwien de ' wà bupaabu wɔ ń li saakreh binib ya gbɛnɛnt la , wɔ ń li saakreh binib ya gbɛnɛnt . Uwien de ' wà bupaabu wɔ ń li punh binib tibont la , wɔ ń li punh ki la cuɔleh . Uwien de ' wà ticiɛnt wɔ ń li likeh binib la , wɔ ń li sɔnh uʼtuonl mɔnmɔnm . Uwien de ' wà bupaabu wɔ ń li muɔh binib micɛcɛkm la , wɔ ń li muɔh bɛ nin lifɛ̀sɔngl .
44019002	Faith	ki niire ' bɛ ki ye : « Ni tì teke ' *Yesu ki jin ' ma nɔ , *Mifuoñaanm jiire ' niʼbo ŋɔ-ɔɔ ? » Nɛ bi ye : « Tinbi ŋa laan lì cii ' nil len ' ki ye *Mifuoñaanm te mɔnɔn . »
53003014	Recommendation	Niʼni wà ŋa boh ti kɛle ' tigbɛr tà kugbɔnku kuu ni la , ní sekn udaan , kí wiɛ uʼgbɛr ŋɔ ifɛ ń cuo wɔ .
46015050	Sin	Nʼyaabɛ , n ye ń tɔke nà sɔ : nà ŋmɔbe tigbɛnɛnt nin misɛ̀m ŋa ń fre kí kɔ Uwien ya bɛl ni . Na li bùre nin nà ŋa ń bùre ŋa ń fre kí taan .
43006027	Recommendation	La sɔnh mɛn ki nuunh tijier tà saah . Ama li sɔnh mɛn ki nuunh tijier tà dienh nɛ limiɛl là ŋa ŋmɔbe gbenm . Unil ya Bijɛ nɛ li de nɛ tijier bugbɛn , kimɛ Baa Uwien bugbɛn wuɔn ' ki ye u de ' wɔn nɛ uʼtuɔm . »
59004003	Sin	Ni miɛh mɔnɔn la , na lɛnh , kimɛ niʼyɛnmaale ŋa mɔn . Ni miɛh ki nuunh ní li teh niʼyɛnm yíe nà nɛ .
49005020	Faith	kí li faareh Baa Uwien uyo kɛ nibonn kɛ bo tiʼYonbdaan *Yesu Kristo ya yel bo .
48003006	Faith	Kimɛ nì kɛle ' *Uwien ya gbɔnku ni ki ye : « *Abraham teke ' Uwien ki jin ' , nɛn bo nɛ Uwien bù ' wɔ ugbɛmɔ̀ndaan . »
66021023	Grace	Udu nnɔ ya nib ŋa nuunh wien nin ŋmaal ń li wendeh uʼni , kimɛ Uwien ya wenwenku nɛ wendeh wù , nɛ Kipebuk nnɔ yé uʼfrl .
45008009	Faith	Ninbi bɛn wɔn , na pɛ nisaaltetem bo , ni pɛ *Uwien ya Fuoñaanm bo nɛ , kimɛ Uwien ya Fuoñaanm te niʼni . Kristo ya Fuoñaanm ŋa te unil wà ni la , udaan ŋa yé uʼyɔ .
45011023	Faith	Nì te nnɔ nɛ Israyɛl yaab mɔ bo : bi wiɛ ' biʼyufaa la , Uwien li jiin bɛ kí nɛbn bi là cɔre ' bɛ nà saan nnɔ nɛ . U ŋmɔbe mituɔm wɔ ń jiin bɛ kí nɛbn .
66014005	Description	Ba bɛn tonnɛnku , nɛ ka ŋmɔbe biil mɔ .
44024014	Faith	N bɛn nà sɔ ń tɔke ŋɛ : n pɛ *Yesu ya sɛn bo ŋɔ ń li pukeh tiʼyaajɛb ya Wien mɔnmɔnm nɛ , nɛ bɛn *Sufmbɛ lienh ki teh usɛn nnɔ ŋa yé sɛnmɔ̀n . N boh nà kɛ kɛle ' *yiko ya gbɔnku ni nin *Uwien ya ñɔbonsɔknb kɛle ' nà kɛ nnɔ mɔ nɛ .
45013008	Recommendation	La ŋmɔbe mɛn uba fɛ̀nl . Lifɛnbaabl là ni li ŋmɔbe lɛ̀ si : ní li yíe tɔb nɛ , kimɛ unil wà yíe uʼtɔ la , udaan bon ' *yiko ye nà kɛ nnɔ nɛ .
66016009	Sin	Kuwɔlku funfunde ' binib , nɛ bi suke ' Uwien wà ŋmɔbe ufaa ki cère ' bi jɛ̀ndeh nnɔ , ka tuo ' bɛ ń lèbre biʼtetem ŋɔ kí kpiɛke wɔ .
66021012	Description	Liguoncɛnciɛnl liba nɛ là guɔn ' udu nnɔ , ki ŋmɔbe inañuɔn piik nin ile . Uwien ya tondb piik nin bile se inañuɔn nnɔ kɛ saan . Israyɛl yaab ya baamul piik nin ile ya yel kɛle ' inañuɔn piik nin ile nnɔ kɛ bo .
48003013	Grace	Kristo dɛ ' tɛ ki wiɛ ' , ki ñɛn ' tɛ *yiko ya ŋùum ni , ki teke ' tiʼsensien ki cère ' mì lu ' wɔn bo nɛ . Kimɛ nì kɛle ' *Uwien ya gbɔnku ni ki ye : « Bi ku ' wà kɛ ki lɛkn ' udɔ bo la , nì yé miŋùum nɛ uʼbo » .
48001013	Sin	Ninbi mɔnɔn cii ' nʼtetem là te ma uyo wà n là pɛ Uwien bo *Sufmbɛ yaam nnɔ . N là jɛ̀ndeh Uwien ya taanl yaab nì tì kɛnde ' , nɛ nʼnun mɔ́n ń gben bɛ .
66020002	Description	ki baa ' ki cuo ' utunwiɛn nnɔ . U yé uyo bo ya wɛ nnɔ nɛ . Bi yih wɔn nɛ usɛnpol , ki liɛbe ' ki yih wɔ *Satan . U taa ' tikudɔkr nnɔ ki lòle ' wɔ , wɔ ń li lùo kí tì baa ibin liturl ,
44008009	Description	Ujɛ uba mɔ là te udu nnɔ ni , bi yih wɔ Simɔn , u teh iñɔke nì coh Samari ya tinfɛnm ya nib miyɔkm . U là yih uba unikpɛkpiɛk nɛ .
50003010	Faith	N yíe nibonbaabn nà si : ń li bɛn Kristo nɛ , kí li bɛn u mɛkrm ya tuɔm , kí taan nin wɔ uʼjɛnd ni , kí tì kpo tɛn wɔn ,
54005022	Recommendation	A ye á de unil lituonl Kristo ya taanl ni la , la yíe tonm kí pɔk kí yuon aʼnuɔ uʼbo kí kàare kí de wɔ . La kɔ tɔb ya biɛre ni . Cère sin bugbɛn ya tetem ń li wien .
56002003	Recommendation	Tɔke ipiiciɛn mɔ kí ye yɛ̀ ń li ŋmɔbe binib bà pɛ Uwien ya sɛn bo ya tetem , ki la li lienh tɔb bo fɛnfɛnm , ki la taa ' biʼba ki de ' daam , kí li ŋmɔbe igbiermɔnmɔn .
46007038	Recommendation	Tɔ , wà kuɔn ' uʼjɛkpeng la , u tien ' nì mɔn nɛ , ama wa juore ' lijɛkpɔkl la , u tien ' nì mɔn ki cɛn ' u bi kuɔn ' la .
59001022	Recommendation	La cèreh mɛn niʼyɛnm ń li sɔnge Uwien ya gbɛr ya cengm baba bo , li teh mɛn tù ye ma bo nnɔ mɔ . Na teh nnɔ la , ni lɛreh niʼba nɛ .
43007001	Violence	Ni ya puoli bó nɛ *Yesu cuonh Galile ya tinfɛnm ni , ka yíe wɔ ń jo Sude ya tinfɛnm ni , kimɛ Sufmbɛ ya ciɛnb bà te niʼbó nnɔ nuunh bɛ ń ku wɔ nɛ .
46001030	Grace	Wɔn nɛ taan ' ninbi nin *Yesu Kristo , ki cère ' Kristo yé tiʼbo miyɛnfuom . Wɔn Kristo bo nɛ u bù ' tɛ bigbɛmɔ̀ndɛnb , ki gɛ̀nde ' tɛ tí li yé uʼyaab , ki dɛ ' tɛ ki wiɛ ' .
43013005	Description	nɛ ki taa ' miñunm ki kuore ' kusɛnku ni , ki cin ' ki sɔkreh uʼpanpaankaab ya tàan , ki taah u gbin kukpɛlciɛku kùa nnɔ ki ŋmireh yɛ̀ .
44022004	Violence	N là jɛ̀ndeh binib bà pɛ *Yesu ya sɛn bo nɛ haali bi tì kpuokeh , ki coh bijɛb nin bipiib , ki lùoh bɛ tikudɔkr , ki tì pɛkndeh .
