43007043	Description	Nnɔ nɛ Yesu bo , linigol nnɔ ŋa len ' ki cii ' tɔb bó , nɛ ki gbiire ' icɛk ile .
60005002	Recommendation	« Li kpaah mɛn Uwien ŋukn ' nɛ binib bà nnɔ , kí li likeh bɛ , ki la cère nɛn li te tɛn nì yé liwɔbl nɛ niʼbo , ama nɛ̀ ń li yé niʼyɛnm ni , tɛn Uwien yíe ma bo . Ni la sɔnh ki nuunh like , ama cère mɛn niʼyɛnm ń li pɛ lituonl nnɔ bo .
46015056	Sin	Ibiɛre nɛ yé mikuum ya lɔbpìen , nɛ yiko bo nɛ ibiɛre ŋmɔbe tiʼbo mituɔm .
59005004	Sin	Liike mɛn , bitonsɔnb bà taan ' niʼkpàan ni ya jier , ŋɔ ni yìe ' ka pɛ̀n ' bɛ biʼpaaku kɛ nnɔ muɔh kuʼbo . Nɛ biʼmuɔ nnɔ lu ' Yonbdaan Uwien , mituɔm kɛ ya daan ya tubl ni .
60002001	Recommendation	Nɛn bo , dàan mɛn mibiɛrm kɛ ya bol nin milɛrkjim kɛ ya bol , ki la ŋmɔbe ñuɔn ilele , ki la ŋmɔbe nunfɔke , ki la lienh ki saah tɔb .
46007039	Recommendation	Uyo wà upii ya cɛ laan fuobe la , u yé uʼcɛ nɛ . Ujɛ nnɔ tì kpo ' la , u li fre kí kun u yíe ujɛ wà , ama nì kpɛ ujɛ nnɔ ń li yé Kristo yɔ nɛ .
55002018	Sin	Bi tùre ' nɛ ka ji pɛ gbɛmɔ̀nt ya sɛn bo , ki lienh ki teh Uwien mɛkre ' bitɛnkpiib ŋɔ . Bi lienh nnɔ ma nnɔ nɛ cèreh binib biba wiɛnh biʼtekjim .
48005006	Faith	Kimɛ a yé *Yesu Kristo yɔ la , a jiɛ ' aʼpunl bii ŋa jiɛ ' la , na ciɛke . Nà ciɛke si : á teke Kristo kí ji ŋɔ aʼtekjim ń cère á li yíe binitɔb nɛ .
58005009	Grace	Uwien cère ' u sɔn ' uʼtuonl niʼdonbó ki tì gben ' . Nɛn bo nɛ kí ñɛ wɔn bo , binib bà kɛ boh wɔ nnɔ li lɛ limiɛl là ŋa ŋmɔbe gbenm .
46016001	Recommendation	Tɔ , mipum mà ni li taan mɛ̀ kí tore Uwien ya nib nnɔ ya gbɛr wɔn , tien mɛn tɛn n là tɔke ' Kristo ya táan yaab bà te Galasi ki ye bɛ ń tien ma bo nnɔ .
49005022	Recommendation	Bipiibɛ , li blinh mɛn niʼyul niʼciɛb ya nun bó tɛn ni blinh ma niʼyul Yonbdaan ya nun bó nnɔ ;
43008012	Faith	*Yesu tí tɔke ' linigol ki ye : « Min nɛ yé uŋɛndun ya wenwenku . Unil wà kɛ pɛ nʼbo la , wa ń li cuonh cinñunl ni , ama u li lɛ kuwenwenku kùa dienh limiɛl .
65001017	Recommendation	Nʼjɔtiebɛ , ninbi bɛn wɔn , tiɛre mɛn tiʼYonbdaan *Yesu Kristo ya tondb là juɔ ' ki tɔke ' nɛ tigbɛr tà nnɔ .
44017025	Grace	Wa nuunh nil ya torm , niba ŋa pɔre ' wɔ , kimɛ wɔn nɛ dienh binib limiɛl nin mitafaam mà bi fuoreh mɛ̀ nɔ nin tibont kɛ .
62005009	Faith	Ti teknh binib ya mɔ̀nkun la , tí li bɛn kí ye Uwien ya mɔ̀nkun cɛn ' binib yu . Uwien ya mɔ̀nkun nnɔ si : u kun ' imɔ̀n ki ye *Yesu mɔnbe ki yé uʼBijɛ nɛ .
45013014	Faith	Taa mɛn Yonbdaan *Yesu Kristo kí tien niʼliɛrl , ki la ji ń de niʼgbɛnɛnt sɛn tù ń tien tù yíe nà .
58011030	Description	Israyɛl yaab là teke ' Uwien ki jin ' , nɛ ki taa ' iwien ilole ki cuon ' ki linde ' Seriko ya du , nɛ liguonjɛl là guɔn ' wù nnɔ lu ' .
44019011	Grace	Uwien cère ' Pɔl teh miyɔkm ya bonciɛnt cɛɛn ,
43008034	Sin	Nɛ u ye : « N tɔkeh nɛ imɔ̀n nɛ , wà kɛ teh ibiɛre la , u yé ibiɛre ya yonb nɛ .
62004011	Faith	Nʼjɔtiebɛ , Uwien yíe tɛ nnɔ ma nnɔ , nì kpɛ tiʼmɔ ń li yíe tɔb nɛ .
44002028	Grace	A wuɔn ' nni limiɛl ya sɛn . A te nʼsaan ma nnɔ , a li cère n li ŋmɔbe uyɛnsɔnge kí tì gben nɛ . › »
54004013	Recommendation	Taa aʼba kí de *Uwien ya gbɔnku ya kàanm Kristo yaab ni , kí li sureh bɛ , kí li wɔknh bɛ haali nin nʼbaam .
47004008	Description	Bi pɛbeh tɛ isɛn kɛ ni nɛ , ama ba freh ki mɛreh tɛ . Ti te iyɛnbɛn ni , ama ti tuu ki ŋmɔbe lidɛndɛnl nɛ .
44002013	Description	Ama biba mɔ sukreh bɛ nɛ ki teh bi ñun ' midaam nɛ ki yibe ' .
66021018	Description	Bi là taa ' itɛn yà bi yih yɛ̀ jaspi nnɔ nɛ ki mɛn ' liguonl nnɔ . Udu nnɔ kɛ là yé miñɔ̀km mà wien , ki windeh ki likeh ki càareh tɛn lidingl nɛ .
66015006	Description	Nɛ Uwien ya tondb bilole bà li cère uŋɛndun ya nib ń jɛ̀nde kí tì dukn bolm milole nnɔ ñɛn ' ní kuduku nnɔ ni , ki guo tikpɛlcɛpenpient tù windeh , ki buobe miñɔ̀km ya nìngbɛn biʼsiik ni .
45012014	Recommendation	Ní li kàareh Uwien wɔ ń tien binib bà jɛ̀ndeh nɛ nnɔ uʼmɔnm . Ní li teh wɔ ń tien bɛ uʼmɔnm , ni la teh wɔ ń wiɛ bɛ ŋùum .
66001015	Description	Uʼtàan windeh tɛn kukurku kùa faa bi pule ' kù umu ni kù mɔ́nde ' , nɛ uʼniɛke mɔ tuoreh tɛn miñunciɛnm nɛ fuh .
43017026	Grace	N cère ' bi bɛnde ' a yé udaan wà , ki li liɛbe kí cère bɛ ń bɛnde ŋɛ , ŋɔ a yíe nni miyíem ma nnɔ ń li te biʼni , ŋɔ nʼmɔ ń li tɛ nin bɛ . »
45008032	Grace	Wa yìe ' uʼtiɛma Bijɛ mɔnɔn bo , ama u taa ' wɔ ki cɛ̀be ' wɔ ń tì kpo tiʼkɛ ya biɛre bo nɛ . U de ' tɛ uʼBijɛ ma nnɔ , bɛ li tien u la juoke tɛ kí de tɛ tibont kɛ ?
65001018	Sin	Bi là tɔke ' nɛ ki ye : ufɔfɔryo binib lá li lɛ̀ nɛ , kí li pɛ biʼyɛnm yíe nà bo , ka ń li boh Wien .
45011018	Recommendation	Nɛn bo , la jɛbnh aʼba bi cɔre ' isigben yà nnɔ bo . A li tien mila kí jɛbn aʼba , kimɛ na yé sin nɛ tuke isiñaan , isiñaan nɛ tuke ŋɛ .
47001024	Faith	Na yé ti nuunh tí wɔbn nɛ kí wuɔn nɛ ni li teke Uwien kí ji ma bo nɛ , kimɛ ni co mitekjim kenken nɛ . Ama ti nuunh tinbi nin ninbi ń taan kí sɔn ŋɔ ní li ŋmɔbe uyɛnsɔnge nɛ .
43011001	Description	Ujɛ uba nɛ là te ki bun , bi yih wɔ Lasaar . U yé Mari nin Mart ya ninjɛ nɛ . Wɔn nin bɛn kɛ là kɔh udu uba ni nɛ , bi yih wù Betani . Mari nnɔ yé upii wà là taa ' lɛfina ki wule ' Yonbdaan ya tàan bo , ki taa ' uʼyur ki ŋmiŋmire ' yɛ̀ nnɔ nɛ .
52004008	Sin	Nɛn bo , wà kɛ yìe ' tigbɛr tuu la , na yé u yìe ' binib ya gbɛr nɛ , u yìe ' Uwien wà dienh nɛ *Mifuoñaanm nnɔ ya gbɛr nɛ .
62004002	Faith	Nà sɔ li cère ní bɛnde binib bà ŋmɔbe *Uwien ya Fuoñaanm : wà kɛ lienh ki teh *Yesu Kristo mɔnbe ki baa ' uŋɛndun wuu ni nin tinisaalgbɛnɛnt la , wɔn nɛ yé Uwien yɔ .
65001008	Sin	Bibiɛrdɛnb nnɔ mɔ teh tɛn bɛn nɛ . Bi pɛ biʼdɛknt bo nɛ ki sɔnh itùon yà kuɔndeh biʼtiɛma gbɛnɛnt tijɔknt , ki yindeh Uwien ya yonbdɛnt , ki sukreh nà kɛ ŋmɔbe ukpiɛke paaki bó .
60003011	Recommendation	kí dàan nà bre , kí li teh nà mɔn , kí li nuunh uñɔkpaan nin inunmɔ́n .
51001023	Faith	Ama ní li faa mitekjim ni , kí li co kenken . Ni là cii ' tigbɛmɔnmɔnt ma nnɔ , tù cère ' ni ŋmɔbe lidɛndɛnl nɛ . Ni la wiɛ lidɛndɛnl nnɔ . Bi kpaande ' tù utingbɛn bo ya nib kɛ saan nɛ . Nɛ min Pɔl ya tuonl si : ń kpaande tu ya gbɛmɔnmɔnt nɛ .
43008059	Violence	Nɛn saan nɛ bi gɛ̀nde ' itɛn bɛ ń yèke kí ku wɔ , nɛ u lɔkre ' ki ñɛn ' Uwien ya duku ya luo bo .
49004024	Recommendation	ŋɔ ní li ŋmɔbe mitetefɛ̀nm mà Uwien tien ' mɛ̀ u yíe ma bo nnɔ . Tigbɛmɔ̀nt nɛ cère ' mitetem nnɔ mɔn , ki cuube .
66014012	Faith	Nɛn bo , nì yé uyo wà Uwien ya nib bà boh uʼwɔb , ki teke ' *Yesu ki jin ' nnɔ ń li ŋmɔbe kuminku nɛ .
44013030	Description	Ama Uwien cère ' u mɛkre ' bitɛnkpiib ni .
43010011	Description	« Min nɛ yé upekpaamɔ̀n . Upekpaamɔ̀n li tuo kí kpo uʼpe bo .
49003002	Grace	Ni cii ' Uwien ya nimɔ̀nt bo , u de ' nni lituonl là ń sɔn kí de nɛ nnɔ bó .
56003010	Recommendation	Unil cèreh Kristo yaab boreh tɔb la , á gbiere wɔ nba . U yìe la , á gbiere wɔ nle . U tí yìe la , á wiɛ uʼgbɛr ,
43010019	Description	*Yesu len ' nnɔ nɛ Sufmbɛ ya gbɛr ŋa tí cende ' .
43003033	Faith	Wà kɛ teke ' uʼmɔ̀nkun nnɔ la , u tuo ' ki ye Uwien yé ugbɛmɔ̀ndaan nɛ .
61003014	Recommendation	Nɛn bo , nʼjɔtiebɛ , ni gu niʼdaali ma nɔ , li ñikndeh mɛn ŋɔ u lá baa ' la , wɔ ń lɛ ni te uyɛnduɔn ni , ka ŋmɔbe jɔknt , ka gbè niba saan .
53003001	Faith	Tɔ , tiʼyaabɛ , li kàareh mɛn ki dienh tɛ ŋɔ Yonbdaan ya gbɛr ń li yɛreh niʼkɛ saan tontonm , kí li ŋmɔbe ukpiɛke tɛn tù ŋmɔbe ukpiɛke niʼdu ni ma bo .
47004014	Faith	Imɔ̀n , ti bɛn ki ye Uwien wà mɛkre ' Yonbdaan *Yesu nnɔ li mɛkre tiʼmɔ tí li te nin *Yesu wɔ ń taa tinbi nin ninbi kí jo uʼba saan .
59005014	Recommendation	Niʼni uba bun la , wɔ ń yin Kristo ya taanl ya ciɛnb , bɛ ń kàare kí de wɔ , kí taa mikpɔm kí fanfaan wɔ Yonbdaan ya yel bo .
44007023	Description	« Tɔ , uyo wà u laa ' ibin pinan nnɔ , nɛ u taa ' iyɛnmaale ki jon ' wɔ ń tì fuonde uʼyaab Israyɛl yaab .
44023027	Violence	*Sufmbɛ là cuo ' ujɛ wuɔ ki benh bɛ ń ku wɔ nɛ . N cii ' u yé Erom yɔ ma nnɔ nɛ n taa ' Sojambɛ ki tì fie ' wɔ biʼsaan .
44019029	Description	Nɛn saan nɛ udu nnɔ ya nib kɛ kpre ' , ki tɔke ligol ki joh udu nnɔ ya nib taakeh nà saan nnɔ , nɛ ki cuo ' Pɔl ya tɔntɔknlieb bile usɛn ni . Bi yih uba Gayus , ki yih utɔ Aristak . Bi yé Maseduɔnn ya tinfɛnm ya nib nɛ .
44003014	Sin	Ninbi , yìe ' wà yé uñaan , ki yé ugbɛmɔ̀ndaan , nɛ ki ji tɔke ' Pilat ki ye wɔ ń taa unikul kí wiɛ .
44015009	Faith	Wa bore ' tinbi nin bɛn , kimɛ mitekjim bo nɛ u sɔkre ' biʼfɛ̀l bo ya jɔknt .
46011028	Recommendation	Nɛn bo , unil kɛ ń tùɔre kí maale kí liike uʼtetem te ma bo kí yaan kí ŋmɔn kpɔnɔ nnɔ , kí ñu midaam nnɔ .
46015058	Faith	Nɛn bo , nʼyaab bà n yíe bɛ , tùɔre mɛn kí cuo kenken , kí cère niʼnun ń li mɔ́n Yonbdaan ya tuonl bo , ní li tuu ki sɔnh lɛ̀ ki joh inun bó , kí li bɛn ki ye ni sɔnh ki dienh tiʼYonbdaan la , niʼtòntònku ŋa ń juore fɛnm .
46004016	Recommendation	Nɛn bo nɛ n gbáanh nɛ , ní tɛkn nʼtaal ni Kristo ya sɛn ni .
46001021	Faith	Kimɛ uŋɛndun wuu ya nib nin biʼyɛnfuom kɛ ba fre ' ki bɛnde ' Uwien uʼyɛnfuom ni . Nɛn bo nɛ Uwien cɛ̀kre ' uʼyɛnm wɔ ń cère binib bà teke ' Kristo ki jin ' nnɔ ń ŋmɛre kí ñɛ tiwaargbɛr tà ti kpaandeh tù ki tɔkeh binib nnɔ bo .
60003001	Recommendation	Bipiibɛ , niʼmɔ ń li blinh niʼyul niʼciɛb ya nun bó , ŋɔ biʼni biba ŋa teke ' Uwien ya gbɛr ki jin ' mɔnɔn la , kí ñɛ biʼpuob ya tetem bo , bɛ ń teke tù kí ji , kí lɛ ba tɔke ' bɛ gbɛr ,
47005020	Recommendation	Ti se Kristo ya taal ni nɛ ki tɔkeh nɛ tigbɛr tuu , nɛ kí ñɛ tinbi bo Uwien nin uʼyul nɛ lienh nɛ . Ti gbáanh nɛ nɛ , Kristo ya yel bo , taan mɛn nin Uwien buñɔbu .
44002024	Description	Ama Uwien mɛkre ' wɔ ki ñɛn ' wɔ mikuum ya jɛnd ni , kimɛ kuum ŋa ŋmɔbe tuɔm mɛ̀ ń juon wɔ kutɛnkpiiku ni .
59002007	Sin	Bɛn nɛ ŋa saah *Yesu ya yel-ii ? Li ya yeñaanl nɛ ŋa cère ' ni yé Uwien yaab-ii ?
54003003	Description	ki la taa ' uʼba kí de daam , ki la ŋmɔbe jɛr . Wɔ ń li ŋmɛ nin binib kɛ , ki la findeh nin nib , ki la cère uʼnun ń li mɔ́n ilike bo ,
43004014	Grace	Ama wà kɛ li ñu n li de wɔ miñunm mà nnɔ , ñuñun ŋa ji li cuo wɔ fiebu . N li de wɔ miñunm mà nnɔ li te tɛn liñunbunl nɛ uʼni , kí li dienh wɔ limiɛl là ŋa ŋmɔbe gbenm . »
62002005	Faith	Ama wà kɛ boh Uwien ya gbɛr la , wɔn nɛ cinbe ki yíe Uwien ki tì gben ' . Nnɔ nɛ ti mɔnbe ki bɛn ki ye tinbi nin Uwien tɛ .
66016013	Description	Nɛ n laa ' isɛnpol ita ; uba ñɛn ' *utunwiɛn nnɔ ya ñɔbu ni , utɔ ñɛn ' kiwɛnk nnɔ yaabu ni , utɔ mɔ ñɛn ' utonnɛnñɔbonsɔknl yaabu ni . Isɛnpol nnɔ naan itɛtiɛ nɛ .
59002008	Recommendation	Tɔ , yiko wà te *Uwien ya gbɔnku ni ki cɛn ' uʼtɔ nnɔ ye : « Li yíe aʼtɔ tɛn a yíe aʼba ma bo . » Ni boh wɔ mɔnmɔnm la , ni teh nà mɔn nɛ .
47004005	Faith	Tɔ , ti tɔkeh nɛ tigbɛr tà nnɔ ŋa lienh tinbi bo , tù lienh *Yesu Kristo bo nɛ ki teh wɔn nɛ yé Yonbdaan . Tinbi bɛn wɔn , ti tɔkeh nɛ ki teh ti yé niʼtonsɔnb nɛ wɔn *Yesu bo .
46015033	Recommendation	La cère mɛn uba ń lɛre nɛ . « A tɔkeh nin unibiɛrɔ la , aʼmɔ li tì gben kí saa nɛ . »
58013020	Grace	Uwien nɛ yé uyɛnduɔn ya daan . U cère ' tiʼYonbdaan *Yesu wà yé upekpaaciɛn nnɔ mɛkre ' bitɛnkpiib ni . U ya sɛ̀m bo nɛ Uwien cuo ' nin binib kujɔtieku kùa ŋa ŋmɔbe gbenm .
50001027	Recommendation	Nì te ma kɛ la , li fuobe mɛn binib ni Kristo ya gbɛmɔnmɔnt wɔkn ' nɛ ma bo . Nì yé n fre ' la , n li baa niʼsaan . Ma tí baa la , ń cii niʼgbɛr kí ye ni pɛ mitekjim ya sɛn bo mɔnmɔnm , ki kpɛ buñɔbu , ki ŋmɔbe iyɛnmaale iba , ki mɔ̀h limuɔl liba mitekjim mà kpe tigbɛmɔnmɔnt ya sɛn nnɔ bo .
46006014	Grace	Nɛ Uwien wà cère ' Yonbdaan mɛkre ' bitɛnkpiib ni nnɔ li cère uʼtuɔm bo tiʼmɔ ń mɛkre .
55001006	Recommendation	Nɛn bo nɛ n tiɛreh ŋɛ , á fìkre Uwien là de ' ŋɛ *uʼFuoñaanm ya paabu bùa nnɔ ya tuɔm uyo wà n là yuon ' nʼnuɔ aʼbo , ki kàare ' ki de ' ŋɛ nnɔ .
60004006	Grace	Nɛn bo nɛ bi tɔke ' bitɛnkpiib mɔnɔn tigbɛmɔnmɔnt . Bi là kpo ' binib kɛ kpuokeh ma bo nɛ . Bi tɔke ' bɛ tigbɛmɔnmɔnt nnɔ ŋɔ Mifuoñaanm bo bɛ ń li fuobe tɛn Uwien nɛ .
46007023	Recommendation	Uwien nɛ pɛ̀n ' ki ñɛn ' niʼkɛ tiʼyonbt ni . Nɛn bo , la ji ń li yé mɛn nib ya yonbe .
46010010	Recommendation	La li ŋulnh mɛn tɛn biʼni biba là ŋulnh ma ki cère ' Uwien ya tond wà kuuleh baa ' ki kuku ' bɛ nnɔ .
47002017	Faith	Tinbi ŋa taah Uwien ya gbɛr ya tɔkm ki teh ukpenkpende tɛn binib bà yɛbe teh ma bo . Uwien nɛ sɔn ' tɛ . Kristo bo nɛ ti tɔkeh wɔn Uwien ya gbɛr uʼnun bó , jɔknt ŋa te tiʼfɛ̀l bo .
45015001	Recommendation	Tinbi bà faa mitekjim ni nnɔ , nì mɔn tí li toreh bà ŋa faa tekjim ni nnɔ nɛ biʼjiint ni , ki la li nuunh tí li teh tiʼyɛnm yíe ma .
50002024	Faith	N du Yonbdaan bo ki ye min nin nʼyul li baa niʼsaan na ń taande .
66007001	Description	Ni ya puoli bó nɛ n tí laa ' tidɛknt yaam Uwien ya tondb binan se kitink ya kɛle kɛ inan , ki co ikɛle inan nnɔ ya tafaam ŋɔ tafaam la ji ń jo tink nin ñunciɛnm nin subu bo .
60004003	Sin	Uyo uba , ni là teh bà ŋa pɛ Wien bo yíe nà , nɛ nì tì wuɔke ' . Ni là teh lisɔnsɔndl nɛ , ki teh unisaal fɛ tibont tà , ki ñuh ki yibeh , ki jinh unifɛnjin , ki taakeh ki kaah , ki jinh ki ñuh ki yibeh , ki pɛ ibule bo . Ibule bo ya paanm yé ijuɔke ya bonn nɛ Uwien ya nun bó .
66011005	Violence	Biʼnɛnnɛndb nuunh bɛ ń jɛ̀nde bɛ la , umu uba nɛ li ñɛ biʼñuɔn ni kí ku bɛ . Wà kɛ nuunh wɔ ń jɛ̀nde bɛ la , udaan li kpo nnɔ nɛ .
44023005	Recommendation	Nɛ Pɔl ye : « Weee ! Nʼyaabɛ , ma bɛn ki ye u yé bitɔtuɔrciɛnb ya ciɛn . N bi bɛn la , ma bi li len nnɔ , kimɛ nì kɛle ' *Uwien ya gbɔnku ni ki ye : ‹ Ŋa ń len aʼdu ya ciɛn fɛnfɛnm . › »
66022015	Sin	Ama bà teh ijuɔke ya bont nin biñɔkdɛnb nin isɔnsɔnd nin binikub nin bà pɛ ibule bo nnɔ , biʼkɛ fɛ itùon nin tigbɛr tà ŋa kpe gbɛmɔ̀nt ya sɛn nɛ , nɛ ki pɛ tuʼbo . Bɛn li juore saali nɛ .
66002014	Sin	Ama n li kɔn nin ŋɛ nibonwawaann niba bo nɛ , kimɛ niʼni biba pɛ Balam ya wɔknm bo nɛ . Wɔn nɛ là gbiere ' Balak u li tien ma kí tuln Israyɛl *yaab bɛ ń ŋmɔn titɔtuɔrnɔnt , kí tien lisɔnsɔndl .
53001003	Faith	Tiʼyaabɛ , nì kpɛ tí li faareh Uwien niʼbo uyo kɛ nɛ , nì yé nibonn nà cuube nɛ , kimɛ ni tùɔreh ki teknh *Yesu ki jinh mɔnmɔnm , nɛ ki tùɔreh ki yíe tɔb mɔ mɔnmɔnm .
46012002	Sin	Ni bɛn ki ye na laan là pɛ Uwien ya sɛn bo ma nnɔ , ibule nɛ là co nɛ ticuɔr nɛ na ń fre kí ŋmɛre iʼsaan , ki bɛn mɔ ki ye ibule nnɔ ŋa lienh .
49005025	Recommendation	Bijɛbɛ , wà kɛ ń li yíe uʼpo tɛn Kristo yíe uʼtaanl ma , ki teke ' liʼkuum ki kpo ' nnɔ .
45012017	Recommendation	Unil tien ' ŋɛ nà bre la , la jiin wɔ nà bre . Li nuunh mɛn ní li teh nà mɔn binib kɛ ya nun bó .
60005006	Recommendation	Nɛn bo , li jiindeh mɛn niʼba tingi Uwien , mituɔm kɛ ya daan , ya nun bó ŋɔ wɔ ń kpiɛke nɛ u sien ' uyo wà wɔ ń kpiɛke nɛ nnɔ .
44014017	Grace	Nin nɛn kɛ wà dàan ' mimɔnm ya tienm ŋɔ wɔ ń wuɔn binib u yé udaan wà . U cèreh utaa niih , tijier teh , ni jinh ki gbuokeh , ki te liwiel ni . »
54003011	Recommendation	Bipiib bà yé bitotorb mɔ li yé binib bà bi boh bɛ nɛ , ki la lienh tɔb bo fɛnfɛnm , kí li coh biʼba tibont kɛ ni , kí li yé bipiib bà bi du biʼbo isɛn kɛ ni .
66002021	Sin	N de ' wɔ libònl wɔ ń lèbre uʼtetem , ama wa yíe wɔ ń lèbre uʼtetem kí wiɛ uʼsɔnsɔndl nnɔ .
44012020	Description	Herod ya benku ni piebe ' Tir nin Sidɔn ya nib bo ki gbien ' . Nɛ biʼkɛ kpaan ' buñɔbu bɛ ń jo kí lɛ wɔ . Bi kpiɛ ' ki laa ' ujɛ uba nɛ bi yih wɔ Blatus , wɔn nɛ gu Herod ya dugɔkaaku . Wɔn nin bɛn kpaan ' tù ŋɔ wɔ ń cuo ubɛr ya dunl tigbɛr nnɔ ń gben nɛ , kimɛ tijier ñɛh Herod ya du ni nɛ ki bàareh biʼdu ni .
43008049	Sin	Nɛ u tɔke ' bɛ ki ye : « Sɛnpol ŋa ŋaake nni . N boh nʼBaa nɛ , nɛ ninbi ŋa boh nni .
43006018	Description	Kutafaaku fii ' ki joh ki gbiekeh , nɛ iñungbegbel fih .
45008018	Faith	N bɛn ki ye fɛnfɛnnɔ ya jɛnd ŋa ŋmɔbe bɛ ń taa yɛ̀ kí kpaan nin ukpiɛke wà Uwien lá li ñɛn wù upaan bo kí de tɛ nnɔ .
62002012	Grace	Nʼbumu , n kiɛh tigbɛr tuu ń de nɛ , kimɛ Uwien fère ' nɛ niʼbiɛre *Yesu Kristo ya yel bo ŋɔ .
55001009	Grace	Wɔn nɛ ŋmiɛn ' tɛ , ki yin ' tɛ , ki tien ' tɛ uʼyaab . Na yé tiʼtùon bo nɛ u tien ' nnɔ , ama u cɛ̀kre ' uʼyɛnm nɛ ki tien ' nnɔ . *Yesu Kristo bo nɛ u tien ' tɛ tinimɔ̀nt ki laa ' wa laan ñɛn ' uŋɛndun .
43019006	Violence	Ama bitɔtuɔrciɛnb nin biguguurb laa ' wɔ ma nnɔ nɛ ki wuureh ki teh : « Kpɛ wɔ udɔpɔnpɔn bo ! Kpɛ wɔ udɔpɔnpɔn bo ! » Nɛ Pilat tɔke ' bɛ ki ye : « Niʼbugbɛn ń taa wɔ kí tì kpɛ wɔ udɔpɔnpɔn bo , kimɛ min ŋa laa ' u bii ' nà nì kpɛ kuum . »
60001010	Grace	*Uwien ya ñɔbonsɔknb là tùɔre ' ki fiin ' miŋmiɛnm bugbɛn ya gbɛr , nɛ ki sɔkn ' nɛ Uwien bonde ' wɔ ń de nɛ bupaabu bùa nnɔ ya gbɛr .
63001007	Sin	Binib bà tulndeh biʼtɔb yɛbre ' uŋɛndun wuu ni , ki lienh ki teh *Yesu Kristo ŋa baa ' nin nisaalgbɛnɛnt . Unil teh nnɔ la , u yé wà tulndeh binib nɛ , ki yé *Kristo ya nɛnnɛnd .
44024005	Sin	Ti sekn ' ki laa ' ujɛ wuɔ yé unibiɛrɔ nɛ . U kpìindeh *Sufmbɛ bà kɛ te uŋɛndun wuu ni nɛ , ki cèreh bi teh fɛnfɛnm . Wɔn nɛ yé licɛkl là pɛ Nasarɛt ya *Yesu ya sɛn bo nnɔ ya ciɛn .
54003016	Grace	Imɔ̀n , Uwien bo ya paanm ya gbɛr tà buɔ u kpiire ' tù nnɔ yé tigbɛciɛnt nɛ . Kristo nɛ yé tigbɛr tà buɔ nnɔ , ki tien ' uʼba unisaal , ki ñɛn ' uʼba upaan bo *Mifuoñaanm nɛ wuɔn ' ki ye u yé ugbɛmɔ̀ndaan , u cère ' Uwien ya tondb laa ' wɔ , bi kpaande ' uʼgbɛr bà ŋa yé *Sufmbɛ ni , nɛ binib teke ' wɔ uŋɛndun ni ki jin ' , Uwien taa ' wɔ uʼkpiɛke ni ki don ' paaki bó .
66016021	Violence	Utaa nii ' nɛ itɛtɛn lulu ' binib bo ki kpiɛke cɛɛn , nɛ bi suke ' Uwien itɛtɛn nnɔ bo , kimɛ ijɛnd nnɔ là bre biʼbo cɛɛn nɛ .
61003013	Faith	Ama Uwien là pùon ' ki ye u li tien kutɛfɛ̀nku nin kitinfɛ̀nk , kí cère tigbɛmɔ̀nt ń li te tuʼbo . Ti gu nɛn nɛ .
66006014	Description	Kutaaku gbendeh ki joh tɛn bi kondeh kugbɔnku nɛ , ijuɔn nin idek kɛ lèlèbre ' isensien .
58010010	Grace	*Yesu Kristo tien ' Uwien ya yíem , ki taa ' uʼba ki tien ' lituɔrl bolm miba kpein , ki cère ' ti mɔn ki tì gben ' Uwien ya nun bó .
52001002	Faith	Ti tuu ki faareh Uwien niʼkɛ bo nɛ , ki tiɛn niʼbó tiʼkaare ni .
66006004	Violence	Nɛn saan nɛ utɛnmɔ́n tohin ñɛn ' . Bi de ' wà jɛke wɔ nnɔ usɛn wɔ ń cère butɔbu ń tien utingbɛn bo ŋɔ binib ń li kuuleh tɔb , ki de ' wɔ kijusiecɛnciɛnk kiba .
54006001	Recommendation	Binib bà kɛ yé iyonbe nnɔ bɛ ń li boh biʼcɛnbaambɛ mɔnmɔnm , nì kpɛ bɛ ń li boh bɛ ma bo , ŋɔ uba la lɛ u li dule nà bo kí len Uwien nin tiʼwɔknm bo fɛnfɛnm .
51003009	Recommendation	La tɔkeh mɛn tɔb tonnɛngbɛr . Ni gben ' niʼtetekpaam nin mì là cèreh ni teh tibont tà kɛ nnɔ ya gbɛr ,
66002020	Sin	Ama n li kɔn nin ŋɛ nibonn niba bo nɛ , kimɛ a cère ' Sesabɛl , upii wà yih uʼba *Uwien ya ñɔbonsɔknl nnɔ tulndeh nʼtonsɔnb ki wɔknh bɛ bɛ ń li teh lisɔnsɔndl , ki li ŋmɔnh titɔtuɔrnɔnt .
48003008	Grace	Uwien là juɔ ' ki len ' uʼgbɔnku ni ki ye u li bù bà ŋa yé *Sufmbɛ nnɔ bigbɛmɔ̀ndɛnb biʼtekjim bo nɛ . Nɛn bo nɛ u là juɔ ' ki tɔke ' *Abraham tigbɛmɔnmɔnt tuu ki ye : « Sin bo nɛ n li tien inibol kɛ mimɔnm . »
58012005	Recommendation	La sunde mɛn Uwien tɔke ' nɛ nà ki de ' nɛ lifɛ̀l nnɔ bó tɛn bibaa gbiereh uʼbumu ma bo . U ye : « Nʼbukɛ , la yìe Yonbdaan ya tudɛre . U kɔnh nin ŋɛ la , la cère aʼyɛnm ń saa .
58013017	Recommendation	Li boh mɛn niʼciɛnb , kí li tuonh biʼñuɔn bó , kimɛ bɛn nɛ likeh nɛ , ki lá li tɔke ' Uwien bi liliike ' nɛ ma bo . Ni boh bɛ la , bi li sɔn biʼtùon nin uyɛnduɔn nɛ . Nnɔ ŋa ñí la , bi li sɔnh ki dunh nɛ , nɛ na ń tore nɛ .
44013019	Description	ki yaan ki gben ' inibol ilole yà là kɔ Kanaan ya tink bo nnɔ , ki taa ' biʼtink nnɔ ki de ' tɛ , kì kpɛnde ' tiʼyaak .
54006003	Faith	Unil wɔknh miwɔknm mà bore ' miba , ka pɛ tiʼYonbdaan *Yesu Kristo ya gbɛmɔnmɔnt bo , ka pɛ miwɔknm mà kpe Uwien ya sɛn bo la ,
63001010	Recommendation	Wà baa ' ní niʼsaan ka tuke mi ya wɔknm la , la teke wɔ mɛn , ki la fuonde wɔ mɔnɔn .
47001005	Grace	Nnɔ nɛ Kristo bo , ti lɛnh ijɛnd ki gbiekeh ma nnɔ wɔn Kristo bo nɛ Uwien duɔndeh tiʼyɛnm mɔ ki gbiekeh .
65001011	Sin	Nì bre biʼbo , kimɛ bi kpìen ' Kayɛn là kpìen ' usɛn wà nnɔ nɛ . Bi taa ' biʼba ki de ' ilike ya nuunm nɛ ki tùre ' tɛn Balam , ki yìe ' Uwien ya ñɔbu bó tɛn Kore là yìe ' ma bo , nɛ ki kpo ' .
65001010	Sin	Ama bibiɛrdɛnb nnɔ bɛn wɔn , bi sukreh ba bɛn nà nɛ , ki te tɛn ipiɛ , ki maaleh ki teh bi bɛn nà nnɔ mɔnɔn tulndeh bɛ ki joh nɛ .
58011007	Faith	Nowe là teke ' Uwien ki jin ' , nɛ ki tien ' buñɛrcɛnciɛnbu ki ŋmiɛn ' wɔn nin uʼden yaab . Uwien là juɔ ' ki tɔke ' wɔ tibont tà ba laan lɛnh tù , tù lá li tien nnɔ bó nɛ u teke ' tù tunɔjɛr tule . Nnɔ nɛ Nowe wuɔn ' ki ye uŋɛndun ya nib ŋmɔbe libiil Uwien saan . Uʼtekjim bo nɛ Uwien bù ' wɔ ugbɛmɔ̀ndaan .
58009006	Description	Bi bonde ' tibont kɛ ki sensien ' nnɔ nɛ . Bitɔtuɔrkaab kɛ kɔh upuke ni nɛ idaan kɛ ki tì sɔnh biʼtuonl .
44007051	Sin	Etiɛnn tí len ' ki ye : « Niʼyul faa , nɛ niʼfɛ̀l bo te tɛn binib bà ŋa pɛ Wien bo , ka cengeh uʼgbɛr , ki yìenh *Mifuoñaanm uyo kɛ . Ni te tɛn niʼyaajɛb nɛ .
54001009	Sin	Tùɔre mɛn kí cii kí ye yiko ŋa te ki de ' nimɔ̀n , ama u te ki de ' bà ŋa boh wɔ nin bà yìe ' Uwien ya ñɔbu bó nin bà ŋa pɛ Uwien bo nin bibiɛrdɛnb nin bà yindeh Uwien nin uʼbont kɛ nin bà kuuleh biʼnaambɛ nin biʼbaambɛ nin bà kɛ yé binikub nin
46005009	Recommendation	Tɔ , n là kɛle ' nʼgbɔnku ni ki ye ni la li ŋmɔbe kànkàan nin isɔnsɔnd .
48001015	Grace	Ama Uwien gɛ̀nde ' nni ki laa ' ba laan maa ' nni . Uʼnimɔ̀nt bo nɛ u yin ' nni . Uʼyíem bo nɛ
45007015	Description	Ma bɛn n teh nà , kimɛ n yíe ń tien nà la , ma teh nɛn . Ama n nɛn nà nnɔ n teh nɛn nɛ .
61003018	Faith	Ama tùɔre mɛn kí li bɛndeh tiʼYonbdaan nin tiʼŊmiɛnl *Yesu Kristo ki joh inun bó , kí cère uʼjuokm ń li yɛbreh niʼsaan . Wɔn si ukpiɛke fɛnfɛnnɔ nin uyo wà ŋa ŋmɔbe gbenm . [ Ami ] .
46004010	Description	Kristo bo , tinbi te tɛn iwaar nɛ , nɛ ninbi yé biyɛnfodɛnb kí ñɛ ni yé Kristo yaab ma nnɔ bo-a ! Tinbi yé ijiin nɛ , nɛ ninbi yé bifɛfaab . Bi kpiɛkreh ninbi nɛ ki yuɔndeh tinbi .
60005009	Faith	La cɛ̀be wɔ mɛn niʼba , tùɔre mɛn kí li du Uwien bo , kí li bɛn kí ye niʼyaab Kristo yaab bà kɛ mɔ te uŋɛndun wuu ni nnɔ mɔ jɛ̀ndeh tɛn ninbi nɛ .
51003022	Recommendation	Iyonbe , li boh mɛn niʼcɛnbaambɛ uŋɛndun wuu ni isɛn kɛ ni . Ni la li boh bɛ biʼnun ni baba tɛn ni nuunh binib nɛ ń li pɛ̀keh nɛ , ama ní li boh bɛ nin niʼfɛ̀l kɛ kí ñɛ ni boh Yonbdaan ma nnɔ bo .
66017012	Description	A laa ' iyin piik yà nnɔ , yé binib piik bà lá li ji libɛl nɛ . Bi lá jin ' libɛl la , bɛn nin kiwɛnk nnɔ li taan libɛl nnɔ nɛ , ama la ń wuɔke .
46002012	Grace	Tinbi wɔn , ta maaleh tɛn uŋɛndun ya nib maaleh ma bo , ama Uwien nɛ de ' tɛ *uʼFuoñaanm ŋɔ tí fre kí bɛnde u punh tɛ bupaabu bùa nnɔ .
59005001	Recommendation	Cenge mɛn fɛnfɛnnɔ , ninbi bifàadɛnbɛ : muɔ mɛn kí kpiɛnde micɛcɛkm mà lá li tu nɛ nnɔ bo .
66002010	Recommendation	La fɛnge mɛn ni li ji ijɛnd yà . Ni bɛn-ii ! Usɛnpol li biike nɛ kí cère bɛ ń pɛkn niʼni biba . Bi li jɛ̀nde nɛ kí tì baa iwien piik . Bi li ku nɛ mɔnɔn la , li pɛ mɛn nʼbo . N li su nɛ limiɛl là ŋa ŋmɔbe gbenm .
54006011	Recommendation	Sin Uwien ya nilɔ , la paan nɛn kɛ bo , kí li yé unil wà cuube , kí li pɛ Uwien ya sɛn bo , kí li ŋmɔbe mitekjim , kí li ŋmɔbe miyíem nin kuminku , kí li ŋmɛ nin unil kɛ .
59005005	Sin	Ni te liwiel ni nɛ uŋɛndun wuu ni , ki teh nà sɔnge niʼyɛnm , ki jinh ki gbengreh tɛn bi jindeh tiwɛnt tà tù ń gbenge bɛ ń kù .
66004004	Description	Mubɛrbiɛmu pile nin munan mɔ se ki guɔn ' kɛ̀ . Biciɛnb pile nin binan mɔ kɛ mubɛrbiɛmu nnɔ bo , ki guo tiwɛnpenpient , ki kpiɛ miñɔ̀km ya yukpiɛkpiɛ .
66018007	Description	Bɛn bà là yíe tigbengt , ki yíe bɛ ń li te liwiel ni , nì tì kɛnde ' nnɔ , cère mɛn bɛ ń ji ijɛnd mɔ kí li kaa mikuum kí tì baa nnɔ , kimɛ udu nnɔ ya nib maaleh biʼfɛ̀l ni , ki teh biʼdu gbɛre ' nɛ , ka te tɛn kpopii , ka lì li kɛ̀le kuum mɔ fiebu .
