51001023	Faith	Ele fará isso, contanto que vocês continuem [DOU] crendo na mensagem sobre Cristo; especificamente, se permanecerem estáveis e se continuarem confiantemente esperando receber aquilo de que ouviram quando ouviram aquela mensagem. Aquela mensagem tem sido proclamada {Eles proclamaram aquela mensagem} às pessoas em muitos lugares, [HYP] e eu, Paulo, também me tornei um daqueles que a proclamam às pessoas.
43008059	Violence	Portanto, por ficarem tão zangados por Jesus afirmar que tinha existido eternamente/era igual a Deus, eles pegaram pedras para jogar nele com o intuito de matá-lo. Mas foram impedidos de vê-lo {Jesus fez com que} não O pudessem ver, e Ele saiu do pátio do templo.
49004024	Recommendation	e que deveriam começar a ser [MET] as novas pessoas que Deus os criou para se tornarem {que Deus os tornou}. Quer dizer, seu comportamento deve ser reto e realmente devoto.
66014012	Faith	Portanto, o povo de Deus, aqueles que obedecem aquilo que Deus manda e confiam em Jesus, deve continuar obedecendo e confiando fielmente nele.
44013030	Description	Porém, Deus fez com que Ele voltasse à vida depois de morrer,
43010011	Description	Sou como um bom pastor. Um bom pastor está disposto a morrer para salvar as ovelhas [MET]. Semelhantemente, estou disposto a me sacrificar para salvar aqueles que me pertencem.
49003002	Grace	Suponho que alguém já lhes avisou de como Deus agiu com muita bondade para comigo, nomeando-me para proclamar a boa mensagem a vocês, não judeus.
56003010	Recommendation	Quanto à pessoa que prega ensinamentos falsos prega com que os outros se afastem dos verdadeiros ensinamentos, você deve advertir essa pessoa de que Deus vai castigá-la se continuar assim. Se ela não mudar/deixar de fazer isso, advirta-a mais uma vez. Se a pessoa ainda não desistir, não permita que influencie mais os cristãos.
43010019	Description	Após ouvir estas palavras ditas por Jesus, os judeus ficaram novamente divididos.
43003033	Faith	Aqueles que aceitam o que Ele diz, verificam que aquilo que Deus disse é realmente verdade.
61003014	Recommendation	Portanto, amigos queridos, já que estão esperando essas coisas acontecerem, façam tudo quanto puderem para agir de maneira piedosa para que Cristo veja que vocês são completamente puros [DOU] e que estão agindo pacificamente entre si.
53003001	Faith	Quanto aos demais assuntos, irmãos crentes, orem em nosso favor para que cada vez mais pessoas possam ouvir de nós a mensagem sobre nosso Senhor Jesus e possam acreditar essa mensagem, bem como vocês estão fazendo/têm feito.
47004014	Faith	Agimos assim porque sabemos (excl) que, mesmo que as pessoas nos matem, Deus, que fez com que o Senhor Jesus voltasse à vida após morrer, também fará com que nós (excl) vivamos novamente após morrermos. Ele fará isso por pertencermos a Jesus. Então Deus vai conduzir-nos (excl), junto com vocês, ao lugar onde Ele está.
59005014	Recommendation	Se qualquer um de vocês está doente [RHQ], esse deve chamar os líderes da congregação para virem e orar por ele. Eles devem colocar azeite de oliva sobre a cabeça do doente e então, com a autoridade do Senhor [MTY] (OU, clamando ao Senhor para curá-lo), orar.
44007023	Description	“Um dia, quando Moisés tinha uns quarenta anos de idade, ele resolveu ir ver como passavam seus patrícios/conterrâneos, os israelitas. Por isso ele se dirigiu ao lugar onde eles trabalhavam.
44023027	Violence	Mando-lhe este homem, Paulo, porque ele foi preso por certos judeus e estava para ser assassinado por eles {certos judeus o agarraram e estavam para matá-lo}. Mas ouvi alguém dizer que ele é cidadão romano, portanto eu e meus soldados fomos a onde ele estava e o livramos daqueles judeus, para evitar sua morte nas mãos deles.
44019029	Description	Muitos dos outros habitantes da cidade ouviram a gritaria e se uniram a multidão. Também se zangaram contra Paulo e começaram a gritar. Várias dessas pessoas pegaram dois homens que viajavam com Paulo. Eles se chamavam Gaio e Aristarco e eram macedônios. Então a multidão inteira foi correndo, arrastando consigo esses dois homens, até o estádio municipal.
44003014	Sin	Vocês rejeitaram Jesus, embora Ele tivesse feito sempre o que era certo/justo e reto. Pilatos quis soltar Jesus, mas vocês o instigaram a soltar alguém que tinha matado algumas pessoas {soltar em lugar dele alguém que tinha matado algumas pessoas}.
44015009	Faith	Deus tratou/salvou a nós judeus e àqueles não-judeus da mesma forma, limpando-os por dentro exclusivamente como resultado de eles crerem no Senhor Jesus. Era exatamente assim que Ele nos tinha perdoado.
46011028	Recommendation	Antes de qualquer cristão comer desse pão e beber desse vinho [MTY], ele deve pensar com cuidado sobre o seu comportamento,
46015058	Faith	Portanto, meus irmãos cristãos a quem eu amo, continuem segurando firmemente nas coisas em que creem. Não permitam que nada os faça duvidar delas. Continuem sempre fazendo, com entusiasmo, o trabalho que o Senhor lhes confiou. E lembrem-se de que nunca é em vão o trabalho que vocês fazem por amor ao Senhor, como de fato o seria, se Deus não nos fizesse ressuscitar após a morte.
46004016	Recommendation	Por isso, eu insisto em que vocês vivam por Cristo, como eu vivo.
46001021	Faith	Deus, agindo de maneira muito sábia, impossibilitou que os descrentes conhecessem a Deus pela prática daquilo que eles achavam ser [IRO] sábio. Pelo contrário, Ele se agradou em salvar aqueles que confiam em Cristo por causa deles terem ouvido o que as pessoas lhes proclamaram, uma mensagem que os outros consideram tola.
60003001	Recommendation	Vocês mulheres que são crentes, submetam-se aos seus maridos, assim como os escravos devem submeter-se aos patrões deles. Façam assim para que, se alguns deles não crerem na mensagem sobre Cristo, possam se converter a Cristo sem a necessidade de suas mulheres dizerem qualquer coisa a eles a respeito do relacionamento delas com Deus.
47005020	Recommendation	Portanto, eu e meus companheiros somos os representantes de Cristo neste mundo. Quando comunicamos às pessoas a mensagem sobre Cristo, é Deus mesmo que apela para elas através daquilo que dizemos. Portanto, como verdadeiros representantes de Cristo, apelamos a vocês: ‘Creiam na verdadeira mensagem de Deus sobre Cristo para serem reconciliados {terem uma relação pacífica} com Ele’.
44002024	Description	Jesus sofreu terrivelmente ao morrer, mas Deus não O deixou morto, pois era impossível que Ele [PRS] permanecesse morto. Deus fez com que Ele ficasse vivo novamente.
59002007	Sin	São eles/não são eles [RHQ] que falam mal contra Jesus Cristo, a pessoa tão boa / nobre a quem vocês pertencem!
54003003	Description	Não deve ser viciado no álcool. Não deve insistir em brigar com aqueles que o irritam. Pelo contrário, deve ser manso, não brigoso. Não deve ser ganancioso.
43004014	Grace	Mas aqueles que beberem da água que eu lhes dou nunca mais terão sede. Pelo contrário, a água que eu lhes dou será no interior deles como uma fonte de água que os capacita a viver eternamente”.
62002005	Faith	Mas se alguém obedecer aquilo que Deus nos manda fazer, tal pessoa realmente ama a Deus da forma que Deus deseja. Vou lhes dizer como podemos ter certeza de termos um íntimo relacionamento com Deus:
66016013	Description	Vi três espíritos malignos, que pareciam rãs, saírem da boca do dragão, da boca da besta e da boca do falso profeta.
59002008	Recommendation	Deus ordenou nas Escrituras que cada um de vocês deve amar ao próximo como ama a si mesmo. Este mandamento é o que Jesus, nosso Rei [MTY], nos mandou fazer. Se vocês realmente estão amando uns aos outros, estão fazendo o que é certo.
47004005	Faith	É por causa disso que, ao lhes ensinarmos (excl), não nos gabamos de nós mesmos, como alegam certas pessoas. Pelo contrário, nós lhes ensinamos que Jesus Cristo é nosso Senhor. Nós mesmos somos apenas servos de vocês. Desejamos honrar e obedecer a Jesus.
46015033	Recommendation	Não se deixem enganar pelas pessoas que dizem que Deus não vai ressuscitar os cristãos {Não deixem que as pessoas que dizem que Deus não vai ressuscitar os cristãos os enganem}. Se vocês se associarem aos iníquos que dizem tais coisas, eles vão estragar a boa conduta de vocês.
58013020	Grace	Jesus supre nossas necessidades, protege-nos e nos guia, como faz um grande pastor com suas ovelhas [MET], e Deus, que nos dá paz interior, ressuscitou nosso Senhor Jesus dentre os mortos. Ao fazer isso, Deus confirmou sua eterna aliança conosco pelo sangue derramado de Cristo quando ele morreu na cruz.
50001027	Recommendation	O mais importante é que como irmãos crentes em Cristo, ajam assim como aprenderam quando ouviram a boa mensagem sobre Cristo. Façam isso quer que eu vá ver vocês, quer que eu esteja longe de vocês e os outros me falam de vocês, para que o que me disserem me faça feliz. Eles me dirão que vocês estão unidos e cooperando na sua resistência àqueles que se opõem à boa mensagem (ou, se opõem a vocês ). Vou saber que vocês não estão deixando que outros os influenciem a crerem em uma mensagem diferente da boa mensagem de Cristo.
46006014	Grace	Deus, pelo Seu poder, fez com que o Senhor Jesus voltasse à vida depois da morte, e Ele vai fazer-nos voltar a viver após nossa morte, fato este que demonstra que Ele se interessa muito pelo nosso corpo.
55001006	Recommendation	Por ter certeza de que você crê nele, venho lembrar-lhe de fazer com fervor aquilo que Deus determinou e capacitou você para fazer. Deus escolheu você pelo imposição das minhas mãos separando-o para o serviço de Deus.
60004006	Grace	É por esta razão que a mensagem sobre Cristo foi pregada {as pessoas pregaram a mensagem de Cristo} para as pessoas/os crentes que já morreram. Foi pregada {pregaram} a eles para que mesmo que fossem julgados por pessoas más que {pessoas más os julgassem e} dissessem que são culpados, o Espírito de Deus os ajudaria a viver eternamente. toda a sua força.
46007023	Recommendation	É como se [MET] um preço tivesse sido pago por Cristo {Cristo pagasse um preço} para comprá-los quando Ele morreu por vocês. Portanto, não se comportem como escravos dos iníquos, praticando as coisas malévolas que eles lhes mandam fazer.
46010010	Recommendation	Não devemos nos queixar daquilo que Deus faz. Algumas daquelas pessoas se queixavam, e como resultado o anjo destruidor dos seres humanos as aniquilou. Portanto, Deus com certeza vai nos castigar se pecarmos como elas.
47002017	Faith	Como vocês veem, nós (excl) não trabalhamos/agimos como tantos outros que vocês conhecem. Eles ensinam a mensagem de Deus de uma forma que consideram agradável às pessoas e acham que as pessoas vão pagar-lhes por ensinarem daquela maneira. Nós (excl.) com certeza não queremos proceder assim. Pelo contrário, como servos de Cristo e sabendo que Deus nos (excl) observa, nós ensinamos sinceramente a mensagem que Deus nos deu para comunicar.
45015001	Recommendation	A maioria de nós tem certeza de que Deus não nos condena por haver feito certas coisas proibidas pela lei que Deus deu a Moisés. Devemos suportar as práticas daqueles que estão incertos quanto a tais coisas, não deixando que eles nos irritem. Não devemos meramente agradar a nós mesmos.
50002024	Faith	E tenho confiança/certeza de que Deus também vai me ajudar a ir/vir a vocês logo.
66007001	Description	Depois, eu vi quatro anjos. Um deles ficava em pé ao norte, um a leste, um ao sul e um a oeste. Eles refreavam os ventos que sopravam de toda parte [MTY] para que não batessem de forma destrutiva na terra, nem no mar, nem em qualquer árvore.
60004003	Sin	Falo do tempo que vocês ainda têm, porque o tempo que já passou nas suas vidas basta [SAR] para fazer o que as pessoas que não conhecem Deus gostam de fazer. No passado vocês faziam todo tipo de ato sexualmente imoral [DOU], participavam de orgias depois de ficarem bêbados, faziam farras e adoravam ídolos abomináveis.
66011005	Violence	Se alguém tentar fazer mal às testemunhas, sairá da boca delas fogo que destruirá seus inimigos. Se alguém quiser fazer mal a elas, com certeza ele vai ser morto {com certeza as duas testemunhas vão matá-lo} desta forma.
44023005	Recommendation	Paulo respondeu: “Meus irmãos judeus, sinto muito. Eu não sabia que o homem que mandou um de vocês me dar um tapa na boca era o sumo sacerdote. Se tivesse sabido isso, eu não teria insultado nosso sumo sacerdote, pois sei que está escrito {que Moisés escreveu} na nossa lei: ‘Não falem mal de um governante do seu povo!’ ”
66022015	Sin	Do lado de fora ficam as pessoas imundas/malévolas, inclusive as que praticam idolatria, as que pecam sexualmente, as que assassinam outras pessoas, as que adoram os ídolos e todas aquelas pessoas que gostam de mentir e mentem continuamente. Tais pessoas nunca poderão entrar naquela cidade”.
66002014	Sin	Contudo, tenho a seguinte queixa contra vocês: vocês permitem que alguns dos seus membros ensinem as coisas que Balaão ensinou há muito tempo. Ele ensinou Balaque a persuadir os israelitas a pecarem. Especificamente, ensinou-os a consumir comida que tinham oferecido aos ídolos e a praticar imoralidades sexuais.
53001003	Faith	Irmãos crentes, nós três damos graças a Deus com frequência por vocês, pois devemos fazer isso e está certo fazermos assim. Agradecemos a ele pelo fato de vocês crerem cada vez mais no Senhor Jesus e se amarem mais e mais uns aos outros.
46012002	Sin	Vocês sabem que, antes de se tornarem cristãos, vocês eram guiados por diversas coisas {diversas coisas os guiavam} a adorarem os ídolos, que são incapazes de dizer-lhes uma mínima parte da mensagem de Deus.
49005025	Recommendation	Vocês maridos, amem à sua esposa como Cristo amou todos nós que íamos tornar-nos crentes, com o resultado de que Ele resolveu voluntariamente morrer por nós,
45012017	Recommendation	Não retribuam atos malévolos a qualquer pessoa que lhes tiver feito algo de mal. Procurem agir de uma forma que todas as demais pessoas possam reconhecer como sendo boa!
60005006	Recommendation	Humilhem-se, portanto, ao darem conta de que Deus tem grande poder [MTY] para punir os orgulhosos, para que possa honrar vocês no tempo determinado por ele.
44014017	Grace	Mas Ele nos tem mostrado [LIT] que age bondosamente para conosco (incl). É Ele quem faz a chuva cair e as plantas crescerem. Ele lhes dá bastante comida para comerem e faz com que vocês fiquem muito felizes”.
54003011	Recommendation	Suas esposas (OU, As diaconisas), semelhantemente, devem comportar-se apropriadamente. Especificamente, devem ser pessoas sérias. Não devem falar mal das outras pessoas. Não devem ser viciadas no álcool. Devem ser fiéis em todas as coisas.
66002021	Sin	Embora eu tenha dado a ela tempo suficiente para rejeitar sua imoralidade sexual e suas práticas pagãs, ela não quis parar de praticar aquelas coisas.
44012020	Description	Naquela altura, o Rei Herodes se zangou violentamente com os habitantes das cidades de Tiro e Sidom. Então alguns homens que representavam os moradores chegaram em comitiva a Cesareia para um encontro com Herodes. Eles persuadiram Blasto, um dos importantes oficiais de Herodes, a avisar Herodes de que os habitantes das cidades deles desejavam fazer as pazes com ele. Eles desejavam ter comércio com as pessoas governadas por Herodes, pois precisavam receber comida {precisavam da comida recebida} daquela região. Herodes tinha mandado que as pessoas governadas por ele deixassem de mandar comida aos habitantes daquelas cidades.
43008049	Sin	Jesus respondeu, “Um demônio não me controla! Pelo contrário, honro meu Pai, e vocês não me honram.
43006018	Description	Começou a soprar um vento forte, fazendo a água ficar bem agitada criando ondas grandes.
45008018	Faith	Acho que aquilo que estamos sofrendo atualmente nem vale nossa atenção, pois é tão grande o futuro/o esplendor/a glória que Deus vai nos revelar.
62002012	Grace	Estou escrevendo isto a vocês, a quem amo como se [MET] fossem meus filhinhos, a vocês que são pessoas espiritualmente maduras que são como [MET] pais e a vocês os espiritualmente vigorosos que são como [MET] jovens. Lembrem-se que seus pecados foram perdoados {Deus perdoou seus pecados} por causa daquilo que Cristo [MTY] fez. Vocês chegaram a conhecer a Cristo, que tem existido sempre. Vocês venceram o maligno, Satanás.
55001009	Grace	Deus nos salvou e quer que tenhamos vidas puras. Não foram nossas boas ações que o levaram a agir bondosamente para conosco; ele mesmo planejou ajudar-nos. Quer dizer, há muito tempo ele determinou favorecer-nos mediante aquilo que Cristo Jesus ia fazer por nós.
43019006	Violence	Quando os principais sacerdotes e guardas do templo o viram, gritaram, “Mande que seus soldados o matem, pregando-o em uma cruz! Crucifique-o”! Pilatos, sabendo que eles mesmos não poderiam fazê-lo legalmente, disse a eles, “Levem-no vocês mesmos e crucifiquem-no! Quanto a mim, não acho que Ele tenha feito nada que justifique castigo”.
60001010	Grace	Quanto àqueles que há muito tempo atrás falaram mensagens que Deus tinha revelado a eles sobre como Deus agiria de uma maneira que vocês não mereciam, eles investigaram com muito cuidado [DOU] como Deus salvaria vocês.
63001007	Sin	Muitas pessoas que enganam seus semelhantes abandonaram sua congregação e já saíram entre outras pessoas da sua região [MTY]. São esses indivíduos que não confessam que Jesus Cristo se tornou ser humano. São aqueles que enganam as pessoas e se opõem àquilo que ensinamos sobre Cristo.
44024005	Sin	Nós (excl) observamos que este homem, por onde vai, cria problemas. Especificamente, ele provoca motins entre todos os judeus por toda parte [HYP]. Assim como, ele lidera o grupo inteiro chamado de ‘seguidores do nazareno’, um grupo que acredita em mentiras/maldades.
54003016	Grace	Com certeza, é verdade que a mensagem que Deus revelou agora é realmente maravilhosa! Aprendemos naquela mensagem esta verdade espiritual que anunciamos/cantamos sobre Cristo: (OU, Afirmamos esta doutrina como sendo certa e muito importante. É ela que nos mostra como devemos viver de uma forma piedosa. É o que Deus agora revelou, mesmo que não fosse conhecido anteriormente.) Afirmamos, com relação a Jesus Cristo, que: É Ele quem apareceu na terra em corpo humano; foi revelado pelo Espírito de Deus {o Espírito de Deus mostrou} que Ele era realmente o Messias (OU, que Ele agia sempre de forma reta e justa); Ele foi visto pelo anjos {os anjos O viram}; foi proclamada a mensagem dele {as pessoas pregaram sobre Ele} entre muitas nações; a mensagem dele foi recebida com fé pelos seres humanos em muitas regiões do mundo {as pessoas em muitas partes do mundo acreditaram na mensagem sobre Ele}; Ele foi levado {Deus O levou} para ––os céus/a glória.
66016021	Violence	Outrossim, como resultado de o anjo ter esvaziado seu vaso, caíram do céu sobre os seres humanos grandes pedras de granizo, pesando cada uma delas quase 45 quilos. Os seres humanos insultaram a Deus por Ele ter causado a imensa saraivada que caiu sobre eles.
61003013	Faith	Mesmo que tudo isso vá acontecer, estamos esperando novos céus e uma nova terra, porque é isso que Deus prometeu. Nestes novos céus e nesta nova terra, somente aquelas pessoas que são [PRS] justas viverão.
66006014	Description	O céu se rachou e se enrolou para os dois lados, como [SIM] um pergaminho velho fica enrolado ao ser dividido em dois. Todas as montanhas e ilhas se ficaram deslocadas {deslocaram}.
58010010	Grace	Por Jesus Cristo ter feito aquilo que Deus queria que ele fizesse, fomos separados {ele nos separou} para Deus pela oferta que ele fez do seu próprio corpo uma só vez como sacrifício, um sacrifício que não precisa ser repetido.
52001002	Faith	Nós três agradecemos sempre a Deus por vocês ao mencioná-los quando oramos (ou, quando oramos por vocês).
66006004	Violence	Então saiu um cavalo vermelho. Àquele que estava montado nele foi lhe permtido fazer com que{Deus permitiu que aquele que o montava} fez/fizesse com que as pessoas já não pudessem viver em paz, passando a matar-se umas às outras. Para tal propósito, foi lhe dado {o agente de Deus lhe deu} uma grande espada.
54006001	Recommendation	Quanto aos escravos [DOU] cristãos, ensine-os a pensar no fato de ser certo honrarem seus patrões de todas as formas possíveis. Se assim fizerem, as pessoas não falarão contra Deus [MTY], e a doutrina que nós apóstolos ensinamos não será criticada {elas não falarão contra aquilo que nós apóstolos ensinamos}, pois observarão que os escravos respeitam os seus patrões.
51003009	Recommendation	Não mintam uns aos outros. Não façam tais coisas, pois já estão livres da sua antiga natureza iníqua e deixaram de fazer o que faziam quando ainda tinham aquela antiga natureza iníqua,
66002020	Sin	Contudo, tenho a seguinte queixa contra vocês: vocês toleram, entre seus membros, aquela mulher que é parecida [MET] com a malvada rainha Jezabel, que viveu há muito tempo. Ela se chama de profetisa, mas pelo seu ensino ela está enganando meus próprios servos. Ela os estimula a praticar a imoralidade sexual e a consumir comidas que já ofereceram aos ídolos.
48003008	Grace	Além disso, Deus planejou antecipadamente que seria no momento de os não judeus confiarem nele que ele apagaria o registro dos seus pecados. Moisés escreveu na Escritura [PRS] esta boa mensagem que Deus comunicou a Abraão: “Por meio daquilo que você fez vou abençoar as pessoas em [MTY] todas as nações.”
58012005	Recommendation	Não se esqueçam [RHQ] destas palavras que Salomão disse ao seu filho, que são iguais às que Deus diria ao exortar vocês como filhos dele: Meu filho, preste atenção [LIT] quando o Senhor o disciplina, e não se desanime quando o Senhor o castiga [DOU],
58013017	Recommendation	Obedeçam aos seus líderes espirituais e façam aquilo que eles mandarem, pois são eles que estão vigiando pelo bem-estar espiritual de vocês [SYN]. Algum dia eles terão que ficar diante de Deus para ele lhes declarar se aprova aquilo que eles têm feito. Obedeçam-lhes para que possam realizar devidamente a tarefa de vigiá-los com alegria e não com tristeza, pois se vocês os obrigarem a desempenhar essa função com tristeza, não será de nenhuma ajuda para vocês (OU, eles não poderão ajudar vocês de nenhuma maneira).
44013019	Description	Deus fez com que os israelitas vencessem sete grupos tribais que habitavam a região de Canaã e deu a terra deles a nós (incl) israelitas para que pudéssemos possui-la.
54006003	Faith	Algumas pessoas ensinam coisas diferentes. Aquilo que elas ensinam não está de acordo com a doutrina certa que nosso Senhor Jesus Cristo ensinou (OU, sobre nosso Senhor Jesus Cristo). Elas não concordam com a ideia de levarmos vidas santas.
63001010	Recommendation	Quando você encontrarem alguém que não ensine aquilo que Cristo ensinava, não o acolham em casa! Não o animem, desejando-lhe bênçãos de nenhuma forma!
47001005	Grace	De fato, da mesma forma como Cristo sofreu, nós que O servimos também sofremos continuamente por pertencermos a Ele. Mas também, por pertencermos a Cristo, Deus nos fortalece grandemente da mesma maneira como Ele O fortaleceu.
65001011	Sin	Deus vai lhes fazer coisas horríveis! Eles vivem de forma iníqua como Caim, que matou seu irmão por causa dos ciúmes. Aqueles falsos mestres se dedicam às ações erradas [MET] como Balaão. Balaão tentou levar o povo de Deus ao pecado para ganhar o dinheiro que alguém lhe ofereceu. Eles vão perecer como Corá, que se rebelou contra a autoridade que Deus concedeu a Moisés.
65001010	Sin	Mas esses falsos mestres no meio de vocês insultam os seres/elementos espirituais que não compreendem. Além disso, por fazerem as coisas iníquas que desejam, coisas que entendem naturalmente/impensadamente, coisas que fazem os animais sem razão, eles se destroem. Mas Deus também vai castigá-los.
58011007	Faith	Foi por Noé confiar em Deus que, depois de ser advertido por Deus {depois que Deus o advertiu} sobre um dilúvio que não tinha acontecido ainda, Noé mostrou que reverenciava a Deus por construir um grande navio para salvar sua família. Ao fazer isso, ele mostrou a todas as pessoas que não acreditavam nas palavras dele [MTY] que elas mereciam ser condenadas {que Deus iria condená-las}. Ele se tornou uma pessoa que Deus declarou justa por causa da sua confiança em Deus.
58009006	Description	Preparadas todas essas coisas {Depois que tinham preparado dessa forma todas as referidas coisas} nas duas divisões da tenda, os sacerdotes judaicos costumavam entrar na sala externa da tenda para executar seus rituais.
44007051	Sin	“Vocês são muito obstinados/teimosos [MET], pois não querem obedecer nem escutar [MTY] a Deus! Vocês são iguais aos seus antepassados! Vocês sempre resistem ao Espírito Santo, como eles resistiram!
54001009	Sin	Devemos nos lembrar de que Deus não deu aquelas leis a Moisés para condenar as pessoas justas. Por meio daquelas leis Ele condenou as pessoas que se comportam como se não houvessem / existissem leis e que se recusam a obedecerem ninguém. Ele condenou aqueles que se recusam a reverenciar a Deus e aqueles que pecam habitualmente. Ele condenou aqueles que recusam praticar os rituais que agradam a Deus e que não respeitam a religião. Ele condenou aqueles que matam os pais e as mães e que matam outras pessoas.
46005009	Recommendation	Na carta anterior que escrevi a vocês, eu disse que vocês não deveriam se juntar a pessoas sexualmente imorais.
