46007036	Recommendation	Mas se alguém lhe parece que indecentemente trata com sua virgem, se ela passar da idade da juventude, e assim convier se fazer, que tal faça o que quiser, não peca, casem-se.
43016002	Violence	Expulsarão a vós das sinagogas; mas a hora vem, quando qualquer que vos matar, pensará fazer serviço a Deus.
66015001	Description	E eu vi outro grande e admirável sinal no céu: sete anjos, que tinham as sete últimas pragas; porque nelas a ira de Deus se torna completa.
43018023	Description	Respondeu-lhe Jesus: Se falei mal, dá testemunho do mal; e se bem, por que me feres?
50004003	Recommendation	Peço também de ti, verdadeiro companheiro, que ajude a essas que lutaram no Evangelho comigo, como também com Clemente, e com os demais cooperadores, cujos nomes estão no livro da vida.
66016006	Sin	porque eles derramaram o sangue dos santos e dos profetas, também tu lhes deste sangue a beber; porque disto são merecedores.”
45006002	Sin	De maneira nenhuma! Nós, que morremos para o pecado, como ainda viveremos nele?
66017011	Violence	E a besta que era, e não é, este é também o oitavo; e é um dos sete, e vai para a perdição.
48004030	Recommendation	Mas o que diz a Escritura? Expulsa a escrava e o filho dela, porque de maneira nenhuma o filho da escrava herdará com o filho da livre.
54006009	Sin	Mas os que querem ser ricos caem em tentação, armadilha, e em muitos desejos insensatos e nocivos, que afundam as pessoas na destruição e perdição.
66017016	Violence	E os dez chifres que tu viste na besta, estes odiarão a prostituta, e a farão desolada, e nua; e comerão a carne dela, e a queimarão com fogo.
46008003	Faith	Mas se alguém ama a Deus, o tal dele é conhecido.
45003009	Sin	Então, quê? Somos nós melhores? Não, de maneira nenhuma. Pois já delatamos que todos, tanto judeus como gregos, estão debaixo do pecado,
44007041	Sin	E naqueles dias eles fizeram o bezerro, o ofereceram sacrifício ao ídolo, e se alegraram nas obras de suas próprias mãos.
66009020	Sin	E o resto da humanidade, que não foi morta por estas pragas, não se arrependeu das obras de suas mãos, para não adorar os demônios, e ídolos de ouro, de prata, de bronze, de pedra e de madeira, que não podem ver, nem ouvir, nem andar;
47005011	Faith	Conhecendo, pois, o temor ao Senhor, persuadimos as pessoas para a fé, e a Deus somos claramente visíveis; mas espero, também, que estejamos claramente visíveis em vossas consciências.
49002003	Sin	Entre esses também todos nós antes andávamos nos desejos da nossa carne, fazendo a vontade da carne e dos pensamentos; e éramos por natureza filhos da ira, como também os outros.
44002040	Recommendation	E com muitas outras palavras ele dava testemunho, e exortava, dizendo: Salvai-vos desta geração perversa!
45008013	Faith	porque, se viverdes segundo a carne, morrereis; mas se, pelo Espírito, fizerdes morrer as ações do corpo, vivereis.
45010011	Faith	Porque a Escritura diz: “Todo aquele que nele crê não será envergonhado.”
45001008	Faith	Em primeiro lugar, agradeço ao meu Deus por meio de Jesus Cristo, por todos vós, porque a vossa fé é anunciada no mundo todo.
52001004	Faith	Sabemos, irmãos amados por Deus, que por ele fostes escolhidos,
60004008	Recommendation	Mas, acima de tudo, tende fervoroso amor uns para com os outros; porque o amor cobrirá uma multidão de pecados.
44027001	Description	E quando foi determinado que tínhamos que navegar para a Itália, entregaram a Paulo e alguns outros prisioneiros, a um centurião, por nome Júlio, do esquadrão imperial.
66015003	Faith	E cantavam o cântico de Moisés, o servo de Deus, e o cântico do Cordeiro, dizendo: “Grandes e maravilhosas são as tuas obras, ó Senhor Deus Todo-Poderoso! Teus caminhos são justos e verdadeiros, ó Rei dos santos!
60002002	Faith	e desejai ansiosamente, como bebês recém-nascidos, o leite da Palavra, não falsificado, para que por meio dele estejais crescendo;
66014013	Faith	E eu ouvi uma voz do céu, que me dizia: Escreve: “Benditos são os mortos que morrem no Senhor a partir de agora; sim, diz o Espírito, para que se descansem de seus trabalhos; e suas obras os seguem.”
59001027	Faith	A religião pura e não contaminada para com Deus e Pai é esta: visitar os órfãos e as viúvas nas suas aflições, e guardar-se sem a corrupção do mundo.
51002004	Recommendation	Digo isso para que ninguém vos engane com palavras persuasivas.
66005013	Description	E eu ouvi toda criatura que está no céu, e na terra, e abaixo da terra, e no mar, e todas as coisas que nelas há, dizendo: “Ao que está sentado sobre o trono, e ao Cordeiro, seja o louvor, a honra, a glória, e o poder, para todo o sempre!”
66008008	Description	E o segundo anjo tocou sua trombeta; e como um grande monte ardendo em fogo foi lançado ao mar; e a terça parte do mar se tornou sangue;
44007058	Violence	E, lançando -o fora da cidade, o apedrejaram; e as testemunhas puseram as roupas deles junto aos pés de um rapaz chamado Saulo.
45015011	Faith	E outra vez: “Louvai ao Senhor todas as nações, e celebrai-o todos os povos.”
45011036	Faith	Porque dele, por ele, e para ele, são todas as coisas! A ele seja a glória eternamente! Amém!
43001029	Faith	O dia seguinte viu João a Jesus vir a ele, e disse: Eis o Cordeiro de Deus, que tira o pecado do mundo.
58011031	Description	Pela fé, Raabe, a prostituta, não pereceu com os incrédulos, pois acolheu em paz os espias.
43010010	Grace	O ladrão não vem, senão para roubar, matar, e destruir; eu vim para que tenham vida, e a tenham em abundância.
50003020	Faith	Mas nós somos cidadãos dos céus, de onde também esperamos um Salvador, o Senhor Jesus Cristo.
45015007	Recommendation	Portanto, recebei uns aos outros, assim como também Cristo nos recebeu para a glória de Deus.
44021024	Recommendation	Toma contigo a estes, e purifica-te com eles, e paga os gastos deles, para que rapem a cabeça, e todos saibam que não há nada do que foram informados sobre ti, mas sim, que tu mesmo andas guardando a Lei.
45004012	Faith	e para que fosse pai da circuncisão, dos que não somente são circuncidados, mas que também andam nos passos da fé do nosso pai Abraão, quando ainda não era circuncidado.
44001026	Description	E lançaram-lhes as sortes; e caiu a sorte sobre Matias. E ele passou a ser contado junto com os onze apóstolos.
45004007	Grace	Benditos são os que têm as transgressões perdoadas, e seus pecados são cobertos.
66011004	Description	Estas são as duas oliveiras, e os dois castiçais, que estão diante do Deus da terra.
59004009	Recommendation	Reconhecei vossas misérias, lamentai e chorai. Torne-se o vosso riso em pranto, e a vossa alegria em tristeza.
64001011	Recommendation	Amado, não imites o mal, mas sim o bem. Quem faz o bem é de Deus, mas quem faz o mal nunca viu Deus.
45004011	Faith	E ele recebeu o sinal da circuncisão como selo da justiça da fé quando ainda era incircunciso, para que fosse pai de todos os que creem, ainda que não estejam circuncidados, para que a justiça também lhes seja imputada;
45006007	Grace	pois o que está morto já está absolvido do pecado.
47004010	Faith	Sempre por todas as partes trazendo a mortificação do Senhor Jesus no corpo, para que também a vida de Jesus se manifeste em nossos corpos.
50002021	Sin	pois todos buscam as suas próprias coisas, e não as de Cristo Jesus.
58011011	Faith	Pela fé, também, a própria Sara recebeu a capacidade de conceber descendência, e já na idade avançada ela deu à luz, pois considerou fiel aquele que havia prometido.
43006039	Grace	E esta é a vontade do Pai, que me enviou: que de tudo quanto me deu, nada perca, mas que eu o ressuscite no último dia.
46008006	Faith	Todavia para nós há só um Deus, o Pai, do qual são todas as coisas, e nós para ele; e um só Senhor Jesus Cristo, pelo qual são todas as coisas, e nós por ele.
52003006	Description	Mas agora, depois que Timóteo voltou a nós da vossa presença, e nos trouxe boas notícias da vossa fé e amor, e de como sempre tendes boa lembrança de nós, e desejais muito nos ver, como também nós a vós;
60005004	Grace	E quando o Pastor Principal aparecer, vós recebereis a indestrutível coroa da glória.
47003012	Faith	Visto que temos tal esperança, falamos com muita ousadia,
61002012	Sin	Mas estes, como animais irracionais, que seguem a natureza, gerados para a prisão e destruição, insultando aquilo que não entendem, perecerão na sua própria corrupção;
43012006	Sin	E isto disse ele, não pelo cuidado que tivesse dos pobres; mas porque era ladrão, e tinha a bolsa, e trazia o que se lançava nela .
62004016	Faith	E nós conhecemos e cremos no amor que Deus tem por nós. Deus é amor, e quem está no amor está em Deus, e Deus nele.
44011019	Description	E os que foram dispersos por causa da perseguição que aconteceu por causa de Estêvão, passaram até a Fenícia, e Chipre, e Antioquia; não falando a ninguém a palavra, a não ser somente aos judeus.
54006006	Faith	Mas grande lucro é a devoção divina acompanhada de contentamento.
66013007	Violence	E foi-lhe concedido fazer guerra aos santos, e os vencer; e foi-lhe dada autoridade sobre toda tribo, língua, e nação.
60002020	Faith	Afinal, que mérito há em suportar serdes espancados por cometerdes pecado? Contudo, se, quando fazeis o bem, sois afligidos e suportais, isso é a Deus.
58009015	Grace	E por isso ele é o Mediador de um Novo Testamento, a fim de que, com a ocorrência de uma morte para redenção das transgressões sob o primeiro Testamento, os que foram chamados recebam a promessa da herança eterna.
45006001	Sin	Que diremos, pois? Continuaremos no pecado, para que a graça aumente?
49005004	Recommendation	nem imoralidades, nem palavras tolas, nem escárnios, que não convêm; em vez disso, atos de gratidão.
66006008	Violence	E eu olhei, e eis um cavalo amarelo, e o que estava sentado sobre ele, seu nome era Morte; e o Xeol o seguia. E foi-lhes dada autoridade para matar a quarta parte da terra, com espada, com fome, com morte por doença , e com os animais ferozes da terra.
45004016	Faith	Por isso é pela fé, para que seja conforme a graça, a fim de que a promessa seja confirmada a todos os descendentes, não somente aos que são da Lei, mas também aos que são da fé de Abraão, que é Pai de todos nós,
44028018	Description	Os quais, tendo me investigado, queriam me soltar, por não haver em mim nenhum crime de morte.
45009016	Grace	Portanto, não depende daquele que quer, nem daquele que se esforça, mas sim, de Deus, que se compadece.
46010008	Sin	E não pequemos sexualmente, como alguns deles assim pecaram, e em um dia vinte e três mil caíram.
45007023	Sin	mas em meus membros vejo outra lei, que batalha contra a lei do meu entendimento, e me prende sob a lei do pecado, que está nos meus membros.
58006001	Faith	Portanto deixemos os tópicos elementares da doutrina de Cristo, e prossigamos adiante até a maturidade, sem lançarmos de novo o fundamento da conversão de obras mortas, e da fé em Deus,
46016011	Recommendation	Portanto ninguém o despreze; mas enviai-o em paz, para que ele venha a mim; porque eu o espero com os irmãos.
59002014	Faith	Meus irmãos, qual é o proveito se alguém disser que tem fé, mas não tiver obras? Acaso a fé pode salvá-lo?
43007025	Description	Diziam, pois, alguns dos de Jerusalém: Não é este ao que procuram matar?
43020022	Faith	E havendo dito isto, soprou sobre eles ,e disse-lhes: Recebei o Espírito Santo.
45010003	Sin	Pois, como ignoraram a justiça de Deus, e procuraram estabelecer a sua própria justiça, eles não se sujeitaram à justiça de Deus.
62005010	Faith	Quem crê no Filho de Deus tem testemunho em si mesmo; quem não crê em Deus o fez de mentiroso, porque não creu no testemunho que Deus deu acerca do seu Filho.
43014012	Faith	Em verdade, em verdade vos digo, que aquele que crê em mim, as obras que eu faço também ele as fará; e fará maiores que estas. Porque eu vou a meu Pai.
56002009	Recommendation	Que os servos sejam sujeitos a seus próprios senhores, sendo agradáveis em tudo, e não falando contra eles .
58012015	Recommendation	Vigiai com empenho para que ninguém perca de receber da graça de Deus; para não acontecer que alguma raiz de amargura brote, seja incômoda, e muitos sejam contaminados por ela.
54003007	Recommendation	É dever também que tenha bom testemunho dos que estão de fora, para que não caia em reprovação pública e na cilada do diabo.
49004007	Grace	Mas a graça foi dada a cada um de nós conforme a medida do dom de Cristo.
66016003	Description	E o segundo anjo derramou sua taça sobre o mar, e este se tornou em sangue como de morto, e toda alma vivente no mar morreu.
49006006	Recommendation	não servindo somente quando vistos, como para agradar pessoas; mas sim, como servos de Cristo, fazendo de coração a vontade de Deus;
60003016	Recommendation	tendo uma boa consciência; para que, naquilo que falam mal de vós como malfeitores, os que insultam o vosso bom comportamento em Cristo sejam envergonhados.
43006040	Faith	E esta é a vontade daquele que me enviou, que todo aquele que vê ao Filho, e nele crê, tenha a vida eterna; e eu o ressuscitarei no último dia.
44012023	Violence	E no mesmo instante um anjo do Senhor o feriu, porque ele não deu a glória a Deus; e tendo sido comido por vermes, deixou de respirar.
47001003	Grace	Bendito seja o Deus e Pai de nosso Senhor Jesus Cristo, o Pai das misericórdias, e o Deus de toda consolação,
54001006	Sin	Alguns se desviaram dessas coisas, e se entregaram a discursos inúteis;
45001016	Faith	Porque não me envergonho do Evangelho de Cristo, pois é o poder de Deus para a salvação de todo aquele que crê, primeiramente do judeu, e também do grego.
46003011	Description	Pois ninguém pode pôr fundamento diferente do que já está posto, o qual é Jesus Cristo.
49005033	Recommendation	Assim também vós, cada um individualmente, ame a sua própria esposa como a si mesmo, e a mulher respeite o marido.
51002013	Grace	E quando vós estáveis mortos em pecados, na incircuncisão da vossa carne, Deus vos deu vida juntamente com ele, perdoando-vos todas as ofensas.
54004014	Recommendation	Não desprezes o dom que está em ti, que te foi dado por profecia, com a imposição das mãos dos presbíteros.
66021001	Description	E eu vi um novo céu e uma nova terra; porque o primeiro céu e a primeira terra já passaram; e e já não havia mar.
52005016	Recommendation	Alegrai-vos sempre.
66009006	Description	E naqueles dias os homens buscarão a morte, e não a acharão; e desejarão morrer, e a morte fugirá deles.
52004014	Faith	Pois, se cremos que Jesus morreu e ressuscitou, assim também aos que morreram em Jesus, Deus os trará de volta com ele.
62004015	Faith	Todo aquele que confessar que Jesus é o Filho de Deus, Deus está nele, e ele em Deus.
49004022	Recommendation	quanto ao comportamento passado, que deveis abandonar o velho ser humano, que se corrompe pelos maus desejos de engano;
43010009	Grace	Eu sou a porta; se alguém entrar por mim, será salvo; e entrará, e sairá, e achará pasto.
58011037	Violence	foram apedrejados, serrados, tentados, morreram pela espada; andaram vestidos de peles de ovelhas e de cabras; necessitados, afligidos, maltratados;
62002029	Faith	Se sabeis que ele é justo, sabeis que todo aquele que pratica a justiça é nascido dele.
44013047	Grace	Porque assim o Senhor nos mandou, dizendo : Eu te pus como luz para os gentios, para que tu sejas como salvação até às extremidades da terra.
47004002	Faith	Mas já rejeitamos as coisas ocultas e vergonhosas, não andando com astúcia, nem falsificando a Palavra de Deus, mas pela manifestação da verdade fazemos recomendação de nós mesmos à consciência de todos os seres humanos, à vista de Deus.
44002033	Description	Portanto, tendo sido exaltado à direita de Deus, e recebido do Pai a promessa do Espírito Santo, derramou isto que agora estais vendo e ouvindo.
51003010	Recommendation	e vos revestistes do novo, que se renova em conhecimento, conforme a imagem daquele que o criou.
43011004	Faith	E ouvindo Jesus, disse: Esta doença não é para morte, mas para glória de Deus; para que o Filho de Deus seja por ela glorificado.
45001017	Faith	Pois no Evangelho se revela a justiça de Deus de fé em fé; como está escrito: O justo viverá pela fé.
43019017	Description	E levando ele sua cruz, saiu para o lugar chamado a Caveira, que em hebraico se chama Gólgota.
45012006	Faith	Temos, contudo, diferentes dons, segundo a graça que nos foi dada: se é o de profecia, seja segundo a medida da fé;
66004007	Description	E o primeiro animal era semelhante a um leão, e o segundo animal semelhante a um bezerro, e o terceiro animal tinha o rosto como de homem, e o quarto animal era como uma águia voando.
49005015	Recommendation	Portanto vede cuidadosamente como vos conduzis, não como tolos, mas sim como sábios;
45010012	Grace	Pois não há diferença entre judeu e grego, porque um mesmo é o Senhor de todos, rico para todos os que o invocam.
45010004	Faith	Porque o fim da Lei é Cristo, para justiça de todo aquele que crê.
50004006	Recommendation	Não estejais ansiosos por coisa alguma; mas em tudo, por meio de orações e súplicas com ações de gratidão, sejam os vossos pedidos conhecidos por Deus;
46010006	Faith	E estas coisas nos servem de exemplos, para que não desejemos coisas ruins, como eles desejaram.
66009002	Description	E o poço do abismo foi aberto; e subiu fumaça do poço, como a fumaça de uma grande fornalha; e o sol e o ar se escureceram por causa da fumaça do poço.
52004006	Recommendation	Ninguém oprima ou engane ao seu irmão nisso, porque o Senhor é vingador de todas essas coisas, como também antes vos dissemos e demos testemunho.
47005017	Faith	Portanto, se alguém está em Cristo, uma nova criatura é ; as coisas velhas já passaram, eis que tudo se fez novo.
43005020	Faith	Porque o Pai ama ao Filho, e todas as coisas que faz lhe mostra; e maiores obras que estas lhe mostrará, para que vós vos maravilheis.
49004028	Recommendation	O que furtava, não furte mais; em vez disso, trabalhe, operando com as mãos o bem, para que tenha o que repartir com o que tiver necessidade.
57001022	Recommendation	E enquanto isso também me prepara um lugar para eu ficar; porque eu espero que por vossas orações eu seja entregue a vós.
58013009	Recommendation	Não vos deixeis levar por doutrinas várias e estranhas. Pois bom ao coração é ser fortificado pela graça, e não por alimentos, que não resultaram em proveito algum aos que com eles se ocuparam.
52005012	Recommendation	Irmãos, nós vos rogamos que reconheçais os que trabalham entre vós, e que lideram sobre vós no Senhor, e vos advertem;
43009022	Description	Isto disseram seus pais, pois temiam aos judeus. Porque já os Judeus tinham combinado, que se alguém confessasse que ele era o Cristo, seria expulso da sinagoga.
50003003	Faith	Pois a circuncisão somos nós, que servimos a Deus pelo Espírito, orgulhamo-nos em Cristo Jesus, e não confiamos na carne.
62003023	Faith	E este é o seu mandamento: que creiamos no nome do seu Filho Jesus Cristo, e nos amemos uns aos outros, como ele nos mandou.
66013011	Description	E eu vi outra besta subindo da terra, e tinha dois chifres semelhantes aos de um cordeiro; e ela falava como um dragão.
46014020	Recommendation	Irmãos, não sejais meninos no entendimento, mas sede meninos na malícia, e adultos no entendimento.
59005013	Recommendation	Alguém entre vós está aflito? Ore. Alguém está contente? Cante louvores.
58012012	Recommendation	Portanto, levantai as mãos cansadas e os joelhos enfraquecidos,
60001017	Recommendation	E, se vós chamais de Pai aquele que, sem acepção de pessoas, julga segundo a obra de cada um, vivei em temor o tempo de vossa peregrinação;
58010036	Recommendation	pois precisais de paciência, a fim de que, depois que houverdes feito a vontade de Deus, recebais o que foi prometido.
58011001	Faith	Ora, a fé é a certeza das coisas que se esperam, e a prova das coisas que não se veem.
49004017	Recommendation	Portanto digo isso, e dou testemunho no Senhor, que não andeis mais como os outros gentios andam, na futilidade das suas mentes.
51002016	Recommendation	Portanto, ninguém vos julgue pelo comer, ou pelo beber, ou por causa de celebração religiosa , ou pela lua nova, ou pelos sábados;
66007015	Faith	Por isso eles estão diante do trono de Deus, e servem a ele dia e noite no seu templo; e aquele que está sentado sobre o trono armará sua tenda e habitará com eles.
44020010	Description	Mas Paulo, tendo descido, debruçou sobre ele e, abraçando -o ,disse: Não fiqueis perturbados, porque sua alma ainda está nele.
55002010	Faith	Por isso tudo suporto por causa dos escolhidos, a fim de que também eles obtenham a salvação que está em Cristo Jesus com glória eterna.
60005014	Recommendation	Saudai-vos uns aos outros com beijo de amor. A paz seja com todos vós que estais em Cristo Jesus. Amém.
49005021	Recommendation	sujeitando-vos uns aos outros no temor a Deus.
61003017	Recommendation	Portanto vós, amados, sabendo disto com antecedência, guardai-vos para que, pelo engano dos maus, não sejais juntamente arrebatados, e caiais de vossa firmeza.
51003018	Recommendation	Mulheres, sede submissas aos vossos próprios maridos, como convém no Senhor.
54005020	Recommendation	Aos que pecarem, repreende-os na presença de todos, para que os outros também tenham temor.
45014013	Recommendation	Portanto, não julguemos mais uns aos outros; em vez disso, tomai a decisão de nunca pôr alguma pedra de obstáculo ou de tropeço diante do seu irmão.
45002010	Grace	porém, glória, honra, e paz, a todo aquele que pratica o bem, primeiramente ao judeu, e também ao grego;
58011034	Violence	apagaram o poder do fogo, escaparam do fio de espada, da fraqueza tiraram forças, tonaram-se fortes na batalha, puseram em fuga os exércitos dos estrangeiros;
48006017	Faith	De agora em diante, ninguém me perturbe, porque trago no meu corpo as marcas do Senhor Jesus.
66018021	Violence	E um forte anjo levantou uma pedra, como uma grande pedra de moinho, e a lançou no mar, dizendo: “Com tal violência Babilônia será lançada, aquela grande cidade, e não mais será achada.
65001020	Faith	Mas vós, amados, edificai a vós mesmos em vossa santíssima fé, orando no Espírito Santo.
45012002	Recommendation	E não vos conformeis com a presente era; mas transformai-vos pela renovação da vossa mentalidade, para que experimenteis qual seja a boa, agradável, e perfeita vontade de Deus.
46015009	Sin	Porque eu sou o menor dos apóstolos, que não sou digno de ser chamado apóstolo, porque persegui a Igreja de Deus.
62002015	Recommendation	Não ameis o mundo, nem as coisas que há no mundo. Se alguém ama o mundo, o amor do Pai não está nele.
45002001	Sin	Por isso, tu, que julgas, não tens desculpa; quem quer que sejas! Pois condenas a ti mesmo naquilo que julgas o outro, porque tu, que julgas, fazes as mesmas coisas.
48002009	Description	e quando Tiago, Cefas, e João, que eram considerados como colunas, reconheceram a graça que me foi dada, eles estenderam as mãos direitas de comunhão a mim e a Barnabé, para que nós fôssemos aos gentios, e eles aos circuncisos;
43019023	Description	Havendo pois os soldados crucificado a Jesus, tomaram suas roupas, e fizeram quatro partes, para cada soldado uma parte, e a túnica. E era a túnica sem costura, toda tecida desde cima até baixo .
45002021	Sin	tu, pois, que ensinas ao outro, não ensinas a ti mesmo? Tu que pregas que não se deve furtar, furtas?
46006019	Faith	Ou não sabeis que vosso corpo é templo do Espírito Santo, o qual está em vós, o qual tendes de Deus, e que não sois de vós mesmos?
47005014	Grace	Porque é o amor de Cristo que nos controla; pois temos certeza que, se um morreu por todos, logo todos morreram.
58003001	Faith	Portanto, santos irmãos, participantes do chamado celestial, considerai o Apóstolo e Sumo Sacerdote da nossa declaração de fé, Cristo Jesus.
44020035	Recommendation	Em tudo eu vos tenho mostrado que trabalhando assim, é necessário dar suporte aos enfermos; e lembrar-se das palavras do Senhor Jesus, que disse: Mais bem-aventurado é dar do que receber.
58013004	Recommendation	O matrimônio seja honrado entre todos, e o leito conjugal sem contaminação; mas Deus julgará os pecadores sexuais e os adúlteros.
43020005	Description	E abaixando-se, viu estar os lençóis; entretanto não entrou.
66016018	Description	E houve vozes, e trovões, e relâmpagos; e houve um grande terremoto, o qual nunca tinha acontecido desde que existia a humanidade sobre a terra, de tão forte e tão grande.
66019010	Faith	E eu me lancei aos pés dele para o adorar; mas ele me disse: “Olha, não faças isso ! Eu também sou companheiro de serviço teu, e de teus irmãos, que têm o testemunho de Jesus; adora a Deus; porque o testemunho de Jesus é o espírito da profecia.”
46002010	Grace	Mas Deus as revelou para nós pelo seu Espírito. Porque o Espírito investiga todas as coisas, até as profundezas de Deus.
50002029	Recommendation	Recebei-o, pois, no Senhor, com toda alegria; e honrai ao que são como ele;
51003020	Recommendation	Filhos, obedecei em tudo aos pais, porque isso é agradável ao Senhor.
47001012	Faith	Porque nosso orgulho é este: o testemunho de nossa consciência, que com simplicidade e sinceridade de Deus, não com sabedoria carnal, mas com a graça de Deus, nós nos comportamos no mundo, e especialmente convosco.
43014021	Faith	Quem tem meus mandamentos, e os guarda, esse é o que me ama; e quem a mim me ama, será amado de meu Pai, e eu o amarei, e a ele me manifestarei.
