45012018	Recommendation	Vivam em paz com seus semelhantes, sempre que possível, na medida em que puderem controlar a situação.
58010023	Faith	Devemos continuar professando resolutamente aquilo que cremos. Já que Deus faz fielmente tudo que ele prometeu fazer, devemos esperar confiantes que ele continue fazendo isso.
43014027	Grace	Ao deixar vocês, dou-lhes paz no seu interior. Esta paz interna vem de mim. Não faço com que vocês tenham algo que lhes pudessem dar aqueles que não pertencem a Deus [MTY]. Portanto, deixem de ficar ansiosos/preocupados, e não tenham medo.
47005006	Faith	Portanto, já que o Espírito de Deus vive em nós, sempre temos confiança de que Deus nos dará um corpo novo. Sabemos que, enquanto vivermos no nosso corpo mortal aqui na terra, não estamos vivendo ainda com o Senhor Jesus no céu.
43012047	Grace	Quanto àqueles que ouvem minha mensagem mas não prestam atenção a ela, não sou eu quem os julga. A principal razão da minha vinda ao mundo/do céu não foi eu julgar os habitantes do [MTY] mundo. Pelo contrário, vim salvá-los de serem castigados por seus pecados.
62003012	Sin	Não devemos odiar nossos irmãos crentes como fez Caim, filho de Adão, que pertencia a Satanás, o maligno. Por odiar seu irmão menor, Caim o assassinou. Lembro-lhes/Vocês sabem que, não é [RHQ], por que ele matou o irmão: Foi porque ele costumava comportar-se de forma iníqua e odiava o irmão por este se comportar de forma justa.
66016020	Description	Também, como consequência do terremoto, desapareceram todas as ilhas, e as montanhas se converteram em terra plana.
58011012	Description	Portanto, embora Abraão fosse velho demais para ter filhos, daquele indivíduo descenderam muitas pessoas, tantas em número como as estrelas no céu e tão inúmeras quanto os grãos de areia na praia, bem como Deus lhe prometeu.
54001017	Faith	Meu desejo é que as pessoas honram e louvem para sempre o único verdadeiro Deus! Mesmo que ninguém possa vê-lo, Ele é o Rei que reina para sempre, e que nunca morrerá. É verdade!/Amém!
66014007	Faith	Ele bradou em voz alta: “Reverenciem a Deus e honrem-no, pois chegou a hora de Ele julgar os seres humanos! Adorem a Deus, pois é Ele quem criou o céu, a terra, o mar e as fontes de água”.
44006001	Description	Durante aquele tempo, muitas mais pessoas se tornavam cristãos em Jesus. Alguns desses cristãos vinham de outros países e falavam apenas a língua grega, mas a maioria dos cristãos tinha morado sempre em Israel e falava a língua hebraica. Os que falavam grego começaram a se queixar daqueles que falavam hebraico, dizendo: “Quando vocês cristãos, falantes de hebraico, distribuem comida ou dinheiro às viúvas diariamente, não dão a porção equivalente {não dão uma quantia justa} às viúvas que falam grego”.
60002021	Grace	Deus tem escolhido vocês para que sofram, porque quando Cristo sofreu por vocês ele se tornou exemplo para vocês, para que imitem o que ele fez.
53003010	Recommendation	Ordenamos isto a vocês, pois quando estávamos com vocês, insistíamos muitas vezes que, se algum irmão crente não quisesse trabalhar, vocês não deveriam alimentar/sustentar tal pessoa.
43003016	Grace	Deus nos amou tanto a nós, os habitantes do mundo, que deu seu único Filho como sacrifício por nós, para que todos os que crerem/confiarem nele possam não ficar separados de Deus para sempre. Pelo contrário, eles vão viver para sempre.
44019015	Description	Mas um dia, enquanto eles assim procediam, o Espírito maligno se recusou a sair daquela pessoa. Pelo contrário, o Espírito disse a eles: “Conheço Jesus e sei que Ele autorizou Paulo a expulsar demônios. Mas ninguém autorizou vocês/quem autorizou vocês [RHQ] a procederem assim comigo!?”
66019019	Violence	Depois vi a besta e os reis da terra com seus exércitos reunidos para lutarem contra Cristo, o cavaleiro do cavalo (branco), e contra o exército dele.
44027002	Description	Portanto embarcamos num navio recém-chegado da cidade de Adrimítio na província da Ásia. Esse navio voltaria para lá, com escalas nas cidades litorâneas da província da Ásia. Acompanhava-nos Aristarco, um irmão cristão da cidade de Tessalônica na província da Macedônia.
58013003	Recommendation	Lembrem-se de ajudar aqueles que estão no cárcere por serem cristãos, como se vocês estivessem na cadeia com eles. Lembrem-se daqueles que estão sendo maltratados {a quem as pessoas estão maltratando} por serem crentes. As procederem assim, tenham em mente que vocês também estão vivos [MTY], e bem poderiam sofrer como eles.
51003017	Recommendation	Em tudo que disserem e fizerem, procedam como devem proceder aqueles que são representantes [MTY] do Senhor Jesus, enquanto agradecem constantemente a Deus nosso Pai ao pedirem que o Senhor Jesus apresente suas orações a Deus.
48006006	Recommendation	Vocês a quem está sendo ensinada {a quem outros estão ensinando} a verdade de Deus devem compartilhar suas posses materiais [EUP] com seus mestres.
44007005	Description	Naquela época, Deus não entregou a Abraão nenhuma terra aqui para ocupar e possuir. (OU, Naquela época, Deus não deu a Abraão nenhuma terra aqui, nem o mínimo pedaço desta terra que pertenceria a ele.) Deus prometeu que mais tarde daria esta terra a ele e a seus descendentes, e que ela iria sempre pertencer-lhes. Contudo, naquela época Abraão não tinha filhos que fossem herdá-lo/possui-lo após a morte dele.
44007019	Description	Aquele rei tentou cruelmente destruir nosso povo e oprimiu nossos antepassados, fazendo-os sofrer grandemente. Até mandou que eles abandonassem seus bebês do sexo masculino ao relento para eles morrerem.
43020003	Description	Por isso Pedro e eu partimos em direção à caverna.
44024016	Faith	Por eu esperar confiante aquele dia, procuro sempre fazer aquilo que sei ser agradável a Deus e aceitável às demais pessoas.
65001013	Description	Eles são irrequietos [MET], como as ondas bravas do mar. Justamente como as ondas produzem espuma malcheirosa na praia, esses falsos mestres produzem apenas obras vergonhosas [MTY]. Não podemos depender deles para nos orientar em termos de como devemos viver [MET], bem como não podemos depender dos meteoros/estrelas cadentes para nos mostrar a rota ao viajarmos. A intensa escuridão lhes foi reservada {Deus lhes reservou a intensa escuridão} no inferno.
48001012	Description	Não recebi esta mensagem de um mensageiro humano, e não me foi ensinada {nenhum ser humano me ensinou}. Pelo contrário, Jesus Cristo a revelou a mim.
45007005	Sin	Quando nossa natureza humana, tão pecaminosa/egocêntrica, ainda nos controlava, os desejos que nos conduziam ao pecado estavam ativos em nosso corpo. Estes desejos aumentavam à medida que chegávamos a conhecer a lei de Deus. Como resultado disso, praticávamos atos iníquos que nos separavam de Deus.
54002007	Faith	E Ele me nomeou para declarar esta mensagem e para ser um apóstolo. Eu digo a verdade sobre o fato de Deus me nomear. Não estou mentindo! Ele me designou para ensinar aos não judeus que eles devem crer na verdadeira mensagem de Deus.
62003024	Faith	Se alguém fizer aquilo que Deus o manda fazer, é uma pessoa que faz aquilo que Deus quer que faça, e Deus tem um íntimo relacionamento com ele. Vou lhes dizer como podemos ter certeza de que Deus tem um íntimo relacionamento conosco: é porque temos o Espírito dele, que ele nos concedeu.
46010024	Recommendation	Ninguém deve tentar tirar proveito somente para si mesmo. Pelo contrário, cada indivíduo deve tentar beneficiar a outras pessoas espiritualmente.
45012016	Recommendation	Procurem para os outros o que procuram para si mesmos (OU, Vivam em harmonia uns com os outros)! Não sejam ambiciosos demais, dedicando-se às atividades que os tornarão famosos/orgulhosos! Pelo contrário, fiquem satisfeitos com os deveres humildes (OU, associem-se se a pessoas sem importância.) Não se considerem sábios.
49004031	Recommendation	Não fiquem ressentidos para com os outros. Não se zanguem de nenhuma forma. Não gritem abusivamente para os outros. Não difamem os seus semelhantes. Não ajam nunca de uma forma maliciosa.
51001025	Faith	Eu mesmo me tornei uma pessoa que serve ao povo de Deus, pois fui nomeado {Deus me nomeou} a ser responsável para com vocês que são gentios (não judeus). Eu me tornei uma pessoa que serve ao povo de Deus para divulgar a vocês não judeus a mensagem integral de/sobre Deus.
66001014	Description	O cabelo dele era branco como lã branca ou neve. Os olhos dele brilhavam fortes [SIM] como uma chama de fogo.
47004015	Grace	É por isso que todas estas coisas que estamos (excl) sofrendo servem para ajudar vocês. Nós sofremos tudo isto para que cada vez mais pessoas, como resultado de ouvirem que Deus perdoará bondosamente/livremente os seus pecados, possam lhe agradecer e O louvar. Então elas vão honrá-lo grandemente e adorá-lo.
43006056	Faith	Aqueles que comerem da minha carne e beberem do meu sangue vão ter um íntimo relacionamento comigo, e eu com eles.
43011027	Faith	Ela disse a Ele, “Sim, Senhor! Acredito que o Senhor é o Messias, o Filho de Deus/homem que é também Deus. O Senhor é realmente aquele que Deus prometeu mandar ao mundo”!
44002042	Faith	Eles obedeciam continuamente aquilo que os apóstolos ensinavam, e também se reuniam continuamente com os demais cristãos. Outrossim, eles costumavam tomar juntos as refeições, celebrando a Ceia do Senhor, e oravam juntos continuamente.
58001009	Grace	Você ama as obras retas dos seres humanos e odeia as obras ilegais deles. Por isso eu, seu Deus, faço com que você fique mais feliz [MTY] que qualquer outro”.
44012002	Violence	Ele mandou um soldado cortar a cabeça do apóstolo Tiago, irmão mais velho do apóstolo João.
55002016	Recommendation	Evite aqueles que falam de forma profana e fútil, pois aqueles que falam de maneira tola se tornarão ainda mais impiedosos,
62003015	Sin	Se alguém odiar qualquer dos irmãos crentes, Deus o considera [MET] um assassino. E vocês sabem que Deus não fará com que um assassino viva para sempre.
43021015	Faith	Depois de comermos, Jesus disse a Simão Pedro, “Simão, filho de João , você me ama mais do que estes outros discípulos ?” Pedro respondeu, “Sim, Senhor, você sabe que me é muito querido (OU, que eu o amo)”. Jesus disse, “Dê para aqueles que me pertencem aquilo de que precisam espiritualmente, como [MET] um pastor supre alimento para os seus cordeiros”.
46012008	Grace	A alguns é dada, pelo Espírito {o Espírito dá a alguns}, a habilidade de falar bem, sabiamente. A outros, o mesmo Espírito dá a habilidade de saber as coisas que Ele lhes revela.
44007013	Description	Quando os irmãos de José foram ao Egito pela segunda vez, compraram novamente cereal de José. Mas desta vez eles foram informados {ele os informou} de quem ele era. Outrossim, as pessoas informaram o Faraó de que a família de José era do povo israelita/hebraico e que aqueles homens que tinham vindo de Canaã eram irmãos dele.
60003010	Recommendation	Considere o que o salmista escreveu sobre fazer essas coisas: Quanto àqueles que querem gozar a sua maneira de viver e experimentar coisas boas nas suas vidas todos os dias, não devem falar [MTY] o mal nem falar [MTY] palavras que enganem os outros.
44004032	Description	O grupo daqueles que tinham crido/criam em Jesus era unânime no tocante àquilo que os membros pensavam e desejavam. Nenhum deles alegava possuir exclusivamente os seus pertences. Pelo contrário, eles compartilhavam uns com os outros tudo que possuíam.
46015003	Grace	A parte mais importante da mensagem que recebi do Senhor Jesus, e que lhes comuniquei, foi esta: Cristo morreu para tirar a culpa de nossos pecados, exatamente como as Escrituras vaticinaram que Ele iria fazer.
66018024	Violence	Você é também responsável por ter matado e derramado [MTY] o sangue dos profetas e outros membros do povo de Deus. De fato, você é culpada da morte de todos aqueles que foram mortos {que outras pessoas mataram} na terra!”
44013048	Faith	Enquanto os gentios/não-judeus escutavam aquelas palavras, começaram a regozijar-se, dizendo repetidamente que era maravilhosa a mensagem sobre o Senhor Jesus. E todos aqueles gentios/não-judeus que tinham sido escolhidos por Deus {a quem Deus tinha escolhido} para viverem com Ele eternamente deram fé à/acreditaram na mensagem sobre o Senhor Jesus.
66022020	Description	Jesus, que afirma serem verídicas todas estas coisas, diz: “Com certeza venho/volto em breve!” Eu, João, respondo: “Assim seja! Senhor Jesus, venha já!”
50004009	Recommendation	As coisas que eu ensinei a vocês e que vocês receberam de mim, as coisas que vocês me viram fazer e me ouviram dizer, são essas as coisas que vocês mesmos devem fazer sempre. Como resultado de vocês fazerem estas coisas, Deus, aquele que faz com que tenhamos a paz interior, estará com vocês.
53003015	Recommendation	Não o tratem como inimigo, porém, mas admoestem-no como fariam a qualquer irmão crente.
51002008	Recommendation	Cuidado para que ninguém os torne discípulos dele [MET], ensinando-lhes uma filosofia religiosa falsa e sem valor. Tal filosofia é falsa porque ensina o que pensam simples seres humanos e porque ensina normas elementares que estão preocupados apenas com aquilo que é externo e por que ele ensina algo contrário à verdadeira doutrina sobre Cristo.
50003014	Faith	Pelo contrário, eu me concentro somente em ser cada vez mais semelhante a Cristo durante toda minha vida até o fim. Como resultado, por causa do meu relacionamento com Jesus Cristo Deus vai me chamar/convocar para receber um galardão dele no céu.
56002014	Faith	Foi Ele que se entregou/deu Seu corpo voluntariamente - -para morrer/como sacrifício— por nós, para nos libertar de toda ação pecaminosa! Ele quer que –nós deixemos todo caminho mau/nos purifiquemos— [MET], porque somos mesmo o povo dele. Além disso, Ele quer que nós sejamos um povo que tem um verdadeiro desejo de fazer o que é bom.
43005024	Faith	Escutem agora o seguinte: Aqueles que ouvirem minha mensagem e crerem que foi Deus quem me enviou, têm a vida eterna. Deus não vai condená-los/dizer que vai castigá-los por seus pecados. Eles já não ficarão separados de Deus. Pelo contrário, eles já começaram a viver eternamente.
66021015	Description	O anjo que falava comigo levava na mão uma vara de medir feita de ouro, para medir a cidade, seus portões e sua muralha.
50003019	Sin	Deus vai destruir eles por causa de seu modo de agir. As coisas que seus corpos desejam têm se tornado como deuses para eles. Eles têm orgulho das coisas de que deviam ter vergonha. Pensam somente nas coisas em que pensam os não crentes deste mundo.
54003006	Sin	Não deve ser uma pessoa que tenha confiado recentemente em Jesus, porque se for escolhido tal homem, pode tornar-se presunçoso por ser escolhido tão cedo. Como resultado dessa presunção, Deus o condenará, como condenou o diabo por sua presunção.
65001003	Recommendation	Vocês a quem amo, embora estivesse bem ansioso para escrever-lhes sobre aquilo que todos nós compartilhamos, qual seja―como Deus/Jesus nos salva―, eu me dei conta da necessidade de lhes escrever para exortá-los no sentido de defenderem a verdade sobre Cristo que nós cremos. Essa verdade foi comunicada definitivamente uma vez por Jesus e seus apóstolos {Jesus e seus apóstolos comunicaram essa verdade uma só vez} a nós que pertencemos a Deus, e não devemos deixar que ninguém a altere / modifique.
44004002	Description	Esses homens estavam bem preocupados/zangados, pois os dois apóstolos explicavam que por Deus ter feito com que Jesus se tornasse vivo novamente, esse mesmo Deus faria com que outros mortos voltassem à vida também.
66018005	Sin	É como se os pecados deles fossem acumulados {se acumulassem}, chegando até o céu, e Deus se lembrasse deles [DOU], portanto agora Ele precisa castigá-los [MTY]”.
43004046	Description	Jesus se dirigiu novamente à cidadezinha de Caná no distrito da Galileia. Foi ali que, anteriormente, Ele tinha transformado a água em vinho. Lá estava um dos oficiais do rei, que morava na cidade de Cafarnaum e cujo filho estava muito doente.
45012011	Recommendation	Não sejam preguiçosos, mas pelo contrário sirvam zelosamente a Deus! Permaneçam espiritualmente ferventes! Sirvam ao Senhor!
60001008	Faith	Vocês amam Jesus, mesmo que não o tenham visto. Embora não o vejam agora, vocês se alegram muito [DOU]
62004013	Grace	Vou lhes dizer como é que podemos ter certeza de que temos um íntimo relacionamento com Deus, e que Deus nos faz comportar-nos como ele se comporta: Deus depositou seu Espírito dentro de nós.
43019029	Description	Havia ali uma vasilha de vinho azedo {vinagre}. Por isso alguém molhou nele uma esponja. Então pregou a esponja no caniço de uma planta chamada hissopo e a ergueu até os lábios de Jesus.
51001013	Grace	Deus nosso Pai nos resgatou espiritualmente, portanto o maligno já não nos governa [MET, MTY], e ele nos transferiu espiritualmente para que o Filho, que ele ama, nos governe.
45016017	Recommendation	Meus irmãos crentes, aconselho vocês a terem cuidado dessas pessoas que estão provocando brigas/desavenças entre vocês e fazendo com que as pessoas se afastem de Deus, ensinando coisas contrárias à mensagem sobre Cristo que vocês aprenderam (OU, que outros lhes ensinaram). Evitem tais pessoas!
45012007	Recommendation	Aqueles que Deus capacitou a servir seus semelhantes devem fazer exatamente isso. Aqueles que Deus capacitou a ensinar sua verdade devem fazer assim.
43016023	Faith	Quando isso acontecer, vocês não me farão mais perguntas sobre nada. Escutem bem o seguinte: Depois que isso acontecer, meu Pai vai dar-lhes tudo que pedirem, por causa da íntima relação que Ele tem comigo [MTY].
66021019	Description	Os alicerces da muralha da cidade eram de grande beleza, constituídos de todo tipo de pedras preciosas. A primeira pedra do alicerce era uma pedra cristalina chamada jaspe; a segunda pedra do alicerce era uma pedra azul chamada safira; a terceira pedra do alicerce era uma pedra verde chamada calcedônia/ágata; a quarta pedra do alicerce era uma pedra verde chamada esmeralda;
59004017	Sin	Com certeza, se alguém sabe qual a coisa boa/certa que deve fazer, mas não a faz, ele está pecando.
66019005	Faith	Uma voz [MTY] que procedeu do trono disse: “Todos vocês, servos dele, louvem a nosso Deus! Todos vocês que O cultuam, sejam muito ou pouco importantes do ponto de vista social, louvem a Ele!”
47005002	Faith	Aqui na terra sofremos. Muitas vezes gememos porque desejamos ir ao céu, onde Deus nos dará nosso corpo novo [MET].
48006004	Recommendation	Em vez disso, cada um de vocês deve examinar-se constantemente para ver se pode aprovar aquilo que está fazendo e pensando. Então poderá se orgulhar por causa do que você mesmo está fazendo e pensando, não porque o que você está fazendo é superior àquilo que outras pessoas estão fazendo.
46007036	Recommendation	Alguns de vocês, homens, não sabem o que fazer com suas filhas solteiras. Se algum homem achar que está tratando injustamente sua filha, e se já passou da hora certa para ela se casar, e se ele achar que ela deve casar, então ele deverá proceder como quiser. Deve deixá-la se casar. Ao proceder assim, ele não está pecando.
43016002	Violence	Eles não vão deixar que vocês adorem nas sinagogas. Pelo contrário, virá um dia quando aquele que matar vocês vai achar que, por assim proceder, está prestando um serviço a Deus.
66015001	Description	Aconteceu no céu outra coisa bem incomum. Vi sete anjos, cuja responsabilidade era de punir os (OU: impor sofrimento nos) rebeldescom sete pragas/de sete formas diferentes. Deus está tão zangado com os rebeldes que é esta a última vez que vai castigá-los com propósito de lhes oferecer oportunidade de se arrependerem do seu comportamento pecaminoso.
43018023	Description	Jesus lhe respondeu, “Se eu tivesse dito algo contrário às suas leis, você poderia ter-me dito o que foi exatamente que eu disse que estava errado. Mas, já que eu ensinava apenas coisas certas, —por que você está/você não deve estar— [RHQ] me batendo?”!
50004003	Recommendation	E, meu fiel companheiro, peço que você as ajude a ter outra vez um relacionamento pacífico uma com a outra, porque elas têm proclamado fielmente a boa mensagem sobre Cristo junto comigo ainda que muitos têm se oposto a nós (excl). Elas têm proclamado fielmente a boa mensagem junto com Clemente e os meus outros companheiros de trabalho, cujos nomes estão no livro no qual Deus tem escrito os nomes de todos aqueles que vão viver para sempre/eternamente.
66016006	Sin	Quando os rebeldes mataram teu povo santo e teus profetas, derramaram o sangue deles. Portanto, tu és justo ao castigá-los, dando-lhes sangue de beber. É isso mesmo que eles merecem!”
45006002	Sin	Responderia eu, Não, com certeza não devemos continuar pecando! Não está certo que continuemos a pecar! Devemos considerar-nos incapazes de responder aos desejos pecaminosos, assim como um cadáver não responde nem reage quando algo/alguém tenta estimulá-lo.
66017011	Violence	A besta que viveu antes e depois não estava viva é o oitavo governante. Ele será maligno como os sete governantes, mas Deus vai destruí-lo.
48004030	Recommendation	Mas —são estas as/vocês se lembram das— [RHQ] palavras da Escritura [PRS]: “O filho da mulher que não era escrava herdará o que seu pai possui. O filho da escrava com certeza não herdará aquelas coisas. Portanto, mande embora daqui a escrava e seu filho [MET]!” Isso significa que vocês com certeza devem expulsar dos seus grupos aqueles que insistem em que obedeçamos todas as leis que Deus deu a Moisés [MET].
54006009	Sin	Mas algumas pessoas desejam exageradamente ser ricas. Como resultado, elas fazem coisas erradas para ganhar dinheiro, e isto faz com que fiquem presas [MET], como os animais ficam presos nas armadilhas. Tais pessoas desejam muitas coisas loucamente, e tais desejos as prejudicam seriamente. E Deus vai rejeitá-las totalmente!
66017016	Violence	Os dez chifres que você viu representam governantes [SYM]. Eles e a besta odiarão a cidade [MTY] representada pela prostituta {que a prostituta representa}. Consequentemente, eles tirarão tudo que nela está como se a [MET] deixassem nua. Eles vão destruí-la como se [MET] estivessem devorando carne, e também vão queimá-la com fogo.
46008003	Faith	Mas quanto aos que amam a Deus, é do conhecimento Dele {Ele sabe} que eles pertencem a Ele.
45003009	Sin	Se alguém fosse perguntar, “Devemos concluir que Deus vai nos tratar – a nós judeus – mais favoravelmente, tratando os não judeus com menos favor?”, eu diria que, com certeza, não podemos tirar essa conclusão! Já lhes mostrei que Deus condena todos os seres humanos, tanto judeus como não judeus, pois todos eles pecaram.
44007041	Sin	Por isso, durante aqueles dias, construíram uma imagem de ouro, que parecia um bezerro. Então sacrificaram animais e ofereciam outras coisas para honrar aquele ídolo, cantaram e dançaram para homenagear o ídolo que eles mesmos tinham fabricado.
66009020	Sin	Os demais rebeldes, que não foram mortos pelo fogo e a fumaça e o enxofre ardente {a quem o fogo, a fumaça e o enxofre ardente não mataram} não se arrependeram do seu comportamento pecaminoso. Eles não deixaram de adorar os ídolos feitos com as próprias mãos. Eles não quiseram deixar de cultuar os demônios e ídolos feitos de ouro, prata, bronze, pedra e de madeira, mesmo sendo estes apenas ídolos que nem podem ver, nem ouvir, nem andar.
47005011	Faith	Por isso, pois sinto temor sabendo que o Senhor me julgará de acordo com aquilo que eu tiver feito, faço tudo o possível para convencer as pessoas de que ensino sinceramente (OU: que elas devem acreditar) a verdadeira mensagem de Deus. É bem sabido por Deus {Deus sabe muito bem} como atuo e o que ensino, e creio realmente que vocês também o sabem no seu interior.
49002003	Sin	Antigamente, todos nós costumávamos desobedecer a Deus, como fazem eles. Praticávamos as coisas que nossa natureza egoísta nos mandava praticar. Cometíamos habitualmente os atos iníquos que nosso corpo e nossa mente desejavam. Ao agirmos dessa forma, com certeza Deus iria castigar-nos [MTY], bem como Ele com certeza castigará todas as demais pessoas iníquas.
44002040	Recommendation	Pedro falou muito mais, dirigindo- se com força/confiança a eles. Ele lhes rogou: “Peçam a Deus que Ele os salve {para salvá-los}, para que Ele não os castigue quando vier castigar estas pessoas iníquas/perversas que rejeitaram Jesus”!
45008013	Faith	Se vocês viverem do jeito que a natureza egoísta lhes manda, com certeza não vão viver eternamente (OU, ficarão com certeza separados de Deus). Mas se, pelo poder do Espírito, continuarem evitando a prática das coisas pecaminosas que nossos corpos desejam, vão viver eternamente.
45010011	Faith	Alguém/Isaías escreveu sobre Cristo na Escritura, “Quem quiser acreditar nele não ficará desapontado.”
45001008	Faith	Ao iniciar esta carta, dou graças a Deus por todos vocês, crentes romanos. Posso agradecer-lhe por causa daquilo que Jesus Cristo tem feito por nós. Dou graças a ele, pois o fato de vocês confiarem em Jesus Cristo se tornou assunto de conversa das pessoas por toda parte do Império Romano.
52001004	Faith	Meus irmãos crentes, amados de Deus, agradecemos também a Deus porque sabemos que Deus escolheu vocês para serem um grupo que confia nele,
60004008	Recommendation	Acima de tudo, amem-se de todo coração, porque se amarmos os outros [PRS], ignoraremos muitas das coisas más que fazem para nós.
