44020029	Violence	Sei muito bem que depois da minha partida, entrarão no meio de vocês falsos mestres [MET], causando muito dano aos cristãos. Eles serão como lobos ferozes que matam as ovelhas.
53001004	Faith	Como resultado, continuamos falando de vocês aos demais grupos de crentes que adoram a Deus; especificamente, dizemos a eles que vocês permanecem firmes e que continuam crendo no Senhor Jesus, mesmo sendo frequentemente perseguidos e atribulados por causa da sua fé.
62004012	Faith	Ninguém viu a Deus. Contudo, se nos amamos mutuamente, mostramos que estamos nos comportando como Deus se comporta, e que amamos os outros da forma que Deus deseja que os amemos.
48001001	Description	Eu, Paulo, escrevo esta carta a vocês. Desejo lembrar-lhes que sou um apóstolo. Não é porque um grupo de pessoas me nomeou, nem porque um ser humano me enviou para ser um apóstolo. Pelo contrário, foram Jesus Cristo e Deus nosso Pai celestial, que fez com que Jesus se tornasse novamente vivo após ter morrido, que me nomearam e me enviaram para ser um apóstolo.
58012003	Recommendation	Jesus suportou pacientemente a situação quando os pecadores o trataram com tanta hostilidade. Comparem-se agora com ele, para não abandonarem sua confiança em Deus nem ficarem desanimados.
45006005	Faith	Fomos unidos com Cristo, separando-nos totalmente da nossa antiga forma de vida, assim como ele se separou, ao morrer, da maneira como tinha vivido anteriormente. Mas Deus com certeza vai capacitar-nos a viver de uma nova maneira, assim como ele capacitou Cristo a viver de novo.
45015010	Recommendation	Davi/O salmista escreveu também em outro trecho das Escrituras, “Regozijem-se, vocês não judeus, com o povo de Deus, os judeus.”
54004001	Sin	O Espírito de Deus nos revelou claramente que, nos últimos dias, algumas pessoas deixarão de acreditar na doutrina que todos nós acreditamos. Pelo contrário, elas darão atenção aos espíritos malignos que enganam as pessoas, e darão fé às doutrinas falsas recebidas desses espíritos malignos.
56003001	Recommendation	Relembre os cristãos a se submetam a todos os que os governam ou que têm autoridade sobre eles, e a aos obedeçam. Eles devem estar prontos para fazer qualquer coisa que seja de ajuda.
61003005	Sin	Dirão isso porque se esquecem de propósito do fato que Deus, ao mandar há muito tempo atrás que fosse assim, fez com que os céus existissem e fez a terra subir da água e ser separada da água.
60003018	Grace	Digo assim porque Cristo morreu por causa daqueles que tinham pecado. Ele era o justo que morreu pelos injustos. Morreu para que pudesse levar-nos/vocês a Deus. Quando tinha um corpo comum, foi morto {pessoas o mataram}, mas o Espírito de Deus fez com que ele tornasse a viver.
61002021	Sin	Já que Deus vai puni-los severamente, teria sido melhor eles nunca saberem o que significa agir de maneira justa, do que, depois de saberem como agir justamente, rejeitarem aquelas coisas que Deus manda que as pessoas façam, coisas que foram ensinadas a eles por nós apóstolos/Cristo {que nós apóstolos/Cristo ensinamos/ensinou a eles}.
53003006	Recommendation	Irmãos crentes, pela autoridade que nosso Senhor Jesus Cristo nos deu, mandamos que vocês se separem de qualquer irmão crente que esteja se comportando de forma desordenada – quer dizer, que não se comporta da maneira que vocês aprenderam de nós.
45005012	Sin	Uma das conclusões daquilo que já escrevi é a seguinte: O fato de todos os seres humanos serem pecadores é resultado do pecado de um homem, Adão, há muito tempo; e já que ele morreu por ter pecado, todos os seres humanos experimentam a morte, pois é como se todas as pessoas tivessem pecado quando Adão pecou.
58011033	Faith	Foi por eles confiarem em Deus que alguns deles realizaram grandes proezas em nome dele. Alguns deles conquistaram terras governadas por homens poderosos. Alguns governaram Israel e puniram com justiça aqueles homens e nações que se rebelaram contra Deus. Alguns deles obtiveram de Deus as coisas que ele prometera dar-lhes [MTY]; alguns deles obrigaram os leões a manterem a boca fechada.
47004009	Faith	Com frequência somos perseguidos pelas pessoas {As pessoas muitas vezes nos causam sofrimento}, mas nunca somos abandonados por Deus {Deus nunca nos deixa sozinhos}. Às vezes somos seriamente feridos por elas {elas nos ferem seriamente}, mas Deus não deixa que nos matem.
59004004	Sin	Como uma mulher que é infiel ao seu marido vocês estão sendo infiéis a Deus [MET]. Vocês certamente / Vocês não [RHQ] sabem que aqueles que estão agindo como as pessoas malvadas agem [MTY] (OU, que aqueles que amam os prazeres maus deste mundo) são certamente hostis para com Deus. Por isso, se alguém escolhe agir como as pessoas malvadas fazem [MTY], ele se torna um inimigo de Deus.
44016006	Description	Paulo e seus companheiros desejavam/pretendiam entrar na província de Ásia e pregar lá a mensagem sobre Jesus, mas foram impedidos pelo Espírito Santo {o Espírito Santo os impediu} de ir naquela direção. Por isso eles viajaram pelas províncias de Frígia e Galácia.
45010006	Faith	Mas todos aqueles cujo registro de pecado Deus já apagou como resultado da sua fé em Cristo, podem dizer abertamente como Moisés afirmou, “Vocês não devem dizer no seu íntimo, com atitude crítica, „Alguém terá que subir e entrar no céu!‟” Em outras palavras, alguém terá que subir para trazer Cristo para a terra para nos comunicar a mensagem de salvação!
66016002	Violence	O primeiro anjo saiu e derramou na terra o vinho que estava no [MTY] seu vaso. Como resultado, apareceram horríveis feridas dolorosas nas pessoas a quem os agentes/representantes da besta tinham marcado e que adoravam a imagem dela.
66005008	Description	Quando Ele pegou o pergaminho, os quatro seres viventes e os vinte e quatro anciãos se prostraram diante dele para adorá-lo. Cada um deles tinha uma harpa, e eles tinham também taças de ouro cheias de incenso, que representam as orações do povo de Deus.
62005001	Faith	Todos os que creem que Jesus é o—Messias/homem que Deus mandou para nos resgata—são os que realmente se tornaram filhos de Deus. E é esperado que todos os que amam um homem que é pai amem também os filhos dele. Semelhantemente, se alguém ama a Deus, que o tornou filho dele [MET], deve amar seus irmãos crentes, que Deus também tornou filhos dele.
48005026	Recommendation	Não devemos andar dizendo quão importantes somos. Não devemos considerar-nos mais importantes que os outros. Não devemos ter inveja uns dos outros.
54005001	Recommendation	Não censure os mais velhos. Pelo contrário, exorte-os respeitosamente, como exortaria seu próprio pai. Exorte os mais jovens mansamente, como exortaria seus irmãos.
60002012	Recommendation	Continuem a agir de uma maneira boa entre aqueles que não conhecem Deus. Se fizerem assim, embora eles os acusem dizendo que vocês são maus, verão as coisas boas que fazem e louvarão a Deus na época quando ele vier para julgar as pessoas.
50003006	Sin	Era-me tão importante fazer com que as pessoas obedecessem aquelas leis que fiz coisas más àqueles que creem em Cristo porque pensei que estavam tentando acabar com essas leis. De fato, quanto à minha obediência a essas leis, ninguém poderia ter me acusado dizendo que eu tinha desobedecido essas leis.
43004052	Description	Ele lhes perguntou, “A que horas meu filho começou a melhorar?” Eles lhe disseram, “A febre começou a baixar ontem pela tarde, por volta das 13h00 ”.
43019031	Violence	Foi o dia em que preparavam tudo para o sábado. O dia seguinte seria um sábado especial, pois era o sábado do festival da Páscoa. Os líderes [SYN] judaicos não quiseram que os cadáveres dos três homens permanecessem na cruz durante o sábado, pois seria contrário às suas leis judaicas deixar corpos mortos expostos até o dia seguinte. Portanto, foram ter com Pilatos e pediram que ele mandasse quebrar as pernas dos três homens crucificados {que os soldados quebrassem as pernas dos três homens nas cruzes}, para eles morrerem mais rapidamente. Então poderiam ser tirados e enterrados os cadáveres {alguém poderia tirar e enterrar os cadáveres deles}.
43019012	Description	Por causa disso, Pilatos continuava tentando soltar Jesus. Mas os líderes [SYN] judaicos ameaçavam relatar ao Imperador que Pilatos não estava disposto a punir um homem que se dizia rei; eles continuavam gritando, “Quem alegar ser ele mesmo rei se opõe ao Imperador! Por isso vamos conseguir que o Imperador não considere o senhor mais seu amigo”!
43014001	Faith	Jesus continuou dizendo-nos, “Deixem de ficar ansiosos/preocupados. Continuem confiando em Deus (OU, Vocês estão confiando em Deus); continuem confiando também em mim.
50001028	Faith	E vou saber que vocês não têm nenhum medo daqueles que se opõem a vocês. Isso vai provar/mostrar a essas pessoas que Deus vai destruí-las, mas vai mostrar/provar a vocês que Deus vai salvar vocês eternamente. É Deus que está fazendo tudo isso.
43015016	Grace	Vocês não resolveram tornar-se meus discípulos. Pelo contrário, fui eu que escolhi vocês, para que pudessem fazer muitas coisas agradáveis a Ele [MET]. O resultado das suas ações vai durar para sempre. Também escolhi vocês para que meu Pai faça por vocês tudo que vocês pedirem para Ele fazer pois vocês me pertencem/na minha autoridade [MTY].
58011004	Faith	Foi por Abel, filho de Adão, confiar em Deus que ele sacrificou a Deus algo melhor que aquilo que seu irmão mais velho, Caim, tinha oferecido a Deus. Por Abel ter feito isso, quando Deus falou bem daquilo que Abel sacrificou, Deus declarou que Abel era justo. Embora Abel já esteja morto, continuamos aprendendo com ele como se confia em Deus.
46004001	Recommendation	Portanto, as pessoas devem nos considerar, a nós apóstolos (OU, a Apolo e eu), como sendo apenas servos de Cristo. Deus nos (excl) tem confiado o labor de comunicar aos outros a mensagem que Ele, agora, nos tem revelado.
66006013	Description	Muitíssimas estrelas caíram para a terra, como [SIM] caem os figos verdes quando uma figueira é sacudida por um vento forte {quando um vento forte sacode uma figueira}.
46010014	Recommendation	Portanto, eu digo a vocês, meus amigos a quem amo, fujam da adoração de ídolos, como fugiriam de qualquer elemento perigoso.
45012021	Recommendation	Não deixem que os atos malévolos praticados por outrem derrotem vocês, levando-os a retribuir a maldade! Pelo contrário, derrotem as más obras deles, retribuindo-lhes boas obras!
55002014	Recommendation	Lembre aos crentes, que vão ensinar outros, destas coisas que eu disse a você, advertindo-os solenemente diante de Deus (OU, que Deus vai julgá-los por qualquer maldade que fizerem, portanto) para que não briguem por causa de palavras, pois quando mestres brigam não conseguem nada de bom senão destroem espiritualmente (OU, fazem com que os seus ouvintes abandonem seu compromisso com Cristo).
59004008	Recommendation	Aproximem-se de Deus espiritualmente, e como resultado disso Ele se aproximará de vocês. Vocês, que são pecadores, parem de fazer o mal e façam somente o bem [SYN, MET]. Vocês que não podem decidir se vocês se dedicarão a Deus, parem de pensar erradamente e tenham somente pensamentos puros [MTY].
59002009	Sin	Mas se, por outro lado, vocês honram a alguns mais do que a outros, estão fazendo o que é mal/pecando. Porque vocês não têm feito o que Deus nos mandou fazer, vocês são condenados por Ele {Ele os condena} [PRS], pois vocês são pessoas que desobedecem a Sua lei.
52004007	Grace	Deus deseja isso, pois ele não chamou a nós crentes para sermos povo de comportamento sexualmente impuro. Pelo contrário, ele nos chamou para sermos um povo distinto, que se comporta de uma forma moralmente pura.
45001018	Sin	De onde ele reina no céu, Deus esclarece a todos os não judeus ímpios e iníquos que está zangado com eles e que eles merecem o castigo dele. Por meio do seu comportamento tão ruim, eles suprimem o que sabem ser certo acerca de Deus.
62004007	Faith	Meus caros amigos, amemos-nos uns aos outros, pois Deus nos capacita a nos amar mutuamente; portanto, se alguém ama seus irmãos crentes, já se tornou filho de Deus e— conhece a/tem um íntimo relacionamento com—Deus.
62002009	Sin	Se alguém afirma ser moralmente puro, como quem [MET] vive na luz, e se ao mesmo tempo odeia qualquer dos seus irmãos crentes, ele continua comportando-se de uma forma moralmente impura/pecaminosa, como [MET] alguém que vive continuamente na escuridão.
60004014	Grace	Se forem insultados pelas pessoas {Se as pessoas insultarem vocês} porque vocês creem em Cristo [MTY], Deus ficará contente por vocês, porque isso mostrem que o Espírito de Deus, o Espírito que mostra como Deus é grande, vive dentro de vocês.
44021019	Grace	Paulo os saudou e depois relatou cada uma das coisas que Deus o tinha capacitado a fazer entre os gentios/não judeus.
43008046	Sin	Já que nunca pequei, nenhum de vocês/será que algum de vocês [RHQ] pode provar que pequei!? Portanto, já que lhes digo a verdade, não há motivo para/por que [RHQ] vocês não me acreditarem/acreditam!?
58010017	Grace	Depois ele disse: Vou perdoar-lhes os seus [DOU] pecados, e julgarei que eles já não são culpados por terem pecado.
46001005	Grace	Em outras palavras, vocês têm sido ajudados abundantemente [HYP], em termos espirituais, por Deus {Deus tem ajudado vocês, espiritualmente, de forma abundante [HYP]} por causa de vocês terem um íntimo relacionamento/estarem unidos com Cristo. Mais especificamente, Deus tem capacitado vocês abundantemente [HYP] a comunicarem mensagens que o Espírito Dele lhes revelou, e Ele tem capacitado vocês abundantemente a saberem muitas coisas [HYP] que o Espírito Dele lhes revelou.
45015030	Recommendation	Já que pertencemos a nosso Senhor Jesus Cristo, e já que o Espírito de Deus nos faz amar-nos uns aos outros, rogo a vocês todos que me acompanhem em intensa/fervorosa oração a Deus em meu favor.
43007020	Violence	Alguns membros da multidão responderam, “Falando assim, você dá provas de que é maluco (OU, um demônio está controlando você)! Com certeza, ninguém está tentando matá-lo”!
45003025	Grace	Deus o apresentou como aquele que iria expiar (OU, perdoar) nossos pecados, derramando seu sangue na cruz. Deus nos redime/perdoa por confiarmos naquilo que Cristo fez por nós. Deus assim fez para mostrar que ele age de forma justa e reta, pois antes de Cristo morrer as pessoas não sabiam se Deus castigava de forma justa, ou não, todos aqueles que pecavam. Durante aquele tempo Deus fazia vista grossa aos pecados deles
43018018	Description	Fazia frio, e por isso os escravos do sumo sacerdote e os guardas do templo tinham preparado uma fogueira de carvão e se aqueciam de pé, reunidos em volta dela. Pedro também se instalou lá, para se aquecer.
49006011	Recommendation	Assim como um soldado veste toda(s) a(s) armadura/coisas que o ajudam a lutar, vocês devem utilizar todos os recursos espirituais que Deus lhes proporciona, para resistir com êxito ao diabo quando este tenta astutamente opor-se a vocês.
43013037	Faith	Pedro disse, “Senhor, por que não posso acompanhá-lo agora? Estou pronto para morrer pelo Senhor”!
50004007	Faith	Como resultado, Deus ajudará vocês a não se preocuparem com nada (ou, Deus protegerá suas mentes) por completo. Isto é, Ele vai fazer com que vocês tenham paz interior porque vocês têm um relacionamento com Jesus Cristo. Vocês nem vão poder entender como é que podem sentir tanta paz em situações tão difíceis!
59003009	Faith	Com a nossa língua nós falamos bem a/sobre Deus que é nosso Senhor e nosso Pai, mas com a mesma língua nós pedimos a Deus que faça mal às pessoas, mesmo que Deus as tenha criado à Sua própria semelhança.
46005010	Sin	Eu não quis dizer, com isso, que não tivessem nada a ver com incrédulos imorais, ou cobiçosos dos bens dos outros, ou ladrões violentos que se apoderam das posses de outros, ou trapaceiros, ou adoradores de ídolos. Vocês teriam que sair deste mundo para evitar todas as pessoas desse tipo!
44026009	Sin	Antigamente eu também tinha certeza de que deveria fazer o máximo possível em oposição a Jesus [MTY], o homem da cidadezinha de Nazaré.
61002014	Sin	Querem cometer [MTY] adultério com cada mulher que olham e nunca deixam de procurar oportunidades de pecar. Seduzem aqueles que são espiritualmente instáveis a se unirem com eles. São pessoas que Deus amaldiçoará porque cada vez mais querem coisas.
43010012	Description	Um empregado contratado para cuidar das ovelhas não é o pastor, o dono das ovelhas. Portanto, quando ele vê um lobo se aproximar, ele abandona as ovelhas e foge. Então o lobo ataca o rebanho de ovelhas, pega uma das ovelhas e faz as outras se espalharem.
59001019	Recommendation	Meus companheiros cristãos, a quem eu amo, vocês sabem (OU, quero que vocês saibam) que cada um de vocês deve prestar atenção com avidez à mensagem verdadeira de Deus, e não deve falar os seus próprios pensamentos sem antes refletir, nem ficar com raiva precipitadamente,
46009014	Recommendation	Portanto, o Senhor manda que aqueles que proclamam a boa mensagem sobre Ele recebam, daqueles que ouvem tal mensagem, tudo que precisarem para a vida.
43012046	Grace	Vim ao mundo para mostrar a verdade de Deus às pessoas, como uma luz mostra às pessoas o que está ao redor delas. Vim para que as pessoas que creem em mim não permaneçam ignorantes da verdade de Deus [MET], como aqueles que estão na escuridão ignoram o que está ao redor deles.
43005014	Description	Mais tarde, Jesus viu o homem quando estavam no pátio do templo. Ele disse seu nome ao homem, e também lhe disse, “Escute! Você é curado! Portanto, deixe de pecar! Se não deixar de pecar, vai lhe acontecer algo pior que a doença que antes tinha”!
46016014	Recommendation	Tudo quanto fizerem, façam com amor.
43014015	Recommendation	Se vocês me amam, vão fazer o que eu lhes mandei fazer.
58012025	Recommendation	Cuidado para não recusarem escutar a voz de Deus, que lhes fala. Os israelitas não foram excluídos do castigo de Deus quando Moisés (OU, Deus) os advertiu aqui na terra. Portanto,— nós com certeza não seremos excluídos do castigo de Deus se o rejeitarmos quando ele nos advertir do céu!/ como escaparemos do castigo de Deus se o rejeitarmos quando ele nos advertir do céu?—[RHQ]
48004008	Sin	Quando vocês não tinham ainda um relacionamento com Deus, serviam a deuses que realmente não existiam [MET], justamente como os escravos servem aos seus patrões [MET].
44003026	Grace	Pedro concluiu: “Portanto, quando Deus enviou à terra Jesus, aquele que sempre lhe obedece, Ele o mandou inicialmente a vocês, israelitas, para abençoá-los. Deus ajudará cada um de vocês, capacitando-os a deixar de praticar o mal/a iniquidade e passarem a fazer aquilo que agrada a Ele”.
44010039	Violence	”Nós (excl) apóstolos informamos as pessoas de todas as coisas que vimos Jesus fazer em Jerusalém e no resto de Israel. Os líderes em Jerusalém O mataram, pregando-O numa cruz.
46001010	Recommendation	Meus irmãos cristãos, com a autoridade do [MTY] nosso Senhor Jesus Cristo eu peço, encarecidamente, a todos vocês que estejam de acordo entre si. Em outras palavras, parem de ficar divididos em grupinhos. Pelo contrário, estejam unidos [MET] na interpretação dos assuntos espirituais, e estejam unidos, também, nas suas decisões.
51001021	Sin	Quanto a vocês, embora antigamente Deus os considerasse inimigos dele (OU, Deus considerasse vocês como estando afastados dele) e mesmo que vocês fossem antigamente hostis a Deus, pensando coisas ruins e agindo de forma iníqua,
55002022	Recommendation	Por isso, você deve evitar a prática das coisas erradas que alguns jovens gostam de fazer; mas deseje ardentemente fazer as coisas certas, acredite nas doutrinas verdadeiras, ame a Deus e aos outros, e fique sempre em paz com aqueles que pedem a ajuda do Senhor e são puros por dentro (OU, que servem fielmente a Jesus).
51003001	Faith	Vocês estão espiritualmente vivos agora e é como se tivessem sido ressuscitados {Deus os tivesse tornado vivos} quando ele fez com que Cristo vivesse de novo. Portanto, desejem constantemente as coisas relacionadas ao céu [MTY], onde mora Cristo. Lá Deus lhe concedeu suprema autoridade e honra.
66008007	Violence	Quando o primeiro anjo tocou sua trombeta, foi derramados {caíram} sobre a terra fogo e uma chuva de pedras misturada com sangue. Como resultado, um terço de tudo sobre a superfície da terra foi queimado {o fogo queimou uma terça parte de tudo sobre a superfície da terra}. Um terço das árvores foi queimado {Queimou um terço das árvores} e uma terça parte de toda a erva verde.
66011017	Faith	Eles disseram: “Senhor Deus, tu és o todo-poderoso, aquele que existe e sempre existiu. Nós te agradecemos teres derrotado com teu poder todos os que se rebelam contra ti, pois agora governas todos os povos do mundo.
43004010	Grace	Jesus respondeu a ela, “Se você soubesse o que Deus quer lhe dar, e se soubesse quem sou Eu, aquele que lhe pede um gole de água, você teria pedido a mim, e eu lhe teria dado da água que sustenta a vida”.
51003004	Grace	Quando Cristo se revelar publicamente {Deus revelar Cristo publicamente}, aquele que faz com que vocês/nós vivam(os) espiritualmente, vocês também serão revelados {Deus revelará vocês também} publicamente, em companhia de Cristo, e vocês-junto com Cristo-serão gloriosos.
43020031	Faith	Mas aqueles sobre os quais escrevi, foram narrados {eu escrevi sobre eles} para que vocês possam crer que Jesus é o Messias, o filho de Deus/homem que é também Deus, e para que possam viver para sempre por crerem nele/naquilo que Ele tem feito por vocês [MTY].
62004006	Faith	Quanto a nós (excl), já que pertencemos a Deus, quem—conhece a/tem um íntimo relacionamento com—Deus nos escuta. Mas se alguém não pertence a Deus, ele não nos escuta. É assim que discernimos se as coisas que as pessoas ensinam [MTY] são verdadeiras ou se esses indivíduos estão apenas enganando as pessoas.
65001012	Description	Tais falsos mestres são tão perigosos para vocês como [MET] são as pedras escondidas de um recife para um barco. Quando vocês participam coletivamente das refeições que promovem o amor e comunhão cristãos, eles farreiam ousadamente/desavergonhadamente, cuidando somente de si mesmos e não se importando com os outros. Por deixarem de fazer quaisquer coisas em apoio dos seus semelhantes [MET], eles são tão inúteis como nuvens impelidas pelo vento {que o vento impele}, mas que não produzem nenhuma chuva. Eles são tão frustrantes como [MET] árvores que não produzem nenhum fruto no outono, como devem. Eles não são apenas mortos [MET] espiritualmente, como incapazes de fazer com que os outros vivam espiritualmente, bem como [MET] árvores que foram arrancadas {que alguém arrancou}, e como resultado são incapazes de produzir nenhum fruto.
44005015	Description	Os apóstolos operavam milagres surpreendentes e, por isso, as pessoas costumavam carregar os doentes para a rua e deitá-los em macas e esteiras, para que Pedro, ao passar por ali, pudesse tocá-los ou que pelo menos a sombra dele fosse tocar alguns deles, curando-os.
49006016	Faith	Além disso, continuem confiando firmemente no Senhor. Isso vai capacitá-los a se proteger contra tudo que Satanás, o maligno, puder fazer para os prejudicar espiritualmente, assim como um soldado leva um escudo para se proteger contra as flechas de pontas ardentes que os inimigos lhe disparam [MET].
51003023	Recommendation	Seja qual for seu trabalho, façam-no de todo coração. Trabalhem de todo coração como aqueles que estão trabalhando para o Senhor Jesus, não como aqueles que trabalham apenas para os homens,
58012016	Recommendation	Que ninguém seja imoral, nem ímpio como Esaú. Ele trocou os direitos da sua primogenitura por uma só refeição.
43018040	Sin	Eles gritaram de novo, “Não, não solte esse homem! Em vez dele, solte Barrabás”! Mas Barrabás estava preso por ser revolucionário/terrorista!
55003004	Sin	Vão trair outras pessoas, e vão agir tolamente. Vão ter excessivo orgulho de si mesmas; e amarão a si mesmas ao invés de amarem a Deus.
50002009	Grace	Como resultado, Deus o elevou/levantou a uma posição no céu que é mais alta do que qualquer outra posição. Isto é, Deus deu a ele uma posição que é acima de todas as outras posições.
61001016	Description	Nós apóstolos contamos a vocês que nosso Senhor Jesus Cristo age poderosamente e que ele voltará. Não nos baseamos no que contamos a vocês em histórias que tinham sido inventadas por pessoas/nós {que pessoas/nós tinham/tínhamos inventado}. Pelo contrário, contamos a vocês o que nós mesmos vimos com os próprios olhos, que nosso (inc) Senhor Jesus Cristo é sumamente grande.
61003016	Sin	Nas cartas que Paulo escreveu há certas coisas que são difíceis para as pessoas entenderem. Os que são ignorantes espiritualmente e instáveis explicam/interpretam estas coisas falsamente, como também interpretam falsamente as outras Escrituras. O resultado é que eles destruirão a si mesmos, e Deus vai castigá-los.
44014014	Description	Mas quando os apóstolos, Barnabé e Paulo, ouviram disso e entenderam que as pessoas os consideravam deuses e desejavam sacrificar os bois em culto de louvor a eles, ficaram muito aflitos e rasgaram as roupas. Foram correndo para dentro da multidão, gritando:
