60003010	Recommendation	Recuerden: “Los que quieren amar sus vidas y ver días felices, deben abstenerse de hablar el mal, y no decir mentiras.
44004032	Description	Todos los creyentes tenían un mismo pensar y un mismo sentir. Ninguno de ellos consideraba nada como suyo sino que compartían todas las cosas unos con otros.
46015003	Grace	Yo les di lo que yo mismo también recibí, un mensaje de vital importancia: que Cristo murió por nuestros pecados, conforme dice la Escritura;
66018024	Violence	En ella se encontró la sangre de los profetas y creyentes que habían muerto en la tierra.”
44013048	Faith	Cuando los extranjeros escucharon esto, se alegraron en gran manera, alabando la palabra del Señor, y todos los elegidos para la vida eterna creyeron en Dios.
66022020	Description	Aquél que confirma todo esto dice: “Sí, yo vengo pronto.” Amén, ven, Señor Jesús.
50004009	Recommendation	Practiquen lo que han aprendido y lo que han recibido de mí, así como lo que me vieron hacer y decir. Entonces el Dios de paz estará con ustedes.
53003015	Recommendation	No los consideren como enemigos, sino háganles la advertencia como quien habla con un hermano y hermana.
51002008	Recommendation	Cuídense de que nadie los esclavice con sus filosofías y engaños vanos, siguiendo las tradiciones humanas y conceptos de este mundo, ni dejen de seguir a Cristo.
50003014	Faith	Corro hacia la meta para ganar el premio de la invitación de Dios al cielo por medio de Cristo Jesús.
56002014	Faith	Pues él se entregó a sí mismo por nosotros, para podernos libertar de toda nuestra maldad, y para limpiarnos para él, como un pueblo que le pertenece, y que está dispuesto a hacer el bien.
43005024	Faith	Les digo la verdad: aquellos que siguen lo que yo digo y creen en Aquél que me envió, tienen vida eterna. Ellos no serán condenados, sino que habrán pasado de la muerte a la vida.
66021015	Description	El ángel que me habló tenía una vara de medir para medir la ciudad, sus puertas, y su muro.
50003019	Sin	Ellos terminarán completamente perdidos, pues estas personas tienen como “dios” sus propios deseos físicos y están orgullosos de cosas que deberían avergonzarles, pues piensan solo en las cosas de este mundo.
54003006	Sin	No debe ser un creyente nuevo, pues en caso de volverse ególatra caerá bajo la misma condenación del diablo.
65001003	Recommendation	Amigos, desde antes ya anhelaba la oportunidad de escribirles acerca de la salvación de la cual somos partícipes. Pero ahora necesito escribirles urgentemente y animarlos a defender enérgicamente la verdad acerca de Dios, que fue dada una vez y para siempre al pueblo santo de Dios.
44004002	Description	Estaban enojados porque ellos estaban enseñándole a la gente, diciéndoles que por medio de Jesús hay resurrección de la muerte.
66018005	Sin	Sus pecados se han acumulado hasta llegar al cielo, y Dios no olvida su maldad.
43004046	Description	Él visitó nuevamente Caná de Galilea, donde había convertido el agua en vino. Cerca, en la ciudad de Capernaúm, vivía un oficial del rey cuyo hijo estaba muy enfermo.
45012011	Recommendation	No sean perezosos para el trabajo arduo; sirvan al Señor con un espíritu entusiasta.
60001008	Faith	Ustedes lo aman aunque nunca lo han visto. Aunque no pueden verlo ahora, creen en él y están llenos de una felicidad maravillosa e indescriptible.
62004013	Grace	¿Cómo podemos saber que él vive en nosotros? En que nos ha dado el poder de amar por su Espíritu.
43019029	Description	Y allí había una tinaja llena de vinagre de vino; así que ellos mojaron una esponja en el vinagre, la pusieron en una vara de hisopo, y la acercaron a sus labios.
51001013	Grace	Él nos rescató de la tiranía de las tinieblas y nos trajo al reino de su Hijo amado,
45016017	Recommendation	Ahora les ruego, mis hermanos creyentes: cuídense de los que causan discusiones y confunden a las personas de la enseñanza que han aprendido. ¡Aléjense de ellos!
45012007	Recommendation	Si se trata del ministerio del servicio, entonces debes servir; si se trata de enseñar, debes enseñar;
43016023	Faith	“Cuando llegue el momento, no tendrán necesidad de preguntarme nada. Les digo la verdad, el Padre les dará cualquier cosa que pidan en mi nombre.
66021019	Description	Los fundamentos del muro de la ciudad estaban decorados con todo tipo de piedras preciosas. El primero era de jaspe, el segundo de zafiro, el tercero de calcedonia, el cuarto de esmeralda,
59004017	Sin	Porque es pecado si sabes hacer lo bueno y no lo haces.
66019005	Faith	Y se escuchó una voz que provenía desde el trono, y dijo: “Alaben a nuestro Dios, todos los que le sirven y lo respetan, desde el más pequeño hasta el más grande.”
47005002	Faith	Suspiramos en nuestro anhelo por esto, deseando con ansias ser vestidos de este nuevo hogar celestial.
48006004	Recommendation	Examinen cuidadosamente sus acciones. Así podrán estar satisfechos de ustedes mismos, sin compararse con nadie más.
46007036	Recommendation	Pero si un hombre piensa que se está comportando de manera inapropiada con la mujer que está comprometido, y si piensa que podría ceder ante sus deseos sexuales, y cree que debe casarse, no será pecado si se casa.
43016002	Violence	Ellos los expulsarán de las sinagogas—de hecho, viene el tiempo en que las personas que los maten, pensarán que están sirviendo a Dios.
66015001	Description	Entonces vi en el cielo otra señal asombrosa y de gran importancia: Siete ángeles sostenían las últimas siete plagas que completan el juicio de Dios.
43018023	Description	Jesús respondió: “Si he dicho algo malo, díganle a todos qué fue lo que dije. Pero si lo que dije estuvo bien, ¿por qué me golpeaste?”
50004003	Recommendation	De hecho, le pido a mi compañero de trabajo, que ayude a estas mujeres, pues ellas trabajaron conmigo en la predicación de la buena noticia, así como Clemente y mis demás compañeros, cuyos nombres están escritos en el libro de la vida.
66016006	Sin	Estas personas derramaron la sangre de los creyentes. ¡Y ahora les das a beber sangre, como lo merecen!”
45006002	Sin	¡Por supuesto que no! Pues si estamos muertos al pecado, ¿cómo podríamos seguir viviendo en pecado?
66017011	Violence	La bestia que era, y no es, es un octavo rey y pertenece a los siete. Él también será destruido por completo.
48004030	Recommendation	Pero ¿qué dice la Escritura? “Despidan a la sierva y a su hijo, porque el hijo de la sierva no será heredero junto al hijo de la mujer libre.”
54006009	Sin	Aquellos que están determinados para volverse ricos, caen en la trampa de la tentación, siguiendo muchos impulsos necios y destructivos.
66017016	Violence	Los diez cuernos que viste y la bestia odiarán a la prostituta, y le quitarán todas sus posesiones, y la dejarán desnuda, comerán su carne y la quemarán hasta que quede en cenizas.
46008003	Faith	Pero todo el que ama a Dios es conocido por él…
45003009	Sin	Entonces, ¿son los judíos mejores que los demás? ¡Ciertamente no! Recordemos que ya hemos demostrado que tanto judíos como extranjeros estamos bajo el control del pecado.
44007041	Sin	Entonces elaboraron un ídolo en forma de becerro, le presentaban sacrificios, y celebraban lo que ellos mismos habían hecho.
66009020	Sin	Pero el resto de la humanidad que no murió por estas plagas no se arrepintió de lo que estaba haciendo. No dejaron de adorar demonios ni ídolos de oro, plata, bronce y piedra, que no pueden oír ni caminar.
47005011	Faith	Sabiendo lo que es el temor al Señor, tratamos de convencer a otros. Para Dios es claro lo que somos, y espero que esté claro en sus mentes también.
49002003	Sin	Todos una vez fuimos así, y nuestra conducta estaba determinada por los deseos de nuestra naturaleza humana pecaminosa y nuestros malos pensamientos. Como todos los demás, en nuestra naturaleza éramos hijos de la ira.
44002040	Recommendation	Luego Pedro siguió hablando, dándoles más evidencias. Les advirtió: “Sálvense de esta generación perversa.”
45008013	Faith	Porque si ustedes viven bajo el control de su naturaleza pecaminosa, van a morir. Pero si siguen el camino del Espíritu, dando muerte a las cosas malas que hacen, entonces vivirán.
45010011	Faith	Como dice la Escritura: “Los que creen en él no serán frustrados.”
45001008	Faith	Permítanme comenzar diciendo que agradezco a mi Dios por medio de Jesucristo por todos ustedes, porque en todo el mundo se habla acerca de la forma en que ustedes creen en Dios.
52001004	Faith	Hermanos y hermanas, ya sabemos que Dios los ama y que ustedes son muy especiales para él.
60004008	Recommendation	Por encima de todo, ámense unos a otros con amor profundo, porque el amor cubre muchas de las faltas que la gente comete.
44027001	Description	Cuando llegó nuestro momento de zarpar a Italia, Pablo y algunos otros prisioneros fueron entregados a un centurión llamado Julio, que pertenecía al Régimen Imperial.
66015003	Faith	y cantaban el cántico de Moisés, el siervo de Dios, y el cántico del Cordero: “Lo que has hecho es extraordinario y maravilloso, Oh Señor Dios, El Todopoderoso. Tus caminos son justos y verdaderos, Rey de las naciones.
60002002	Faith	Deben volverse como bebés recién nacidos que solo quieren leche espiritual pura, para que puedan crecer en la salvación
66014013	Faith	Entonces oí una voz que procedía del cielo, que me decía: “¡Escribe esto! Benditos son los que mueren en el Señor a partir de ahora. Sí, dice el Espíritu, porque ahora ellos pueden descansar de sus aflicciones. Y lo que han logrado hablará por ellos.
59001027	Faith	Ante los ojos de nuestro Dios y Padre, la religión pura y genuina consiste en visitar huérfanos y viudas que sufren, y guardarse de la contaminación del mundo.
51002004	Recommendation	Les digo esto para que ninguno los engañe con cuentos.
66005013	Description	Entonces oí a cada criatura en el cielo, en la tierra y debajo de la tierra, y en el mar—todas las criaturas, en todas partes—respondían: “Bendito Aquél que está sentado en el trono, y el Cordero, a ellos sea la honra, la gloria y la autoridad, por siempre y para siempre.”
66008008	Description	Y el segundo ángel hizo sonar su trompeta. Y sucedió que algo semejante a una gran montaña de fuego ardiente fue lanzada al mar. Y una tercera parte del mar se convirtió en sangre,
44007058	Violence	lo llevaron a rastras fuera de la ciudad, y comenzaron a apedrearlo. Sus acusadores pusieron sus abrigos junto a un joven llamado Saulo.
45015011	Faith	Y una vez más, dice: “Todos ustedes, extranjeros, alaben al Señor, que todos los pueblos le alaben.”
45011036	Faith	Todo proviene de él, todo existe por medio de él, y todo es para él. ¡Gloria a Dios para siempre, amén!
43001029	Faith	Al día siguiente, Juan vio que Jesús se acercaba a él, y dijo: “¡Miren, el Cordero de Dios que quita el pecado del mundo!
58011031	Description	Por fe en Dios, Rahab, la prostituta, no murió junto a los que rechazaban a Dios, porque había recibido a los espías israelitas en paz.
43010010	Grace	El ladrón solo viene a robar, matar y destruir. Yo he venido para traerles vida, una vida abundante.
50003020	Faith	Pero nuestra patria es el cielo, y esperamos un salvador, al Señor Jesucristo, que también vendrá de ella.
45015007	Recommendation	Así que acéptense unos a otros, así como Cristo los aceptó a ustedes, y denle la gloria a Dios.
44021024	Recommendation	Ve con ellos y haz los rituales de purificación con ellos, pagándoles para que les afeiten sus cabezas. De este modo todos sabrán que los rumores que han escuchado acerca de ti no son ciertos, sino que tú mismo guardas la Ley en tu forma de vivir.
45004012	Faith	También es el padre de los judíos circuncidados, no solo porque estén circuncidados, sino porque siguen el ejemplo de la confianza en Dios que nuestro padre Abraham tuvo antes de ser circuncidado.
44001026	Description	Entonces echaron suertes, y fue elegido Matías. Y fue contado como apóstol junto a los otros doce.
45004007	Grace	“Cuán felices son los que reciben perdón por sus errores y cuyos pecados son cubiertos.
66011004	Description	Ellos son los dos árboles de olivo y los dos candelabros que están frente al Señor de la tierra.
59004009	Recommendation	Muestren algo de remordimiento, lloren y laméntense. Cambien su risa por lamento, y su alegría por tristeza.
64001011	Recommendation	Amigo mío, no imites el mal, sino el bien. Los que hacen el bien le pertenecen a Dios; los que hacen el mal no lo conocen.
45004011	Faith	De hecho, fue antes de que Abraham fuera judío por ser circuncidado, lo cual era una confirmación de su confianza en Dios para hacerlo justo. Esto ocurrió antes de ser circuncidado, de modo que él es el padre de todos los que confían en Dios y son considerados justos por él, aunque no sean judíos circuncidados.
45006007	Grace	Todo el que ha muerto, ha sido liberado del pecado.
47004010	Faith	En nuestros cuerpos siempre participamos de la muerte de Jesús, para así también poder demostrar la vida de Jesús en nuestros cuerpos.
50002021	Sin	Otras personas solo se preocupan por sus propios intereses y no los de Jesucristo.
58011011	Faith	Por su fe en Dios, incluso la misma Sara pudo concebir un hijo aunque fuera muy vieja para hacerlo, pues creyó en Dios, que había hecho la promesa.
43006039	Grace	Lo que Él quiere es que yo no deje perder a ninguno de los que me ha dado, sino que los levante en el día final.
46008006	Faith	Pero para nosotros solo hay un Dios, el Padre, a partir del cual fueron hechas todas las cosas, y él es el propósito de nuestra existencia; y un Señor, Jesús, por medio de quien todas las cosas fueron hechas, y él es el mediador de nuestra existencia.
52003006	Description	Ahora Timoteo ha vuelto después de haberlos visitado, y nos ha traído buenas noticias sobre su fe en Dios y el amor que tienen. Nos ha dicho que aún tienen recuerdos gratos de nosotros, y que anhelan vernos así como nosotros deseamos verlos a ustedes.
60005004	Grace	Cuando aparezca el Pastor supremo, ustedes recibirán una corona de gloria, que nunca se dañará.
47003012	Faith	¡Y como tenemos esta esperanza segura, hablamos sin temor!
61002012	Sin	Estas personas son como bestias sin razón, que nacen para ser capturadas y destruidas. Condenan cosas que no conocen, y serán destruidos como animales.
43012006	Sin	Él no decía esto porque le interesaran los pobres, sino porque era un ladrón. Él era quien administraba el dinero de los discípulos y a menudo tomaba de ese dinero para sí mismo.
62004016	Faith	Hemos experimentado y creído en el amor que Dios tiene por nosotros. Dios es amor, y los que viven en amor, viven en Dios, y Dios en ellos.
44011019	Description	Sucedió que los que habían quedado esparcidos por causa de la persecución que ocurrió cuando Esteban fue asesinado, viajaron hasta Fenicia, Chipre y Antioquía. Y solo predicaban la buena noticia entre los judíos.
54006006	Faith	¡Pero conocer y seguir a Dios es tan satisfactorio!
66013007	Violence	Entonces a la bestia se le dio poder de atacar a los creyentes y vencerlos, y también se le dio autoridad sobre todos los pueblos, tribus, lenguas y naciones.
60002020	Faith	Sin embargo, no hay crédito si eres castigado por hacer el mal. Pero si sufres por hacer lo recto, y lo soportas, entonces la gracia de Dios está contigo.
58009015	Grace	Por eso él es el mediador de una nueva relación de pacto. Puesto que la muerte ha ocurrido para liberarlos de los pecados cometidos bajo la relación del primer pacto, ahora los que son llamados pueden recibir la promesa de una herencia eterna.
45006001	Sin	¿Cuál es nuestra respuesta, entonces? ¿Debemos seguir pecando para tener aún más gracia?
49005004	Recommendation	Las conversaciones obscenas, las charlas necias, y los chistes con doble sentido son totalmente inapropiados. Por el contrario, deberían dar gracias a Dios.
66006008	Violence	Entonces miré y vi un caballo amarillo. El que lo cabalgaba se llamaba Muerte, y lo seguía el Hades. Ellos recibieron autoridad sobre una cuarta parte de la tierra para matar gente a filo de espada, con hambre, plagas y por medio de bestias salvajes.
45004016	Faith	De modo que la promesa está basada en la confianza en Dios. Es dada como un don, garantizada a todos los hijos de Abraham, y no solo a los que siguen la ley, sino también a todos los que creen como Abraham, el padre de todos nosotros.
44028018	Description	Después de interrogarme querían dejarme en libertad porque yo no había hecho nada que ameritara mi ejecución.
45009016	Grace	De modo que no depende de lo que nosotros queremos o de nuestros propios esfuerzos, sino del carácter misericordioso de Dios.
46010008	Sin	No debemos cometer pecados sexuales, como lo hicieron algunos de ellos, y en consecuencia 23.000 murieron en un día.
45007023	Sin	pero veo que hay una ley distinta que obra dentro de mí y que está en guerra con la ley que mi mente ha decidido seguir, convirtiéndome en un prisionero de la ley de pecado que está dentro de mí.
58006001	Faith	Así que no nos estanquemos en las enseñanzas básicas acerca de Cristo, sino progresemos a un entendimiento más maduro. No necesitamos volver una y otra vez a los conceptos sobre el arrepentimiento de lo que solíamos hacer, o sobre la fe en Dios,
46016011	Recommendation	No permitan que nadie lo menosprecie. Envíenlo con alegría en su viaje para que pueda venir a verme. Los hermanos, hermanas y yo estamos esperándolo.
59002014	Faith	Amigos míos, ¿qué de bueno hay en decir que tenemos fe en Dios si no hacemos lo correcto? ¿Puede salvarnos tal “fe”?
43007025	Description	Entonces algunos de los que venían desde Jerusalén comenzaron a preguntarse: “¿No es este al que estamos intentando matar?
43020022	Faith	Mientras decía esto, sopló sobre ellos y les dijo: “Reciban el Espíritu Santo.
45010003	Sin	Ellos no comprenden cómo Dios nos hace justos, y tratan de justificarse a sí mismos. Se niegan a aceptar la manera en que Dios justifica a las personas.
62005010	Faith	Los que creen en el Hijo de Dios han aceptado y se han aferrado a esta evidencia. Los que no creen en Dios, llaman a Dios mentirosos, porque no creen la evidencia que Dios da sobre su Hijo.
43014012	Faith	“Les digo la verdad, todo el que cree en mí hará las mismas cosas que yo estoy haciendo. De hecho, hará cosas incluso más grandes porque yo voy ahora al Padre.
56002009	Recommendation	Enseña a los siervos a que siempre obedezcan a sus amos. Enséñales que siempre deben procurar agradarles y no hablar mal a sus espaldas.
58012015	Recommendation	Asegúrense de que no les falte la gracia de Dios, en caso de que surja alguna causa de amargura y tribulación y termine corrompiendo a muchos entre ustedes.
54003007	Recommendation	La gente que está fuera de la iglesia también debe hablar bien de él para que no traiga desgracia sobre sí mismo y caiga en la trampa del diablo.
49004007	Grace	A cada uno de nosotros se nos dio gracia en proporción al generoso don de Cristo.
66016003	Description	Luego el segundo ángel derramó su copa sobre el mar, y se convirtió como la sangre de un cadáver, y todo lo que había en el mar murió.
49006006	Recommendation	No trabajen simplemente cuando los ven o para recibir aprobación, sino trabajen como siervos de Cristo, haciendo con honestidad la voluntad de Dios,
60003016	Recommendation	Asegúrense de tener una conciencia limpia, para que si alguno los acusa, sean avergonzados por hablar mal sobre la buena manera de vivir de ustedes, en Cristo.
43006040	Faith	Lo que mi Padre quiere es que cualquiera que vea al Hijo y crea en Él tenga vida eterna, y yo lo levantaré en el día final.”
44012023	Violence	De inmediato el ángel del Señor lo derribó, porque no le dio la gloria a Dios. Y fue consumido por los gusanos y murió.
47001003	Grace	¡Alaben a Dios, el padre de nuestro Señor Jesucristo! Él es el Padre misericordioso, y Dios de toda consolación.
54001006	Sin	Algunos se han desviado de estas cosas, y han terminado predicando cosas sin sentido.
45001016	Faith	Sin lugar a dudas, no me avergüenzo de la buena noticia, porque es poder de Dios para salvar a todos los que creen en él, primero a los judíos, y luego a todos los demás también.
46003011	Description	Porque nadie puede poner un fundamento distinto al que ya se puso en principio, es decir, Jesucristo.
49005033	Recommendation	Sin embargo, cada esposo debe amar a su propia esposa como a sí mismo, y la esposa debe respetar a su esposo.
51002013	Grace	Y aunque ustedes estaban muertos por causa de sus pecados y estaban físicamente “incircuncisos,” Dios los trajo de regreso a la vida junto con él. Y además ha perdonado todos nuestros pecados.
54004014	Recommendation	No descuides el don de la gracia de Dios que tienes y que te fue dado por inspiración profética cuando los ancianos de la iglesia impusieron sus manos sobre ti.
66021001	Description	Entonces vi un nuevo cielo y una nueva tierra. El primer cielo y la primera tierra habían desaparecido, y el mar ya no existía más.
52005016	Recommendation	Estén siempre llenos de alegría,
66009006	Description	Durante ese tiempo, la gente andará buscando la muerte, pero no la hallarán; querrán morir, pero la muerte huirá de ellos.
52004014	Faith	Puesto que estamos convencidos de que Jesús murió y se levantó de nuevo, también estamos seguros de que Dios traerá con Jesús a aquellos que han muerto confiando en él.
62004015	Faith	Dios vive en todos los que declaran que Jesús es el Hijo de Dios, y ellos viven en Dios.
49004022	Recommendation	¡Entonces abandonen su antigua forma de vivir, y dejen esa vieja naturaleza que los destruye con sus deseos engañosos!
43010009	Grace	Yo soy la puerta. Todo el que entra a través de mi, será sanado. Podrá ir y venir, y encontrará la comida que necesite.
58011037	Violence	Algunos fueron apedreados, tentados, muertos a espada. Algunos fueron vestidos con pieles de corderos y cabras: destituidos, oprimidos y maltratados.
62002029	Faith	Si ustedes saben que él es bueno y justo, entonces también deben saber que todo el que hace lo justo ha nacido de Dios.
44013047	Grace	Porque eso es lo que el Señor nos ha mandado a hacer: ‘Yo los he convertido en luz para los extranjeros, y a través de ustedes la salvación llegará hasta los fines de la tierra.’
47004002	Faith	Pero sí hemos renunciado a los actos secretos y vergonzosos. No actuamos con engaño ni distorsionamos la Palabra de Dios. Nosotros demostramos lo que somos al revelar la verdad ante Dios, a fin de que todos puedan decidirse a conciencia.
44002033	Description	Ahora él ha sido exaltado a la diestra de Dios y ha recibido del Padre al Espíritu Santo, el cual prometió, y ha derramado lo que ustedes están viendo y oyendo.
51003010	Recommendation	y vístanse del nuevo ser que siempre está siendo hecho cada vez más como su Creador, con un mejor entendimiento de quién es él realmente.
43011004	Faith	Cuando Jesús escuchó la noticia dijo: “El resultado final de esta enfermedad no será la muerte. A través de esto, será revelada la gloria de Dios, a fin de que el Hijo de Dios sea glorificado.”
45001017	Faith	Porque en la buena noticia Dios se revela como bueno y justo, fiel desde el principio hasta el fin. Tal como lo dice la Escritura: “Los que son justos viven por la fe en él.”
43019017	Description	Ellos condujeron a Jesús fuera de allí, cargando él su propia cruz, y se dirigió al lugar llamado “La Calavera,” (Gólgota en hebreo).
45012006	Faith	Cada uno tiene dones diferentes, que varían conforme a la gracia que se nos ha dado. De modo que si el don consiste en hablar de Dios, entonces debes hacerlo conforme a tu medida de fe en Dios.
66004007	Description	La primera criatura parecía un león, la segunda parecía un novillo, la tercera tenía rostro humano, y la cuarta parecía como un águila que volaba.
49005015	Recommendation	Así que tengan cuidado en cuanto a su forma de vivir, no con necedad, sino con sabiduría,
45010012	Grace	No hay diferencia entre judío y griego, porque el mismo Señor es Señor de todos, y da generosamente a todos los que le piden.
45010004	Faith	Porque Cristo es el cumplimiento de la ley. Todos los que confían en él son justificados.
50004006	Recommendation	No se preocupen por nada, sino oren a Dios por todas las cosas, y explíquenle lo que necesitan, y agradézcanle por todo lo que él hace.
46010006	Faith	Ahora, estas experiencias sirven como ejemplo para nosotros, para demostrarnos que no debemos desear lo malo, como lo hicieron ellos.
66009002	Description	Y abrió la puerta del Abismo, y salía humo de allí, como el humo de una caldera enorme. El sol y la atmósfera se oscurecieron por el humo que salía del Abismo.
52004006	Recommendation	No engañen ni se aprovechen de otros cristianos en estos asuntos, porque el Señor es el que ejerce juicio en todas estas cosas, como ya se los hemos explicado claramente, y como ya les advertimos.
47005017	Faith	Por eso todo el que está en Cristo es un nuevo ser. ¡Lo viejo ya se ha ido y ha llegado lo nuevo!
43005020	Faith	Porque el Padre ama al Hijo y le revela todo lo que hace; y el Padre le mostrará incluso cosas más increíbles que van a dejarlos asombrados a ustedes por completo.
49004028	Recommendation	Los que son ladrones, dejen de robar y trabajen productivamente y con honestidad con sus manos, para que tengan algo que brindar a quienes lo necesitan.
57001022	Recommendation	Mientras tanto, por favor, prepara una habitación para mí, pues espero poder regresar a verte pronto, como respuesta a tus oraciones.
