49004024	Recommendation	Dxala' gunle da naca chee̱ benne' cube na' da be̱n Dios le'e chee̱ gunle da naca na xlátaje̱ ne da li da naca na la'azxa .
66014012	Faith	Chee̱ le̱ na' , benne' ca' zaj naque̱' chee̱ Dios ne dxuluzue̱' dizra' ca naca mandado chee̱' ne zjácale̱ne̱' da naca chee̱ Jesús , dxala' xelaque̱' zren lazre' .
44013030	Description	Pero Dios bsebane̱' Le̱' ládujla benne' gate .
43010011	Description	Neda' naca' benne' wen dxuxua' becu' zrila' ca' . Benne' wen dxuxue becu' zrila' ca' dxuzue̱' xela nabán chee̱' chee̱ guselé̱' becu' zrila' ca' ,
49003002	Grace	Ba nézele ca be̱n Dios lu xela wen chee̱' , bsebague̱' neda' guchálaja' dizra' wen chee̱ Cristo ládujla le'e .
56003010	Recommendation	Che nu benne' dxune̱' le'e chupa la'a , bsizre-ne̱' tu chupa lasa , ne che quebe dxenne̱' ca dxu'u le̱' , bebeaje̱' ládujla le'e
43010019	Description	Gate benne' judío ca' belenne̱' dizra' caní , na' gulaque̱' chupa la'a xetú .
43003033	Faith	Pero che nu benne' dxéajle̱'e̱ chee̱' , benne' nigá dxule'ene̱' naca li ca da dxená Dios .
61003014	Recommendation	Chee̱ le̱ na' , benne' bicha' nazri'ite̱ lazra' , dxácate̱ dxebézale da caní , le gun ca da séquele chee̱ quebe bi bágale ne quebe bi nadxenle chee̱ dula lau Dios , ne suale lu xela dxebeza zri lazre' .
53003001	Faith	Na'a , benne' bicha' , le naba chee̱ntu' lau Dios , chee̱ zrinche dizra' chee̱ Xránadxu xúgute̱ xe̱zre ca' , ne chee̱ xelezi'e̱ na dute̱ xela ba la'ana , ca guca ládujla le'e .
47004014	Faith	lawe' da nézedxu Dios , Bénnea' bsebane̱' ládujla benne' gate Xránadxu Jesús , cá'anqueze gusebane̱' dxi'u tu zren nen Jesús , na' tu zren nen le'e , xeche̱'e̱ dxi'u lau Le̱' .
59005014	Recommendation	Che nu benne' quebe chawe' zue̱' , dxala' ne̱' benne' gula ca' dxuluxue̱' bi chee̱ Cristo , chee̱ xelenabe̱' lau Dios xexune̱' benne' we̱' na' , ne xelegu'e̱ le̱' aceite lu la Xránadxu .
44007023	Description	’ Gate bzrie̱' chua iza , Moisés guca lazre̱' cheajne̱'e̱ benne' lazrie̱' , benne' Israel ca' .
44023027	Violence	Benne' judío ca' gule̱le̱' benne' nigá ná'tega na'a xelutie̱' le̱' , pero gate gunezda' neda' nababe̱' Roma , na' guxíajle̱na' soldado chia' ca' , xeajselá' le̱' .
44019029	Description	Na' ca naca benne' zaj zra' ciudad na' guleque zréajene̱' . Na' gule̱le̱' Gayo ne Aristarco , zaj naque̱' benne' Macedonia dxeledále̱ne̱' Pablo , na' gulezrube xue̱' benne' caní chale'aj xu'u lawe' .
44003014	Sin	Bzuale chala'ala benne' na' naque̱' la'azxa ne xlátaje̱ , pero gunábale la tu benne' we̱n da zrinnaj .
44015009	Faith	Dios quebe dxuche̱'e̱ ca zri'ine̱' tudxu xetudxu lawe' da bca'ana cháwequeze̱' lazrdau benne' ca' guleajlí lazre̱' Jesús .
46011028	Recommendation	Chee̱ le̱ na' tu tudxu dxala' guxue xánnedxu xichaj lazrdaudxu gate za gágudxu xeta xtila nigá ne za xí'ajdxu chee̱ vaso nigá ,
46015058	Faith	Chee̱ le̱ na' , bicha' nazri'ite̱ lazra' , le se̱ chacha ne le súate̱ze lu zrin dxúndxale chee̱ Xránadxu lawe' da nézele quebe naca dácheze zrin dxunle tu zren nen Xránadxu .
46004016	Recommendation	Ca' naca na , dxata' xúeda' le'e gunle ca dxuna' neda' .
46001021	Faith	Dios nézene̱' xúgute̱ . Quebe be̱'e̱ lataj beniache xelúnbe'e̱ Le̱' por ne̱ chee̱ xela sina chee̱ beniache . Pero bezaca ba lazre̱' bselé̱' por ne̱ chee̱ dizra' nigá benne' ca' dxuluxrén lazre̱' Le̱' , lácala zaj zra' benne' dxeléquene̱' naca dizra' nigá tu da xálaze .
60003001	Recommendation	Cá'anqueze le'e , nu'ula nuchaga na'le , le guzua dizra' chee̱ benne' chee̱le , na' che núlale zua benne' chee̱le quebe dxeajle̱'e̱ xrtizra Dios , xexúnbe'e̱ naca na da li gate le'ene̱' da wen da dxun zru'ule̱' , ne quebe gun na ba xen bi guchalaj zru'ule̱' ,
47005020	Recommendation	Ca' naca na , nácantu' gubáz chee̱ Dios por ne̱ chee̱ Cristo , na' naca na cate̱ze Diósqueze dxata' xuene̱' le'e lu dxúa'antu' , na' dxata' xuentu' le'e lu la Cristo , le xexaca tuze nen Dios .
44002024	Description	Pero Dios bsebane̱' Le̱' , bebeaje̱' Le̱' lu xela gute . Quebe guxu'u modo xega'ane̱' chalásaze lu xela gute na' .
59002007	Sin	¿ Quegá benne' guni'a ca' benne' dxelené̱' schanni' chee̱ da wen ca nazí' lale , dxenale nácale bi chee̱ Cristo ?
54003003	Description	Quebe dxala' xé'aje̱' da guzuzre na le̱' , ne quebe gutile̱' benne' , ne quebe sa lazre̱' dumí , pero dxala' gaque̱' benne' dxexruj lazre' ne zren lazre' .
43004014	Grace	pero benne' xí'aje̱' nisa da gunézruja' neda' , québedxa bílene̱' na , lawe' da nisa na' dxunézruja' neda' galaj na lu xichaj lazrdawe̱' ca tu beaj nisa da gunna na le̱' xela nabán da zeajlí canna .
62002005	Faith	Pero che nu benne' dxuzue̱' dizra' ca naca da dxun Dios mandado , benne' nigá nazri'ine̱' Dios du lazre̱' . Che dxundxu caní nezdxu ba zuadxu tuze nen Le̱' .
66016013	Description	Nadxa ble'eda' beledxuaj chunna be' xriwe̱' dxu'a be̱ snia schanni' , ne dxu'a be̱ xixre' snia na' , ne dxu'a benne' dxené̱' waláz chee̱ba' . Be' xriwe̱' ca' zaj naca na ca bluzxu .
59002008	Recommendation	Che da li dxunle ca dxená mandado blau ca da naxuaj na lu libro la'azxa , dxená na : “ Bzri'i biche lwezru' ca nazri'i cuinu' ” , wen dxunle .
47004005	Faith	Quebe dxuzénentu' beniache ca naca cheé̱zquezentu' , pero ca naca chee̱ Jesucristo , dxenantu' naque̱' Xránadxu , na' ca naca chee̱ntu' dxenantu' nácantu' we̱n zrin chee̱le lawe' da nazri'intu' Jesús .
46015033	Recommendation	Quebe güele lataj nu si xe̱ le'e . Naca cate̱ze dxená na : “ Che gácadxu tuze benne' mal ca' , tu zrénqueze gundxu da mal . ”
58013020	Grace	Dxenaba' lau Dios , Bénnea' dxunne̱' dxi'u xela dxebeza zri lazre' ne bsebane̱' ládujla benne' gate Xránadxu Jesucristo , Benne' blau dxuxue̱' dxi'u , nácadxu becu' zrila' chee̱' , na' caní naque̱' lawe' da blalje̱' dxen chee̱' da bzua chuchu na xela wezría chadía chacanna da be̱ne̱' ;
50001027	Recommendation	Dxun na ba xen gunle da dxuzeajni'i dizra' wen chee̱ Cristo le'e , na' che xedajna'a le'e , u che zua' zitu' , wenda' ze̱ cháchale ne nácale tuze , dxunle tu zren zrin chee̱ Cristo chee̱ xeleajlí lazre' beniache dizra' wen chee̱' .
46006014	Grace	Ca be̱n Dios bsebane̱' Xránadxu ládujla benne' gate ca' , cá'anqueze gusebane̱' dxi'u nen xela waca chee̱' .
55001006	Recommendation	Chee̱ le̱ na' dxuzéajni'ida' lue' guchínenu' ca da be̱nna Dios lue' gate na' bze̱ na'a xichju' gunaba' gun Dios da wen chiu' .
60004006	Grace	Benne' ca' zaj nate belenne̱' ca naca dizra' chee̱ Dios chee̱ xelexaca bane̱' lu espíritu chee̱' ca naca ban Dios , lácala lu xe̱zr la xu nigá Dios bchi'e̱ ca da belune̱' ca guchi'e̱ chee̱ xúgute̱ beniache .
46007023	Recommendation	Dios ba ná'awe̱' le'e nen tu lazruj zrente̱ . Quebe güele lataj nu benne' gune̱' le'e benne' zaj nada'u .
46010010	Recommendation	Quebe ne̱le chee̱ Dios ca gulené̱ bala benne' ca' , na' be̱te ángel chee̱ xela gute benne' ca' .
47002017	Faith	Netu' quebe dxedantu' dxútentu' dizra' chee̱ Dios , ne quebe dxuchantu' na ca dxelún benne' zante̱ , pero lawe' da dxen Dios , dxuchálajntu' du lázrentu' , ca benne' nasela Dios , ne ca we̱n zrin chee̱ Cristo .
45015001	Recommendation	Dxi'u ba ze̱ cháchadxu lu xela dxeajlí lazre' dxala' gácale̱dxu benne' quebe ne s e̱ chache̱' lu xela dxeajlí lazre' , ne quebe gundxu da dxezaca ba lázredxu dxí'uze .
50002024	Faith	pero nuxrén lazra' Xránadxu , néda'queza' xida' xedajna'a le'e .
66007001	Description	Ca gudé chee̱ da nigá , ble'eda' tapa ángel zaj ze̱' dapa saca chee̱ xe̱zr la xu , na' zaj nuzague̱' be' da za'aca na dapa saca , chee̱ quebe bi be' gata' lu xe̱zr la xu ne lawe' nísadau' , ne lawe' xaga ca' .
60004003	Sin	Cá'ante̱ze catite da ba be̱nle gate nate da dxeledanne benne' quebe zaj núnbe'e̱ Dios . Ca lu iza da ba guledé be̱nle da sban ca' ne da mal ca' da guzá lázrele , ne guzúzrele ne be̱nle laní sban ca' . Güé'ele̱'e̱le ne bca'ana szrenle bedau' xiaj xaga ca' da na' dxecuide Dios .
66011005	Violence	Che nu benne' dxaca lazre̱' guzría xi'e̱ benne' caní , na' le̱' xululube̱' xi' da dxuaj lu dxu'e̱ , na' guzézxete̱ na contra chee̱' ca' . Caní gate nútete̱ze benne' tábague̱' benne' chupa caní .
44023005	Recommendation	Pablo guné̱' : ― Benne' bicha' , quebe nezda' che benne' nigá naque̱' bxruze blau lawe' da dxená lu libro chee̱ Dios : “ Quebe neu' schanni' chee̱ benne' dxená be'e̱ lázriu' . ”
66022015	Sin	Pero quebe xelu'u na' benne' we̱n da zrinnaj ca' , ne benne' wazrá' ca' , ne benne' we̱n da sban ca' , ne benne' we̱te benne' , ne benne' dxuluca'ana szrene̱' bedau' xiaj xaga ca' , ne benne' zaj nazri'ine̱' da we̱n lazre' , ne benne' dxelún lazre̱' .
66002014	Sin	Pero zua tu da dxagu na zria chee̱le , dxuele lataj zaj zra' ládujla le'e benne' ca' ne zjácale̱ne̱' da bse̱de Balaam , bénnea' gulu'u xele̱' Balac be̱ne̱' belún benne' Israel ca' dula , gulawe̱' da buluzrie̱' lau bedau' xiaj xaga ca' , ne belune̱' da sban .
53001003	Faith	Le'e , benne' bicha' , dxala' xé̱quezentu' Dios xcalenu' ca naca chee̱le , da dxala' guntu' lawe' da ba dxegula xela dxeajlí lazre' chee̱le , ne ba dxezrí'idxa lwézrele tule xetule .
46012002	Sin	Ba nézquezle gate na' quebe ne chéajle̱le chee̱ Xránadxu , be̱'e̱le lataj nu gulezrube xue̱' le'e chee̱ xeajé̱ lá'anale bedau' xiaj xaga ca' , da quebe dxelené̱ na .
49005025	Recommendation	Benne' biu dxala' zri'ine̱' zru'ule̱' cate̱ze be̱n Cristo , bzri'ine̱' bi chee̱' ca' ne bzánene̱' xela nabán chee̱' por ne̱ chee̱be' .
45012017	Recommendation	Quebe xebi'ile mal chee̱ benne' nune̱' mal chee̱le . Le gun ba xuzre gunle da wen lau xúgute̱ beniache .
60005006	Recommendation	Le guzexruj lázrele lu xela dxená bea zren chee̱ Dios , chee̱ xechisa Le̱' le'e ca zrin hora chee̱ na .
44014017	Grace	lácala blé'equezne̱' benne' ca' nu naca Le̱' por ne̱ chee̱ da wen da dxune̱' chee̱ benne' ca' . Le̱' dxesele̱' xiuj chee̱dxu ne ca naca lina xrdante̱ , ne dxunne̱' da dxechínedxu da gágudxu ne chee̱ bedxu .
54003011	Recommendation	Zru'ula benne' caní dxala' xelaque̱' benne' zaj napa ba la'ana , ne quebe xelaque̱' wetupa dizra' bizruj . Dxala' xelaque̱' du lazre' ne li lazre' ca naca xúgute̱ da dxelune̱' .
66002021	Sin	Neda' ba be'a nu'ula na' lataj xexiaje lazre̱' , pero quebe guca lazre̱' . Quebe dxusane̱' ca naca da sban da dxune̱' .
44012020	Description	Herodes dxezre̱'e̱ benne' ca' zaj zra' ciudad Tiro ne ciudad Sidón , pero benne' chee̱ ciudad ca' belune̱' tuze dizra' chee̱ cheajlele'e cuine̱' lau Herodes na' . Na' belune̱' Blasto benne' xcompe̱' , naque̱' tu benne' blau chee̱ rey Herodes , na' gulesele̱' le̱' lau Herodes chee̱ nabe̱' lawe̱' chee̱ sua zri ca naca da dxaca chee̱ Herodes ne benne' ca' . Caní belune̱' lawe' da dxelagu benne' ciudad Tiro ne Sidón nédxute̱ da guzá' ciudad Cesarea naga zua Herodes .
43008049	Sin	Jesús beche̱be̱' : ― Quebe xu'a be' xriwe̱' . Neda' dxapa' ba la'ana Xra' Dios , pero le'e dxuzúale neda' chala'ala .
43006018	Description	Nadxa guzú lau dxaca tu be' bdunu' lawe' nísadau' na' , na' xeajxruza chee̱ nísadau' na' guxásale̱'e̱ na .
45008018	Faith	Dxéqueda' ca xela zi' da dxededxu na'a quebe gutílele̱be na ca da xabá da sidxu lu zra da za za' .
62002012	Grace	Le'e , bi nazri'ite̱ lazra' , dxuzuaja' chee̱le lawe' da ba bnite lau Dios chee̱le ca naca dula chee̱le , lawe' da gute Jesucristo waláz chee̱dxu .
55001009	Grace	Dios bselé̱' dxi'u ne guné̱' dxi'u chee̱ guzua cuínadxu chee̱ Le̱' , quegá lawe' da be̱ndxu da wen , pero lawe' da guca lázrequeze Le̱' caní , ne lawe' da bzri'ine̱' dxi'u , nazrágadxu chee̱ Cristo . Dios bzri'ine̱' dxi'u gate quebe ne gunte̱' xe̱zr la xu ,
43019006	Violence	Gate benne' xíchaje̱ ca' chee̱ bxruze ca' ne policía ca' belele'ene̱' Jesús , na' gulezú lawe̱' dxelené̱' zizraj : ― Bde̱'e̱ xaga cruzu . Bde̱'e̱ xaga cruzu . Pilato guzre̱' benne' ca' : ― Le che̱'e̱ , ne le gude̱'e̱ xaga cruzu lé'equeze , lawe' da quebe bi falta chee̱' dxezrelda' .
60001010	Grace	Lu iza da ba guledé gate nate , benne' gulené̱' waláz chee̱ Dios buluxue xannie̱' ne belexebeaj ni'e̱ ca naca chee̱ xela weselá nigá , na' buluchálaje̱' ca naca xela wen chee̱ Dios da gunne̱' le'e .
63001007	Sin	Ba belelá' benne' zante̱ , benne' dxelezí xe̱'e̱ . Benne' caní quebe dxelexeche̱be̱' guca Jesús be̱la' dxen . Benne' caní zaj naque̱' benne' dxelezí xe̱'e̱ ne dxeledábague̱' Cristo .
44024005	Sin	Dxená'antu' benne' nigá dxúnle̱'e̱ mal , ne gátete̱ze na' lu xe̱zr la xu nigá dxune̱' benne' judío chupa la'a , ne naque̱' benne' xíchaje̱ chee̱ benne' ca' zaj da' tu benne' Nazaret .
54003016	Grace	Da li tu da zrente̱ naca da nigá ble'e Dios dxi'u ca naca da zéajle̱dxu : Dios ble̱'e̱ nigá , guque̱' beniache ; Na' Espíritu La'azxa ble'ene̱' naque̱' xlátaje̱ . Belele'e ángel ca' Le̱' . Benne' xúgute̱ nación belenne̱' ca naca chee̱' , Na' guleajlí lazre' benne' zaj zra' dute̱ xe̱zr la xu nigá Le̱' , Na' Dios bezi'e̱ Le̱' xabá .
66016021	Violence	Cá'anqueze belexruj zran xabá xiaj bezxe' zri'a lawe' beniache , da dxela'a na ca tu gaxua libra weaj , na' beniache ca' gulené̱' schanni' chee̱ Dios por ne̱ chee̱ da ba xa' da gulezaque̱' , lawe' da guca na tu da ba xa' zrente̱ .
61003013	Faith	pero dxi'u dxebézadxu tu xabá cube ne tu xe̱zr la xu cube da ba guche̱be lazre' Dios naga gaca xlátaje̱ xúgute̱ .
66006014	Description	Xabá benite na ca tu xiche da dxexedube , na' xúgute̱ xi'a ca' ne xe̱zr la xu ca' da zaj naxechaj nísadau' gulecuasa na naga zaj zua na .
58010010	Grace	Dios ba bca'ana chawe̱' dxi'u lu xtúladxu lawe' da be̱n Cristo ca da guná Dios gate bzua cuine̱' lau Dios tu lásaze gate gutie̱' le̱'e̱ xaga cruzu .
52001002	Faith	Dxé̱quezentu' Dios xcalenu' ca naca chee̱ xúgute̱le le'e , ne dxenábantu' gaca wen chee̱le le'e gate dxuchálajle̱ntu' Dios .
66006004	Violence	Na' bdxuaj xetú bzrina' , nácaba' be̱ xrna , na' bénnea' zrie̱'-ba' guzi'e̱ xela dxená bea chee̱ cuase̱' xela dxebeza zri lazre' lu xe̱zr la xu , ne chee̱ gune̱' xelute lwezre beniache , na' bulunézruje̱' le̱' tu machete tunna .
54006001	Recommendation	Benne' zaj nada'u dxala' xelápale̱'e̱ ba la'ana xrane̱' ca' chee̱ quebe nu ne̱ schanni' chee̱ Dios ne chee̱ da dxusé̱dedxu .
51003009	Recommendation	Quebe si xe̱ lwézrele tule xetule , lawe' da ba bzúale chala'ala da gúcale nédxute̱ , ne ca naca da be̱nle ,
66002020	Sin	Pero zua tu da dxagu na zria chee̱le , dxuele lataj nu'ula na' le̱' Jezabel , nu'ula na' dxené̱' dxuchálaje̱' waláz chee̱ Dios , pero dxezí xe̱'e̱ benne' we̱n zrin chia' ca' ca naca da dxusé̱dene̱' chee̱ xelune̱' da sban ne xelawe̱' da dxuluzrie̱' lau bedau' xiaj xaga ca' .
48003008	Grace	Naxuaj na lu dizra' la'azxa ca naca da nigá . Lawe' da neze Dios nédxute̱ guca'ane̱' xlátaje̱ benne' quebe zaj naca judío , benne' xeleajlí lazre̱' Le̱' , na' guzre̱' Abraham nédxute̱ dizra' wen nigá , guné̱' : “ Gaca wen chee̱ benne' xúgute̱ nación por ne̱ chiu' lue' . ”
58012005	Recommendation	Quebe gala lázrele le'e ca dxun Dios , dxuzéajni'ine̱' le'e ca zrí'inequeze̱' , gate dxené̱' : Zri'ina' , quebe guzua chala'ala da dxun Xranu' gate dxusízrene̱' lue' , Ne quebe gute lazru' gate dxedile̱' lue' ;
58013017	Recommendation	Le guzua dizra' chee̱ benne' ca' dxuluxue̱' le'e ne le gun ca da dxelené̱' . Benne' caní dxuluxue̱' alma chee̱le ne wuluxudee̱' lau Dios ca da zaj nune̱' . Che gunle caní , na' benne' caní welune̱' zrin chee̱' du lazre̱' , ne quebe xelezua xache̱' lawe' da che quebe gunle caní , quebe bi da ba neza gaca na chee̱le .
44013019	Description	na' bzria xi'e̱ gazre nación da zaj zua lu xe̱zr la xu Canaán , chee̱ bnézruje̱' xra xrtaudxu ca' xe̱zr la xu chee̱ benne' ca' .
54006003	Faith	Che nu benne' dxusé̱dene̱' da zaj naca cale̱la da quebe zaj naca na tuze ca da bse̱de Xránadxu Jesucristo , ne ca da dxuse̱de da dxéajle̱dxu chee̱ Dios ,
63001010	Recommendation	Che nu benne' xide̱' naga zuale le'e ne quebe dxusé̱dene̱' le'e ca da bse̱de Cristo , quebe ne̱le bénnea' lízrele , ne quebe gápale le̱' ba la'ana .
47001005	Grace	Lawe' da dxededxu xela zi' zren ca da gudé Cristo , cá'anqueze por ne̱ chee̱ Cristo zua nu dxexue zrénqueze dxi'u , Le̱' Dios .
65001011	Sin	Edxugua benne' caní lawe' da dxelune̱' ca da be̱n Caín ne chee̱ gulezí' lu ne̱'e̱ dumí , buluzue̱' chala'ala da dxená Dios ca be̱n Balaam , na' welexenite̱' ca guca chee̱ Coré , bénnea' bzria xi' Dios lawe' da gudábague̱' xrtizra Dios .
65001010	Sin	Pero benne' caní dxelené̱' schanni' chee̱ da quebe zaj núnbe'e̱ , na' da zaj núnbeaqueze̱' , ca da zaj neze be̱ xixre' , be̱ quebe zaj naxeajni , da caní dxuluchínene̱' chee̱ xuluzría xi' cuine̱' .
58011007	Faith	Xela dxeajlí lazre' chee̱ Noé , gate Dios guzre̱' le̱' nédxula ca da dxala' gaca , bzue̱' dizra' chee̱ Dios , be̱ne̱' tu barco zren chee̱ xelelá xrtie̱' ca' . Guxeajlí lazre' Noé Dios , pero gulebía xi' beniache zaj zra' lu xe̱zr la xu na' , lawe' da quebe guleajlí lazre̱' Dios . Dios bca'ane̱' Noé wen lawe' da guxeajlí lazre̱' Le̱' .
58009006	Description	Gate ba naga'ana chawe' da caní , na' bxruze ca' dxelú'uqueze̱' lu lataj nedxu chee̱ lataj la'azxa chee̱ xelune̱' zrin chee̱ xela bxruze chee̱' .
44007051	Sin	Nadxa guná Esteban : ― Pero le'e nácaquezle lazrdau zide' , ne zria nágale ne lazrdaule ca zaj naca chee̱ benne' quebe zaj núnbe'e̱ Dios , quebe dxezile xrtizre̱' . Dxedábagaquezle Espíritu La'azxa . Nácale ca gulaca xra xrtaule ca' .
54001009	Sin	Dxala' gusá lázredxu quebe bzua Dios ley chee̱ na be'e na benne' wen ca' , pero chee̱ na be'e na benne' ca' dxelune̱' da cale̱la , ne benne' ca' quebe dxuluzúa dizra' Le̱' , ne benne' mal ca' , ne benne' we̱n dula ca' , ne benne' ca' quebe dxelape̱' Dios ba la'ana , ne quebe dxelapa ba la'ana da naca chee̱ Dios , ne benne' ca' dxelute xra xrna' , ne benne' ca' dxelutie̱' benne' ,
46005009	Recommendation	Lu da bzuaja' chee̱le nédxudxa gucha' le'e quebe guchixre chee̱le nen benne' ca' dxelune̱' da sban .
48001015	Grace	Pero Dios guque̱'e̱ neda' nédxula gate za gálaja' , na' lu xela zri'i lazre' chee̱' guné̱' neda' . Nadxa gate guca lazre' Le̱' ,
45007015	Description	Neda' quebe dxéajni'ida' da dxaca chia' lawe' da quebe dxuna' da dxaca lazra' guna' pero da dxecuídeda' naca na da dxuna' .
61003018	Faith	Le gúnbea xanne' Xránadxu , Benne' weselá chee̱dxu , Jesucristo , ne le gula lu xela zri'i lazre' chee̱' . Gaca ba Le̱' na'a ne chadía chacanna . Ca'an gaca na .
46004010	Description	Dxeleque beniache nácantu' netu' tu da xálaze lawe' da dxuntu' zrin chee̱ Cristo , pero le'e dxéquele dxeajni'i xánnele le'e da zaj naca chee̱ Cristo . Dxeleque beniache nate ni'a na'ntu' netu' pero le'e dxéquele nácale le'e benne' wala . Dxuluzua beniache netu' chala'ala , pero dxelape̱' le'e ba la'ana .
60005009	Faith	Le tílale̱ da xriwe̱' ne le se̱ chacha lu xela dxeajlí lazre' chee̱le , lawe' da ba nézquezle dxeledéqueze xúgute̱ bíchele zaj zra' lu xe̱zr la xu nigá xela zi' ca da dxedele le'e .
51003022	Recommendation	Le'e , benne' zaj nada'u , le guzua dizra' xúgute̱ da xelené̱ xránale lu xe̱zr la xu nigá , quegaze gate dxelena'te̱' , chee̱ xeléquene̱' le'e wen , pero le gun da ca' du lázrele , ne le zrebe Dios .
66017012	Description	’ Chi lúzu be̱ xixre' snia na' da ble'enu' zaj naca na chi benne' rey ca' , benne' quebe ne xelezú lawe̱' xelená be'e̱ , pero xelezi'e̱ xela dxená bea xelaque̱' rey tu hóraze tu zren nen be̱ xixre' schanni' na' .
46002012	Grace	Espíritu da nazidxu quebe naca na chee̱ xe̱zr la xu nigá , pero nazidxu Espíritu da dxunna Dios dxi'u chee̱ chéajni'idxu da ca' ba nunna Dios dxi'u .
59005001	Recommendation	Le xene da nigá , le'e , benne' guni'a . Le cuezre ne le xewi'ine lazre' ca naca da zi' da xa' da le'ele .
66002010	Recommendation	Quebe zrébele ca naca xela zi' da tele , lawe' da guzrá' da xriwe̱' bálale le'e lizre xia chee̱ gule'e lau da nácale , na' tele xela zi' lawe' chi zra . Pero le gaca li lazre' lácala xelutie̱' le'e , na' neda' gunna' le'e xela nabán ca tu da dxunna bea na be̱nle gan .
54006011	Recommendation	Pero lue' , benne' chee̱ Dios , gucuasa lu da caní . Be̱n da naca xlátaje̱ , ne bzua cuinu' lu na' Dios , ne guxeajlí lazre' Cristo , ne bzri'i Le̱' , ne guca zren lazre' ne dxexruj lazre' .
59005005	Sin	Lu xe̱zr la xu nigá ba guzile ba neza xela guni'a chee̱le ne xúgute̱ da wen ca' , ne guzrenle ca tu be̱zre dxánnele̱'e̱ , pero ba dxezrín hora xelútie̱'-ba' .
66004004	Description	Dxu'a lataj blau na' zaj zua tape dxua lataj naga zaj dxe' tape dxua benne' gula ca' , zaj nacue̱' zra lane̱' chiche , ne zaj zria xíchaje̱' corón oro ca' .
66018007	Description	Gudee̱' benne' ca' lu da ba xa' ne gudee̱' le̱' xela zi' cate̱ze na' belune̱' , buluzua cuine̱' lu xela szren ne gulezue̱' lu xela dxelexezaca ba lazre' chee̱' , lawe' da dxelené̱' lu lazrdawe̱' : “ Dxe'entu' nigá dxená beantu' . Quebe nácantu' we̱ze̱be ne quebe bi sácantu' . ”
60003007	Recommendation	Cá'anqueze le'e , benne' biu , zúale̱le nu'ula , le gaca dxexruj lazre' nen zrú'ulale . Le gapa ba la'ana zrú'ulale lawe' da quebe zaj naque̱' benne' wala ca le'e , ne cá'anqueze zaj nape̱' xela nabán ca da nunna Dios le'e dute̱ xela wen chee̱' . Dxala' gunle caní chee̱ quebe bi guzaga na le'e gate guchálajle̱le Dios .
54002012	Recommendation	Quebe dxunna' lataj nu'ula gusé̱dene̱' benne' biu ca' ne na be'ene̱' le̱' , pero dxala' sua zrie̱' .
46001009	Faith	Dios tu dxúnzqueze̱' ca da nache̱be lazre̱' , naque̱' Bénnea' guné̱' le'e chee̱ gácale tuze nen Zri'ine̱' , Xránadxu Jesucristo .
48005013	Recommendation	Benne' bicha' , Dios guné̱' le'e chee̱ gácale benne' quebe zaj nada'u québedxa xu'ule lu na' ley chee̱ Moisés . Quebe guchínele da nácale chee̱ gunle ca da dxezá lázrele , pero le gun cuínale ca benne' zaj nada'u , gunle zrin chee̱ le sa' lwézrele tule xetule lu xela zri'i lazre' chee̱le .
59002012	Recommendation	Le'e dxala' guchálajle ne gunle ca dxala' xelún benne' ca' guchi'a Dios ca da dxelune̱' , benne' ca' zaj nalá lu na' ley na' .
46012005	Faith	Zaj nazrá' ca gaca gundxu zrin , pero tuze naca Xránadxu , Bénnea' dxundxu zrin chee̱' .
45009005	Description	Zaj naque̱' zri'ine zre zua xra xrtaudxu ca' , na' ládujla benne' walázr chee̱' ca' , lu be̱la' dxen chee̱' bla' Cristo , Bénnea' naque̱' Dios lawe' xúgute̱ da de̱ , ne gaca báqueze̱' chadía chacanna . Ca' gaca na .
47001006	Description	Chee̱ le̱ na' , che dxedentu' netu' xela zi' naca na chee̱ sua nu xexue zren le'e ne chee̱ lale , na' caní gaca guchaga laule dute̱ xela zren lazre' chee̱le xela zi' ca' da dxededxu dxi'u .
47001021	Faith	Dios naque̱' Bénnea' ba nuzé̱ chuchue̱' netu' ne le'e lu da naca chee̱ Cristo , ne ba guque̱'e̱ dxi'u
44010015	Recommendation	Na' benne' na' guné̱' da xubla , dxe̱'e̱ le̱' : ― Da ba nuca'ana chawe' Dios , quebe nau' lue' naca na sban .
66018009	Sin	Benne' rey ca' zaj zra' xe̱zr la xu belúnle̱ne̱' benne' ca' da sban ne da belexezaca ba lazre̱' , xelebezre xache̱' gate xelele'ene̱' ca naca zren chee̱ ciudad na' , dxezxe na .
43014023	Faith	Jesús beche̱be̱' : ― Benne' nazri'ine̱' neda' dxune̱' ca naca da dxenea' , na' Xra' zri'ine̱' bénnea' , na' neda' ne Xra' xedajsúale̱ntu' le̱' .
62004010	Grace	Xela zri'i lazre' li naca na caní : quegá dxi'u na' bzri'idxu Dios , pero Le̱' bzri'ine̱' dxi'u ne gusele̱' Zri'ine̱' chee̱ guque̱' da gudua na da nabágadxu lau Dios chee̱ dula chee̱dxu .
62001007	Faith	Che dxundxu da li da naca chee̱ xela naxaní' , ca naca Dios , naque̱' li lazre' , zue̱' lu xela naxaní' , nadxa zúadxu tuze tudxu xetudxu , na' dxen chee̱ Jesús , Zri'ine Dios , dxibe na dxi'u ca naca xúgute̱ dula nabágadxu .
48004007	Grace	Ca'an naca , nácadxu zri'ine Dios , ne québedxa nácadxu ca benne' zaj nada'u lu na' ley chee̱ Moisés . Na' lawe' da nácadxu zri'ine̱' , Dios gunne̱' dxi'u da de̱ chee̱' . Caní naca lawe' da nácadxu Cristo tuze .
58001008	Faith	Pero ca naca chee̱ Zri'ine̱' , guná Dios : Lataj blau chiu' lue' , Dios , zua na chadía chacanna ; Xela dxená bea chiu' naca na xlátaje̱ .
43010033	Sin	Belexeche̱be benne' judío ca' : ― Quebe güentu' lue' xiaj lawe' da nunu' da wen , pero lawe' da guneu' schanni' chee̱ Dios . Lue' nacu' beniache , pero dxun cuinu' Dios .
66014011	Description	Zren chee̱ xi' , naga saca zi'e̱ , cuen na chadía chacanna , na' xelezaca zi' te zra ne chizrela benne' ca' dxuluca'ana szrene̱' be̱ snia na' ne bedau' chee̱ba' , ne dxelu'e̱ lataj da' luzrgue̱' laba' .
47004001	Faith	Ca' naca na , cabata' dxate ni'a nantu' lawe' da lu xela dxexache lazre' chee̱' , Dios ba nusebague̱' netu' zrin chee̱ Cristo nigá da dxuntu' .
58013006	Faith	Caní naca , du lázredxu waca nadxu : Xrana' Dios dxácale̱ne̱' neda' . Quebe zreba' bi da gusaca beniache neda' .
45014003	Recommendation	Benne' dxawe̱' xúgute̱ da ca' quebe dxala' guzue̱' chala'ala bénnea' nadxuaj nadxeze da dxawe̱' , na' benne' nadxuaj nadxeze da dxawe̱' quebe dxala' si tizre̱' bénnea' dxawe̱' bala bi de̱ , lawe' da nazí' lu na' Dios bénnea' .
45015005	Grace	Dxenaba' lau Dios , Bénnea' dxunne̱' dxi'u xela zren lazre' ne dxexue zrene̱' dxi'u , chee̱ gácale̱ne̱' le'e chee̱ gácale tuze tule xetule por ne̱ chee̱ Jesucristo ,
