62002015	Recommendation	لاَ تُحِبُّوا الْعَالَمَ، وَلاَ الأَشْيَاءَ الَّتِي فِي الْعَالَمِ. فَالَّذِي يُحِبُّ الْعَالَمَ، لاَ تَكُونُ مَحَبَّةُ الآبِ فِي قَلْبِهِ.
45002001	Sin	إِذَنْ، لاَ عُذْرَ لَكَ أَيُّهَا الإِنْسَانُ الَّذِي يَدِينُ الآخَرِينَ، كَائِناً مَنْ كُنْتَ. فَإِنَّكَ بِمَا تَدِينُ غَيْرَكَ، تَدِينُ نَفْسَكَ: لأَنَّكَ أَنْتَ الَّذِي تَدِينُ تَفْعَلُ تِلْكَ الأُمُورَ نَفْسَهَا.
48002009	Description	فَلَمَّا اتَّضَحَتِ النِّعْمَةُ الْمَوْهُوبَةُ لِي عِنْدَ يَعْقُوبَ وَبُطْرُسَ وَيُوحَنَّا، وَهُمُ الْبَارِزُونَ بِاعْتِبَارِهِمْ أَعْمِدَةً، مَدُّوا إِلَيَّ وَإِلَى بَرْنَابَا أَيْدِيَهُمُ الْيُمْنَى إِشَارَةً إِلَى الْمُشَارَكَةِ، فَنَتَوَجَّهُ نَحْنُ إِلَى غَيْرِ الْيَهُودِ وَهُمْ إِلَى أَهْلِ الْخِتَانِ،
43019023	Description	وَلَمَّا صَلَبَ الْجُنُودُ يَسُوعَ أَخَذُوا ثِيَابَهُ وَقَسَّمُوهَا إِلَى أَرْبَعَةِ أَقْسَامٍ، فَأَخَذَ كُلُّ جُنْدِيٍّ قِسْماً. وَأَخَذُوا الْقَمِيصَ أَيْضاً، وَكَانَ مَنْسُوجاً كُلُّهُ مِنْ قِطْعَةٍ وَاحِدَةٍ، بِغَيْرِ خِيَاطَةٍ.
45002021	Sin	فَأَنْتَ إِذَنْ، يَامَنْ تُعَلِّمُ غَيْرَكَ، أَمَا تُعَلِّمُ نَفْسَكَ؟ أَنْتَ يَامَنْ تَعِظُ أَنْ لاَ يُسْرَقَ، أَتَسْرِقُ؟
46006019	Faith	أَمَا تَعْلَمُونَ أَنَّ جَسَدَكُمْ هُوَ هَيْكَلٌ لِلرُّوحِ الْقُدُسِ السَّاكِنِ فِيكُمْ وَالَّذِي هُوَ لَكُمْ مِنَ اللهِ، وَأَنَّكُمْ أَنْتُمْ لَسْتُمْ مِلْكاً لأَنْفُسِكُمْ؟
47005014	Grace	فَإِنَّ مَحَبَّةَ الْمَسِيحِ تُسَيْطِرُ عَلَيْنَا، وَقَدْ حَكَمْنَا بِهَذَا: مَادَامَ وَاحِدٌ قَدْ مَاتَ عِوَضاً عَنِ الْجَمِيعِ، فَمَعْنَى ذَلِكَ أَنَّ الْجَمِيعَ مَاتُوا؛
58003001	Faith	إِذَنْ، أَيُّهَا الإِخْوَةُ الْقِدِّيسُونَ الَّذِينَ اشْتَرَكْتُمْ فِي الدَّعْوَةِ السَّمَاوِيَّةِ، تَأَمَّلُوا يَسُوعَ: الرَّسُولَ وَرَئِيسَ الْكَهَنَةِ فِي الإِيمَانِ الَّذِي نَتَمَسَّكُ بِهِ.
44020035	Recommendation	وَقَدْ أَظْهَرْتُ لَكُمْ بِوُضُوحٍ كَيْفَ يَجِبُ أَنْ نَبْذُلَ الْجَهْدَ لِنُسَاعِدَ الْمُحْتَاجِينَ، مُتَذَكِّرِينَ كَلِمَاتِ الرَّبِّ يَسُوعَ، إِذْ قَالَ: الْغِبْطَةُ فِي الْعَطَاءِ أَكْثَرُ مِمَّا فِي الأَخْذِ!»
58013004	Recommendation	حَافِظُوا جَمِيعاً عَلَى كَرَامَةِ الزَّوَاجِ، مُبْعِدِينَ النَّجَاسَةَ عَنِ الْفِرَاشِ. فَإِنَّ اللهَ سَوْفَ يُعَاقِبُ الَّذِينَ يَنْغَمِسُونَ فِي خَطَايَا الدَّعَارَةِ وَالزِّنَى.
43020005	Description	وَانْحَنَى فَرَأَى الأَكْفَانَ مُلْقَاةً عَلَى الأَرْضِ، وَلكِنَّهُ لَمْ يَدْخُلْ.
66016018	Description	فَحَدَثَتْ بُرُوقٌ وَأَصْوَاتٌ وَرُعُودٌ وَزِلْزَالٌ عَنِيفٌ لَمْ تَشْهَدِ الأَرْضُ لَهُ مَثِيلاً مُنْذُ وُجِدَ الإِنْسَانُ عَلَى الأَرْضِ، لأَنَّهُ كَانَ زِلْزَالاً عَنِيفاً جِدّاً!
66019010	Faith	فَجَثَوْتُ عِنْدَ قَدَمَيْهِ لأَسْجُدَ لَهُ، فَقَالَ لِي: «لاَ تَفْعَلْ! إِنِّي عَبْدٌ لِلهِ، مِثْلُكَ وَمِثْلُ إِخْوَتِكَ الْمُؤْمِنِينَ الَّذِينَ لَدَيْهِمِ الشَّهَادَةُ الْمُخْتَصَّةُ بِيَسُوعَ: لِلهِ اسْجُدْ! فَإِنَّ الشَّهَادَةَ الْمخْتَصَّةَ بِيَسُوعَ هِيَ رُوحُ النُّبُوءَةِ».
46002010	Grace	وَلَكِنَّ اللهَ كَشَفَ لَنَا ذَلِكَ بِالرُّوحِ. فَإِنَّ الرُّوحَ يَتَقَصَّى كُلَّ شَيْءٍ، حَتَّى أَعْمَاقَ اللهِ.
50002029	Recommendation	فَاقْبَلُوهُ إِذَنْ فِي الرَّبِّ بِكُلِّ فَرَحٍ، وَعَامِلُوا أَمْثَالَهُ بِالإِكْرَامِ.
51003020	Recommendation	أَيُّهَا الأَوْلاَدُ، أَطِيعُوا وَالِدِيكُمْ فِي كُلِّ أَمْرٍ، لأَنَّ ذَلِكَ مَرْضِيٌّ فِي الرَّبِّ.
47001012	Faith	فَإِنَّ فَخْرَنَا هُوَ هَذَا: شَهَادَةُ ضَمِيرِنَا بِأَنَّنَا، فِي قَدَاسَةِ اللهِ وَإِخْلاَصِهِ، قَدْ سَلَكْنَا فِي الْعَالَمِ، وَبِخَاصَّةٍ تُجَاهَكُمْ؛ وَلَمْ يَكُنْ ذَلِكَ بِحِكْمَةٍ بَشَرِيَّةٍ بَلْ بِنِعْمَةِ اللهِ.
43014021	Faith	مَنْ كَانَتْ عِنْدَهُ وَصَايَايَ، وَيَعْمَلُ بِهَا، فَذَاكَ يُحِبُّنِي. وَالَّذي يُحِبُّنِي، يُحِبُّهُ أَبِي، وَأَنَا أُحِبُّهُ وأُعْلِنُ لَهُ ذَاتِي».
51002023	Sin	لَهَا مَظَاهِرُ الْحِكْمَةِ لِمَا فِيهَا مِنْ إِفْرَاطٍ فِي الْعِبَادَةِ الْمُصْطَنَعَةِ، وَإِذْلاَلٍ لِلذَّاتِ، وَقَهْرٍ لِلْجَسَدِ؛ أُمُورٌ لاَ قِيمَةَ لَهَا، وَمَا هِيَ إِلاَّ لإِرْضَاءِ الْمُيُولِ الْبَشَرِيَّةِ.
64001006	Recommendation	وَقَدْ شَهِدَ هؤُلاءِ الإِخْوَةُ، أَمَامَ الْكَنِيسَةِ، شَهَادَةً جَمِيلَةً لِمَحَبَّتِكَ. فَإِنَّكَ تَفْعَلُ حَسَناً إِذَا زَوَّدْتَهُمْ بِمَا يَحْتَاجُونَ إِلَيْهِ فِي السَّفَرِ. فَأَنْتَ تَعْرِفُ أَنَّ هَذَا يُرْضِي اللهَ،
55002023	Recommendation	أَمَّا الْمُجَادَلاَتُ الْغَبِيَّةُ الْحَمْقَاءُ، فَتَجَنَّبْهَا، عَالِماً أَنَّهَا تُوَلِّدُ الْمُشَاجَرَاتِ.
47003018	Faith	وَنَحْنُ جَمِيعاً فِيمَا نَنْظُرُ إِلَى مَجْدِ الرَّبِّ بِوُجُوهٍ كَالْمِرْآةِ لاَ حِجَابَ عَلَيْهَا، نَتَجَلَّى مِنْ مَجْدٍ إِلَى مَجْدٍ لِنُشَابِهَ الصُّورَةَ الْوَاحِدَةَ عَيْنَهَا، وَذَلِكَ بِفِعْلِ الرَّبِّ الرُّوحِ.
58009014	Grace	فَكَمْ بِالأَحْرَى دَمُ الْمَسِيحِ الَّذِي قَدَّمَ نَفْسَهُ لِلهِ بِرُوحٍ أَزَلِيٍّ ذَبِيحَةً لاَ عَيْبَ فِيهَا، يُطَهِّرُ ضَمَائِرَنَا مِنَ الأَعْمَالِ الْمَيِّتَةِ لِنَعْبُدَ اللهَ الْحَيَّ.
44011017	Grace	فَإِنْ كَانَ اللهُ قَدْ سَاوَاهُمْ بِنَا فَأَعْطَاهُمُ الْهِبَةَ الَّتِي أَعْطَانَا إِيَّاهَا، إِذْ آمَنَّا بِالرَّبِّ يَسُوعَ الْمَسِيحِ، فَمَنْ أَكُونُ أَنَا حَتَّى أُعِيقَ اللهَ؟»
49004030	Faith	وَلاَ تُحْزِنُوا رُوحَ اللهِ، الرُّوحَ الْقُدُسَ الَّذِي بِهِ خُتِمْتُمْ لِيَوْمِ الْفِدَاءِ.
66003003	Recommendation	تَذَكَّرْ مَا سَبَقَ أَنْ تَقَبَّلْتَهُ وَسَمِعْتَهُ، وَتَمَسَّكْ بِمَا آمَنْتَ بِهِ، وَتُبْ! فَإِنْ كُنْتَ لاَ تَتَنَبَّهُ، آتِيكَ كَمَا يَأْتِي اللِّصُّ، وَلاَ تَدْرِي فِي أَيَّةِ سَاعَةٍ أُفَاجِئُكَ!
62003007	Recommendation	أَيُّهَا الأَوْلاَدُ الصِّغَارُ، لاَ تَدَعُوا أَحَداً يُضَلِّلُكُمْ. تَأَكَّدُوا أَنَّ مَنْ يُمَارِسُ الصَّلاَحَ، يُظْهِرُ أَنَّهُ بَارٌّ كَمَا أَنَّ الْمَسِيحَ بَارٌّ.
62004001	Recommendation	أَيُّهَا الأَحِبَّاءُ، لاَ تُصَدِّقُوا كُلَّ رُوحٍ، بَلِ امْتَحِنُوا الأَرْوَاحَ لِتَعْرِفُوا مَا إِذَا كَانَتْ مِنْ عِنْدِ اللهِ أَمْ لاَ، لأَنَّ عَدَداً كَبِيراً مِنَ الأَنْبِيَاءِ الدَّجَّالِينَ قَدِ انْتَشَرَ فِي الْعَالَمِ.
44013038	Grace	فَاعْلَمُوا، أَيُّهَا الإِخْوَةُ، أَنَّهُ بِيَسُوعَ تُبَشَّرُونَ بِغُفْرَانِ الْخَطَايَا،
50003001	Recommendation	وَبَعْدُ، يَاإِخْوَتِي، افْرَحُوا فِي الرَّبِّ. لاَ يُزْعِجُنِي أَنْ أَكْتُبَ إِلَيْكُمْ بِالأُمُورِ نَفْسِهَا، فَإِنَّ ذَلِكَ يَجْعَلُكُمْ فِي مَأْمَنٍ.
46011034	Recommendation	وَإِنْ كَانَ أَحَدٌ جَائِعاً فَلْيَأْكُلْ فِي بَيْتِهِ، لِكَيْ لاَ يَكُونَ اجْتِمَاعُكُمْ لِلْحُكْمِ عَلَيْكُمْ. أَمَّا الْمَسَائِلُ الأُخْرَى، فَعِنْدَمَا آتِي أُرَتِّبُهَا.
43018031	Description	فَقَالَ بِيلاَطُسُ: «خُذُوهُ أَنْتُمْ وَحَاكِمُوهُ حَسَبَ شَرِيعَتِكُمْ». فَأَجَابُوهُ: «لاَ يَحِقُّ لَنَا أَنْ نَقْتُلَ أَحَداً!»
46012031	Faith	وَلكِنْ تَشَوَّقُوا إِلَى الْمَوَاهِبِ الْعُظْمَى. وَهَا أَنَا أَرْسُمُ لَكُمْ بَعْدُ طَرِيقاً أَفْضَلَ جِدّاً.
58007026	Description	نَعَمْ، هَذَا هُوَ رَئِيسُ الْكَهَنَةِ الَّذِي كُنَّا مُحْتَاجِينَ إِلَيْهِ. إِنَّهُ قُدُّوسٌ، لاَ عَيْبَةَ فِيهِ، وَلاَ نَجَاسَةَ، قَدِ انْفَصَلَ عَنِ الْخَاطِئِينَ، وَارْتَفَعَ حَتَّى صَارَ أَسْمَى مِنَ السَّمَاوَاتِ.
50004013	Faith	إِنِّي أَسْتَطِيعُ كُلَّ شَيْءٍ، فِي الْمَسِيحِ الَّذِي يُقَوِّينِي.
52004003	Recommendation	فَإِنَّ مَشِيئَةَ اللهِ هِيَ هذِهِ: قَدَاسَتُكُمْ. وَذَلِكَ بِأَنْ تَمْتَنِعُوا عَنِ الزِّنَى،
51004002	Recommendation	دَاوِمُوا عَلَى الصَّلاَةِ، مُتَيَقِّظِينَ فِيهَا بِالشُّكْرِ،
44007029	Description	وَهُنَا هَرَبَ مُوسَى مِنْ مِصْرَ إِلَى بِلاَدِ مَدْيَانَ، وَعَاشَ فِيهَا غَرِيباً. وَهُنَاكَ أَنْجَبَ وَلَدَيْنِ.
46011007	Description	ذَلِكَ لأَنَّ الرَّجُلَ عَلَيْهِ أَلاَّ يُغَطِّيَ رَأْسَهُ، بِاعْتِبَارِهِ صُورَةَ اللهِ وَمَجْدَهُ. وَأَمَّا الْمَرْأَةُ فَهِيَ مَجْدُ الرَّجُلِ.
51003015	Faith	وَلْيَمْلِكْ فِي قُلُوبِكُمْ سَلاَمُ الْمَسِيحِ، فَإِلَيْهِ قَدْ دُعِيتُمْ فِي الْجَسَدِ الْوَاحِدِ؛ وَكُونُوا شَاكِرِينَ!
58002010	Grace	فَلَمَّا قَصَدَ اللهُ، الَّذِي مِنْ أَجْلِهِ كُلُّ شَيْءٍ وَبِهِ كُلُّ شَيْءٍ، أَنْ يُحْضِرَ إِلَى الْمَجْدِ أَبْنَاءً كَثِيرِينَ، كَانَ مِنَ اللاَّئِقِ أَنْ يَجْعَلَ قَائِدَهُمْ إِلَى الْخَلاَصِ مُؤَهَّلاً عَنْ طَرِيقِ الآلاَمِ.
59004001	Sin	مِنْ أَيْنَ النِّزَاعُ وَالْخِصَامُ بَيْنَكُمْ؟ أَلَيْسَ مِنْ لَذَّاتِكُمْ تِلْكَ الْمُتَصَارِعَةِ فِي أَعْضَائِكُمْ؟
46005001	Sin	قَدْ شَاعَ فِعْلاً أَنَّ بَيْنَكُمْ زِنىً. وَمِثْلُ هَذَا الزِّنَى لاَ يُوجَدُ حَتَّى بَيْنَ الْوَثَنِيِّينَ. ذَلِكَ بِأَنَّ رَجُلاً مِنْكُمْ يُعَاشِرُ زَوْجَةَ أَبِيهِ.
46010013	Faith	لَمْ يُصِبْكُمْ مِنَ التَّجَارِبِ إِلاَّ مَا هُوَ بَشَرِيٌّ. وَلَكِنَّ اللهَ أَمِينٌ وَجَدِيرٌ بِالثِّقَةِ، فَلاَ يَدَعُكُمْ تُجَرَّبُونَ فَوْقَ مَا تُطِيقُونَ، بَلْ يُدَبِّرُ لَكُمْ مَعَ التَّجْرِبَةِ سَبِيلَ الْخُرُوجِ مِنْهَا لِتُطِيقُوا احْتِمَالَهَا.
44020029	Violence	فَإِنِّي أَعْلَمُ أَنَّهُ بَعْدَ رَحِيلِي سَيَنْدَسُّ بَيْنَكُمْ ذِئَابٌ خَاطِفَةٌ، لاَ تُشْفِقُ عَلَى الْقَطِيعِ.
53001004	Faith	حَتَّى إِنَّنَا، نَحْنُ أَنْفُسَنَا، نَفْتَخِرُ بِكُمْ فِي كَنَائِسِ اللهِ بِسَبَبِ ثَبَاتِكُمْ وَإِيمَانِكُمْ فِي وَسَطِ كُلِّ مَا تَحْتَمِلُونَهُ مِنِ اضْطِهَادَاتٍ وَضِيقَاتٍ.
62004012	Faith	إِنَّ اللهَ لَمْ يَرَهُ أَحَدٌ مِنَ النَّاسِ قَطُّ. وَلكِنْ، حِينَ نُحِبُّ بَعْضُنَا بَعْضاً، نُبَيِّنُ أَنَّ اللهَ يَحْيَا فِي دَاخِلِنَا، وَأَنَّ مَحَبَّتَهُ قَدِ اكْتَمَلَتْ فِي دَاخِلِنَا.
48001001	Description	مِنْ بُولُسَ، وَهُوَ رَسُولٌ، لاَ مِنْ قِبَلِ النَّاسِ وَلاَ بِسُلْطَةِ إِنْسَانٍ، بَلْ بِسُلْطَةِ يَسُوعَ الْمَسِيحِ وَاللهِ الآبِ الَّذِي أَقَامَهُ مِنْ بَيْنِ الأَمْوَاتِ،
58012003	Recommendation	فَتَأَمَّلُوا مَلِيّاً مَا قَاسَاهُ بِتَحَمُّلِهِ تِلْكَ الْمُعَامَلَةَ الْعَنِيفَةَ الَّتِي عَامَلَهُ بِهَا الْخَاطِئُونَ، لِكَيْ لاَ تَتْعَبُوا وَتَنْهَارُوا!
45006005	Faith	فَمَا دُمْنَا قَدِ اتَّحَدْنَا بِهِ فِي مَوْتٍ يُشْبِهُ مَوْتَهُ، فَإِنَّنَا سَنَتَّحِدُ بِهِ أَيْضاً فِي قِيَامَتِهِ.
45015010	Recommendation	وَأَيْضاً قِيلَ: «افْرَحُوا، أَيُّهَا الأُمَمُ، مَعَ شَعْبِهِ».
54004001	Sin	إِلَّا أَنَّ الرُّوحَ يُعْلِنُ صَرَاحَةً أَنَّ قَوْماً فِي الأَزْمِنَةِ الأَخِيرَةِ سَوْفَ يَرْتَدُّونَ عَنِ الإِيمَانِ، مُنْسَاقِينَ وَرَاءَ أَرْوَاحٍ مُضَلِّلَةٍ وَتَعَالِيمَ شَيْطَانِيَّةٍ،
56003001	Recommendation	ذَكِّرِ الْمُؤْمِنِينَ أَنْ يَخْضَعُوا لِلْحُكَّامِ وَالسُّلُطَاتِ، وَيُطِيعُوا الْقَانُونَ، وَيَكُونُوا مُسْتَعِدِّينَ لِكُلِّ عَمَلٍ صَالِحٍ،
61003005	Sin	إِنَّهُمْ يَتَنَاسُونَ، عَمْداً، أَنَّهُ بِكَلِمَةِ أَمْرٍ مِنَ اللهِ وُجِدَتِ السَّمَاوَاتُ مُنْذُ الْقَدِيمِ وَتَكَوَّنَتِ الأَرْضُ مِنَ الْمَاءِ وَبِالْمَاءِ.
60003018	Grace	فَإِنَّ الْمَسِيحَ نَفْسَهُ مَاتَ مَرَّةً وَاحِدَةً لِكَيْ يَحُلَّ مُشْكِلَةَ الْخَطَايَا. فَمَعَ أَنَّهُ هُوَ البَارُّ، فَقَدْ تَأَلَّمَ مِنْ أَجْلِنَا نَحْنُ الْمُذْنِبِينَ، لِكَيْ يُقَرِّبَنَا إِلَى اللهِ، فَمَاتَ بِجِسْمِهِ الْبَشَرِيِّ، ثُمَّ عَادَ حَيّاً بِالرُّوحِ.
61002021	Sin	وَبِالْحَقِيقَةِ، كَانَ أَفْضَلَ لَهُمْ لَوْ أَنَّهُمْ لَمْ يَتَعَرَّفُوا بِطَرِيقِ الْبِرِّ، مِنْ أَنْ يَتَعَرَّفُوا بِهِ ثُمَّ يَرْتَدُّوا عَنِ الْوَصِيَّةِ الْمُقَدَّسَةِ الَّتِي تَسَلَّمُوهَا.
53003006	Recommendation	ثُمَّ نُوصِيكُمْ، أَيُّهَا الإِخْوَةُ، بِاسْمِ رَبِّنَا يَسُوعَ الْمَسِيحِ، أَنْ تَعْتَزِلُوا عَنْ كُلِّ أَخٍ يَسْلُكُ سُلُوكاً فَوْضَوِيّاً، لاَ يُوَافِقُ التَّعْلِيمَ الَّذِي تَلَقَّيْتُمُوهُ مِنَّا.
45005012	Sin	وَلِهَذَا، فَكَمَا دَخَلَتِ الْخَطِيئَةُ إِلَى الْعَالَمِ عَلَى يَدِ إِنْسَانٍ وَاحِدٍ، وَبِدُخُولِ الْخَطِيئَةِ دَخَلَ الْمَوْتُ، هَكَذَا جَازَ الْمَوْتُ عَلَى جَمِيعِ الْبَشَرِ، لأَنَّهُمْ جَمِيعاً أَخْطَأُوا.
58011033	Faith	فَبِالإِيمَانِ، تَغَلَّبَ هؤُلاَءِ عَلَى مَمَالِكِ الأَعْدَاءِ، وَحَكَمُوا حُكْماً عَادِلاً وَنَالُوا مَا وَعَدَهُمْ بِهِ اللهُ. وَبِهِ، سَدُّوا أَفْوَاهَ الأُسُودِ،
47004009	Faith	يُطَارِدُنَا الاضْطِهَادُ، وَلَكِنْ لاَ يَتَخَلَّى اللهُ عَنَّا. نُطْرَحُ أَرْضاً، وَلَكِنْ لاَ نَمُوتُ.
59004004	Sin	أَيُّهَا الْخَوَنَةُ! أَلَسْتُمْ تَعْلَمُونَ أَنَّ مُصَادَقَةَ الْعَالَمِ هِيَ مُعَادَاةٌ لِلهِ؟ فَالَّذِي يُرِيدُ أَنْ يُصَادِقَ الْعَالَمَ، يَجْعَلُ نَفْسَهُ عَدُوّاً لِلهِ.
44016006	Description	وَمَنَعَهُمُ الرُّوحُ الْقُدُسُ مِنَ التَّبْشِيرِ فِي مُقَاطَعَةِ أَسِيَّا، فَسَافَرُوا فِي مُقَاطَعَتَيْ فِرِيجِيَّةَ وَغَلاَطِيَّةَ.
45010006	Faith	غَيْرَ أَنَّ الْبِرَّ الآتِيَ مِنَ الإِيمَانِ يَقُولُ هَذَا: «لاَ تَقُلْ فِي قَلْبِكَ: مَنْ يَصْعَدُ إِلَى السَّمَاوَاتِ؟» (أَيْ لِيُنْزِلَ الْمَسِيحَ)،
66016002	Violence	فَذَهَبَ الْمَلاَكُ الأَوَّلُ وَسَكَبَ كَأْسَهُ عَلَى الأَرْضِ، فَخَرَجَتْ مِنْهَا قُرُوحٌ خَبِيثَةٌ أَصَابَتْ جَمِيعَ النَّاسِ الَّذِينَ عَلَيْهِمْ عَلاَمَةُ الْوَحْشِ وَالَّذِينَ يَسْجُدُونَ لِتِمْثَالِهِ.
66005008	Description	فَسَجَدَ الشُّيُوخُ الأَرْبَعَةُ وَالْعِشْرُونَ وَالْكَائِنَاتُ الْحَيَّةُ الأَرْبَعَةُ أَمَامَ الْحَمَلِ، وَكَانَ بِيَدِ كُلٍّ مِنْهُمْ قِيثَارَةٌ وَكُؤُوسُ ذَهَبٍ مَمْلُوءَةٌ بِالْبَخُورِ، الَّذِي هُوَ صَلَوَاتُ الْقِدِّيسِينَ.
62005001	Faith	كُلُّ مَنْ يُؤْمِنُ حَقّاً أَنَّ يَسُوعَ هُوَ الْمَسِيحُ، فَهُوَ مَوْلُودٌ مِنَ اللهِ. وَمَنْ يُحِبُّ الْوَالِدَ، فَلاَبُدَّ أَنْ يُحِبَّ الْمَوْلُودِينَ مِنْهُ أَيْضاً.
48005026	Recommendation	لاَ نَكُنْ طَامِحِينَ إِلَى الْمَجْدِ الْبَاطِلِ، يَسْتَفِزُّ بَعْضُنَا بَعْضاً، وَيَحْسُدُ أَحَدُنَا الآخَرَ!
54005001	Recommendation	لاَ تُوَبِّخْ شَيْخاً تَوْبِيخاً قَاسِياً، بَلْ عِظْهُ كَأَنَّهُ أَبٌ لَكَ. وَعَامِلِ الشُّبَّانَ كَأَنَّهُمْ إِخْوَةٌ لَكَ؛
60002012	Recommendation	وَلْيَكُنْ سُلُوكُكُمْ بَيْنَ الأُمَمِ سُلُوكاً حَسَناً. فَمَعَ أَنَّهُمْ يَتَّهِمُونَكُمْ زُوراً بِأَنَّكُمْ تَفْعَلُونَ الشَّرَّ، فَحِينَ يُلاَحِظُونَ أَعْمَالَكُمُ الصَّالِحَةَ يُمَجِّدُونَ اللهَ يَوْمَ يَفْتَقِدُهُمْ.
50003006	Sin	وَمِنْ جِهَةِ الْحَمَاسَةِ، مُضْطَهِدٌ لِلْكَنِيسَةِ؛ وَمِنْ جِهَةِ الْبِرِّ الْمَطْلُوبِ فِي الشَّرِيعَةِ، كُنْتُ بِلاَ لَوْمٍ.
43004052	Description	فَسَأَلَهُمْ فِي أَيَّةِ سَاعَةٍ تَعَافَى، أَجَابُوهُ: «فِي السَّاعَةِ السَّابِعَةِ مَسَاءَ الْبَارِحَةِ، وَلَّتْ عَنْهُ الْحُمَّى».
43019031	Violence	وَلَمَّا كَانَ الإِعْدَادُ يَتِمُّ فِي ذَلِكَ الْيَوْمِ، طَلَبَ الْيَهُودُ مِنْ بِيلاَطُسَ أَنْ تُكْسَرَ سِيقَانُ الْمَصْلُوبِينَ، فَتُؤْخَذَ جُثَثُهُمْ لِئَلاَّ تَبْقَى مُعَلَّقَةً عَلَى الصَّلِيبِ يَوْمَ السَّبْتِ، وَلاَ سِيَّمَا لأَنَّ ذلِكَ السَّبْتَ كَانَ يَوْماً عَظِيماً.
43019012	Description	مِنْ أَجْلِ ذلِكَ سَعَى بِيلاَطُسُ أَنْ يُطْلِقَهُ، وَلَكِنَّ الْيَهُودَ صَرَخُوا: «إِنْ أَطْلَقْتَ هَذَا، فَلَسْتَ مُحِبّاً لِلْقَيْصَرِ. فَإِنَّ كُلَّ مَنْ يَجْعَلُ نَفْسَهُ مَلِكاً، يُعَادِي الْقَيْصَرَ».
43014001	Faith	«لاَ تَضْطَرِبْ قُلُوبُكُمْ. أَنْتُمْ تُؤْمِنُونَ بِاللهِ، فَآمِنُوا بِي أَيْضاً.
50001028	Faith	غَيْرَ مُرْتَعِبِينَ فِي شَيْءٍ مِنَ الَّذِينَ يُقَاوِمُونَكُمْ، فَإِنَّ فِي مُقَاوَمَتِهِمْ دَلِيلاً عَلَى هَلاَكِهِمْ هُمْ وَعَلَى خَلاَصِكُمْ أَنْتُمْ، وَذَلِكَ مِنْ عِنْدِ اللهِ.
43015016	Grace	لَيْسَ أَنْتُمُ اخْتَرْتُمُونِي، بَلْ أَنَا اخْتَرْتُكُمْ وَعَيَّنْتُكُمْ لِتَنْطَلِقُوا وَتُنْتِجُوا ثَمَراً وَيَدُومَ ثَمَرُكُمْ، فَيُعْطِيَكُمُ الآبُ كُلَّ مَا تَطْلُبُونَهُ بِاسْمِي.
58011004	Faith	بِالإِيمَانِ، قَدَّمَ هَابِيلُ لِلهِ ذَبِيحَةً أَفْضَلَ مِنْ تِلْكَ الَّتِي قَدَّمَهَا قَايِينُ. وَعَلَى ذَلِكَ الأَسَاسِ، شَهِدَ اللهُ بِأَنَّ هَابِيلَ بَارٌّ، إِذْ قَبِلَ التَّقْدِمَةَ الَّتِي قَدَّمَهَا لَهُ. وَمَعَ أَنَّ هَابِيلَ مَاتَ قَتْلاً، فَإِنَّهُ مَازَالَ الآنَ يُلَقِّنُنَا الْعِبَرَ بِإِيمَانِهِ.
