51003008	Recommendation	وَأَمَّا الآنَ، فَانْزِعُوا عَنْكُمْ، أَنْتُمْ أَيْضاً، هذِهِ الْخَطَايَا كُلَّهَا: الْغَضَبَ، النَّقْمَةَ، الْخُبْثَ، التَّجْدِيفَ، الْكَلاَمَ الْقَبِيحَ الْخَارِجَ مِنْ أَفْوَاهِكُمْ.
44018003	Description	وَإِذْ كَانَ مِنْ أَهْلِ مِهْنَتِهِمَا، وَهِيَ صِنَاعَةُ الْخِيَامِ، أَقَامَ عِنْدَهُمَا وَكَانَ يَشْتَغِلُ مَعَهُمَا.
45006012	Sin	إِذَنْ، لاَ تَمْلِكَنَّ الْخَطِيئَةُ فِي جَسَدِكُمُ الْمَائِتِ فَتَنْقَادُوا لَهَا فِي شَهَوَاتِهِ.
53003012	Recommendation	فَمِثْلُ هَؤُلاَءِ نُوصِيهِمْ وَنُنَاشِدُهُمْ، فِي الرَّبِّ يَسُوعَ الْمَسِيحِ، أَنْ يَكْسِبُوا مَعِيشَتَهُمْ بِأَنْفُسِهِمْ، مُشْتَغِلِينَ بِهُدُوءٍ.
44007009	Sin	وَحَسَدَ الآبَاءُ الأَوَّلُونَ يُوسُفَ وَبَاعُوهُ، فَأَصْبَحَ عَبْداً فِي مِصْرَ. وَلَكِنَّ اللهَ كَانَ مَعَهُ،
44011028	Description	وَبَيْنَهُمْ نَبِيٌّ اسْمُهُ أَغَابُوسُ، تَنَبَّأَ بِوَحْيٍ مِنَ الرُّوحِ أَنَّ مَجَاعَةً عَظِيمَةً سَتَحْدُثُ فِي الْبِلاَدِ كُلِّهَا. وَقَدْ وَقَعَتْ هذِهِ الْمَجَاعَةُ فِعْلاً فِي عَهْدِ الْقَيْصَرِ كُلُودِيُوسَ.
44020036	Description	وَبَعْدَ هَذَا الْكَلاَمِ رَكَعَ بُولُسُ مَعَهُمْ جَمِيعاً وَصَلَّى.
48005024	Faith	وَلَكِنَّ الَّذِينَ صَارُوا خَاصَّةً لِلْمَسِيحِ، قَدْ صَلَبُوا الْجَسَدَ مَعَ الأَهْوَاءِ وَالشَّهَوَاتِ.
59001002	Recommendation	يَاإِخْوَتِي، عِنْدَمَا تَنْزِلُ بِكُمُ التَّجَارِبُ وَالْمِحَنُ الْمُخْتَلِفَةُ، اعْتَبِرُوهَا سَبِيلاً إِلَى الْفَرَحِ الْكُلِّيِّ.
62001006	Sin	فَإِنْ كُنَّا نَدَّعِي أَنَّ لَنَا شَرِكَةً مَعَهُ، وَنَحْنُ نَعِيشُ فِي الظَّلاَمِ، نَكُونُ كَاذِبِينَ وَلاَ نُمَارِسُ الْحَقَّ.
44010011	Description	فَرَأَى رُؤْيَا: السَّمَاءَ مَفْتُوحَةً، وَوِعَاءً يُشْبِهُ قِطْعَةً كَبِيرَةً مِنَ الْقُمَاشِ مَرْبُوطَةً بِأَطْرَافِهَا الأَرْبَعَةِ يَتَدَلَّى إِلَى الأَرْضِ،
44002009	Description	فَبَعْضُنَا فَرْتِيُّونَ، وَمَادِيُّونَ، وَعِيلاَمِيُّونَ. وَبَعْضُنَا مِنْ سُكَّانِ مَا بَيْنَ النَّهْرَيْنِ وَالْيَهُودِيَّةِ، وَكَبَّدُوكِيَّةَ، وَبُنْتُسَ، وَأَسِيَّا،
51001010	Faith	لِكَيْ تَسْلُكُوا سُلُوكاً لاَئِقاً بِالرَّبِّ وَمُرْضِياً فِي كُلِّ شَيْءٍ، مُنْتِجِينَ الثَّمَرَ فِي كُلِّ عَمَلٍ صَالِحٍ وَنَامِينَ فِي مَعْرِفَةِ اللهِ إِلَى التَّمَامِ،
54001018	Recommendation	هذِهِ التَّوْصِيَاتُ، يَاتِيمُوثَاوُسُ وَلَدِي، أُسَلِّمُهَا لَكَ، بِمُقْتَضَى النُّبُوآتِ السَّابِقَةِ الْمُخْتَصَّةِ بِكَ، وَغَايَتِي أَنْ تُحْسِنَ الْجِهَادَ فِي حَرْبِكَ الرُّوحِيَّةِ،
66019001	Faith	وَبَعْدَ هَذَا سَمِعْتُ صَوْتاً عَالِياً كَأَنَّهُ صَادِرٌ مِنْ جَمْعٍ كَبِيرٍ فِي السَّمَاءِ يَقُولُ: «هَلِّلُويَا! الْخَلاَصُ وَالْمَجْدُ وَالْكَرَامَةُ وَالْقُدْرَةُ لِلرَّبِّ إِلَهِنَا
49002001	Grace	وَأَنْتُمْ كُنْتُمْ فِي السَّابِقِ أَمْوَاتاً بِذُنُوبِكُمْ وَخَطَايَاكُمْ،
46010021	Sin	فَلاَ تَسْتَطِيعُونَ أَنْ تَشْرَبُوا كَأْسَ الرَّبِّ وَكَأْسَ الشَّيَاطِينِ مَعاً، وَلاَ أَنْ تَشْتَرِكُوا فِي مَائِدَةِ الرَّبِّ وَمَائِدَةِ الشَّيَاطِينِ مَعاً،
49005003	Recommendation	أَمَّا الزِّنَى، وَكُلُّ نَجَاسَةٍ أَوْ شَهْوَةٍ نَهِمَةٍ، فَلاَ يُذْكَرْ بَيْنَكُمْ حَتَّى اسْمُهَا، كَمَا يَلِيقُ بِالْقِدِّيسِينَ.
56001015	Sin	عِنْدَ الطَّاهِرِينَ، كُلُّ شَيْءٍ طَاهِرٌ. أَمَّا عِنْدَ النَّجِسِينَ وَغَيْرِ الْمُؤْمِنِينَ، فَمَا مِنْ شَيْءٍ طَاهِرٍ، بَلْ إِنَّ عُقُولَهُمْ وَضَمَائِرَهُمْ أَيْضاً قَدْ صَارَتْ نَجِسَةً.
44009021	Description	وَأَثَارَ كَلاَمُهُ دَهْشَةَ السَّامِعِينَ، فَتَسَاءَلُوا: «أَلَيْسَ هَذَا هُوَ الَّذِي كَانَ يُبِيدُ جَمِيعَ الدَّاعِينَ بِهَذَا الاِسْمِ فِي أُورُشَليمَ؟ أَمَا جَاءَ إِلَى هُنَا لِيُلْقِيَ الْقَبْضَ عَلَيْهِمْ وَيَسُوقَهُمْ مُقَيَّدِينَ إِلَى رُؤَسَاءِ الْكَهَنَةِ؟»
58008006	Description	فَرَئِيسُ كَهَنَتِنَا، إِذَنْ، قَدْ حَصَلَ عَلَى خِدْمَةٍ أَفْضَلَ مِنْ خِدْمَةِ الْكَهَنُوتِ الأَرْضِيِّ، لِكَوْنِهِ الْوَسِيطَ الَّذِي أَعْلَنَ لَنَا قِيَامَ عَهْدٍ جَدِيدٍ أَفْضَلَ مِنَ الْعَهْدِ السَّابِقِ، وَلِكَوْنِ هَذَا الْعَهْدِ الْجَدِيدِ يَنْطَوِي عَلَى وُعُودٍ أَفْضَلَ.
50001021	Faith	فَالْحَيَاةُ عِنْدِي هِيَ الْمَسِيحُ، وَالْمَوْتُ رِبْحٌ لِي.
50001006	Faith	وَلِي ثِقَةٌ فِي هَذَا الأَمْرِ بِالذَّاتِ: أَنَّ الَّذِي بَدَأَ فِيكُمْ عَمَلاً صَالِحاً سَوْفَ يُتَمِّمُهُ إِلَى يَوْمِ الْمَسِيحِ يَسُوعَ.
62005020	Faith	وَإِنَّنَا نَعْلَمُ أَنَّ ابْنَ اللهِ قَدْ جَاءَ إِلَى الأَرْضِ وَأَنَارَ أَذْهَانَنَا لِنَعْرِفَ الإِلهَ الْحَقَّ. وَنَحْنُ الآنَ نَحْيَا فِيهِ، لأَنَّنَا فِي ابْنِهِ يَسُوعَ الْمَسِيحِ. هَذَا هُوَ الإِلهُ الْحَقُّ، وَالْحَيَاةُ الأَبَدِيَّةُ.
45012018	Recommendation	إِنْ كَانَ مُمْكِناً، فَمَادَامَ الأَمْرُ يَتَعَلَّقُ بِكُمْ، عِيشُوا فِي سَلاَمٍ مَعَ جَمِيعِ النَّاسِ.
58010023	Faith	وَلْنَتَمَسَّكْ دَائِماً بِالرَّجَاءِ الَّذِي نَعْتَرِفُ بِهِ، دُونَ أَنْ نَشُكَّ فِي أَنَّهُ سَيَتَحَقَّقُ، لأَنَّ الَّذِي وَعَدَنَا بِتَحْقِيقِهِ، هُوَ أَمِينٌ وَصَادِقٌ.
43014027	Grace	سَلاماً أَتْرُكُ لَكُمْ. سَلاَمِي أُعْطِيكُمْ. لَيْسَ كَمَا يُعْطِي الْعَالَمُ أُعْطِيكُمْ أَنَا. فَلاَ تَضْطَرِبْ قُلُوبُكُمْ، وَلاَ تَرْتَعِبْ.
47005006	Faith	لِذَلِكَ نَحْنُ وَاثِقُونَ دَائِماً، وَعَالِمُونَ أَنَّنَا مَادُمْنَا مُقِيمِينَ فِي الْجَسَدِ، نَبْقَى مُغْتَرِبِينَ عَنِ الرَّبِّ،
43012047	Grace	وَإِذَا سَمِعَ أَحَدٌ كَلاَمِي وَلَمْ يُؤْمِنْ بِهِ، فَأَنَا لاَ أَحْكُمُ عَلَيْهِ، فَقَدْ جِئْتُ لاَ لأَحْكُمَ عَلَى الْعَالَمِ، بَلْ لأُخَلِّصَ الْعَالَمَ.
62003012	Sin	لاَ أَنْ نَكُونَ مِثْلَ قَايِينَ الَّذِي قَتَلَ أَخَاهُ. فَقَايِينُ كَانَ مِنْ أَوْلاَدِ إِبْلِيسَ الشِّرِّيرِ. وَلِمَاذَا قَتَلَ أَخَاهُ؟ قَتَلَهُ لأَنَّ أَعْمَالَهُ هُوَ كَانَتْ شِرِّيرَةً، أَمَّا أَعْمَالُ أَخِيهِ فَكَانَتْ صَالِحَةً.
66016020	Description	وَهَرَبَتِ الْجُزُرُ كُلُّهَا، وَاخْتَفَتِ الْجِبَالُ.
58011012	Description	وَهكَذَا وُلِدَ مِنْ إِبْرَاهِيمَ، وَقَدْ كَانَ مَيِّتاً مِنْ حَيْثُ الْقُدْرَةُ عَلَى الإِنْجَابِ، شَعْبٌ كَبِيرٌ «كَنُجُومِ الْفَضَاءِ عَدَداً، وَكَالرَّمْلِ الَّذِي عَلَى شَطِّ الْبَحْرِ، لاَ يُحْصَى».
54001017	Faith	فَلِلْمَلِكِ الأَزَلِيِّ، اللهِ الْوَاحِدِ غَيْرِ الْمَنْظُورِ وَغَيْرِ الْفَانِي، الْكَرَامَةُ وَالْمَجْدُ إِلَى أَبَدِ الآبِدِينَ. آمِين!
66014007	Faith	وَهُوَ يُنَادِي عَالِياً: «اتَّقُوا اللهَ وَمَجِّدُوهُ، فَقَدْ حَانَتْ سَاعَةُ دَيْنُونَتِهِ. اسْجُدُوا لِمَنْ خَلَقَ السَّمَاءَ وَالأَرْضَ وَالْبَحْرَ وَالْيَنَابِيعَ».
44006001	Description	وَإِذْ تَكَاثَرَ التَّلاَمِيذُ فِي تِلْكَ الأَيَّامِ، احْتَجَّ الْيَهُودُ الْيُونَانِيُّونَ عَلَى الْعِبْرَانِيِّينَ، لأَنَّ أَرَامِلَهُمْ لَمْ يَكُنَّ يَحْصُلْنَ عَلَى نَصِيبٍ مِنَ الإِعَانَاتِ الْيَوْمِيَّةِ.
60002021	Grace	لأَنَّ اللهَ دَعَاكُمْ إِلى الاشْتِرَاكِ فِي هَذَا النَّوْعِ مِنَ الآلاَمِ. فَالْمَسِيحُ، الَّذِي تَأَلَّمَ لأَجْلِكُمْ، هُوَ الْقُدْوَةُ الَّتِي تَقْتَدُونَ بِهَا. فَسِيرُوا عَلَى آثَارِ خُطُوَاتِهِ:
53003010	Recommendation	فَلَمَّا كُنَّا عِنْدَكُمْ، أَوْصَيْنَاكُمْ بِهَذَا الْمَبْدَأ: إِنْ كَانَ أَحَدٌ لاَ يُرِيدُ أَنْ يَشْتَغِلَ، فَلاَ يَأْكُلْ!
43003016	Grace	لأَنَّهُ هكَذَا أَحَبَّ اللهُ الْعَالَمَ حَتَّى بَذَلَ ابْنَهُ الْوَحِيدَ، لِكَيْ لاَ يَهْلِكَ كُلُّ مَنْ يُؤْمِنُ بِهِ، بَلْ تَكُونُ لَهُ الْحَيَاةُ الأَبَدِيَّةُ.
44019015	Description	فَأَجَابَهُمُ الرُّوحُ الشِّرِّيرُ: «يَسُوعُ أَنَا أَعْرِفُهُ، وَبُولُسُ أَفْهَمُهُ. وَلكِنْ، مَنْ أَنْتُمْ؟»
66019019	Violence	وَرَأَيْتُ الْوَحْشَ وَمُلُوكَ الأَرْضِ وَجُيُوشَهُمْ وَقَدِ احْتَشَدُوا لِيُحَارِبُوا هَذَا الْفَارِسَ وَجَيْشَهُ.
44027002	Description	فَرَكِبْنَا سَفِينَةً قَادِمَةً مِنْ أَدْرَامِيتَ، مُتَّجِهَةً إِلَى مَوَانئِ مُقَاطَعَةِ أَسِيَّا. وَرَافَقَنَا فِي الرِّحْلَةِ أَرَسْتَرْخُسُ مِنْ مَدِينَةِ تَسَالُونِيكِي فِي مُقَاطَعَةِ مَقِدُونِيَّةَ.
58013003	Recommendation	اهْتَمُّوا دَائِماً بِالْمَسْجُونِينَ، كَأَنَّكُمْ مَسْجُونُونَ مَعَهُمْ. وَتَعَاطَفُوا مَعَ الْمَظْلُومِينَ، كَأَنَّكُمْ مَظْلُومُونَ مَعَهُمْ.
51003017	Recommendation	وَمَهْمَا كَانَ مَا تَعْمَلُونَهُ، بِالْقَوْلِ أَوْ بِالْفِعْلِ، فَلْيَجْرِ كُلُّ شَيْءٍ بِاسْمِ الرَّبِّ يَسُوعَ، رَافِعِينَ بِهِ الشُّكْرَ لِلهِ الآبِ.
48006006	Recommendation	لِيُشَارِكِ الَّذِي يَتَعَلَّمُ الْكَلِمَةَ مَنْ يُعَلِّمُهَا، فِي جَمِيعِ الْخَيْرَاتِ.
44007005	Description	وَلَمْ يُعْطِهِ هُنَا مِلْكاً، وَلاَ مَوْطِئَ قَدَمٍ. وَمَعَ أَنَّهُ كَانَ وَقْتَئِذٍ بِلاَ وَلَدٍ، فَإِنَّ اللهَ وَعَدَهُ بِأَنْ يُعْطِيَ هَذَا الْبَلَدَ لَهُ وَلِنَسْلِهِ مِنْ بَعْدِهِ.
44007019	Description	فَغَدَرَ بِشَعْبِنَا، وَأَسَاءَ مُعَامَلَةَ آبَائِنَا، حَتَّى أَجْبَرَهُمْ عَلَى التَّخَلِّي عَنْ أَطْفَالِهِمْ لِيَمُوتُوا.
43020003	Description	فَخَرَجَ بُطْرُسُ وَالتِّلْمِيذُ الآخَرُ وَتَوَجَّهَا إِلَى الْقَبْرِ.
44024016	Faith	لِذَلِكَ أَنَا أَيْضاً أُدَرِّبُ نَفْسِي لِكَيْ أَحْيَا دَائِماً بِضَمِيرٍ نَقِيٍّ أَمَامَ اللهِ وَالنَّاسِ.
65001013	Description	وَبِأَعْمَالِهِمِ الْمُخْجِلَةِ يَفْضَحُونَ أَنْفُسَهُمْ كَأَمْوَاجٍ فِي الْبَحْرِ هَائِجَةٍ تَقْذِفُ الأَوْسَاخَ. وَهُمْ أَشْبَهُ بِنُجُومٍ تَائِهَةٍ فِي الْفَضَاءِ، مَصِيرُهَا الظَّلامُ الشَّدِيدُ إِلَى الأَبَدِ!
48001012	Description	فَلاَ أَنَا تَسَلَّمْتُهُ مِنْ إِنْسَانٍ، وَلاَ تَلَقَّنْتُهُ، بَلْ جَاءَنِي بِإِعْلاَنٍ مِنْ يَسُوعَ الْمَسِيحِ.
45007005	Sin	فَعِنْدَمَا كُنَّا فِي الْجَسَدِ، كَانَتْ أَهْوَاءُ الْخَطَايَا الْمُعْلَنَةِ فِي الشَّرِيعَةِ عَامِلَةً فِي أَعْضَائِنَا لِكَيْ نُثْمِرَ لِلْمَوْتِ.
54002007	Faith	وَلَهَا قَدْ عُيِّنْتُ أَنَا مُبَشِّراً وَرَسُولاً، الْحَقَّ أَقُولُ وَلَسْتُ أَكْذِبُ، مُعَلِّماً لِلأُمَمِ فِي الإِيمَانِ وَالْحَقِّ.
62003024	Faith	وَكُلُّ مَنْ يُطِيعُ وَصَايَا اللهِ، فَإِنَّهُ يَثْبُتُ فِي اللهِ، وَاللهُ يَثْبُتُ فِيهِ. وَالَّذِي يُؤَكِّدُ لَنَا أَنَّ اللهَ يَثْبُتُ فِينَا، هُوَ الرُّوحُ الْقُدُسُ الَّذِي وَهَبَهُ لَنَا.
46010024	Recommendation	فَلاَ يَسْعَ أَحَدٌ إِلَى مَصْلَحَةِ نَفْسِهِ، بَلْ إِلَى مَصْلَحَةِ غَيْرِهِ!
45012016	Recommendation	كُونُوا مُتَوَافِقِينَ بَعْضُكُمْ مَعَ بَعْضٍ، غَيْرَ مُهْتَمِّينَ بِالأُمُورِ الْعَالِيَةِ، بَلْ مُسَايِرِينَ ذَوِي الْمَرَاكِزِ الْوَضِيعَةِ. لاَ تَكُونُوا حُكَمَاءَ فِي نَظَرِ أَنْفُسِكُمْ.
49004031	Recommendation	انْزِعُوا عَنْكُمْ كُلَّ حِقْدٍ وَنَقْمَةٍ وَغَضَبٍ وَصَخَبٍ وَسُبَابٍ وَكَلَّ شَرٍّ.
51001025	Faith	وَلَهَا قَدْ صِرْتُ أَنَا خَادِماً بِمُوجِبِ تَدْبِيرِ اللهِ الْمَوْهُوبِ لِي مِنْ أَجْلِكُمْ، وَهُوَ أَنْ أُتَمِّمَ كَلِمَةَ اللهِ، بِإِعْلاَنِ
66001014	Description	شَعْرُ رَأْسِهِ نَاصِعُ الْبَيَاضِ كَالصُّوفِ أَوِ الثَّلْجِ، وَعَيْنَاهُ كَشُعْلَةٍ مُلْتَهِبَةٍ.
47004015	Grace	فَإِنَّ جَمِيعَ الأَشْيَاءِ نُقَاسِيهَا مِنْ أَجْلِكُمْ، حَتَّى إِذَا فَاضَتِ النِّعْمَةُ فِي الْكَثِيرِينَ، تَجْعَلُ الشُّكْرَ يَفِيضُ لأَجْلِ مَجْدِ اللهِ.
43006056	Faith	وَكُلُّ مَنْ يَأْكُلُ جَسَدِي وَيَشْرَبُ دَمِي، يَثْبُتُ فِيَّ وَأَنَا فِيهِ.
43011027	Faith	أَجَابَتْهُ: «نَعَمْ يَاسَيِّدُ. أَنَا قَدْ آمَنْتُ أَنَّكَ أَنْتَ الْمَسِيحُ ابْنُ اللهِ الَّذِي جَاءَ إِلَى الْعَالَمِ!»
44002042	Faith	وَكَانَ الْجَمِيعُ يُدَاوِمُونَ عَلَى تَلَقِّي تَعْلِيمِ الرُّسُلِ، وَعَلَى حَيَاةِ الشَّرِكَةِ، وَكَسْرِ الْخُبْزِ، وَالصَّلَوَاتِ.
58001009	Grace	إِنَّكَ أَحْبَبْتَ الْبِرَّ وَأَبْغَضْتَ الإِثْمَ. لِذَلِكَ مَسَحَكَ اللهُ إِلَهُكَ مَلِكاً، إِذْ صَبَّ عَلَيْكَ زَيْتَ الْبَهْجَةِ أَكْثَرَ مِنْ رُفَقَائِكَ!»
44012002	Violence	فَقَتَلَ يَعْقُوبَ شَقِيقَ يُوحَنَّا بِالسَّيْفِ.
55002016	Recommendation	أَمَّا الأَحَادِيثُ الْبَاطِلَةُ الدَّنِسَةُ، فَتَجَنَّبْهَا؛ فَإِنَّ الْمُنْصَرِفِينَ إِلَيْهَا يَتَقَدَّمُونَ إِلَى فُجُورٍ أَفْظَعَ،
62003015	Sin	وَكُلُّ مَنْ يُبْغِضُ أَخاً لَهُ، فَهُوَ قَاتِلٌ. وَأَنْتُمْ تَعْرِفُونَ أَنَّ الْقَاتِلَ لاَ تَكُونُ لَهُ حَيَاةٌ أَبَدِيَّةٌ ثَابِتَةٌ فِيهِ.
43021015	Faith	وَبَعْدَمَا أَكَلُوا سَأَلَ يَسُوعُ سِمْعَانَ بُطْرُسَ: «يَاسِمْعَانُ بْنَ يُونَا، أَتُحِبُّنِي أَكْثَرَ مِمَّا يُحِبُّنِي هؤُلاَءِ؟» فَأَجَابَهُ «نَعَمْ يَارَبُّ، أَنْتَ تَعْلَمُ أَنِّي أُحِبُّكَ!» فَقَالَ لَهُ: «أَطْعِمْ حُمْلاَنِي!»
46012008	Grace	فَوَاحِدٌ يُوهَبُ، عَنْ طَرِيقِ الرُّوحِ، كَلاَمَ الْحِكْمَةِ، وَآخَرُ كَلاَمَ الْمَعْرِفَةِ وَفْقاً لِلرُّوحِ نَفْسِهِ،
44007013	Description	وَعِنْدَمَا أَرْسَلَهُمْ مَرَّةً ثَانِيَةً عَرَّفَهُمْ يُوسُفُ بِنَفْسِهِ، وَتَبَيَّنَ لِفِرْعَوْنَ أَصْلُ يُوسُفَ.
60003010	Recommendation	فَمَنْ أَرَادَ أَنْ يَتَمَتَّعَ بِحَيَاةٍ سَعِيدَةٍ وَأَيَّامٍ طَيِّبَةٍ، فَلْيَمْنَعْ لِسَانَهُ عَنِ الشَّرِّ وَشَفَتَيْهِ عَنْ كَلاَمِ الْغِشِّ.
44004032	Description	وَكَانَتْ جَمَاعَةُ الْمُؤْمِنِينَ قَلْباً وَاحِداً وَنَفْساً وَاحِدَةً، وَلَمْ يَكُنْ أَحَدٌ يَقُولُ إِنَّ شَيْئاً مِمَّا عِنْدَهُ هُوَ لَهُ وَحْدَهُ، بَلْ كَانَ كُلُّ شَيْءٍ عِنْدَهُمْ مُشْتَرَكاً.
46015003	Grace	فَالْوَاقِعُ أَنِّي سَلَّمْتُكُمْ، فِي أَوَّلِ الأَمْرِ، مَا كُنْتُ قَدْ تَسَلَّمْتُهُ، وَهُوَ أَنَّ الْمَسِيحَ مَاتَ مِنْ أَجْلِ خَطَايَانَا وَفْقاً لِمَا فِي الْكُتُبِ،
66018024	Violence	وَفِيهَا وُجِدَتْ دِمَاءُ أَنْبِيَاءَ وَقِدِّيسِينَ وَجَمِيعِ الَّذِينَ قُتِلُوا عَلَى الأَرْضِ».
44013048	Faith	فَلَمَّا سَمِعَ غَيْرُ الْيَهُودِ ذَلِكَ، فَرِحُوا جِدّاً، وَمَجَّدُوا كَلِمَةَ الرَّبِّ. وَآمَنَ جَمِيعُ مَنْ أَعَدَّهُمُ اللهُ لِلْحَيَاةِ الأَبَدِيَّةِ.
66022020	Description	وَالَّذِي يَشْهَدُ بِهذِهِ الأُمُورِ يَقُولُ: «نَعَمْ! أَنَا آتٍ سَرِيعاً». آمِين! تَعَالَ أَيُّهَا الرَّبُّ يَسُوعُ!
50004009	Recommendation	وَاعْمَلُوا بِهَا مَا تَعَلَّمْتُمْ وَتَلَقَّيْتُمْ وَسَمِعْتُمْ مِنِّي وَمَا رَأَيْتُمْ فِيَّ. وَإِلَهُ السَّلاَمِ يَكُونُ مَعَكُمْ.
53003015	Recommendation	وَلكِنْ، لاَ تَعْتَبِرُوهُ عَدُوّاً لَكُمْ، بَلْ أَرْشِدُوهُ بِاعْتِبَارِهِ أَخاً.
51002008	Recommendation	احْذَرُوا أَنْ يُوقِعَكُمْ أَحَدٌ فَرِيسَةً بِالْفَلْسَفَةِ وَالْغُرُورِ الْبَاطِلِ، عَمَلاً بِتَقَالِيدِ النَّاسِ وَأَرْكَانِ الْعَالَمِ؛ مِمَّا لاَ يُوَافِقُ الْمَسِيحَ.
50003014	Faith	إِذْ أَسْعَى إِلَى الْهَدَفِ، لِنَوَالِ تِلْكَ الْجَائِزَةِ الَّتِي يَدْعُونَا اللهُ إِلَيْهَا دَعْوَةً عُلْيَا فِي الْمَسِيحِ يَسُوعَ.
56002014	Faith	الَّذِي بَذَلَ نَفْسَهُ لأَجْلِنَا لِكَيْ يَفْتَدِيَنَا مِنْ كُلِّ إِثْمٍ وَيُطَهِّرَنَا لِنَفْسِهِ شَعْباً خَاصّاً يَجْتَهِدُ بِحَمَاسَةٍ فِي الأَعْمَالِ الصَّالِحَةِ.
43005024	Faith	الْحَقَّ الْحَقَّ أَقُولُ لَكُمْ إِنَّ مَنْ يَسْمَعُ كَلاَمِي وَيُؤْمِنُ بِالَّذِي أَرْسَلَنِي تَكُونُ لَهُ الْحَيَاةُ الأَبَدِيَّةُ، وَلاَ يُحَاكَمُ فِي الْيَوْمِ الأَخِيرِ، لأَنَّهُ قَدِ انْتَقَلَ مِنَ الْمَوْتِ إِلَى الْحَيَاةِ.
66021015	Description	وَكَانَ الْمَلاَكُ الَّذِي يُكَلِّمُنِي يُمْسِكُ قَصَبَةً مِنَ الذَّهَبِ لِيَقِيسَ بِهَا الْمَدِينَةَ وَأَبْوَابَهَا وَسُورَهَا.
50003019	Sin	الَّذِينَ مَصِيرُهُمُ الْهَلاَكُ، وَإِلهُهُمْ بُطُونُهُمْ، وَفَخْرُهُمْ فِي خِزْيِهِمْ، وَفِكْرُهُمْ مُنْصَرِفٌ إِلَى الأُمُورِ الأَرْضِيَّةِ.
54003006	Sin	وَيَجِبُ أَيْضاً أَنْ لاَ يَكُونَ مُبْتَدِئاً فِي الإِيمَانِ، لِئَلَّا يَنْتَفِخَ تَكَبُّراً، فَيَقَعَ عَلَيْهِ عِقَابُ إِبْلِيسَ!
65001003	Recommendation	أَيُّهَا الأَحِبَّاءُ، كُنْتُ قَدْ نَوَيْتُ أَنْ أَكْتُبَ إِلَيْكُمْ فِي مَوْضُوعِ الْخَلاَصِ الَّذِي نَشْتَرِكُ فِيهِ جَمِيعاً. وَلَكِنْ، أَرَانِي الآنَ مُضْطَرّاً لأَنْ أَكْتُبَ لأُشَجِّعَكُمْ عَلَى الْجِهَادِ فِي سَبِيلِ الإِيمَانِ الَّذِي سُلِّمَ مَرَّةً وَاحِدَةً لِلْقِدِّيسِينَ.
44004002	Description	مُتَضَايِقِينَ لأَنَّهُمَا كَانَا يُعَلِّمَانِ النَّاسَ وَيُعْلِنَانِ أَنَّ قِيَامَةَ الأَمْوَاتِ حَقِيقَةٌ تُؤَكِّدُهَا قِيَامَةُ يَسُوعَ،
66018005	Sin	فَقَدْ تَرَاكَمَتْ خَطَايَاهَا حَتَّى بَلَغَتِ السَّمَاءَ، وَتَذَكَّرَ اللهُ مَا ارْتَكَبَتْهُ مِنْ آثَامٍ!
