60003001	Recommendation	كَذَلِكَ، أَيَّتُهَا الزَّوْجَاتُ، اخْضَعْنَ لأَزْوَاجِكُنَّ. حَتَّى وَإِنْ كَانَ الزَّوْجُ غَيْرَ مُؤْمِنٍ بِالْكَلِمَةِ، تَجْذِبُهُ زَوْجَتُهُ إِلَى الإِيمَانِ، بِتَصَرُّفِهَا اللاَّئِقِ دُونَ كَلاَمٍ،
47005020	Recommendation	فَنَحْنُ إِذَنْ سُفَرَاءُ الْمَسِيحِ، وَكَأَنَّ اللهَ يَعِظُ بِنَا نُنَادِي عَنِ الْمَسِيحِ: «تَصَالَحُوا مَعَ اللهِ!»
44002024	Description	وَلكِنَّ اللهَ أَقَامَهُ مِنْ بَيْنِ الأَمْوَاتِ نَاقِضاً أَوْجَاعَ المَوْتِ، فَمَا كَانَ يُمْكِنُ لِلْمَوْتِ أَنْ يُبْقِيَهُ فِي قَبْضَتِهِ!
59002007	Sin	وَهُمُ الَّذِينَ يَسْتَهْزِئُونَ بِالْمَسِيحِ الَّذِي تَحْمِلُونَ اسْمَهُ الْجَمِيلَ؟
54003003	Description	لاَ مُدْمِناً لِلْخَمْرِ وَلاَ عَنِيفاً؛ بَلْ لَطِيفاً، غَيْرَ مُتَعَوِّدِ الْخِصَامِ، غَيْرَ مُولَعٍ بِالْمَالِ،
43004014	Grace	وَلكِنَّ الَّذِي يَشْرَبُ مِنَ الْمَاءِ الَّذِي أُعْطِيهِ أَنَا، لَنْ يَعْطَشَ بَعْدَ ذَلِكَ أَبَداً، بَلْ إِنَّ مَا أُعْطِيهِ مِنْ مَاءٍ يُصْبِحُ فِي دَاخِلِهِ نَبْعاً يَفِيضُ فَيُعْطِي حَيَاةً أَبَدِيَّةً».
62002005	Faith	أَمَّا الَّذِي يَعْمَلُ بِحَسَبِ كَلِمَتِهِ، فَإِنَّ مَحَبَّةَ اللهِ تَكُونُ قَدِ اكْتَمَلَتْ فِي دَاخِلِهِ. بِهَذَا نَعْرِفُ أَنَّنَا نَنْتَمِي إِلَيْهِ.
66016013	Description	وَعِنْدَ هَذَا رَأَيْتُ ثَلاَثَةَ أَرْوَاحٍ نَجِسَةٍ تُشْبِهُ الضَّفَادِعَ تَخْرُجُ مِنْ فَمِ التِّنِّينِ، وَمِنْ فَمِ الْوَحْشِ، وَمِنْ فَمِ النَّبِيِّ الدَّجَّالِ،
59002008	Recommendation	مَا أَحْسَنَ عَمَلَكُمْ حِينَ تُطَبِّقُونَ تِلْكَ الْقَاعِدَةَ الْمُلُوكِيَّةَ الْوَارِدَةَ فِي الْكِتَابِ: «تُحِبُّ قَرِيبَكَ كَمَا تُحِبُّ نَفْسَكَ!»
47004005	Faith	فَإِنَّنَا لاَ نُبَشِّرُ بِأَنْفُسِنَا، بَلْ بِالْمَسِيحِ يَسُوعَ رَبّاً، وَمَا نَحْنُ إِلاَّ عَبِيدٌ لَكُمْ مِنْ أَجْلِ يَسُوعَ.
46015033	Recommendation	لاَ تَنْقَادُوا إِلَى الضَّلاَلِ: إِنَّ الْمُعَاشَرَاتِ الرَّدِيئَةَ تُفْسِدُ الأَخْلاقَ الْجَيِّدَةَ!
58013020	Grace	وَأَسْأَلُ اللهَ، إِلَهَ السَّلاَمِ الَّذِي أَقَامَ مِنْ بَيْنِ الأَمْوَاتِ رَبَّنَا يَسُوعَ رَاعِيَ الْخِرَافِ الْعَظِيمَ بِفَضْلِ دَمِهِ الَّذِي خَتَمَ بِهِ الْعَهْدَ الأَبَدِيَّ
50001027	Recommendation	إِنَّمَا عِيشُوا عِيشَةً تَلِيقُ بِإِنْجِيلِ الْمَسِيحِ، حَتَّى إِذَا جِئْتُ وَشَاهَدْتُكُمْ أَوْ بَقَيْتُ غَائِباً عَنْكُمْ، أَسْمَعُ أَخْبَارَكُمْ وَأَعْرِفُ أَنَّكُمْ ثَابِتُونَ فِي رُوحٍ وَاحِدٍ، وَبِنَفْسٍ وَاحِدَةٍ تُجَاهِدُونَ مَعاً لأَجْلِ الإِيمَانِ الْمُعْلَنِ فِي الإِنْجِيلِ،
46006014	Grace	وَاللهُ قَدْ أَقَامَ الرَّبَّ مِنَ الْمَوْتِ، وَسَيُقِيمُنَا نَحْنُ أَيْضاً بِقُدْرَتِهِ!
55001006	Recommendation	لِهَذَا السَّبَبِ أُنَبِّهُكَ أَنْ تُلْهِبَ نَارَ مَوْهِبَةِ اللهِ الَّتِي فِيكَ بِوَضْعِ يَدَيَّ عَلَيْكَ.
60004006	Grace	وَلِهَذَا أُبْلِغَتِ الْبِشَارَةُ إِلَى الأَمْوَاتِ أَيْضاً لِكَيْ يَكُونُوا دَائِماً أَحْيَاءً بِالرُّوحِ عِنْدَ اللهِ، مَعَ أَنَّ حُكْمَ الْمَوْتِ قَدْ نُفِّذَ بِأَجْسَادِهِمْ، فَمَاتُوا كَغَيْرِهِمْ مِنَ النَّاسِ.
46007023	Recommendation	قَدِ اشْتُرِيتُمْ بِفِدْيَةٍ، فَلاَ تَصِيرُوا عَبِيداً لِلْبَشَرِ.
46010010	Recommendation	وَلاَ تَتَذَمَّرُوا، كَمَا تَذَمَّرَ بَعْضُهُمْ، فَهَلَكُوا عَلَى يَدِ الْمَلاَكِ الْمُهْلِكِ.
47002017	Faith	فَإِنَّنَا لاَ نُتَاجِرُ بِكَلِمَةِ اللهِ كَمَا يَفْعَلُ الْكَثِيرُونَ، وَإِنَّمَا بِإِخْلاَصٍ وَمِنْ قِبَلِ اللهِ، وَأَمَامَ اللهِ، نَتَكَلَّمُ فِي الْمَسِيحِ.
45015001	Recommendation	وَلكِنْ عَلَيْنَا نَحْنُ الأَقْوِيَاءَ، أَنْ نَحْتَمِلَ ضَعْفَ الضُّعَفَاءِ، وَأَنْ لاَ نُرْضِيَ أَنْفُسَنَا.
50002024	Faith	وَلَكِنَّ لِي ثِقَةً فِي الرَّبِّ بِأَنِّي، أَنَا نَفْسِي، سَآتِي إِلَيْكُمْ عَنْ قَرِيبٍ.
66007001	Description	وَرَأَيْتُ بَعْدَ ذَلِكَ أَرْبَعَةَ مَلاَئِكَةٍ وَاقِفِينَ عَلَى زَوَايَا الأَرْضِ الأَرْبَعِ، يَحْبِسُونَ رِيَاحَ الأَرْضِ الأَرْبَعَ، فَلاَ تَهُبُّ رِيحٌ عَلَى بَرٍّ أَوْ بَحْرٍ أَوْ شَجَرٍ.
60004003	Sin	كَفَاكُمْ ذَلِكَ الزَّمَانُ الْمَاضِي مِنْ حَيَاتِكُمْ، لِتَكُونُوا قَدْ سَلَكْتُمْ سُلُوكَ الْوَثَنِيِّينَ، حِينَ كُنْتُمْ تَعِيشُونَ فِي الدَّعَارَةِ وَالشَّهْوَاتِ وَإِدْمَانِ الْخَمْرِ، وَحَفَلاَتِ السُّكْرِ وَالْعَرْبَدَةِ، وَعِبَادَةِ الأَصْنَامِ الْمُحَرَّمَةِ.
66011005	Violence	فَإِذَا حَاوَلَ أَحَدٌ أَنْ يَمَسَّهُمَا بِسُوءٍ تَخْرُجُ نَارٌ مِنْ فَمِهِمَا وَتَلْتَهِمُ أَعْدَاءَهُمَا. ذَلِكَ يَجِبُ أَنْ يَكُونَ مَصِيرُ مَنْ يُحَاوِلُ أَنْ يُؤْذِيَهُمَا.
44023005	Recommendation	فَأَجَابَ بُولُسُ: «لَمْ أَكُنْ أَعْرِفُ أَيُّهَا الإِخْوَةُ أَنَّهُ رَئِيسُ كَهَنَةٍ فَقَدْ جَاءَ فِي الْكِتَابِ: لاَ تَشْتِمْ رَئِيسَ شَعْبِكَ!»
66022015	Sin	أَمَّا فِي خَارِجِ الْمَدِينَةِ، فَهُنَالِكَ الْكِلاَبُ وَالْمُتَّصِلُونَ بِالشَّيَاطِينِ، وَالزُّنَاةُ وَالْقَتَلَةُ، وَعَبَدَةُ الأَصْنَامِ وَالدَّجَّالُونَ وَمُحِبُّو التَّدْجِيلِ!
66002014	Sin	وَلَكِنِّي عَاتِبٌ عَلَيْكَ قَلِيلاً لأَنَّكَ تَتَسَامَحُ مَعَ الْقَوْمِ الَّذِينَ يَتَمَسَّكُونَ بِتَعْلِيمِ بَلْعَامِ عِنْدَمَا عَلَّمَ الْمَلِكَ بَالاَقَ أَنْ يُدَمِّرَ بَنِي إِسْرَائِيلَ بِتَوْرِيطِهِمْ فِي ارْتِكَابِ الزِّنَى وَالأَكْلِ مِنَ الذَّبَائِحِ الْمُقَدَّمَةِ لِلأَصْنَامِ،
53001003	Faith	مِنْ وَاجِبِنَا أَنْ نَشْكُرَ اللهَ عَلَى الدَّوَامِ لأَجْلِكُمْ أَيُّهَا الإِخْوَةُ. كَمَا أَنَّ هَذَا حَقٌّ: لأَنَّ إِيمَانَكُمْ يَنْمُو نُمُوّاً فَائِقاً، وَمَحَبَّةَ أَحَدِكُمْ لِلآخَرِ تَفِيضُ بَيْنَكُمْ جَمِيعاً.
46012002	Sin	تَعْلَمُونَ أَنَّكُمْ، عِنْدَمَا كُنْتُمْ مِنَ الأُمَمِ، كُنْتُمْ تَنْجَرِفُونَ إِلَى الأَصْنَامِ الْخَرْسَاءِ أَيَّمَا انْجِرَافٍ.
49005025	Recommendation	أَيُّهَا الأَزْوَاجُ، أَحِبُّوا زَوْجَاتِكُمْ مِثْلَمَا أَحَبَّ الْمَسِيحُ الْكَنِيسَةَ وَبَذَلَ نَفْسَهُ لأَجْلِهَا،
45012017	Recommendation	لاَ تَرُدُّوا لأَحَدٍ شَرّاً مُقَابِلَ شَرٍّ، بَلِ اجْتَهِدُوا فِي تَقْدِيمِ مَا هُوَ حَسَنٌ أَمَامَ جَمِيعِ النَّاسِ.
60005006	Recommendation	إِذَنْ، تَوَاضَعُوا تَحْتَ يَدِ اللهِ القَدِيرَةِ لِكَيْ يَرْفَعَكُمْ عِنْدَمَا يَحِينُ الْوَقْتُ،
44014017	Grace	مَعَ أَنَّهُ لَمْ يَتْرُكْهُمْ دُونَ شَاهِدٍ يَدُلُّهُمْ عَلَيْهِ. فَهُوَ مَازَالَ يُنْعِمُ عَلَيْكُمْ بِالْخَيْرِ، وَيَرْزُقُكُمْ مِنَ السَّمَاءِ أَمْطَاراً وَمَوَاسِمَ مُثْمِرَةً، وَيُشْبِعُكُمْ طَعَاماً وَيَمْلأُ قُلُوبَكُمْ سُرُوراً».
54003011	Recommendation	كَذَلِكَ يَجِبُ أَنْ تَكُونَ النِّسَاءُ أَيْضاً رَزِينَاتٍ، غَيْرَ نَمَّامَاتٍ، يَقِظَاتٍ، أَمِينَاتٍ فِي كُلِّ شَيْءٍ.
66002021	Sin	وَقَدْ أَمْهَلْتُهَا مُدَّةً لِتَتُوبَ تَارِكَةً زِنَاهَا، وَلَكِنَّهَا لَمْ تَتُبْ.
44012020	Description	وَكَانَ نَاقِماً عَلَى أَهْلِ صُورَ وَصَيْدَا. فَاتَّفَقُوا وَأَرْسَلُوا وَفْداً مِنْهُمْ يَسْتَعْطِفُونَ بَلاَسْتُسَ حَاجِبَ الْمَلِكِ طَالِبِينَ الأَمَانَ، لأَنَّ مِنْطَقَتَهُمْ كَانَتْ تَكْسِبُ رِزْقَهَا مِنْ مَمْلَكَةِ هِيرُودُسَ.
43008049	Sin	أَجَابَهُمْ: «لاَ شَيْطَانَ فِيَّ، لكِنِّي أُكْرِمُ أَبِي وَأَنْتُمْ تُهِينُونَنِي.
43006018	Description	وَهَبَّتْ عَاصِفَةٌ قَوِيَّةٌ، فَاضْطَرَبَتِ الْبُحَيْرَةُ.
45008018	Faith	فَإِنِّي مُقْتَنِعٌ بِأَنَّ آلاَمَ الزَّمَانِ الْحَاضِرِ لَيْسَتْ شَيْئاً إِذَا قِيسَتْ بِالْمَجْدِ الآتِي الَّذِي سَيُعْلَنُ فِينَا.
62002012	Grace	أَكْتُبُ إِلَيْكُمْ، أَيُّهَا الأَوْلاَدُ، لأَنَّ اللهَ قَدْ غَفَرَ لَكُمْ خَطَايَاكُمْ إِكْرَاماً لاسْمِ الْمَسِيحِ.
55001009	Grace	فَهُوَ قَدْ خَلَّصَنَا، وَدَعَانَا إِلَيْهِ دَعْوَةً مُقَدَّسَةً، لاَ عَلَى أَسَاسِ أَعْمَالِنَا، بَلْ بِمُوجِبِ قَصْدِهِ وَنِعْمَتِهِ الَّتِي وُهِبَتْ لَنَا فِي الْمَسِيحِ يَسُوعَ قَبْلَ أَزْمِنَةِ الأَزَلِ،
43019006	Violence	فَلَمَّا رَآهُ رُؤَسَاءُ الْكَهَنَةِ وَالْحَرَسُ صَرَخُوا: «اصْلِبْهُ! اصْلِبْهُ!» فَقَالَ لَهُمْ بِيلاَطُسُ: «بَلْ خُذُوهُ أَنْتُمْ وَاصْلِبُوهُ، فَإِنِّي لاَ أَجِدُ فِيهِ ذَنْباً!»
60001010	Grace	وَكَمْ فَتَّشَ الأَنْبِيَاءُ قَدِيماً وَبَحَثُوا عَنْ هَذَا الْخَلاَصِ! فَهُمْ تَنَبَّأُوا عَنْ نِعْمَةِ اللهِ الَّتِي كَانَ قَدْ أَعَدَّهَا لَكُمْ أَنْتُمْ،
63001007	Sin	إِنَّ الْعَالَمَ أَصْبَحَ مَلِيئاً بِالْمُضَلِّلِينَ الَّذِينَ لاَ يَعْتَرِفُونَ أَنَّ يَسُوعَ الْمَسِيحَ جَاءَ إِلَى الأَرْضِ بِجِسْمٍ بَشَرِيٍّ. هَذَا هُوَ رُوحُ المُضِلُّ وَضِدُّ الْمَسِيحِ!
44024005	Sin	وَجَدْنَا هَذَا الْمُتَّهَمَ مُخَرِّباً، يُثِيرُ الْفِتْنَةَ بَيْنَ جَمِيعِ الْيَهُودِ فِي الْبِلاَدِ كُلِّهَا، وَهُوَ يَتَزَعَّمُ مَذْهَبَ النَّصَارَى.
54003016	Grace	وَبِاعْتِرَافِ الْجَمِيعِ، إِنَّ سِرَّ التَّقْوَى عَظِيمٌ: اللهُ ظَهَرَ فِي الْجَسَدِ، شَهِدَ الرُّوحُ لِبِرِّهِ، شَاهَدَتْهُ الْمَلاَئِكَةُ، بُشِّرَ بِهِ بَيْنَ الأُمَمِ، أُومِنَ بِهِ فِي الْعَالَمِ، ثُمَّ رُفِعَ فِي الْمَجْدِ.
66016021	Violence	وَتَسَاقَطَ مِنَ السَّمَاءِ عَلَى النَّاسِ بَرَدٌ كَبِيرٌ، كُلُّ حَبَّةٍ مِنْهُ بِمِقْدَارِ وَزْنَةٍ وَاحِدَةٍ، فَجَدَّفَ النَّاسُ عَلَى اللهِ بِسَبَبِ هذِهِ الْبَلِيَّةِ الشَّدِيدَةِ جِدّاً.
61003013	Faith	إِلاَّ أَنَّنَا، وَفْقاً لِوَعْدِ الرَّبِّ، نَنْتَظِرُ سَمَاوَاتٍ جَدِيدَةً وَأَرْضاً جَدِيدَةً، حَيْثُ يَسْكُنُ الْبِرُّ.
66006014	Description	وَطُوِيَتِ السَّمَاءُ كَمَا تُطْوَى لِفَافَةٌ مِنْ وَرَقٍ، فَتَزَحْزَحَتِ الْجِبَالُ وَالْجُزُرُ كُلُّهَا مِنْ مَوَاضِعِهَا.
58010010	Grace	بِمُوجِبِ هَذِهِ الإِرَادَةِ الإِلَهِيَّةِ، صِرْنَا مُقَدَّسِينَ إِذْ قَدَّمَ يَسُوعُ الْمَسِيحُ، مَرَّةً وَاحِدَةً، جَسَدَهُ عِوَضاً عَنَّا!
52001002	Faith	إِنَّنَا نَشْكُرُ اللهَ دَائِماً مِنْ أَجْلِكُمْ جَمِيعاً، إِذْ نَذْكُرُكُمْ فِي صَلَوَاتِنَا دُونَ تَوَقُّفٍ؛
66006004	Violence	فَخَرَجَ حِصَانٌ أَحْمَرُ، أُعْطِيَ رَاكِبُهُ سَيْفاً عَظِيماً، وَمُنِحَ سُلْطَةَ نَزْعِ السَّلاَمِ مِنَ الأَرْضِ وَجَعْلِ النَّاسِ يَقْتُلُونَ بَعْضُهُمْ بَعْضاً.
54006001	Recommendation	عَلَى جَمِيعِ مَنْ هُمْ تَحْتَ نِيرِ الْعُبُودِيَّةِ أَنْ يَعْتَبِرُوا سَادَتَهُمْ أَهْلاً لِكُلِّ إِكْرَامٍ، لِكَيْ لاَ يَجْلِبُوا التَّجْدِيفَ عَلَى اسْمِ اللهِ وَعَلَى التَّعْلِيمِ.
51003009	Recommendation	لاَ يَكْذِبْ أَحَدُكُمْ عَلَى الآخَرِ، إِذْ قَدْ نَزَعْتُمُ الإِنْسَانَ الْعَتِيقَ وَأَعْمَالَهُ
66002020	Sin	وَلَكِنَّ لِي عَلَيْكَ أَنَّكَ تَتَسَاهَلُ مَعَ هَذِهِ الْمَرْأَةِ إِيزَابَلَ، الَّتِي تَدَّعِي أَنَّهَا نَبِيَّةٌ، فَتُعَلِّمُ عَبِيدِي وَتُغْوِيهِمْ أَنْ يَزْنُوا وَيَأْكُلُوا مِنَ الذَّبَائِحِ الْمُقَدَّمَةِ لِلأَصْنَامِ.
48003008	Grace	ثُمَّ إِنَّ الْكِتَابَ، إِذْ سَبَقَ فَرَأَى أَنَّ اللهَ سَوْفَ يُبَرِّرُ الأُمَمَ عَلَى أَسَاسِ الإِيمَانِ، بَشَّرَ إِبْرَاهِيمَ سَلَفاً بِقَوْلِهِ: «فِيكَ تَتَبَارَكُ جَمِيعُ الأُمَمِ!»
58012005	Recommendation	فَهَلْ نَسِيتُمُ الْوَعْظَ الَّذِي يُخَاطِبُكُمْ بِهِ اللهُ بِوَصْفِكُمْ أَبْنَاءً لَهُ؟ إِذْ يَقُولُ: «يَاابْنِي، لاَ تَسْتَخِفَّ بِتَأْدِيبِ الرَّبِّ. وَلاَ تَفْقِدِ الْعَزِيمَةَ حِينَ يُوَبِّخُكَ عَلَى الْخَطَأِ.
58013017	Recommendation	أَطِيعُوا مُرْشِدِيكُمْ، وَاخْضَعُوا لَهُمْ، لأَنَّهُمْ يَسْهَرُونَ عَلَى مَصْلَحَتِكُمُ الرُّوحِيَّةِ، كَمَا يَسْهَرُ الَّذِي يَحْمِلُ مَسْئُولِيَّةً سَوْفَ يُقَدِّمُ حِسَاباً عَنْ قِيَامِهِ بِهَا. وَعِنْدَئِذٍ، يُؤَدُّونَ مُهِمَّتَهُمْ بِفَرَحٍ دُونَ تَذَمُّرٍ. فَلَنْ يَكُونَ فِي تَذَمُّرِهِمْ نَفْعٌ لَكُمْ!
44013019	Description	ثُمَّ أَزَالَ سَبْعَةَ شُعُوبٍ مِنْ بِلاَدِ كَنْعَانَ، وَأَوْرَثَهُمْ أَرْضَهَا،
54006003	Faith	أَمَّا إِذَا كَانَ أَحَدٌ يُعَلِّمُ مَا يُخَالِفُهَا وَلاَ يُذْعِنُ لِلْكَلاَمِ الصَّحِيحِ، كَلاَمِ رَبِّنَا يَسُوعَ الْمَسِيحِ، وَلِلتَّعْلِيمِ الْمُوَافِقِ لِلتَّقْوَى،
63001010	Recommendation	إِنْ جَاءَكُمْ أَحَدٌ بِغَيْرِ هَذَا التَّعْلِيمِ، فَلاَ تَسْتَقْبِلُوهُ فِي بَيْتِكُمْ، وَلاَ تُبَادِلُوهُ التَّحِيَّةَ.
47001005	Grace	فَكَمَا تَفِيضُ عَلَيْنَا آلاَمُ الْمَسِيحِ، يَفِيضُ عَلَيْنَا أَيْضاً التَّشْجِيعُ بِالْمَسِيحِ.
65001011	Sin	الْوَيْلُ لَهُمْ! لأَنَّهُمْ سَلَكُوا طَرِيقَ قَايِينَ، وَانْدَفَعُوا إِلَى ارْتِكَابِ خَطِيئَةِ بَلْعَامَ طَلَباً لِلْمَالِ، وَتَمَرَّدُوا كَمَا تَمَرَّدَ قُورَحُ، فَدَمَّرُوا أَنْفُسَهُمْ.
65001010	Sin	وَلَكِنَّ هَؤُلاَءِ الْمُعَلِّمِينَ يَتَكَلَّمُونَ كَلاَماً مُهِيناً عَلَى أُمُورٍ لاَ يَعْرِفُونَهَا. وَأَمَّا مَا يَفْهَمُونَهُ بِالْغَرِيزَةِ، كَالْحَيَوَانَاتِ غَيْرِ الْعَاقِلَةِ، فَإِنَّهُمْ بِهِ يُدَمِّرُونَ أَنْفُسَهُمْ.
58011007	Faith	وَبِالإِيمَانِ نُوحٌ، لَمَّا أَنْذَرَهُ اللهُ عَنْ طَرِيقِ الْوَحْيِ بِالطُّوفَانِ الآتِي، دَفَعَهُ خَوْفُ اللهِ إِلَى بِنَاءِ سَفِينَةٍ ضَخْمَةٍ كَانَتْ وَسِيلَةَ النَّجَاةِ لَهُ وَلِعَائِلَتِهِ، مَعَ أَنَّهُ لَمْ يَكُنْ قَدْ رَأَى طُوفَاناً مِنْ قَبْلُ. وَبِعَمَلِهِ هَذَا، حَكَمَ عَلَى الْعَالَمِ وَأَصْبَحَ وَارِثاً لِلْبِرِّ الْقَائِمِ عَلَى أَسَاسِ الإِيمَانِ.
58009006	Description	وَبِمَا أَنَّ هَذِهِ الأُمُورَ كَانَتْ مُرَتَّبَةً هَكَذَا، كَانَ الْكَهَنَةُ يَدْخُلُونَ دَائِماً إِلَى الْقِسْمِ الأَوَّلِ، حَيْثُ يَقُومُونَ بِوَاجِبَاتِ خِدْمَتِهِمْ.
44007051	Sin	ثُمَّ قَالَ اسْتِفَانُوسُ: «يَاأَصْحَابَ الرِّقَابِ الصُّلْبَةِ وَالْقُلُوبِ وَالآذَانِ غَيْرِ الْمَخْتُونَةِ! إِنَّكُمْ دَائِماً تُقَاوِمُونَ الرُّوحَ الْقُدُسَ. وَكَمَا فَعَلَ آبَاؤُكُمْ تَفْعَلُونَ!
54001009	Sin	إِذْ نُدْرِكُ أَنَّ الشَّرِيعَةَ لاَ تُوضَعُ لِمَنْ كَانَ بَارّاً، بَلْ لِلأَشْرَارِ وَالْمُتَمَرِّدِينَ، وَالْفَاجِرِينَ وَالْخَاطِئِينَ، وَالنَّجِسِينَ وَالدَّنِسِينَ، وَقَاتِلِي آبَائِهِمْ وَأُمَّهَاتِهِمْ، وَقَاتِلِي النَّاسِ،
46005009	Recommendation	كَتَبْتُ إِلَيْكُمْ فِي رِسَالَتِي أَنْ لاَ تُعَاشِرُوا الزُّنَاةَ.
48001015	Grace	وَلَكِنْ، لَمَّا سُرَّ اللهُ، الَّذِي كَانَ قَدْ أَفْرَزَنِي وَأَنَا فِي بَطْنِ أُمِّي ثُمَّ دَعَانِي بِنِعْمَتِهِ،
45007015	Description	فَإِنَّ مَا أَفْعَلُهُ لاَ أَمْلِكُ السَّيْطَرَةَ عَلَيْهِ: إِذْ لاَ أَفْعَلُ مَا أُرِيدُهُ، وَإِنَّ مَا أُبْغِضُهُ فَإِيَّاهُ أَعْمَلُ.
61003018	Faith	وَلَكِنْ، ازْدَادُوا نُمُوّاً فِي النِّعْمَةِ وَفِي مَعْرِفَةِ رَبِّنَا وَمُخَلِّصِنَا يَسُوعَ الْمَسِيحِ. لَهُ الْمَجْدُ، الآنَ وَإِلَى الْيَوْمِ الأَبَدِيِّ.
46004010	Description	نَحْنُ جُهَلاَءُ مِنْ أَجْلِ الْمَسِيحِ، وَأَنْتُمْ حُكَمَاءُ فِي الْمَسِيحِ. نَحْنُ ضُعَفَاءُ وَأَنْتُمْ أَقْوِيَاءُ. أَنْتُمْ مُكَرَّمُونَ وَنَحْنُ مُهَانُونَ.
60005009	Faith	فَقَاوِمُوهُ، ثَابِتِينَ فِي الإِيمَانِ. وَاذْكُرُوا أَنَّ إِخْوَتَكُمُ الْمُنْتَشِرِينَ فِي الْعَالَمِ يَجْتَازُونَ وَسَطَ هذِهِ الآلاَمِ عَيْنِهَا.
51003022	Recommendation	أَيُّهَا الْعَبِيدُ، أَطِيعُوا فِي كُلِّ أَمْرٍ سَادَتَكُمُ الْبَشَرِيِّينَ، فَلاَ تَعْمَلُوا بِجِدٍّ فَقَطْ حِينَ تَكُونُ عُيُونُهُمْ عَلَيْكُمْ، كَمَنْ يُحَاوِلُ إِرْضَاءَ النَّاسِ، بَلْ بِقَلْبٍ صَادِقٍ خَائِفِينَ الرَّبَّ.
66017012	Description	وَأَمَّا الْقُرُونُ الْعَشَرَةُ الَّتِي رَأَيْتَهَا هِيَ عَشَرَةُ مُلُوكٍ لَمْ يَتَوَلَّوْا الْمُلْكَ بَعْدُ، وَسَيَتَوَلَّوْنَ سُلْطَةَ الْمُلْكِ مَعَ الْوَحْشِ لِمُدَّةِ سَاعَةٍ وَاحِدَةٍ،
46002012	Grace	وَأَمَّا نَحْنُ فَقَدْ نِلْنَا لاَ رُوحَ الْعَالَمِ بَلِ الرُّوحَ الَّذِي مِنَ اللهِ، لِنَعْرِفَ الأُمُورَ الَّتِي وُهِبَتْ لَنَا مِنْ قِبَلِ اللهِ.
59005001	Recommendation	أَيُّهَا الأَغْنِيَاءُ، هَيَّا الآنَ ابْكُوا مُوَلْوِلِينَ بِسَبَبِ مَا يَنْتَظِرُكُمْ مِنْ أَهْوَالٍ وَشَقَاءٍ.
66002010	Recommendation	دَعْ عَنْكَ الْخَوْفَ مِمَّا يَنْتَظِرُكَ مِنْ آلاَمٍ، فَإِنَّ إِبْلِيسَ سَيَزُجُّ بِبَعْضِكُمْ فِي السِّجْنِ لِكَيْ تُمْتَحَنُوا، فَتُقَاسُونَ الاضْطِهَادَ عَشَرَةَ أَيَّامٍ. فَابْقَ أَمِيناً حَتَّى الْمَوْتِ، فَأَمْنَحَكَ إِكْلِيلَ الْحَيَاةِ.
54006011	Recommendation	وَأَمَّا أَنْتَ، يَاإِنْسَانَ اللهِ، فَاهْرُبْ مِنْ هَذِهِ الأُمُورِ، وَاسْعَ فِي إِثْرِ الْبِرِّ وَالتَّقْوَى وَالإِيمَانِ وَالْمَحَبَّةِ وَالصَّبْرِ وَالْوَدَاعَةِ.
