54003003	Description	Mecu̶ose idimecu̶becu̶, quẽabecu̶, gãjerãre ajijũnisinicõari, oca josabecu̶ ĩ ñajama, quẽnaja. Rojose gãjerã ĩna yiboajaquẽne, ĩnare ĩamaicõari, quẽnaro ejarẽmogũ̶ ñagũ̶mi, “Quẽnaseju̶a tu̶oĩato ĩna” yigu̶. Gãjoare bojatu̶oĩabecu̶ ñagũ̶mi.
43004014	Grace	No bojarã oco catireayere masare yu̶ iorãma, quẽna gãme oco idiru̶abetiru̶arãma. Ĩnare yu̶ oco iose su̶orine Diorãca quẽnaro ñacõa ñarũgũru̶arãma —sore yigotiyuju Jesús.
62002005	Faith	Dios ĩ rotirore bajiro yigu̶ju̶a ñagũ̶mi ĩre maigũ̶. To bajiro mani yijama, “Dios yarã ñaja mani”, yimasirãja mani.
66016013	Description	To ĩ yiro bero, vãtia tũjare bajirã ñarãre idiarã ĩacaju̶ yu̶. Sĩgũ̶, gu̶sore bajigu̶ ñagũ̶ro riseju̶ budiadicami. Güiogu̶, moa riagaju̶ majadicacu̶, riseju̶ budiadicami gãji. “Diore gotirẽtobosarimasu̶ ñaja yu̶” yitogu̶, riseju̶ budiadicami gãji. Ĩne ñacami sita tũcuroju̶ joe jeadicacu̶.
59002008	Recommendation	Mani u̶ju̶, Dios ñamasusere ĩ rotimasire ado bajiro gotiaja: “Mu̶ masu ruju̶re mu̶ mairore bajirone mu̶ tu̶anare maiña”, yigotiaja. Tire mu̶a cu̶dijama, quẽnaro yirã yirãja mu̶a.
47004005	Faith	“Yu̶aju̶are rũ̶cu̶bu̶oya” yirã me, ti ocare gotimasiorũgũaja yu̶a. “Mani u̶ju̶ Jesucristoju̶are rũ̶cu̶bu̶oato” yirãju̶a yaja. Jesúre maicõari, mu̶are moabosarãre bajirone bajirũgũaja, tire mu̶are gotirã.
46015033	Recommendation	To bajiro ĩna yisere ajitirũ̶nu̶besa. “Rojose yirã rãca mu̶a baba cu̶tijama, quẽnaro yirã ñaboarine, ĩnare bajiro rojose yiru̶arãja mu̶a quẽne” yirere masiritibesa.
58013020	Grace	“Quẽnaro ñato ĩna” yigu̶ manire ejarẽmogũ̶mi Dios. Ĩne ñagũ̶mi, mani u̶ju̶ Jesús manire ĩ rijabosaro bero, ĩre catior'i, ĩre catiocõari, “Ovejare ĩatirũ̶nu̶gũ̶re bajiro, yu̶ yarãre quẽnaro ĩnare ĩatirũ̶nu̶ru̶cu̶ja mu̶” ĩre yir'i. Jesús ĩ rijabosare su̶orine, “Rojose ĩna yisere masiriocõari, quẽnaro yiru̶cu̶ja yu̶” masare Dios ĩ yimasiriarore bajirone bajiyuja. To bajiro ĩ yise jedibetiru̶aroja.
50001027	Recommendation	Cristo oca ti gotirore bajiro mu̶a cu̶dirotiju̶a ñaja ñamasuse. Mu̶a tu̶ju̶ yu̶ vajama, yu̶ vabetijaquẽne, ado bajiro mu̶a yisere ajiru̶aja yu̶: “Cristo ocare ajicõari, sĩgũ̶re bajiro tu̶oĩarã ñaama ĩna. To yicõari, ‘Cristore ajitirũ̶nu̶ato gãjerã quẽne’ yirã, ĩ ocare tocãrãcarũ̶mu̶ne gotimasioama ĩna” yu̶re ĩna yigotisere ajiru̶aja yu̶.
46006014	Grace	Mani ruju̶ ti bajiyayiboajaquẽne, mani u̶ju̶ Cristore ĩ catioriarore bajirone manire quẽne ĩ masise rãca catioru̶cu̶mi Dios.
55001006	Recommendation	To bajiro mu̶re yitu̶oĩagũ̶ ñari, ado bajise mu̶ tuditu̶oĩarotire bojaja yu̶: Mu̶re yu̶ ãmo ñujeorone, “Adi ñaja mu̶ moaroti Dios ĩ cũre” Diore yu̶ yigotibosarone, quẽnaro mu̶ yirotire mu̶re u̶joyumi Dios. To bajiro mu̶re ĩ yire ti ñajare, tire masiritibecu̶ne, mu̶ yimasiro cõro variquẽnase rãca quẽnaro yicõa ñaru̶cu̶ja mu̶.
60004006	Grace	Yoaro me to bajiro ĩ yirotire tu̶oĩagũ̶ ñari, rijariarãre quẽne ĩ oca quẽnasere gotimasioñuju mani u̶ju̶. To bajiro ĩnare gotimasioñuju, jẽre rijariarã ñaboarine, ĩre ajitirũ̶nu̶rã ñari, tudicaticõari, Diorãca quẽnaro ĩna ñarotire yigu̶.
46007023	Recommendation	“Yu̶ yarã ñato” yigu̶, Satanás yarã mu̶a ñaboarone, ĩ macu̶ ĩ rijare su̶orine, “Yu̶ yarã ñaama”, mu̶are yiyumi Dios. To bajiri gãjerã, Dios ĩ bojabetire mu̶are ĩna yirotisere ĩnare cu̶dibetiroti ñaja.
46010010	Recommendation	Yu̶a ñicu̶a sĩgũ̶ri Diore ñagõmacamasiñujarã. To bajiro ĩna yise su̶orine ĩ tu̶agu̶re ĩnare sĩarearoticõamasiñuju Dios. To bajiri ángelju̶a ĩnare sĩareacõamasiñuju. “Manire quẽne to bajiro yirotiromi Dios” yirã, ĩre ñagõmacabetiroti ñaja.
47002017	Faith	Bajirãju̶ma, gãjerã, jãjarã ñarãma, Dios ocare gotimasiorã. Ĩnama, “Tire goticõari, gãjoa bu̶jarãsa” yirã ñaama. Yu̶aju̶ama, ĩnare bajiro yirã me ñaja. Jesucristo yarã, Dios ĩ cõariarã ñari, ĩ ĩaro rĩjoroju̶a rũ̶cu̶bu̶ose rãca ĩ ocare gotimasiorũgũaja.
45015001	Recommendation	“Cristo yu̶are ejarẽmogũ̶mi” yitu̶oĩarã ñaboarine, tu̶oĩagüirãre, “To bajiro mu̶a bajise quẽnabeaja” ĩnare yimenane, ĩnare rũ̶cu̶bu̶ocõaña. Mu̶a ñaroti rĩne tu̶oĩamenane, tu̶oĩagüirãre ĩnare ejarẽmoroti ñaja.
50002024	Faith	Tire mu̶are gotiboarine, “Mani u̶ju̶ ĩ ejarẽmose rãca yu̶ bajijama, yu̶ quẽne ĩ rãca mu̶are ĩagũ̶ varu̶cu̶ja”, yitu̶oĩaja yu̶.
66007001	Description	To ĩna yiro bero, ángel mesa babarirãcu̶ ĩacaju̶ yu̶. Ju̶doaga sojeju̶ ñacami sĩgũ̶. Jũnaga sojeju̶ ñacami gãji. Varuaga sojeju̶ ñacami gãji. To bajicõari, gajejacatu̶aju̶a varuaga sojeju̶ ñacami gãji. To bajirone ñacõacama ĩna, “Mino vabeticõato” yirã. To ĩna bajijare, adi sita joe, riagari joe quẽne, mino vabeticaju̶. Yucú̶ joere quẽne, mino vabeticaju̶.
60004003	Sin	Ado bajiro ti bajijare, to bajiro yirũgũroti ñaja mu̶are: Diore mu̶a masiroto rĩjoro, mu̶a masu mu̶a bojarore bajiro, ado bajiro yirũgũñuja mu̶a maji: Rojose yirã ñari, rõmia rãca ajeriarã cu̶tirũgũñuja mu̶a. Idire mecu̶ose idimecu̶cõari, rojose yicudirũgũñuja mu̶a. “Ado bajirã ñarãma” ĩna masune yiquẽnorujeocõari, ĩna rũ̶cu̶bu̶orãre mu̶a quẽne rũ̶cu̶bu̶orũgũñuja.
66011005	Violence	Gotirẽtobosarimasare ĩaterã, ĩnare rojose ĩna yiru̶aboajama, ĩna riseriju̶ jea budicaju̶. Ti rãca ĩnare soereajeocõacama ĩna.
44023005	Recommendation	To ĩna yijare, ado bajiro yiyuju Pablo: —“Paia u̶ju̶ ñamasugũ̶ ñagũ̶mi”, yimasibeju̶ yu̶. “Mu̶are ũmato ñagũ̶re ĩre tud'ibesa”, yigotiaja Dios oca masa ĩna ucamasire —ĩnare yiyuju Pablo.
66022015	Sin	Adocãrãca vãme rojose yirã ñaama ti macare sãjabetirona: Gãjerãre rojarã, Dios ĩ bojabetire yirã, ĩna ruju̶ ti bojarore bajiro gãmerã ajeriarã cu̶tirã, sĩarimasa quẽne, “Ado bajirã ñarãma” ĩna masune yitu̶oĩa quẽnorujeocõari, rũ̶cu̶bu̶orã quẽne sãjabetiru̶arãma. To yicõari, socase yirã quẽne sãjabetiru̶arãma ti macare —yu̶re yigoticami ángel.
66002014	Sin	To bajiro mu̶are quẽnaro yiboarine, ado bajiro mu̶a yiseju̶are ĩavariquẽnabeaja yu̶: Mu̶a rãcana sĩgũ̶ri, Balaam vãme cu̶ticacu̶, Balac vãme cu̶ticacu̶re ĩ gotimasiocatire ajisu̶yacanare bajiro yama ĩna. Ado bajiro gotimasiocami Balaam, Balac vãme cu̶tigu̶re gotigu̶: “Israelita masare rojose mu̶ yiroru̶ajama, ũ̶mu̶are ado bajise rojose yi ocasãña: ‘Yu̶a quẽnor'ire rũ̶cu̶bu̶orã vaibu̶cu̶re sĩacõari, ĩ tu̶ju̶ yu̶a cũru̶are riire mu̶a bajaquẽne, quẽnaru̶aroja. To yicõari, yu̶a yarã rõmia rãca mu̶a ajeriarã cu̶tijaquẽne, quẽnaru̶aroja ti’ ĩnare yi ocasãña”, yigotimasiocami Balaam.
53001003	Faith	Yu̶are ajiya yu̶a mairã. Tocãrãcajine mu̶a bajisere yu̶a tu̶oĩajama, “Quẽnaro yaja mu̶”, Diore ĩre yirũgũaja yu̶a. Bu̶tobu̶sa Jesucristore ajitirũ̶nu̶rũtuana yaja mu̶a. To yicõari, bu̶tobu̶sa gãmerã ĩamairũtuana yaja mu̶a. Dios mu̶are ĩ ejarẽmojare, to bajiro bajiaja mu̶a. To bajiro ĩ yijare, to bajiro mu̶a bajisere tu̶oĩacõari, “Quẽnaro yaja mu̶”, ĩre yirũgũaja yu̶a.
46012002	Sin	Diore mu̶a ajirũ̶cu̶bu̶oroto rĩjoro, mu̶are yitorimi vãtia u̶ju̶, Satanás. To ĩ yijare, “Ado bajirã ñarãma” ĩna masune yitu̶oĩa quẽnorujeocõari, ñagõmena ĩna ñaboajaquẽne, “Rẽtoro masirã ñarãma” socarãne yirũ̶cu̶bu̶orã ñañuja mu̶a maji.
49005025	Recommendation	Ũ̶mu̶are quẽne gotigu̶ yaja yu̶: Cristo manire ĩ mairore bajiro mu̶a manajoare ĩnare maiña mu̶a. Manire maigũ̶ ñari, manire rijabosayumi Cristo. “Yu̶re ajitirũ̶nu̶rã bautiza ecorãre, rojose ĩna yisere masiriocõari, ‘Yu̶ yarã ñaama’ ĩnare yiĩaru̶cu̶ja yu̶” yigu̶, rijabosayumi Cristo.
45012017	Recommendation	Quẽnase rĩne yirũgũña mu̶a, “Quẽnaro yirã ñaama” masa ĩna yiĩarotire yirã. Rojose mu̶are yirãre ĩnare gãmebesa mu̶a.
60005006	Recommendation	To bajiri Diore, “Yu̶a rẽtoro ñamasugũ̶ ñaami” yirã, quẽnaro yirũ̶cu̶bu̶orũgũña mu̶a. “Yu̶a u̶ju̶, ñajediro masijeogu̶ ñaja mu̶. Mu̶ bojarore bajiro bajiato”, ĩre yirũ̶cu̶bu̶orũgũña. To bajiro mu̶a yijama, “To cõrone adi macaru̶cu̶ro jedicoaru̶aroja” Dios ĩ yitu̶oĩariarũ̶mu̶ ti ejaro, “Gãjerã rẽtoro ñamasurã ñato” yigu̶, mu̶are yiru̶cu̶mi Dios.
44014017	Grace	“Tone yicõato” yigu̶ ñaboarine, quẽnaro ĩnare yicoadimasiñumi Dios, “ ‘Quẽnagũ̶ ñaami’ yimasiato ĩna” yigu̶. Ĩne ñaami oco quedisere, rica cu̶tire quẽne mu̶are cõarũgũgũ̶ma, “Rodori rica cu̶tiato” yigu̶. Ĩne ñaami barere mu̶are cõarũgũgũ̶ma. Mu̶are quẽnaro ĩ yise ñajare, variquẽnaja mu̶a —ĩnare yigotiyujarã Pablo, Bernabé rãca.
54003011	Recommendation	Rõmiare quẽne, Cristore ajitirũ̶nu̶rãre ũmato ñarãre moabosarimasare gãjerã ĩna ĩarũ̶cu̶bu̶orãre bojaja mani. Socarãne, “Ado bajise rojose yima”, gãjerãre yigotirã me ñarãma. Quẽnaro tu̶oĩacõari, quẽnase rĩne yirã ñarãma. “Yiru̶arãja” ĩna yirore bajiro yirã ñarãma.
66002021	Sin	To bajiro rojose so yisere yitu̶jacõari, yu̶ bojaseju̶are so yirotire yoaro yubu̶sacõaboaja yu̶. Ajeriarã cu̶ti tu̶jaru̶abeamo so.
44012020	Description	Tirũ̶mu̶rire Tiro vãme cu̶ti macanare, to yicõari Sidón vãme cu̶ti macanare quẽne bu̶to ĩnare jũnisiniñuju Herodes. To bajiri Sidón macana, Tiroana rãca rẽjacõari, Herodere ñagõrã vasujarã ĩna. “Herodes ĩ jũnisinicõa ñajama, u̶ju̶ ĩ ñari sita bare mani bu̶jarũgũsere ĩsibecu̶mi” yirã ñari, to bajiro bajiyujarã ĩna. Herodes tu̶ju̶re ñañuju ĩre ejarẽmogũ̶ ñamasugũ̶, Blasto vãme cu̶tigu̶. To bajiri Herodere ĩna ñagõroto rĩjoro, ĩre ñagõñujarã ĩna, Blastore. To ĩna yise ñajare, ĩnare ĩamaicõari, ĩnare ñagõbosayuju Blasto. Ĩnare ĩ ñagõbosarone, “Cojorũ̶mu̶ ĩnare ñagõru̶cu̶ja yu̶ maji”, ĩre yiyuju Herodes.
43008049	Sin	To bajiro ĩna yisere ajicõari, ado bajiro ĩnare yicami Jesús: —Vãti sãñagũ̶ me ñaja yu̶ma. Yu̶ jacu̶ Diore quẽnase ĩre yirũ̶cu̶bu̶oaja yu̶. Mu̶ama, yu̶re rũ̶cu̶bu̶obeaja mu̶a.
43006018	Description	To yu̶a bajijẽarũtuatone, bu̶to mino vacaju̶. To bajica yiro, bu̶to sabetu̶ocõacaju̶ ti.
45008018	Faith	To bajiri adirũ̶mu̶ri, “¿No yirã rojose tãmu̶oati mani?”, yitu̶oĩa su̶tiritibetiroti ñaja manire, rojose mani tãmu̶ose rẽtoro quẽnaro Diorãca ñarona ñari.
62002012	Grace	Mu̶a jediro, yu̶ rĩare bajiro bajirã, adi queti mu̶are ucaja yu̶: Jesús manire ĩ rijabosare ñajare, rojose mu̶a yisere Dios ĩ masiriorã ñarãja mu̶a.
55001009	Grace	Cristo ĩ rijabosare su̶orine, “Rojose mana ñaama”, manire yiĩañumi Dios. To yicõari, “Yu̶ yarã ñari, quẽnaro yirã ñaña”, manire yiyumi. Adi macaru̶cu̶ro ĩ rujeoroto rĩjoroju̶ne, “Ĩnare mairu̶cu̶ja” yimasir'i ñari, quẽnase mani yibetiboajaquẽne, “Rojose mana ñaama”, manire yiĩañumi Dios.
43019006	Violence	To bajiro ĩ yirone, Jesús ĩ budiadore ĩacõari ado bajiro avasãcama ĩna paia u̶jarã, Diore yirũ̶cu̶bu̶oriavi coderimasa quẽne: —¡Yucú̶tẽroju̶ ĩre jajutuya! ¡Ĩre jajutuya! —yiavasãcama ĩna. To bajiro ĩna yirone, —¡Mu̶a masune ĩre ãmivacõari yucú̶tẽroju̶ ĩre jajutuaya mu̶a! Yu̶ju̶a yu̶ ĩajama, ñieju̶a rojose yigu̶ me ñaami —ĩnare yicami Pilato, jud'io masare.
60001010	Grace	To bajiro quẽnaro Dios manire ĩ yirotire gotiyuma tirũ̶mu̶ana, Diore gotirẽtobosariarã. Quẽnagũ̶ ñari, manire ĩamaicõari, quẽnaro ĩ yirotire gotiboarine, bu̶tobu̶sa tire masiru̶aboayujarã ĩna. To bajiri Diore ĩna gotirẽtobosarere quẽnaro buecõari, bu̶to tu̶oĩarũgũñujarã ĩna.
63001007	Sin	Socase gotimasiocudirimasa, jãjarã ñarãma. “Manire bajiro ruju̶ cu̶tigu̶ me ñañuju Jesucristo”, yisocarãma. To bajise yirã ñari, Cristore terã ñarãma.
44024005	Sin	Ãni Pablo vãme cu̶tigu̶, yu̶a jud'io masa jedirore bu̶to gotimavisiocudirũgũami. To bajiro ĩ yijare, quẽnaro ñamasibeaja yu̶a. To bajiri, nazareno masare socase yirãre ĩnare ũmato ñagũ̶ ñaami. Tire masiaja yu̶a.
54003016	Grace	Cristo su̶orine manire quẽnaro Dios ĩ yire queti quẽnamasuse ñaja. Masa ĩna masibeti ĩ ejarẽmose rãca mani masise ñaja. Ado bajiro bajiaja ti: Adi macaru̶cu̶roju̶ vadicõari, manire bajiro ruju̶ cu̶tiyuju Cristo. To bajicõari, Esp'iritu Santo su̶orine, “Ñie rojose magũ̶ ñaami”, yiĩañujarã masa. Ángel mesa quẽne, ĩna ĩarũ̶cu̶bu̶ogu̶ ñañuju. Masa jedirore ĩ ocare gotimasioñujarã. To bajicõari, tocãrãca sitana ĩ ocare ajitirũ̶nu̶ñujarã. Manire rijabosacõari, ĩ tudicatiro bero, õ vecaju̶ ĩ ñaroju̶ ĩre ãmicoasuju Dios.
66016021	Violence	To bajicõari, õ vecaye oco vetacujiri vẽjacaju̶. Cuarenta kilos rẽtoro rũ̶cu̶ricujiri ñacaju̶ ti. Tire tãjo ecocõari, bu̶to rojose Diore ñagõmacacama masa.
61003013	Faith	To bajiro bajiroti ti ñaboajaquẽne, “Dios ĩ gotiriarore bajirone quẽna adi macaru̶cu̶roayere, to yicõari, õ vecayere quẽne reajeocõari, quẽnase rĩne mame rujeovasoaru̶cu̶mi Dios”, yitu̶oĩavariquẽnaja mani. To bajiro ĩ yiro beroju̶re Dios ĩ bojarore bajiro quẽnaro yirã rĩne catiru̶arãma.
66006014	Description	To bajicõari, ũ̶mu̶agasero yayicoacaju̶. Paperajoti tũnariarore bajiro bajiyayicoacaju̶. Jediro gũ̶tau̶rire, yucú̶yoarire quẽne yivãreocõari, gajeroju̶ tire cõacami Dios.
58010010	Grace	To bajiri Dios ĩ rotiriarore bajirone yigu̶, cojojine manire rijabosayumi. To bajiro ĩ bajire ñajare, rojose mani yisere masiriocõari, “Rojose mana ñaama”, manire yiĩagũ̶mi Dios.
52001002	Faith	Tocãrãcajine Dios mani jacu̶re ĩre sẽnirã, mu̶a jediro mu̶a bajisere tu̶oĩacõari, “Quẽnaro yaja mu̶”, ĩre yisẽnirũgũaja yu̶a.
66006004	Violence	To ĩ yirone, caballo sũagũ̶re ĩacaju̶ yu̶. Ĩ joe jesagu̶ jariase jairijãi ĩsiecocami. To yicõari, “Ado bajiro yiru̶cu̶ja mu̶”, yiecocami: Masa quẽnaro ĩna ñabetirotire yigu̶, to yicõari, ĩna gãmerã sĩarotire yigu̶, cũecocami.
54006001	Recommendation	Jesucristore ajitirũ̶nu̶rã gãjerãre moabosarã, ĩna u̶jarãre rũ̶cu̶bu̶oroti ñaja. Ĩna u̶jarãre rũ̶cu̶bu̶obetire ĩacõari, “Rojose yirã ñaama Cristore ajitirũ̶nu̶rã; vaja maja ĩna gotimasiose”, yiru̶arãma gãjerã.
51003009	Recommendation	Mu̶a socarũgũriarore bajiro socabesa mu̶a. Cristore mu̶a ajitirũ̶nu̶su̶orone, mu̶are ejarẽmosu̶oyumi. To bajicõari, quẽnabu̶saro Diore mu̶a masirotire yigu̶, mu̶a rãca ñacõa ñagũ̶mi. To bajiri ñajediro rojose yibetiroti ñaja.
66002020	Sin	To bajiro quẽnaro mu̶a yise ti ñaboajaquẽne, ado bajise mu̶a yiseju̶are ĩavariquẽnabeaja yu̶: Mu̶a tu̶ago Jezabel vãme cu̶tigo socase so gotimasiosere ajicõari, “Soco yaja mu̶. Gotimasiobeticõaña mu̶”, sore yibeaja mu̶a. “Cristo oca riojo gotimasiogõ ñaja yu̶” yitocõari, so gotimasiose su̶orine yu̶ bojase yirã ñaboarã, ado bajiro rojose yama: Ajeriarã cu̶tirã ñaama. To bajicõari, gãjerã ĩna quẽnor'ire rũ̶cu̶bu̶orã vaibu̶cu̶re sĩacõari, ĩ tu̶ju̶ ĩna cũru̶are riire barã ñaama.
48003008	Grace	Ado bajiro ti bajijare, to bajiro yimasiaja mani: Tirũ̶mu̶ju̶ adi macaru̶cu̶roju̶ ĩ macu̶re Dios ĩ cõaroto rĩjoroju̶, “Jud'io masa me ñarã quẽne, Abraham, yu̶re ĩ ajitirũ̶nu̶rore bajiro yu̶ macu̶re ĩna ajitirũ̶nu̶jama, ‘Rojose maja’ ĩnare yiĩaru̶cu̶ja”, yitu̶oĩamasiñuju Dios. Tire tu̶oĩacõari, ado bajiro Abraham ñamasir'ire ĩre gotimasiñuju: “Mu̶ su̶orine masa jedirore quẽnase ĩnare yiru̶cu̶ja yu̶”, yimasiñuju Dios.
58012005	Recommendation	Diore ajitirũ̶nu̶rã ñari, ĩ rĩare bajiro bajirãre, “Rojose tãmu̶orã ñaboarine, ‘Ĩ yirore bajiro yigu̶ ñagũ̶mi’ yu̶re yitu̶oĩa tu̶jabeticõato ĩna” yigu̶, mu̶are gotimasioñumi. Tire masiritirãja mu̶a. Ado bajise gotiaja ti Dios ocare masa ĩna ucamasire: “Macu̶, ‘Ado bajiroju̶a yiya’, mu̶re yu̶ yisere ajitebesa. Rojose tãmu̶ogũ̶ ñaboarine, yu̶ bojarore bajiro yicõa ñaña.
58013017	Recommendation	Mu̶are ũmato ñarãre quẽnaro cu̶diya mu̶a. “ ‘¿No bajiro ĩnare ĩatirũ̶nu̶cati mu̶a?’ manire yisẽniĩagũ̶mi Dios” yimasirã ñari, tocãrãcarũ̶mu̶ne, “Diorãca quẽnaro ñato ĩna” yirã, mu̶are ĩatirũ̶nu̶rũgũrãma ĩna. To bajiri, quẽnaro ĩnare mu̶a cu̶dijama, to bajiro mu̶a yisere, “Ado bajiro quẽnaro mu̶re ajitirũ̶nu̶cama ĩna”, Diore ĩre yivariquẽnaru̶arãma ĩna.
44013019	Description	Bero, ĩ su̶orine Canaán sita ñarimacarianare heteo masare, gergeseo masare, amorreo masare, cananeo masare, ferezeo masare, heveo masare, to yicõari jebuseo masare quẽne ĩnare sĩareacõari, ĩna ñaboaria macarire ñamasiñujarã ĩna. To bajiro ĩna bajijama, “Yu̶ yarãju̶a, ti sitare ñaru̶arãma” Dios ĩ yimasire ñajare, to bajiro bajiyuma ĩna.
54006003	Faith	Mani u̶ju̶ Jesucristo ocare buerẽtobuboarine, ricati gotimasiorã ĩna bajisere gotiaja yu̶: Dios ĩ bojase mani yisere riojo gotimasiomena ñarãma.
63001010	Recommendation	To bajiri, Cristo oca me, ricati mu̶are gotimasiorimasa mu̶a ya viju̶ ĩna ejajama, ĩnare sẽnibeja. To yicõari, ĩnare sãjarotibeja.
47001005	Grace	“Diorãca quẽnaro ñato” yigu̶, rojose manire tãmu̶obosayumi Cristo. To bajiri, gãjerã Diorãca quẽnaro ĩna ñarotire yirã, rojose tãmu̶obosarũgũaja yu̶a quẽne. Bu̶tobu̶sa rojose yu̶a tãmu̶oñaro rĩne, “Su̶tiriti tu̶jacõari, variquẽnato” yigu̶, bu̶tobu̶sa quẽnaro manire ejarẽmorũgũgũ̶mi Cristo. To bajiro ti bajijare, “Quẽnaro yaja mu̶”, Diore ĩre yivariquẽnarũgũaja yu̶a.
65001011	Sin	Tirũ̶mu̶ana ñamasiriarã rojose ĩna yimasiriarore bajiro yirã ĩna ñajare, bu̶to rojose ĩnare yiru̶cu̶mi Dios: Ca'in ñamasir'i, rojose ĩ tãmu̶oriarore bajiro tãmu̶oru̶arã, rojose yirũgũama ĩna quẽne. To bajicõari, Balaam ñamasir'i ĩ yimasiriarore bajiro yirã, gãjoaju̶are bojamasucõarã ñari, Dios ĩ bojasere yibetirũgũrãma. Coré ñamasir'i ĩ bajimasiriarore bajiro yirã, ĩna u̶jarã ĩna rotisere cu̶dibetirũgũama ĩna quẽne. To bajiro ĩna bajise vaja, rojose ĩnare ĩ yimasiriarore bajiro rojose tãmu̶otu̶jabetiriaroju̶ ĩnare cõaru̶cu̶mi Dios.
65001010	Sin	Satanáre ĩ tud'ibetiboajaquẽne, socase gotimasiorãju̶ama, ángel mesare, vãtiare quẽne ĩna bajisere masimena ñari, rũ̶cu̶bu̶obetirũgũama. To bajicõari, ĩna ruju̶ ti bojarore bajiro yirã, “Bojoneose yirã yaja” yimasimenane, tire yirũgũrãma. To bajiro yirã ñari, rojose tãmu̶otu̶jabetiriaroju̶ varona ñarãma.
58011007	Faith	“Ĩ yirore bajiro yigu̶ ñagũ̶mi”, Diore ĩre yitu̶oĩagũ̶ ñamasiñuju Noé ñamasir'i quẽne. Ado bajiro ĩre yimasiñuju Dios: “Masa ñajedirore ruureajeocõaru̶cu̶ja yu̶. To bajiri, cũmua jairica quẽnoña mu̶, ‘Rujarobe’ yigu̶”, ĩre yimasiñuju Dios. To bajiro ĩ yijare, bajirotire masibetiboarine, “Ĩ yirore bajiro yigu̶ ñagũ̶mi” Diore ĩre yitu̶oĩagũ̶ ñari, ĩ gotirore bajirone yigu̶, cũmua jairicare quẽnomasiñuju Noé. To bajiri ĩ yarã rãca Noé ĩ rujaborotire ĩnare yirẽtobosamasiñuju Dios. To bajiboarine, gãjerãrema ĩ rãcana ñaboariarãre, “Ĩ yirore bajiro yigu̶ ñagũ̶mi Dios” yitu̶oĩamena ĩna ñajare, ĩnare yirẽtobosabetimasiñuju Dios. Noéju̶arema, “Ĩ yirore bajiro yigu̶ ñagũ̶mi” yu̶re yitu̶oĩagũ̶ ĩ ñajare, “Yu̶ ĩavariquẽnarã rãcagu̶ ñaami, ĩ quẽne”, Noére ĩre yimasiñuju Dios.
58009006	Description	To bajiboarine, Diore rũ̶cu̶bu̶oroti ti ñajedicõajare, tocãrãcarũ̶mu̶ne Diore rũ̶cu̶bu̶orã sãjaejarũgũmasiñujarã paia, ñasu̶orisõare.
44007051	Sin	To bajiro ĩnare yigajano, ado bajiro ĩnare gotirẽmoñuju quẽna: —Dios ocare ajitirũ̶nu̶betirũgũaja mu̶a. “Dios magũ̶mi” yirãre bajiro ĩ ocare ajiteaja mu̶a. Mani ñicu̶are bajiro Dios ĩ cõagũ̶ Esp'iritu Santore cu̶dimena ñaja mu̶a.
54001009	Sin	Ĩ roticũmasirere masicõari, “Diore cu̶dibeaja yu̶. To bajiri rojose ñaja yu̶re” masa ĩna yirotire bojagu̶ ñari, tire cũmasiñumi Dios. To bajiri, quẽnaro yirãre tu̶oĩagũ̶ me, ĩ rotimasirere cũmasiñumi. Rojose yirãju̶are tu̶oĩagũ̶, tire cũmasiñumi. Ĩre rũ̶cu̶bu̶omenare, Dios yere ajatud'irãre, jacu̶are sĩarãre, to yicõari, gãjerãre sĩarimasare tu̶oĩagũ̶, ĩ rotimasirere cũmasiñumi.
46005009	Recommendation	Tirũ̶mu̶ju̶ papera mu̶are cõagũ̶, ado bajiro gotiboacaju̶ yu̶: “Gãmerã ajeriarã cu̶tirã rãca ñabesa”, mu̶are yiucaboacaju̶ yu̶.
48001015	Grace	To bajiro yu̶ bajiboajaquẽne, yu̶ ruyuaroto rĩjoroju̶, “Ãni Pablo, bu̶cu̶acu̶, yu̶ yu̶ ñaru̶cu̶mi”, yitu̶oĩañumi Dios. To yicõari, beroju̶, bu̶to quẽnagũ̶ ñari, yu̶re ĩamaicõari, “¿Yu̶ yu̶, yu̶ bojasere yigu̶ ñaru̶abeati mu̶?”, yu̶re yicami.
45007015	Description	Mani bajisere ajimasibeaja mani. Quẽnasere mani yiru̶aseju̶arema yibetirũgũaja mani. To yicõari, “Rojose yibetiru̶arãja” mani yitu̶oĩaseju̶are yirũgũaja mani.
61003018	Faith	Jesucristo ñaami mani u̶ju̶. Ĩ ñaami rojose mani yise vaja manire vaja yibosar'i, “Quẽnase rĩne yirã ñato” yigu̶. To bajiro yir'i ĩ ñajare, bu̶tobu̶sa ĩre ajitirũ̶nu̶rũtuasa mu̶a, “Quẽnagũ̶ ñari, quẽnaro manire yami” yimasicõari, bu̶tobu̶sa gãmerã maiña mu̶a. “Ñamasugũ̶ ñaami”, Jesucristore yirũ̶cu̶bu̶orũgũroti ñaja. To cõro ñaja.
46004010	Description	Cristo ĩ bojasere yirã yu̶a ñajare, “Tu̶oĩamasimena ñaama”, yu̶are yama masa. To bajiro yu̶are yiboarine, mu̶aju̶arema, masirãre bajiro mu̶are ĩama. “Dios ĩ ejarẽmobetijama, ĩ ocare quẽnaro gotimasimenaja mani”, yitu̶oĩarã ñaja yu̶a. To bajiro yirã yu̶a ñaboajaquẽne, “Dios oca quẽnaro masiaja yu̶a”, yirũgũaja mu̶a. Gãjerã ĩna rũ̶cu̶bu̶orã mu̶a ñaboajaquẽne, yu̶arema rũ̶cu̶bu̶obetirũgũama masa.
60005009	Faith	To bajiro ĩ yirotiboasere cu̶dibetirũgũña mu̶a. “Ĩ gotiriarore bajiro quẽnaro manire ejarẽmoru̶cu̶mi Dios” yitu̶oĩa tu̶jamenane, Dios ĩ bojaseju̶are yicõa ñarũgũru̶arãja mu̶a. “Adigodoana Cristore ajitirũ̶nu̶rã jediro, manire bajirone rojose tãmu̶orãma ĩna quẽne”, yimasiritibesa.
51003022	Recommendation	Moabosarimasare, mu̶are quẽne gotigu̶ yaja yu̶. Cojoji ru̶yabeto variquẽnase rãca mu̶are moare rotirãre quẽnaro cu̶diya mu̶a. “Manire moare rotirã ĩna ĩaro rĩne quẽnaro moaru̶arãja, ‘Manire ĩavariquẽnato’ yirã”, yitu̶oĩabetiru̶arãja mu̶a. Ĩna ĩaro, ĩna ĩabeto quẽne, quẽnaro ĩnare moabosarũgũru̶arãja mu̶a, “Ĩnare quẽnaro mani moabosabetijama, rẽtoro masigũ̶, mani u̶ju̶, Cristo, manire ĩavariquẽnabecu̶mi” yitu̶oĩa güirã ñari.
66017012	Description	Ju̶aãmo cõro jotari mu̶ ĩase, ju̶aãmocãrãcu̶ u̶jarã ĩna ñasere ĩoro bajiaja. Masare rotisu̶obeama maji. Bero güiogu̶ sũagũ̶ ĩ rotirirũ̶mu̶rire ĩna quẽne yoaro meaca rotirã ñaru̶arãma.
46002012	Grace	To bajiboarine, adigodoana Diore masimena ĩna tu̶oĩase ũni mere manire cõañumi Dios. Esp'iritu Santoju̶are manire cõañumi, manire ĩ u̶josere quẽnaro mani ajimasirotire yigu̶.
59005001	Recommendation	Sĩgũ̶ri, gajeyeũni jairãre mu̶are gotigu̶ yaja yu̶. Gajerũ̶mu̶ bu̶to rojose mu̶a tãmu̶orotire tu̶oĩaotiya mu̶a.
66002010	Recommendation	Rojose mu̶are ĩna yirotire tu̶oĩagüibesa. “Sĩgũ̶ri, tubiberiaviju̶ tubibe ecoato ĩna” yigu̶, mu̶are yiru̶cu̶mi Satanás. “Cristore ajitirũ̶nu̶ tu̶jato” yigu̶, to bajiro mu̶are yiru̶cu̶mi. To ĩ yiroti ñajare, ju̶aãmo cõro ñarirũ̶mu̶ri rojose tãmu̶oru̶arãja mu̶a. Rojose tãmu̶oboarine, yu̶re ajitirũ̶nu̶ tu̶jabesa. Mu̶are ĩna sĩaroti ti ñaboajaquẽne, yu̶re ajitirũ̶nu̶ tu̶jabesa. To bajiro mu̶a bajijama, “Rijacoaboarine, quẽna tudicaticõari, rijarona me ñato” yigu̶, mu̶are yiru̶cu̶ja yu̶.
54006011	Recommendation	To bajiro ĩna yiboajaquẽne, mu̶ju̶ama, Dios yu̶ ñari, ĩnare bajiro yibesa. Dios ĩ bojarore bajiro quẽnase rĩne yirũgũña. Bu̶to rojose tãmu̶oboarine, Cristore ajitirũ̶nu̶ tu̶jabesa. Gãjerãre rũ̶cu̶bu̶ocõari, quẽnaro ĩnare yirũgũña.
