45002001	Sin	“Rojose ĩna yise vaja Dios rojose ĩnare ĩ yijama, riojo yigu̶ yigu̶mi” yitu̶oĩacõari, “Quẽnarã ñaja yu̶a; yu̶arema rojose yibecu̶mi” mu̶a yitu̶oĩaboajaquẽne, “Yu̶are quẽne, rojose yu̶are yato Dios” yirã yirãja mu̶a. Rojose ĩna yirore bajirone rojose yaja mu̶a quẽne. To bajiri, “Rojose yimena ñaja yu̶a”, yimasimenaja mu̶a.
48002009	Description	To bajiri ti macana yu̶a rãca rẽjacana, ñamasurã ñacama Santiago, Pedro, Juan quẽne. Yu̶ gotisere ajicõari, “Dios, quẽnagũ̶ ñari, to bajiro Pablore gotimasio roticõañumi”, yimasicama ĩna. To bajiro yirã ñari, yu̶re, yu̶ rãcagu̶ Bernabére quẽne, ado bajiro yu̶are goticama ĩna: “Yu̶are bajiro Dios ĩ bojasere yirã ñaja mu̶a quẽne. Jud'io masare yu̶a gotimasiosere Dios ĩ bojarore bajiro jud'io masa mere mu̶a gotimasiosere bojaami”, yu̶are yigoticama ĩna.
43019023	Description	Yucú̶tẽroju̶ Jesúre jajutugajanocõari, ĩ sudi sãñaboarere juacama ĩna surara. Babaricãrãcaju̶ vocõari, gãmerã batocama ĩna. To bajiri, cojasene ru̶yacaju̶ ti, ĩna ãmirotiase. Jesús ĩ sãñarito joeado tiayamano ñacaju̶ ti. Riojone suamu̶jagajanoriaro ñacaju̶ ti.
45002021	Sin	To bajiri gãjerã masare gotimasioboarine, ¿mu̶aju̶ama gãjerãre mu̶a gotimasiorore bajiro yibeati mu̶a? Gãjerã masare, “Mu̶a juarudijama, quẽnabeaja ti” yigotiboarine, mu̶aju̶ama juarudirãja mu̶a.
46006019	Faith	Esp'iritu Santore mani u̶su̶riju̶re manire cõañumi Dios. To bajiri mani u̶su̶riju̶ ĩ ñajare, “Esp'iritu Santo ĩ ñarivire bajiro bajiaja”, yimasirãja mu̶a. To bajiri mani ruju̶, mani masu ruju̶ me ñaja. Dios ye ñaja.
47005014	Grace	“Manire ĩamaiami Cristo” yitu̶oĩacõari, ĩre cu̶diru̶aja yu̶a. Manire bu̶to ĩamaigũ̶ ñari, rojose mani yise vaja manire rijabosayumi. To bajiri, “Ĩre ajitirũ̶nu̶rãre manire ĩ rijabosare ñajare, mani quẽne ĩ rãca rijariarãre bajiro bajiyuja”, yitu̶oĩaja mani.
58003001	Faith	To bajiri, “Jesús manire ejarẽmogũ̶ ñaami”, yimasiaja mani. Maniju̶a, “Dios ĩ ejarẽmose rãca Cristore ĩre ajitirũ̶nu̶roti ñaja” yimasicõari, ĩre cu̶dirã ñaja mani. “Yu̶ yarã ñato” Dios ĩ yiriarã ñaja. Jesúju̶a ñagũ̶mi, “Masare quẽnaro yu̶ yirotire gotiba” Dios ĩ yicõar'i. To bajicõari, tirũ̶mu̶ju̶ paia u̶jarã ĩna yisu̶oadimasire ũnire yigu̶, Cristo quẽne rojose mani yisere “Masirioato Dios” yigu̶, manire sẽnibosagu̶ ñagũ̶mi. To bajiri, “Ñamasugũ̶ ñagũ̶mi Jesús”, yitu̶oĩato mani.
44020035	Recommendation	To bajiro yu̶ yijama, “Mani bojasere, to yicõari, maioro bajirã ĩna bojasere ĩnare vaja yiĩsiru̶arã, quẽnaro moarũgũroti ñaja” yigu̶, yicaju̶ yu̶. Ti ũnire ado bajiro manire gotimasioñuju mani u̶ju̶ Jesucristo: “Ĩsiecocõari, ĩ variquẽnaro rẽtoro variquẽnagũ̶mi gãjerãre ĩ ĩsijama”, manire yigotiyuju Cristo. To bajiri, tire masiritibeticõaña mu̶a —ĩnare yigoticami Pablo, Efesoana Jesúre ajitirũ̶nu̶rãre ũmato ñarãre.
58013004	Recommendation	Gãmerã mu̶a bojasere quẽnaro rũ̶cu̶bu̶oroti ñaja. Manajo cu̶tirã, manaju̶ cu̶tirã, manajo mana, manaju̶ mana quẽne gãjerã rãca ajeriarã cu̶tibesa. To bajiro mu̶a yijama, “Rojose tãmu̶oru̶arãma”, mu̶are yiru̶cu̶mi Dios.
43020005	Description	Mubiacõari, ti vire ĩasõcaju̶ yu̶. Ĩre ĩna gũmaboare rĩne ñacaju̶. Sãjabeticaju̶ yu̶, bajigu̶ju̶ma.
66016018	Description	To ĩ yirone, bu̶to bu̶jo yabecõari, jacami. To bajicõari, güiose ocaruyucaju̶. To bajicõari, sita bu̶to sabecaju̶. Adi macaru̶cu̶roana ĩna sabe ecoriaro rẽtoro sabecaju̶.
66019010	Faith	To ĩ yijare, ĩre rũ̶cu̶bu̶ogu̶, ĩ rĩjoroju̶a gu̶somuniari tuetuejarũjũcaju̶ yu̶. To bajiro yu̶ bajirone, ado bajiro yu̶re goticami: —To bajiro yu̶re rũ̶cu̶bu̶obesa. Yu̶ quẽne, mu̶re bajirone Dios ĩ bojasere yigu̶ ñaja. Jesús oca riojo gotisere ajitirũ̶nu̶ tu̶jamenare bajiro bajigu̶ ñaja yu̶ quẽne. To bajiri, Dioju̶are mu̶ rũ̶cu̶bu̶ojama, quẽnaja —yu̶re yigoticami ángel. —Jesús ĩ gotimasiorotire, ti ñaja Diore gotirẽtobosarimasa mu̶a gotimasio variquẽnase —yu̶re yigoticami ángel.
46002010	Grace	Yucu̶rema, mani masibetirũgũrere Esp'iritu Santo ĩ ejarẽmose su̶orine Dios ĩ u̶josere masiaja mani. Ñajediro masiami Esp'iritu Santo. Dios ĩ tu̶oĩasere quẽne masigũ̶ ñaami.
50002029	Recommendation	Cristo oca yu̶ gotimasiosere yu̶re ejarẽmobeaja mu̶a, sõju̶ ñarã ñari. “Ĩre gotirẽmoato” yirã, mu̶a cõar'i quẽne Cristo ocare gotimasiorũgũami. To bajiro yicudigu̶ne, bu̶to rijaye jairo ti ñajare, rijacoabocami. To bajiro bajicacu̶ ñaboarine, ĩ caticõajare, mu̶a tu̶ju̶ ĩ ejaro, variquẽnase rãca ĩre sẽniru̶arãja mu̶a. Ĩre bajiro Cristo ocare goticudirãre quẽne, quẽnaro ĩnare yiya.
51003020	Recommendation	Rĩamasaju̶are, ado bajise mu̶are quẽne gotiaja yu̶: Tocãrãcajine mu̶a jacu̶a ĩna rotirore bajirone cu̶dirũgũru̶arãja mu̶a. To bajiro mu̶a yisere ĩacõari, variquẽnaru̶cu̶mi mani u̶ju̶.
47001012	Faith	Ado bajise tu̶oĩacõari, variquẽnaja yu̶a: “Dios ĩ bojarore bajiro masare quẽnaro yicaju̶ mani”, yitu̶oĩaja yu̶a. Masare yitorã me ñaja yu̶a. “Corinto macana rãca ñarã, quẽnaro Dios ocare gotimasiocaju̶”, yitu̶oĩaja yu̶a. Yu̶are quẽnaro yiyumi Dios, “Gãjerãre quẽnaro yato” yigu̶. Yu̶a masune yu̶a tu̶oĩasene gotibeticaju̶. Dios ĩ masise rãca to bajiro yicaju̶ yu̶a.
43014021	Faith	Yu̶ rotisere cu̶digu̶ma, yu̶re maigũ̶ ñaami. Yu̶re maigũ̶rene ĩre mairu̶cu̶mi yu̶ jacu̶ quẽne. Yu̶ quẽne ĩre mairu̶cu̶ja yu̶. Ĩre maicõari, ĩ rãca ñagũ̶ ejaru̶cu̶ja yu̶. To yu̶ bajiro yu̶re ĩabetiboarine ĩ rãcane yu̶ ñasere “Masiato” yigu̶ ĩre rotiru̶cu̶ja yu̶ —yu̶are yicami Jesús.
51002023	Sin	Ĩna ajivariquẽnasere ĩna gotijama, tire ajicõari, “Quẽnaro gotimasiama”, yitu̶oĩaboarãma sĩgũ̶ri. To bajiro ĩna yiboajaquẽne, quẽnaro tu̶oĩarã me ñarãma. Ado bajise ĩnare gotimasioboarãma ĩna: “Yu̶a rũ̶cu̶bu̶orãre mu̶a quẽne mu̶a rũ̶cu̶bu̶ojama, quẽnaja. ‘Masirã me ñaja’ mu̶a yitu̶oĩajama, quẽnaja. Mani ruju̶re rojose mani yijama, quẽnaja. To bajiro mani yijama, rojose mani yisere yitu̶jaru̶arãja mani”, yitu̶oĩaboarãma. To bajiro ĩna yiboase socase ñaja.
64001006	Recommendation	Sĩgũ̶ri Cristo ocare gotimasiocudirimasa, adoju̶ Cristore ajitirũ̶nu̶rã ĩna rẽjariviju̶ ejacõari, “Quẽnaro yu̶are yirẽmocami”, yu̶are yigotima ĩna. To yicõari, quẽna mu̶ tu̶ju̶ ĩna ejaro, “Quẽnaro rẽtoajaro ĩna” yigu̶, Dios ĩ bojarore bajiro quẽnaro ĩnare mu̶ yirẽmojama, quẽnaroja.
55002023	Recommendation	Adigodoaye rĩne tu̶oĩacõari, “Gãmerã ñagõto mani” ĩna yijama, ĩnare ajibesa, “Tire mani gãmerã ñagõboajama, quẽnabetoja” yimasigũ̶ ñari.
47003018	Faith	Jesucristore ajitirũ̶nu̶rã ñari, “Quẽnarẽtogũ̶ ñagũ̶mi”, ĩre yitu̶oĩamasiaja mani. To bajiri, ĩ bojarore bajiro yirũgũaja mani. To yirã rĩne, bu̶tobu̶sa ĩre bajiro bajiru̶arãja mani, Esp'iritu Santo ĩ ejarẽmorã ñari.
58009014	Grace	“Vaibu̶cu̶rã ri'ine mu̶are ĩ yayeguojama yu̶re rũ̶cu̶bu̶oriavire sãjamasiru̶arãja mu̶a” Dios ĩ yimasire ti ñaboajaquẽne, “Cristo manire ĩ rijabosareju̶a rẽtoro quẽnase ñañuja”, yimasiaja mani. Rojose yibetir'i ñari, to bajiro bajiyumi Cristo. Esp'iritu Santo ñacõa ñarũgũrocu̶ ĩ ejarẽmojare. Cristo manire ĩ rijabosare su̶orine, rojose mani yisere masiriogu̶mi Dios. To bajiri, “Rojose maja manire”, yitu̶oĩaja mani. To bajiro yitu̶oĩacõari, ñacõa ñarũgũrocu̶ Dios ĩ bojarore bajiro quẽnaro yirũgũroti ñaja manire.
44011017	Grace	Jesucristore ajitirũ̶nu̶rã mani ñajare, Esp'iritu Santore manire ĩ cõacatore bajirone ĩnare quẽne cõacami Dios, jud'io masa me ĩna ñaboajaquẽne. Ĩnare quẽne to bajiro ĩ yijare, “Jud'io masa me ñari, mani rãcana me ñaama”, yimasibeaja yu̶ —ĩnare yiyuju Pedro.
49004030	Faith	Rojose mu̶a yijama, rojose mu̶a yisere ĩacõari bu̶to su̶tiritigu̶mi Esp'iritu Santo. Ĩne ñaami Dios manire ĩ cõar'i. “Ĩ su̶orine, Jesucristo yarã ñaja mani”, yimasiaja. Ĩre cõa ecorã ñari, rojose yimenane ñacõaña mu̶a, Jesucristo “Ĩnare yirẽtobosaru̶cu̶ja” ĩ yiriarũ̶mu̶ ti ejarotire yurã.
66003003	Recommendation	Tirũ̶mu̶ju̶ yu̶ ocare mu̶are ĩna gotimasiocatire ajicaju̶ mu̶a. Tire tuditu̶oĩacõari, ajitirũ̶nu̶ña quẽna. To bajiro mu̶a yibetijama, juarudirimasu̶re bajiro mu̶a masibetone rojose mu̶are yigu̶ ejaru̶cu̶ja yu̶.
62003007	Recommendation	Yu̶ rĩare bajiro bajirã, mu̶a vatoaju̶ mu̶are yitogu̶ “Manicõato” yirã, quẽnaro ajicõĩaña. Sĩgũ̶, “Quẽnaro yigu̶ ñaja” ĩ yisocabetijama, Cristo ĩ yiriarore bajiro quẽnaro ĩ yisere ĩamasiru̶arãja mu̶a.
62004001	Recommendation	Ajiya, yu̶ mairã. Jãjarã, “Dios ocare gotimasiorã ñaja yu̶a” yirã, Esp'iritu Santo rãca ñarã me ñarãma. To bajiri, “¿Esp'iritu Santo rãcana masune ñati?” mu̶a masune yitu̶oĩamasicõari, quẽnaro ĩnare ajicõĩaña, “Ĩna socajama, masiru̶arãja mani” yirã.
44013038	Grace	To bajiri, ado bajiro tu̶oĩaña mu̶a: “Moisés ñamasir'ire Dios ĩ roticũmasirere cu̶dijeoroti ñaja manire”, yimasicaju̶ mani. “Ñajedirore mani cu̶dijeojama, ‘Quẽnarã ñaama’ Dios ĩ yiĩarã ñari, mani rijato beroju̶ ĩ tu̶ju̶ ñaru̶arãja”, yicaju̶ mani. To bajiboarine, “Cu̶dijeogu̶ magũ̶mi”, yicoadicaju̶ mani. Yucu̶rema ado bajiroju̶a bajiaja yuja: Jesúre mani ajitirũ̶nu̶jama, rojose mani yisere masiriocõari, Jesús manire ĩ rijabosare su̶orine, “Ñie rojose mana ñaama”, manire yiĩagũ̶mi Dios.
50003001	Recommendation	Jesucristo yarã ñari, variquẽnaña mu̶a. Tirũ̶mu̶ju̶ mu̶are yu̶ ucacatire tudiucaja yu̶. To bajiro mu̶are yu̶ yicõa ñajama, “Gãjerã socase ĩna gotisere ajiroma” yigu̶, yaja.
46011034	Recommendation	Mu̶a rẽjaroto rĩjoro, mu̶a ñiorijajama, mu̶a ya viriju̶ mu̶a bajama, quẽnacõaroja. To bajiro mu̶a yijama, no yigu̶ rojose mu̶are yibecu̶mi Dios. Mu̶a tu̶ju̶ ejacõari, gajeye quẽnaro mu̶are gotiru̶cu̶ja yu̶.
43018031	Description	To bajiro ĩna yirone, —Ĩre ãmicoasa mu̶a. Mu̶a masune rojose ĩ yisere ĩacõĩajeocõari, rojose ĩ yise vaja rojose ĩre yiba mu̶a yuja —ĩnare yiboacami Pilato, jud'io masare. To bajiro ĩnare ĩ yirone, —Yu̶a, jud'io masama, masare sĩamasibeaja —Pilatore ĩre yicama ĩna.
46012031	Faith	To bajiri, jedirone masijeobetiboarine, quẽnamasuseju̶are ĩ u̶jorotire sẽniña. To bajiro mu̶a yiboajaquẽne, gajeye ñaja rẽtoro ñamasuse. Tire mu̶are gotigu̶agu̶ yaja yu̶.
58007026	Description	To bajiri tirũ̶mu̶ju̶ paia u̶jarã ĩna yisu̶oadimasire ũnire yigu̶, Cristo quẽne rojose mani yisere “Masirioato Dios”, manire yisẽnibosarũgũgũ̶ ñagũ̶mi. Cristo ñañumi masa rojose ĩna yirore bajiro yibecu̶. Quẽnase rĩne yigu̶ ñañumi. To bajiro bajir'i ĩ ñajare, Dios ĩ ñaroju̶, “Rẽtoro ñamasugũ̶ ñaru̶cu̶ja mu̶” Dios ĩ yir'i ñagũ̶mi.
50004013	Faith	To bajiro yu̶ bajise jedirore yu̶re ejarẽmorũgũami Cristo.
52004003	Recommendation	Ado mu̶a bajisere bojaami Dios: Dios yarã mu̶a ñajare, quẽnase rĩne mu̶a yisere bojaami. Manajo cu̶tirã, manaju̶ cu̶tirã, manajo mana, manaju̶ mana quẽne, mu̶a gãmerã ajeriarã cu̶tisere bojabeami.
51004002	Recommendation	Mu̶a jedirore gotigu̶ yaja yu̶. Tocãrãcarũ̶mu̶ne Diore sẽnirũgũroti ñaja. To yicõari, ĩ yirẽmosere masicõari, “Quẽnaro yaja mu̶”, yirũgũroti ñaja.
44007029	Description	To bajiro ĩ yisere ajicõari, Egipto sita ñar'i, Madián sitaju̶are rudicoamasiñuju Moisés. Toju̶ manajo bu̶jacõari, ju̶arã rĩa cu̶timasiñuju ĩ.
46011007	Description	To bajiri ũ̶mu̶a, Diore ĩna sẽnijama, ĩ ocare ĩna gotijaquẽne, ru̶joa jeoriarorire jeobetiroti ñaja, “Yu̶re rotibosacõari, yu̶re rũ̶cu̶bu̶oato” yigu̶, Dios ĩ rujeoriarã ñari. Rõmiaju̶ama, “Ũ̶mu̶are rũ̶cu̶bu̶oato” yigu̶, Dios ĩ rujeorio ñaamo.
51003015	Faith	Cristo su̶orine quẽnaro ñarã ñari, mu̶a yirotire tu̶oĩacõari, “To bajiro yu̶ yijama, ĩna rãca quẽnaro ñacõaru̶cu̶ja” yimasicõari rĩne, yiru̶arãja mu̶a. Quẽnaro mu̶a ñarũgũsere Dios ĩ bojajare, to bajiro yirũgũru̶arãja mu̶a. Ĩ su̶orine quẽnaro ñarã ñari, “Quẽnaro yaja mu̶”, Diore yirũgũru̶arãja mu̶a.
58002010	Grace	Adi macaru̶cu̶ro ñase jediro Dios ĩ rujeore ñaja. Quẽnaro ĩ rotimasijare, adi macaru̶cu̶ro bajise jediro bajiñarũgũaja. Jediro Jesucristo su̶orine, “Yu̶ yarã ñaama” Dios ĩ yiĩarã, “Yu̶ tu̶ju̶ ejamasiru̶arãma”, ĩnare yiyumi Dios. To bajiro yigu̶ ñari, “Rojose ĩna tãmu̶oborotire yirẽtobosaaya” yigu̶, ĩ macu̶re cõañumi Dios. To bajiro ĩ yiroticõajare, rojose tãmu̶ocõari, manire rijabosayumi Jesucristo.
59004001	Sin	¿Noju̶a vadiati gãmerã mu̶a ĩatese? Mu̶a masune rojose yiru̶a tu̶oĩacõari, rojosere gãmerã yirũgũaja mu̶a.
46005001	Sin	Gaje vãme mu̶are gotiru̶aja yu̶. Sĩgũ̶ mu̶a rãcagu̶ ĩ jacu̶ manajore ĩ ajerio cu̶tisere ajibu̶ yu̶. To bajiro ĩ yijama, bu̶to rojose yigu̶ yiyumi. Gãjerãju̶ama, Diore ajimena ñaboarine, ti ũnire yimenama ĩna.
46010013	Faith	Quẽnaro tu̶oĩaroti ti ñaboajaquẽne, “ ‘Rojose yiru̶abeaja’ yicõaboarine, rojose yicõaroti ñaja”, yitu̶oĩaroti me ñaja mu̶are. “Yu̶are rojose ĩ rotirore bajiro mu̶are rotibecu̶mi Satanás”, yiroti me ñaja. Gãjerãre rojose ĩ yirotirore bajiro rĩne manire yirotirũgũami. Rojose manire ĩ yirotiboajaquẽne, “Tire yibeticõari, yu̶ bojaseju̶are yirã ñato” yigu̶, manire ejarẽmoru̶cu̶mi Dios.
44020029	Violence	Yu̶ vaveoro bero ejaru̶arãma gãjerã, “Diore gotirẽtobosarimasa ñaja yu̶a” yitorimasa. Mu̶a ñaro vatoaju̶re ejacõari, ĩna gotitose su̶orine Jesúre ajitirũ̶nu̶ tu̶jacõari, rojose tãmu̶oru̶arãma mu̶a rãcana.
53001004	Faith	To bajiro bajirã mu̶a ñajare, tocãrãca macaju̶ gãjerã Jesús ocare ajitirũ̶nu̶rãre mu̶a bajisere gotirã, “Quẽnamasucõaama Tesalónica macana”, ĩnare yivariquẽnarũgũaja yu̶a. Ado bajiro ĩnare yirũgũaja yu̶a: “Tesalónica cu̶toana Cristore ajitirũ̶nu̶rã ĩna ñajare, rojose ĩnare yicoderũgũama gãjerã. To bajiro ĩna yiboajaquẽne, Cristore quẽnaro ajitirũ̶nu̶cõa ñaama ĩna”, ĩnare yivariquẽnarũgũaja yu̶a.
62004012	Faith	Dios, ruyubecu̶ ĩ ñaboajaquẽne, mani gãmerã ĩamaijama, “Mani rãca ñaami Dios”, yimasiru̶arãja mani. Masare ĩamaigũ̶ mani rãca ĩ ñajare, gãmerã mairu̶arãja mani quẽne.
48001001	Description	¿Ñaboati mu̶a, Galacia sitana, Jesucristore ajitirũ̶nu̶rã? Yu̶ ñaja Pablo adi queti mu̶are ucacõagũ̶. Jesucristo, to yicõari, ĩ rijato bero ĩre catior'i, ĩ jacu̶, ĩna ñaama ti quetire yu̶re gotiroticõarimasa. Masane, “Goticudiaya” yirã ĩna cõar'i me ñaja. Yu̶ sĩgũ̶ me adi papera mu̶are cõaja yu̶. Yu̶ rãcana, Jesucristore ajitirũ̶nu̶rã quẽne, “Quẽnato”, mu̶are yicõaama ĩna.
58012003	Recommendation	Jesús adigodoju̶ ĩ ñaro, bu̶to rojose ĩre ĩna yiboajaquẽne, quẽnaseju̶are yicõa ñañumi. To bajiri mani quẽne, rojose tãmu̶orã ñaboarine, quejemenane, quẽnaseju̶are yicõa ñarũgũroti ñaja.
45006005	Faith	To bajiri, Jesucristo rãca rijariarãre bajiro bajirã ñari, tudicatir'i ĩ ñajare, ĩ rãca tudicatiriarãre bajiro bajirã ñari, ĩ ejarẽmose rãca quẽnase yirũgũroti ñaja manire.
45015010	Recommendation	Quẽna gajeye ado bajiro gotiaja Dios ocare masa ĩna ucamasire: “Mu̶a jud'io masa me, Dios yarã jud'io masa rãca cojo masare bajiro variquẽnaru̶arãja mu̶a”, yigotiaja Dios oca.
54004001	Sin	Cristore ajitirũ̶nu̶rã, jãjarã mani ñaboajaquẽne, adi macaru̶cu̶ro ti jedirũtu vato cõrone sĩgũ̶ri ĩre ajitirũ̶nu̶ tu̶jaru̶arãma. “Ĩre ajitirũ̶nu̶ tu̶jacõari, vãtia ĩnare ĩna yitosere gotimasiorãre ajitirũ̶nu̶ru̶arãma”, manire yiyumi Esp'iritu Santo.
56003001	Recommendation	Gaje vãme ado bajiro ĩnare gotiya mu̶, “Masiritiroma” yigu̶: “Gobierno, to yicõari mu̶are ũmato ñarã ĩna rotisere, quẽnaro ĩnare ajirũ̶cu̶bu̶oya. To yicõari, gãjerãre quẽne quẽnaro yirũgũña mu̶a.
61003005	Sin	To bajiro tu̶oĩarã ñari, adi macaru̶cu̶rore Dios ĩ rujeosu̶omasirere masimena ñarãma. Mani jacu̶ Dios jediro masigũ̶ ñari, adi macaru̶cu̶rore, ũ̶mu̶agaserore quẽne rujeomasiñuju. Ĩ rotise su̶orine sita oco vatoaju̶ ñare ruyuamasiñuju. To bajiro yicõari, ocore quẽne ricati ti ñarotire yimasiñuju.
60003018	Grace	Cristo quẽne, quẽnase rĩne yigu̶ ñaboarine, rojose tãmu̶ocõari, rojose yirãre manire rijabosacami. To bajiro bajicami, Dios tu̶ju̶ quẽnaro mani ñarũgũrotire yigu̶. Rijacoaboarine, Esp'iritu Santo su̶orine tudicatiyumi.
61002021	Sin	To bajiro rojose yirãrema, rẽmoju̶ne Cristore ajitirũ̶nu̶beticõaroti ñaboayuja. Tire bajimenane, Cristore ajitirũ̶nu̶cõari, quẽna ĩna ajitirũ̶nu̶ tu̶jajama, quẽnabeti ñaja. To bajiro bajirã ĩna ñajare, bu̶tobu̶sa rojose ĩnare yiru̶cu̶mi Dios.
53003006	Recommendation	Ajiya yu̶a mairã. Ado bajise mani u̶ju̶ Jesucristo yu̶are ĩ gotirotijare, yaja yu̶a: Cristore ajitirũ̶nu̶gũ̶ ñaboarine ĩ moabetijama, ĩre baba cu̶tibesa mu̶a. Ĩ ũgũ̶, mu̶are yu̶a gotimasiocatore bajiro yibeami.
45005012	Sin	Adán ñamasiñuju rojose yisu̶or'i. To bajiro ĩ yimasire vaja rijacoamasiñuju. To bajiro ĩ yimasire ti ñajare, jedirone rojose yirã ñari, bajireacoayuja mani quẽne.
58011033	Faith	Ĩna quẽne, “Ĩ yirore bajiro yigu̶ ñagũ̶mi Dios” yitu̶oĩarã ñari, gaje sitana rãca ĩna gãmerã sĩajama, ĩnaju̶a rĩne, ĩnare sĩacõarũgũmasiñujarã ĩna. Gãjerãma, quẽnaro masare rotimasiñujarã ĩna, ĩna yarãre, “Quẽnaro gãmerã yato” yirã. Gãjerãma, rojose tãmu̶orã ñari, “Yu̶are ejarẽmoña” yirã, Diore sẽnimasiñujarã ĩna. To ĩna yijare, ĩ gotiriarore bajirone ĩnare ejarẽmomasiñuju Dios. Gãjerãrema, “Ĩ yirore bajiro yigu̶ ñagũ̶mi” Diore ĩna yitu̶oĩajare, “Yaia, león vãme cu̶tirã ĩnare babeticõato”, yiyumi Dios.
47004009	Faith	Jãjarã yu̶are ĩaterã ĩna ñaboajaquẽne, Dioma yu̶a rãca ñacõa ñarũgũami. Cojoji me bu̶to rojose yu̶are yiboarine, sĩabetirũgũama.
59004004	Sin	To bajiri, Diore ajitirũ̶nu̶ tu̶jariarãre bajiro tu̶oĩarãja mu̶a. Adi macaru̶cu̶roaye rĩne cu̶oru̶a tu̶oĩarãre bajiro me tu̶oĩaroti ñaja, Diore ajitirũ̶nu̶rãrema. To bajiro ti bajijare, “Diore ajitirũ̶nu̶gũ̶ ñaja” yigu̶ ñaboarine, Diore masimena, ĩna cu̶oru̶a tu̶oĩarore bajiro ĩ quẽne ĩ tu̶oĩajama, Diore ajitirũ̶nu̶ tu̶jacõari, ĩre tegu̶re bajiro bajigu̶ ñagũ̶mi.
44016006	Description	Asia sitaju̶re Jesús su̶orine quẽnaro Dios ĩ yisere ĩnare gotirotibesuju Esp'iritu Santo. To bajiri toju̶re vamenane, Frigia, Galacia, to yicõari, Misia sita ñarimacarianare quẽne ĩnare gotimasiocudiyujarã ĩna.
45010006	Faith	To ĩ yimasire ti ñaboajaquẽne, “Dios ĩ rotimasire ti yirore bajirone cu̶digu̶ magũ̶mi”, yimasiaja mani. To yicõari, “Jesucristore masa ĩna ajitirũ̶nu̶jama, ‘Rojose mana ñaama’ ĩnare yiĩagũ̶mi Dios”, yimasiaja mani. To bajiro yirã ñari, “Dios ĩ ñaroju̶ ñagũ̶re manire yirẽtobosarocu̶re Cristore ĩre ãmirã varoti ñaja”, yitu̶oĩabetiroti ñaja, manire.
66016002	Violence	To ti yirone, ñasu̶ogu̶ ángel ĩ cu̶oribajare adi macaru̶cu̶ro joeju̶ yuejeocami. To bajiro ĩ yirone, güiogu̶, moa riagaju̶ majadicacu̶re bajigu̶ ĩna quẽnorujeocacu̶re rũ̶cu̶bu̶ocõari, ĩ vãme ucatu ecocanare ĩna ruju̶rire bu̶to jũnise cãmi joe jeacaju̶.
66005008	Description	To ĩ yirone, babaricãrãcu̶ ĩaĩañamana, to yicõari, veinticuatro ñarã bu̶cu̶rã quẽne, oveja macu̶re bajiro rijabosacacu̶ rĩjoroju̶a muqueacama, ĩre rũ̶cu̶bu̶orã. Ĩna jediro jabasariarorire arpa vãme cu̶tiriaserire cu̶ocama. Orone quẽnoriabajarire quẽne cu̶ocama. Tibajariju̶ su̶tiquẽnase soemu̶oroti jũ̶mu̶cõacaju̶. Su̶tiquẽnase ti buemu̶ja vase, masa, Dios yarã ĩre ĩna sẽnisere bajiro bajise ñacaju̶.
62005001	Faith	“ ‘Rotigu̶ ñaru̶cu̶mi’ yigu̶, Dios ĩ cõar'i ñaami Jesús” yirãma, Dios rĩare bajiro bajirã ñaama. “Jacu̶re mani maijama, ĩ rĩare quẽne mairu̶arãja mani”, yigotise ñaja. To bajiri, mani jacu̶ Diore mani maijama, “Yu̶ rĩa ñaama” Dios ĩ yiĩarãre quẽne mairoti ñaja.
48005026	Recommendation	“Gãjerã rẽtoro masirã ñaja yu̶a”, yibetiroti ñaja manire. To bajiro mani yibetijare, manire ĩatemenama gãjerã.
54005001	Recommendation	Sĩgũ̶ bu̶cu̶, rojose ĩ yiboajaquẽne, tud'igu̶re bajiro ĩre gotibesa. Ado bajiroju̶a mu̶ yijama, quẽnaja: Rũ̶cu̶bu̶ose rãca mu̶ jacu̶re mu̶ yirore bajiro quẽnaro ĩre gotiya. To yicõari, mamarãre quẽne, mu̶ bederãre mu̶ yirore bajiro quẽnaro ĩnare yiya.
60002012	Recommendation	Diore masimena vatoaju̶ ñarã ñari, quẽnase rĩne yirũgũña, “ ‘Rojose yama’ gãjerãre yi ocasãroma” yirã. Quẽnase rĩne mu̶a yicõa ñasere ĩariarã ñari, “Mu̶ su̶orine quẽnaro yirũgũcama”, Diore yiru̶arãma, masare ĩ ĩabeserirũ̶mu̶ ti ejaro.
50003006	Sin	“Ado bajiro yu̶ yisere bojagu̶mi Dios” yitu̶oĩacõari, variquẽnase rãca yirũgũboacaju̶ yu̶. To bajise tu̶oĩagũ̶ ñari, “Cristore ajitirũ̶nu̶rãma, mani ñicu̶a Diore ĩna rũ̶cu̶bu̶omasiriarore bajiro yimenama” yitu̶oĩacõari, bu̶to rojose ĩnare yirũgũcaju̶ yu̶. To bajicõari, Dios ĩ rotimasire quẽnaro cu̶digu̶ yu̶ ñajare, “Adi vãme yibeami Pablo”, yu̶re yimasigũ̶ manicami.
43004052	Description	To bajiro ĩna yirone, —¿No cõro masune tudiquẽnasu̶ori ĩ, yu̶ macu̶? —ĩnare yisẽniĩañuju. —Ñamica, ũ̶mu̶recaji ñaro masune ĩre tu̶jamasimu̶ ti —ĩre yiyujarã ĩna, ĩna u̶ju̶re.
43019031	Violence	Pascua boserũ̶mu̶ bare basu̶oriarũ̶mu̶ rĩjoroagarũ̶mu̶ ñacaju̶ ti. Gajerũ̶mu̶ yu̶a jud'io masa u̶su̶sãjariarũ̶mu̶ ñacaju̶. To bajiri yucú̶tẽroju̶ rijariarã ruju̶ri tuyasere bojabeticama ĩna. To bajiri Pilatore ĩre sẽniñujarã jud'io masa u̶jarã: —Yucú̶tẽroju̶ tuyarãre ĩna ñicu̶gũ̶ri gõare jatũ̶rerotiya mu̶, “Guaro rijacoajaro” yigu̶. To yicõari ĩna ruju̶rire rujio rotiya —ĩre yiyujarã ĩna, jud'io masa u̶jarã.
43019012	Description	To bajiro ĩ yisere ajicõari, “¿No bajiro yicõari, Jesúre ĩre bucõaroti ñaboati ti?”, yitu̶oĩañuju Pilato yuja. To bajiro ĩ yitu̶oĩaboajaquẽne, ado bajiro yiavasãcama jud'io masa: —Ĩre mu̶ bucõajama, u̶ju̶ ñamasugũ̶ César vãme cu̶tigu̶ rãcagu̶ me ñaru̶cu̶ja mu̶. No bojagu̶ ĩre sẽnibecu̶ne, “U̶ju̶ ñaru̶cu̶ja yu̶” yigu̶ma, César ĩ ĩategu̶ ñaami. To bajiri, ĩre mu̶ bujama, quẽnabeaja —Pilatore ĩre yiavasãcama ĩna.
43014001	Faith	To bajiro Pedrore ĩre yigajanocõari ado bajiro yu̶are yigoticami Jesús quẽna: —Bu̶to tu̶oĩarejaibeticõaña mu̶a. Diore ĩre ajitirũ̶nu̶cõari, yu̶re quẽne ajitirũ̶nu̶ña.
50001028	Faith	To yicõari, “Ĩnare ĩaterãre quẽne güimenane Cristo ocare gotimasiorũgũama” yu̶re ĩna yigotisere quẽne ajiru̶aja yu̶. Mu̶are ĩaterãju̶ama, ĩnare güimenane mu̶a gotimasiocõa ñasere ĩacõari, “Rojose tãmu̶otu̶jabetiriaroju̶ manire cõaru̶cu̶mi Dios”, yimasiru̶arãma. To bajiboarine, mu̶aju̶ama, “Rojose mani tãmu̶oborotire yirẽtobosaru̶cu̶mi Dios”, yimasiru̶arãja mu̶a, ĩnare güibetiriarã ñari.
43015016	Grace	Yu̶re besecana me ñaja mu̶ama. Yu̶ju̶a mu̶are besecaju̶ yu̶. “Quẽnase rĩne yato ĩna” yigu̶, mu̶are besecaju̶ yu̶. To bajiro mu̶a yijama, gãjerã mu̶are ĩacõari, mu̶are ajicõari yu̶re ajitirũ̶nu̶ru̶arãma ĩna quẽne. To bajiri Dios ĩ catisere cu̶oru̶arãma ĩna quẽne. To bajiri, quẽnase mu̶a yijama, yu̶re mu̶a sẽnirore bajirone mu̶are ĩsiru̶cu̶mi yu̶ jacu̶.
58011004	Faith	“Ĩ yirore bajiro yigu̶ ñagũ̶mi”, Diore ĩre yitu̶oĩagũ̶ ñamasiñuju mani ñicu̶ Abel ñamasir'i. To bajiro Diore tu̶oĩagũ̶ ñari, ĩre rũ̶cu̶bu̶ogu̶, Dios ĩ bojarore bajiro yigu̶, vaibu̶cu̶re soemu̶omasiñuju. To bajiro ĩ yijama, ĩ gagu̶ Ca'in rẽtoro quẽnaro Diore rũ̶cu̶bu̶ogu̶ yimasiñuju. To bajiri, Dioju̶ama, “Rojose magũ̶ ñaami”, ĩre yiĩamasiñuju Dios. Abel ñamasir'i tirũ̶mu̶ju̶ ĩ bajirocare ti ñaboajaquẽne, ĩ yimasiriarore bajiro mani quẽne Diore mani rũ̶cu̶bu̶oru̶ajama, Dios ĩ bojarore bajiro yirũ̶cu̶bu̶oroti ñaja manire.
46004001	Recommendation	Mu̶are gotimasiorimasare: “Cristore moabosarimasa ñaama”, yu̶are yiya mu̶a. Ĩ oca masa ĩna masibeticatire yu̶are gotimasioroticõacami Dios.
