49004025	Recommendation	Dios ocare ajitirũ̶nu̶rã ñari, mu̶a socasere quẽne to cõrone yitu̶jaya. Jesucristore ajitirũ̶nu̶rã ñari, cojo masare bajiro bajirã ñaja mani. To bajiri, riojo gãmerã gotirũgũña mu̶a.
48002005	Faith	To bajiro ĩna yiboajaquẽne, cojo vãme yu̶are ĩna goticatore bajiro ĩnare cu̶dibeticaju̶ yu̶a. “Cristo ĩ rijabosare su̶orine Dios quẽnaro manire ĩ yise queti, mavisiare mano, riojo Pablore Dios ĩ gotiroticõariarore bajirone gotimasiocõa ñarũgũato” yirã, ĩnare cu̶dibeticaju̶ yu̶a. To yicõari, Galacia sitana, “Quẽnaro Dios manire ĩ yise queti mani ajicatore bajirone bajiyuja” mu̶a yimasirotire yirã, ĩnare cu̶dibeticaju̶.
46014013	Recommendation	Gãjerãre ejarẽmorotire tu̶oĩarã ñari, masiñamani oca ñagõrã quẽne, Diore sẽniña mu̶a, “Ti ocare buebecu̶ ñaboarine, ajimasicõari, gãjerãre gotirẽtobumasirã ñarãsa” yirã.
44009001	Violence	Saulo ñañuju. Jesúre ajitirũ̶nu̶rãre sĩaru̶, bu̶to ĩnare ĩajũnisinirũgũñuju maji. To bajiri, paia u̶ju̶ ñamasugũ̶re sẽnigũ̶ vasuju.
43017013	Description	Yucu̶acane mu̶ tu̶ vagu̶agu̶ yaja yu̶ yuja. Adi macaru̶cu̶roju̶re ñagũ̶ maji adire mu̶re sẽniaja yu̶, “Yu̶re ajitirũ̶nu̶rã, yu̶ variquẽnarore bajirone ĩna quẽne quẽnaro variquẽnajedicõato ĩna” yigu̶.
60004013	Recommendation	Mu̶a quẽne, Cristore ajitirũ̶nu̶rã ñari, rojose ĩ tãmu̶ocatore bajiro rojose mu̶a tãmu̶ojama, variquẽnaña. To bajiro rĩne mu̶a bajicõa ñajama, adi macaru̶cu̶roju̶ Cristo ĩ tudiejarirũ̶mu̶re, ĩ rãca ñacõari, rẽtobu̶saro variquẽnaru̶arãja mu̶a.
44011006	Description	“¿Ñie ñati, ti jubeaju̶re?” yigu̶, quẽnaro ĩacaju̶ yu̶. Toju̶ ñacama sãñarã vaibu̶cu̶rã jediro. Ãña, jẽnirã, to yicõari, vu̶rã quẽne ñacama.
51003008	Recommendation	Adirũ̶mu̶rirema ñajediro rojose mu̶a yirũgũrere to cõrone tire yitu̶jaya. Gãjerã rojose mu̶are ĩna yiboajaquẽne, jũnisinibesa mu̶a. Gãjerãre ĩatebesa. Gãjerãre rojose ñagõmacabesa.
44018003	Description	Vaibu̶cu̶rã gaserorine viri bu̶arotire quẽnocõari, vaja sẽnirã ñañujarã ĩna. To bajiri Pablo quẽne, tire moarũgũr'i ñari, ĩna tu̶ju̶ ñacõari, ĩna rãca moañuju ĩ.
45006012	Sin	Mani ruju̶, yoaro catirotiruju̶ me ñaja. To bajiri Dios ĩ bojabetire yiru̶arã ñaboarine, tire yibetiru̶arãja mani. “Rijacoaboarine, Jesucristo ĩ tudicatire ñajare, ĩ ejarẽmose rãca Dios ĩ bojaseju̶are yiru̶arãja” yitu̶oĩacõari, quẽnaseju̶a yirã ñaru̶arãja mani.
53003012	Recommendation	To bajiro ĩna bajise ñajare, mani u̶ju̶ Jesucristo ĩ rotirore bajirone, ĩnare yiroticõaja yu̶a: Gãjerãre gõjanabiomenane, quẽnaro moaña mu̶a, ñie cu̶omena ñari, mu̶a vaja tarotire yirã.
44007009	Sin	Jacob rĩa, ĩna bedi, José vãme cu̶tigu̶re bu̶to ĩre ĩatemasiñujarã ĩ gagu̶ mesa. To bajiri Egipto sita vanare ĩre ĩsicõari, vaja sẽnimasiñujarã ĩna. To bajiro ĩna yiboajaquẽne quẽnaro ĩre ĩatirũ̶nu̶cõa ñañuju Dios.
44011028	Description	Ĩna rãcagu̶ ñañuju Agabo vãme cu̶tigu̶. Jesúre ajitirũ̶nu̶rã ĩna rẽjarũgũroju̶re sãjaejacõari, Esp'iritu Santo ĩ ejarẽmose rãca tu̶oĩacõari, ado bajiro ĩnare gotiyuju Agabo: —Judea sita ti ñaro cõrone, ñio ejaru̶aroja. Bare jedicoaru̶aroja —yiyuju Agabo. To ĩ yisere ajicõari, “Judeana ñiorijaru̶arãma ĩna. Gãjoa ĩnare cõato mani”, yiyujarã Antioqu'iana Jesúre ajitirũ̶nu̶rã. To ĩna yiriarore bajirone yiyujarã ĩna. Ĩna cu̶ose ĩna ĩsimasiro cõro Saulore, Bernabére quẽne ĩnare ĩsiñujarã, Judea ñarãre Jesúre ajitirũ̶nu̶rã bu̶cu̶rãre “Ĩnare ĩsiato” yirã. To bajiro ti bajijama, Roma macagu̶ Claudio vãme cu̶tigu̶ masa ñajediro u̶ju̶ ĩ ñariarodore bajiyuju.
44020036	Description	To bajiro ĩnare yigotigajanocõari, ĩna rãca gu̶somuniari tuetucõari, “Diore sẽnito mani”, ĩnare yicami Pablo.
48005024	Faith	Cristo yarã ñari, ado bajiro tu̶oĩaja mani: “ ‘Rojose yiru̶aboarine, tire yibeticõato’ yigu̶, manire rijabosayumi Cristo. To bajiri, rojose yibetiru̶arãja mani”, yitu̶oĩaja mani.
59001002	Recommendation	Ajiya yu̶ yarã, Jesucristore ajitirũ̶nu̶rã. Gãjerã, rojose mu̶are ĩna yiboajaquẽne, su̶tiritimenane, variquẽnama.
62001006	Sin	Rojose yiboarine, “Dios ĩ tu̶oĩarore bajiro tu̶oĩaja yu̶a” mani yijama, socarã yirãja mani.
44010011	Description	Õ vecaju̶ ũ̶mu̶agasero soje jãnacoasuju ti. To bajicõari, sudijãi jairijãi ju̶ajacatu̶a gaja ñiacõari yorujiocõariarore bajiro rujiayuju ti. Rujiadi, ĩ tu̶ju̶ ejayuju.
44002009	Description	Adocãrãca sitana vadiriarã ñaja mani: Partia, Media, Elam, Mesopotamia, Judea, Capadocia, Ponto, Asia, Frigia, Panfilia, Egipto, to yicõari, Cirene maca adoju̶ana Africana quẽne, Roma macaju̶ vadiriarã sĩgũ̶ri jud'io masa quẽne ñaama.
51001010	Faith	Mu̶are yu̶a sẽnibosase su̶orine to bajiro mu̶a yijama, mani u̶ju̶ ĩ bojarore bajiro yiñarũgũru̶arãja mu̶a. To yicõari, ĩre bu̶tobu̶sa masirũtuaru̶arãja.
54001018	Recommendation	Timoteo, yu̶ macu̶re bajiro bajigu̶, yu̶re quẽnaro ajiya. Mu̶re yu̶ gotiroticatore bajirone yiroti ñaja mu̶re. Tirũ̶mu̶ju̶ Diore gotirẽtobosarimasa, “Dios ocare gotiru̶cu̶mi” ĩna yicatire masiritibeticõari, ĩ ocare gotimasiocõa ñaru̶cu̶ja mu̶. To bajiro mu̶ bajijama, vãti rojose mu̶re ĩ yirotisere cu̶dibeticõari, Cristoju̶are ajitirũ̶nu̶cõa ñaru̶cu̶ja. Gãjerã sĩgũ̶ri ñaama ĩ ocare ajitirũ̶nu̶ tu̶jacana. To bajicana ñari, socaseju̶are ajitirũ̶nu̶rã ñarãma.
66019001	Faith	Tiju̶ bero, jãjarã õ vecaju̶ ruyugoaro ĩna ocaruyusere ajicaju̶ yu̶. Ado bajiro yi ocaruyucama ĩna: —“Quẽnarẽtogũ̶ ñaami Dios mani u̶ju̶” Diore yivariquẽnato mani —yi ocaruyucama ĩna. —Ĩ ñaami rojose tãmu̶otu̶jabetiriaroju̶ mani vaborotire manire yirẽtobosar'i. Ĩ ñaami rẽtoro ñamasugũ̶, to yicõari, rẽtoro masigũ̶.
49002001	Grace	Mu̶a jud'io masa me ñarã, ĩre masimena ñari, rojose yirã ñariarãja mu̶a maji. To bajiri, catirã ñaboarine, Dios ĩ ĩajama, bajireariarãre bajiro bajirã ñariarãja mu̶a.
46010021	Sin	To bajiri mani u̶ju̶re rũ̶cu̶bu̶ocõa, vãtiare quẽne rũ̶cu̶bu̶o mani yijama, quẽnabetoja. To bajiro yibetiroti ñaja manire.
49005003	Recommendation	Dios yarã ñaja mani yuja. To bajiri, manajo mana, manaju̶ mana, manaju̶ cu̶tirã, manajo cu̶tirã quẽne, gãjerã rãca ajeriarã cu̶tibesa mu̶a. To yicõari, jairo gajeyeũni cu̶orã ñaboarine, gajeye quẽna bojarẽmobesa. Ti ũnire mu̶a yibetijama, niju̶ane “To bajiro yiyuma” yirã manama.
56001015	Sin	Quẽnasere tu̶oĩarãma, jediro ĩna yise rĩne quẽnase ñacõaroja. Rojosere tu̶oĩarãrema, ĩna yise jediro rojose rĩne ñaroja. “Adi ñaja quẽnase. Tiju̶a ñaja rojose”, yimasimenama ĩna, rojose rĩne tu̶oĩarã ñari.
44009021	Description	To ĩ yisere ajicõari, no yimasibesujarã ĩna, ñajediro: —Ãni Saulo, ¿Jerusalénju̶ Jesúre ajitirũ̶nu̶rãre ĩnare sĩar'i me ñati? To yicõari, ¿Jesúre ajitirũ̶nu̶rãre ñejeru̶ me adoju̶re vayujari ĩ? ¿Ĩnare ñejecõari, paia u̶jarãre ĩsibequĩda ĩ? —yiyujarã masa.
58008006	Description	Paia u̶jarã ñamasurã Dios ĩ rotimasire cu̶dimasiriarã ĩna yirũgũmasire rẽtoro quẽnaro manire yibosarũgũgũ̶mi Cristo. To bajiri, “ ‘Quẽnaro mu̶are yiru̶cu̶ja yu̶’ Moisére Dios ĩ yicũmasire rẽtoro quẽnase ñaja adirodoriaye”, yimasiaja mani.
50001021	Faith	To bajiri, yu̶re ĩna bucõajama, ñajediro yu̶ yirũgũrore bajiro yicõa ñaru̶cu̶ja, “Cristore quẽnaro yirũ̶cu̶bu̶oato masa” yigu̶. Yu̶re ĩna sĩacõajaquẽne, rẽtoro yu̶re quẽnaru̶aroja. To cõroju̶ma, Cristo tu̶ju̶ quẽnaro ñacõarũgũru̶cu̶ja yu̶.
50001006	Faith	Jesucristore mu̶a ajitirũ̶nu̶su̶orone, “Yu̶ bojarore bajiro yirã ñato” yigu̶, mu̶are ejarẽmosu̶oyumi Dios. “To bajiro yicõa ñarũgũru̶cu̶mi, ‘Jesucristo mu̶are juagu̶ ĩ tudiejarirũ̶mu̶ ti ejaro, quẽnase rĩne yirã ñato ĩna’ yigu̶”, yimasiaja yu̶.
62005020	Faith	Gajeyere ado bajise masiaja mani: “Diore masiato” manire yigu̶, adi macaru̶cu̶roju̶ vayumi Dios macu̶. To ĩ bajire ñajare, Diore quẽnaro masirã ñaja mani. To bajicõari, ĩ macu̶ Jesucristo rãca ñaja mani. “Ĩne ñaami Dios”, yimasiaja mani. Ĩ ñagũ̶mi mani rijato beroju̶ mani catirotire ĩ catisere manire ĩsigũ̶.
45012018	Recommendation	Mu̶a yimasiro cõro quẽnase rĩne yiya, “Masa jediro mani rãca quẽnaro ñato” yirã.
58010023	Faith	Cristo oca mani buesu̶ocatire ajitirũ̶nu̶ tu̶jabetiru̶arãja mani. “Quẽnaro mu̶are yiru̶cu̶ja” Dios manire ĩ yirere tu̶oĩatu̶jabetiru̶arãja mani, “Yiru̶cu̶ja” ĩ yirore bajiro yigu̶ ĩ ñajare.
43014027	Grace	Gajeye quẽna ado bajiro yu̶are goticami Jesús: —Mu̶are vare gotigu̶agu̶ yaja yu̶. Mu̶are yu̶ rijabosaroti ñajare, Diorãca quẽnaro ñaru̶arãja mu̶a. Yu̶re ajimenaju̶ama, “Ado bajiro mani yijama, quẽnaro ñaru̶arãja mani” yiboarine, Diorãca quẽnaro ñamasibetiru̶arãma. To bajiri, tu̶oĩarejaibesa mu̶a. To bajicõari, güibesa.
47005006	Faith	“Maji adigodoju̶ ñarã, mani u̶ju̶ Cristo ĩ ñaroju̶ ejamasibeaja”, yimasiaja. To bajiri mani bajirotire tu̶oĩa yurã, tire tu̶oĩavariquẽnaja mani.
43012047	Grace	Yu̶ ocare ajiboarine yu̶re ĩna ajitirũ̶nu̶betijama, yu̶ me ñaja rojose tãmu̶otu̶jabetiriaroju̶ ĩnare cõarocu̶ma. Adi macaru̶cu̶roanare rojose yigu̶agu̶ vadicacu̶ me ñaja yu̶ma. Yu̶re ajitirũ̶nu̶rãre ĩna ñaro cõrone rojose tãmu̶otu̶jabetiriaroju̶ ĩna vaborotire ĩnare yirẽtobosagu̶agu̶ vadicaju̶ yu̶.
62003012	Sin	Ca'in ñamasir'i ĩ yimasiriarore bajiro yibesa mu̶a. Rojose yigu̶ ñari, ĩ bedi quẽnase ĩ yiseju̶are ĩajũnisinicõari, ĩre sĩamasiñuju.
66016020	Description	To bajicõari, yucú̶yoari, gũ̶tayucu̶ri quẽne yayijedicoacaju̶.
58011012	Description	To bajiri, “Bu̶cu̶acoar'i ñaboarine, macu̶ cu̶ticõari, jãjarã jãnerabatia cu̶tirocu̶ ñamasiñumi. Jãjarã ñocoa ñarãre, mani cõĩajeobetore bajiro, to yicõari, jare mani cõĩajeobetore bajiro jãjarã jãnerabatia cu̶tirocu̶ ñamasiñumi Abraham”, yimasiaja mani.
54001017	Faith	Mani u̶ju̶ Dios ĩ rotise jedibetiru̶aroja. Ĩ ñaami ñajediro ti ruyuaroto rĩjoroju̶ ñamasir'i, to bajicõari, ñacõa mu̶orũ̶gõrocu̶. Sĩgũ̶ ĩre ĩagũ̶ magũ̶mi. Ĩre bajiro bajigu̶ magũ̶mi. To bajiri, ĩre quẽnaro yirũ̶cu̶bu̶orũgũroti ñaja manire. To bajirone bajiato.
66014007	Faith	Ado bajiro ruyugoaro goticami: —Masare Dios ĩ beserirũ̶mu̶ ejacoaju̶ ti. To bajiri, güirãne, “Jediro masigũ̶ ñaja mu̶” Diore ĩre yirũ̶cu̶bu̶oya. Ĩ ñaami õ vecaye, adi macaru̶cu̶roaye, moa riagari, oco ũmaburigojeri, ñajediro rujeomasir'i. To bajiro yimasir'i ĩ ñajare, ĩre rũ̶cu̶bu̶oya —yigoticami ángel.
44006001	Description	Tirodore Jesúre ajitirũ̶nu̶rã jãjarãbu̶sa ñarũtuasujarã ĩna. To bajiri, griego oca ñagõrã, hebreo oca ñagõrãre ado bajiro ñagõjaisu̶oyujarã: —Tocãrãcarũ̶mu̶ne mu̶a bare batojama, cojoro cõro batobeaja mu̶a. Manaju̶a rijaveoriarãre hebreo oca ñagõrã rõmiri rĩne jairo ĩsiaja mu̶a —yiyujarã ĩna griego oca ñagõrã.
60002021	Grace	To bajiro mu̶a bajirotire yigu̶, “Yu̶ rĩa ñaña”, mu̶are yirimi Dios. Cristo quẽne, manire rojose tãmu̶obosagu̶ ñaboarine, gãmebeticami. To bajiro ĩ bajicati ti ñajare, ĩre bajiro bajiroti ñaja manire quẽne.
53003010	Recommendation	Mu̶a rãca ñarã, cojoji me ado bajiro mu̶are yiroticaju̶ yu̶a: “Moaru̶amena, babeticõato ĩna. Ĩnare ecabesa”, mu̶are yiroticaju̶ yu̶a.
43003016	Grace	—Ñajediro masare maimasucõagũ̶ ñari, ĩ macu̶ sĩgũ̶ne ñagũ̶re ĩre cõañumi Dios, “Masare rijabosato” yigu̶. To bajiro ĩ yire ñajare, “Jesucristo ĩ bajirocare su̶orine yu̶re ĩavariquẽnacõari, quẽnaro yiru̶cu̶mi Dios” yitu̶oĩarãma, ĩna rijato beroju̶ “Tudirijabeticõato” yigu̶, Dios ĩ catisere ĩ ĩsiriarã ñarãma.
44019015	Description	To bajiro yirũgũriarã ñari, vãti sãñagũ̶ ĩ ñariviju̶re sãjaejacõari, “Jesús ĩ rotise rãca budiya”, yiboayujarã, masu̶ u̶su̶ju̶ sãñagũ̶re vãtire. To ĩna yirone, —Jesúrema masiaja yu̶. Pablore quẽne ĩre masiaja. To bajiboarine mu̶arema masibeaja —ĩnare yicõañuju vãti. To yigu̶ne, —Ĩnare quẽaña mu̶ —yiyuju vãti, ĩ sãñagũ̶re. To ĩ yijare, ĩnare quẽacõari, ĩna sudire voreajeocõañuju. To ĩ yiriarã, cãmirori cu̶ticõari, sudi manane, ũmabudicoasujarã, ĩre rudiana.
66019019	Violence	To ĩ yiro bero, güiogu̶ sũagũ̶, adi macaru̶cu̶ro ñarã u̶jarã, ĩna surara rãca rẽjacama. Caballo botigu̶ joe jesagu̶ yarã surara rãca quẽarona ĩna bajisere ĩacaju̶ yu̶.
44027002	Description	Cũmua ñacaju̶ Adramitio vãme cu̶ti macana yaga. Asia sitaju̶re varoado bajicaju̶ tia. To bajiri tia rãca vacaju̶ yu̶a. Yu̶a rãca ñacami Aristarco vãme cu̶tigu̶ quẽne. Macedonia sita ñarimaca, Tesalónica vãme cu̶ti macagu̶ ñacami.
58013003	Recommendation	Gãjerã Cristore ajitirũ̶nu̶rãre tubibe ecorãre masiritibesa mu̶a. Mani quẽne mani tubibe ecojama, “Quẽnabetoja” yitu̶oĩarã ñari, ejarẽmoña. Gãjerãre quẽne, rojose ĩnare ĩna yijama, mu̶a quẽne ĩna rãca rojose tãmu̶orãre bajiro ĩnare ĩamaicõari, ejarẽmoña mu̶a.
51003017	Recommendation	To yicõari, tocãrãcajine mu̶a gotijama, mu̶a moajaquẽne, mani u̶ju̶ Jesúre ajitirũ̶nu̶rã ñari, ĩ bojarore bajiro rĩne yirũgũru̶arãja mu̶a. To yicõari, “Quẽnaro yaja mu̶”, mani jacu̶ Diore yivariquẽnarũgũru̶arãja mu̶a.
48006006	Recommendation	Cristo ocare mu̶are gotimasiorimasu̶re, ĩ bojase masu ti manijama, ĩre ejarẽmoroti ñaja mu̶are.
44007005	Description	“Adi sitaju̶ ñaña” Dios ĩ yiboajaquẽne, ñajediro gãjerã ye sita ñamasiñuju ti maji. To bajiri, “Adi ñaja yu̶ ye sita”, yimasibesuju Abraham. Rẽmone, “Ado bajiro bajiru̶aroja”, yimasiñuju Dios, Abrahamre: “Ti sitare mu̶re ĩsiru̶cu̶ja yu̶. Mu̶ rijato beroju̶, mu̶ jãnerabatia ye sita ñaru̶aroja”, yimasiñuju Dios, Abrahamre, rĩa magũ̶ ĩ ñaboajaquẽne.
44007019	Description	Ĩne mani ñicu̶a ñamasiriarãre ĩnare yitomasiñuju. To yicõari, rojose yimasiñuju. Mame ruyuarã rĩamasare riagaju̶ ĩnare rearotimasiñuju ĩ, “Bu̶ju̶roma” yigu̶.
43020003	Description	To so yisere ajicõari, Pedro rãca ĩarã vacoacaju̶ yu̶a.
44024016	Faith	To bajiro tu̶oĩagũ̶ ñari, yu̶ yimasiro cõro quẽnasere yirũgũaja yu̶, Dios quẽne, masa quẽne, “ ‘Rojose yigu̶ ñaami’ yu̶re yiroma” yigu̶.
65001013	Description	To bajicõari, riaga jairisa ti saberone, sõmo cu̶ti, u̶eri jai bajiaja. Tire bajirone bojoneri mene rojosere yiñarũgũama socase gotimasiorimasa quẽne. To bajicõari, ñocoa tirũ̶mu̶ju̶ õ vecaju̶ Dios ĩ cũmasiriarã, sĩgũ̶ri ĩnare ĩ cũmasiriaroju̶re vaveoriarã ĩna ñajare, ĩna ñarũgũrotiju̶re tu̶oĩacõari, bu̶to rẽtiaroju̶ quẽnomasiñuju Dios. To bajirone bajirãma socase oca mu̶are gotimasiorimasa quẽne. Dios oca quẽnasere ajitu̶jacõari, ĩna masune ĩna bojarore bajiro yirã ñari, bu̶to rẽtiaroju̶ ñacõa ñaru̶arãma.
48001012	Description	Tire gãjerãne yu̶re gotimasiobeticama. Jesucristo ĩ masune yu̶re goticõari, tire yu̶ ajimasirotire yu̶re u̶jocami.
45007005	Sin	Jesúre mani ajitirũ̶nu̶roto rĩjoroju̶ma, rojose rĩne yirã ñarũgũñuja mani. Moisére Dios ĩ roticũmasirere masiboarine, ti yirore bajiro yiru̶abesuja mani. To bajiri, rojose yisejarã ñari, ti rione manire yiru̶amacõñuja ti. To bajiro yirã ñari, rojose tãmu̶otu̶jabetiriaroju̶ varona ñaboayuja mani maji.
54002007	Faith	To bajiri, “Ti ocare jud'io masa mere quẽnaro gotimasiocudiru̶cu̶ja mu̶, ‘ “Rojose mani yise vaja manire yirẽtobosayumi” yitu̶oĩato ĩna’ yigu̶”, yu̶re yicami Cristo. Socu̶ me yaja yu̶.
62003024	Faith	Tire ajirũ̶cu̶bu̶orãma, Diorãca ñarãma. To bajiri, Esp'iritu Santore Dios ĩ cõare su̶orine, “Diorãca ñaja mani”, yimasiaja mani.
46010024	Recommendation	Mani masu quẽnaro mani ñaroti rĩne tu̶oĩaroti me ñaja. Gãjerã quẽnaro ĩna ñarotire quẽne tu̶oĩarũgũru̶arãja mani.
45012016	Recommendation	Gãjerã rãca cojo masare bajiro gãmerã ĩamaiña. “Ñamasurã ñaja yu̶a”, yitu̶oĩabesa. “Ñamasurã me ñaama” gãjerã ĩna yirãre baba cu̶tiya mu̶a. “Gãjerã rẽtoro masirã ñaja yu̶a”, yitu̶oĩabesa.
49004031	Recommendation	Gãjire rojose mu̶a yiru̶a tu̶oĩasere yibesa. Gãjerãre ĩatebesa. Jũnisinicõari, avasãtud'ibesa. Gãjerãre rojose ñagõmacabesa. Gãjerã rojose mu̶are ĩna yiboajaquẽne, jũnisinibesa. To yicõari, rojose mu̶are yirãre gãmebesa. Ñajediro rojose mu̶a yisere yitu̶jaya mu̶a.
51001025	Faith	“Cristo ocare jud'io masa me ñarãre quẽnaro gotimasiocudiru̶cu̶mi” Dios ĩ yitu̶oĩariarore bajirone Cristo yu̶re ĩ yijare, Cristore ajitirũ̶nu̶rãre ejarẽmorimasu̶ ñacaju̶ yu̶.
66001014	Description	Ĩ ru̶joa joa oveja joare bajiro bu̶to boticaju̶. To bajicõari, buerigaserire bajiro boticaju̶. Ĩ cajearima, jea ũ̶ju̶sere bajiro yaacaju̶.
47004015	Grace	Ado bajiro tu̶oĩarã ñari, “Yu̶a rãca varu̶arãja mu̶a”, yibu̶ yu̶a: “ ‘Mani gotimasiosere ajirona quẽnase bu̶jato ĩna’ yirã, rojose tãmu̶orũgũaja mani”, yitu̶oĩaja yu̶a. To bajiri mani u̶ju̶ ocare gotimasiorã ñari, rojose tãmu̶orã ñaboarine, tire gotimasiocõa ñaja, “Jãjarãbu̶sa Jesucristore ajitirũ̶nu̶rũtuajaro” yirã. “Manire ĩamaicõari, quẽnaro yami Dios”, yivariquẽnaru̶arãma ĩre ajitirũ̶nu̶rã. To bajiri, jãjarãbu̶sa ñarũtuaru̶arãma ĩre quẽnaro rũ̶cu̶bu̶orã.
43006056	Faith	To bajiri yu̶ ruju̶re bacõari, yu̶ ri'ire idigu̶ma, yu̶ rãcagu̶ ñagũ̶mi. Yu̶ju̶a quẽne, ĩ rãcagu̶ ñaja yu̶.
43011027	Faith	To bajiro ĩ yisere ajicõari, —“Yu̶ u̶ju̶, mu̶ yirore bajirone bajiaja ti. Mu̶ne ñaja, ‘Rotimu̶orũ̶gõru̶cu̶mi’ yigu̶, Dios ĩ cõar'i, masa ñajediro u̶ju̶. Dios macu̶ne ñaja mu̶, adi macaru̶cu̶roju̶re vadir'i”, mu̶re yimasiaja yu̶ —Jesúre ĩre yicamo so.
44002042	Faith	To bajiri Jesús ĩ gotiroticõasu̶oriarã rãca rẽjañujarã ĩna. Tocãrãcarũ̶mu̶ne ĩna rãca rẽjarũgũñujarã. To bajiri sĩgũ̶re bajiro tu̶oĩañujarã ĩna. To bajicõari Diore sẽnirũgũñujarã ĩna. Bare barã quẽne, Jesús ĩ yirotiriarore bajirone yibayujarã ĩna.
58001009	Grace	‘Yu̶ bojarore bajiro quẽnaro yigu̶, rojoseju̶arema yibetiru̶cu̶ja’ yitu̶oĩarũgũcaju̶ mu̶. To bajiro yicacu̶ mu̶ ñajare, ‘Gãjerã rẽtoro ñamasugũ̶ ñaja’ mu̶re yaja yu̶. To bajiro mu̶re yu̶ yijare, bu̶to variquẽnaja mu̶”, yiyumi Dios, ĩ macu̶re.
44012002	Violence	To yicõari, “Juan bedire Santiagore ĩ ru̶joare jataya mu̶a”, ĩnare yiyuju ĩ.
55002016	Recommendation	Adigodoaye rĩne tu̶oĩacõari, “Gãmerã ñagõto mani” ĩna yijama, ĩnare ajibesa. Tire tu̶oĩavariquẽnarã ñari, Dioju̶are ajibeticõari, rojoseju̶are bu̶tobu̶sa yirũtuana yirãma.
62003015	Sin	Mani u̶ju̶re ajitirũ̶nu̶rãre ĩaterãma, Dios ĩ ĩajama, sĩarimasa ñarã bajirãma ĩna. To bajiri, “Ĩna rijato beroju̶ ĩna catirotire ĩnare ĩsibecu̶mi Dios”, yimasiaja mani.
43021015	Faith	Yu̶a bayujigajanoro bero, Pedrore ĩre sẽniĩacami Jesús: —¿Mu̶ rãcana yu̶re ĩna mairo rẽtoro yu̶re maiati mu̶ Pedro, Jonás macu̶? —ĩre yisẽniĩacami Jesús. To bajiro ĩ yirone, —Yu̶ u̶ju̶ mu̶re maiaja yu̶. Mu̶re yu̶ maisere masiaja mu̶ —Jesúre ĩre yicami Pedro. To bajiro ĩ yijare, —¡Oveja rĩare ĩna ecarũgũriarore bajirone yu̶ yarãre yu̶re gotimasiobosaba mu̶! —ĩre yicami Jesús.
46012008	Grace	“Quẽnaro tu̶oĩacõari gotimasiogũ̶ ñato” yigu̶, ĩ yimasirotire ĩre u̶jogu̶mi. Gãjirema, “Dios ocare quẽnaro ajimasicõari, ĩnare gotimasiogũ̶ ñato” yigu̶, ĩ yimasirotire ĩre u̶jogu̶mi.
44007013	Description	Egiptoju̶ bare juarã vamasiñujarã ĩna. Tiju̶ bero, quẽna toju̶ne vamasiñujarã ĩna. To ĩna bajiro ĩacõari, ado bajiro ĩnare yimasiñuju José: “Yu̶re ĩamasibeaja mu̶a. Mu̶a bedine ñaja yu̶”, ĩnare yimasiñuju. To bajiro José ĩ yirere ajicõari, “Ĩ yarã ñaama”, yimasiñuju faraón.
60003010	Recommendation	Dios ocare masa ĩna ucamasire ado bajiro ti gotijare, “Tire riojo gotiami Pedro”, yimasirãja mu̶a: “Quẽnaro ĩna ñaru̶ajama, ĩna ñagõroto rĩjoro quẽnaro tu̶oĩarũgũru̶arãma, ‘Rojose ñagõrobe’ yirã. To yicõari, gãjerãre yitobetiru̶arãma.
44004032	Description	Jesúre ajitirũ̶nu̶rã sĩgũ̶re bajiro tu̶oĩarã ñañujarã ĩna. Ĩna cu̶osere, “Yu̶ sĩgũ̶ ye ñaja”, yibesujarã ĩna. Ñajedirore, “Mani ye ñaja” yirã, ĩna babarãre ĩsiñujarã ĩna.
46015003	Grace	Ti oca ñamasuse, Cristo yu̶re ĩ goticati ñacaju̶. Ado bajiro bajiaja: Dios ocare masa ĩna ucamasire ti gotirore bajirone rojose mani yise vaja manire rijabosayumi Cristo.
66018024	Violence	Quẽna õ vecaju̶ ado bajiro yi ocaruyucaju̶: —Diore gotirẽtobosarimasare, gãjerã Dios yere ajirãre, to yicõari adi macaru̶cu̶ro ñarã jedirore sĩacama ti macana. To bajiro ĩna yicati vaja, bu̶to rojose tãmu̶oru̶arãma —yi ocaruyucaju̶.
44013048	Faith	To ĩna yisere ajicõari, “Quẽnaro masu yigu̶ ñaami Dios”, yivariquẽnañujarã jud'io masa meju̶a. To bajicõari, “Ĩna rijato beroju̶, quẽna tudirijabetiru̶arãma” Dios ĩ yimasiriarã, Jesúre ĩre ajitirũ̶nu̶su̶oyujarã ĩna.
66022020	Description	Adi quetire gotigu̶, ado bajiro gotiami: —Yu̶ gotirore bajirone yigu̶, yoaro mene tudivadiru̶cu̶ja —yami. To ĩ yirone, —To bajirone bajiato. Yoaro mene tudivayá, yu̶ u̶ju̶ —ĩre yaja yu̶.
50004009	Recommendation	Mu̶are yu̶ gotimasiocatore bajirone yirũgũña. Yu̶re mu̶a ajicatire, mu̶a ĩacatire quẽne to bajirone yicõa ñaña. To bajiro mu̶a yijama, variquẽnase manire cõagũ̶, Dios, mu̶a rãca ñacõa ñarũgũru̶cu̶mi.
53003015	Recommendation	Rojose ĩ yiboajaquẽne, ĩre ĩatebesa mu̶a. Ĩre tud'imenane, mu̶a bedire bajiro quẽnaro ĩre gotiya.
51002008	Recommendation	To bajiri, gãjerã ricati gotimasiorã, “Cristore bajiro bajirã ñarãma gãjerã” ĩna yisocasere ajibesa mu̶a. Cristo ye me ñaja ti. Ĩna ñicu̶a ĩna tu̶oĩamasiriarore bajiro tu̶oĩacõari gotirã yama.
50003014	Faith	“Dios tu̶ju̶ yu̶ ejaro, quẽnaro yu̶ yise vaja quẽnaro yu̶re yato ĩ” yigu̶, to bajiro rĩne yirũgũaja yu̶. Ĩ tu̶ju̶ mani ejaro, quẽnaro mani yise vaja, “Quẽnaro ĩnare yiru̶cu̶ja”, yiyuju Dios, quẽnase rĩne yirã mani ñarotire yigu̶.
56002014	Faith	Ĩre ajitirũ̶nu̶rã, “ ‘Ñie rojose mana ñaama’ manire yiĩato Dios” yigu̶, manire rijabosayumi Jesucristo. To bajicõari, “Rojose yiru̶aboarine, yibeticõari, quẽnaseju̶are yato” yigu̶, manire rijabosayumi.
43005024	Faith	To bajiro ĩnare yigajanocõari, ado bajiro goticami Jesús: —Ñamasusere riojo mu̶are gotiaja yu̶: No bojagu̶ yu̶ ocare ajicõari, yu̶re cõacacu̶re ajitirũ̶nu̶gũ̶ma, Dios ĩ catisere cu̶ogu̶ ñaami. Ĩ ũgũ̶rema, rojose tãmu̶otu̶jabetiriaroju̶ ĩre cõabetiru̶cu̶mi Dios.
66021015	Description	Ángel yu̶ rãca ñagõcacu̶, macare ĩ cõĩaroti orone quẽnoriu̶re cu̶ocami. Ti macare, matariacũ̶nire, sojerire quẽne ĩ cõĩaroti ñacaju̶ tiu̶.
50003019	Sin	To bajiro bajirã ñari, rojose tãmu̶otu̶jabetiriaroju̶ varu̶arãma. Dios ĩ bojasere yimena ñari, ĩna masu ĩna bojase rĩne yirã ñaama. To bajicõari, rojose ĩna yijama, bojonemenane, tire gotivariquẽnarãma. Adigodoaye rĩne tu̶oĩarũgũrãma.
54003006	Sin	Cristo ocare ajitirũ̶nu̶rãre ũmato ñagũ̶ ĩ ñaru̶ajama, Cristore mame ajitirũ̶nu̶gũ̶ me ñagũ̶mi. Cristore mame ajitirũ̶nu̶gũ̶ ĩ ñajama, “Gãjerã rẽtoro ñamasugũ̶ ñaja yu̶”, yitu̶oĩagũ̶mi. To bajiro ĩ yijama, Satanás ĩ tu̶oĩamasiriarore bajiro tu̶oĩagũ̶ ĩ ñajare, “Rojose tãmu̶oru̶cu̶ja” Satanáre Dios ĩ yirotimasiriarore bajiro yiecoru̶cu̶mi, ĩ quẽne.
