47005011	Faith	Jelikož tedy známe Pánovu hrůzu, přivádíme lidi k víře. Bohu jsme zjevní a mám naději, že jsme zjevní i vašemu svědomí.
49002003	Sin	mezi nimiž jsme také my všichni kdysi žili v žádostech svého těla, když jsme dělali to, co chtělo tělo a mysl, a byli jsme přirozeností dětmi hněvu tak jako ostatní.
44002040	Recommendation	Dosvědčoval [to] ještě mnoha jinými slovy a vyzýval [je]: “Zachraňte se z tohoto zvráceného pokolení!”
45008013	Faith	Žijete-li totiž podle těla, zemřete; jestliže však skutky těla umrtvujete Duchem, budete žít.
45010011	Faith	Vždyť Písmo říká: “Nikdo, kdo v něj věří, nebude zahanben.”
45001008	Faith	Především pak děkuji svému Bohu skrze Ježíše Krista za vás všechny, že vaše víra se rozhlašuje po celém světě.
52001004	Faith	Víme, bratři milovaní Bohem, o vašem vyvolení,
60004008	Recommendation	Především však mějte jedni k druhým horlivou lásku, neboť láska přikryje množství hříchů.
44027001	Description	Jakmile pak bylo rozhodnuto, že vyplujeme do Itálie, byl Pavel s některými jinými vězni svěřen setníkovi jménem Julius z praporu Jeho Veličenstva.
66015003	Faith	a zpívají píseň Božího služebníka Mojžíše a píseň Beránkovu: “Veliké a předivné [jsou] tvé skutky, Pane, Všemohoucí Bože, spravedlivé a pravé [jsou] tvé cesty, Králi svatých!
60002002	Faith	a jako čerství novorozenci se dožadujte neředěného mléka [Božího] slova, abyste jím rostli -
66014013	Faith	Potom jsem uslyšel hlas z nebe, který mi říkal: “Piš: Blaze mrtvým, kteří od této chvíle umírají v Pánu.” “Ano,” praví Duch, “ať si odpočinou od svých prací; a jejich skutky jdou s nimi.”
59001027	Faith	Čisté a neposkvrněné náboženství před Bohem a Otcem je toto: navštěvovat sirotky a vdovy v jejich soužení a zachovávat sám sebe neposkvrněného od světa.
51002004	Recommendation	A toto říkám, aby vás nikdo neklamal přesvědčivými řečmi.
66005013	Description	Také všechno stvoření, které je na nebi, na zemi, pod zemí i v moři, všechno, co [je] v nich, jsem slyšel říkat: “Sedícímu na trůnu a Beránkovi chvála a čest, sláva i vláda na věky věků!”
66008008	Description	Když zatroubil druhý anděl, jako by byla do moře vržena veliká ohnivě planoucí hora. Třetina moře se obrátila v krev
44007058	Violence	Potom ho vyhnali ven z města a kamenovali [ho.] Svědkové tehdy odložili své pláště u nohou mladíka jménem Saul
45015011	Faith	A znovu: “Chvalte Pána, všechny národy, a velebte ho, všichni lidé!”
45011036	Faith	Neboť z něj a skrze něj a pro něj [jsou] všechny věci. Jemu [buď] sláva na věky! Amen.
43001029	Faith	Druhého dne spatřil Jan Ježíše, jak přichází k němu, a řekl: “Hle, Beránek Boží, který snímá hřích světa!
58011031	Description	Vírou nevěstka Rahab nezahynula s nepovolnými, neboť v pokoji přijala špehy.
43010010	Grace	Zloděj přichází, jen aby kradl a zabíjel a ničil; já jsem přišel, aby měly život a měly [ho] hojně.
50003020	Faith	Naše občanství je ovšem v nebesích, odkud také očekáváme Spasitele - Pána Ježíše Krista.
45015007	Recommendation	Proto se navzájem přijímejte, jako i Kristus přijal nás do Boží slávy.
44021024	Recommendation	Vezmi je [k sobě], nech se s nimi očistit a zaplať za ně náklady, aby si oholili hlavy. Tehdy všichni poznají, že [na tom], co o tobě slyšeli, nic není, ale že i [ty] sám chodíš v řádu a zachováváš Zákon.
45004012	Faith	a otcem obřízky těch, kdo nejsou jen z obřízky, ale kteří také kráčí ve šlépějích víry našeho otce Abrahama, která byla před obřezáním.
44001026	Description	Dali jim tedy losy a los padl na Matěje. A [tak] byl připočten k jedenácti apoštolům.
45004007	Grace	“Blaze [těm], kterým byly odpuštěny nepravosti a jejichž hříchy byly přikryty.
66011004	Description	Ti jsou ty dvě olivy a dva svícny stojící před tváří Boha [vší] země.
59004009	Recommendation	Dejte se do bědování, truchlete a plačte. Váš smích ať se obrátí v nářek a vaše radost v sklíčenost.
64001011	Recommendation	Milovaný, nenásleduj příklad zlého, ale dobrého. Kdo koná dobro, je z Boha; ale kdo koná zlo, Boha neviděl.
45004011	Faith	A znamení obřízky přijal jako pečeť spravedlnosti [z] víry, kterou [měl už] před obřezáním, aby byl otcem všech, kdo věří v neobřízce, aby i jim byla přičtena spravedlnost,
45006007	Grace	Neboť kdo zemřel, je ospravedlněn od hříchu.
47004010	Faith	Stále nosíme na [svém] těle umírání Pána Ježíše, aby byl na našem těle zjeven také Ježíšův život.
50002021	Sin	neboť všichni hledají svůj vlastní [prospěch] a ne [prospěch] Ježíše Krista.
58011011	Faith	Vírou také i Sára přijala moc k početí semene a mimo přiměřený věk porodila, protože soudila toho, který dal zaslíbení, za věrného.
43006039	Grace	A toto je vůle Otce, který mě poslal - abych nic [z] toho, co mi dal, neztratil, ale vzkřísil to v poslední den.
46008006	Faith	pro nás [je] ale jediný Bůh - Otec, z něhož [je] všechno, i my pro něj; a jediný Pán - Ježíš Kristus, skrze něhož [je] všechno, i my skrze něj.
52003006	Description	Nyní však Timoteus přišel od vás [zase] k nám a oznámil nám radostnou zprávu o vaší víře a lásce a [o tom,] že na nás stále vzpomínáte v dobrém a toužíte nás vidět stejně jako my vás.
60005004	Grace	A až se ukáže ten nejvyšší pastýř, přijmete nevadnoucí korunu slávy.
47003012	Faith	Jelikož tedy máme takovouto naději, mluvíme tak otevřeně,
61002012	Sin	Tito se však jako nerozumná zvířata, z přirozenosti narozená k polapení a záhubě, rouhají tomu, co neznají. [Ti] zahynou svou vlastní zkažeností.
43012006	Sin	To však řekl ne [proto], že měl starost o chudé, ale že byl zloděj a měl [na starosti] pokladnu a to, co se [do ní] dávalo, bral.
62004016	Faith	A my jsme poznali tu lásku, kterou má Bůh k nám, a uvěřili jsme jí. Bůh je láska, a kdo přebývá v lásce, přebývá v Bohu a Bůh v něm.
44011019	Description	Ti, kdo se rozprchli následkem soužení, které nastalo kvůli Štěpánovi, tedy přišli až do Fénicie, [na] Kypr a [do] Antiochie a nemluvili Slovo nikomu kromě Židů.
54006006	Faith	[Opravdu] velikým ziskem je však zbožnost se spokojeností.
66013007	Violence	Bylo jí dáno, aby svedla boj se svatými a přemohla je; a byla jí dána moc nad každým kmenem, jazykem i národem.
60002020	Faith	Vždyť jaká [bude vaše] pověst, když budete snášet rány za své chyby? Jestliže ale snášíte utrpení, když jednáte dobře, [je] to u Boha chvályhodné.
58009015	Grace	A proto je prostředníkem nové smlouvy, aby ti, kdo jsou povoláni, mohli přijmout zaslíbení věčného dědictví, neboť [již] nastala smrt k vykoupení z přestupků [spáchaných] za první smlouvy.
45006001	Sin	Co tedy řekneme? Máme zůstat v hříchu, aby se rozhojnila milost?
49005004	Recommendation	ani nestoudnost, pošetilé řeči a vtipkování, což je nepatřičné, ale raději díkůčinění.
66006008	Violence	A hle, spatřil jsem koně mrtvolně bledého a jméno toho, který na něm seděl, [bylo] Smrt a za ním šlo Peklo. A byla jim dána moc nad čtvrtinou země, aby zabíjeli mečem, hladem, morem a šelmami země.
45004016	Faith	[Je] proto z víry, aby [bylo] podle milosti, aby zaslíbení bylo jisté všemu semeni, nejen tomu, které je ze Zákona, ale také tomu, které je z Abrahamovy víry. [Vždyť] on je otcem nás všech
44028018	Description	Ti mě vyslechli a chtěli propustit, protože na mně nebyla žádná smrtelná vina.
45009016	Grace	A tak nezáleží na tom, kdo chce, ani na tom, kdo usiluje, ale na Bohu, který se smilovává.
46010008	Sin	Ani nesmilněme, jako někteří z nich smilnili a padlo jich v jeden den dvacet tři tisíc.
45007023	Sin	ale ve svých údech vidím jiný zákon, který bojuje proti zákonu mé mysli a činí mě zajatcem zákona hříchu, který je v mých údech.
58006001	Faith	Proto zanechme řeči o Kristových počátečních věcech a směřujme k dokonalosti. Nepokládejme znovu základ[y] pokání z mrtvých skutků a víry v Boha,
46016011	Recommendation	Ať jím tedy nikdo nepohrdá, ale vypravte ho v pokoji, aby mohl přijít ke mně, neboť na něj s bratry čekám.
59002014	Faith	Co je platné, bratři moji, říká-li někdo, že má víru, ale nemá skutky? Může ho snad ta víra spasit?
43007025	Description	Někteří z Jeruzalémských tedy říkali: “Není snad tohle ten, kterého chtějí zabít?
43020022	Faith	A když to pověděl, dechl a řekl jim: “Přijměte Ducha Svatého.
45010003	Sin	Nepoddali se totiž Boží spravedlnosti, protože Boží spravedlnost neznají a snaží se ustanovit svou vlastní spravedlnost.
62005010	Faith	Kdo věří v Božího Syna, má svědectví sám v sobě. Kdo Bohu nevěří, udělal z něj lháře; neboť neuvěřil tomu svědectví, které Bůh vydal o svém Synu.
43014012	Faith	“Amen, amen, říkám vám: Kdo věří ve mne, skutky, které dělám já, bude dělat i on; a bude dělat větší [skutky] než tyto, neboť já jdu ke svému Otci.
56002009	Recommendation	Služebníky [uč], ať jsou poddáni svým pánům, ať jsou ve všem příjemní, [ať] neodmlouvají,
58012015	Recommendation	Dbejte na [to], aby někdo neminul Boží milost, aby [vás] netrápil nějaký pučící kořen hořkosti, skrze nějž by mnozí byli poskvrněni;
54003007	Recommendation	Musí mít také dobré svědectví od těch venku, aby neupadl do potupy a [do] ďáblovy pasti.
49004007	Grace	Každému jednotlivému z nás pak byla dána milost podle míry Kristova obdarování.
66016003	Description	Druhý anděl pak vylil svůj koflík do moře a obrátilo se jakoby v krev mrtvého a veškerá živá duše v moři zemřela.
49006006	Recommendation	Neslužte naoko, jako ti, kdo se chtějí zalíbit lidem, ale jako Kristovi služebníci čiňte Boží vůli z [celé] duše.
60003016	Recommendation	a s dobrým svědomím, aby ti, kdo pomlouvají váš poctivý život v Kristu, byli zahanbeni, že vás pomlouvají jako zločince.
43006040	Faith	Neboť toto je vůle Toho, který mě poslal - aby každý, kdo vidí Syna a věří v něho, měl věčný život. A já ho vzkřísím v poslední den.”
44012023	Violence	A ihned ho ranil Pánův anděl, protože nevzdal slávu Bohu: byl rozežrán červy a vypustil duši.
47001003	Grace	Požehnaný Bůh a Otec našeho Pána Ježíše Krista, Otec milosrdenství a Bůh veškerého potěšení,
54001006	Sin	od čehož někteří zbloudili, když se uchýlili k prázdnému tlachání.
45001016	Faith	Nestydím se totiž za Kristovo evangelium, neboť je [to] Boží moc ke spasení každého, kdo věří, předně Žida, ale i Řeka.
46003011	Description	Neboť nikdo nemůže položit jiný základ vedle toho, který je [již] položen, jenž je Ježíš Kristus.
49005033	Recommendation	Ať však také každý jednotlivý z vás miluje svou manželku jako sám sebe. Žena pak ať má [svého] manžela v úctě.
51002013	Grace	I vás, mrtvé v hříších a neobřízce vašeho těla, spolu s ním obživil, když vám odpustil všechny hříchy
54004014	Recommendation	Nezanedbávej dar, který je v tobě, který ti byl dán skrze proroctví s vkládáním rukou staršovstva.
66021001	Description	Potom jsem uviděl nové nebe a novou zemi. Neboť první nebe a první země pominuly a moře již nebylo.
52005016	Recommendation	Vždycky se radujte.
66009006	Description	(V těch dnech budou lidé hledat smrt, ale nenaleznou ji; budou toužit umřít, ale smrt od nich uteče.)
52004014	Faith	Věříme-li totiž, že Ježíš zemřel a vstal [z mrtvých], právě tak [věřme, že] i ty, kdo zesnuli v Ježíši, Bůh přivede s ním.
62004015	Faith	Kdokoli by vyznal, že Ježíš je Boží Syn, Bůh přebývá v něm a on v Bohu.
49004022	Recommendation	[že] vzhledem k dřívějšímu způsobu života máte odložit toho starého člověka, který se kazí podle klamných žádostí.
43010009	Grace	Já jsem dveře. Kdokoli vejde skrze mne, bude spasen a bude vcházet i vycházet a nalezne pastvu.
58011037	Violence	Bývali kamenováni, rozřezáváni, pokoušeni, umírali zabíjeni mečem, chodili v ovčích a kozlích kůžích - strádající, soužení a trápení.
62002029	Faith	Jestliže víte, že [on] je spravedlivý, vězte [také], že každý, kdo působí spravedlnost, je narozen z něho.
44013047	Grace	Tak nám [to] totiž přikázal Pán [slovy:] ‘Postavil jsem tě za světlo pohanům, abys byl spasením až do posledních [končin] země.’
47004002	Faith	Zřekli jsme se skrytých hanebností, nechodíme v chytráctví, ani nezacházíme s Božím slovem podvodně, ale zjevováním pravdy se v Božích očích osvědčujeme před každým lidským svědomím.
44002033	Description	Když byl tedy Boží pravicí vyvýšen, přijal od Otce zaslíbení Ducha Svatého a vylil to, co nyní vidíte a slyšíte.
51003010	Recommendation	a oblékli toho nového, jenž se obnovuje k [plnému] poznání podle obrazu Toho, který ho stvořil.
43011004	Faith	Když [to] pak Ježíš uslyšel, řekl: “Ta nemoc není k smrti, ale pro Boží slávu, aby skrze ni byl oslaven Boží Syn.”
45001017	Faith	Neboť v něm je zjevena Boží spravedlnost z víry k víře, jak je napsáno: “Spravedlivý pak bude žít z víry.”
43019017	Description	Nesl svůj kříž a vyšel na místo jménem Lebka, hebrejsky nazývané Golgota.
45012006	Faith	Když tedy máme rozdílná obdarování podle milosti, která je nám dána, ať už proroctví, [to konejme] v souladu s vírou;
66004007	Description	A ta první bytost [byla] podobná lvu, druhá bytost podobná teleti, třetí bytost měla tvář jako člověk a čtvrtá bytost se podobala letícímu orlu.
49005015	Recommendation	Dbejte tedy pečlivě [na to], jak [máte] chodit: ne jako nemoudří, ale jako moudří.
45010012	Grace	Není totiž rozdílu mezi Židem a Řekem, neboť tentýž Pán všech [je] bohatý ke všem, kdo ho vzývají.
45010004	Faith	Vždyť cílem Zákona [je] Kristus, k ospravedlnění každého věřícího.
50004006	Recommendation	O nic nemějte starost, ale za všech [okolností] své žádosti skrze modlitbu a prosbu s díkůčiněním oznamujte Bohu.
46010006	Faith	Tyto věci se staly nám pro výstrahu, abychom nedychtili po zlých věcech, jako dychtili oni.
66009002	Description	a když tu bezednou propast otevřela, vystoupil z propasti dým jako dým [z] veliké pece a dýmem té propasti se zatmělo slunce i ovzduší.
52004006	Recommendation	aby [nikdo] nepřekračoval [meze] a neoklamával v této věci svého bratra, protože Pán [je] toho všeho mstitelem, jak jsme vám také předem řekli a dosvědčili.
47005017	Faith	Proto, jestliže [je] někdo v Kristu, [je] nové stvoření. Staré věci pominuly, hle, vše je nové!
43005020	Faith	Otec totiž má rád Syna a ukazuje mu všechno, co sám dělá; a ukáže mu větší skutky než tyto, abyste se vy divili.
49004028	Recommendation	Zloděj ať již nekrade, ale ať raději pracuje a dělá svýma rukama, co je dobré, aby měl [z čeho] dávat tomu, kdo má nouzi.
57001022	Recommendation	Zároveň mi však také připrav ubytování, neboť doufám, že vám budu díky vašim modlitbám darován.
58013009	Recommendation	Nenechte se unášet rozličným a cizím učením. Je přece dobré, aby srdce bylo utvrzováno milostí, a ne pokrmy, jež nepřinesly užitek těm, kdo se [jimi] zabývali.
52005012	Recommendation	Prosíme vás, bratři, abyste se znali k těm, kdo mezi vámi pracují, vedou vás v Pánu a napomínají vás,
43009022	Description	Jeho rodiče to řekli, protože se báli Židů. Židé se totiž už dohodli, že kdokoli by ho vyznal jako Krista, bude vyobcován ze synagogy.
50003003	Faith	[Pravá] obřízka jsme přece my, kdo sloužíme Bohu duchem, chlubíme se v Kristu Ježíši a nespoléháme na tělo.
62003023	Faith	A to je to jeho přikázání, abychom uvěřili jménu jeho Syna Ježíše Krista a milovali jedni druhé, jak nám dal přikázání.
66013011	Description	Potom jsem spatřil jinou šelmu, jak vystupuje ze země: měla dva rohy jako Beránek, ale mluvila jako drak.
46014020	Recommendation	Bratři, nebuďte dětmi ohledně myšlení, ale buďte [jako] nemluvňata ohledně zlého. Ohledně myšlení pak buďte dospělí.
59005013	Recommendation	Snáší někdo z vás útrapy? Ať se modlí. Je někdo dobré mysli? Ať zpívá chvály.
58012012	Recommendation	Proto napřimte svěšené ruce a ochablá kolena
60001017	Recommendation	Nazýváte-li Otcem Toho, který bez ohledu na osobu soudí každého podle [jeho] díla, prožijte čas svého pobytu [zde] v bázni.
58010036	Recommendation	Potřebujete totiž vytrvalost, abyste vykonali Boží vůli a dosáhli zaslíbení.
58011001	Faith	Víra je podstata věcí, v něž doufáme, důkaz skutečností, jež nevidíme.
49004017	Recommendation	Toto tedy říkám a dosvědčuji v Pánu, abyste již nechodili tak, jako chodí ostatní pohané, v marnosti své mysli,
51002016	Recommendation	Ať vás tedy nikdo nesoudí kvůli jídlu či pití, nebo kvůli svátku, novoluní či sobotám.
66007015	Faith	a proto jsou před Božím trůnem a slouží mu dnem i nocí v jeho chrámu; a Ten, který sedí na trůnu, bude přebývat mezi nimi.
44020010	Description	Pavel tedy sestoupil dolů, padl na něj, objal [ho] a řekl: “Neznepokojujte se, vždyť jeho duše je v něm!”
55002010	Faith	A proto všechno snáším, kvůli vyvoleným, aby i oni došli spasení, které je v Kristu Ježíši, s věčnou slávou.
60005014	Recommendation	Pozdravte se navzájem polibkem lásky. Pokoj vám všem, kdo jste v Kristu Ježíši. Amen.
49005021	Recommendation	a poddávejte se jedni druhým v Boží bázni.
61003017	Recommendation	Ale vy, milovaní, protože [to] víte předem, chraňte se, abyste nebyli strženi bludem těch zvrhlíků a neodpadli od své stálosti.
51003018	Recommendation	Manželky, poddávejte se svým mužům, jak se sluší v Pánu.
54005020	Recommendation	Ty, kteří hřeší, kárej přede všemi, aby i ostatní měli bázeň.
45014013	Recommendation	Nesuďme již tedy jedni druhé, ale raději posuďte toto: abyste nekladli před bratra kámen úrazu nebo pohoršení.
45002010	Grace	Avšak sláva, čest a pokoj každému, kdo koná dobro, předně Židu, ale i Řeku.
58011034	Violence	uhašovali moc ohně, unikali ostří meče, bývali posilněni v slabosti, stávali se silnými v boji a obraceli na útěk vojska cizinců.
48006017	Faith	Nadále ať mi nikdo nedělá potíže, vždyť já na svém těle nosím vyrytá znamení, [že patřím] Pánu Ježíši.
66018021	Violence	Tehdy jeden silný anděl zvedl balvan veliký jako mlýnský kámen a hodil [ho] do moře se slovy: “Tak prudce bude svržen Babylón, to veliké město, a už nikdy nebude nalezen.
65001020	Faith	Ale vy, milovaní, se budujte na té své nejsvětější víře, modlete se v Duchu Svatém
45012002	Recommendation	A nepřizpůsobujte se tomuto světu, ale proměňujte se obnovením své mysli, abyste mohli rozeznat, co [je] dobrá, příjemná a dokonalá Boží vůle.
46015009	Sin	Já jsem přece nejmenší z apoštolů; [ani] nejsem hoden být apoštolem nazýván, protože jsem pronásledoval Boží církev.
62002015	Recommendation	Nemilujte svět ani ty věci, které [jsou] ve světě. Jestliže někdo miluje svět, Otcova láska v něm není.
45002001	Sin	Proto nemáš výmluvu, ó každý člověče, který soudíš, neboť v čem soudíš jiného, [v tom] odsuzuješ sám sebe, poněvadž [ty,] který soudíš, děláš totéž.
48002009	Description	a když Jakub, Kéfas a Jan, kteří jsou považováni za sloupy, poznali milost, která mi byla dána, podali mně a Barnabášovi pravice [na důkaz] společenství, abychom my [šli] k pohanům a oni k obřezaným.
43019023	Description	Když potom vojáci Ježíše ukřižovali, vzali jeho šaty a udělali [z nich] čtyři díly, každému vojákovi díl. [Vzali mu] i košili a ta košile byla nesešívaná, odshora utkaná vcelku.
45002021	Sin	[Proč] tedy ty, který učíš jiného, neučíš sám sebe? Ty, který vyhlašuješ, [že] se nemá krást, kradeš?
46006019	Faith	Anebo nevíte, že vaše tělo je chrámem Ducha Svatého ve vás, kterého máte od Boha, a nejste sami svoji?
47005014	Grace	Vždyť Kristova láska nás zavazuje. Máme zato, že jestliže jeden zemřel za všechny, pak zemřeli všichni;
58003001	Faith	A proto, svatí bratři, účastníci nebeského povolání, hleďte na apoštola a nejvyššího kněze našeho vyznání, Krista Ježíše,
44020035	Recommendation	Ve všem jsem vám ukázal, že máme takto pracovat, podporovat slabé a pamatovat na slova Pána Ježíše, protože on řekl: ‘Požehnanější je dávat, než dostávat.’ ”
58013004	Recommendation	Manželství [ať je] všemi ceněno a [jeho] lože [ať je] neposkvrněné; smilníky a cizoložníky pak bude soudit Bůh.
43020005	Description	A když se naklonil [dovnitř], spatřil ležící plátna, ale nevešel [tam].
66016018	Description	A nastaly hlasy, hromobití a blýskání a bylo veliké zemětřesení - tak veliké zemětřesení, jaké nebylo, co jsou lidé na zemi.
66019010	Faith	Padl jsem tedy k jeho nohám, abych se mu klaněl. Ale řekl mi: “Hleď, abys [to] nedělal! Jsem spoluslužebník tvůj i tvých bratrů, kteří mají Ježíšovo svědectví. Klaněj se Bohu!” (A to Ježíšovo svědectví je duch proroctví.)
46002010	Grace	Nám [to] však Bůh zjevil skrze svého Ducha. Duch totiž zkoumá všechny věci, i Boží hlubokosti.
50002029	Recommendation	Přijměte ho tedy v Pánu s veškerou radostí a mějte takové [lidi] v úctě.
51003020	Recommendation	Děti, poslouchejte ve všem své rodiče, neboť to je příjemné Pánu.
47001012	Faith	Neboť naše chlouba je tato: svědectví našeho svědomí, že jsme si na světě - a obzvláště u vás - počínali v prostotě a upřímnosti Boží, ne v tělesné moudrosti, ale v Boží milosti.
43014021	Faith	Kdo má moje přikázání a zachovává je, to je ten, který mě miluje. A kdo mě miluje, bude milován mým Otcem a já ho budu milovat a zjevím mu sám sebe.”
51002023	Sin	[Svou] strojenou nábožností, [falešnou] pokorou a nešetřením těla sice působí zdáním moudrosti, [ale] nemají žádnou cenu, [jedině] k uspokojení těla.
64001006	Recommendation	Ti vydali před církví svědectví [o] tvé lásce. Když je vypravíš na cestu, jak je důstojné Boha, učiníš dobře.
55002023	Recommendation	Pošetilé a nerozumné otázky pak odmítej, neboť víš, že plodí hádky.
47003018	Faith	My všichni se pak s odkrytou tváří zhlížíme v Pánově slávě jako v zrcadle a jsme proměňováni v tentýž obraz, od slávy k slávě, jako od Pánova Ducha.
58009014	Grace	čím spíše krev Krista, který skrze věčného Ducha obětoval sám sebe neposkvrněného Bohu, očistí vaše svědomí od mrtvých skutků ke službě živému Bohu?
44011017	Grace	Jestliže jim tedy Bůh dal stejný dar jako nám, když uvěřili v Pána Ježíše Krista, kdo jsem byl já, abych mohl zabránit Bohu?”
49004030	Faith	A nezarmucujte Božího Svatého Ducha, jímž jste byli označeni ke dni vykoupení.
66003003	Recommendation	Pamatuj tedy, jak jsi přijal a slyšel [mé slovo]; zachovávej [je] a čiň pokání. Pokud však nebudeš bdít, přijdu na tebe jako zloděj a nebudeš vědět, ve kterou hodinu na tebe přijdu.
62003007	Recommendation	Synáčkové, ať vás nikdo nesvádí. Kdo působí spravedlnost, je spravedlivý, jako je spravedlivý on.
62004001	Recommendation	Milovaní, nevěřte každému duchu, ale zkoušejte duchy, zda jsou z Boha, neboť do světa vyšlo mnoho falešných proroků.
44013038	Grace	Proto ať je vám známo, bratři, že skrze něj se vám prohlašuje odpuštění hříchů.
50003001	Recommendation	Dále [pak], bratři moji, radujte se v Pánu. Psát vám [znovu] totéž mi jistě není zatěžko a pro vás [je to] bezpečné.
46011034	Recommendation	A jestliže má někdo hlad, ať jí doma, abyste se nescházeli k odsouzení. Ostatní věci pak zařídím, až přijdu.
43018031	Description	Pilát jim tedy řekl: “Vezměte si ho vy a suďte ho podle svého zákona.” Židé mu tedy řekli: “My nemáme dovoleno nikoho zabít.”
46012031	Faith	Mějte však horlivou touhu po lepších darech a [já] vám ukážu ještě mnohem vyšší cestu:
58007026	Description	Slušelo se totiž, abychom měli takovéhoto nejvyššího kněze - svatého, nevinného, neposkvrněného, odděleného od hříšníků a vyvýšeného nad nebesa.
50004013	Faith	Všechno mohu v Kristu, který mě posiluje.
52004003	Recommendation	Neboť toto je Boží vůle: vaše posvěcení, [totiž] abyste se zdržovali od smilstva,
51004002	Recommendation	V modlitbě buďte vytrvalí, bděte v ní s díkůčiněním.
44007029	Description	Mojžíš tedy kvůli tomu slovu utekl a bydlel jako přistěhovalec v midjánské zemi, kde zplodil dva syny.
46011007	Description	Muž si ovšem nemá zahalovat hlavu, neboť je obrazem a slávou Boží, žena však je slávou muže.
51003015	Faith	Ve vašich srdcích ať vládne Boží pokoj, k němuž jste také byli povoláni v jednom těle; a buďte vděční.
58002010	Grace	Na toho, pro něhož [je] všechno a skrze něhož [je] všechno, se totiž slušelo, aby přivedl mnoho synů do slávy, když skrze utrpení přivedl k cíli vůdce jejich spasení.
