48006008	Faith	Kdo totiž rozsívá svému tělu, bude z těla sklízet zkázu; kdo však rozsívá Duchu, bude z Ducha sklízet věčný život.
46010009	Recommendation	Ani nepokoušejme Krista, jako někteří z nich pokoušeli a byli zahubeni hady.
46013005	Recommendation	nechová se nepatřičně, nehledá svůj [prospěch], nedá se vydráždit, nemyslí na [nic] zlého;
66009009	Description	Také měly pancíře jako pancíře ze železa a zvuk jejich křídel [byl] jako zvuk vozů, když množství koní běží do boje.
43015022	Sin	Kdybych nepřišel a nemluvil k nim, neměli by hřích, ale teď pro svůj hřích nemají výmluvu.
51004005	Recommendation	Choďte v moudrosti před těmi, kdo jsou venku, a vykupujte čas.
45006006	Faith	Víme [přece], že náš starý člověk byl ukřižován s [ním], aby bylo odstraněno tělo hříchu, abychom již dále nesloužili hříchu.
62003010	Sin	Podle toho jsou zjevní synové Boží a synové ďábla. Nikdo, kdo nepůsobí spravedlnost a kdo nemiluje svého bratra, není z Boha.
45008007	Sin	Smýšlení těla [je] proto v nepřátelství vůči Bohu, neboť není a vlastně ani nemůže být poddáno Božímu zákonu.
44002026	Faith	Proto se mé srdce rozveselilo a můj jazyk zajásal, nadto i mé tělo spočine v naději.
46010020	Sin	[Říkám] spíše, že to, co obětují pohané, obětují démonům a ne Bohu. A [já] nechci, abyste byli účastníky démonů.
44013001	Description	V církvi, která byla v Antiochii, pak byli někteří proroci a učitelé, jako Barnabáš, Šimon zvaný Černý, Lucius Kyrénský, Manahen, který byl vychován společně s tetrarchou Herodem, a Saul.
49005006	Recommendation	Ať vás nikdo neklame prázdnými slovy, neboť kvůli těmto věcem přichází Boží hněv na syny neposlušnosti.
56001011	Sin	jimž musí být zacpána ústa. Ti rozvracejí celé domy, když pro mrzký zisk vyučují tomu, co se nesmí.
43013011	Sin	(Věděl totiž o svém zrádci; proto řekl: “Ne všichni jste čistí.”)
43010001	Sin	“Amen, amen, říkám vám: Kdo nevchází do ovčince dveřmi, ale vstupuje jinudy, ten je zloděj a lupič,
61002015	Sin	opustili přímou cestu a zabloudili, neboť následovali cestu Baláma, [syna] Bosorova, který si zamiloval mzdu za nepravost.
44014005	Violence	Když se je však pohané i Židé se svými vůdci pokusili potupit a kamenovat,
43021017	Description	Zeptal se ho potřetí: “Šimone Jonášův, máš mě rád?” Tehdy se Petr zarmoutil, protože se ho potřetí zeptal: “Máš mě rád?” a odpověděl mu: “Pane, ty víš všechno, ty víš, že tě mám rád.” Ježíš mu řekl: “Krm mé ovce.
66021027	Sin	avšak rozhodně do něj nevejde nic znečišťujícího ani působícího ohavnost a lež, [ale] jen ti, kteří jsou zapsáni v Beránkově knize života.
66017004	Sin	Ta žena byla oblečena purpurem a šarlatem a pokryta zlatem, drahým kamením a perlami. V ruce měla zlatý kalich plný ohavností a nečistoty svého smilstva
51003014	Recommendation	Nad to všechno se však [oblečte] láskou, která je svazkem dokonalosti.
43012023	Description	Ježíš jim tedy odpověděl: “Přišla hodina, aby Syn člověka byl oslaven.
45002022	Sin	Ty, který říkáš: “Necizolož!” cizoložíš? Ty, který se štítíš model, se dopouštíš svatokrádeže?
45007008	Sin	Hřích se pak skrze to přikázání chopil příležitosti a způsobil ve mně veškerou žádost. Bez Zákona [je] tedy hřích mrtev.
44026017	Grace	Budu tě vysvobozovat od tohoto lidu i [od] pohanů, ke kterým tě nyní posílám,
56003003	Sin	Vždyť i my jsme kdysi byli nerozumní, nepovolní, oklamaní, otročili jsme různým žádostem a rozkoším, žili jsme ve zlobě a závisti, [byli jsme] odporní a vzájemně se nenávidící.
54005021	Recommendation	Zapřísahám [tě] před Bohem a Pánem Ježíšem Kristem a [před] vyvolenými anděly, abys tyto věci dodržoval bez předsudků a nedělal nic předpojatě.
58010035	Recommendation	Proto nezahazujte svou smělou důvěru, která má velikou odplatu.
46004002	Faith	Od správců se ostatně vyžaduje, aby byl každý shledán věrným.
44009043	Description	Stalo se tedy, že [Petr] zůstal v Joppe po mnoho dní u nějakého Šimona koželuha.
46003016	Grace	Cožpak nevíte, že jste Boží chrám a [že] Boží Duch přebývá ve vás?
58010019	Faith	Máme tedy, bratři, smělou důvěru k vstoupení do nejsvětější svatyně skrze Ježíšovu krev,
43008021	Sin	Ježíš jim tedy znovu řekl: “Já odcházím a budete mě hledat a zemřete ve svém hříchu. Kam já jdu, vy nemůžete přijít.”
51003012	Recommendation	Oblečte se tedy, jako Boží vyvolení, svatí a milovaní, soucitným milosrdenstvím, laskavostí, pokorou, krotkostí, trpělivostí.
43012026	Faith	Slouží-li mi někdo, ať mě následuje; a tam, kde jsem já, bude i můj služebník. A bude—li mi někdo sloužit, Otec ho poctí.”
54003004	Description	[Ať] dobře vede svou rodinu a udržuje [své] děti v poddanosti se vší počestností
52005011	Recommendation	Proto se navzájem povzbuzujte a budujte jeden druhého, jak také činíte.
62003011	Recommendation	Neboť to je to poselství, které jste slyšeli od počátku, abychom milovali jedni druhé.
46007026	Recommendation	Domnívám se tedy, že je to dobré vzhledem k nynější tísni, [totiž] že je dobré, aby člověk zůstal tak, [jak je].
43003001	Description	Mezi farizeji pak byl člověk jménem Nikodém, židovský hodnostář.
59002025	Description	Nebyla podobně na základě skutků ospravedlněna také nevěstka Rahab, když přijala ty posly a propustila [je] jinou cestou?
54002015	Faith	Bude však ochráněna během rození dětí, zůstanou-li ve víře, lásce a svatosti s rozvahou.
44013017	Grace	Bůh tohoto lidu, Izraele, vyvolil naše otce a pozdvihl tento lid, když pobýval v egyptské zemi, a vyvedl je z ní [svou] vztaženou paží.
44015008	Grace	A Bůh, který zná srdce [lidí], jim vydal svědectví, když jim dal Ducha Svatého tak jako nám.
59002011	Sin	Vždyť ten, který řekl: “Nezcizoložíš,” řekl také: “Nezabiješ.” Jestliže tedy necizoložíš, ale zabíjíš, stal ses přestupníkem Zákona.
43010028	Grace	A já jim dávám věčný život a nezahynou navěky a nikdo je nevytrhne z mé ruky.
45016020	Grace	Bůh pokoje pak rozdrtí Satana pod vašima nohama brzy. Milost našeho Pána Ježíše Krista s vámi. Amen.
55003005	Sin	Budou mít vnější způsob zbožnosti, ale zřeknou se její moci. Od takových se odvracej.
45012005	Description	tak [i my, ačkoli] mnozí, jsme jedno tělo v Kristu a jednotlivě údy jedni druhých.
56003008	Faith	To slovo [je] spolehlivé a chci, abys na těchto věcech trval, aby se ti, kteří uvěřili Bohu, snažili vynikat v dobrých skutcích.
59002023	Faith	Tak se naplnilo Písmo, které říká: “Abraham uvěřil Bohu a bylo mu [to] počteno za spravedlnost” a byl nazván Božím přítelem.
59002001	Faith	Bratři moji, nespojujte víru našeho slavného Pána Ježíše Krista s předpojatostí.
45003013	Sin	“Jejich hrdlo [je] otevřený hrob, svými jazyky podváděli.” “Pod jejich rty [je] jed lítých hadů.”
49005028	Recommendation	Tak jsou i muži povinni milovat své manželky jako svá vlastní těla. Kdo miluje svou manželku, miluje sám sebe.
45009030	Faith	Co tedy řekneme? Že pohané, kteří spravedlnost nevyhledávali, dosáhli spravedlnosti, totiž spravedlnosti z víry,
54003009	Faith	[ale] mající tajemství víry v čistém svědomí.
54006002	Recommendation	A ti, kdo mají za pány věřící, ať [jimi] nepohrdají, protože jsou bratři, ale ať slouží tím spíše, protože ti, kdo mají užitek [z jejich] dobré práce, jsou věřící a milovaní. Tyto věci uč a vybízej [k nim].
45003003	Faith	Co totiž [na tom], jestliže někteří neuvěřili? Zruší snad jejich nevěra Boží věrnost?
43019034	Violence	ale jeden z vojáků probodl jeho bok kopím a hned vyšla krev a voda.
43015012	Recommendation	Toto je mé přikázání, abyste se navzájem milovali, jako jsem já miloval vás.
45006013	Recommendation	Také nevydávejte své údy hříchu za nástroje nepravosti, ale vydejte se Bohu jako [ti], kdo ožili z mrtvých a své údy [vydejte] Bohu za nástroje spravedlnosti.
58010039	Faith	My však necouváme k záhubě, ale věříme k získání duše.
45011026	Grace	A tak bude spasen celý Izrael, jak je napsáno: “Ze Sionu přijde Vysvoboditel a odvrátí bezbožnosti od Jákoba.
52002015	Violence	kteří zabili Pána Ježíše i své vlastní proroky, nás vyhnali, Bohu se nelíbí a [vůči] všem lidem [jsou] nepřátelští.
58010026	Sin	Jestliže totiž poté, co jsme poznali pravdu, dobrovolně hřešíme, nezůstává již žádná oběť za hříchy,
49002006	Grace	a spolu [s ním] vzkřísil a posadil na nebesích v Kristu Ježíši,
49004025	Recommendation	Proto odložme lež a mluvme každý se svým bližním pravdu, neboť jsme údy jedni druhých.
48002005	Faith	Těm jsme ani na chvíli neustoupili a nepoddali se, aby při vás zůstala pravda evangelia.
46014013	Recommendation	Proto ať se ten, kdo mluví jazykem, modlí, aby mohl vykládat.
44009001	Violence	Saul však ještě [stále] dychtil po výhrůžkách a po vraždění Pánových učedníků. Přišel k nejvyššímu knězi
43017013	Description	Teď ale jdu k tobě a toto mluvím na světě, aby v sobě měli plnost mé radosti.
60004013	Recommendation	ale radujte se [z toho], že jste účastníky Kristových utrpení, abyste se s jásotem radovali i při zjevení jeho slávy.
44011006	Description	Když jsem do ní upřeně pohlédl, rozeznal jsem a spatřil čtvernohá zvířata země i šelmy a plazy a nebeské ptáky.
51003008	Recommendation	ale nyní to všechno ze svých úst odložte: zuřivost, hněv, zlobu, urážky [i] nestoudné řeči.
44018003	Description	A protože byl stejného řemesla, bydlel a pracoval u nich, neboť jejich řemeslem bylo dělat stany.
45006012	Sin	Ať tedy ve vašich smrtelných tělech nevládne hřích, tak abyste ho poslouchali v jeho žádostech.
53003012	Recommendation	Takovým tedy přikazujeme a vyzýváme [je] skrze našeho Pána Ježíše Krista, aby pokojně pracovali a jedli svůj vlastní chléb.
44007009	Sin	“Patriarchové pak žárlili na Josefa a prodali [ho] do Egypta, ale Bůh byl s ním.
44011028	Description	Jeden z nich jménem Agabus povstal a oznamoval skrze Ducha, že po celém světě bude veliký hlad. (Ten také nastal za císaře Klaudia.)
44020036	Description	A když to řekl, poklekl s nimi všemi a modlil se.
48005024	Faith	A ti, kdo jsou Kristovi, ukřižovali [své] tělo s vášněmi a žádostmi.
59001002	Recommendation	Považujte [to] jen za radost, bratři moji, když upadáte do různých zkoušek,
62001006	Sin	Řekneme-li, že s ním máme společenství, a chodíme ve tmě, lžeme a nečiníme pravdu.
44010011	Description	A spatřil otevřené nebe a jakousi nádobu, jak sestupuje k němu jako veliká plachta uvázaná za čtyři cípy a spouští se na zem.
44002009	Description	Parthové, Médové, Elamité a obyvatelé Mezopotámie, Judska i Kappadokie, Pontu a Asie,
51001010	Faith	abyste chodili, jak je důstojné Pána, k [jeho] plnému zalíbení, [abyste] nesli ovoce v každém dobrém skutku, rostli v poznání Boha
54001018	Recommendation	Toto přikázání ti ukládám, [můj] synu Timoteji, podle předešlých proroctví o tobě, abys skrze ně bojoval dobrý boj,
66019001	Faith	Potom jsem uslyšel mocný hlas velikého zástupu v nebi, který říkal: “Halelujah! Spasení a sláva, čest i moc Pánu, našemu Bohu,
49002001	Grace	A [vzkřísil] i vás, mrtvé v proviněních a hříších,
46010021	Sin	Nemůžete pít Pánův kalich i kalich démonů; nemůžete mít podíl na Pánově stolu i na stolu démonů.
49005003	Recommendation	Avšak smilstvo, veškerá nečistota a chtivost ať mezi vámi nejsou ani jmenovány, jak se sluší na svaté;
56001015	Sin	Čistým [je] všechno čisté; poskvrněným a nevěřícím však [není] čisté nic, ale jejich [vlastní] mysl i svědomí jsou poskvrněné.
44009021	Description	Všichni, kteří [ho] slyšeli, tedy žasli a říkali: “Copak toto není ten, který v Jeruzalémě vyhlazoval ty, kdo vzývali toto jméno a sem přišel proto, aby je odvedl svázané k velekněžím?”
58008006	Description	Nyní pak obdržel [o tolik] významnější službu, nakolik je také prostředníkem lepší smlouvy, která je založena na lepších zaslíbeních.
50001021	Faith	Neboť žít - [to je] pro mne Kristus a umřít - [to je] zisk.
50001006	Faith	Jsem si jist, že ten, který ve vás začal dobré dílo, [je také] do dne Ježíše Krista dokončí.
62005020	Faith	A víme, že Boží Syn přišel a dal nám schopnost, abychom poznali toho pravého, a jsme v tom pravém, v jeho Synu Ježíši Kristu. On je ten pravý Bůh a věčný život.
45012018	Recommendation	Je-li [to] možné, pokud je na vás, mějte se všemi lidmi pokoj.
58010023	Faith	Držme se neochvějně vyznání [naší] naděje, neboť ten, který dal zaslíbení, [je] věrný.
43014027	Grace	Zanechávám vám pokoj, svůj pokoj vám dávám; já vám dávám, ne jako dává svět. Ať se vaše srdce nermoutí ani nestrachuje.
47005006	Faith	Proto máme stále smělou důvěru a víme, že dokud jsme doma v tomto těle, jsme vzdáleni od Pána.
43012047	Grace	A jestliže někdo slyší má slova a nevěří, já ho nesoudím; nepřišel jsem totiž, abych soudil svět, ale abych svět spasil.
62003012	Sin	Ne jako Kain, [který] byl z toho zlého a zavraždil svého bratra. A proč ho zavraždil? Protože jeho skutky byly zlé, kdežto [skutky] jeho bratra spravedlivé.
66016020	Description	Tehdy zmizely všechny ostrovy a hory se nedaly najít.
58011012	Description	Proto se také z [toho] jednoho, a to již umrtveného, narodilo bezpočet [potomků], jako [je] množství nebeských hvězd a jako [je] písku na mořském břehu.
54001017	Faith	Králi věků, nepomíjejícímu, neviditelnému, jedinému moudrému Bohu [buď] čest a sláva na věky věků! Amen.
66014007	Faith	jak říká mocným hlasem: “Bojte se Boha a vzdejte mu chválu, neboť přišla hodina jeho soudu; klanějte se Tomu, který stvořil nebe, zemi, moře i prameny vod!”
44006001	Description	V těch dnech, když se rozmnožoval [počet] učedníků, pak nastalo reptání helénistů proti Hebrejům, že jejich vdovy jsou při každodenní službě zanedbávány.
60002021	Grace	Jste k tomu přece povoláni, protože i Kristus trpěl za nás a [tak] nám zanechal vzor, abyste následovali jeho šlépěje:
53003010	Recommendation	Když jsme [ještě] byli u vás, přikazovali jsme vám přece toto: Nechce-li někdo pracovat, ať také nejí!
43003016	Grace	Neboť Bůh tak miloval svět, že dal svého jednorozeného Syna, aby žádný, kdo věří v něho, nezahynul, ale měl věčný život.
44019015	Description	Zlý duch jim však odpověděl: “Ježíše znám a o Pavlovi vím, ale kdo jste vy?”
66019019	Violence	A uviděl jsem šelmu a krále země i jejich vojska, jak se sjeli, aby svedli boj s Tím, který seděl na tom koni, a s jeho vojskem.
44027002	Description	Nastoupili jsme tedy na adramyttskou loď, která měla plout podél pobřeží Asie, a vypluli jsme. Byl s námi [také] Aristarchos, Makedonec z Tesaloniky.
58013003	Recommendation	Pamatujte na vězně jako [byste] byli uvězněni s [nimi], na trpící, jako ti, kdo jsou sami také v těle.
51003017	Recommendation	A všechno, cokoli děláte slovem nebo skutkem, všechno [to čiňte] ve jménu Pána Ježíše a děkujte skrze něj Bohu a Otci.
48006006	Recommendation	Ten, kdo je vyučován ve slově, ať se ve všech dobrých věcech dělí s tím, kdo [ho] vyučuje.
44007005	Description	A nedal mu v ní dědictví ani [jako] šlápotu nohy, ale slíbil ji dát do vlastnictví jemu i jeho semeni po něm, když [ještě] neměl syna.
44007019	Description	Ten nakládal s naším rodem lstivě a trápil naše otce, takže [museli] odkládat své novorozence, aby nezůstávali naživu.
43020003	Description	Petr tedy vyšel, i ten druhý učedník a šli k hrobu.
44024016	Faith	Proto se sám snažím o to, abych měl vždycky čisté svědomí před Bohem i před lidmi.
65001013	Description	divoké mořské vlny vypěňující své vlastní hanebnosti, bludné hvězdy, jimž je na věčnost zachována černota tmy.
48001012	Description	Já jsem ho totiž nepřijal ani se [ho] nenaučil od člověka, ale zjevením Ježíše Krista.
45007005	Sin	Když jsme totiž byli v těle, vášně hříchů, [probouzené] skrze Zákon, působily v našich údech k plození ovoce smrti.
54002007	Faith	k čemuž jsem byl já postaven za kazatele a apoštola (říkám pravdu v Kristu, nelžu), za učitele pohanů ve víře a pravdě.
62003024	Faith	Kdo tedy zachovává jeho přikázání, zůstává v něm a on [také] v něm. A podle toho poznáváme, že zůstává v nás, [totiž] podle Ducha, kterého nám dal.
46010024	Recommendation	Nikdo ať nehledá svůj [prospěch], ale každý [prospěch] toho druhého.
45012016	Recommendation	Buďte k sobě navzájem jednomyslní, nesmýšlejte vysoce, ale nechte se vést k poníženým. Nebuďte moudří sami před sebou.
49004031	Recommendation	Veškerá hořkost, hněv, zuřivost, křik i urážky ať jsou od vás odňaty [spolu] s každou špatností.
51001025	Faith	Jejím jsem se stal služebníkem, vzhledem ke správcovství, jež mi bylo pro vás dáno od Boha, abych naplnil Boží slovo -
66001014	Description	Jeho hlava a vlasy [byly] bílé jako bílá vlna, jako sníh a jeho oči jako plamen ohně.
47004015	Grace	To všechno [se] totiž [děje] pro vás, aby se milost rozmnožená skrze díkůčinění mnohých ještě více rozhojnila k Boží slávě.
43006056	Faith	Kdo jí mé tělo a pije mou krev, zůstává ve mně a já v něm.
43011027	Faith	Řekla mu: “Ano, Pane, já jsem uvěřila, že ty jsi Kristus, Boží Syn, který má přijít na svět.”
44002042	Faith	a zůstávali v apoštolském učení a ve společenství, v lámání chleba a v modlitbách.
58001009	Grace	Miloval jsi spravedlnost a nenáviděl jsi nepravost; proto tě, ó Bože, pomazal tvůj Bůh olejem veselí nad [všechny] tvé společníky.”
44012002	Violence	Popravil tedy Jakuba, Janova bratra, mečem,
55002016	Recommendation	Světským prázdným řečem se pak vyhýbej, neboť [ti, kdo je mluví,] budou postupovat k [ještě] větší bezbožnosti
62003015	Sin	Každý, kdo nenávidí svého bratra, je vrah; a víte, že žádný vrah nemá věčný život, který by v něm zůstával.
43021015	Faith	A když posnídali, zeptal se Ježíš Šimona Petra: “Šimone Jonášův, miluješ mě více než tito?” [On] mu řekl: “Ano, Pane, ty víš, že tě mám rád.” Řekl mu: “Krm mé beránky.”
46012008	Grace	jednomu je totiž skrze Ducha dáváno slovo moudrosti, jinému pak slovo poznání podle téhož Ducha,
44007013	Description	a podruhé se Josef dal svým bratrům poznat a [tak] byl farao seznámen s Josefovým rodem.
60003010	Recommendation	Vždyť: “Kdo chce milovat život a vidět dobré dny, ať zdržuje svůj jazyk od zlého a jeho rty ať nemluví lest.
44004032	Description	To množství věřících pak mělo [jedno] srdce a jednu duši. Nikdo ani nenazýval nic z toho, co měl, svým vlastním, ale měli všechny věci společné.
46015003	Grace	Předal jsem vám totiž především to, co jsem také přijal: že Kristus zemřel za naše hříchy podle Písem
66018024	Violence	V něm pak byla nalezena krev proroků a svatých i všech, kdo byli zavražděni na zemi.
44013048	Faith	Když [to] tedy slyšeli pohané, radovali se a oslavovali Pánovo slovo a všichni, kdo byli předurčeni k věčnému životu, uvěřili.
66022020	Description	Ten, který vydává svědectví o těchto věcech, říká: “Jistě, přijdu rychle. Amen.” Ano, přijď, Pane Ježíši!
50004009	Recommendation	Čemu jste se naučili a přijali, [co] jste slyšeli a viděli na mně, to dělejte a Bůh pokoje bude s vámi.
53003015	Recommendation	Nemějte [ho] však za nepřítele, ale napomínejte [ho] jako bratra.
51002008	Recommendation	Dejte si pozor, aby vás někdo neunesl filozofií a marným klamem založeným na lidské tradici, na principech světa, a ne na Kristu.
50003014	Faith	ženu se k cíli, k vítězné odměně Božího povolání shůry v Kristu Ježíši.
56002014	Faith	který dal sám sebe za nás, aby nás vykoupil z veškeré nepravosti a očistil si pro sebe svůj zvláštní lid, horlivě milující dobré skutky.
43005024	Faith	“Amen, amen, říkám vám: Kdo slyší mé slovo a věří Tomu, který mě poslal, má věčný život a nepřijde na soud, ale již přešel ze smrti do života.
66021015	Description	A ten, který se mnou mluvil, měl zlatou třtinu, aby změřil město, jeho brány i jeho hradbu.
50003019	Sin	Jejich konec [je] záhuba, jejich bůh břicho a [jejich] sláva v jejich hanebnostech. Ti myslí na pozemské věci.
54003006	Sin	ne čerstvě obrácený, aby nadut [pýchou] neupadl do ďáblova odsouzení.
65001003	Recommendation	Milovaní, ačkoli jsem vynakládal všechnu snahu, abych vám psal o našem společném spasení, musel jsem vám napsat napomenutí, abyste statečně bojovali o víru, která byla jednou [provždy] dána svatým.
44004002	Description	protože těžce nesli, že učí lid a kážou vzkříšení z mrtvých skrze Ježíše.
66018005	Sin	Neboť její hříchy dosáhly až k nebi a Bůh se rozpomněl na její nepravosti.
43004046	Description	Přišel tedy znovu do Kány Galilejské, kde udělal z vody víno. A [tam] byl jeden královský [úředník], jehož syn byl nemocný v Kafarnaum.
45012011	Recommendation	v pilnosti nepolevujte, buďte vroucí duchem, služte Pánu,
60001008	Faith	I když jste ho neviděli, milujete [ho]; a i když [ho] dosud nevidíte, přece v něj věříte a radujete se nevýslovnou radostí plnou slávy,
62004013	Grace	Podle toho poznáváme, že zůstáváme v něm a on v nás, že nám dal ze svého Ducha.
43019029	Description	A stála [tam] nádoba plná octa. Naplnili tedy houbu octem, dali [ji] na [větev] yzopu a podali k jeho ústům.
51001013	Grace	On nás vysvobodil z vlády temnoty a přenesl do království svého milovaného Syna,
45016017	Recommendation	Vyzývám vás však, bratři, abyste si dávali pozor na ty, kdo působí roztržky a pohoršení proti učení, které jste poznali, a vyvarujte se jich.
45012007	Recommendation	nebo službu, ve sloužení; nebo ten, kdo učí, ve vyučování;
43016023	Faith	A v ten den se mě nebudete ptát na nic. Amen, amen, říkám vám, že o cokoli byste poprosili Otce v mém jménu, [to] vám dá.
66021019	Description	Základy městské hradby byly ozdobeny všemi drahokamy: první základ [byl] jaspis, druhý safír, třetí chalcedon, čtvrtý smaragd,
59004017	Sin	Kdo tedy umí činit dobře, avšak nečiní, má hřích.
66019005	Faith	A z trůnu vyšel hlas, který říkal: “Chvalte našeho Boha, všichni jeho služebníci a kdo se ho bojíte, malí i velcí!”
47005002	Faith	Vždyť také v tomto vzdycháme, neboť toužíme být oblečeni svým příbytkem z nebe,
48006004	Recommendation	Každý ať posoudí své vlastní dílo a tehdy se bude chlubit jen sám sobě, a ne jinému.
46007036	Recommendation	Domnívá-li se však někdo, že nejedná slušně vůči své panně, jestliže je ve zralém věku a musí to tak být, ať dělá, jak chce: nehřeší. Ať se vezmou.
43016002	Violence	Vyobcují vás ze shromáždění, ano, přichází hodina, kdy každý, kdo vás bude zabíjet, se bude domnívat, že [tím] koná službu Bohu.
66015001	Description	Potom jsem na nebi uviděl jiné znamení, veliké a předivné: sedm andělů, kteří mají sedm posledních ran; neboť skrze ně [má] být dokonán Boží hněv.
43018023	Description	Ježíš mu odpověděl: “Jestliže jsem mluvil zle, vydej svědectví o zlém, jestliže však dobře, proč mě biješ?”
50004003	Recommendation	A žádám i tebe, věrný spojenče, pomáhej jim. Ony [přece] spolu se mnou bojovaly v evangeliu, a také s Klementem a s mými ostatními spolupracovníky, jejichž jména [jsou] v knize života.
66016006	Sin	Protože prolévali krev svatých a proroků, a [ty] jsi jim dal pít krev, neboť si [to] zaslouží.”
45006002	Sin	V žádném případě! Jak bychom mohli ještě žít v hříchu [my,] kdo jsme mu zemřeli?
66017011	Violence	A šelma, která byla a není, ta je osmý [král]; je z těch sedmi a jde do záhuby.
48004030	Recommendation	Avšak co říká Písmo? “Vyvrhni služku i jejího syna, neboť syn služky nebude dědicem se synem svobodné.”
54006009	Sin	Ti, kdo touží zbohatnout, však upadají do pokušení a pasti a [do] mnoha nerozumných a škodlivých žádostí, které ponořují lidi do záhuby a zkázy.
66017016	Violence	A těch deset rohů, které jsi viděl na šelmě, začne nenávidět tu nevěstku a způsobí, že bude zpustošená a nahá, a budou jíst její tělo a spálí ji ohněm.
46008003	Faith	Jestliže však někdo miluje Boha, ten je jím poznán.)
45003009	Sin	Co tedy? Máme [nějakou] přednost? Vůbec ne; vždyť jsme již dříve obvinili jak Židy, tak Řeky, že jsou všichni pod hříchem,
44007041	Sin	V těch dnech pak udělali tele a přinesli té modle oběť a veselili se z díla svých rukou.
66009020	Sin	Ostatní lidé, kteří nebyli zabiti těmito ranami, však nečinili pokání ze skutků svých rukou, aby se přestali klanět démonům a modlám [ze] zlata, stříbra, mědi, [z] kamene i [ze] dřeva, které nemohou vidět ani slyšet ani chodit.
