65001018	Sin	Řekli vám přece, že v posledním čase budou posměvači chodící podle svých bezbožných žádostí.
45011018	Recommendation	nechlub se proti těm větvím. Pokud se však vychloubáš, [pamatuj, že] ne ty neseš kořen, ale kořen tebe.
47001024	Faith	Ne že panujeme nad vaší vírou, ale jsme pomocníky vaší radosti; vždyť vírou stojíte.
43011001	Description	Nějaký Lazar z Betanie, městečka Marie a její sestry Marty, pak byl nemocný.
52004008	Sin	Kdo tedy [toto] odmítá, neodmítá člověka, ale Boha, který nám také dal svého Svatého Ducha.
62004002	Faith	Podle tohoto poznávejte Božího Ducha: každý duch, který vyznává Ježíše Krista přišlého v těle, je z Boha.
65001008	Sin	tak podobně i tito [jako] pohroužení do snu poskvrňují tělo, odmítají vlády a tupí hodnostáře.
60003011	Recommendation	Ať se odvrátí od zlého a činí dobré; ať hledá pokoj a následuje jej.
51001023	Faith	pokud ovšem zůstáváte založení a pevní ve víře a neodchylujete se od naděje evangelia, jež jste slyšeli, jež bylo vyhlášeno všemu stvoření pod nebem a jehož jsem se já Pavel stal služebníkem.
43008059	Violence	Vzali tedy kamení, aby po něm házeli. Ježíš se však skryl, a když prošel jejich středem, vyšel z chrámu; a tak odešel.
49004024	Recommendation	a oblékněte toho nového člověka, který byl stvořen podle Boha ve spravedlnosti a svatosti pravdy.
66014012	Faith	Zde je vytrvalost svatých, zde [jsou] ti, kteří zachovávají Boží přikázání a Ježíšovu víru.
44013030	Description	Ale Bůh ho vzkřísil z mrtvých
43010011	Description	Já jsem ten dobrý pastýř. Dobrý pastýř pokládá za ovce svůj život.
49003002	Grace	pokud jste ovšem slyšeli o správě Boží milosti, jež mi byla udělena pro vás,
56003010	Recommendation	Sektáře po prvním a druhém napomenutí vyobcuj.
43010019	Description	Mezi Židy tedy znovu nastala kvůli těm slovům roztržka.
43003033	Faith	Kdo přijímá jeho svědectví, zpečetil [to], že Bůh je pravdomluvný.
61003014	Recommendation	Proto, milovaní, očekávejte tyto věci a snažte se, abyste jím byli shledáni v pokoji jako neposkvrnění a bezúhonní.
53003001	Faith	Závěrem, bratři, modlete se za nás, aby se Pánovo slovo rychle šířilo a bylo oslavováno tak jako u vás
47004014	Faith	neboť víme, že Ten, který vzkřísil Pána Ježíše, vzkřísí skrze Ježíše i nás a postaví [nás] s vámi.
59005014	Recommendation	Je někdo z vás nemocný? Ať zavolá starší sboru a ať se za něj modlí a pomažou ho olejem v Pánově jménu.
44007023	Description	A když mu bylo čtyřicet let, přišlo mu na srdce, aby navštívil své bratry, syny Izraele.
44023027	Violence	Tohoto muže Židé zajali a chtěli zabít. Když jsem se [však] dozvěděl, že je Říman, přišel jsem s vojskem a vytrhl [jim] ho.
44019029	Description	Celé město se tedy naplnilo rozruchem a když chytili Makedonce Gaia a Aristarcha, Pavlovy společníky na cestách, hnali se [všichni] společně do divadla.
44003014	Sin	Zřekli jste se toho Svatého a Spravedlivého a vyžádali jste si, aby vám byl vydán vrah.
44015009	Faith	A neučinil žádný rozdíl mezi námi a jimi, když vírou očistil jejich srdce.
46011028	Recommendation	Ať tedy člověk prověří sám sebe a takto ať jí z toho chleba a pije z toho kalichu.
46015058	Faith	Proto, moji milovaní bratři, buďte pevní a nepohnutelní, stále se rozhojňujte v Pánově díle a vězte, že vaše práce není v Pánu marná.
46004016	Recommendation	Vyzývám vás tedy, následujte můj příklad.
46001021	Faith	Když totiž v Boží moudrosti svět nepoznal Boha skrze moudrost, zalíbilo se Bohu spasit věřící skrze bláznivost kázání.
60003001	Recommendation	Podobně [vy] ženy, buďte poddány svým manželům, aby když někteří neposlouchají slovo, byli získáni beze slov jednáním [svých] žen,
47005020	Recommendation	Proto tedy jako Kristovi velvyslanci prosíme na místě Kristově, jako by skrze nás žádal Bůh: Smiřte se s Bohem.
44002024	Description	Bůh ho [ale] vzkřísil a zprostil bolestí smrti, protože nebylo možné, aby ho držela ve své moci.
59002007	Sin	Nerouhají se [právě] oni tomu vzácnému jménu, které bylo nad vámi vyhlášeno?
54003003	Description	ne pijan, ne ziskuchtivý [nebo] rváč, ale vlídný, ne svárlivý, ne lakomec.
43004014	Grace	Kdo by se však napil té vody, kterou mu dám já, nebude žíznit navěky, ale ta voda, kterou mu dám, se v něm stane pramenem vody tryskající k věčnému životu.”
62002005	Faith	Kdokoli však zachovává jeho slovo, v tom Boží láska opravdu došla k dokonalosti. Podle toho víme, že jsme v něm.
66016013	Description	Tehdy jsem uviděl z úst draka, z úst šelmy a z úst falešného proroka vycházet tři nečisté duchy podobné žabám.
59002008	Recommendation	Jestliže vskutku plníte královský zákon podle Písma: “Budeš milovat svého bližního jako sám sebe,” činíte dobře.
47004005	Faith	Neboť nekážeme sami sebe, ale Ježíše Krista [jako] Pána, a sebe [jako] vaše služebníky pro Ježíše.
46015033	Recommendation	Nemylte se: “Špatné vztahy kazí dobré mravy.”
58013020	Grace	A Bůh pokoje, který pro krev věčné smlouvy vyvedl z mrtvých našeho Pána Ježíše, toho velikého Pastýře ovcí,
50001027	Recommendation	Jenom veďte život důstojný Kristova evangelia, abych ať už přijdu a uvidím vás, anebo když budu vzdálen, slyšel o vás, že stojíte v jednom duchu, [že] s jednou myslí společně bojujete ve víře evangelia
46006014	Grace	Bůh vzkřísil Pána - vzkřísí svou mocí i nás!
55001006	Recommendation	Proto ti připomínám, abys rozněcoval ten Boží dar, který je v tobě díky vkládání mých rukou.
60004006	Grace	Proto bylo také mrtvým kázáno evangelium, aby mohli být u Boha živí v duchu, ačkoli byli u lidí odsouzeni v těle.
46007023	Recommendation	Byli jste koupeni za cenu; nestávejte se otroky lidí!
46010010	Recommendation	Ani nereptejte, jako někteří z nich reptali a byli zahubeni zhoubcem.
47002017	Faith	Nejsme totiž jako mnozí, kteří kupčí s Božím slovem, ale jakožto z upřímnosti, jakožto z Boha, mluvíme před Boží tváří o Kristu.
45015001	Recommendation	My silní jsme tedy povinni snášet slabosti těch, kdo silní nejsou, a ne se snažit líbit sami sobě.
50002024	Faith	Spoléhám však v Pánu [na to], že [k vám] brzy přijdu i sám.
66007001	Description	Potom jsem uviděl čtyři anděly, kteří stáli ve čtyřech koutech země a drželi čtyři zemské větry, aby vítr nevál na zem ani na moře ani na žádný strom.
60004003	Sin	Stačí nám přece ten uplynulý čas života, kdy jsme dělali, co se líbí pohanům: chodili jsme v nestydatostech, žádostech, opilství, hodech, pitkách a [v] nechutné modloslužbě.
66011005	Violence	A kdyby jim chtěl někdo ublížit, vyjde z jejich úst oheň a pohltí jejich nepřátele. Kdyby jim tedy chtěl někdo ublížit, musí být takto zabit.
44023005	Recommendation	Pavel řekl: “Nevěděl jsem, bratři, že je [to] nejvyšší kněz. Je přece napsáno: ‘Vůdci svého lidu nebudeš zlořečit.’ ”
66022015	Sin	Venku však [zůstanou] psi, čarodějové, smilníci, vrahové, modláři a každý, kdo miluje a provozuje lež.
66002014	Sin	Ale mám proti tobě [to] málo, že tam máš ty, kteří drží učení Balámovo, který učil Baláka klást pohoršení před syny Izraele, aby jedli to, co je obětované modlám a smilnili.
53001003	Faith	Musíme za vás, bratři, stále děkovat Bohu, jak se sluší, protože vaše víra velice roste a vzájemná láska vás všech se rozhojňuje,
46012002	Sin	Víte, že jste byli pohané a chodili jste k němým modlám, jak jste bývali vedeni.
49005025	Recommendation	Muži, milujte své ženy, jako i Kristus miloval církev a vydal sám sebe za ni,
45012017	Recommendation	Nikomu neodplácejte zlo zlem. Opatrujte dobré přede všemi lidmi.
60005006	Recommendation	Pokořte se tedy pod mocnou Boží ruku, aby vás v patřičný čas povýšil.
44014017	Grace	ačkoliv nenechal sám sebe bez svědectví, protože konal dobro, dával nám z nebe déšť a úrodné časy a nasycoval naše srdce pokrmem a potěšením.”
54003011	Recommendation	Rovněž manželky [ať mají] počestné, ne pomlouvačné, [ale] střídmé, ve všem věrné.
66002021	Sin	A dal jsem jí čas, aby činila pokání ze svého smilstva, ale [ona] pokání nečinila.
44012020	Description	Tehdy se Herodes velice hněval na Nýrské a Sidonské. Přišli tedy jednomyslně k němu a když přesvědčili Blasta, královského komorníka, žádali o smír, protože jejich kraj byl zásobován z královského území.
43008049	Sin	Ježíš odpověděl: “Já nemám démona, ale ctím svého Otce a vy mnou pohrdáte.
43006018	Description	Tehdy se moře začalo zvedat vanutím velikého větru.
45008018	Faith	Mám totiž za to, že utrpení nynějšího času nejsou srovnatelná s tou slávou, která se má zjevit na nás.
62002012	Grace	Píši vám, synáčkové, že jsou vám odpuštěny hříchy pro jeho jméno.
55001009	Grace	[Vždyť] on nás spasil a povolal svatým povoláním; ne podle našich skutků, ale podle vlastního předsevzetí a [podle] milosti, která nám byla dána v Kristu Ježíši před věčnými časy
43019006	Violence	A jakmile ho velekněží a [jejich] služebníci uviděli, vykřikli: “Ukřižuj [ho], ukřižuj!” Pilát jim řekl: “Vezměte ho vy a ukřižujte, neboť já na něm [žádnou] vinu nenalézám.”
60001010	Grace	Toto spasení se snažili vyhledat a objevit proroci, kteří prorokovali o té milosti, která [měla přijít] k vám.
63001007	Sin	Do světa totiž vyšlo mnoho bludařů, kteří nevyznávají Ježíše Krista přišlého v těle. [Každý] takový je bludař a antikrist.
44024005	Sin	Shledali jsme totiž, [že] tento muž [je jako] mor. Rozněcuje nesváry mezi všemi Židy po celém světě a [je] vůdcem té sekty nazaretských.
54003016	Grace	Tajemství zbožnosti je bezesporu veliké: Bůh byl zjeven v těle, ospravedlněn v Duchu, viděn anděly, kázán pohanům, uvěřilo se mu na světě a ve slávě byl vzat vzhůru.
66016021	Violence	Z nebe padaly na lidi veliké kroupy, [těžké] jako cent. A kvůli ráně těch krup se lidé rouhali Bohu, neboť ta rána byla nesmírně veliká.
61003013	Faith	Podle jeho zaslíbení však očekáváme nová nebesa a novou zemi, v nichž přebývá spravedlnost.
66006014	Description	A nebe bylo odstraněno, jako když se zavírá kniha, a všechny hory i ostrovy se pohnuly ze svého místa.
58010010	Grace	A v této vůli jsme skrze obětování těla Ježíše Krista jednou provždy posvěceni.
52001002	Faith	Stále za vás všechny děkujeme Bohu a zmiňujeme se o vás ve svých modlitbách;
66006004	Violence	A vyšel jiný kůň, ohnivě rudý. A tomu, kdo na něm seděl, bylo dáno, aby odňal mír ze země a aby se navzájem vraždili; a byl mu dán veliký meč.
54006001	Recommendation	Všichni, kdo jsou pod otrockým jhem, ať považují své pány za hodné vší úcty, aby Boží jméno a učení nebylo tupeno.
51003009	Recommendation	Nelžete jedni druhým, když jste [již] svlékli starého člověka s jeho skutky
66002020	Sin	Ale mám proti tobě [to] málo, že necháváš ženu Jezábel, která si říká prorokyně, aby učila a sváděla mé služebníky, aby smilnili a jedli to, co je obětované modlám.
48003008	Grace	A Písmo, které předvídalo, že Bůh ospravedlňuje pohany z víry, předpovědělo Abrahamovi: “V tobě budou požehnány všechny národy.”
58012005	Recommendation	a zapomněli jste na povzbuzení, které k vám promlouvá jako k synům: “Synu můj, nepohrdej tím, když [tě] Pán vychovává, a neklesej [na mysli], když tě kárá.
58013017	Recommendation	Poslouchejte ty, kdo vás vedou, a buďte poddajní, neboť oni bdí nad vašimi dušemi jako ti, kdo budou [muset] skládat účty. Ať to mohou dělat s radostí a ne se vzdycháním - to by vám přece nebylo prospěšné.
44013019	Description	a když vyhladil sedm národů v zemi Kanán, rozdělil jim jejich zem losem.
54006003	Faith	Učí-li někdo jinak a nechce přistoupit na zdravá slova našeho Pána Ježíše Krista a učení, které odpovídá zbožnosti,
63001010	Recommendation	Přichází-li k vám někdo a nepřináší toto učení, nepřijímejte ho do domu, ani ho nezdravte.
47001005	Grace	Jak se totiž při nás rozhojňují Kristova utrpení, tak se skrze Krista rozhojňuje také naše potěšení.
65001011	Sin	Běda jim, neboť se vydali Kainovou cestou a propadli svodu Balámovy mzdy a zahynuli odporováním Chóreho.
65001010	Sin	Tito se však rouhají tomu, co neznají, a kazí se tím, co znají přirozeně jako nerozumná zvířata.
58011007	Faith	Vírou Noé, Bohem obeznámený o dosud neviditelných věcech, pečlivě připravil archu k záchraně svého domu. Skrze ni odsoudil svět a stal se dědicem spravedlnosti, jež [vyplývá] z víry.
58009006	Description	Od doby, kdy to bylo takto zřízeno, vcházejí kněží neustále do prvního stánku a konají bohoslužbu.
44007051	Sin	“Tvrdošíjní a neobřezaného srdce i uší, vy stále [jen] vzdorujete Duchu Svatému - jak vaši otcové, [tak] i vy!
54001009	Sin	a s vědomím toho, že Zákon není uložen spravedlivému, ale nespravedlivým a nepoddaným, bezbožným a hříšníkům, nesvatým a světským [lidem], otcovrahům, matkovrahům a vrahům [vůbec],
46005009	Recommendation	Napsal jsem vám v dopisu, abyste se nesměšovali se smilníky,
48001015	Grace	Když se však Bohu, který mě oddělil [již] v lůnu mé matky a povolal svou milostí, zalíbilo
45007015	Description	Nerozumím totiž [tomu], co dělám; neboť nekonám to, co chci, ale dělám to, co nenávidím.
61003018	Faith	Rozrůstejte se pak v milosti a poznání našeho Pána a Spasitele Ježíše Krista, jemuž [buď] sláva nyní i na věčné časy. Amen.
46004010	Description	My [jsme] kvůli Kristu blázny, ale vy [jste] v Kristu rozumní; my slabí, ale vy silní; vy slavní, ale my bezectní.
60005009	Faith	Vzepřete se mu [jakožto] silní ve víře a vězte, [že] tatáž utrpení se dějí vašim bratrům na [celém] světě.
51003022	Recommendation	Služebníci, poslouchejte ve všem své tělesné pány. neslužte [jen] naoko, jako ti, kdo se chtějí zalíbit lidem, ale v prostotě srdce a s Boží bázní.
66017012	Description	A deset rohů, které jsi viděl, je deset králů, kteří se ještě neujali kralování, ale mají přijmout moc jako králové v jednu hodinu [spolu] se šelmou.
46002012	Grace	My jsme ovšem nepřijali ducha světa, ale Ducha, který je z Boha, abychom věděli, co nám bylo od Boha darováno.
59005001	Recommendation	A nyní vy, boháči - plačte a kvílejte nad bídami, jež na vás přicházejí.
66002010	Recommendation	Nic se neboj toho, co máš vytrpět. Hle, ďábel uvrhne [některé] z vás do vězení, abyste byli vyzkoušeni, a budete mít soužení po deset dní. Buď věrný až do smrti a dám ti korunu života.
54006011	Recommendation	Ty, Boží člověče, však od takových věcí utíkej. Následuj pak spravedlnost, zbožnost, víru, lásku, trpělivost, krotkost.
59005005	Sin	Žili jste na zemi v rozkoši a požitcích; vykrmili jste svá srdce jako ke dni porážky.
66004004	Description	Okolo toho trůnu [bylo] čtyřiadvacet trůnů a na těch trůnech jsem viděl sedět čtyřiadvacet starců, oblečených do bílých rouch; a na hlavách měli zlaté koruny.
66018007	Description	Nakolik se chlubila a hýřila, tolik jí dejte muk a nářku. Neboť ve svém srdci říká: ‘Sedím [jako] královna! Nejsem vdova a nářek nespatřím.’ ”
60003007	Recommendation	Podobně muži, žijte s [nimi] v porozumění a prokazujte ženskému [pohlaví] čest jakožto slabší nádobě a jako spoludědičkám milosti života, aby vaše modlitby neměly překážku.
54002012	Recommendation	Ženě pak nedovoluji učit ani ovládat [jejího] muže, ale ať je v tichosti.
46001009	Faith	Věrný [je] Bůh, jímž jste byli povoláni ke společenství jeho Syna Ježíše Krista, našeho Pána!
48005013	Recommendation	Vy jste přece povoláni do svobody, bratři; jenom tu svobodu nemějte za záminku pro tělo, ale v lásce služte jedni druhým.
59002012	Recommendation	Takto [tedy] mluvte a takto jednejte - jako ti, kdo mají být souzeni podle zákona svobody.
46012005	Faith	jsou rozličné služby, ale tentýž Pán
45009005	Description	jejichž [jsou] otcové a z nichž podle těla [pochází] Kristus, který je nade vším, požehnaný Bůh na věky. Amen.
47001006	Description	Ať už tedy jsme souženi [- je to] pro vaše potěšení a spasení, které se projevuje ve snášení stejných utrpení, která trpíme i my; nebo jsme potěšováni - [je to] pro vaše potěšení a spasení.
47001021	Faith	Ten, kdo nás s vámi utvrzuje v Kristu a pomazal nás, [je] Bůh,
44010015	Recommendation	Tehdy k němu hlas [promluvil] podruhé: “Co Bůh očistil, ty neměj za nečisté!”
66018009	Sin	Králové země, kteří s ní smilnili a hýřili, ji budou oplakávat a budou nad ní kvílet, až uvidí dým jejího pálení.
43014023	Faith	Ježíš mu odpověděl a řekl: “Jestliže mě někdo miluje, bude zachovávat mé slovo; a můj Otec ho bude milovat a přijdeme k němu a zřídíme [si] u něj příbytek.
62004010	Grace	V tom je láska, ne že bychom my milovali Boha, ale že on miloval nás a poslal svého Syna, [oběť] slitování za naše hříchy.
62001007	Faith	Chodíme-li však ve světle, jako on je ve světle, máme společenství mezi sebou a krev Ježíše Krista, jeho Syna, nás očišťuje od veškerého hříchu.
48004007	Grace	A tak už nejsi otrok, ale syn, a když syn, [pak] také Boží dědic skrze Krista.
58001008	Faith	Ale o Synu říká: “Tvůj trůn, ó Bože, [je] na věky věků; žezlo spravedlnosti [je] žezlem tvého království.
43010033	Sin	Židé mu odpověděli: “Nekamenujeme tě za dobrý skutek, ale za rouhání, totiž že ty, člověk, ze sebe děláš Boha!”
66014011	Description	A dým jejich muk bude vystupovat na věky věků. A ti, kteří se klanějí šelmě a jejímu obrazu, a kdokoli přijme znamení jejího jména, nebudou mít odpočinutí dnem ani nocí.”
47004001	Faith	Poněvadž tedy máme tuto službu podle milosrdenství, které jsme přijali, nepolevujeme.
58013006	Faith	takže můžeme směle říkat: “Pán [je] můj pomocník, nebudu se bát. Co mi může udělat člověk?”
45014003	Recommendation	Ten, kdo jí, ať nepohrdá tím, kdo nejí, a kdo nejí, ať nesoudí toho, kdo jí; vždyť Bůh ho přijal!
45015005	Grace	Ať vám tedy Bůh trpělivosti a potěšení dá být mezi sebou jednomyslnými podle Krista Ježíše,
58007027	Description	Ten nemusí jako tamti nejvyšší kněží každý den nejprve přinášet oběti za své vlastní hříchy a potom za [hříchy] lidu, neboť to udělal jednou provždy, když obětoval sám sebe.
62003017	Sin	Kdokoli však má jmění tohoto světa a vidí svého bratra, jak má nedostatek, a zavře před ním své srdce, jak v něm může zůstávat Boží láska?
47005008	Faith	Máme tedy smělou důvěru a líbí se nám raději být vzdálenými od tohoto těla a být doma u Pána.
60002011	Recommendation	Milovaní, vyzývám [vás] jako cizince a přistěhovalce: zdržujte se tělesných žádostí, jež bojují proti duši.
60002017	Recommendation	Všechny ctěte, bratry milujte, Boha se bojte, krále mějte v úctě.
44007025	Description	Domníval se totiž, že jeho bratři porozumí, že jim Bůh skrze jeho ruku dává vysvobození, ale oni nerozuměli.
50003002	Violence	Dejte si pozor na ty psy, dejte si pozor na ty zlé dělníky, dejte si pozor na tu ‘rozřízku’!
56001016	Sin	Vyznávají, že znají Boha, svými skutky [to] však popírají. Jsou ohavní, nepovolní a nezpůsobilí k jakémukoli dobrému dílu.
45010002	Faith	Neboť jim vydávám svědectví, že mají horlivost pro Boha, ale ne podle [pravého] poznání.
47001004	Grace	který nás potěšuje v každém našem soužení, abychom mohli potěšovat ty, kteří [jsou] v jakémkoli soužení, tím potěšením, kterým jsme sami potěšeni od Boha.
55002015	Recommendation	Usiluj, aby ses mohl představit jako osvědčený před Bohem, dělník, který se nemá za co stydět a který správně vykládá slovo pravdy.
53002004	Description	který se staví na odpor a povyšuje se nade všechno, čemu se říká Bůh a co se uctívá, takže se posadí v Božím chrámu jako Bůh a bude se vydávat za Boha.
49006004	Recommendation	A [vy], otcové, nepopouzejte své děti k hněvu, ale vychovávejte je v Pánově kázni a napomínání.
45008037	Grace	Ale v tom všem skvěle vítězíme skrze Toho, který si nás zamiloval.
44026014	Violence	A když jsme všichni padli na zem, uslyšel jsem hlas, který ke mně mluvil a říkal hebrejským jazykem: ‘Saule, Saule, proč mě pronásleduješ? Je pro tebe těžké vzpírat se proti bodcům.’
66002009	Sin	Znám tvé skutky, i soužení a chudobu (ale jsi bohatý), i rouhání těch, kteří si říkají Židé, a nejsou, ale [jsou] shromáždění Satanovo.
46013006	Faith	neraduje se z nepravosti, ale raduje se s pravdou;
59001021	Recommendation	Odložte tedy všechnu špínu i přemíru špatnosti a s krotkostí přijímejte zaseté slovo, které má moc spasit vaše duše.
46003006	Grace	Já jsem sázel, Apollo zaléval, ale Bůh působil vzrůst.
66014008	Sin	A za [ním] letěl jiný anděl se slovy: “Padlo, padlo to veliké město Babylón, neboť napájelo všechny národy vínem svého vášnivého smilstva!”
43015014	Recommendation	Vy jste moji přátelé, děláte-li, co vám přikazuji.
62005021	Recommendation	Synáčkové, vyvarujte se model! Amen.
55003006	Sin	Jsou mezi nimi [i] tací, kteří se vkrádají do domů a svádějí ženštiny obtížené hříchy, puzené různými žádostmi,
49004015	Faith	ale [abychom] říkali pravdu v lásce a ve všem rostli v toho, který je hlavou, [totiž v] Krista.
49004003	Faith	a usilovali zachovávat jednotu Ducha ve svazku pokoje.
44009005	Description	Řekl tedy: “Kdo jsi, Pane?” A Pán řekl: “Já jsem Ježíš, kterého ty pronásleduješ. Je pro tebe těžké vzpírat se proti bodcům.”
60003015	Recommendation	Posvěcujte však ve svých srdcích Pána Boha a [buďte] vždy připraveni [dát] odpověď každému, kdo vás požádá o zdůvodnění naděje, která je ve vás, a [to] s krotkostí a úctou
44007033	Recommendation	Tehdy mu Pán řekl: ‘Zuj obuv ze svých nohou, protože místo na němž stojíš, je svatá půda.
62002024	Faith	Ať ve vás tedy zůstává to, co jste slyšeli od počátku. Jestliže ve vás zůstane to, co jste slyšeli od počátku, zůstanete i vy v Synu i v Otci.
43008051	Faith	Amen, amen, říkám vám: Zachová-li někdo mé slovo, navěky nespatří smrt.”
66020011	Description	Tehdy jsem uviděl veliký bílý trůn a toho, kdo na něm seděl, před jehož tváří zmizela země i nebe a nebylo pro ně nalezeno místo.
46006013	Recommendation	Pokrmy [patří] břichu a břicho pokrmům; Bůh pak jedno i druhé obrátí vniveč. Tělo však nepatří smilstvu, ale Pánu a Pán tělu.
45006011	Faith	Tak se i vy považujte za vskutku mrtvé hříchu, ale za živé Bohu v Kristu Ježíši, našem Pánu.
47002014	Faith	Avšak díky Bohu, který nám vždycky dává vítězství v Kristu a na každém místě skrze nás zjevuje vůni svého poznání.
62001005	Grace	To je pak to poselství, které jsme slyšeli od něho a oznamujeme vám, že Bůh je světlo a není v něm žádná tma.
43006037	Grace	Všechno, co mi dává Otec, přijde ke mně; a toho, kdo ke mně přichází, jistě nevyženu ven.
58013001	Recommendation	Bratrská láska ať trvá.
58007025	Grace	Proto je také schopen dokonale spasit ty, kdo skrze něj přicházejí k Bohu, neboť je stále živ, aby za ně orodoval.
43019015	Violence	Oni však vykřikli: “Pryč [s ním], pryč! Ukřižuj ho!” Pilát jim řekl: “Mám ukřižovat vašeho krále?” Velekněží odpověděli: “Nemáme krále, jen císaře!”
45011005	Grace	A tak tedy i v nynější době vznikl ostatek, vyvolený podle milosti.
66017002	Sin	se kterou smilnili králové země a obyvatelé země se opili vínem jejího smilstva.”
45012010	Recommendation	Bratrskou láskou srdečně milujte jedni druhé, vzájemně se předcházejte uctivostí,
45008014	Faith	Neboť všichni, kdo jsou vedeni Božím Duchem, ti jsou Boží synové.
66012003	Description	Tehdy se na nebi ukázalo jiné znamení: hle, veliký rudý drak se sedmi hlavami a deseti rohy, a na těch hlavách sedm korun.
45008017	Faith	A jestliže děti, [pak] i dědicové, totiž dědicové Boží a spoludědicové Kristovi, abychom jestliže s [ním] trpíme, byli s [ním] také oslaveni.
54005017	Recommendation	Starší, kteří dobře vedou [sbor], ať jsou pokládáni za hodné dvojí cti, zvláště ti, kteří pracují ve slově a učení.
46008007	Sin	Ve všech ale toto poznání není. Někteří totiž až dosud jedí věc obětovanou modle s vědomím o modle a jejich svědomí, [které je] slabé, se poskvrňuje.
43015002	Grace	Každou ratolest, která ve mně nenese ovoce, odřezává a každou, která nese ovoce, čistí, aby nesla více ovoce.
60005003	Recommendation	ne jako byste panovali nad tím, co [vám] bylo svěřeno, ale buďte stádu příkladem.
52004013	Recommendation	Nechci pak, bratři, abyste nevěděli o těch, kdo zesnuli, abyste se nermoutili jako ti ostatní, kteří nemají naději.
