62003016	Faith	Bra nu kuwe tian' cha' si'yaan mslyaa Krixtu ngujwi Ni lo wsi , cha' su'we 'a nka tiye Ni ña'an Ni 'ñaan , bra kan' ka biya' tian' nchga cha' nu su'we la ku'nian , si su'we nka tiyean ña'aan 'in ta'a msñian cha' 'in Ni . Su'we si xlyaan tayaan' 'in ta'a ntean ngwaña'an , ni siya kajaan ti ykwiin' tian cha' 'in ta'a ntean .
43013001	Grace	Ti ji tyukwa tsan cha' ka ta'a pascua kan' ; jlyo ti' Jesús cha' wa tiya ti bra 'in yu , cha' tyo'o yu chalyuu re tyaa yu nde se'en ndi'in Ndiose Sti yu . Xkwi' nsu'wi 'a cha' tiye Jesús ña'an yu 'in nten chalyuu nu wa yten cha' 'in yu ; lo'o ña'an ti nsu'wi 'a cha' tiye yu 'in nten kan' , sa ña'an bra nu tyii chalyuu 'in yu .
58003017	Sin	kan' cha' msin' 'a ti' Ndiose 'in ne' tyukwi tyempu nu mda'a tu'wa yijan , kwi' ngujwi ayman kan' ngwa ti ña'an tu'wa tuwiin ni' kixin' se'en mda'an yu'wi ne' bra kan' .
60001014	Recommendation	Tukwa su'we wan cha' nu ykwi' Ndiose , cha' ka wan sñi' nu su'we 'a ngi'ni ; ja ku'ni wan ya ña'an ti cha' kuxi nu ndiya ti' wan , sa ña'an nu y'ni wan ti s'ni , xa nu ja ya ka biya' ti' wan cha' su'we nu ngi'ni Ndiose .
45011032	Grace	Ska ti biya' ndlaa ya' Ndiose 'in nchga nten chalyuu nu ja nnan cha' nchkwi' Ni , si ngwaña'an nchka ti' ne' , cha' ja xlyaa ne' tukwa ne' cha' 'in Ni siya' ti . Lo'o chun' ndi'in la , bra kan' chka t'nan ti' Ni 'in nchga nten xa nu tsaa naan ne' 'in Ni xiya' .
66006006	Description	Mgii tiǎn' cha' nganen nchkwi' ska nten laja se'en nduun ta'a jakwa 'ni kti kan' bra kan' : ― Ska ska' ti nskwa' kaja 'in nten nu ku'ni tñan ska tsan ― ndukwin ― , lo'o ngwaña'an ska mlya ti nskwa' trigu kaja 'in nten ska tsan ; lo'o sete ni , kwi' ka'an 'a xu'wi lyo ran , kwi' ka'an 'a xu'wi lyo mñun nu ndi'yo ne' ― ndukwin yu kan' bra kan' .
59004010	Recommendation	Ka jyu'u ti' wan 'wan tloo Ndiose sikwa , si'ya ki'ya nu ndi'in 'wan , lo'o chun' ndi'in la ta Ni ska se'en nu su'we la se'en tyi'in wan nde se'en ndi'in Ni .
44017031	Grace	chun' wa mstya Ni ska tsan cha' ku'ni biya' Ni 'in nchga nten chalyuu , lo'o ngwaña'an wa ngulo suwi Ni 'in ska nu ka wse . ( Jesucristo lka nu kan' . ) Su'we 'a y'ni Ndiose cha' kanun tsaa cha' kan' 'in nten chalyuu , cha' wa y'ni Ni cha' ndyu'u Jesucristo kan' xiya' xa wa yjwi ne' 'in yu .
43019002	Description	Ngwiñan sndaru ska sne' kiche' cha' xtya ne' ke Jesús , lo'o mda ne' ska te' kolo kwaa cha' ku' yu bra kan' , ña'an ti' si lka yu ska ree .
54005014	Recommendation	Kan' cha' su'we la si xiya' kaja kwilyo'o nu kuna'an kune' kan' , nxke' tiǎn' ; kaja sñi' ne' bra kan' , ña'ansiin ne' na'an tyi ne' , lo'o ja kaja ña'an nu xtya ne' ki'ya 'ñaan si'ya nu kuna'an kan' .
43014011	Faith	Xñi wan cha' 'ñaǎn sikwa , cha' nu niǐn 'wan cha' su'wa ndi'in cha' 'ñaǎn lo'o Stiǐn Ndiose . Ni siya ja tsaa ña'an ti' wan 'ñaǎn ngwaña'an ti , su'we si tsaa ña'an ti' wan 'ñaǎn xa nu ña'an wan cha' tnun nu ngi'niǐn ― ndukwin Jesús ― .
66020014	Violence	Kan' mxkwan Ni 'in La Mte , lo'o mxkwan Ni ña'aan chalyuu se'en ndi'in ayman , ndyaa ran la lo tiyu' se'en ndi'in kii' tnun nchkin bra kan' . Ngwaña'an nten nu tsaa lo tiyu' kan' ni , tyaa ne' chalyuu tla bra kan' ; kaja ne' kan' siya' ti , ja tyu'u 'a ne' kan' bra kan' .
58009026	Description	Ja ndyaa Ni tyun ya' la kan' , chun' ja mstya ne' 'in Ni tyun ya' lo wsi ti bra nu ndya' chalyuu . Ska ya' ti yan Ni lo chalyuu nu ja s'ni lye , xa wa tyii ti chalyuu kula , yan Ni cha' ku'ni tyii Ni ki'ya nu ndi'in 'in nchga nten chalyuu chun' ngujwi Ni lo wsi .
44013018	Description	Xa nu mda'an yu'wi ne' kan' lo yuu wtyi xa tu'wa yijan , mdalo 'a Ndiose 'in ayman kula 'ñaan bra kan' , ni siya ka'an 'a cha' kuxi y'ni ne' kan' .
46011033	Recommendation	'Wan ta'a msñian cha' 'in Jesús , tyaa yu'wi ti' wan cha' kan' bra nu tyo' ti'in wan cha' ku'ni wan siin kan' ; kata wan chin' 'in ta'a wan cha' su'wa ti tyisnan ku wan lo'o nchga ta'a wan .
66006012	Violence	Lo'o ngwaña'an , na'aǎn nu lka ña'an ti' slya' kan' , cha' nu mda'a skwa ya' mstun Ni kiña' nu nchkun' tu'wa kityi kan' ; lye 'a mñan bra kan' . Yku kwichaa bra kan' , ngwi'ya tla ña'aan chalyuu ; ña'an ti' te' ngata nu nchku' nten se'en nskwa ayman , ngwaña'an ngwa chalyuu bra kan' . Lo'o ko' ni , ngwa nga'a ran ; ña'an ti' tnen , kwi' ngwaña'an ngwa ran bra kan' .
58011035	Violence	Kwi' ngwaña'an nu kuna'an ni , xiya' ngala yu ki'yu 'in ne' ña'an lu'u ti , cha' nu yaa ña'an ti' ne' cha' ka 'in Ndiose kulaa 'in yu ni siya wa ngujwi yu ska ya' . Ti'í 'a mji'in ne' kuxi kan' 'in xka ta ta'a yu bra kan' , chun' ja mslyaa yu kan' kulaa ya' yu 'in Ndiose . Si nu kulaa ya' yu kan' 'in Ni , ja jwi'in ne' kuxi 'in yu bra kan' ; kulaa ne' kuxi 'in yu kan' bra kan' . Mdi'in ta 'a yu kan' ña'aan bra kan y'ya Ni 'in yu , cha' ta Ni xka chalyuu nu su'we la 'in yu .
44016037	Violence	― Ja su'we ― ndukwin Palyu 'in policía ― . Wa na'an nchga nten kichen xa nu mji'in ne' yka 'wa , ni siya ne' romano lka bare . Lo'o ja ya ka biya' 'wa ti bra nu msu'wa ne' 'wa ni' ña'an chkwan re ― ndukwin ― . Lo'o ni , nchka ti' ne' kulaa ne' 'wa mnan ti . Si'i ngwaña'an ndi'in cha' ka . Su'we la kan ti kwi' wse cha' kulaa 'wa .
45013009	Recommendation	Tyun lo tñan ngulo Ndiose 'in nten bra nu ykwi' Ni cha' re lo'o Moisés nu ngwa s'ni : “ Ja xu'wi cha' 'wan lo'o kwilyo'o xka nten ” ndukwin Ni . “ Ja kujwi wan 'in ta'a nten wan . Ja ku'ni wan kunan nan nu nsu'wi 'in ta'a nten wan . Ja xitukwi ti' wan nan nu nsu'wi 'in ta'a nten wan ” ndukwin Ni . Ska ti biya' ndyo'o nchga cha' kan' lo'o xka cha' nu nchkwi' kityi kan' : “ Ndi'in cha' chka t'nan ti' wan 'in ta'a nten wan , sa ña'an nu nchka t'nan ti' wan 'wan , ti ykwi' ti wan ” ndukwin Ni .
62003003	Faith	Lo'o nchga nten nu ndi'in ta cha' ña'an 'in Ni nde loo la , ndi'in cha' ku'ni luwi ne' ni' kasiya 'in ne' , sa ña'an nu luwi kasiya 'in Jesucristo .
45007022	Faith	Tyukwi ti tiyeěn mdiya 'a tiǎn' ku'niǐn nchga tñan nu ngulo Ndiose 'ñaan nu ngwa s'ni ;
50004004	Recommendation	Nchka tiǎn' cha' nchga tsan ka su'we ka tiye wan chabiya' 'in nu nka X'naan . Ni siya tukwa ya' chkwiǐn' cha' kan' lo'o wan : ¡ Nchka tiǎn' cha' ka su'we ka tiye wan !
66001012	Description	Bra ti mxina'aǎn nde chuǔn' cha' na'aǎn ti ka nu ykwi' lo'oǔn bra kan' . Lo'o na'aǎn cha' nduun kati kandlyeru chkwan oro bra kan' .
58003018	Sin	Wa lye 'a ykwi' Ni lo'o nten nu msuun lo'o Ni : “ Ja kan 'a wan se'en ndi'iǐn , cha' tyi'in su'we wan lo'oǔn nde re ” ndukwin Ni bra kan' .
43010008	Sin	Ja ndukwa slya' kan' 'in nten nu yan ti kulo la , bra nu ti ji kaǎn , cha' xkwi' ne' kunan lka ne' kan' ; sa ku' ti ngi'ni ne' kunan nan nu nsu'wi 'in ta'a nten ne' ― ndukwin ― .
60002018	Recommendation	'Wan nu lka wan msu 'in nten ni , tukwa su'we wan tñan nu ndlo x'nan wan , ni siya nduwe ti' x'nan wan 'wan chun' su'we nka tiye yu ña'an yu 'wan , ni siya ja nduwe 'a ti' yu 'wan chun' xa'an tiye yu .
44006013	Description	Lo'o ne' kwiñi kan' ndyaa lo'o ne' . ― Nchga tsan chen 'a ña'an nchkwi' yu ki'yu re ― ndukwin ne' kwiñi kan' ― . Nchkwi' ka'an yu 'in laa tnun re , lo'o nchkwi' ka'an yu 'in kityi se'en ngwa'an ti kwi' tñan nu ngulo Ndiose 'ñaan ― ndukwin ne' ― .
47005018	Faith	Ndiose lka nu y'ni nchga cha' kan' , cha' ka su'we cha' 'ñaan lo'o Ni chun' tñan nu y'ni Krixtu . Lo'o ni , wa mda Ni tñan 'ñaan cha' chkwian' lo'o nten sa ña'an ka su'we cha' 'in ne' lo'o Ndiose .
59005010	Recommendation	'Wan ne' ta'aan , tyu'wi ti' wan sa ña'an ngwa 'in ayman kula 'wan nu ykwi' lo'o nten chabiya' 'in Ndiose nu ngwa s'ni ; chan ndalo ayman kan' , ni siya lye 'a mdijin ne' nu ti'í .
44002021	Faith	Lo'o kulaǎn 'in nchga nten nu jñan cha' tlyu ti' 'ñaǎn . Ngwaña'an ykwi' Ndiose , kan' cha' ngwa'an ayman Joel cha' kan' lo kityi ― ndukwin Tyu ― .
66007012	Faith	Ykwi' angajle kan' bra kan' : ¡ Ngwaña'an ka sikwa ! Ku'niin tnuan 'in Ndiose , su'we 'a chkwian' cha' 'in Ni , tyaan xu'we 'in Ni . Chkwian' cha' nchga cha' jlyo ti' Ni , nan 'in Ni lka nchga lo nan nu nsu'wi lo chalyuu ; nchga lo tñan nchka 'in Ni ku'ni Ni siya' ti , ska ti Ndiose nsu'wi chabiya' ku'ni nchga tñan . Nchga bra ja tsaa tii 'a cha' ngwaña'an ka 'in Ndiose Stian . Lo'o chañi cha' ngwaña'an ka . Ngwaña'an ykwi' angajle lo'o ta'a bra kan' .
60003003	Recommendation	Nchga wan ne' kuna'an , su'we si ku'ni xu'we wan kichan' ke wan ; ni siya ja n'ni cha' kwiji wan ka'an 'a tyempu , ka'an 'a tñi 'wan , cha' ku'ni xu'we wan kichan' ke wan . Lo'o ja ndi'in cha' tyukwi chkwan nskan wan nu ka'an 'a ndyu'wi lyo , ja ndi'in cha' ku' wan te' nu ka'an 'a nga'an . Si'i te' nchku' ska nu kuna'an nu ngi'ni cha' chañi su'we la ña'an ne' .
55001008	Faith	Ja ka jyu'u tii' sikwa ; katsaa' cha' re 'in nten , sa ña'an nka nchga cha' 'in X'naan . Kwi' ngwaña'an , ja ka jyu'u tii' cha' nsu'wiǐn ni' ña'an chkwan . Nda ne' nu ti'í 'ñaǎn cha' nchkwiǐn' cha' 'in X'naan , kan' cha' ja tya'an cha' tiyee lye 'a si lo'oo ta ne' nu ti'í 'iin cha' nchkwii' cha' su'we 'in Jesucristo lo'o nten . Ta Ndiose jwersa 'ñaan cha' taloan ,
43017019	Description	Lo'o ni , taǎn tyukwi ña'aan na' , ti ykwiǐn' tiǎn , cha' 'in nten kan' , cha' ku'niǐn nchga tñan nu nchka tii' cha' ku'niǐn ― ndukwin ― . Lo'o nchga nten nu wa msñi cha' 'iin , nchka tiǎn' cha' xa'aan kasiya 'in ne' , cha' nu'win katsaa' cha' nu ñi nu kanun ni' kasiya 'in ne' cha' 'iin .
66003002	Recommendation	“ Xaa ti' wan ni , cha' ña'an ti' si laja' wan ndi'in wan . Ku'ni lya wan ni siya chin' ti cha' su'we nu jlyo ti' wan ku'ni wan , cha' ja kana' ji tñan kan' bra kan' ; ja ya na'aǎn cha' ndyaa to'o su'we tñan kan' 'wan tloo Ndiose Stiǐn ” ndukwin Ni .
66016004	Description	Lo'o ndyaa angajle nu nchka snan , ndyaa mslu nan nu nsu'wi ni' ka'nan nchga tu'wa chku , nchga se'en ndyukwa tyi'a tyukwi ña'aan chalyuu ; mxa'an tyi'a ngwa tnen bra kan' .
45005002	Faith	Su'we 'a ngi'ni Ndiose lo'oan chabiya' 'in Krixtu , chun' nu msñian cha' 'in Krixtu kan' . Lo'o ni , ndi'in cha' 'ñaan lo'o Ndiose , kan' cha' ja ndi'in cha' kulaa yaan' 'in Ni . Su'we 'a nka tiyean , cha' jlyo tian' cha' chun' ndi'in la kaja ska se'en nu su'we la se'en tyi'ian nde se'en ndi'in Ndiose , cha' ngwaña'an xkwi' su'we ti ngi'ni Ni lo'oan .
49005005	Sin	Ska cha' nu ñi 'a lka re : Nten nu ngwaña'an xkwi' cha' kuxi ngi'ni , ja kaja chabiya' tyaa ne' kan' nde se'en ndi'in Ndiose lo'o Krixtu chun' ndi'in la , bra nu ka Ni ndloo la ; nten nu xkwi' cha' 'in nu kuna'an nda'an cha' tiye ne' , nten nu ngi'ni cha' chen ña'an , nten nu nxitukwi ti' ska nan , ja kaja chabiya' tyaa ne' kan' nde se'en ndi'in Ndiose . ( Bra nu nxitukwi tian' ska nan ni , sa ña'an si nu ngi'ni tnuan 'in ska jo'o , ngwaña'an nchka ti' cha' kan' . )
58011008	Faith	Yaa ña'an ti' ayman Abraham 'in Ndiose , kan' cha' ynan yu bra nu ykwi' Ni lo'o yu cha' tsaa yu ska lo yuu tijyu' 'a , cha' ka kichen tyi yu nde kwa . Mdo'o yu lo yuu se'en mdi'in yu ti kulo , ndyaa yu bra kan' , ni siya ja jlyo 'a ti' yu la nde ya' tsaa yu .
49005018	Recommendation	Ja ka ku'wi wan ; ngi'ni ñu'un 'a kune' xa'an 'in nten cha' kana' chalyuu 'in ne' , si'ya cha' ku'wi 'in ne' . Xka ña'an ku'ni wan , cha' ka taya' Tyi'i Ndiose 'wan lo'o nchga tñan nu ku'ni wan lo chalyuu .
61002002	Sin	Kwi' ngwaña'an , tukwa tyun ne' ta'aan cha' nu nchkwi' yu kwiñi kan' ; lo'o ndiya ne' ta'aan nu ku'ni cha' chen ña'an lo'o ta'a ne' bra kan' , sa ña'an cha' nu kwa'u yu kwiñi kan' 'in ne' cha' ku'ni ne' . Ja su'we ngwaña'an . Kan' cha' ka'an 'a cha' kuxi chkwi' nten 'ñaan bra kan' , nten kichen nu ja siya' msñi cha' 'in Ndiose .
49002018	Faith	Lo'o ni , ja n'ni cha' ni siya ne' judío lka ba , ni siya xka ta nten lka wan , ska ti nten lkaan lo'o nchga ta'aan chabiya' 'in Krixtu , ska ti Tyi'i Ndiose ngi'ni cha' xu'wi lyoan 'in Ni ;
44021025	Recommendation	Lo'o ne' xka la'a tsu' nu wa yten cha' 'in Jesucristo ni , wa ngwa'an ba ska kityi nu ndyaa se'en ndi'in ne' kan' , cha' ka biya' ti' ne' cha' ja ndi'in cha' su'wa ku'ni ne' nchga cha' nu ndi'in cha' ku'ni ne' judío ta'aan . Nde lka cha' nu ngwa'an ba : cha' ja su'we ku ne' kuna' 'ni nu wa mda ne' cha' ka lomstan 'in jo'o , lo'o ja su'we ku ne' tnen , ja su'we ku ne' kuna' 'ni nu ja ngalu su'we tnen i' bra wa yjwi ne' 'in i' , lo'o ja la su'we xu'wi cha' 'in ne' lo'o xka nten nu si'i kwilyo'o ne' .
44005003	Sin	Ykwi' Tyu lo'o yu bra kan' : ― Ananías ― ndukwin Tyu ― , ¿ ni nan lka ngwa 'iin a ? ¿ Ni cha' mdaa chabiya' 'in kune' xa'an nu naan Satanás cha' ka ndloo la ni' kasiya 'iin a ? Kan' lka nu mdatsaa 'iin cha' mñi lyo'oo 'in Tyi'i Ndiose ― ndukwin Tyu 'in yu kan' ― . Ndukwiin cha' nde lka nchga tñi nu mjwi 'iin lo'o yuu kan' , lo'o si'i nchga tñi lka re .
49004014	Recommendation	Bra kan' ja ku'nian sa ña'an nu ngi'ni nu xuwe ti nu ta'a ti nxa'an tñan 'in , bra nu ndi'in jya ne' ; ja taan chabiya' cha' tsaa lo'o ne' 'ñaan xka tuwiin , bra nu chkwi' ne' lo'oan ska cha' nu ja ya kunaan . Nsu'wi 'a cha' kwiñi nu nchkwi' nten lo'oan , kwi' nten nu nchka 'a nchkwi' , nten nu nchka 'a ti' cha' tsaa lo'o 'ñaan tuwiin kuxi .
46006009	Sin	Jlyo tian' cha' ja ka sten nten kuxi se'en tlyu se'en nka Ndiose ndloo la . Su'we si ñi 'a ka biya' ti' wan cha' ja tsaa ne' kuxi se'en nu su'we kan' . Nten nu chen 'a ña'an ngi'ni lo'o ta'a , nten nu ngi'ni tnun 'in nkwin jo'o , nten nu ndi'in cha' 'in lo'o kwilyo'o xka nten , ni siya yu ki'yu nu ngi'ni cha' chen ña'an lo'o ta'a ki'yu yu ,
58010025	Recommendation	Ndiya ne' ta'aan nu ja nda'an se'en ndi'in ta'a msñian cha' 'in Jesús , nu ja ndyo' ti'in lo'o ta'aan . Ja su'we ku'nian ngwaña'an ; ndi'in cha' ti tsaan tyo' ti'ian lo'o ta'aan , cha' kanun tsaa la cha' 'in Ndiose ni' kasiya 'ñaan , ta'aan nu wa msñian cha' 'in Ni . Wa ndyaa ña'an tian' cha' wa kan ti X'naan xiya' , kan' cha' ta'a ti tyo' ti'ian lo'o ne' ta'aan ni .
51003005	Sin	Ku'ni tyii wan nchga cha' kuxi nu ndiya 'a ti' wan sikwa : ja ku'ni wan cha' kuxi lo'o kwilyo'o xka nten , ja ku'ni wan cha' chen ña'an lo'o ta'a nten wan , ja xitukwi ti' wan 'in ta'a nten wan , ku'ni tyii wan nchga lo cha' kuxi nu nda'an 'a cha' tiye wan cha' ku'ni wan , ja xitukwi ti' wan skaa cha' su'we nu nsu'wi 'in nten chalyuu . Ska nan nu nxitukwi tian' ni , su'wa ti lka cha' kuxi kan' ña'an ti' si ku'ni tnuan 'in ska nkwin jo'o .
52005008	Faith	Nan ni , nsu'wi xaa 'in Ndiose ni' kasiya 'ñaan , kan' cha' ndii ti tian' tyi'ian lo chalyuu ; xñian su'we cha' 'in Ndiose , kwi' ngwaña'an su'we xu'wi tiyean ña'aan 'in ta'a ntean chabiya' 'in Jesús , ngwaña'an ña'ansiin 'ñaan ti ykwiin' tian cha' ja ku'nian cha' kuxi . Ña'an ti' ska sndaru , nda'a yu 'in tiye yu lo'o chun' yu lo'o chkwan nu nchku' yu . Ndi'in taan 'in Ndiose , ña'an bra ku'ni tyii ji Ni nchga cha' kuxi nu ndi'in 'ñaan , kan' cha' ndi'in cha' ku'nian kwenta 'ñaan , ti ykwiin' tian , sa ña'an nda'a sndaru 'in yu lo'o chkwan nu ndyukwa ke yu .
55001007	Grace	Ja nchka ti' Ndiose cha' kutsean ; kan' cha' nda Ni Tyi'i ykwi' Ni cha' kanun ni' kasiya 'ñaan , cha' ka ngula la tian' ni' kasiya 'ñaan , cha' su'we ti xu'wi tiyean ña'aan 'in ta'a ntean , cha' ka ku'nian nchga tñan nu nchka ti' Ni cha' ku'nian nchga tsan .
62002004	Sin	Kwiñi 'a nten nu nchkwi' cha' ndi'in cha' 'in ne' lo'o Jesucristo , si ja ndukwa ne' tñan nu ndlo Ni 'in ne' ; ja ñi cha' nu nda'an tiye ne' kan' bra kan' .
50002002	Faith	Kan' cha' ni , si chañi cha' ngwaña'an ngi'ni wan , ku'ni wan cha' ka su'we ka tiyeěn sikwa ; ngwaña'an ka bra nu ña'aǎn cha' su'wa 'a ndi'in cha' 'wan lo'o ta'a wan , cha' ska ti cha' nka tiye wan , cha' ska ti cha' nda'an tiye wan , cha' ska ti biya' su'we ti ngi'ni wan lo'o ta'a wan .
43007030	Description	Xa wa mdyii ykwi' Jesús cha' kan' , mdiyan xka ta nten se'en ndi'in yu bra kan' , ngwa ti' ne' cha' xñi ne' 'in yu . Lo'o ja tukwin ngwa 'in kala' 'in yu , cha' ti ji tiya bra 'in ne' xa'an cha' xñi ne' 'in yu .
54006018	Recommendation	Nde ndiya tñan nu kuloo 'in ne' kuliya' kan' : Xkwi' cha' su'we ku'ni ne' lo chalyuu ; chka t'nan ti' ne' 'in xka ta nten , tyu'wi ti' ne' 'in nu ti'i , ta ne' nan nu lyiji 'in nu ti'i kan' .
43018030	Description	Mxkwen ne' judío 'in Pilato bra kan' : ― Si ja ndukwi yu ki'ya , ja kan lo'o ba 'in yu se'en ndi'iin bra kan' , yu kula ― ndukwin ne' 'in yu .
45014006	Faith	Bra nu ndi'in kti ne' ska tsan cha' 'in ska ta nten , kan' lka tsan nu ndi'in cha' ku'ni tnun ne' kan' 'in Ndiose sikwa ; lo'o xka ta nten ka ku'ni tnun 'in Ndiose , ni siya ja ngi'ni kti ne' tsan kan' . Kwi' ngwaña'an ndyo'o cha' 'in nten nu ja ntsen ku kuna' . Wa yten ne' kan' cha' 'in Ndiose , kan' cha' ja ntsen ne' , cha' ndya ne' xu'we 'in Ndiose bra nu nchku ne' 'in ran . Lo'o nten nu ntsen ku kuna' kan' , ti kwi' chabiya' 'in Ndiose ntsen ne' ku ne' 'in ran ; lo'o ne' kan' ndya ne' xu'we 'in X'naan cha' nda Ni nan ku ne' .
45012012	Recommendation	Ku'ni wan cha' su'we 'a ka tiye wan xa nu ndi'in ta wan 'in Ndiose cha' kan Ni xiya' , cha' kulaa ji Ni 'wan . Ja xi'in chun' wan cha' kan' , ni siya lye 'a ta ne' nu ti'í 'wan se'en ndi'in wan lo chalyuu . Nchga tsan chkwi' wan lo'o Ndiose Stian ; ja kulaa ya' wan cha' nchkwi' wan lo'o Ni .
44024023	Description	Kan' ykwi' Félix lo'o capitán 'in sndaru nu ndi'in kwan 'in Palyu , cha' ta chabiya' 'in yu cha' ku'ni yu nchga cha' nu nchka ti' yu ku'ni yu , ni siya ti tyi'in ne' kwan 'in yu ; lo'o mda Félix chabiya' cha' kan ne' ta'a nda'an yu se'en ndi'in yu , cha' ta ne' nan lka nu lyiji chin' 'in yu . Mdo'o Félix ndyaa yu bra kan' .
46013007	Description	Bra nu chañi cha' su'we nka tiyean ña'aan 'in nten , lye la taloan 'in ne' bra kan' , ni siya ku'ni ne' nchga cha' kuxi ; tsaa ña'an tian' nchga cha' su'we , tyi'in taan cha' su'we la ka cha' nde loo la , ni siya ja jlyo tian' ; kwi' ngwaña'an , ndi'in cha' taloan lo'o nchga cha' nu nchka 'ñaan lo chalyuu re ni .
47004013	Faith	Ndiya ska cha' nu ndukwa lo kityi kula se'en ykwi' ska nten cha' re : “ Wa ndyaa ña'an tiǎn' cha' chañi lka cha' kan' , kan' cha' nchkwiǐn' cha' nu ñi re lo'o xka ta nten ” ndukwin ayman kan' . Kwi' ngwaña'an bare , nchkwi' ba cha' 'in Jesús cha' wa yten ba cha' 'in yu , bra nu msñi ba cha' kan' .
52005014	Recommendation	'Wan ta'a msñi wan cha' 'in Jesús , nde ndiya ska cha' nu chkwi' ba lo'o wan : Kulo wan tñan 'in ta'a wan nu ja xlya ku'ni tñan , nu ndaja 'a ; ku'ni wan cha' ka ngula la ti' ni' kasiya 'in ne' ta'a wan nu xi'in ti ti' , cha' xñi su'we la ne' cha' 'in Jesús ; taya' wan 'in ne' ta'a wan nu ja ndyiji jwersa 'in ne' cha' xuun ne' lo'o nu kuxi , lo'o ngwaña'an talo wan 'in nchga ne' ta'a wan .
66016010	Description	Lo'o ndyaa angajle nu nchka ki'yu , ndyaa mslu nan nu nsu'wi ni' ka'nan lo yka xlya tnun se'en ndukwa 'ni chen ña'an kan' bra kan' ; ngwa tla yta ña'aan se'en ndloo i' tñan bra kan' . Lye 'a mgii ti' nten chalyuu nu ti'í kan' sa ña'an ya' nchku li'ya ne' cha' ti'í 'a 'in ne' bra kan' .
48006016	Grace	Nchga nten nu ku'ni ngwaña'an chabiya' 'in Jesús laja nu ndi'in ne' lo chalyuu , ka tyi'in tiin ti ne' bra kan' , lo'o ngwaña'an chka t'nan ti' Ndiose 'in ne' kan' bra kan' ; kwi' ngwaña'an ku'ni Ni lo'o ta'aan nu chañi cha' lkaan nten 'in Ni .
44018025	Faith	Ti ngwa s'ni la ngwa'u su'we ta'a ne' 'in yu cha' 'in Jesús nu nka X'naan ; kan' cha' ndla ti yu , ja ngwa ndaja ti' yu siya' ti cha' chkwi' yu cha' kan' . Su'we 'a mdu'u yu cha' 'in Jesús 'in nten bra kan' ; sa kan' ti cha' , ti ndukwatya yu 'in ne' sa ña'an nu mdukwatya ayman Xuwa 'in nten , cha' ti ji ka biya' ti' yu nchga cha' 'in Jesús .
46010031	Recommendation	Su'we sikwa , ni siya ku wan , ni siya ko'o wan , ni siya ku'ni wan ya ña'an ti tñan nu ngi'ni wan , tyu'wi ti' wan 'in Ndiose tyukwi laja nu ku'ni wan tñan kan' , cha' ka biya' ti' nten bra kan' cha' su'we 'a lka cha' 'in Ndiose , ti kwi' cha' nu wa yten wan .
62002027	Recommendation	'Wan ni , wa nganun Tyi'i Ndiose ni' kasiya 'wan , kan' cha' ja ndi'in cha' kwa'u xka ta nten 'wan ; Tyi'i Ndiose , kan' lka nu kwa'u 'wan nchga cha' nu ti ji ku'ni xa'an wan cha' 'in Ni . Bra nu ndu'u Tyi'i Ndiose 'wan , ñi 'a lka cha' kan' ; si'i cha' kwiñi ndu'u Ni . Kan' cha' sikwa , sa ña'an nu ndu'u Tyi'i Ndiose 'wan cha' xñi wan cha' 'in Jesús , kwi' ngwaña'an ndi'in cha' ku'ni wan .
59002026	Faith	Kwi' ngwaña'an nan ni , si chkwian' cha' wa ytean cha' 'in Ndiose , lo'o ja ngi'nian cha' su'we nu tayaan' 'in ta'a ntean , bra kan' lkaan sa ña'an lka nten nu wa ndyaa kasiya 'in cha' wa ngujwi ne' .
44027035	Description	Xa wa mdyii ykwi' Palyu lo'o ne' , bra kan' msñi yu ska jaxlya . Ndya yu xu'we 'in Ndiose tloo nchga nten kan' , msu'we yu jaxlya kan' , yku yu bra kan' .
44015020	Sin	Sa kan' ti cha' ku'nian , nxke' tiǎn' ; kwa'aan ska kityi cha' tsaa se'en ndi'in ne' kan' . Nde ka cha' nu chkwi' kityi kan' : Ja su'we ku ne' lomstan nu wa mskwa tloo jo'o ; ku'ni ñu'un lomstan kan' 'in kasiya 'ñaan bra nu kuan 'in ran . Lo'o ja su'we tyi'in cha' 'in ne' lo'o kwilyo'o xka nten siya' ti ; kwi' ja su'we ku ne' 'ni nu ja mdyii ngalu tnen 'in i' xa wa yjwi ne' 'in i' ; kwi' ja su'we ku ne' tnen .
44023003	Sin	― ¡ Ndiose jwi'in 'iin ngwaña'an ni ! ― ndukwin Palyu 'in x'nan sti jo'o bra kan' ― . Kwiñii 'a nu'win . ¿ Ta ñi 'a cha' y'nii , nxke' tii' a ? Nde ngi'ni biya' wan cha' 'ñaǎn chabiya' 'in cha' kula nu ndiya 'ñaan , lo'o nguloo tñan cha' ykwan' ne' tu'waǎn , ni siya ja ndi'in chabiya' ku'nii ngwaña'an .
45008001	Description	Lo'o ni , nde ña'an y'ni Ndiose cha' 'ñaan . Ja nganun 'a yuwe' 'ñaan ni , cha' su'wa ndi'in cha' 'ñaan lo'o Jesucristo ; ja ka 'a 'in nu xa'an nu nsu'wi chalyuu jwakii 'ñaan ni , cha' Tyi'i Ndiose lka ndloo la 'ñaan bra nu ndi'ian lo chalyuu .
52005009	Grace	Ndiose ngulo suwi Ni 'ñaan , si'i cha' ta Ni nu ti'í 'ñaan ; wa ngulo suwi Ni 'ñaan cha' kulaa Ni 'ñaan chun' tñan nu y'ni Jesucristo nu nka X'naan ,
66020008	Violence	Tyo'o Satanás kan' ti xi'i cha' kwiñi lyo'o yu 'in nchga nten tyukwi ña'aan chalyuu , cha' xuun ne' lo'o Ndiose ; ne' Gog lo'o ne' Magog lka nten kan' . Ña'an ti' kata ysiin nu ndi'in tu'wa tujo'o cha' ja nchka 'ñaan kwaan sa kwa lka ran , kwi' ngwaña'an , ja ka kwaan ni sa ña'an nten xo' ti'in Satanás cha' xuun yu lo'o Ndiose bra kan' .
46006011	Grace	Kwi' ngwaña'an , ndiya chin' ta'a wan nu y'ni wan ti kwi' ta'a cha' kuxi kan' ti ngwa s'ni ; lo'o xka ña'an ngi'ni wan ni , cha' wa y'ni tyii Jesús nchga ki'ya nu ndukwi wan ti bra kan' , lo'o ni , wa yten wan cha' 'in Ndiose bra kan' . Wa ngwa su'wa cha' 'wan lo'o Ndiose cha' wa msñi wan cha' 'in Jesucristo nu nka X'naan , lo'o wa nda Ndiose Tyi'i Ni cha' xu'wi ni' kasiya 'wan .
55001012	Faith	Kan' cha' ndijiǐn nu ti'í ni . Lo'o ja jyu'u tiǎn' , cha' na' wa jlyo tiǎn' cha' Ndiose ka nu mda cha' re 'ñaǎn . Jlyo tiǎn' cha' nchka 'in Ni ku'ni kuwe ti' Ni 'ñaǎn ; nchka 'in Ni taya' Ni 'ñaǎn bra nu ngi'niǐn tñan nu nda Ni 'ñaǎn , cha' ka tsaa to'o su'we tñan 'ñaǎn bra nu tiya tsan nu kan Jesús lo chalyuu xiya' .
49006018	Faith	Chkwi' wan lo'o Ndiose bra nu xuun wan lo'o nu kuxi , jñan wan chabiya' 'in Ni ; nchga bra taya' Tyi'i Ndiose 'wan cha' ka chkwi' wan lo'o Ni . Kwi' ngwaña'an ndi'in cha' chkwi' wan lo'o Ni cha' 'in nchga nten nu wa msñi cha' 'in Ni . Kan' cha' sikwa , ndii ti ti' wan chkwi' wan lo'o Ni , cha' ja ka ndaja ti' wan .
52001001	Grace	Palyu lkaǎn . Lo'o Silvano lo'o Timu ndi'in lo'oǔn nde re . Nda'an ba kityi re cha' tsaa se'en ndi'in wan , nchga ta wan ne' kichen Tesalónica nu su'wa ndi'in cha' 'wan lo'o Ndiose Stian , lo'o Jesucristo nu nka X'naan . Nchka 'a ti' ba cha' ti ku'ni Ndiose cha' su'we lo'o wan , cha' ku'ni Ni cha' tiin ti tyi'in ni' kasiya 'wan .
50004005	Faith	Xkwi' chka t'nan 'a ti' wan 'in nchga nten , cha' ka biya' ti' ne' cha' ngwaña'an ngi'ni wan . Wa ndla ti kan ykwi' X'naan xiya' .
46011026	Faith	Kan' cha' nchga bra nu ku wan jaxlya kan' , ko'o wan nan nu nsu'wi ni' basu kan' , ñi kwa'u wan 'in nten cha' ngujwi Jesús lo wsi cha' 'ñaan , sa ña'an bra nu kan Jesús xiya' .
59005015	Faith	Chkaa nu ti'í kan' bra kan' , cha' nu ndyaa ña'an ti' wan cha' nu wa ykwi' wan lo'o Ndiose . Ti ta Ni chalyuu 'in nu ti'í kan' xiya' , kwi' ngwaña'an ku'ni Ni cha' tlyu ti' 'in yu nchga ki'ya nu ndukwi yu .
55001003	Faith	Sa ña'an nu y'ni ayman 'ñaan nu ngwa s'ni , tyukwi ti tiye ne' y'ni ne' tñan 'in Ndiose , kwi' ngwaña'an tyukwi ti tiyeěn ngi'niǐn tñan 'in Ni sa bra ni . Ndyaǎn xu'we 'in Ndiose bra nu nchkwiǐn' lo'o Ni cha' 'iin , tsan lo'o tla nchkwiǐn' lo'o Ni .
66006016	Description	Kwen msi'ya ne' 'in ki'ya lo'o kee tnun : ― Tlyuu lya wan chun' ba , cha' ja ña'an 'a Ndiose nu ndukwa se'en tnun kwa 'wa bra kan' ; wa msin' 'a ti' nu lka ña'an ti' slya' kan' 'wa ― ndukwin ne' bra kan' .
66002017	Description	“ Kunan su'we wan nchga cha' nu nchkwi' Tyi'i Ndiose lo'o ta'a nten nu wa msñi cha' 'in Ni skaa kichen , si xlyaa wan kunan wan : Su'we ti ku'niǐn lo'o nchga nten nu tyijin lyo 'in kune' xa'an tyukwi bra nu xu'wi ne' chalyuu ; ka kala' ti' ne' kan' , ku ne' cha' su'we nu wa mxoǔn' ti'iǐn cha' kaja 'in ne' . Kwi' ngwaña'an , taǎn ska kee xuwe nu ngaten 'a ña'an , nu ndukwa nin ska nten chun' , cha' ka biya' ti' ne' kan' , cha' su'we nka tiyeěn ña'aǎn 'in ne' ; xka nin nu ja ya kunan nten , kan' nu ndukwa chun' kee kan' . Lo'o ja kaja chabiya' 'in xka ta nten xu'wi lyo nin kan' ; wa lka ti nten nu kaja nin kan' 'in , kan' nu kaja chabiya' cha' xu'wi lyo 'in ran ” ndukwin Jesús .
61002003	Sin	Kwi' ngwaña'an , nxitukwi 'a ti' yu kwiñi kan' 'in nan nu nsu'wi 'wan ; nchka 'a ti' yu tyijin lyo yu 'wan , kan' cha' sa ti chkwi' yu cha' kwiñi lo'o wan . Ndi'in cha' ta Ndiose nu ti'í 'in yu kwiñi kan' , cha' wa s'ni ykwi' Ni cha' kuxi 'a ku'ni ne' ngwaña'an . Si'i nan laja' Ndiose ; jlyo ti' Ni sa ña'an ngi'ni yu kwiñi kan' , kan' cha' ku'ni tyii Ni 'in yu ndla ti .
53002011	Sin	kan' cha' kulaa ya' Ndiose 'in ne' , chun' ndyaa ña'an la ti' ne' 'in cha' kwiñi kan' .
