66006004	Violence	Que aiyeda , etame apecʉ caballo , jũacʉ . Ñai tubacʉ ṹ̶ra ãd̶amatede d̶aicõjeimʉ mateáme ijãravʉcavʉre , ne boarĩ́ jarʉvarãjiyepe ayʉ ne baju . Que teni cãrijimenore cũiné d̶aicõjeimʉ mateáme . Cʉvateame cũináve boaicarove ũ̶mʉjʉrivede .
54006001	Recommendation	Caivʉ Jesúre jʉ aipõeva memecaivʉre pued̶aiye jaʉvʉ ne jabocʉre cainʉmʉa , apevʉ ne ãmeina yávabenajiyepe aivʉ Jũ̶menijicʉre aru maje bueiyede máre .
51003009	Recommendation	Que baru borod̶abejarã mu̶je bajumia . Mu̶ja aipe ãrojarivu̶ bácavu̶re mu̶je ãmeina d̶aiyu̶eque aru mu̶je d̶are nu̶iye báquede ãmenore dajocad̶avũ̶ mu̶ja .
66002020	Sin	’ Ʉbenita cũináro mi d̶ainore ãmeina jã́ivʉ yʉ . Mʉ jaetovabevʉ nomióre õi ãmiá Jezabel . Õ mʉje jẽneboi ‘ Jũ̶menijicʉi yávaiyede coyʉcaipõecobu yʉ ’ , ʉbenina aibico õ . Õi bueiyeque jʉjovaibico ina yʉre memecaivʉre . Que baru ãmeina d̶are d̶aibico náre apevʉque némarebʉcʉva ãmevʉque . Aru ãre d̶aibico náre ãiyede pẽpeimarare ne jíye báquede máre .
48003008	Grace	Javede Jũ̶menijicʉ toivaicõjenejaquemavʉ ũ̶i yávaiyede , põeva ne coreóvarãjiyepe ayʉ boropatebede d̶acʉyʉ ũ̶i jã́inore ina judíova ãmevʉre ne jʉ aiyeque ṹ̶re . Jũ̶menijicʉ coyʉrejaquemavʉ Abraham mácʉre mearo d̶acacʉyʉre ũ̶ mácʉre ũ̶i mearo d̶acaquiye jipocai yópe arĩ : “ Mʉ jʉ aivʉ yʉre . Que baru mʉre ji mearo d̶acaiye báquepedeca ijãravʉcavʉ apevʉ , caivʉ yʉre jʉ aivʉre máre , mearo d̶acacʉyʉmu yʉ ” , arĩ toivaicõjenejaquemavʉ Jũ̶menijicʉ .
58012005	Recommendation	¿ Aru ãrʉmetenarʉ mʉja iye Jũ̶menijicʉi majicaiyede majare yópe mamarape ? Yópe arĩ , toivaicõjenejaquemavʉ : Mʉ , bʉcʉ , me jápiarĩ ad̶ajacʉ maje jabocʉ Jũ̶menijicʉ majicayʉre mʉre aipe d̶aiye jaʉrõre . Chĩori parʉbetebejacʉ mi ũmei ũ̶ coreóvare d̶ayʉre mi ãmeina teiyede .
58013017	Recommendation	Me jápiajarã mʉja , Jesúre jʉ aipõeva , mʉjare coreipõevare . Náre pued̶arĩ , ne coyʉiyede jʉ arĩ , d̶ajarã yópe ne d̶aicõjeiyepe . Cainʉmʉa mʉjare ʉrĩ , jã́ri cored̶ama ye jabʉóvabevʉva . Aru nópe d̶ad̶ama , ne coreóvaiye boje coyʉrãjivʉre Jũ̶menijicʉre aipe ne d̶aiyede iye ũ̶i náre coreicõjeiyede mʉjare . Mʉja ne coyʉiyede jʉ arĩ , diepe mʉje d̶aru , torojʉrivʉ coyʉrãjarama Jũ̶menijicʉre mʉje jʉ aiyede . Ʉbenita mʉja ne coyʉiyede jʉ abeni , diepe mʉje d̶abedu , chĩoivʉ coyʉrãjarama Jũ̶menijicʉre mʉje jʉ abede . Aru chĩoivʉ coyʉru , ye meamejebu mʉjare . Jũ̶menijicʉ ñájine d̶ajebu mʉjare , mʉje jʉ abe boje náre .
44013019	Description	Bíjaroyʉ bácʉ siete paiyajuboare , Canaán ãmicʉrijoborõcavʉre , jídejaquemavʉ no joborõre ũ̶i põeva mácavʉre .
54006003	Faith	Maje jabocʉ Jesucristo bueibi majare jãve , maje majinajiyepe ayʉ aipe d̶aiye jaʉrõre majare , maje cʉrãjiyepe ayʉ yópe Jũ̶menijicʉi ʉrõpe . Ʉbenita apevʉ cʉrivʉbu , jʉ abevʉ Jesús ũ̶i bueiyede . Quénora bueivʉbu na ape bueiyede jãve ãmene .
63001010	Recommendation	Ácʉ põecʉ buecʉdayʉ baru mʉje yebai ape bueiyede Jesúi bueiye báquede jarʉvarĩ , ñaine copʉ etabejarã mʉje cũ̶ramiai aru jacoyʉbejarã ṹ̶re .
47001005	Grace	Yópe Cristoi ʉrarõ ñájiye báquepe , nopedeca maja máre ʉrarõ ñájivʉbu . Aru yópe Jũ̶menijicʉi ʉrarõ cad̶ateiye báquepe ṹ̶re , nopedeca ʉrarõ cad̶ateyʉbe majare , maje cʉe boje Jesucristoque cũinávʉpe .
65001011	Sin	¡ Chĩorajarama na ! D̶ad̶ama yópe Caín mácʉpe , ñai ĩmacʉ bácʉre boarĩ́ jarʉvayʉ bácʉpe . Aru ãmeina ted̶ama , earãjivʉ tãutʉrare yópe Balaam mácʉpe . Ʉbenita bíjarãjarama , ne jʉ abe boje jabovare yópe Coré bácʉpe .
65001010	Sin	Ina jʉjovaivʉ , borocʉede bueivʉ , ãmeina yávad̶ama iye ne coreóvabede . Aru iye ne coreóvaiyede coreóvabenama ne majiéque yópe põeva dápiaivʉpe . Quénora coreóvad̶ama diede ne dápiaiyeque jĩ́cua yópe ãimara dápiabevʉpe . Aru bíjarãjarama na no boje .
58011007	Faith	Noé mácʉ ũ̶i jʉ aiye báque boje Jũ̶menijicʉre , jiad̶ocũ ʉracũ cũ̶rami cʉricũre d̶arejaquemavʉ yópe Jũ̶menijicʉi coyʉiye báquepedeca ũ̶ mácʉre , mead̶acʉyʉ ũ̶ jina mácavʉre muiváibore jocarĩ . Jũ̶menijicʉ coreóvare d̶arejaquemavʉ ũ̶ mácʉre ãnié ãmene vaiquíye báquede , ãnié jã́me máquede cãreja . Aru Noé mácʉcapũravʉ jápiarĩ ad̶arĩ jʉ arejaquemavʉ ṹ̶re . Ʉbenita ijãravʉcavʉ Jũ̶menijicʉre jʉ abevʉ bácavʉ Noé mácʉre jápiarĩ ad̶abeni jʉ abedejaquemavʉ ũ̶ mácʉre . Que baru Jũ̶menijicʉi ñájine d̶arãjimara marejaquémavʉ na mácavʉ . Ʉbenita Noé mácʉre “ Boropatebecʉbu mʉ ji jã́inore ” , arejaquemavʉ Jũ̶menijicʉ , ũ̶i jʉ aiye báque boje ṹ̶re .
58009006	Description	Diñami cũ̶rami mácarõ nópe barejaquémavʉ . Que baru caijãravʉa coapa ditucubʉ ʉratucubʉ ne mamarʉmʉ ecoitucubʉ bácarõre ecovarejaquemavʉ ina sacerdoteva bácavʉ , memecarãjivʉ Jũ̶menijicʉre yópe jaʉépe na mácavʉre .
44007051	Sin	’ Yʉ coyʉyʉbu mʉjare : ¡ Ʉbenita jápiaiyʉbevʉ mʉja ! Dápiaivʉbu mʉja yópe Jũ̶menijicʉre jʉ abevʉ ne dápiaiyepe . Jápiaiyʉbevʉ mʉja Jũ̶menijicʉi yávaiyede . Mʉjeñecuva mácavʉpe paivʉbu mʉja . Na mácavʉpedeca mʉjavacari máre cainʉmʉa jápiabevʉ ñai Espíritu Santore .
54001009	Sin	Coreóvaiye jaʉvʉ põevare aipe teni Jũ̶menijicʉi coreóvare d̶aiye báquede iye d̶aicõjeiyede . Jũ̶menijicʉ coyʉrejaquemavʉ iye d̶aicõjeiyede Moisés bácʉre , jã́d̶ovacʉyʉ dieque põeva ne ãmeina teiyede . Que baru ina põeva boropatebevʉre Jũ̶menijicʉi jã́inore , ne jʉ aiye boje Jesúre , jaʉbevʉ náre iye d̶aicõjeiye . Quénora ina ãmeina teivʉre iye d̶aicõjeiyeque Jũ̶menijicʉ jã́d̶ovaimi ne ãmeina teiyede . Ãmeina teivʉ ne d̶aiye nópe paiyebu . Námu Jũ̶menijicʉi d̶aicõjeiyede jʉ abeni d̶abevʉ . Pued̶abevʉbu Jũ̶menijicʉre , ãmeina d̶aivʉ . Námu Jũ̶menijicʉi ʉbemara aru yʉrivʉ Jũ̶menijicʉre máre . Námu boarĩ́ jarʉvaivʉ népacʉre , aru népacore , aru apevʉre máre .
46005009	Recommendation	Jipocare ji toivaicõjeiye báquede apecʉre paperayocare , mʉjare yóvaicõjemetecacʉ ina ãmeina d̶aivʉre apevʉque némarebʉcʉva ãmevʉque .
48001015	Grace	Ʉbenita nópe d̶ayʉ bácʉreca , Jũ̶menijicʉcapũravʉ yópe d̶acarejaquemavʉ yʉre . Beorejaquemavʉ yʉre ji põetequiye jipocamia . Aru cuturejaquemavʉ yʉre , ũ̶i pare ʉe boje põevare , ji memequiyepe ayʉ ṹ̶que .
45007015	Description	Jãve coreóvabevʉ aipe vaiyede yʉre aru ji d̶aiyede máre . Yópe ji d̶aiyʉepe d̶abevʉ yʉ . Ʉbenita iyebu ji jã́iyʉbe ji d̶aiye .
61003018	Faith	Quénora pʉeno baju nʉjara mʉja , Jũ̶menijicʉi mearo d̶acaimara bojecʉbeda ũ̶i me boje . Aru pʉeno baju coreóvajarã maje jabocʉ Jesucristore , majare mead̶aipõecʉre . Mearore jínajarevʉ ṹ̶reca caride aru cainʉmʉa , jã́d̶ovarajivʉ ṹ̶re meacʉ bajure . Quédecabu . Quénoramu .
46004010	Description	Ijãravʉcavʉ Jesúre jʉ abevʉ , “ Majibema na , ʉbenina coyʉivʉ ” , ad̶ama ñʉje borore , Jesúi daroimarare coyʉcarãjivʉ ũ̶i yávaiye méne . Ʉbenita mʉjacapũravʉ “ Jesucristo caiyede coreóvare d̶aibi ñʉjare ” , arĩ dápiad̶avũ̶ , ʉbenina dápiaivʉvacari . Ñʉjacapũravʉ bueni majibevʉ parʉéque . Ʉbenita mʉjacapũravʉ “ Parʉéque bueivʉbu ñʉja ” , arĩ dápiad̶avũ̶ , ʉbenina dápiaivʉvacari . Aru mʉjatamu põeva ne pued̶aimara . Ʉbenita ñʉjatamu ne ãmeina jã́imara .
60005009	Faith	Ʉbenita dajocabejarã mʉje jʉ aiyede ṹ̶re . Quénora maucʉvajarã ñai abujuvai jabocʉre , mʉje coreóvaiye boje caino joborõacavʉ ijãravʉi Jesúre jʉ aivʉ , na máre ñájiñama mʉje ñájiyepe .
51003022	Recommendation	Mu̶ja , memecaivu̶ , cainu̶mu̶a ju̶ ajarã me mu̶je jabova ijãravu̶cavu̶re ne coyu̶iyede mu̶jare . Cainu̶mu̶a ju̶ ajarã náre me mu̶je ũmeque . Ju̶ aivu̶ ãmejara náre quénora ne jã́iyede mu̶jare , “ Mearo d̶aivu̶bu ” ne arãjiyepe aivu̶ mu̶jare . Ju̶ ajarã náre , mu̶je pued̶aiye boje maje jabocu̶ Cristore .
66017012	Description	’ Caipʉcapʉrʉape paijavaroa mi jã́iye báque , jẽvari coyʉrĩ diedecabu caipʉcapʉrʉape paivʉ jabova bárãjivʉ , jaboteni bú̶bevʉ cãreja . Ʉbenita cũináora baju jaboteicõjeimara marajárama ñai ãme ãimacʉ jijecʉcʉque .
46002012	Grace	Ñai Espíritu Jũ̶menijicʉi daroimʉ majare põeva ne majiéde coreóvare d̶abebi majare . Quénora Jũ̶menijicʉi majiéde coreóvare d̶aibi majare , maje coreóvarãjiyepe ayʉ iye Jũ̶menijicʉi mearore d̶acaiyede majare bojecʉbeda .
59005001	Recommendation	Caride jápiajarã mʉja , cʉve cʉvarivʉ . Cod̶oboborĩ ojarã mʉja mʉje ñájinajinore .
66002010	Recommendation	’ Jidʉbejacʉ mi ñájiquinore . Jã́jacʉ . Ñai abujuvai jabocʉ bʉore d̶acʉyʉme apevʉ mʉjacavʉre ãmeina teivʉre jẽni jacoiñami , jã́ri coreóvacʉyʉ mʉje jʉ aiyede yʉre . Caipʉcapʉrʉape paijãravʉa baquiyéde ñájinajaramu mʉja . Jʉ ajacʉ yʉre pʉ mi yaiyeta . Que teyʉre , yʉ bojed̶acʉyʉmu mʉre me . Mʉre cʉre d̶acʉyʉmu jãravʉ cũiméjãravʉ baquinóre yú̶que .
54006011	Recommendation	Mʉ Jũ̶menijicʉi põecʉbu . Ʉ̃́re memecayʉbu mʉ . Que baru d̶abejacʉ caiye iye ãmeina teiyede yópe ji coyʉiyepe . Pʉeno baju d̶ajacʉ cainʉmʉa , mearo d̶acʉyʉ Jũ̶menijicʉi jã́inoi , pued̶acʉyʉ ṹ̶re , jʉ acʉyʉ Jesús ũ̶i yávaiye méne , ʉcʉyʉ põevare , napicʉyʉ mi ñájiyede , aru meacʉ põecʉpe cʉcʉyʉ apevʉque .
59005005	Sin	Ijãravʉi torojʉrĩ cʉrivʉbu mʉja mʉje ʉre cʉveque . Ʉrabʉcʉvabu mʉje ãiye boje méne . Que baru yópe oteiãimacʉ coreóvabecʉpe põevai jíyede ṹ̶re ʉrarõ ãinore , d̶arãjivʉ jiacʉcʉre ne boarã́jiye jipocai ṹ̶re , nopedeca mʉje ñájinajijãravʉ baquinó edaquiyebu mʉjare , corebevʉre .
66004004	Description	Jabocʉi dobarõ mearo yebai apenoa jabovai dobarõa mearoa veinticuatro painoa yópe meatarabʉ dobarĩ jãpʉrino mateávũ̶ . Aru die coapa dobateima veinticuatro paivʉ bʉcʉva , doivʉ cuitótecajea boricajeare aru ne jipobʉi cʉvateima úruque d̶aitarabʉare máre .
66018007	Description	Yópe ʉrarõ mearore aru ʉre cʉve bojecʉede máre ne ĩ́ye báquepe ne baju , nopedeca ĩcavajarã náre ñájiyede ʉre aru chĩoiyede máre ʉre cũinátʉrʉra . Yópe arĩ dápiarĩduyama na ne ũmei : “ Yui jabotenajivʉ dobarivʉbu ñʉja . Apejĩe ye jaʉbevʉ ñʉjare . Cõmaje ãrojarivʉ ãmenajaramu ñʉja cainʉmʉa . Aru chĩomenajaramu , ñájimenajaramu máre cainʉmʉa ” , arĩ dápiarĩduyama nócavʉ , “ ¿ Meara márica apevʉ pʉeno ? ” aivʉ .
60003007	Recommendation	Aru mʉja nomicʉrivʉ máre , me coreóvajarã aipe d̶aiye jaʉrõre mʉjare mʉjemarebʉcʉvare . Na mʉje cãchino parʉrivʉbu . Que baru pued̶ajarã náre . Aru na cʉvarãjarama jãravʉ cũiméjãravʉ baquinóre cũinátʉrʉ mʉjaque . Que baru pued̶ajarã náre . Me cʉjarã náque , mʉje jẽniari bʉojarãjiyepe aivʉ Jũ̶menijicʉque yópe mʉjare jaʉépe .
54002012	Recommendation	Yʉ nomivare bueicõjemevʉ ũ̶mʉvare . Aru yʉ nomivare máre jaboteicõjemevʉ ũ̶mʉvare . Quénora bi ajarãri na , nomiva .
46001009	Faith	Jũ̶menijicʉ d̶aibi cainʉmʉa yópe ũ̶i aiye báquepedeca . Ʉ̃́recabe mʉjare cuturĩ epeyʉ maje jabocʉ Jesucristoque cũinávʉpe , “ Yóvajarãri na jímacʉ Jesucristoque ” , ũ̶i aiye báquepedeca .
48005013	Recommendation	Mʉja , jívʉ , mʉjarecabu Jũ̶menijicʉi cutuimara mácavʉ ũ̶ jina márajivʉ , d̶abenajivʉ iye d̶aicõjeiyede yebacavʉpe . Ʉbenita me jã́jara diede , yebacavʉpe tede d̶aiyede . Mʉjare d̶aiye jaʉbe boje iye d̶aicõjeiyede , “ Caiye maje ãmeina d̶aiyʉede d̶arĩ bʉojaivʉbu maja ” , arĩ dápiabejarã . Quénora dápiajarã mʉje baju yópe yebacavʉpe , cad̶atenajivʉ mʉjacavʉ Jesúre jʉ aipõevare , mʉje ʉe boje caivʉ Jesúre jʉ aivʉre .
59002012	Recommendation	Mʉja coreóvaivʉbu Jũ̶menijicʉ jã́ri coyʉcʉyʉre méne o ãmene mʉje d̶aiyede . Jã́cʉyʉme aipe ãrojaene diede , yópe ũ̶i d̶aicõjeiye me , aru ye jaʉbe , aru bʉoimarare d̶abepe máre . Que baru me yávajarã aru me d̶ajarã máre yópe Jũ̶menijicʉi ʉrõpe .
46012005	Faith	Ʉretamu maje memecaiye Jũ̶menijicʉre aru apevʉre máre maje majiécarõque . Ʉbenita cũinátʉrʉ ãmevʉ . Aru maje jabocʉ Jesucristo cũinácʉrecabe jaboteyʉ maje memecaiyede .
45009005	Description	Ina judíovavacari “ Ñʉjeñecuva mácavʉbu ” , ad̶ama Abraham mácʉre , Isaac bácʉre , Jacob bácʉre , aru Jacob bácʉi doce paivʉ mamara mácavʉre máre , ne yajuboare bʉipõeva mácavʉre . Aru Cristovacari põetedejaquemavʉ yópe ne yajubocacʉpe , judíovacacʉpe . Ʉbenita me jápiajarã yʉre . Jesucristo põecʉbe . Ʉbenita ũ̶ máre Jũ̶menijicʉ , mearore jímʉme , aru ne torojʉede jímʉme cainʉmʉa jãravʉ cũiméjãravʉ baquinóre . Quédecabu .
47001006	Description	Ñʉja ñájivʉbu , bʉojarãjivʉ cad̶ateivʉ mʉjare , mʉje parʉrãjiyepe aivʉ mʉje ũmei aru mʉje mead̶aimara marajiyépe aivʉ máre . Jũ̶menijicʉi cad̶ateiyede ñʉjare ũ̶i parʉre d̶aiyede ñʉje ũmei , coreóvare d̶aibi ñʉjare aipe d̶aiye jaʉrõre ñʉjare , ñʉje cad̶atenajiyepe ayʉ mʉjare , parʉre d̶arĩ mʉjare mʉje ũmei . Que baru mʉja máre mʉje ñájiyede napini bʉojarãjivʉbu mʉje ñájinajijãravʉ baquinói yópe ñʉje napiyepedeca ñʉje ñájiyede .
47001021	Faith	Jũ̶menijicʉrecabe parʉre d̶ayʉ ñʉjare aru mʉjare máre maje ũmei , maje cʉede Jesucristoque cũinávʉpe . Ʉ̃́recabe beoyʉ bácʉ majare ũ̶ jinava .
44010015	Recommendation	Ʉbenita Jũ̶menijicʉcapũravʉ arĩ yávarejamed̶a Pedrore cojedeca . — “ Ãiyʉbevʉ yʉ ” , abejacʉ mʉ iyede ji ãicõjeiyede mʉre , arejamed̶a Jũ̶menijicʉ .
66018009	Sin	Caivʉ ina jabova ijãravʉcavʉ ãmeina d̶aivʉ bácavʉ diĩmaro mácarõcavʉque bʉjiéque cod̶oboborĩ , ñarebare totarĩ orãjarama na , ne jã́iyede toabico porĩ mʉinore no ĩmaro mácarõre ẽ́iyede .
43014023	Faith	Jesús , yópe arĩ , coyʉrejame : — Ácʉ põecʉ yʉre ʉcʉ , ji coyʉiyede jʉ acʉyʉme . Ʉ̃́recabe jipacʉi ʉquimʉ . Yʉ aru jipacʉmaque ũ̶i yebai nʉri , ṹ̶que cʉrãjaramu ñʉja .
62004010	Grace	Maja bʉojarĩ ʉrivʉbu Jũ̶menijicʉre quĩ́jinora . Ʉbenita Jũ̶menijicʉ bʉojarĩ ʉbi majare pʉeno ʉrarõ baju . Yópebu Jũ̶menijicʉi ʉe jãve : Jũ̶menijicʉ darorejaquemavʉ mamacʉre ijãravʉi , jícʉyʉ ṹ̶re ũ̶i yaicáquiyepe ayʉ majare boje , Jũ̶menijicʉi ãrʉmetequiyepe ayʉ maje ãmeina teiyede .
62001007	Faith	Ʉbenita maja d̶aivʉ baru mearore Jũ̶menijicʉpe , aru yópe miad̶ároi cʉrivʉpe baru , jãve maja cʉrãjaramu cũinávʉpe cũinátʉrʉ maje ũmei . Aru Jũ̶menijicʉi mácʉ Jesús bojed̶arejame maje yóvaiyede Jũ̶menijicʉque ũ̶i jiveque , ũ̶i yaicáiye báquede majare maje ãmeina teiye boje . Que baru Jũ̶menijicʉ ãrʉmeteibi maje ãmeina teiyede , Jesúi d̶acaiye báque boje majare .
48004007	Grace	Jũ̶menijicʉi nópe d̶aiye boje , caride yebacavʉpe , apevʉi d̶aicõjeimarape paivʉ ãmevʉ mʉja . Quénora Jũ̶menijicʉi máramu mʉja , ũ̶i jãve mearo d̶acaiye boje mʉjare yópe ũ̶i aiye báquepedeca . Caiye iye ũ̶i cʉvaede ũ̶i jíquiyede ũ̶i márare jícʉyʉme mʉjare .
58001008	Faith	Ʉbenita mamacʉcapũravʉre yópe arĩ , toivaicõjenejaquemavʉ Jũ̶menijicʉ : Mʉ , Jũ̶menijicʉ baju , cainʉmʉa põevare jabotecʉyʉmu mʉ . Mú̶tamu meacʉ baju . Que baru cainʉmʉa põevare jabotecʉyʉmu mʉ ména . Aru náre mearore d̶are d̶acʉyʉmu yópe mi ʉrõpe .
43010033	Sin	Jesúre arejaima na : — Mi d̶aiyede jã́ivʉ bácavʉ cũ̶raboaque dʉreni , mʉre boabénamu ñʉja . Ʉbenita “ Jũ̶menijicʉque cũinávʉpebu ñʉja ” , avʉra mʉ . Jũ̶menijicʉre ãmeina yávaivʉ mʉ , que ayʉ . Quénora põecʉratamu mʉ . Que baru Jũ̶menijicʉre mi ãmeina yávaiye boje , mʉre boarã́jaramu ñʉja , arejaima Jesúre ina judíova .
66014011	Description	Ibo toabo náre ñájiovaibore jocarĩ bico porĩ mʉivʉ cainʉmʉa . Que baru cũiméquiyebu ne ñájiye . Quénora jabʉóvabevʉva ñájinajarama jãravʉre aru ñamine máre caivʉ ina mearore jívʉ ñai jia ʉrad̶are dayʉ bácʉre aru ũ̶i pẽpeimʉre máre , aru ina toivare d̶aicõjeivʉ ne bajure ũ̶i ãmiáque , arĩ coyʉáme ñai ángele .
47004001	Faith	Jũ̶menijicʉ ũ̶i cõmaje ãroje jã́iye boje , ṹ̶re memecaicõjeimi ñʉjare , ñʉje coyʉrãjiyepe ayʉ Jesús ũ̶i yávaiye méne . Que baru ʉetʉbevʉva diede coyʉre nʉrajaramu ñʉja .
58013006	Faith	Que baru jidʉbevʉva yópe arãjarevʉ : Maje jabocʉ Jũ̶menijicʉrecabe yʉre cad̶ateyʉ . Que baru jidʉbecʉbu yʉ . Põecʉ cʉbebi ãmed̶arĩ bʉojayʉ ji ũmene , arãjarevʉ maja .
45014003	Recommendation	Mʉja caijĩene ãivʉ ãmeina jã́mejara ina ãimajiarʉare ãmevʉre . Quédeca mʉja ãimajiarʉare ãmevʉ ãmeina yávabejarã ina caijĩene ãivʉre . Jũ̶menijicʉvacari me jã́ñʉ coatebebi ina caijĩene ãivʉre ũ̶ jinare jocarĩ .
45015005	Grace	Aru Jũ̶menijicʉ napine d̶aibi põevare , aru torojʉre d̶aibi náre máre . Que baru cʉre d̶ajacʉrĩ mʉjare cãrijimevʉva cũinátʉrʉ mʉje ũme , mʉje d̶arãjiyepe ayʉ nópe Jesucristoi d̶aiye báquepe .
58007027	Description	Apevʉ sacerdotevare jaboteipõevape páyʉ ãmemi ũ̶ . Ʉ̃i ãmeina tebe boje , jícaiye jaʉbevʉ ṹ̶re jícaiyede Jũ̶menijicʉre ũ̶i baju ãmeina teiye boje jãravʉa coapa yópe apevʉ sacerdotevare jaboteipõeva bácavʉ ne d̶aiye báquepe . Na mácavʉcapũravʉ , apenʉmʉa jícarĩ aru apenʉmʉa jícaicõjeni apevʉ sacerdoteva bácavʉre , jícavarejaquemavʉ ne jícaiyede Jũ̶menijicʉre jãravʉa coapa . Mamarʉmʉre ne baju ãmeina teiye boje aru no yóbore caivʉ põeva névʉ bácavʉ ne ãmeina teiye boje , ãimara ne boaimara mácavʉre juarĩ jícavarejaquemavʉ na mácavʉ . Ʉbenita Jesúcapũravʉ cũinára jícarejaquemavʉ ũ̶i jícaiyede Jũ̶menijicʉre caivʉ põeva maje ãmeina teiye boje . Ʉ̃i bajure jícarejaquemavʉ ũ̶ , ũ̶i yaiye báquede majare boje .
62003017	Sin	Ácʉ põecʉ cʉve cʉvacʉ baru aru jã́ñʉ maru ũ̶ jicʉre cʉve cʉvabecʉre ṹ̶re jaʉéde , ʉbenita yéde jíbecʉ ñai cõmaje ãrojacʉre cad̶atebebi ṹ̶re . Jãve “ Yʉ ʉvʉ Jũ̶menijicʉre ji ũmeque ” , arĩ bʉojabebi ũ̶ . Quénora ñai cõmaje ãroje jã́mecʉ ʉbebi Jũ̶menijicʉre jãve .
47005008	Faith	Jidʉbevʉva aru chĩomevʉva máre napini corede nʉivʉbu maja . Pʉeno baju yaiyʉrivʉbu maja , cʉrãjivʉ maje jabocʉ Cristoi cʉrõi .
60002011	Recommendation	Mʉja , ji ʉmara , parʉrõreca jẽniaivʉ mʉjare . Mʉja ijãravʉcavʉpe paivʉ ãmevʉ . Quénora cavarõ mearo Jũ̶menijicʉi cʉrõcavʉ barãjáramu mʉja . Mʉja cʉrivʉbu ijãravʉi obebejĩena . Mʉje ãmeina d̶aiyʉe yópe maucʉvaepebu mʉje ũmeque . Que baru d̶abejarã yópe mʉje ãmeina d̶aiyʉepe . D̶aicõjemejara mʉja mʉje dápiaino ãmenore mʉje bajure .
60002017	Recommendation	Pued̶ajarã caivʉ põevare . Ʉjarã apevʉ Jesucristore jʉ aipõevare . Jũ̶menijicʉre pued̶arĩ , mearore jíjarã ṹ̶re . Aru pued̶ajarã ñai jabocʉ ijãravʉcacʉ pʉeno baju parʉcʉre .
44007025	Description	Ʉ̃ mácʉ yópe arĩ dápiarĩdurejaquemavʉ : “ Ina jívʉ majinajarama Jũ̶menijicʉ yʉre nʉvaicõjecʉyʉre náre ne yebacateinore jocarĩ ” , arĩdurejaquemavʉ . Ʉbenita majibedejaquemavʉ na mácavʉ .
50003002	Violence	Me jã́jara ina apevu̶ põeva ne ãmeina jã́imarare , aru ãmeina d̶aivu̶re , aru ũ̶mu̶va ne baju ne cajede buraicõjeivu̶re máre . Ne cajede buraicõjeiye boje , “ ¿ Jũ̶menijicu̶i põeva márica maja ? ” arĩ dápiarĩduyama . Que teni nácapũravu̶ napini coreniduivu̶bu Jũ̶menijicu̶i mead̶aquiyede náre , ne nópe d̶aiye boje .
56001016	Sin	Yópe arĩ , “ Jũ̶menijicʉre coreóvaivʉbu ñʉja ” , ʉbenina aivʉbu na . Ʉbenita ne d̶aiyeque jã́d̶ovaivʉbu coreóvabevʉre Jũ̶menijicʉre . Ãmena bajubu na Jũ̶menijicʉi jã́inore . Aru jápiabeni jʉ abevʉbu ṹ̶re . Que baru ye mearo d̶aiye majibema na .
45010002	Faith	Yʉ jãve mʉjare coyʉivʉ . Nácapũravʉ ʉrarõ memecaiyʉrĩduivʉbu Jũ̶menijicʉre ũ̶i ʉrõpe . Ʉbenina “ Yópe Jũ̶menijicʉi ʉrõpe d̶aivʉbu ñʉja ” , arĩ dápiad̶ama na . Ʉbenita yéde d̶abenama na yópe ũ̶i ʉrõpe .
47001004	Grace	Cainʉmʉa maje ñájiyede , majepacʉ Jũ̶menijicʉ parʉre d̶arĩ maje ũmei , cad̶ateyʉbe majare , majacapũravʉ maje cad̶atenajiyepe ayʉ apevʉ ñájivʉre . Yópe ũ̶i parʉre d̶aiyepe majare , nopedeca maja parʉre d̶aivʉbu apevʉre máre .
55002015	Recommendation	Méneca d̶arĩ jã́jacʉ , cʉcʉyʉ Jũ̶menijicʉi jã́inore ṹ̶re memecayʉ ũ̶i jʉ aimʉpe . Que teni cʉyebecʉbu mʉ mi bueiye boje me Jũ̶menijicʉi yávaiyede . Aru buejacʉ põevare yávaiyede jãvene .
53002004	Description	Ñai ũ̶mʉ ãmecʉ maucʉvacʉyʉme caivʉ põeva ne pẽpeimarare , aru ne jũ̶menijinare , caivʉ apevʉ ne mearore jímarare , aru Jũ̶menijicʉre máre . Yópe arĩ , ñai ũ̶mʉ ãmecʉ “ Yʉrecabu parʉcʉ caivʉ apevʉ pʉeno ” , acʉyʉme . Que teni ecocʉyʉme Jũ̶menijicʉi cũ̶rami , dobacʉyʉ yópe jabocʉpe . Aru , “ Yʉrecabu Jũ̶menijicʉ ” , acʉyʉme caivʉre .
49006004	Recommendation	Mʉja , nébʉcʉva , jorojĩne d̶abejarã mʉjemarare . Quénora buejarã náre aru majicajarã náre aipe d̶aiye jaʉrõre , ne torojʉre d̶arãjiyepe aivʉ Jũ̶menijicʉre ne d̶aiyeque .
45008037	Grace	Ʉbenita majacapũravʉ maje mauva ne ãmeina d̶abemaramu . Quénora Jũ̶menijicʉ pʉeno meare d̶aibi majare ne ãmeina d̶arĩduiyedeca , ũ̶i ʉeque ũ̶i jã́d̶ovaiye báquede Cristoi yaijãravʉi . Cad̶atevaibi majare , d̶acʉyʉ pʉeno meara márajivʉ .
44026014	Violence	Que baru cuecumaivʉ caivʉ mori tʉcarã joborõi . Aru jápiacacʉ apeno yávainore ñʉja judíova ñʉje yávaicamuaque , yópe ainore : “ Mʉ , Saulo , ¿ aipe teni maucʉvacʉrũ̶ mʉ yʉre ? Yópe d̶ayʉ , mú̶vacari ñájine d̶aivʉ mʉ mi bajuma , yópe cũinácʉ oteiãimacʉ ʉracʉ ũ̶i ñájine d̶aiyepe ũ̶i bajure tãtañʉ abod̶o juijóiyore ” , áme yʉre .
66002009	Sin	Coreóvaivʉ yʉ mi ñájiyede yʉre boje . Coreóvaivʉ mʉre cʉve cʉvabecʉre máre . Ʉbenita jãve ʉre cʉve cʉvavʉ mʉ Jũ̶menijicʉi cʉve méne . Aru coreóvaivʉ yʉ caiye iye ne ãmeina yávaiyede mi borore ina ‘ Judíovabu ñʉja ’ ʉbenina aivʉre . Ʉbenita judíova baju ãmema na . Quénora nárecabu Satanás jina . Aru cójijivaivʉbu , memecarãjivʉ ṹ̶re .
46013006	Faith	Maja apevʉre ʉrivʉ , ye torojʉbevaivʉbu apevʉ ne ãmeina teiyede , ne coyʉiyede jãve ãmene máre , aru ne ãmed̶aiyede apevʉre , ne coyʉiyede jãve ãmene apevʉi borore máre . Quénora torojʉvaivʉbu apevʉ ne mearo teiyede , ne coyʉiyede jãvene máre , aru ne mearo d̶aiyede apevʉre , ne coyʉiyede jãvene apevʉi borore máre .
59001021	Recommendation	Que baru dajocajarã caiye ãmeina teiyede mʉjare jarʉvarĩ . Aru d̶abejarã ãmenore . Meara põevape jʉ ajarã iye yávaiyede jãvene , iye coiye báquede mʉje ũmei yópe oteiye coiyepe joborõi . Iye yávaiye parʉé boje , mead̶aimara marajáramu mʉja .
46003006	Grace	Yópe cũinácʉ jiore memeipõecʉ ũ̶i oteiyepe , nopedeca mamarʉmʉre Jũ̶menijicʉi yávaiye méne coyʉcacʉ yʉ mʉjare . Aru yópe apecʉ ũ̶i mead̶aiyepe iye oteiyede , nopedeca ji yóboi mʉjare buequemavʉ Apolos . Ʉbenita yópe Jũ̶menijicʉi bʉcʉre d̶aiyepe iye oteiyede , nopedeca ṹ̶recabe põevare jʉ are d̶ayʉ ũ̶i yávaiye méne .
66014008	Sin	Apecʉ ángele dáme ũ̶i yóboi , yópe arĩ coyʉyʉ : — Jave bíjaivʉ no ĩmaro ʉrarõ Babilonia ãmicʉrõ . No ĩmarocavʉ ne pare ãmeina d̶aiye báque boje aru ne pare ãmeina d̶are d̶aiye báque boje caivʉ ijãravʉcavʉ Jesucristore jʉ abevʉre caijaborõai , bíjare d̶aimaramu na , arĩ coyʉáme ñai ángele .
43015014	Recommendation	Ji d̶aicõjeiyede jʉ arĩ d̶aivʉ baru , ji ʉmaramu mʉja .
62005021	Recommendation	Mʉja , jímajinape paivʉ , jíbejarã mʉja mearore pẽpeimarare . Quénoramu .
55003006	Sin	Apevʉ nácavʉ dʉibajĩeneca ecoicõjene d̶aivʉbu náre apevʉ ne cũ̶ramiai , jʉjovarãjivʉ nomiva ãrʉmevʉre . Ina nomiva , ne dápiaiye ãmeque d̶aiye boje , d̶aiyʉrivʉbu ãmenore ʉrarõ .
49004015	Faith	Ʉbenita coyʉrãjarevʉ Jesús ũ̶i yávaiyede jãvene . Maje yópe coyʉiyede jã́d̶ovarajarevʉ maje ʉede maje bajumia , aru náre maje coyʉimarare máre . Que d̶aivʉ baru , Jũ̶menijicʉi ʉrõpe d̶are nʉrajaramu maja , maje cʉe boje Cristoque cũinávʉpe . Maja ṹ̶re jʉ aivʉ caiyajuboa põeyajuboacavʉ ũ̶i bajupe paivʉbu . Aru ṹ̶vacari maje jabocʉbe , majare d̶aicõjeñʉ .
49004003	Faith	Ñai Espíritu Santo cãrijimenoque cʉre d̶aibi mʉjare . Cójijovaibi mʉjare cũináyajubocavʉpe cũinátʉrʉ mʉje ũmei . Que baru d̶ajarã caiyede mʉje oainope , mead̶arãjivʉ iye mʉje cʉede cũinátʉrʉ mʉje ũmei .
44009005	Description	Saulo jẽniari jã́rejamed̶a : — Mʉ , ji jabocʉ , ¿ ñamenʉ mʉ ? jẽniari jã́rejamed̶a . Aru Jesús arejamed̶a : — Yʉrecabu Jesús , mi maucʉvamʉ mácʉ . Mi maucʉvarõ yʉre ãmed̶aivʉ mʉre , arejamed̶a .
