43009022	Description	Nópe arejaimad̶a , ne jidʉé boje ñʉja judíova ñʉje jabovare . Jipocamia yópe arĩ , coyʉrejaimad̶a ina fariseova : “ Ácʉ põecʉ ‘ Jesúbe Jũ̶menijicʉi daroimʉ mácʉ ũ̶ ’ ayʉre , ñʉje cójijiñamine jaetovarãjaramu ñʉja , ũ̶i cójijibequiyepe aivʉ ñʉjaque bedióva cojedeca ” , aivʉ barejáimad̶a na jipocamia .
50003003	Faith	Ʉbenita majacapũravu̶ jãve Jũ̶menijicu̶i põevatamu . Que baru majarecabu mearore jívu̶ Jũ̶menijicu̶re jãve , Espíritu Santoi bu̶ojare d̶aiye boje majare . Aru majarecabu toroju̶rĩ cu̶rivu̶ Jesucristoque cũinávu̶pe . Aru majarecabu “ ¿ Jũ̶menijicu̶ mead̶aquidica majare maje d̶aiye boje ? ” arĩ dápiabevu̶ .
62003023	Faith	Jũ̶menijicʉ d̶aicõjeimi majare , maje jʉ arãjiyepe ayʉ mamacʉ Jesucristore , aru maje ʉrãjiyepe ayʉ majevʉre , yópe Jesúi d̶aicõjeiyepe .
66013011	Description	No yóboi , jã́cacʉ apecʉ ãme ãimacʉ jijecʉcʉre mʉri dayʉre joborõre jocarĩ . Pʉcarõa javaroa cʉvateame yópe ovejai javaroape . Ʉbenita yávame yópe ãijuacʉi yávaiyepe .
46014020	Recommendation	Mʉja , jívʉ , d̶abejarã mʉja yópe jʉed̶ova dápiabevʉ ne d̶aiyepe . Mʉje apevʉre jã́icõjeniduiyede mʉjare , ñai Espíritu Santo ũ̶i majide d̶aimara mae boje , jʉed̶ovape teivʉbu mʉja . Quénora d̶ajarã yópe bʉcʉva dápiaivʉ ne d̶aiyepe . Mʉje apevʉre cad̶ateiyede , ñai Espíritu Santo ũ̶i majide d̶aimara mae boje , bʉcʉvape teivʉbu mʉja . Ʉbenita yópe jʉed̶ova majibevʉ ãmeno d̶aiyeque , mʉja máre majibevʉpe tejarã ãmeno d̶aiyeque .
59005013	Recommendation	Apecʉ mʉjacacʉ ñájiñʉ maru , jẽniajacʉrĩ ũ̶ Jũ̶menijicʉque . Aru apecʉ mʉjacacʉ torojʉcʉ baru , yʉriajacʉrĩ , jícʉyʉ mearore Jũ̶menijicʉre .
58012012	Recommendation	Que baru yópe cúyaivʉ ne parʉre d̶aiyepe ne ãmuvede aru ne ñʉaboare máre , parʉre d̶ajarã mʉja mʉje ũmei .
60001017	Recommendation	Mʉje jẽniaiyede Jũ̶menijicʉque , “ mʉ , jipacʉ ” aivʉbu ṹ̶re . Aru Jũ̶menijicʉrecabe ñai jã́ñʉ caivʉ põevare cũinátʉrʉ , coyʉyʉ majare coapa , mearo d̶ayʉre o ãmeno d̶ayʉre máre , maje d̶aiye báque boje ijãravʉre . Que baru pued̶ajarã ṹ̶re mʉje cʉedeca yore ijãravʉi .
58010036	Recommendation	Mʉje ñájiyede , napiye jaʉédecabu mʉjare , mʉje jʉ arãjiyepe aiye Jesúre yópe Jũ̶menijicʉi ʉrõpe . Que teni earãjaramu iye mearore ũ̶i d̶acaquiyede mʉjare yópe ũ̶i aiye báquepedeca .
58011001	Faith	Jũ̶menijicʉre jʉ aivʉrecabu jãve majidivʉ eare d̶aimara márajivʉre iye maje napini coreiyede , maje cʉvarãjiyede méne Jũ̶menijicʉque , cʉvabevʉvacari cãreja diede . Me majidivʉbu iye maje jã́mene cãreja jãve bajure , aru vaiquíyede jã́mevʉvacari cãreja diede .
49004017	Recommendation	Ji cʉe boje Jesucristoque cũinávʉpe , coyʉquijivʉ mʉjare paredeca . D̶abejarã mʉja yópe ina Jũ̶menijicʉre jʉ abevʉ ne d̶aiyepe . Iye ne d̶aiyepe paiyede dajocajarã mʉja . Námu ʉbenina dápiaivʉ .
51002016	Recommendation	Que baru jápiarĩ ad̶abejarã mu̶ja ácu̶ põecu̶ ãmeina yávayu̶re mu̶jare , mu̶je ãiye boje aru mu̶je ũcuiye boje máre , aru mu̶je toroju̶ve tebe boje ṹ̶pe ũ̶i toroju̶ve teijãravu̶are caiu̶ju̶a coapa , caivu̶ aviáva coapa , aru sábadore máre caisumana coapa .
66007015	Faith	Que baru núrivʉbu Jũ̶menijicʉ jabocʉi dobarõ mearo jipocai . Memecaivʉbu ṹ̶re ũ̶i cũ̶rami jívʉi jãravʉre aru ñamine máre . Ñai dobacʉ jabocʉi dobarõ mearo coricacarõra jã́ri corecʉyʉme náre ũ̶i cʉe boje náque .
44020010	Description	Ʉbenita Pablo jõd̶ari yaiyú̶ bácʉi baju bácarõre tucʉnʉri , narióñʉ arejame apevʉre : — Cuecumamejara . Apʉcʉbe cojedeca , arejame Pablo .
55002010	Faith	Que baru napivʉ yʉ caiye iye ñájiyede náre boje , ina Jũ̶menijicʉi beoimarare , Jesucristo ũ̶i mead̶aquiyepe ayʉ náre máre , ne cʉrãjiyepe ayʉ ṹ̶que ũ̶i cʉrõ pʉeno mearo cavarõi cainʉmʉa .
60005014	Recommendation	Me jacoyʉjarã mʉja mʉjevʉre , mʉje jivare nuri , mʉje Jũ̶menijicʉ jina mae boje . Caivʉ mʉja cʉrivʉ Jesucristoque cũinávʉpe me cʉjarã cãrijimevʉva . Quénoramu .
49005021	Recommendation	Pued̶arĩ jápiajarã mʉja mʉje bajumia , mʉje pued̶aiye boje Cristore .
61003017	Recommendation	Mʉja , ji ʉmara , javede majivʉ mʉja diede . Que baru me jã́jara ina põeva Jũ̶menijicʉre jʉ abevʉre , ne jʉjovabenajiyepe aivʉ mʉjare ne bueiye jãve ãmeque , mʉje vainí tʉrĩ bíjabenajiyepe aivʉ mʉje jʉ aiyede jarʉvarĩ .
51003018	Recommendation	Mu̶ja , ũ̶mu̶cu̶rivu̶ , ju̶ ajarã mu̶jemarepacu̶re ũ̶i coyu̶iyede mu̶jare . Ju̶ aiye jau̶vu̶ mu̶jare ṹ̶re , mu̶je cu̶e boje maje jabocu̶ Cristoque cũinávu̶pe .
54005020	Recommendation	Aru jarajacʉ ṹ̶re caivʉ apevʉ Jesúre jʉ aipõeva ne jã́inoi , ne jidʉrãjiyepe ayʉ d̶arãjivʉ ãmeno ṹ̶pe .
45014013	Recommendation	Que baru ãmeina yávabenajarevʉ majevʉre . Quénora majijarã mʉje ũme mʉja ãmeina teivʉre . Que baru mearo d̶ajarã , mʉjevʉ ne vainí tʉbenajiyepe aivʉ , ne jã́iye boje mʉje ãmeina teiyede .
45002010	Grace	Ʉbenita caivʉ ina põeva mearare , Jũ̶menijicʉ d̶acʉyʉme náre coapa meara baju yópe ũ̶i ʉrõpe . Aru coyʉcʉyʉme náre , “ Mearo d̶aivʉbu mʉja ” . Aru cãrijimevʉva me cʉre d̶acʉyʉme náre máre , judíovare mamarʉmʉre caivʉ jipocamia , aru judíova ãmevʉre máre .
58011034	Violence	Nácavʉ bácavʉ jabova ne jarʉvaicõjeimara mácavʉvacari toabo ʉrabo ãmebo jívʉi , ẽ́imara ãmenejaquemavʉ . Dupini nʉrejaquemavʉ , apevʉ ne totarĩ boarĩ́ jarʉvabenajiyepe aivʉ nácavʉ bácavʉre boaicaroveque . Nácavʉ bácavʉ parʉbevʉ bácavʉre parʉre d̶arejaquemavʉ Jũ̶menijicʉ . Churarava parʉrivʉ tedejaquemavʉ nácavʉ bácavʉ . Aru nácavʉ bácavʉ apenoa joborõacavʉ bácavʉ ne ñavaranʉiyede ne oteiye báquede jẽiyede aru ne oteiãimarare máre , ina ñavaivʉ bácavʉre cujurĩ copaide d̶arejaquemavʉ ne joborõita . Nópe d̶arejaquemavʉ na mácavʉ ne jʉ aiye báque boje Jũ̶menijicʉre .
48006017	Faith	Yʉrecabu cʉvacʉ ji churiá báquede ji bajui , ji memecaiye boje Jesúre . Que baru yo jipocare ina Jesucristore jʉ aivʉre cãrijovaivʉ chĩore d̶abejarãri yʉre .
66018021	Violence	Dinʉmʉre cũinácʉ ángele parʉcʉ cũinábo cũ̶rabo ʉrabore , oteiyabeare cũ̶oibope paibore , ĩni dʉvarĩ jarʉvame jia ʉrad̶ai . Yópe arĩ , coyʉáme : — Yópe bíjaino maquiyébu no ĩmaro ʉrarõ Babilonia ãmicʉrõ . Bʉojarĩ jã́menamu cojedeca cainʉmʉa .
65001020	Faith	Ʉbenita mʉja , jívʉ , ji ʉmara , parʉre d̶ajarã mʉje ũmei mʉje Jesucristore jʉ aiyeque me , Jũ̶menijicʉi majide d̶aiye báquede majare ũ̶i yávaiye méne , maje meara marajiyépe ayʉ jaʉbevʉva ũ̶i jã́inoi . Aru jẽniajara Jũ̶menijicʉre ñai Espíritu Santoi cad̶ateinoque .
45012002	Recommendation	D̶abejarã mʉja yópe ijãravʉcavʉ Jũ̶menijicʉre jʉ abevʉ ne d̶are nʉiyepe . Quénora Jũ̶menijicʉre oatʉvaicõjejara mʉja , cʉvarãjivʉ mamaũmene aru mʉje dápiaino mamarore máre mʉja coapa . Que teni mʉja bʉojarãjaramu majidivʉ Jũ̶menijicʉi ʉrõre mʉje d̶arãjiyede . Aru Jũ̶menijicʉi ʉrõ mearomu , torojʉre d̶aino , aru ye jaʉbenomu .
46015009	Sin	Yʉrecabu caivʉ Jesús ũ̶i yávaiye méne beorĩ coyʉicõjeimara ne cãchinocacʉpe páyʉ baju . Ji cujurĩ , boarĩ́ , ñájine d̶aiye báque boje Jesúre jʉ aipõevare , Jesús beobejebu yʉre , ji coyʉquiyepe ayʉ ũ̶i yávaiye méne .
62002015	Recommendation	Ʉbejarã mʉja iyede , ijãravʉcavʉ Jũ̶menijicʉre jʉ abevʉ ne ʉede . Aru ʉbejarã yo ijãravʉcarõ cũiquínore máre . Ñai ʉcʉ baru ijãravʉre aru ijãravʉquede máre , ñai bʉojabebi ʉcʉ majepacʉ Jũ̶menijicʉre .
45002001	Sin	Mʉ ayʉ baru apevʉ ne borore , “ Ñájiye jaʉvʉ náre ne ãmeina teiye boje ” , arĩ bʉojabevʉ “ Ãmeina d̶abevʉ yʉ . Que baru ñájiye jaʉbevʉ yʉre ” . Mi coreóvaiyede apevʉ ne ãmeina teiyede , mʉ máre põecʉrecabu . Que baru napedeca ãmeina d̶ayʉbu mʉ . Que baru “ Apevʉre ñájiye jaʉvʉ ” mi aru , “ Yʉre máre ñájiye jaʉvʉ ” , ainopebu no .
48002009	Description	Que baru ina Jesúre jʉ aipõevai jabova parʉrivʉ põeva ne jã́iyede ; Santiago , Pedro , aru Juan máre ; coreóvaima dinʉmʉre Jũ̶menijicʉ yʉre memecare d̶ayʉre ṹ̶re , ũ̶i mearo d̶acaiye boje bojecʉbeda . Que baru caivʉ ñʉja , ina yóbecʉrã aru yʉ Bernabémaque , pʉrʉjẽcarã ñʉje baju , jã́d̶ovarajivʉ ne jʉ aiyede ñʉje memecaiyede Jũ̶menijicʉre . Que teni ñʉje ũme cũinátʉrʉ , “ Pablo Bernabémaque buenajarama Jesús ũ̶i yávaiye méne judíova ãmevʉre . Aru Santiago , Pedro , aru Juan máre buenajarama Jesús ũ̶i yávaiye méne judíovare ” , acarã ñʉja .
43019023	Description	Jesúre jocʉcʉjaravena pẽvari jẽori bubarĩburu yóboi , ũ̶i doiye báquede coapa ĩnejaima ṹ̶re pẽvaivʉ bácavʉ . Yóvaicʉvaivʉ barejáima na . Que baru náre coapa ĩnejaima . Ʉbenita dicaje pʉenocacaje nareimea cʉbecajede coapavaiyʉbedejaima na .
45002021	Sin	¿ Mʉja bueivʉ apevʉre , aipe teni d̶abevʉrũ̶ mʉja yópe mʉje bueiyepe ? Mʉja “ Ñavamejara ” aivʉvacari apevʉre , mʉja máre ñavad̶avʉ mʉja .
46006019	Faith	Jãve ñai Espíritu Santo cʉcʉbe maje baju jívʉi . Que baru maje bajubu yópe Espíritu Santoi cũ̶ramipe . Jũ̶menijicʉvacari darorejaquemavʉ ṹ̶re , ũ̶i cʉquiyepe ayʉ majaque . Que baru majavacari majare uparivʉ ãmevʉ aru d̶aicõjemevʉ maje bajure . Quénora ñai Espíritu Santorecabe majare upacʉ aru d̶aicõjeñʉ maje bajure . ¿ Diede coreóvabenarʉ mʉja ?
47005014	Grace	Memecaivʉbu mʉjare Cristoi ʉre d̶aiye boje ñʉjare , ũ̶i ʉe boje caivʉ põevare . Maja coreóvaivʉbu cũinácʉ ũ̶mʉ , maje jabocʉ Cristo , yaicáyʉ bácʉre caivʉ põevare boje . Caivʉ põeva yaijʉrorivʉreca ne ãmeina teiye boje , Cristorecabe yaicáyʉ bácʉ majare boje . Que baru caivʉ ṹ̶re jʉ aivʉ yópe yaivʉ bácavʉpebu maje cʉede ṹ̶que cũinávʉpe .
58003001	Faith	Caiye iye ji coyʉiye mʉjare jãvetamu . Que baru mʉja , jívʉ , Jesúre jʉ aivʉ aru Jũ̶menijicʉ jina , yú̶pe paivʉbu mʉja máre Jũ̶menijicʉi cutuimara mácavʉ ũ̶ jina márajivʉ , cʉvarãjivʉ caiye iye Jũ̶menijicʉi mearo d̶acaquiyede majare . Me ãrʉjara mʉja Jesúre , coreóvarãjivʉ me aipe ãrojacʉre aru aipe d̶ayʉre . Ʉ̃́recabe Jũ̶menijicʉi daroimʉ mácʉ , ṹ̶re coyʉcaipõecʉ , majide d̶acʉyʉ majare Jũ̶menijicʉ “ Que d̶arãjare ” ũ̶i aino mácarõre majare . Aru sacerdotevare jaboteipõecʉbe ũ̶ , cad̶atecʉyʉ majare , maje d̶arãjiyepe ayʉ yópe maje aiyepedeca , maje jʉ aiye boje Jũ̶menijicʉre .
44020035	Recommendation	Cainʉmʉa yʉ jã́d̶ovaivʉ mʉjare yópe ʉrarõ memeino jaʉrõre mʉjare , mʉje cad̶atenajiyepe ayʉ ina cõmaje ãrojarivʉre . Aru dápiajarã cainʉmʉa yópe Jesús ũ̶i aiye báquepe : “ Ñai jíyʉ apecʉre torojʉcʉtame ñai jacopʉyʉ pʉeno ” , arejame Pablo .
58013004	Recommendation	Caivʉ põeva pʉrʉbʉoivʉ ne pʉrʉbʉoiyede , ne cʉede yópe cũinávʉpe , pued̶ajarãri ne baju . Que teni ũ̶mʉva nomicʉrivʉ cʉbejarãri apecoque aru nomiva ũ̶mʉcʉrivʉ máre cʉbejarãri apecʉque , némarebʉcʉvare jarʉvarĩ . Caivʉ ina pʉrʉbʉoivʉ apevʉque cʉrivʉ baru , némarebʉcʉvare jarʉvarĩ , Jũ̶menijicʉi ñájine d̶aimara márajivʉbu na . Aru caivʉ ina nomicʉbevʉ nomióque cʉrivʉ baru aru ũ̶mʉcʉbevʉ máre ũ̶mʉque cʉrivʉ baru , Jũ̶menijicʉi ñájine d̶aimara márajivʉbu na máre .
43020005	Description	Ʉ̃i jipocai earĩ , dicobe jívʉi nacachini jã́ridurejacacʉ yʉ . Nore Jesús bácʉre ne cũmaicajea báquede , nore paraicajeare , jã́rejacacʉ . Ʉbenita dicobede ecorĩ nʉmenejacacʉ yʉ .
66016018	Description	Dinʉmʉmia yaroino cojiteavũ̶ , yávaino bʉjinoque jápurateavũ̶ , õpo tʉavũ̶ , aru ʉrarõ joborõ cújiavũ̶ máre . No joborõ cújino ãmeno mateávũ̶ cainoa apenoa joborõ cújinoa pʉeno , Jũ̶menijicʉi põevare cʉed̶ainʉmʉ mácarõmiata .
66019010	Faith	Ji jápiaiyede ũ̶i nópe aiyede , ñʉatutacacʉ yʉ ũ̶i cʉboba yebai , mearore jíyʉrĩduyʉ ṹ̶re . Ʉbenita yópe arĩ , mearore jícõjemeteame ũ̶ yʉre : — Que d̶abejacʉ mʉ . Yʉ máre memecayʉbu Jũ̶menijicʉre mʉpedeca aru mívʉpe páyʉ máre , ina coyʉivʉ Jesús ũ̶i yávaiyede jãvene dajocabevʉva pʉ apevʉ náre boarĩ́ jarʉvaiyeta . Que baru mearore jíjacʉ mʉ maje jabocʉ Jũ̶menijicʉre cũinácʉrata , áme yʉre . Ñai Espíritu Santo majide d̶aibi caivʉ ina Jũ̶menijicʉi yávaiyede coyʉcaipõevare , ne coyʉrãjiyepe ayʉ Jesús ũ̶i yávaiyede jãvene .
46002010	Grace	Iye ũ̶i mearo d̶acaquiyede ũ̶i Espíritu Santoque coreóvare d̶aibi majare . Ñai Espíritu Santorecabe majicʉ caiyede . Pʉ caiye iye Jũ̶menijicʉi ʉrarõ majiéde majibi ũ̶ .
50002029	Recommendation	Que baru toroju̶rivu̶ copu̶ etajarã ṹ̶re me , yópe Jesúre ju̶ aipõeva ne copu̶ etaiye jau̶épe apevu̶ névu̶re . Pued̶ajarã caivu̶ ṹ̶pe paivu̶re .
51003020	Recommendation	Mu̶ja , ju̶ed̶ova , cainu̶mu̶a ju̶ ajarã me mu̶jebu̶cu̶vare ne coyu̶iyede mu̶jare . Jũ̶menijicu̶ toroju̶rĩ jã́imi mu̶je ju̶ aiyede náre .
47001012	Faith	Apevʉ mʉjacavʉ ʉbenina arĩ coyʉrĩduyama ñʉjare borocʉrivʉre . Ʉbenita ne que aiye jãve ãmevʉ . “ D̶ad̶avũ̶ maja yópe d̶aiye jaʉrõre majare Jũ̶menijicʉi jã́inore ” , ñʉje arĩ dápiaiyeque torojʉrivʉbu ñʉja . Coreóvaivʉbu ñʉja cainʉmʉa d̶arĩ cõmajivʉre jʉjovabevʉva aru ãmeno cʉbevʉva máre põeva Jesúre jʉ abevʉque aru pʉeno baju mʉja Jesúre jʉ aipõevaque . Ʉbenita nópe d̶arĩ bʉojabevʉ ñʉja ñʉje majiéque . Quénora Jũ̶menijicʉ nópe d̶arĩ majide d̶aibi ñʉjare bojecʉbeda ũ̶i parʉé majiéque .
43014021	Faith	Ácʉ põecʉ ji d̶aicõjeiye caiyede jʉ arĩ d̶ayʉ , ṹ̶recabe yʉre ʉcʉ . Aru ñai yʉre ʉcʉ , ṹ̶recabe jipacʉi ʉquimʉ . Yʉ máre ṹ̶re , yʉre ʉcʉre , ʉcʉyʉmu . Aru ji bajure jã́d̶ovacʉyʉmu ṹ̶re , arejame ñʉjare Jesús .
51002023	Sin	Põeva iye d̶aicõjeiyede d̶aivu̶ Jũ̶menijicu̶re pued̶aivu̶pe ãrojariduivu̶bu . Aru jã́d̶ovariduivu̶bu ne baju apevu̶ ne cãchinocavu̶re . Ñájine d̶arĩ ne bajure , Jũ̶menijicu̶re pued̶aivu̶pe teniduivu̶bu na . Iye ne d̶aiyede yópe ne d̶aicõjeiyepe majidivu̶pe teniduivu̶bu . Ʉbenita iye d̶aicõjeiyede d̶aivu̶vacari , ye dajocabema ne baju ãmeina d̶aiyu̶ede . Que baru iye d̶aicõjeiye ne cu̶vae bojecu̶bevu̶ náre .
64001006	Recommendation	Ina copaivʉ bácavʉ mʉre jocarĩ coyʉyama mi borore yui Jesúre jʉ aipõeva ne jápiaiyede . Coyʉyama aipe mi cad̶ateiyede náre mi ʉe boje . Aru ne copaiyede mi yebai , cad̶atejacʉ náre cojedeca náre jaʉéde . Que teni mʉ me bʉojare d̶aquijivʉ náre yópe Jũ̶menijicʉi ʉrõpe , ne curãnʉiyede .
55002023	Recommendation	Jápiarĩ ad̶abejacʉ mʉ apevʉ ne coyʉiyede bojecʉbede aru ãrʉmene máre . Nácapũravʉ me coreóvabevʉbu . Ʉbenita mú̶capũravʉ coreóvaivʉ põeva yópe coyʉivʉre , jararĩ bú̶rãjivʉre .
47003018	Faith	Caivʉ maja cʉrivʉbu yópe cʉvaepe maje jiva cũmamejivare , maje coreóvaiye boje Jesucristore . Yópe jivarʉ cũmamedʉ jã́d̶ovaiyepe ñai jã́ñʉ nore , nopedeca maja jã́d̶ovaivʉbu apevʉre maje jabocʉ Cristo meacʉ baju ũ̶i parʉé pẽoiyede maje cʉvaede , maje cʉe boje ṹ̶que cũinávʉpe . Maje coreóvare nú̶vaiyede ṹ̶re cainʉmʉa , oatʉvare nú̶vaivʉbu maja , ṹ̶pe tenajivʉ . Jãravʉa coapa pʉeno baju jã́d̶ovare nú̶vaivʉbu ũ̶i parʉé pẽoiyede maje d̶aiyeque . Nópe d̶are d̶ayʉbe maje jabocʉ Cristo . Ʉ̃́recabe ñai Espíritu Santo .
58009014	Grace	Ʉbenita Cristoi jive meiye báque boje ũ̶i yainʉmʉ mácarõre majare boje , pʉeno baju cad̶ateibi majare Jũ̶menijicʉi jã́inore . Me jã́ñʉme majare Jũ̶menijicʉ Jesúi jiveque ũ̶i jã́iye báque pʉeno majare ãimara ne boaimara mácavʉ ne jive báqueque . Ñai Espíritu Santo cainʉmʉa cʉcʉ parʉre d̶arejaquemavʉ Cristore , ũ̶i boarĩ́ jarʉvaicõjequiyepe ayʉ ũ̶i mauvare ũ̶i bajure . Que baru Jũ̶menijicʉre jícaiyepe tedejaquemavʉ ũ̶ . Ye ãmeno cʉbecʉva aru jaʉbecʉva ũ̶i baju jícarejaquemavʉ Jũ̶menijicʉre majare boje . Yópe joaiyepe docʉcʉede ocoque , nopedeca Cristo joaiyepe d̶aibi maje ãmeũmene aru maje dápiaino ãmenore maje ãmeina teiye boje , “ Boropatebevʉ yʉ ” maje arĩ dápiarĩ bʉojarãjiyepe ayʉ . Iye maje ãmeina teiye boje maja coavajʉromaramu Jũ̶menijicʉre jarʉvarĩ . Nópe d̶acarejaquemavʉ Cristo majare boje , maje mearore jíni memecarãjiyepe ayʉ ñai Jũ̶menijicʉ apʉcʉre .
44011017	Grace	Jãvemu . Ñʉja judíova ñʉje jʉ aiyede Jesúre , Jũ̶menijicʉ daroáme ñʉjare ñai Espíritu Santore . Nopedeca d̶aibi ina judíova ãmevʉ ne jʉ aiyede Jesúre . Jũ̶menijicʉ daroibi ñai Espíritu Santore náre máre . Que baru , ¿ aipe d̶aiye jaʉri yʉre ? Jũ̶menijicʉre ũ̶i ʉrõre d̶aicõjemecʉ bʉojabevʉ yʉ , arejamed̶a Pedro ina judíovare .
49004030	Faith	Chĩore d̶abejarã mʉja ñai Espíritu Santore , Jũ̶menijicʉ jicʉre . Ʉ̃́recabe jã́d̶ovañʉ majare Jũ̶menijicʉ jinava . Ñai Espíritu Santoi cʉe boje majaque , majidivʉbu jãve cũinájãravʉ daquijãravʉ baquinóre meara baju jaʉbeda d̶acʉyʉre majare yópe Jũ̶menijicʉi ʉrõpe .
66003003	Recommendation	Que baru ãrʉre nʉjacʉ caiye iye Jũ̶menijicʉi yávaiye méne ne bueiyede mi jápiaiye báquede . Diede jápiarĩ , jʉ arĩ , chĩori oatʉvajacʉ mi d̶aiyede , jarʉvacʉyʉ mi ãmeina teiyede . Ʉbenita nópe mi d̶abedu , dacʉyʉmu yʉ mi yebai yópe ñavaipõecʉ ũ̶i daiyepe . Aru ji daquinʉmʉre ye majibecʉyʉmu mʉ .
62003007	Recommendation	Mʉja , jímajinape paivʉ , jápiabejarã ina jʉjovaiyʉrivʉre mʉjare . Ñai d̶ayʉ mearore cainʉmʉa d̶aibi mearore yópe Jesucristovacari ũ̶i d̶aiyepe mearore cainʉmʉa .
62004001	Recommendation	Mʉja , jívʉ , ji ʉmara , jʉ abejarã mʉja caivʉ ina “ Jũ̶menijicʉi Espíritu coyʉicõjeimi yʉre ” aivʉre . Ʉbenita cainʉmʉa cũinácʉ põecʉ “ Que aibi Jũ̶menijicʉ ” ũ̶i arĩ coyʉru , jã́ri coreóvajarã mʉja ũ̶i coyʉiyede , majinajivʉ jãve Jũ̶menijicʉi Espíritu dápiaicõjeñʉre ṹ̶re . Que d̶ajarã mʉja , obedivʉ Jũ̶menijicʉi yávaiyede coyʉcaipõevape teniduivʉ ne daiye boje . Coyʉre cuivʉbu “ Jũ̶menijicʉi yávaiyede coyʉcaipõecʉbu yʉ ” arĩduivʉ . Ʉbenita borocʉrivʉbu na .
44013038	Grace	’ Mʉja , jívʉ , jãve majijarã mʉja ñʉje coyʉiyede mʉjare Jũ̶menijicʉi yávaiye méne , ũ̶i ãrʉmetequiyepe aivʉ ãmeina teiyede , Jesús ũ̶i yaiye báque boje majare boje . Majijarã . “ Mi ãmeina teiye cʉbevʉ ” , acʉyʉme Jũ̶menijicʉ caivʉ ina jʉ aivʉre Jesúre . Ʉbenita põeva ne d̶aiyʉru Jũ̶menijicʉi d̶aicõjeiyede ũ̶i coyʉiye báquede Moisés bácʉre , “ Mi ãmeina teiye cʉbevʉ ” , abecʉyʉme náre .
50003001	Recommendation	Mu̶ja , jívu̶ , cu̶jarã toroju̶rĩ maje jabocu̶ Jesucristoque cũinávu̶pe . Ʉetu̶bevu̶ toivaicõjeivu̶ yu̶ apecu̶re bedióva cojedeca iye majié jau̶éde mu̶jare , mu̶je cu̶rãjiyepe ayu̶ me Jesucristoque .
46011034	Recommendation	Ácʉ põecʉ mʉjacacʉ ãvʉé yaiyú̶ baru , ãjacʉrĩ ũ̶i cũ̶rami jívʉi , Jũ̶menijicʉi ñájine d̶abequiyepe ayʉ mʉjare , mʉje ãmed̶aiye boje mʉje cójijivaiyede . Apede mʉje jẽniari jã́iye báquede yʉre , majicacʉyʉmu mʉjare aipe d̶aiye jaʉrõre ji eaquiyede mʉje yebai .
43018031	Description	Pilato arejame náre : — Dinʉmʉ ṹ̶re nʉvari , majijarã mʉje baju . Mʉje d̶aicõjeiyepedeca coyʉjarã ṹ̶re aipe ñájicʉyʉre , ũ̶i bojed̶aquiyepe aivʉ ũ̶i ãmeno d̶aiye báquede , arejame . Nácapũravʉ arejaima : — Mʉja Romacavʉ ñʉja judíovare boarĩ́ jarʉvaicõjemevʉ põevare . Que baru ṹ̶re boarĩ́ jarʉvaivʉ bʉojabevʉ ñʉja , arejaima .
46012031	Faith	Apeno Jũ̶menijicʉi majiécarõque pʉeno baju cad̶ateivʉbu maja apevʉre . Que baru pare ʉjarã mʉje cʉvarãjiyede iye pʉeno baju bojecʉe majiéde .
58007026	Description	Que baru Jesúrecabe ñai sacerdotevare jaboteipõecʉ majare jaʉmʉ baju . Ʉ̃́recabe d̶ayʉ caiye ṹ̶re jaʉéde , cad̶atecʉyʉ majare . Ʉ̃́recabe meacʉ baju Jũ̶menijicʉi jã́inoi aru ye d̶abecʉ ãmenore , Jũ̶menijicʉi ʉbenore . Ʉ̃́recabe ye ãmeno cʉbecʉ aru cʉcʉ bácʉvacari ijãravʉi ãmeina teipõevaque ye ãmeina tebecʉ cainʉmʉa . Ʉ̃́recabe Jũ̶menijicʉi jãmʉóimʉ mácʉ pʉ cavarõ mearoi ũ̶i cʉrõita aru ũ̶i parʉre d̶aimʉ caivʉ pʉeno .
50004013	Faith	Cristoi cu̶e boje yú̶que cũinávu̶pe , paru̶re d̶aibi ji ũmei . Que baru caijĩe vaiyede yu̶re , d̶aiye majivu̶ yu̶re jau̶éde yópe ũ̶i u̶rõpe .
52004003	Recommendation	Yópe ʉbi ñai Jũ̶menijicʉ : Mʉja coapa d̶ajarã mearore cainʉmʉa . Meara májara mʉja , ũ̶ jina mʉje teiye boje . Que baru cʉbejarã mʉja apevʉque mʉjemarebʉcʉva ãmevʉque .
51004002	Recommendation	Ʉetu̶bevu̶va coyu̶jarã Jũ̶menijicu̶que . Mu̶je coyu̶iyede ṹ̶que , me dápiajarã mu̶je coyu̶iyede aru toroju̶ede jíjarã ṹ̶re .
44007029	Description	Ʉ̃ mácʉi que aiyede jápiayʉ Moisés bácʉ , dupini nʉrejaquemavʉ Egipto ãmicʉrijoborõre jocarĩ . Apeno joborõ , Madián ãmicʉrijoborõi , earĩ cʉrejaquemavʉ . Jímarepaco báco , dijoborõcaco , jʉed̶ocʉvarejaquemavʉ pʉcarã ũ̶mʉvare .
46011007	Description	Ʉbenita ũ̶mʉre cũmaiye jaʉbevʉ ũ̶i jipobʉre ũ̶i jẽniaiyede Jũ̶menijicʉque aru ũ̶i coyʉcaiyede ũ̶i yávaiyede apevʉre máre , Jũ̶menijicʉi cʉed̶aiye báque boje ṹ̶re ṹ̶pe ãrojacʉre . Que baru ũ̶mʉvarecabu cʉrivʉ , mearore jínajivʉ Jũ̶menijicʉre . Diede jã́d̶ovaivʉbu ne cũmameque ne jipobʉre . Ʉbenita nomivarecabu cʉrivʉ , mearore jínajivʉ némarepacʉre . Diede jã́d̶ovaivʉbu ne cũmaiyeque ne jipobʉre .
51003015	Faith	Cristo cãrijimene d̶aibi mu̶jare . Aru Jũ̶menijicu̶ cuturĩ epeibi mu̶jare , mu̶je cu̶rãjiyepe ayu̶ cũinávu̶pe cãrijimevu̶va . Que baru cãrijimena cu̶re nu̶jara mu̶ja . Aru cainu̶mu̶a toroju̶ede jíde nu̶jara Jũ̶menijicu̶re .
58002010	Grace	Jũ̶menijicʉ ye jaʉrõ cʉbecʉ d̶arejaquemavʉ Jesúre , ũ̶i ñájiyede earĩ bʉojare d̶acʉyʉ obedivʉ põevare Jũ̶menijicʉi mára márajivʉva , maje cʉrãjiyepe ayʉ meara baju Jũ̶menijicʉque cavarõ mearo ũ̶i cʉrõi . Meavʉ Jũ̶menijicʉ , ñai cʉed̶ayʉ bácʉ caiyede ũ̶i cʉvaiyʉe boje diede , ũ̶i eavare d̶aiye majare ũ̶i yebai ũ̶i mára márajivʉva . Aru Jesúrecabe yópe ũ̶i jipocateni nʉvaiyepe ũ̶i mái , majare mead̶arĩ eare d̶ayʉ caiye iye Jũ̶menijicʉi mearo d̶acaquiyede majare .
59004001	Sin	¿ Aipe teni boaivʉba mʉja mʉje baju ? Aru , ¿ aipe teni ãd̶amateivʉba mʉja mʉje baju ? Mʉje ãmeina d̶aiyʉe yópe maucʉvaepebu mʉje dápiaiyeque .
46005001	Sin	Jápiaicacʉ yʉ , “ Ãmeno baju d̶aibiya cũinácʉ Jesúre jʉ aipõecʉ Corintocacʉ ” , põeva ne coyʉvarede yʉre . “ Cʉbiya jípacʉi márepaco bajuque ” , ávaivʉbuya . Pʉeno baju ãmenotamu no . Que baru ina Jũ̶menijicʉre jʉ abevʉvacari pare ʉbema põeva ne d̶aiyede yópe ũ̶i d̶aiyepe .
46010013	Faith	Apenʉmʉa mʉja “ Yópe d̶aiyʉvʉ yʉ ” , arĩ dápiad̶avũ̶ . Ʉbenita nópe d̶aivʉ baru , ãmeina tejebu mʉja . Nópe vaiyavũ̶ caivʉ põevare . Ʉbenita Jũ̶menijicʉ , ñai d̶ayʉ cainʉmʉa yópe ũ̶i aiye báquepedeca , ye dajocabebi mʉjare , mʉje vainí tʉrãjiyepe ayʉ mʉje ãmeina d̶aiyʉe boje . Quénora parʉre d̶acʉyʉme mʉjare mʉje ũmei , mʉje ãmeina d̶abenajiyepe ayʉ . Parʉre d̶acʉyʉme mʉjare mʉje ũmei , mʉje napinajiyepe ayʉ caiye iye mʉje ãmeina d̶aiyʉede , d̶abevʉva diede . Que teni mʉja vainí tú̶jʉrorivʉ bácavʉre vaidé d̶acʉyʉme ũ̶ mʉje ãmeina d̶aiyʉede jocarĩ .
44020029	Violence	Coreóvaivʉ yʉ ji etarĩburu yóboi mʉjare jocarĩ , apevʉ darãjivʉre mʉje jẽneboi yópe ãimara macarõcavʉ jijecʉrivʉ ne daiyepe ovejava jẽneboi . Borocʉrãjarama mʉjare , mʉje dajocarãjiyepe aivʉ mʉje jʉ aiyede Jesúre .
53001004	Faith	Que baru ñʉjacapũravʉ torojʉrĩ coyʉivʉbu mʉje borore apeno ĩmaroacavʉ Jesúre jʉ aipõevare . Coyʉivʉbu mʉje pare napiyede aru mʉje jʉ aiyede Jesúre , apevʉ ne maucʉvaede mʉjare aru ne ñájine d̶aiyede máre mʉjare .
62004012	Faith	Ácʉ põecʉ Jũ̶menijicʉre jã́ñʉ mácʉ cʉbebi ũ̶ . Ʉbenita maje ʉru majevʉre , Jũ̶menijicʉ yóvaibi majare cũinávʉpe , cũinátʉrʉ maje ũmei . Que teni coreóvaivʉbu me aipe d̶arĩ bʉojarĩ ʉrivʉ Jũ̶menijicʉre jãve .
48001001	Description	Yʉ , Pablo , Jesús ũ̶i yávaiye méne beorĩ coyʉicõjeimʉtamu . Põecʉ ãmemi beorĩ daroyʉ yʉre epecʉyʉ Jũ̶menijicʉi yávaiye méne coyʉipõecʉva . Quénora Jesucristorecabe , majepacʉ Jũ̶menijicʉque , ñai nacovañʉ mácʉ Jesucristore yainore jarʉvarĩ , epeyʉ bácʉ yʉre coyʉcʉyʉva ũ̶i yávaiye méne .
