50003003	Faith	Tagaya Anumaya Koti Avamuteti Anumaya Koti agia alisaga nehunafe Anumaya Kotina tama nafanea mainone . Yisasi Kalaisia hulatenea yafena aluya huta musena nehuta Taugafama laga hu-malenona yamoa taya ohugahie . huta tametitia nehune .
62003023	Faith	Anima akave malesuna kahegi kemoa mage huno nehie Nagai nafanea Yisasi Kalaisia hulamatenea yafena havitama tamakupi maletama tamametiti hutetama mama Yisasima hu-mainea kea akave maletama nagoke nagokemo-gatama nelamafu-gamifena tamahau tamayamopafi tamahaino . huno hu-maineane .
66013011	Description	Nagaya YoniꞋna agogeno nago kefo afai afumoꞋa * mopamo agusafiti evaꞋyi humaine . Ani kefo afai afumo anupina tole avela , sipi sipi nafaꞋnemo ave kana ave haneanagi agema aiyana tusiꞋa puku pukumo age kana huno agea aimaine .
46014020	Recommendation	NafuꞋnagana-gatama kefo yama hisaya yafena nute nafaꞋnemoꞋya nehaviya amakesamo avamete hu havitama maiho huꞋna nehuanagi alopa veaꞋmoꞋya nehaviya amaku amakesamo avamete havitama kanaleꞋya hutama ma ma Alu Aotage AvamuꞋmoꞋa tokiyama tamamisia kema tamahapauva kea fako hutama nafaꞋnemoꞋya nehaviya avamete tamaku tamakesa ohaviho .
59005013	Recommendation	Nagoamo-gatamilema kana yama falote hisigetama Anumaya Kotitega ke hutama havigeho . Nagoamo-gamina amakuamoa musema hisigeya Anumaya Koti agia yagamefiti alisaga huya maisae .
58012012	Recommendation	Tamayamoma kalake kisigetamahena alipi hu-linetama aliyana aliho . Tamaleya yama nelama-kesigetamahena ayepi hu-mainetama tokiyaage hutama vaiyeho .
60001017	Recommendation	Anumaya Kotia kaiyeke humatesia kanafina amakima hanea vayamogami amakile fako hu oamategahigi tagaiti agoma hu-mainona auava yatileti nagoke avamete huno kaiyekea hu-lategahie . Tamakaya ani kanomofena Nelafae hutama nunamupitila havinegayanagi ma mopalema mainaya mopa agola maisaya mopa omalenea yafe Anumayamofena kolia nehutama fatago hutama vaiyeho .
58010036	Recommendation	Tamamigahianagi ako hutama mai lokiya vaitama mainetama Anumaya Kotina haisia kavakeyama hisayana Anumaya Kotia Ma yama hulamategahue . huno hu lokiya vai-malenea yana hulamategahie .
58011001	Faith	Anumayamofema havita lagupi maleta lametiti hu-mainona yamoa maa humaine Tagaitima tametiti nehuna yana aligahune . Noagona yana haneanagita tamage agegahune . huno humaine .
49004017	Recommendation	Nagaya Anumayatimoene aigamaena mainena nago kea tokiyaage huna tamahapaigahe nehue . Tamakaya nagoene Yisasi kema ohavinaya veamoya afa yafe amakesa havi havi huya nemaiya kavala ohiho .
51002016	Recommendation	Havigu nagoꞋa veaꞋmoꞋya nesaya kavefeꞋene tifeꞋene opa kanaene sapati kanaene maifalu hisaya kanaenefena “ NaꞋa higetama ma kavala nehae . ” huꞋya kaiyekea hu otamatesae .
66007015	Faith	Ani yafe amakaya Anumaya KotiꞋma mainea siamo aulega heti-maineꞋya felugaene kegeꞋene agai agia alisaga nehuꞋya agai aliꞋya neꞋaliyanagino Anumaya KotiꞋa au vaimateno kava yagaimategahie .
44020010	Description	Fali-mainegeno PoloꞋenena lavino mo anu-kilineno mage hie “ Atali talua ohiho . Ago fali-maineanagi eteno haimula neꞋalie . ” huno humaine .
55002010	Faith	Ani yafe mukia Anumaya Kotima huno yogi-malenea veala Yisasi Kalaisiene tokaeya maisagenofena Anumaya Kotia amaku amamena aligatisigeya agola maige maige huya tokiya hale yapi maisaya yafe nagaya naugafa nagata neaigena mailava huna mai lokiya vaina mainoe .
60005014	Recommendation	Mukiamo-gatama tamafu-tamakana-gamifema tamahaisigetamahena tamayana oami aami hiho . Kalaisienema tokaetama mainaya yafe tamaipamoa falu nehinagetama maiho . Kenia male hano hie . Nagaini nagia Pitanae .
49005021	Recommendation	Tamakaya Kalaisife alati maine hutama tamakesa nehavitama agima alisaga nehaya tamafu-tamakana-gamife amaiyaafi maiho .
61003017	Recommendation	Naa hu-maineafe tamakaya nahau-mainea nafunagana-gatama haenagama vayi hisia yafena ago havimainagi kayetama maiho . Havigu kahegi kema aliya neatagayaya veanemoya havige huya tamakaila ali haviya hu-lamatesageno tamametitimoa tokiyaage huno fatago ohuyafenagi tamakaya kayeho .
51003018	Recommendation	Tamakaya aꞋnemogatama anautamimogami kea akave maleho . NaꞋama hisaya yamoꞋa Anumayamo aufina fatago kava nehie .
54005020	Recommendation	Anumaya Koti aliya nealisaya veamoya kefo kavama huge huge hisagetama mukia mono note veamogami amaufi amavale-matetama amaku amakesa alitama fatago hisageya mukia veamoya ageteya koli hisae huna nehue .
45014013	Recommendation	Tafu-taganagamifena “ NaꞋa nehane . ” huta fakoa humateta nagoꞋene havi tagesa havi oꞋamamisune . NaꞋa ohisunana tafu-taganaꞋya tageteꞋya asaga hulaviꞋya kefo kava hisaya yafenagita havi kavala ohisune .
45002010	Grace	Amamigahianagi fatago kavaꞋma nehaya veaꞋnea Anumaya KotiꞋa halemainea tokiyaꞋaene ala amakiene amaipamoꞋa falu hisia yaꞋene amamigahie . Hagoteno Yuta veaꞋmogami amamiteno anileti Yuta vea omainaya veaꞋnenena amamigahie .
58011034	Violence	Nagoamogamina tusia atafi amasaga huya takigahe hayanagi Anumaya Kotia ani ata alisu humaine . Kame vayaamimoya ayaaya naepeleti hamaegahe hayanagi Anumaya Kotia hamaoke hemaine . Amakaila amayamufa omalegeno Anumayamoa ali hetimateteno tokiyaage amayamufa amamigeya ati vayala amanati-mainae .
48006017	Faith	Nagaya Yisasi aliya nealugeya nagoa veamoya nagaima nahae-mainaya nafugula hanegi menia nago kanomoa kana yana onamisie huna nehue .
66018021	Violence	Higeno nagola tokiyaꞋage ensole kanomoꞋa nagola tusiꞋa yafakefa alisaga huteno hagelipi hagaꞋyu hu neꞋataleno mage huno hie ani ala yafakefama hagaꞋyu hutaloa yamoꞋa Anumaya KotiꞋa ani avamete huno ani Papilonia ala kumala , alino tusiya huno ali haviya huteno alino hagaꞋyu hu-talenageno fanane hinageꞋya nagoꞋene veaꞋmoꞋya oꞋagegahae .
65001020	Faith	Naa huya mainagi tamakaya nahau nayamopafi nenahaiya nafunagana-gatama naa kavala ohutama Yisasima hulatenea yafe tusiya huno alu aotage ke hanegi tamakupima malenaya kea atafa hutama tokiyaage higeno Alu Aotage Avamumoa tokiya tamamisigetama Anumayamotega kea hutama havigeho .
45012002	Recommendation	Tamakaya ma mopafi veaꞋmoꞋya nehaya augafa kavala ohutama lamaku tamakesa aiyahae hageno Anumaya KotiꞋa yaufa lamaku tamakesa tamamineafe agaiꞋma nehaiya kavafena havilama hutama havigahae . Ani kavala kanale yane . MukiꞋa yamona ago agaseno kosa hetenea ya hane .
46015009	Sin	
62002015	Recommendation	Ma mopaene mopale hanea yafeene tusia muse hutama agetama tamahayea ohiho . Nagoa veamoyama ma mopafi yafema tusia muse huteya age hamayema hisayana Nefana amakua noamiye .
45002001	Sin	Kefo yama nehaya yafena nagoꞋa veafena “ Lamakaya naꞋa kava nehae . ” hutama nehutama amakaila fako hu neꞋamatagi tamakaiꞋenena aniꞋa kefo kavala nehageno tamakaiꞋenena tamakaya nehie . Tamakaya kaiyeke humataya veamogatama aniꞋa kefo yana ago humainayafe kenonama hisaya kea omalene .
48002009	Description	Monote ala kava vaya mainae . huya humatenaya vayala Yisasina aganaamoa Yemesiene Pitaene Yoniene mani kea haviteya Tamage nehane . Anumayamoa mani aliyana kamiteno kayone yamaaleti kaya nehie . huya hageta tagua ali nagopi maleneta Tanakaya Isaleli vea omainaya veapi aliyana molio . Tagaya Yuta vayapi aliyana aligahune . huya huteya amayana Panapasiene taaminae .
43019023	Description	Ati vayaꞋmoꞋya Yisasina yafaga yosale nili heꞋya asai-maleteꞋya kenaꞋa foꞋa ( 4 ) hetaꞋma vaiꞋya ali-mainae . AyaꞋaya siotaꞋaene aligahe agayana mukiꞋa analegati afetegama lavi-maineana aye ohati siota hane .
45002021	Sin	Alu veaꞋnea humave-nelinanagi naꞋa higeka kagaikaꞋahena ave notine ? “ Musufa yana ohiho . ” huka huhaleka veala hamanepainanagi kagaikaꞋa musufa yana nehano ?
46006019	Faith	Anumaya KotiꞋa agaiꞋa Alu Aotage AvamuꞋa ago tamamigeno tamakupina maineafe tamaugafamoꞋa AvamuꞋmona nomaꞋa haneanagino tamaugafa tamakaitami yana omalene . Ani kea ohavinao ?
47005014	Grace	KalaisiꞋa lagaifena hau ayamopafima nehaiya yamofe huta agai aliꞋyana neꞋalune . NeꞋalita nago yafema havunana nago kanomoꞋa mukiꞋa veafene huno fali-maine . KalaisiꞋa tagaife huno fali-maineafe mukiꞋa veala agaiꞋene tokaeta ago fali-mainone .
58003001	Faith	Kefo yama nohaya nenafugatama Anumaya Kotia ikapinagati agaialega visaya yafe tamakaila ago ke hu-mainegi tamakaya Yisasima hulatenea yafena tamakesa havi havi hutama maiho . Yisasina Anumaya Kotia hutenea kanogino mono notela hagote kava kanoe . * Anumaya Kotiene veanene amunoamifi maineanagita havita lagupi maleta tametitima nehuna kanomofe huhaleta hisune .
44020035	Recommendation	NaꞋa nehuꞋna mukiꞋa yana tamaveliꞋna mage huꞋna humainoe “ AliꞋya alitetama kalima neꞋaliya vayala amaya hiho . ” AnumayatimoꞋa Yisasi humainea kea mage humaine “ VeaꞋmoꞋya nago yama alisayana muse hugahagi afuꞋaganana nago yana amisiana tusiya huno musena hugahie . Aminea yamo muse yamoꞋa ali-mainea muse yana agase-maine . ” huno humainea kea tamakesa havi havi hutama maiho huno humaine .
58013004	Recommendation	Alavemo-gatama maisaya yana kanale yanagi anene munanenena vemogatama amavayu ohigeya ane munanemo-gatama vemogamina amavayu ohiho . Ani kavama hisagenoa Anumaya Koti kaiyekea hulamateno kayo keve tamamigahie .
43020005	Description	Uteno mope hu-maineno ageana Yisasina aye-gasagi-tenaya kenaꞋage hanegeno ageanagi anifinaga hai-ofalene .
66016018	Description	Ani kea nehigeno aulumaya kotino ute ete higeno monagemoꞋa tusiya huno agea neꞋaigeno tusiꞋa imila ali-maine . VeaꞋmoꞋya ma mopafima mainaya kanafina aniꞋa augafa imila aligeꞋya oꞋagenayanagino mukiꞋa imila agaseno tusiꞋa imikefa ali-maine .
66019010	Faith	HigeꞋna nagaya ani ensole kanomo agia alisaga hugahe aiyafi asaga hulaviꞋna nagoꞋya yemaugeno “ AꞋaogi kagaya naꞋa ohuo . Nagaya kagaiꞋene kafu-kaganaꞋyaenena , Yisasi kema havitama atafa hu-linetama huhaletama nehaya veaꞋmogatamaene nagoke aliꞋya neꞋaluna kano mainogi nagai nagia alisaga ohuganagi Anumaya Koti agiꞋage alisaga huo . YisasiꞋma humainea kemoꞋa Anumaya Koti kema huhaleꞋya hisaya tokiya veaꞋmogami amamine . ” huno nahapai-maine .
46002010	Grace	VeaꞋmoꞋya oꞋagageno falakino hanea kea Anumaya KotiꞋa agaiꞋa AvamuꞋaleti taveli-maine . E , Alu Aotage AvamuꞋmoꞋa mukiꞋa yana atiyeno Anumaya Kotina falakino hanea agu agesaene agemaine .
50002029	Recommendation	Tamakaitegama vigetamahena Anumayamoene ailokaetama mainageno etenoma emainea yafena tusia muse hutama agia alisaga hiho .
51003020	Recommendation	NafaꞋnemogatama itatami-afotamimogami kea mukiꞋa havitama akave maleho . NaꞋama hisaya yafena AnumayamoꞋa aluya huno nehaiye .
47001012	Faith	Nagaya Yisasi kema nohaviya veaꞋnene tamakaiꞋene ailokaeꞋna maineꞋna alu aotage kano mainogeno Anumaya KotiꞋa kayone yamaꞋa namigeꞋna fatago huꞋna maineꞋna ma mopale haviꞋyaꞋami hanea vayaꞋmogami ke kana kea nohue . Ani yafena nagesa havuana naguꞋamoꞋa “ Havi kava nehane . ” huno ohia yafena muse nehue .
43014021	Faith	NagoꞋa veaꞋmoꞋya nagai kema haviꞋya akave malenuꞋya nagaifena hamau amayamopafifna hamau-maine . Nagaifema hamau amayamopafima hamau-mainesia veaꞋmoꞋya NenafaꞋa aniꞋa huno amakaifena hau ayamopafina nehaiye . NehaigeꞋna nagaiꞋenena aniꞋa huꞋna nahau nayamopafina nenahaigeꞋna naguꞋa amamisugeꞋya nagaila nage-lama huꞋya nagegahae . ” huno hie .
51002023	Sin	NehageꞋya tamage ani kahegi kea kanale havi haviꞋya nehaya vayaꞋmogami kea kana nehagi amegale kea mage hae “ Tagaitige Anumaya Koti agia alisaga nehuna yaꞋene laugafa alita ohaisuna yaꞋene laugafa aiko neluna kavaꞋene tahaꞋnemae . ” huꞋya hagi ani nehaya kavala taugafa age tahaꞋye hisia yana atalesuna yafe taya ohugahie .
64001006	Recommendation	Nagoama amaya hu-mainana veamoya eteya mono nopi hetiya kagayama amakaima kayone humatenana kavafena me lahapaigeta haviteta tusia musekaa hugi menia Anumaya Kotina haisia kava huka katema visaya veala amaya huo .
55002023	Recommendation	Naa nehuka havi amakesa haviya aifonafo ke huya ke nevaiya mo hu me hu kema nehaya veanenena to okao . Ania augafa kefitila tu hisaya yana falote nehia yafena ago havimainane .
47003018	Faith	Taugosafi aiso humainea yana omalegeno Anumayamo tokiya hale yamoꞋa lagai taugosafi aye halegeꞋya veaꞋmoꞋya nelageꞋya Anumayamo tokiya hale yamaꞋa neꞋagae . AvamuꞋmoꞋa agai avamete veaꞋne maisunafe tagaila alino hapae-lategeta agaiꞋa tokiya hale yana alime alime nehaune .
58009014	Grace	Ani yamoa amega amaugafamona alino kanale humateanagi Kalaisi kolamoa hulatenea yanagino tusiya huno agase-maine . Kalaisia kefo yamaa omaleneanagino agola maige maige nehia Alu Aotage Avamumoa aya higeno agaia augafa hakino Anumaya Kotina amine . Amineafe agaia kolamoa amega taugafaageya aye ohaminegi taguafima hanea kefo yamoa tahaeno falilatesia kefo yana , aye hami-talegeta tagaya menia maige maige huno mainea Anumaya Koti aliya veane mainone .
44011017	Grace	Tagayama Yisasi Kalaisife havita tagupi maleta tametiti humainona yupa Anumaya KotiꞋa Alu Aotage Avamula tamineanagino aniꞋa huno amakaiꞋenena Alu Aotage Avamula amamianagiꞋna nagaya taꞋna Anumaya KotiꞋma aliꞋyama alia aliꞋyana tilesue ? Nagaya maleli-otegahue huno hu-maine .
49004030	Faith	Anumaya Kotia Haenaga tamaku tamamena aligatigahue . huno higetama Ania hugahie . hutama havisayafene huno Alu Aotage Avamula tamakupina tamamigeno mainegi ani Avamumona aipa agata aisia kavala huoateho .
66003003	Recommendation	Ohuneanagitama agoꞋma havi-mainaya mono kehena tamakesamoꞋa hao hinagetama akave maletama kefo yatamihena tamakuꞋa aiyahae hiho . Fae-mainesaletiꞋma he otisayana nagaya ‘ Omegahie . ’ hutama hisaya kanafi musufa vaya kana huꞋna esuaꞋamoꞋna kefo yamo anonatamia me lamamigahue .
62003007	Recommendation	Osi nafaneyaganimoga-tama tamakaya kaye ho . Nagoa veamoya havi kapi visaya yafe aye lamavataga hugahae . Fatago kavama huge huge nehaya veamoya Yisasima fatago kanoma mainea ya huya ani veamoya fatago veane mainae .
62004001	Recommendation	Nenahaiya anaganimogatama ma mopafina kasagoya havigeage amaune vayamoya Anumaya Koti kea alita neone . huya emainagi mukia vayamoya avamumo kema hisaya kea ohavitama hagotetama Anumaya Koti humategeya emainafi ? Hanateti emainafi hutama agelama hutetama amakai kea haviho .
44013038	Grace	Ani yafe nafuꞋnaganagatama havilama hutama haviho ani kanomoꞋma hulatenea kavafe Anumaya KotiꞋa kefo yatamia aigetamateno atalelamatene huta tamahanepaune .
50003001	Recommendation	Nafunagana-gatama nago kene tamahapaisue Anumayamona nafaneyagaa mainagi tusia muse hiho . Etena mani kema kaesua yafena kasalola nonahae . Ani kemoa tamaya hugahie .
46011034	Recommendation	Havigu kefo yama nehutama Anumayamo kaveꞋma nesayana Anumaya KotiꞋa kaiyeke hulamateno fako hulamateyafenagi nagoꞋa veaꞋmogamima tusiꞋa amakatesigeꞋyahena noꞋamifinagati neteꞋya esae . NagoꞋa kea haneanagiꞋna tamakaitegama esua kanafina tamahapaigahue .
43018031	Description	Hageno PailatiꞋa eteno mage huno hama-paiye “ Tamakaya avaletama tamakaitami mono keleti kaiyekea hu-teho tamakaitami yane . ” huno hie . HigeꞋya Yuta vayaꞋmoꞋya mage huꞋya hu-mainae “ Kagaya kamanimoga huka taumono malenana kemoꞋa nago kanoa haegeno ofalino . ” huka hu-mainane * huꞋya hae .
46012031	Faith	AꞋao naꞋa nohunagi tamakaya AvamuꞋmo uhagote hanea muse yana alisayafe tokiyaꞋage huno tamahaisie huꞋna nehue . Menia nagaya nago yamoꞋa lamage huno uhagote hanea auꞋavafe tamahapaigahe hugi haviho .
58007026	Description	Yisasia mono notela hagote kava kanogino alu aotage kano maineanagino nagoke kanoa kefo yamaa omale kanoe . Aguafina oniya yamaa omaleneanagino kefo yama nehaya veala amakasegeno ame anale avaleno ategeno maineafe kanaleya huno taya nehie .
50004013	Faith	Kalaisia nagaila nagu nagesa alino tokiya vainategena agaia tokiyaleti mukia kavala afaa huleasine .
52004003	Recommendation	Anumaya Kotima haiya agu agesamoa maa humaine Kefo kavala ohutama alu aotage vea mainetama lamaugafa age lamahaye hu kavala neataletama afaa maiho . huno humaine .
51004002	Recommendation	Tamakaya nunamuna atafa hutama tokiyaꞋage hu-linetama tamau kalo-kalola ohutama efi efi hutama tamakesa havitama musena hiho .
44007029	Description	Higeno ani kema hia kehe MoseseꞋa faleno Mitiani kotega mo maineno ala aliteteno maineno haenagaꞋa tole ne nafaꞋnelata anatene .
46011007	Description	VemoꞋya Anumaya Kotina amemaꞋa “ Anumayamo agi alisaga hisae . ” huno vemogamina talo hu-maleneafe amanutela aiso ohisagi aꞋnemoꞋya anauꞋamimogami amaki alisaga hisayafe amanutela aiso hisae .
51003015	Faith	KalaisiꞋa tamaipa falu hisia yana tamamineanagino kava hulamatesigetama keꞋa haviho . Nagoke tamaipale maisaya yafe Anumaya KotiꞋa tamakaifena ke higetama ageno “ Nagai naugafa nagoke mainae . ” huno humaine . MukiꞋa yafena mukiꞋa kanafina Anumaya Kotitega muse huteho .
58002010	Grace	Anumaya Kotia mukia yamona aepaa maineanagino mukia yana agaia yakeya hanesiafe talo humalene . Talo hu-malegeno Yisasia tagu tamema aligatisia kanomoa fatago huno ala kano maisia yafe Anumaya Kotia Yisasina tusia agata aiya yana amigeno aliteno ani agatama aiya yateti kasagoya nafaneyagaa amavaleno agaialega amateneanagiya tokiyaage hale yapi maigahae .
59004001	Sin	Tuma nehaya yamoene kema nevaiya yatamimoenena hanateti falote nehie ? Age lamahaye nehaya yamoene kanale tamaku tamakesamoenena tua nehayafe kema vai yatamimoa falote nehie .
46005001	Sin	Nago kema falote higeꞋna havuana Yisasi kema nohaviya veaꞋmoꞋya nohaya kefo yana tamakai veapitila nago veaꞋmoꞋya maitama nehae . Nago kanomoꞋa nefa aꞋene kumai heno alitea tamavagea hageꞋna havi-mainoe .
46010013	Faith	Yagaitama mainesageno kana yano “ Havi yama hiho . ” hunoꞋma ayelamavataga hisia yano falote hisiana ani yana tamakaitamige ayelamavataga nohigi mukiꞋa veala aniꞋa huno ayemavataga nehie . NaꞋa nehianagi Anumaya KotiꞋa huno tokiya vaino humalenea kele tole agesa ohavinegi ani kele akave maleno tamaya hugahie . Ayelamavataga hisigetama “ TokiyaꞋnia omalene . ” hutama hugahe hageno tokiya vaitama maisayafe Anumaya KotiꞋa tusiya huno tamaya huno “ Haegafa katela male viho . ” huno tamave-ligahie .
44020029	Violence	Nagaya nehavue tamataleꞋnama visuana nagoꞋa vayala , kaveꞋage afela kalamo nehia kava huꞋya tamakai amuꞋnopi esayaꞋamoꞋya Yisasife haviꞋya amakupi malenaya sipi sipiyaga ali haviya hugahae .
53001004	Faith	Aniama haya yateti Anumaya Kotina veamoya alitaluma huya maiya amunoamifina maineta tamakai tamakia alisaga nehuta mage huta nehune Yisasife haviya amakupi malenaya yafe Anumaya Kotina kame vayaamoya ali haviya humatayanagi tokiyaage huya amakupima malenaya kemona atafa huya tokiya hulinae . huta hamanepaune .
62004012	Faith	Nagoke kanomoa Anumaya Kotina oagenegi tagayama nelafu-gamifema tahau tayamopafima lahaisigenoa Anumaya Kotia tagaienena tokaeno mainegeno agaima hau ayamopafima hau-mainea yana tagupi tamigeno tokiyaage huno ala hu-maine .
48001001	Description	Nagaya Polonae Aposolo kanomona mani avona kae-malenoe . Yisasi aliya alisua yafe vayamoya hu onatenagi Yisasima fali-mainefiti ali hetitenea Anumaya Kotia , Nelafaene Yisasi Kalaisiene hunataagena Yisasi mono kea huhalena nehue .
58012003	Recommendation	Tamakaila kasalola otamahaeno . Yisasifena tamakesa havi havi hutama maiho . Kefo yama nehaya vayamoya Yisasina kame lagiya kaetayanagi agaya tokiyaage huno mainea yafena tamakesa nehavitama tamahaumanamoa faki faki ohino .
45006005	Faith	Tagaya agaiꞋene aigaꞋmaeta agayama humainea kava huta faliteta aniꞋa huta agaiꞋene aigaꞋmaeta fali-mainefiti hetimainea kava huta hetigahune .
45015010	Recommendation	AniꞋa huno nago kemoꞋa maꞋa humaine “ Tamakaya Yuta vea omainaya anagaꞋmogatama agaiꞋa nofi anagaꞋaene ailalupetama muse hiho . ” huno humaineane .
54004001	Sin	Alu Aotage Avamumoa huhaleno mage huno humaine Anumayamo esia kanamoa eaupama hisiana nagoa Kefo Avamumoya havigema huya ayemavataga hisaya yafe ani vayamogami ke haviteya akave nemaleya Yisasifema haviya amakupi malenaya kea neatalae .
56003001	Recommendation	Mukia veamoya ala Kamani kava vayamogami amaiyaafi maisayafe ali-makafa hisanageya amakai kea akave maleya kanale auava kavakeya hiho .
61003005	Sin	Ehe kanafima Anumaya Kotia agaia hu-malenea kealeti ikana ali falote huteno tina eteno nealino mopa talo hu-malene .
60003018	Grace	Kalaisia fatago kanogino ania huno tagayama Anumaya Kotiene mo lokaeta maisunafene huno kefo kavama hu-mainona anonatia agaya alino fali-maine . Nagoke yupa kanoa fali-maineanagino nagoene eteno ofaligahie . Agaya afaa vayatafa mainegeya hayageno fali-maineanagi eteno heteana avamu maine .
61002021	Sin	Anumaya Koti kamoa fatago humainea kafema ohavinaleasina afaa kanale haleasinagi alu aotage kea agoma haviteya eteya amakavenoma hutayana tusiya huya havi kava maiya nehae .
53003006	Recommendation	Nafunagana-gatama Anumayatimoa , Yisasi Kalaisi agile tagaya tamakaifena tokiyaage ke huta tamahapaigahunagi haviho . Tamakaipitima nagoa tafu-taganaya aliyama oaliya havigu maineya agoma tamamigetama ali-mainaya kea akave nomalae . Aniama hisaya veanenena tamakaya tokaetama omaitama aluale maiho .
45005012	Sin	AtamuꞋa , nagoke kanomo , kefo yana higeno ani kefo yama humainea yamoꞋa ma mopafina falote hutegeno kefo yama humainea kumiꞋamoꞋa haneafe veaꞋma fali yana alifalote higeno mukiꞋa veaꞋmoꞋya kefo yama hayafe anonaꞋamia fali yamoꞋa mukiꞋa veapina emaine .
58011033	Faith	Ani kasagoya vayamoya Anumaya Kotifena haviya amakupi maleya ametiti humainaya yafe kame vayaamia hamae hano humainae . Fatago kavakeya huya veatela kava yagai-mainae . Anumaya Kotia Tamamigahue . huno hu lokiya vai-malenea yana amamine . Nagi nagola kaveage afumo agia Laiyonie afugino Anumaya Kotife haviya amametiti haya vayala hamaeno nakai-talegahe hianagi avaya Anumayamoa alino tukiteneane .
47004009	Faith	Yisasi kema huna yateti ali haviya hulatayanagi AnumayamoꞋa otatalene . MukiꞋa kanafina kaꞋyo kevema lamiyana ofalinone .
59004004	Sin	Tamakaya Anumaya Kotina ago ataletama ma mopale yafe age lamahayea nehae . Nagoa veamoya ma mopafi yafema age hamayema hisayana Anumaya Kotina kame lagiya kae neatae . Ani yafena ohavinao ?
44016006	Description	Alu Aotage AvamuꞋmoꞋa “ Esia kotega * nagai ke hamaopaigahae . ” huno nagalu humateneanagiꞋya PoloꞋagi SailasiꞋagi Timotigamina Faligia kotegaene Kalesia kotegaene umainae .
45010006	Faith	Hu-maineanagi nagoꞋa veaꞋmoꞋya Yisasi hulatenea yafema haviꞋya amakupi maleꞋya amametiti humainayafe Anumaya KotiꞋa “ Fatago veaꞋne mainae . ” huno humatenea yamofena mage huno hie tamakuꞋafitila mage hutama haviokeho “ Ta ikapinaga haiteno Kalaisina avaleno elavigahie ? ” hutama ohiho .
66016002	Violence	Higeno hagote molia ensole kanomoꞋa viaꞋamo ani yopaꞋafima hanea yana alino mopafi mo aitagu-fegeꞋya kefo afai afumo avoma amaugafaleꞋma kae-malenea veaꞋmoꞋya ani kefo afai afumo amefena “ Anumayati mainane . ” huꞋya agima alisaga nehaya veaꞋmogamina tusiꞋa kele amamu amale-maine .
66005008	Description	AligeꞋya foꞋa ( 4 ) hamaimuꞋene anagaꞋyaene tueti foꞋa ( 24 ) kava vayaꞋmoꞋyaene ani Sipi sipimo nafaꞋnea avate mope huꞋya mukiꞋamoꞋya gita kana yana yagame nehaya yaꞋene kanileta yafateti talo hu-malenaya yopaene atafa hulinae . Ani yopafina manaꞋage halinamo humainea taꞋnefamoꞋa havate-maine . Ani manaꞋage halinamoꞋa maꞋa humaine veaꞋmoꞋya nunamuma nehuꞋya Anumayamo agima alisaga nehageno Anumayamo avate vigeno havigeno aipamoꞋa kanale higeno hagaꞋage manama nehavia kava humaine .
62005001	Faith	Mukia veamoya Yisasife Anumaya Kotima taugafa aligatigahe hutenea kanoa , Kalaisi maine . huyama haviya amakupi maleya amametitima hayana Anumaya Kotina nafaneyagaa mainae . Maineya Nelamafaa , Anumaya Kotifena , amahau amayamopafima hamaisigeya ania huyama Anumaya Kotina nafaneyagaahena hamaugahie .
48005026	Recommendation	Tagaiti tagia alita ohaisune . Tafu-taganaya humainesaya kavafena ageta lahaye nehuta taipa haviya huta tua ohisune .
54005001	Recommendation	Vayatamamo-gamina kea oamamakika negafama huneatana kava huka kanaleya huka ako humateka ania huka ali hetimato . Yaufa neyavemo-gamina kaganakamo-gamima hu neamatana kava huka ania humato .
60002012	Recommendation	Tamakaya Yisasi kema nohaviya veamogami amunopima kama vaiyegahena fatago hutama vaiyeho . Ani veamoya tamakaife Kefo kava nehae . huya hu-haviya hu-lamatesagetama tamakaya kanale auava yatamia nehisageya ageteya haenagaa Anumaya Kotima kaiyeke hu-mategahema esigeya Anumayamo agia alisaga hugahae .
50003006	Sin	Anumaya Koti aliya nealue huna lokiyaage huna Yisasi veamogamina hamaena ali haviya humatenoanagi kahegi kema akave malenoafenagina fatago kano mainoanagino mukia veamogami amaufina kefo yania omalene .
43004052	Description	Me hageno “ Na kanale aepa heno kanale hu-tene ? ” huno hamavi-gegeꞋya “ Ega yagemoꞋa ali tagifeno nagokete evigeno ani amuko-nakoma haiya kalimoꞋa kanale hu-tene . ” huꞋya hae .
43019031	Violence	Sapati yupahe talo tala hisaya yupagino ega ala Sapati kana falote hisia yafe Yuta vayaꞋmoꞋya anima yafaga yosaleꞋma hamae-malaya vayaꞋmogami amaugafamoꞋma SapatileꞋma yafaga yosale hanesia yafena ohamaigeꞋya Pailatife mage huꞋya mo havigae “ Ati vayaꞋmoꞋya amaiya ali kofa hisageꞋya aupaꞋa falisageꞋya hipoꞋya huꞋya aliꞋya visae . ” huꞋya mo havigae .
