45008007	Sin	Atafa amaku amakesale amaugafa age hamaꞋye hisaya veaꞋmoꞋya Anumaya Kotina kame tagiꞋya kaeneꞋateꞋya Anumaya Koti kahegi kemona akave omaleꞋya ani kea akave malesaya tokiyaꞋamia omaletafa huno omalene .
44002026	Faith	NagaiꞋenema nemaiya yafena nagu nafaꞋnemoꞋa tusiꞋa muse nehigeꞋna agia alisaga nehue . Yoka faliteꞋna hetigahue huꞋna nametitia nehue .
46010020	Sin	TokiyaꞋamia omalenegi nagaya tamahanepauve Yisasi kema nohaviya veaꞋmoꞋya Kefo AvamuꞋmo kavela malenagi Anumaya Koti kavela omalenayane . Kefo AvamuꞋene ailokaetama omaisae huꞋna nehue . Ani kavela oneho .
44013001	Description	Ani Atiokua Yisasi anagapiti nagoꞋa maineꞋya amaune laga huꞋya Yisasi ke hamanepaiya vayala mainae . Ani vayaꞋmogami amakia PanapasiꞋene SimioniꞋe kanomona nago agia NaisaꞋe . Tagai kefina ani agimoꞋa “ Anupa kanoe . ” huꞋya neꞋaya agie . Ani kanoene LusiasiꞋa Sailini kanoene SoloꞋenena ManainiꞋe . Ani kanoa HelotiꞋa Kalili kava kanomona afaluꞋamoꞋe .
49005006	Recommendation	Havigu nago kanomoa tamavayu huno havigea nehuno Ani kefo kavala afaa maitama hiho . huno hisigetamahena agai kea ohaviho . Naa augafa kavama nehaya yamoa Anumaya Kotina agai kema neatagayaya vayamogamina aipa haviya hu neamateanagino hai vaimateno amakata aisia yana amamigahie .
56001011	Sin	Nehagi mani kema nehaya vayala Naa kea ohiho . huka kahegi-mato . Ani vayamoya moneamia havige hamapaiya yateti nealiya nagoa veamogami afamoamiene amaku amakesafima hanea kea ali haviya nehae .
43013011	Sin	Hama-paiteno YisasiꞋa agaiꞋma agesiꞋma huno haegahema hia kanoa ago age-mainea yafe “ Tamakaya mukiꞋamogatamina oniꞋyatamia omalene huꞋna nohue . ” huno nehie .
43010001	Sin	YisasiꞋa mage huno hie “ Nagaya tamage-lafa huꞋna tamaha-nepauve nagoꞋa vayaꞋmoꞋya sipi sipi kegiꞋyamo fiatetiꞋma hai ofaleꞋya afalegatiꞋma asaga hu-maiꞋya hai falesaya vayala musufa vaya mainae .
61002015	Sin	Fatago hu-mainea katema visaya yafena amakaveno huteteya afai heya mainae . Palamu nafanea Peoma humainea kavamo aiyaka nemayae . Ani kanoa Palamue kefo kavaage huteno mone alisia yafe aluya huno nehaiya kanoe .
44014005	Violence	HuteꞋya Yuta vayaꞋene Isaleli vea omainaya vayaꞋene kava vayaꞋamiene mage hae “ Pologani Panapasiganina ali haviya hunateteta yafa kaꞋyoteti hanaesunageꞋana faligaꞋe . ” huꞋya humainae .
43021017	Description	Hapaiteno nagoꞋene napa tali ( 3 ) kanale mage huno havige “ Saimonigae Yoni nafaꞋnemoga nagaifena negahaiyo ? ” huno higeno napa tali ( 3 ) kanaleꞋma “ Kagaya nagaifena negahaiyo ? ” hunoꞋma havigea yafe Pita aipamoꞋa kanaꞋage higeno mage huno hie “ AlaniꞋamogae mukiꞋa yana ago havi-mainane . Nagaya kagaifema nenahaiya yafena ago nehavine . ” huno hapaigeno YisasiꞋa mage huno hie “ Kagaya sipi sipiyagaꞋnia kavela amamio . ” huno hapai-maine .
66021027	Sin	Egahayanagi kefo yamaꞋageꞋma nehaya veaꞋnene , amakuꞋamo oniꞋyaꞋage hu-mainea veaꞋnene , havigeꞋage veaꞋnenena ani kumatela ometafa huꞋya omegahae . Omegahagi Sipi sipi nafaꞋnemo avopima , maige maige hisaya hamaimuꞋma hanea avopima amakima kae-malenesia anagaꞋmoꞋya amakaiꞋamige ani kumatela ehaigahae .
66017004	Sin	HanegeꞋna nagaya agoana ani akefamoꞋa oko kenaene haesa kenaene fai-lino maine . MiyamoꞋa hai-mainea seveliyaꞋene kanileta yafateti talo humale yaꞋene fai-linegeno augafalela aleꞋale nehigeno maiya akefa age-mainoe . Agogeno ayapina kanileta yafateti talo humale keꞋayola ali-linegeno kumai yama nehia yaꞋene havigu-nagu hiꞋmanaꞋage kefo yamaꞋaene ani keꞋayopina havate-maine .
51003014	Recommendation	Tamahau tamayamopafima nelamahaiya yamoꞋa mukiꞋa mani kanale kavaꞋmona agaseno ala humaine . Kenatimona atafa hisia tamuꞋnofiꞋma kitama atalakoma huna avamete huno tahau tayamopafima nelahaiya yana aniꞋa huno mukiꞋa mani kanale kavala haꞋyagino hetofa huligahie .
43012023	Description	HapaiꞋageno YisasiꞋa mage huno hana-paiye “ Menia Ikapinagati emainoa kanoa vayaꞋmo natenea kanomonia tusiya huꞋya nagai nagia ali-saga hisaya kanamoꞋa ago evaꞋyi hu-maine .
45002022	Sin	“ Kumai he yana ohiho . ” huka veala hamanepainanagi kagaikaꞋa ani kumaiya nehano ? Ago falimainaya veafe “ Anumayati maine . ” huꞋya amakisana neꞋvaiya yafena “ Onahautafa huno onahaiye . ” huka nehananagi ani veaꞋmogami mono nopitila musufa yana nehano ?
45007008	Sin	Kahegi kemoꞋa kefo kavala naveligeno kefo kavala falote huno mukiꞋa age nahaꞋyema hua yana naguꞋafi falote nehie . Kahegi kema omaleleꞋasina kefo yaꞋmoꞋa fali-mainea augufa kava higeꞋna kefo yafena nagayea ohuleꞋasine .
44026017	Grace	Nehuafe Yuta veaꞋne omainaya veaꞋmogamitega hugategahugi haenagama ali haviya hugatesaya Yuta vayapitiꞋene Yuta veaꞋne omainaya vayaꞋmogami amayapitiꞋene kavaleꞋna kaugafa aligatigahue .
56003003	Sin	Nayona tagayaenena aifonafo lagu tagesa havita Anumaya Koti kea akave omalonageno Satania aye-lavataga higeta lagaiti age lahaye huna kefo yaene taugafamo muse hia yamoene tatafa huno atalako higeta ani nofipi maineta veafe havita haviya humateta alumogami yatefe age lahaye hunageya veamoya lagaila tusiya huya kamea hu-latenayanagita ania huta kame huta mainone .
54005021	Recommendation	Anumaya Koti aufiene Yisasi Kalaisi aufiene huno yogi-malenea ensole vayaigami amaufiene mage huna kahanepauve Anima kahapauva kemona akave nehuka veala alika fako faka ohuka nago kana kana huka mukia veala kagesa havi neamamika aliyakaa alio .
58010035	Recommendation	Nemaiyafe menia tamakupima malenaya yana oataletama tamakuamoa kolia ohisigetama tokiyaage hutama maiho . Naama hutama maisayana Anumaya Kotia muse huteno tusia muse hisaya yana tamamigahie .
46004002	Faith	Kavayagaisaya veafena “ Efi efi hutama aliꞋyana aliho . ” huno humaine .
44009043	Description	PitaꞋa mukiꞋa yupa Yopa kumatela maineno nagola pulamakamo augafa taga huno talo nehia kanoene nemaiyane . Ani kanomo agia SaimoniꞋe .
46003016	Grace	Tamakaya Anumaya Kotina alu aotage nomaꞋa mainageno Anumaya Kotina Alu Aotake AvamuꞋamoꞋa tamakupina maine . Tamakaya ani yana havilama ohunao ?
58010019	Faith	Nayona vayamoya mono nopina kenaleti asa hunalagi-maleteya Ame kaiyaga alu aotage nopinagagitama ohaigahae . huya hu-mainayanagi Yisasia ani kena aye hatata huno hai fale-maine . Anima aye hatata humainea kenamoa maa humaine . Agaia augafagino ania huno aye hatata hu-maleteno katia vali-malene . Menia ani haegafa katia tahaimuma tamisia kapinagita Anumaya Kotitegama ke huta havigesunafe hai falegahune . Naa hu-maineafe nafunagana-gatama Yisasi kolamoa ayenalagi-malenaya kena ago ayehatata hu-maleneanagita Anumaya Kotima mainea alu aotage nopina kolia ohuta afaa hai falegahune .
43008021	Sin	YisasiꞋa eteno nagoꞋene mage hu-maine “ Nagaya ago visugetama nagaifena natiyegahayanagi tamakaitami kefo yatamia oꞋataletama hanesigetama faligahae . Nagayama visua katela tamakaya oꞋugahae . ” huno hie .
51003012	Recommendation	Tamakaila Anumaya KotiꞋa hapali-lamatenea veala agaila alu aotage veaꞋneꞋa mainageno tamakaifena hau ayamopafi nehaiya veaꞋne mainaya yafe kenama alitama nefaiya avamete hutama maꞋa kanale kavala failiho . MukiꞋa veafe tamahau humatetama kayone humateho . Tamaugafa alitama ohaiho . Alu kanomo kema havisayana ako hutama kea oꞋamakiho . Tamamena mailava hutama maiho .
43012026	Faith	NagoꞋa veaꞋmoꞋyama nagaifema huꞋya aliꞋya alisayana nakave ege ege hisae . NakaveꞋma esaya veaꞋmoꞋya maisua yate nagaiꞋene mainesageno NenafaꞋa nagai aliꞋyama neꞋaliya veaꞋmogamina ala amaki amamigahie . ”
54003004	Description	Ane nafanea kanaleya huno kava yagai-matesigeya agai agi alisaga nehuya agai ke ali hipoya hisageno kanale yama huno nemaisia kanoe .
52005011	Recommendation	Ani yafe nagoke nagokemogatama nehaya auava kavala nagoene hutama tamafu-tamakana-gamina kanale fatago amaku amakesale maisaya kea hamapaiho .
62003011	Recommendation	Nayoma havimainaya kea mage huno humaine Yisasi kema nehaviya tamafu tamakana-gamifena tamahau tamayamopafi tamahaino . huno hu-maineane .
46007026	Recommendation	Meni kanafina tusiꞋa kana yana falote nehiafe nagesa mage huꞋna nehavue neyaꞋvene munaꞋneyagaene mainaya avamete hutama maiho .
43003001	Description	Nago Falasia kanoa Yuta vayate ala kava kanoꞋamimo agia NikotimasiꞋe .
59002025	Description	Yosuaa Ko mogeho . huno Yuta vayala humategeya vageno Lehapua nomaafi amavaleno amateteno amaugafa aligatino alu kate hu-mategeya umainae . Naama humainea yafena Anumaya Kotia Lehapufena Fatago a mainane . huno huteneane .
54002015	Faith	Ohunegi aneyagamoya Anumayamofe haviya amakupi maleya amametiti nehuya nagoamogamifena hamau amayamopafi hamaisigeya maineya nafaneamia amatesageno Anumaya Kotia amaugafa aligatisie .
44013017	Grace	Isaleli veaꞋmogamina Anumaya KotiꞋamimoꞋa taginagomogamife agaiꞋa veaꞋne maisayafene huno hapalimategeꞋya Isipi kotega yokala umaiyana Anumaya KotiꞋa amaya higeꞋya tokiyaꞋage veaꞋne aitagufeꞋya kasago hageno agaiꞋa tokiyaꞋaleti Isipi kotegatila amavalegeꞋya ataleꞋya umainae .
44015008	Grace	Anumaya KotiꞋa taguꞋafina ago agelama huno agemainea kanogino ageana “ Ani veaꞋmoꞋya amakuꞋa ago namitafa hageno tagaiꞋma Alu Aotage AvamuꞋmoꞋma taminea kava huno ani veala amamine .
59002011	Sin	Anumaya Kotia mage huno hu-maineane Anea amavayu hutama kumaiya oheho . huno nehuno nagi Nago kanoa hetama ofaliho . huno hu-maineane . Nagi anea amavayu hutama kumaiya ohenesayanagi nago kanoma hetama falitesayana Anumaya Koti kahegi kea ago alitama atagae-mainae .
43010028	Grace	AmaketeꞋna maige maige hisaya hamaimula ago amaminoanagiꞋya ofaligahae . Nagaila ago nayapi mainayanagino nago kanomoꞋa memavayu ohugahie .
45016020	Grace	Anumaya KotiꞋa , taipa falu hisia yamona aepaꞋagino , aupa kanafi Satanina taiyafinaga ayeno tatapegahie . YisasiꞋa Anumayatimona kayone yamaꞋamoꞋa tamakayaene hanesie huꞋna nehue .
55003005	Sin	Ani veamoya mage huya nehae Tagaya mono kea nehavune . huya nehayanagi havigea amegati nehuya Anumaya Kotina tusia tokiya yamaa amakaveno huteya aliya vai oayegahae . Ani kavaagema hisaya veanenena tokaeka omaika aluale maiyo .
45012005	Description	Tagaya mukiꞋa veaꞋmogata ani kava huta KalaisiꞋene aigaꞋmaeta agai augafa nagoke maineta afalu falu huta nagoke mainone .
56003008	Faith	Mani kemoa kelamagelafa haneafe nagaya musekaa nehugi Anumaya Koti veamogamife mani kea huhaleka hulokiya vaika huo . Anumaya Kotife amakupi malenaya veanea kanale auava ya huya hetiya tokiyaage hisayafe mani kea huhaleka huo . Ani yamoa kanaleya huno mukia veala amaya hugahie .
59002023	Faith	Anumaya Koti avopina mage huya kae-malenayane Apalahamua Anumaya Koti humainea kehe Tamage nehane . huno agupi maleno ametiti hu-maineafe Anumaya Kotia agaifena mage huno hutene Fatago kano mainane . huno huteneane . huno kae-maleneane . Apalahamua ani aliyama ali-mainea kanafi mani kea kae-malenea kemoa agola falote huno tamage humaine . Anumaya Kotia Apalahamufena Kagaya nagaila name kafa mainane . huno hu-maineane .
59002001	Faith	Nafunagana-gatama tokiya hale-mainea yaaene kanoa , Anumayati Yisasi Kalaisife havitama tamakupi maletama tamametiti nehayafe amakima hanesia veamogamina kanaleya hu neamatetama afa veamogamina hu-haviyama humatayana havi kava nehae .
45003013	Sin	Amavayafitila vaya komufitiꞋma hia kava huno hiꞋmanaꞋage nehie . AmavefuꞋnamoꞋa havigeꞋage nehuno ani amavaya aguꞋafinaga osifaꞋvemoꞋa vayaꞋma amahaegeꞋya nefaliya augafa tina anifinaga hane .
49005028	Recommendation	Kalaisia veafema hau ayamopafi hau-mainea kava hutama vemogatama tamakaitami tamaugafahe tamahaiya avamete anetamimo-gamifena tamahau humateho . Tamahauma hu-matesayana tamakaitami lamaugafahena nelamahaiye .
45009030	Faith	NaꞋa hu-maineanagita naꞋane huta hisune ? Yuta veapi omainaya veala fatago veaꞋne maisayafe kasageke vokela ohunaya veaꞋmoꞋya afaꞋa YisasiꞋa hulatenea yafe haviꞋya amakupi maleꞋya amametiti humainaya yateti Anumaya KotiꞋa ani veaꞋmogamifena “ Fatago veaꞋne mainae . ” huno humatene huta hisuno ?
54003009	Faith	Anumaya Kotia Yisasifena falaki-mainea kemo aepaamofena haviya amakupi maleya atafa hu-lineya Anumayamo aufina amakuamoa kefo kavala nohisia vaya maisae .
54006002	Recommendation	Kava vayatamimoya Yisasina amakuama aminaya veama mainaya yafe Afaa nafunagana maineafe agai kea ali hipoya ohugahue . hutama ohiho . Ani kema ohisayana Yisasina amakuama aminaya vayatela afa aliya veane mainetama tamakuama aminayafe tamakaila kanaleya hutama amaya hisaya aliyaamia aliho . Manima kahapauva kea kagaya Timotiga hamapaiyo .
45003003	Faith	Maleneanagi nagoꞋa veaꞋmoꞋya haviꞋya amakupi maleꞋya amametiti ohunaya yateti Anumaya KotiꞋa “ Hulokiya vaimalenoa yana mukiꞋa veaꞋmogamina oꞋamamigahue . ” huno hugahifi ?
43019034	Violence	Ali kofa ohageno nago ati kanomoꞋa keveꞋaleti Yisasina haohipafi meyegeno aupaꞋa ani keve kapitila kolamoꞋene timoꞋene taki-lavi-maine .
43015012	Recommendation	Nahau-mainea kavala mage huꞋna nehue ‘ Nagaya tamakaifema nahau nayamopafima nahaiya kava hutama nelama-fugamifena tamahau tamayamopafi tamahainageno aniꞋa huꞋya amakaya tamakaifena hamau amayamopafina hamaino . ’ huꞋna tamaumonola nemaloe .
45006013	Recommendation	Kefo kava hisaya yafena tamaiya , tamayana , tamaulaga , kefo yamote aliꞋyafena tamakuꞋa oꞋamiho . MukiꞋa Anumaya Kotina agaiꞋage amiho . Tamakaya falimainafiti hetimainaya veaꞋne mainagi tamaugafamoꞋa mukiꞋa kanale auꞋava yama alisiafe Anumaya Kotina amiho .
58010039	Faith	Tagaya koli huta agai kea ataleta agola taugafa tagata aisia ata tegelege hisia kumate visuna veanea omainonagi Yisasife havita lagupi nemalonanagino tagu tamena aligatisigeta agola maisuna veane mainone .
45011026	Grace	Anumaya KotiꞋa mukiꞋa Isaleli veala amaku amamena aligatigahie . Anumaya Koti autamafina mage huꞋya kae-malenayane “ Yelusalemuti nagola amaku amamema aligatisia kanamoꞋa falote huteno veaꞋmogamina kefo auꞋava yaꞋamia alitalegahie . ”
52002015	Violence	Ani Yuta vayamoya Yisasia Anumayatimoene Anumaya Koti amaune vayaene hamayageya falitageya tagaila tanati-talenae . Ani vayamoya Anumaya Kotima nehaiya kavala ohuya mukia vayamogamina kame humatenae .
58010026	Sin	Anumaya Kotina kelamageama havilama hutetagi eteta neataleta Nahaiya kava hugahuema . nehuta kefo yama hume hume nevisunagenofena nago kanoa eteya haesageno falinageno kolamaamoa taki lavisia yamoa ani kefo yatia nagoene aye hamisia aliyana omalegi . Anumaya Kotia kame vayaamogamina tusia atafi amatesigeno teno fanane hisigeya hikanufa vaigahayafe Anumaya Kotia kaiyekema hulatesia yafena tusiya huta kolia hisune .
49002006	Grace	Alino katilateteno tavalesaga huno ikapinaga Yisasi Kalaisiene tokaetama siale maiho . huno alino ailokaelatene .
49004025	Recommendation	Malelinetama havigema hisaya yana neataletama tagaya nagoke taugafa mainonafe mukia tamafu-tamakana-gamiene tamage keage hiho .
48002005	Faith	Hayanagi Yisasima hulatenea kanale mono kema havilama hutama akave malege malege hisayafene huta amakai kea tamage huta ohavitafa nehuta Taitasi augafa taga ohunone .
46014013	Recommendation	Ani yafema ohavinesia kefitiꞋma hisia kanomoꞋa ani kea hu yahae hisia tokiya alisia yafena Anumayamotega havigesie .
44009001	Violence	Ani kanafina SoloꞋa aipafinaga tusiꞋa hai-vaiteno tokiyaꞋage ke huno “ Anumayamo anagaꞋamogamina hamaesugeꞋya falisae . ” huno huteno ala mono note hagote kava kanomote uno mage huno havige “ MusekaꞋa nehugi nagaya Tamasigusi kumate uꞋna Yisasi anagaꞋamogamima amakenuꞋnahena amatafa huꞋna kina humateteꞋna Yelusalemu amavaleꞋna egahue . Ani kumate mono note kava vayaꞋmoꞋya nayama hisaya yafe avona kaeka namio . ” huno humaine .
43017013	Description	Menia eteꞋna kagaitega egahugi nagayama nehua muse yaniꞋamoꞋa amakai amakupina hava-tesia yafe ma mopale maineꞋna mani kea hama-nepauve .
60004013	Recommendation	Ohutama Kalaisima augafa agata yama ali-mainea yana tokaetama nealiyafe muse nehutama agai agima alisaga hisia tokiya hale yamaa tamave-lisia kanama vayi hinagetama tusia muse nehutama tamaipamoa kanaleya hugahie .
44011006	Description	Agoana ani yapina mukiꞋa yaga kafa afua osifaꞋvea nama vayupala yapavena anifi mainageno elavi-maine .
51003008	Recommendation	
44018003	Description	Uno monakeana nagoke aliꞋyake hanegeno kena noma fakaꞋniꞋya mone neꞋaliya aliꞋya neꞋaliꞋageno monaketeno anakaiꞋene tokaeno maineno ani aliꞋyana ali-mainae .
45006012	Sin	Na yafe kefo yamoꞋa “ Ala kavatami mainoe . ” huno falisia tamaugafamoꞋa “ Age haꞋye hisia kava huo . ” huno kava oꞋyagaisie .
53003012	Recommendation	Naama haya veafena Anumayatimona Yisasi Kalaisi agile hulokiya vaita kea mage huta hamanepaune Tamakaya kanaleya hutama mainetama aliyama alisaya aliyateti kavela ali falote hutama neho . huta nehune .
44007009	Sin	Ani Yosefena nepuꞋamoꞋya Yosefefe tusiꞋa amaipa kafa heteteꞋya avaleꞋya alu vayaꞋmogami neꞋamamiꞋya mone aligeꞋya Isipi kotega avaleꞋya vayanagi Anumaya KotiꞋa agaiꞋene maineno kanama haiya yana alitaleno kanale agu agesa amigeno Isipi sauve kanoa , Felona , aulagale hetigeno FeloꞋa muse huno “ Hagote kava kano maineka nagai noꞋyagaene mukiꞋa Isipi kotega kava yagaigane . ” huno hutene .
44011028	Description	Haigeno amakai amuꞋnopitila nago kanomo agia AgapusiꞋe heti-mainegeno Alu Aotage AvamuꞋmoꞋa hapaigeno aune laga huno mage huno humaine “ TusiꞋa kafu hisaya kana mukiꞋa mopale evaꞋyi hugahie . ” huno humainea kemoꞋa ani kafuma efaloteꞋma hia kanafina KolotiusiꞋa sauve kano maine .
44020036	Description	Mani kea huteno soka vayaꞋene PoloꞋa aleꞋya ayeno Anumayamotega ke huno havige-maine .
48005024	Faith	Yisasi Kalaisiene ailokaeta mainona veanea Yisasia yafaga yosale fali-mainea kava huta atafa laku takesaene age lahaye hisuna yaene ago fali lavata humainone .
59001002	Recommendation	Nafunagana-gatamae nagoa kana yama tamakaitema falote hisigetamahena ma lamakesa haviho Inamona musekase hisuna yane . hutama hiho .
62001006	Sin	Omaleanagita tagaya Anumaya Kotiene taguamoa nagoke taipale mainone . nehuta haniki mai yapima ute etema hisunana havige nehuta kelamage kemona akave nomalone .
44010011	Description	Ageana ikamoꞋa aihagalo higeno nagola tusiꞋa kena kana yana aluga aluga atupale nofi aye-maleteꞋya atalageno mopafi enelavigeno age-maine .
44002009	Description	Tagaya ma kumaꞋyagaleti emainone PatiaꞋene MitiaꞋene Elamiene MesopotemiaꞋene YutiaꞋene Kapatosiene Potusiene EsiaꞋene FiligiaꞋene PamafiliaꞋene Isipiene Sailinia aupaꞋale Lipia kotegatiꞋene Lomuene Kalitiene AlepiaꞋene naꞋa kotegati emainonagi Yuta vayaꞋene Yuta vayaꞋmogami Anumaya KotiꞋamimo ke havilinaya vayaꞋene emainonagi tahaote tahaote ketifiti Anumaya Koti tokiyaleti humainea kavafe tahapai-mainae . ” huꞋya hae .
51001010	Faith	Hiya hisigetama tamakaya kama vaiyesayana Anumayamo veaꞋne fatago hutama maisageno AnumayamoꞋa mukiꞋa maisaya auꞋava yatamihena ‘ Nagai nafaꞋnemoꞋya amatea kava nehae . ’ huno haisie . MukiꞋama nehaya kavala kanale yakeꞋya falote hisigetama Anumaya Koti aepaꞋa aluya hutama agetetama agaifema havilinaya yatamimoꞋa ala hisie .
54001018	Recommendation	Timotigae , nagai nafanemoga , nayona nagoamogamina Anumayamoa avayafiti kea kagaifena huno falotema humainea augafa ke menia ma avopima kaenama kamua kahegi kemoa hanegi ani kemona fatago huka akave malesanana ani keleti Satanienena tua hugane .
66019001	Faith	Nagaya anile havugeno kasagoꞋya ikapinaga mainaya veaꞋmoꞋya ala kegefafiti mage huꞋya hae “ Tagaya Anumaya Koti agia alisaga hisune . Anumaya KotiꞋa kaiyekema humategahena kanaleꞋya huno kelamage keleti fatago huno kaiyekea hu neꞋamateno ani kumai aꞋmona tokiyaꞋama hanegeno mukiꞋa ma mopafi veafena ‘ Kefo yama hiho . ’ huno ali haviya hu neꞋamatea yatetila Anumaya KotiꞋa ani kefo yamo anonaꞋa ago amine . Ani kumai aꞋmoꞋa Anumaya Koti aliꞋya veala hamaeno falimateneanagino ani yateti Anumaya KotiꞋa kefo yamaꞋamo anonaꞋa ago amine . Amineanagita Anumaya Koti agia alisaga hisune . Anumaya KotitimoꞋa agaiꞋage tokiyaꞋage hale yamo aepa maineanagino tagu tamena ago aligati-maineanagita agia alisaga nehune . ”
49002001	Grace	Nayona kefo kava huge huge hutama mainaya yamoa tamahaegetama fali-mainageno Kalaisia ago fali-mainafiti ali hetilamatene .
46010021	Sin	Havigu tamakaya “ KalaisiꞋa tagai kefo yafe huno fali-maine . ” hutama Anumayamo kapufiti nenetama Kefo AvamuꞋmogami neꞋamamiya tina mo neyafenagi ani kavala tamage hutama ohiho . Havigu tamakaya Anumayamo kave nenetama Kefo AvamuꞋmogami amamiya kaveꞋene neyafenagi ani kavala ohiho .
49005003	Recommendation	Vai neayetama munane ane amaugafale maiya vai neayaya kavaene moli huliteya nehaya kavaene mukia ani oniyaage kefo yaene alu kanomofe age lamahaye hisaya yaene ohiho . Tamakaya Anumaya Koti nafaneyaga mainagi havigu Na kava nehae . huya hulamateyafenagi ani kavala mukia yupa ohiho .
56001015	Sin	Amaku amakesamoa oniya ohunea veamogami amaulagafina mukia yamoa oniyaagela ohunegi Yisasife haviya amakupi maleya amametiti nohaya veamogami amakupina oniyaage hu-maineanagino mukia yana oniyaage hu-mainegeno amaku amakesamoa Ma kavala kanale yanagi atu yana havi yane . huya ohavinae .
44009021	Description	Mani kema haviya veaꞋmoꞋya tusiꞋa amamaꞋyo neꞋaiꞋya mage huꞋya hae “ Mani kanomoꞋa Yelusalemu maineno Yisasi agileꞋma nehaviya veala ago hamaeteno ma kumate eno aniꞋama nehaya veaꞋne kina humateno ala mono note kava vayate kaiyeke humatesia yafe amavalegahe emainea kanofi ? ” huꞋya hae .
58008006	Description	Higeno Kalaisia aliyamoa mopafi maineya mono aliya vayamogami aliyana amakase-maine . Yisasia Anumaya Kotiene mopafi veanene amunotifi maineanagino Anumaya Kotiene alino hagelafi-latene . Ani haegafa kemoa nayoma alino hagelafi-matenea kemona agase-maine . Menia Anumaya Kotia Tusia kanale yama hulamategahue . huno huteno haegafama hulokiya vai-maleneanagino nayona Ma yama hulamategahue . huno humainea kemona ago agase-maine .
50001021	Faith	Haegafama hunama mainoana Kalaisia nagaila aepania maineanagina falisuana tusia kanale yania aligahue .
50001006	Faith	Nagaya ago havimainoe Anumaya Kotia tamakupima kanale aliyama aepa hemainea aliyana alime alime haino Yisasi Kalaisi eteno esia yupa hano hugahie .
62005020	Faith	Yisasi Kalaisia , Anumaya Koti nafanemoa , eaamo aepaa agelama hisuna tagu tagesa ago tamineafe tamage Anumaya Kotina agelama nehuta agaiene nafaneamoene ailokaeta mainone . Ani kanoa tamage Anumaya Koti maineno agola maige maige hisuna tahaimumona aepaa maine .
45012018	Recommendation	Tamakaitamia tuma hisaya yafena tamakesa ohavitafa hutama mukiꞋa veaꞋnenena yuna hetama maiho .
58010023	Faith	Anumaya Kotia Maa yama hu-lamategahue . huno hu lokiya vai-malenea kemoa ani yana tamage huno hugahie . Tamage huno hu-maineafe tametitia nehune . huta hu falote nehuna kehena tole lagesa ohavisunagi tokiya vaita atafa hu-lisune .
43014027	Grace	Tama-taleꞋna ugahe tamaipa falu hutama maisaya tamaku tamakesa nelamamue . Nagayama naipa falu huꞋna nemauva nagu nagesa nelamamue . Anima tamaipa falu hutama maisaya yama tamamua yana ma mopale veaꞋmoya amaipa falu nehaya ya kana ohunegi kanaꞋage tamaku tamakesa havitama kolia ohiho .
47005006	Faith	Tamineafe taguꞋamoꞋa kolia nohianagita havilama huta havilinone ma mopafi mainona kanafina ikapinaga Anumayamo avatela omainonane .
43012047	Grace	NagoꞋa veaꞋmogatama nagai kema havitetama nakaveꞋma omalesayana nagaya tamakaila kaiyekea hu otama-tegahue . Ma mopale veaꞋmogamina kaiyekea hu-ma-tegahue huꞋna omenogi ma mopale veaꞋmogamina amaugafa ali-gatigahue huꞋna emainoe .
62003012	Sin	Tagaya Kenima humainea kava ohisune . Kenia Satani nafanema mainea yafe aganaamona haegeno fali-maine . Naa higeno haegeno fali-maine ? Aganaamoa fatago huno mainea yafe agaia kefo kavaage nehia kanogino aipa haviya huteteno aganaamona haegeno fali-maine .
66016020	Description	Ala imikefa aligeno mukiꞋa hagelimo amuꞋnopima hanea mopaene agoꞋyagaene fanane humainae .
58011012	Description	Ategeno Apalahamua kosuna leteno ago faligahe hianagi agaipiti aginagomoya ohavunamaa veane ateya aitagu-fageno ikatema hanea kanefiyagamo hia avamete huteya ti kahaepamoma hia avamete huya ohavunamaa veane aitagufe-mainae .
54001017	Faith	Anumayamoa mukia kanafina agola maige maige nehia Sauve Kanomoa ofaligahianagita tagaya agaila oagegahune . Anumaya agaiage mainea yafe veamogata agai agia alisaga huge huge nehisunageno mukia kanafina hale-mainea tokiya yamaa hanege hanege hisie huta hisune . Mani kea tamage .
66014007	Faith	Vai-yeno ala kegefafiti mage huno hie “ Anumaya KotiꞋa veaꞋmogami alino kaiyekema humatesia kanamoꞋa ago falote hu-mainegi tamakaya koli nehutama Anumaya Koti agia alisaga hiho . Anumaya KotiꞋa ikaꞋene mopaene hageliꞋene mopafitiꞋma kapai nehagea tiꞋene agaiꞋa talo hu-malegetama agai agia alisaga hiho . ” huno humaine .
44006001	Description	KasagoꞋya veaꞋmoꞋya Yisasi kea haviꞋya amakupi maleneꞋya amaku aminaya kanafina nagoꞋa ani veaꞋmoꞋya Kaliki ke havilinaya vea mainagi nagoꞋa veaꞋmoꞋya Hipalu ke havilinae . Kaliki kema havilinaya veaꞋmoꞋya mage hae “ Tagai megusa aꞋneyaga havi kava hutama osi kanoꞋa kavela neꞋamamiyanagi Hipalu amakema neꞋaiya megusa aꞋneyaga kasagoꞋya kave neꞋamamiye . ” huꞋya amaipa haviya huꞋya ke vai-mainae .
