66022015	Sin	Hai falegahayanagi kefo yamaꞋage veaꞋnene , hanageke kava nehaya veaꞋnene , kumai heꞋya vaineꞋayaya veaꞋnene , vea hamaeꞋya falineꞋamataya veaꞋnene , ago fali-mainaya veafe ‘ Anumayati maine . ’ huꞋya amakisana neꞋvaiya veaꞋnene havigehe muse huꞋya akave nemalaya veaꞋnene ani kumaꞋmona malaga maigahayanagiꞋya Anumayamo ala kumatela haiꞋya omaigahae .
66002014	Sin	OꞋatalenagi nagoꞋa kefo yana nehageno naipamoꞋa haviyana nehie . Tamakai amuꞋnopina nagoꞋa veaꞋmoꞋya PalamuꞋma humainea kea atafa huꞋya akave nemalae . Nayona PalamuꞋa Isaleli veaꞋmoꞋya asaga hu lavisae huno Palakina mage huno hapai-maine “ Mage huka hamapaiyo ‘ Amayateti talo humalenaya afa yafe ‘ Anumayati maine . ’ hutama amiya kavela nenetama kumai kavala hiho . ’ huka amaipa ayesana kea hamapaiyo . ” huno humaineane .
53001003	Faith	Tafu-tagana-gatama tamakaya Yisasifema havitama tamakupi malenaya yamoa mai lokiya vaitama maiya yaenefe tamakayama tusiya hutama mukiamogatama nagoke nagokemogatama tamahau tamayamopafima lamahaiya yamoa via yamo alakefa hia yaenefe Anumaya Kotitega ke huta muse ya neamune . Mukia yupa tatea kava huta tamakaifena Anumayamotega ke huta muse yana neamune .
46012002	Sin	Nayona Yisasi kema ohavinaya kanafina SataniꞋa tamavayu higetama agea oꞋaino ago fali-mainaya veafena “ Anumayati mainae . ” hutama amakisana neꞋvaitama havi kate umainaya yafena tamakaya ago havilinae .
49005025	Recommendation	Kalaisia anagaamogamife hau ayamopafi tusiya huno hau humateno hamamaesia yafe fali-maine . Ani kava hutama vemogatama anetamimo-gamina amaya hutama tamahau tamayamopafi anetamihena tamahaino .
45012017	Recommendation	NagoꞋa veaꞋmoꞋya havi kavaꞋma hulamatesagetama anonaꞋa havi kavala hu oꞋamateho . MukiꞋa veaꞋmogami amaufina kanale kavakeꞋya hiho .
60005006	Recommendation	Ani yafe tamakaya Anumaya Kotima tokiyaaletima kavama yagaisiana agai ayapi maigahune . hutama nehutama tamaugafa alitama ohaitama ako hutama maisayana agaiama hu-malenea kanafina tamakaila alisaga lamahaugahie .
44014017	Grace	Kahegi oꞋamateneanagi ‘ Nagaya ma mainoe . ’ huno amaveligahe huno kanale kavala humateno ikapinagatila kola lamamino hoyafina kanale kavela lamamino tamaku tamamemoꞋa muse hisia yana male hiya hulamatene . ” huꞋana nehaꞋe .
54003011	Recommendation	Aneamimoyaenena ania huya kanale ya huya maineya alumo kea aliya atifi mafi ohisae . Havi lina neya aneginagi ohuya efi efi huya fatago aliyamaage aliya maisae .
66002021	Sin	HigeꞋna nagaya ani aꞋmofena “ Kumai yakahena kaguꞋa aiyahae huka nagoꞋene ohisana kagesa havio . ” huꞋna agava mauvanagi aguꞋa aiyahae nohie .
44012020	Description	HelotiꞋa kava yagai-mainea mopafiti kaveꞋamia neꞋaliya yafe HelotiꞋa Taiya nemaiya veaꞋnene Saitoni veaꞋnenefe tusiya huno aipa haviya humategeꞋya nago amaku amakesa haviteꞋya alitalu huꞋya Helotina hagote aliꞋya kanoꞋamote Palasatusite mage huꞋya me hae “ Falu huta maisuna yafe kagaya Helotina hapaiyo . ” huꞋya hageno agaya nago aipa ani veaꞋnene huteno Helotite emainae .
43008049	Sin	Hageno YisasiꞋa mage hie “ Nagaipina Kefo Avamula omaine . AꞋao nagaya Nenafa agi alisaga nehugetama lamakaya nagai nagia alitama afepinaga nemalae .
43006018	Description	Ala yasigefamoꞋa eno tina melino mo ai-yahae me ai-yahae huno tusiya hu-maine .
45008018	Faith	Nagaya nagesa havuana haenagama Anumaya KotiꞋa tokiya hale yamaꞋa fufu yate ali falote hinageno tavelisigeta agesuna yafe tagesa haviteta “ Meni kanafima tagata aiya yama neꞋaluna yana afa ya kana humaine . ” huta hugahune .
62002012	Grace	Osi nafanenimogatama Yisasi agile Anumaya Kotia kefo yatamia ago aige-lamateno atale-lamatenea yafe mani avona negaove .
55001009	Grace	Anumaya Kotia kefo kava huna yapiti tagu tamena alino katigeta alu aotage anagaa maisuna yafe tagaila huno yogi-malene . Tagayama kanale humainona yafene huno huyo okinegi agaia agesa haviteno haiya kava huno kayone hulategahe ani kavala humaine . Ikaene mopaene falote ohunegeno Yisasi Kalaisia Kayone hulamategahue . huno agesaa havimaineanagino menia Yisasia efalotema humainea yateti taveli-maine . Tagayama kefo kavama huna yamo anonaa Yisasi Kalaisia alia yafe tagu tamena aligatiteno fali yamo tokiyaa ago ali hano hu-taleteno ofalita agola maige maige hisuna tahaimula tamiteno umaige maige hisuna kaana ago taveli-maine .
43019006	Violence	Hama-paigeꞋya mono note kava vayaꞋmoꞋyaene ati vayaꞋene Yisasina ageteꞋya ala kegefafiti mage huꞋya hae “ Yafaga yosale nili hetama asaigeno falino . Yafaga yosale nili hetama asaigeno falino . ” huꞋya hae . Hageno PailatiꞋa kenonaꞋamia mage huno hama-paiye “ Tamakaitami avaletama yafaga yosalela nilia hetama asaiho . Nagaya nago kefo yamaꞋahena ati-yoana omaleanagiꞋna ohaegahue . ” huno hie .
60001010	Grace	Ani tamaku tamame aligati-mainea yafena nayona Anumaya Koti amaune vayamoya tusiya huya ati yegeteya Anumaya Kotia tamakaila kayone hisaya yana tamamisia yafena amaune laga huya hamapai-mainayane .
63001007	Sin	Nesuya veamoya aye lamavataga huya havige nehuya ma mopafina vaiyatete huya havigea mage huya nehae Yisasi Kalaisia ma mopafina vea eno omaine . huya nehae . Mani kema hisaya veamoya havigelafa aye lamavataga hisaya vaya maineya Yisasina kame vayaa mainae .
44024005	Sin	Tagayama agonana ma kanoa PoloꞋe tusiꞋa havi kavaꞋyaga nehuno mukiꞋa kumate Yuta veaꞋmogami amuꞋnoꞋamifina hetino ke vaino tu hisaya ke hamanepaino Nasaleti Yisasi kema nehaviya veaꞋmogami ala kanoꞋami maine .
54003016	Grace	Anumaya Kotia hufalote huno tahanepaiya auava yana tusia lamayo aisuna yane . Yisasia ma mopafi vaya augafa kalino efalote huno mainegeno Alu Aotage Avamumoa Lamage huno Anumaya maine . huno tahapai-maine . Ensole vayamoya agaila agageya vayamoya avagea huya alu kote kote mo huya falote hageno ma mopale kasagoya veamoya haviteya aliya amakupi maleya amametiti hageno Yisasia eteno ikapinaga nehaino tokiyaage hale yamona ali-maine .
66016021	Violence	TusiꞋa koꞋmopa , yafa ku kana huteno , ala alaisi ku kana huno kanaꞋage huno ikapinagati asaga hulavi hulavi hiaꞋamo veamogami amaugafale taviaꞋamo ali haviya humategeꞋya Anumaya Kotifena “ Otahaiya kano mainane . ” huꞋya kamugea hatageꞋya vaitenae .
61003013	Faith	Naa hugahagi Anumaya Kotia ago hu lokiya vaino mage huno humaine Ani ikaene mopaene hanoma hisiana haegafa ikaene mopaene talo hisugeya fatago amaku amakesaene veaneage anilela maigahae . huno humaine . Ani yama falote hisiafe tagaya muse hisune .
66006014	Description	IkamoꞋa iva yuguma alitama aye kafage kitama haꞋyama negiya kava huno ikamoꞋa fanane higeno mukiꞋa agoꞋyaene ti amuꞋnopima hanea mopaene noꞋamia ataleꞋya nagoꞋene omalenae .
58010010	Grace	Naa hu-maineafe Anumaya Kotina nehaiya yanagino , maa humaine Yisasi Kalaisia nagoke yupa kanoa agaia augafama hakino amiteno fali-mainea yateti tagaya ma mopafi veamogatina kefo yatia aye hami-talegeta tagaya agaila alu aotage veanea menia mainone .
52001002	Faith	Tagaya mukia yupa Anumaya Kotitega tamakaifena muse huta tamaki ayeta nunamuna nehune .
66006004	Violence	HigeꞋna agoana nagola kolamaꞋage hosi afua agogeno nago kanomoꞋa ani afumo agupifi mainegeno ala aveꞋneꞋne naepe kaꞋyoꞋene mukiꞋa ma mopafi veaꞋnene tuma hisia tokiyaꞋaene amigeno aliteno ma mopafi veaꞋmoꞋya tuma huꞋya hamaesageꞋya falisaya amakesa ago amamineanagino amaipa falu huꞋya maisaya yamoꞋa mukiꞋa ma mopafina ago haꞋno humaine .
54006001	Recommendation	Yisasina amakuama aminaya veamoya , nofi humatageya afa aliyama nealiya veamoya , amatesia kava huya kava vayaamimo-gami amakia alisaga hisae . Alisaga nehuya keamia ali hipoya ohisageya veamoya neamakeya Anumaya Koti agia ali haviya nehuya Anumaya Kotiamimo kea akave nomalae . huya hugahae .
51003009	Recommendation	Tamakaya atafa kenama asagitama hagaꞋyu hutalaya avamete hutama atafa lamaipaene humainaya yaꞋenena ago atalenagi nelamafu-gamifena havigema ayemavataga nehaya kea ataleho .
66002020	Sin	Nehayanagi nagoꞋa kefo yama nehagenoꞋa naipamoꞋa haviya nehie . Nago aꞋmo agia YesepeliꞋe mage huno humaine “ Nagaya Anumayamo aune a mainoe . ” huno havigea nagai aliꞋya veaꞋmogamina ayemavataga huno mage nehie “ Kumai yana nehutama amayateti talo humalenaya afa anumayamoma amiya kavela neho . ” huno humaine .
48003008	Grace	Anumaya Kotia nayona mage huno agesa havimaine Haenagaa Isaleli vea omainesaya veanemoya nagaifena haviya amakupi maleya amametiti hisayafe Fatago veane . huna humategahue . huno agesa haviteno kanale mono kea Apalahamuna hapai-maineanagino Anumaya Koti autamafina mage huya kae-maleneayane Kagaitetifene huna mukia ma mopale veanea Anumaya Kotina muse yana amamitena ali kanale humategahue . huno higeya kae-malenayane .
58012005	Recommendation	Anumaya Kotia tamavaleteno nafaneyagaahema humainea kemoa tamake-kanio ? Mage huno hu-maineane Nafanenimoga Anumayamoa kaumonoma malesigekahena Afa yane . huka ohuo . Ke negama-kino kayoma kamisiana kagaila kavaleno ali fatago hugatesia yafe nehigi kaipamoa haviyana ohino .
58013017	Recommendation	Kava vayamogami kea havitama ali hipoya nehutama amakai amaiyaafi maiho . Anumaya Kotia tamaku tamamete kava hisaya yafe ali hetimateno aliyana amamineanagi haenagaa tamakaifena hamavi-gegahie . Hamavi-gesigeya tamakaila muse hisaya kema hisagetama tamakaienena muse hugahayanagi amaipamoa kanalema ohisiana tamaya ohugahie .
44013019	Description	Anumaya KotiꞋa seveniꞋa ( 7 ) nofi veaꞋmoꞋya Kenani nemaiya veaꞋmogamina hamae haꞋno higeꞋya faligeno amakai mopa Isaleli veaꞋmoꞋya maisaya yafene huno alino amamine .
54006003	Faith	Nagoa veamoya alu ke hisayana Anumayatia Yisasi Kalaisina kelamage keamona akave ohuya Anumaya Kotina haiya kava hiho . huya nohaya veala amakaiami amaugafa aliya nehaiya kanale amaku amakesa amakai amakupina tamage huno omalene . Omalenea yafe kema hisaya yafena ati neayeya Yisasi kehe ke vaiya nemaiye . Kema vaiya yapiti nago yana falote nehigeya mage huya nehae Agima haneafe ali haviya hugahe nehune . huya amakaiami keamimo tua hu neamategeya amakia hu haviya nehuya Havi kavala nehae . huya humatenayane .
63001010	Recommendation	Nago kanomoma tamakaitema evayi hunoma mani Yisasi kema oalino alu ke alu kema alino esigetama tamakaya hu falu fala hu oatetama avaletama notamifina oateho .
47001005	Grace	Yisasi KalaisiteꞋma kasagoꞋya kana yama falote humainea avamete huno tagaipina kana yana falote nehiafe KalaisiꞋene ailokaeta mainonanagino agaya tusiya huno taipamona alino kanale hunelate .
65001011	Sin	Avonio amaugafama alino haviya humatesia yafena kayeya maisae . Kenia havi kavama huno aganaamona Epolona haegeno fali-mainea kava huya tamakaienema nemaiya vayamoya ani kava maiya nehuya hilato ohunea katela nevae . Nevagi nago kanomo agia Palamue mone alisia yafe havigea maino nehianagiya ani vayamoya ani augafa kava huya mone alisaya yafe havigegeyana maiya nehae . Nehageno nago kanomo agia Kolae Anumayamona veganokano hutegeno Anumayamoa fali hano hutenea yafena nohaviyanagiya ani vayamoya ani kavakeya maiya nehuya Anumaya Koti kemona amakavenona hu neatayafe Anumayamoa Faliho . huno hinageya fali hano hugahae .
65001010	Sin	Naa hu-maineanagi Yisasi kehena havigegeyama nehaya vayamoya ani kavala nohagi amakesamoa havilama ohunea yamofena hu-haviya hu neamatae . Afu kalamoya amaku amakesa nohaviya avamete kava nehageno ani kavama haya yamo amaugafamona ali haviya hu-matene .
58011007	Faith	Anumaya Kotia Noana haenagama falote hisia yana , Noaa oagenea yafema hapaigenoa Tamage nehane . huno amayo aiteno havino agupi maleno ametiti huteno agaia afamo kanoa hamaoke hesiafene huno Anumaya Koti kea akave maleno tipi kalea talo humaine . Naa hu-maineafe Anumaya Kotifema havino ametitima hia yana Anumaya Kotia ageteno Fatago kano mainane . huno huteneane . Huteneanagino mukia ma mopafi mainaya veamoya Anumayamofema haviya amakupi omalaya auavaamia Noaa ali fufute maletegeno Anumayamoa ani veamogamifena Kefo ya humainae . huno anonaamia amamigeya fali-maine .
58009006	Description	Ani yayaga talo tala hu-maleteya mono note kava vayamoya mukia kanafina kumategati hai nefaleya nemaiya nopi haiya aliyaamia alimainae .
44007051	Sin	Tamakaya kea ohavi veaꞋne mainetama tamaku tamakesafinaga “ Anumaya Koti kea ohavigahune . ” hutama Alu Aotage AvamuꞋmona tamakaveꞋno hutetetama tamakinagomoꞋya nehaya kavaꞋage nehae .
54001009	Sin	Kanale yama huya fatagoma humainaya veanehe mani kahegi kemoa ohunegi kefo kavama maiya nehuyama mainaya veanene , ke ohavi veanene , veganokano veanene , Anumaya Koti kema akave nomalaya veanene , kefo kavaagema maiya nehaya veanene , Anumaya Kotina amakaveno huteya hu haviya hu neataya veanene , nefanagi itaamonagi huno hamaeno nefalino , alu veanene hamaeno nefalia vayaenefe mani kea humaine .
46005009	Recommendation	NagoꞋma kae-malenoa avopina mage huꞋna humainoe “ Kumai nehesaya veaꞋnenena tokaetama omaiho . ” huꞋna kae-malenoe .
48001015	Grace	Akave malenoanagi itanimoa onatenegeno Anumaya Kotia aliyamaa alisuafene huno agaia kayone yamaaleti nagaila ago hapali-nateneane .
45007015	Description	Nagayama nehua yamo aepaꞋa ohavinoe . “ Nenahaiya yama hisue . ” huꞋna hua yana nohuanagi “ Onahaiya yane . ” huꞋna hua yamaꞋage mukiꞋa kanafina maiꞋna nehue .
61003018	Faith	Tamakai tamagu tamamema aligati-mainea kanoa , Yisasi Kalaisifena , ago havimainagi agaia kayone yamaafi mainetama nagoene kayonema hisaya yana alitetama Kalaisife tamakesa havi havi hutama havilama hutetama ko hiho . Anumaya Kotina alu aotage tokiya hale yamaamoa meniene haenagaaene agola akaiafikeya mukia kanafina hanege hanege huno hanesigeta tagaya mukia kanafina agai agia alisaga huge huge huta maisune . Tamage . Kenia male hano hie . Nagaini nagia Pitanae .
46004010	Description	Tagaya Yisasi Kalaisi aliꞋya neꞋalunanagita aifo vaya kana huta mainonagi tamakaya KalaisiꞋene ailokaetama mainetama kanale havi haviꞋyatami hanea veaꞋne mainao ? Tagaya tokiyatia omale vaya maunagetama tamakaya tokiyatami hanea veaꞋne mainao ? Tamakai tamakia alisaga nehayanagi tagaifena “ Otahaiya vaya mainae . ” huꞋya nehae .
60005009	Faith	Vai neayeanagi tamakaya Yisasife havitama lamakupi maletama tamametiti nehutama tokiya vaitama Satanife Kagai kea ohavigahunagi alulega vuo . hutama hapaiho . Tamakaya ago havimainae mukia kotega tamafu-tamakanaya tamakaiene ania huya amakata yapi nemaiye .
51003022	Recommendation	Nofipi mainetama miya oꞋali aliꞋya veaꞋmogatama * mopale mainaya kava vayatamimogami kea mukiꞋa havitama akave maleho . Havigu “ Nagaifena ‘ Kanale kano maine . ’ huno hisie . ” hutama kava kanomo aulekeꞋya aliꞋyana neꞋalitama havigu alulegama visaya kanafina oꞋalisagi aꞋao Anumayamofena koli nehutama tamakuꞋamoꞋa fatago hinagetama mukiꞋa kanafina aliꞋyatekeꞋya maiho .
66017012	Description	Agana teniꞋa ( 10 ) aveꞋmoꞋa teniꞋa ( 10 ) Sauve vaya maineꞋya menia yaufa kava aliꞋyana oꞋalinayanagiꞋya kefo afai afuene tokiyaꞋami aliteꞋya ani kava aliꞋyana aupa kana kanoꞋafi kava yagaiteꞋya atalegahae .
46002012	Grace	Anumaya KotiꞋa ma mopafi veaꞋmoꞋya nehaviya amaku amakesa notamigi tagaiꞋma Anumaya KotiꞋa taminea kema havilama huta havisunafe ani Alu Aotage Avamula tamigeta avale-mainone .
59005001	Recommendation	Tusia monetamima hanea veamogatama haviho . Tamakaitela hanageke yama vayi hugahema hisia yafena tamakaya kalagi aitama aviteho .
66002010	Recommendation	Tamakata aisia yana aligahayanagi kolia ohiho . Haviho SataniꞋa aye lamavataga hisigeꞋya nagoꞋa veaꞋmogatamina nofila hulamategahae . TeniꞋa ( 10 ) kanafi * ani kana yaꞋene tamakata aisia yaꞋenena aligahayanagi havitama lamakupi malenaya yana atafa hu-linetama falisageꞋna ani yateti kanale miyana anonatamia maige maige hisaya tamahaimula tamamigahue .
54006011	Recommendation	Kagaya Timotigae Anumaya Koti kema akave nemalana kanomoga mukia ani kefo yana neataleka fatago kavaage hisana kagesa havika maineka Anumayamoma nehaiya kavaage nehuka Yisasife havika kagupi malenana yana atafa hulineka veafena kahau kayamopafi kahaino . Tokiya vaisana yana atafa nehuka mailava huka ako huka maiyo .
59005005	Sin	Tamakaya ma mopafima mainaya kanafina kanaleya hutama tamahaiya yamaagela alitetama musena maitama nehagi Anumaya Kotia kaiyeke hu-lamatesia kanafina tamakaila tamaku tamamena tamahae falisiafenagitama kavela nenetama tusinasi vayala ko nehae .
66004004	Description	NeꞋagogeno tueti foꞋa ( 24 ) sia ani sauve kanomo siale maigagi-mainageꞋya tueti foꞋa ( 24 ) kava vayaꞋmoꞋya ani siayagale mainae . MaineꞋya efeꞋage kenaꞋamia fai-lineꞋya amanutela sauve veaꞋmoꞋya kanileta yafateti talo humale tumano kuꞋma vai neꞋaliya avamete huꞋya vai-linae .
66018007	Description	Ani kumai aꞋmoꞋa agaiꞋa augafa alino nehaino ageno haꞋyema hia kavaꞋma hu-mainea yatetila kagaya aniꞋa huka augafa agata aisia yaꞋene tusiꞋa aviteno augafahema kalagi aisia yaꞋene amio . Ani aꞋmoꞋa agupinaga mage huno nehavie ‘ Nagaya ala Sauve aꞋnemo siale mainoanagiꞋna megusa akefa omainoanagino nagaitela kana yamoꞋa falote hisigeꞋna nagaya avia oꞋategahue . ’ huno agesa havimaine .
60003007	Recommendation	Avemoga ania huka akamoene ako huka tokaeka maiyo . Amo augafamoa falu falu hu-maineafe agi alisaga nehuka tamakaya ako hutama amaya hiho . Anumaya Kotia kayone huno maige maige hisaa tanahaimula ago tanaminea yafe tokaetana kanaleya hutana mainetana Anumayamotega nunamuna hutana havigesaana nago yamoa katania maleli otegahie .
54002012	Recommendation	Vemoya anemogamina kavaami mainayanagiya anemoya Anumayamo kea huge amavelige hiho huna nohugi ako huya maineya ke haviya maisae huna nehue .
46001009	Faith	Anumaya Kotina nafaꞋneꞋamoꞋa Yisasi KalaisiꞋe AlatimoꞋene nagoke tamaipale maisayafe tamakaila ke huno “ NaꞋa hugahue . ” huno hulamatenea kea oꞋatalegahianagino ani kavala hugahie .
48005013	Recommendation	Nafunagana-gatama Mosese kahegi kefiti nofila humainageno Anumayamoa alino kalu he-lamateteno ago ke higetama agaialega emainagi tamakaya atafa lamaku tamakesamo nehaisia kavala hutama omaiho . Omaigahagi nelamafu-gamifena tamahau tamayamopafi nelama-haisigetama amaya hisaya kavakeya hiho .
59002012	Recommendation	Kefo yamoma nofi kilatenea yana ago alino kalu helatenea kemoa kaiyekea hulateno fako hugahie . Ani yafe mukia kanafina kema hisaya yaene maisaya auava yaene ani kemoene nagopi maiho .
46012005	Faith	Anumayamo aliꞋyana aluꞋa luꞋa aliꞋya hanegeta neꞋalunanagi nagoke Anumaya maine .
45009005	Description	Ani nofipiti tokiyaꞋage taginagomoꞋya falote humainayanagino KalaisiꞋa Anumaya KotiꞋma tamaugafa aligatigahie huno hutenea kanoa ani taginagomoꞋyafiti velafa maisiafe falote humaine . KalaisiꞋa mukiꞋa yana kava yagaino Anumaya Koti maineanagita mukiꞋa kanafina agola agia alisaga hisune . Tamage .
47001006	Description	TagaiteꞋma kana yama falote hisigeta tamakaifena , tagaya tamaipa ali kanale hulamatesuna yafe falote nehie . Tamakaila tamaku tamamema aligatisiafe falote nehie . FaloteꞋma hia kanafina Anumaya KotiꞋa taipamona alino kanale hulatesigeta tagaya tamaya hisunafe taipa alino kanale hunelate . TagaiteꞋma falote humainea avamete kana yana tamakaya aligeno Anumaya KotiꞋa tamaya hinageno tamaipamoꞋa kanale hisigetama mailava hutama mai lokiya vaitama maigahae .
47001021	Faith	Agia alisaga nehunageno Anumaya KotiꞋa agaiꞋa tavaleno tagaiꞋene tamakaiꞋene KalaisiꞋene aigaꞋmaelateno “ Tokiya vaitama maiho . ” huno hunelate . Ani kema huhaleta hisunafe tagaila hapalilatene .
44010015	Recommendation	Higeno nagoꞋene agea aino mage huno humaine “ Anumaya KotiꞋa ago alino sese humalenea yafena ‘ OniꞋyaꞋagela ohunegi afaꞋa alika no . ’ huno humainea kavefena nagoꞋene ‘ OniꞋyaꞋage humaineanagiꞋna onegahue . ’ huka ohuo . ”
66018009	Sin	MukiꞋa Sauve vayaꞋmoꞋya ani kumai akefaenena kumaima heꞋya mukiꞋa kefo yaꞋenema humainaya Sauve vayaꞋmoꞋyama ani kumateꞋma kae-malesageno ata halinamoꞋma ageteꞋya tusiya huꞋya hamauna huteꞋya avia ategahae .
43014023	Faith	Havigegeno YisasiꞋa mage huno hie “ NagoꞋa veaꞋmoꞋyama nagaifema hamau amayamopafima hamaisigeꞋyahena nagai kemona akave malesagenofena NenafaꞋa amakaifena aniꞋa huno hau ayamopafina haugahie . NenafaꞋene nagaiꞋnienena amakaiꞋene emaigahuꞋe .
62004010	Grace	Manima hau ayamopafima hau-mainea yana tagaya Anumaya Kotife tahau tayamopafi nelahaiya yanomagi agaia tagaifema hau ayamopafima hau-mainegeno agaia nafanea hutegeno emaine . Tagayama kefo yama huna yafena Anumaya Kotia havino aipa haviya hu-lateneanagi Yisasia kefo yatihe huno faligeno Anumaya Kotia aigetateno kefo yatia alitalesia yafe Yisasina hutegeno emaine .
62001007	Faith	Nomalonanagi Anumaya Kotima hale yapima mainea ya huta hale yapima ute etema hisunana nelafuyaene nagoke taipale maisunagenoa Anumaya Kotina nafaneamoa , Yisasi kolamoa mukia kefo yatia aye hami nelate .
48004007	Grace	Humaineafe kagaya nofipina nagoene omaigane . Aao . Menia Anumaya Kotia kavaleno agaia nafane kategeka mainane . Anumaya Koti nafane mainanafe Kamigahue . huno hulokiya vaimalenea yana aligane .
58001008	Faith	Hu-maineanagi nafaneamofena mage hu-maine Anumaya Kotiga kagaya mukia kanafina agola kava yagaika maige maige huka maigane . Kagaikaa kavama yagaisanana fatago auavateti yagaigane .
43010033	Sin	Hama-vi-gegeꞋya “ Tokiya avame yama hu-mainana yafene huta yafatetila okahaegahunagi kagaya ma mopafi afa kano mainekagi ‘ Anumaya KotiꞋene nagoke mainoꞋe . ’ hukama hanana Anumaya Kotina kalana ategana kema hana yateti kagaila yafa kaꞋyotetila kahaegahena nehune . ” huꞋya hae .
66014011	Description	MukiꞋa kanafina ani amakatama aige aige hisia atamo halinamoꞋa taga ohugahianagino agola haige haige huno haigahie . HaigeꞋya ani veaꞋmoꞋya kefo afai afuleꞋene amayateti avame-name huꞋya talo hu-malenaya amemaꞋaene agia alisaga nehuꞋyama ani kanomo agima amaugafale hanesia veaꞋmoꞋya mukiꞋa kanafina agola kegeꞋene felugaene amaugafa amakata aige aige hinageꞋya haꞋno ohugahie . ” huno humaine .
47004001	Faith	Anumaya KotiꞋa kalagi ailateno “ Nagai kea huhaletama hiho . ” huno hulateneafe “ Kasalotahae . ” huta nohune .
58013006	Faith	Hu-maineanagita tole lagesa ohavisunagi tokiyaage huta maineta mage hisune Kolia ohugahugi Anumayamoa kanaleya huno naya nehigeya veamoya ali haviya hu onategahae . huta hugahune .
45014003	Recommendation	MukiꞋa kaveꞋma nesia kafu-kaganaꞋa afuma nonesia afu-agananafena “ Afa kano mainane . ” huno huoꞋateno . Afumo ameꞋama nonesia afu-aganaꞋa mukiꞋa kaveꞋma nesia afu-aganafena “ NaꞋa kano mainane . ” huno huoꞋateno . Anumaya KotiꞋa ani tole kanolatana ago anavale-maine .
45015005	Grace	Anumaya KotiꞋa veala tokiya vaisaya yaꞋene amaku amakesa ali hetimatesia yaꞋene aepaꞋagino tamaya hisigetama Yisasi Kalaisi humainea auꞋava yana akave maletafa hutama nagoke tamaku tamakesale maisae huꞋna Anumayamotega havinegoe .
58007027	Description	Nayona mono notela hagote kava vayamoya mukia kanafina sipi sipi heya kae-salamana huya Anumaya Kotina neamiyane . Neamiya hagoteya amakaiami kefo yaamima ali-talesiafene huya Anumaya Kotina amiteya anile mukia veamogami kefo yaamima ali-taleseafene huya haenaga aminayane . Aminayanagi Yisasia agaia kefo yamaa omaleanagi nagoke yupa kanoa veamogami kefo yafene huno yafaga yosale fali-mainea yupa agaia augafa hakino Anumaya Kotina amiteno kae-salamana huteneane .
62003017	Sin	Faligahunanagi nagoa veamoyama ma mopalema kanaleya huya maisaya yana hanegeya nagoa yafema kafu huya nemaiya anagaamima amaketeya Tamahaote yatamie . huya nagola nesaya yana oamamisagenoa Anumaya Kotina hau ayamopafima nehaiya yana ani veamogamipina tamage huno omalene .
47005008	Faith	
60002011	Recommendation	Nahau-mainea nafunagana-gatama menia ali lamakafa huna tamahanepauve tamakaya ma mopalela aupa kana kanoama maisayafene tamaugafahema age lamahayema nehaya yana ataleho . Anima age lamahaye hisaya yamoa tamaku tamakesaene ke vaiana tu nehae .
60002017	Recommendation	Mukia veamogamina tamaipa amamiho . Tamafu-tamakana-gamina kayone humamiho . Anumaya Kotife kolia hiho . Ala sauve kanomo agi alisaga hiho .
44007025	Description	Faligeno MoseseꞋa ma agesa havimaine “ VayaꞋnimoꞋya mage huꞋya hugahae ‘ Anumaya KotiꞋa Mosese ayapiti taugafa aligatigahie . ’ huꞋya hugahae . ” huno agesa havianagi vayaꞋamoꞋya ani amakesa ohavinae .
50003002	Violence	Kefo aliyama nealiya vayamoya afai kala kana huya Tamaugafa hataga hiho . huya nehaya vayafena kayetama maiho .
56001016	Sin	Ani veamoya amavayaleti mage nehae Anumaya Kotina agelama hu-mainone . huya nehayanagi nemaiya auava kavaamimoa ani kehena Havige nehae . huno tahapai-maine . Anumaya Koti kea aliya neatagayageno kanale auava kava hisaya tokiyaamia omalegeno Anumaya Kotia amakaifena tusiyate nohaiye .
45010002	Faith	Amakayama nehaya kavala ageteꞋna mani kea nehue amakaya Anumaya Kotina haisia kavala aluya huꞋya hisaya amaku amakesa nehaviyanagi anima haiya yafena havilama nohuꞋya ani kavala nohae .
47001004	Grace	Tagaya mukiꞋa kana yama alunagenoꞋa Anumaya KotiꞋa taipa kanale hulatesia yana nelamie . Tamineafe tagaya aniꞋa huta nagoꞋa veaꞋma kana yama falote humatesigeta Anumaya KotiꞋa tayama hia kava huta veala amaipa alita kanale humatesunafe tagaiteꞋma falote humainea avamete kana yana falote humaine .
55002015	Recommendation	Anumaya Koti aufima hetisana yupa kagai aliyafena muse hugatesia yafena Anumayamona kanale kelamage kemona aepaa havi fatago huka kaya mukiki huka hu falote nehuka kagayea ohino .
