44015009	Faith	Tu'ntzintzjo, junx qten kyuk'a twutz Dios, qu'n o tx'ixpit kychwinqil noq tu'n kynimb'il, ikyxjo tze'nku qe.
46011028	Recommendation	Tu'npetzi'n, teyile junjun tu'n t-xpich'in ti'j tchwinqil, qa at jun tky'i twutz Dios, a na'mxtaq twa'n ex tk'wan ti'jjo Xjan Wab'j.
46015058	Faith	Tu'npetzi'n werman, nimx tq'aq'b'il nk'u'ja kyi'ja, chi we'kuxixa wen, ex mi chi yekjxa toj kynimb'ila. Kyb'inchinkuy taq'in qMan Dios tuk'a tkyaqil kyanmi'n, qu'n ojtzqi'n kyu'n, qa a kyaq'i'n anetzi'n, nya noqx kukxjo, qala' at chojb'il te.
46004016	Recommendation	Tu'npetzi'n, nchin kub'sin nwutza kye'y tu'n tok kyka'yi'n wi'ja, ex tu'n tkub' kyb'inchi'n tze'nku nb'ant wu'n, tze'nku jun tal k'wal ti'j ttata.*
46001021	Faith	Qu'n tb'anilxjo t-xilin qMan, qu'n mi xtaq' tu'n tel tniky'tzajil kyu'nxjal noq tu'n kynab'l nimx ti'jjo te twutz tx'otx'. Qalatzi'n nejxix xtaq' kolb'il kye xjal, aye' i nimin ti'j Tyol, exla qa nti' tajb'in toj kywutz junjuntl.
60003001	Recommendation	Ex ikyx kyeji'y xu'jlb'aj, kyniminkuji'y kychmila,* tu'ntzintla qa at jun n-el ti'jlin Tyol Dios, aku kub' ti'j tnab'l, nya tuk'a jun yol, qala' noq tu'njo wen nb'ant tu'n,
47005020	Recommendation	Ma qo ok nyakuj t-xel Crist tzalu'n twutz tx'otx'. Ex nqo yolin kyuk'axjal nya nimil, nyakuj aku Dios nkub'sin twutz kye. Tu'npetzi'n, nxi qq'ma'n kye tu'n kymujb'in te kyib' tuk'a Dios.
44002024	Description	
59002007	Sin	¿Ma nyatzin aye nchi xo'n yol ti'j tb'i qMan Dios, a o txi kynimi'n?
54003003	Description	ex nya tx'ujtinel, ex nya b'ujil, qala' wen, ex che'wxix tanmin, ex nya xo'nk tk'u'j ti'j pwaq.
43004014	Grace	Me ankye te' kxel k'wan te' che'we kxel nq'o'n, nlaypen tzaj jun majl te' k'waj ti'j. Qu'n atzi'n che'we kxel nq'o'n te, kpuljil toj tanmin, tze'nku' xlok' a', tu'n tten tchwinqil te jun majx.*
62002005	Faith	Me atzin xjal, a nkub' tnimin Tyol Dios, mapen tz'ok tk'u'jlintz qMan Dios tuk'a tumil, ex antza k-elile qniky' te, qa at qmujb'il qib' tuk'a.
66016013	Description	Ex i nli'y oxe taq'nil tajaw il, nyakuj ẍulma'qe, i etz toj ttzi ma tijxix txuk, a iky ka'yin tze'nku xmatx, ex toj ttzi tkab' txuk, ex toj ttzi toxin txuk, a ok tq'o'n tib' te jun yolil Tyol qMan.
59002008	Recommendation	Qatzin tzunxix nkub' kyb'inchinji'y wen, a nuk'b'il nimx toklin, a ntq'ma'n toj Tu'jil Tyol Dios, tu'n tok tk'u'jlin t-xjalila tze'nku n-ok tk'u'jlin te tib' til tib'xa;* ex tb'anilx te' nb'ant ikyjo.
47004005	Faith	Tu'npetzi'n, mi nqo yoli'n toj aq'untl qil qib'xa; qala' nxi qq'ma'n qa a Jesucrist tAjaw Tkyaqil, ex awotzin qe', ma tz'ok qq'on qib'a tu'n qajb'in kye'y toj tumil tb'i.
46015033	Recommendation	Mi chi txalpaja toj kynimb'ila, ikyjo tze'nku ntq'ma'n juntl yol kyxolxjal: Mi chex kyb'inji'y yol nya tumilqe, tu'n mi che'xa q'i'n kyu'n.
58013020	Grace	O tzaj tq'o'ntl Dios jun ak'aj tumil tu'n qkyij toj wen tuk'a te jun majx, noq tu'n tchky'el Jesús, a qAjaw.* Jaw anq'in juntl majl kyxol kyimnin tu'n Dios, ex ok q'o'n te Tb'anil Kyik'lel nimxix toklin tib'aj tkyaqiljo nimil ti'j Dios,* a nik'ulte tkyaqil, ikyxjo tze'nku taj.
50001027	Recommendation	O'kx jun tumiljo nxi nq'o'n kye'y: Kyq'o'nka tilil, tu'n tten kychwinqila, ikyxixjo tze'nku ntzaj tyek'in Tb'anil Tqanil Crist. Exla qa inti'n kyuk'iy exla qa mina, qu'n tu'n najchaq intini'y kyk'atza; me atla waji'y, noq tu'n tul jun kyqanila, qa tb'anilx ite'yi'y, ex qa jikyin ite'yi'y toj kychwinqila, ex qa at kymujb'il kyib'a kyxolilixa kykyaqila, ex qa nchi aq'ni'n wen toj kynimb'ila, a tzaj q'o'n kye'y, tej kynimi'n Tb'anil Tqanil kolb'il,
46006014	Grace	Qu'n ikytzi'n tze'nku xjaw anq'in t-xmilil qAjaw tu'n Dios, exsin ikyxjo qe, kjawil anq'in qxmilil, tu'n tipin.
55001006	Recommendation	Tu'npetzi'n, nxi nna'nxixji'y lu'n te'y, tu'n tja ti'n tib'a wen, ex tu'n mi tz'el tyajinjiy tokli'n, a ma tzaj tq'o'n Dios, tej tkub' nq'o'n nq'ob'a tib'aja, tu'n toka te jun nejinel toj Ttanim Dios.
60004006	Grace	Qu'n ayetzi'n, a o chi kyim, ma yolajtz Tb'anil Tqanil kye, tu'ntzintla tanq'in kyanmin tu'n Dios, exla qa ma kub' kyximinxjal qa nti' kyoklin tu'n kyanq'in tzalu'n twutz tx'otx'; ex b'e'x i kub' kyb'yo'n.
46007023	Recommendation	Qu'n ma chi laq'eta tu'n Dios tu'n jun chojb'ilte wiyilxix, a tchky'el Jesucrist. Tu'npetzi'n, nya wen tu'n t-xi kyk'ayin kyib'a te aq'nil te jun majx kyexjal.
46010010	Recommendation	Ex mi chi yolb'i'n ti'j Dios tze'nku junjunkye i yolb'in, ex b'e'x i kyim tu'n angel te kyimin.*
47002017	Faith	¡Nya noq a'lchaqku! Qala' o'kqexjo aye' junxch'in tumil q'i'n kyu'n twutz Dios, ex nchi yolin tu'n, ti'j Crist. Ex nya ikyxjo tze'nqeku txqantl, aye nchi suqin Tyol Dios noq tu'n kykanb'in pwaq ti'j.
45015001	Recommendation	Me awotzinqe, awo at qipin toj qnimb'il, il ti'j tu'n kyiky'xjo quk'a qu'n, a nyaxix kujqe toj kynimb'il, ex mi kub' qb'inchin a tze'nkuxjo qaj.
50002024	Faith	Me q'uqle we' nk'u'j ti'j qAjaw, tu'n njatza tzalu'n toj tze, ex loqinl we', liweyku chin po'n lol kye'y.
66007001	Description	Tb'ajlinxi' ikyjo, xi nka'yi'n kyaje angel wa'lqetaq toj kyaje tumil tx'otx', a tzyu'ntaq kyaje kyq'iq' kyu'n,* tu'ntzintla mi xupin kyq'iq' tib'aj tx'otx', ex tib'aj ttxuyil a', mixpe tib'aj jun tze.
60004003	Sin	Akuxjo ja'lin, a nkub' kyb'inchintaqa ojtxe, a tze'nkuxjo kytzeqb'ilxjal nya nimilqe. Qu'n ikytaqtzin nchi b'eteji'y tojjo jni' nya wen, ex nimkutaq n-el kyanmi'n ti'j, ex tx'ujtinelqi'y, ex manyor ky'a'jilqi'y, ex noqx nchex lipe ti'j tkyaqiljo il, ex nchi k'uli'n kywutzjo kywutzb'iyil junxil kydiosxjal.
66011005	Violence	Ex qa at jun nt-ximin tu'n tkub' b'inchin mib'in kyi'j, ok k-okil q'aq' toj kytzi, tu'n kytz'e'y te jun majx. Ex ikytzin kchi kyimile' aye kyaj tu'n kyb'inchin mib'in kyi'j.
44023005	Recommendation	Xitzin tq'ma'n Pabl: Ayi'y werman, noq sameqi'y, qu'n nya b'intaq we' wu'n, qa a tnejilxix pale'; qu'n toj Tu'jil Dios ntq'ma'n kyjalu'n: Mina qanb'in ti'jjo kawil toj ttanim.*
66022015	Sin	Me ayetzin kye aj ilqe: Aye yuẍqe, exqetzi'n jni' ky'a'jil, exqetzi'n b'yol xjal, ex tkyaqil nchi k'ulin twutzjo twutzb'iyil, ex jni'qe sb'ulqe nti' kyoklin ti'j tkyaqiljo b'a'n tuk'a Ttanim Dios.
66002014	Sin	Me at junjuntl kyila nwutza. Qu'n at junjun kyxola, a ikyxjo nb'ant kyu'n tze'nku t-xnaq'tzb'in Balaam ojtxe, a ka'min tk'u'j. A b'aj oksinte tk'u'j Balac, a attaq tq'oj kyi'j aj Judiy, tu'n kyok t-xmoxin tu'n kyjaw tz'aq toj il, noq tu'n t-xi kychyo'n chib'j, a xi oyit kywutzjo kywutzb'iyil kydiosxjal, ex tu'n kyb'inchin aj ky'a'jil toj kyb'i.*
53001003	Faith	Erman, kukx nxi qq'onji'y chjonte te qMan Dios kyi'ja. Ex il ti'jjo lo tu'n tkub' qb'inchi'n, qu'n a kynimb'ila nch'iyxix wen, junx tuk'a kyk'u'jb'ila teyile junjun.
46012002	Sin	B'i'n kyu'n, te' na'mtaq kynimi'n Tyol Dios, nxi kyq'o'ntaq kyib'a tu'n kykub' sb'u'n, ex nchex q'i'ntaqa k'ulil kywutzjo twutzb'iyil, a mib'in chi yolin.
49005025	Recommendation	Exsin ikyx kyeji'y chmilb'aj, kyk'u'jlimqektzinji'y kyxu'jila, tze'nku te Crist s-ok tk'u'jlin Ttanim, ex xi tq'o'n tchwinqil tu'n tpaj.*
45012017	Recommendation	Mi kub' kyb'inchi'n nya wen kyi'jjo aye nchi b'inchin nya wen kyi'ja; qala' kyq'onka tilil, tu'n kyb'inchinteji'y wen twutz tkyaqil.
60005006	Recommendation	Tu'npetzi'n, kymutxsinku kyib'a twutz Dios, a nimxix tipin, tu'ntzintla kyjaw nimsi'n tu'n, aj tpon tq'ijil.*
44014017	Grace	Me mina xkyij ttzaqpi'n te Dios tu'n tyek'in te tib', noq tu'n tb'anil nb'anttaq tu'n. Qu'n atzin nxi q'onte jb'al kyib'aja, exsin tb'anil awal, ex a ntzaj q'onte tkyaqil tu'ntzintla kywa'n, ex tu'n kytzalaja.
54003011	Recommendation	Ex aye qya, a mojilqe, il ti'j tu'n kyb'et toj tumil, tu'n kynimajtz kyu'n txqantl, ex nya iqil yolqe, qala' mutxin kyten, ex tz'aqleqe toj tkyaqil.
66002021	Sin	Me ma txi nq'o'n amb'il te, tu'n tajtz ti'j tanmin, ex tu'n tmeltz'aj wuk'iy, me tky'e'x kyij ttzaqpi'n ky'a'jin.
44012020	Description	Tzuntaq q'ojle Herodes kyuk'a xjal te Tiro ex te Sidón. Tu'npetzi'n, i kyij toj wen tu'n kyxi' yolil tuk'a Herodes, me nti'taq tumil tze'n tu'n kyyoline. Tu'n ikyjo, nej i yolin tuk'a Blast, jun kawil tk'atz tnejil kawil Herodes; ex noq tu'n Blast, xi kyqanin, tu'n mina chi q'ojine, qu'n attaq kyoklin ti'jjo awal njaw toj tx'otx' tjaq' tkawb'il Herodes.
43008049	Sin	I xi ttzaq'win Jesús: Nti' jun taq'nil tajaw il toj wanmi'n; qala' o'kx waja tu'n tkub' nb'inchi'n tu'n tjaw nimsin tb'i nMa'n. Me metzin kye, o'kx kyaji'y tu'n wel kyi'jli'n.
43006018	Description	B'e'x tzaj jun nim kyq'iq' xupil te a', tu'n tja pulj ti'j bark.
45008018	Faith	Atzin ja'lin, te we'y, tkyaqiljo n-iky'x qu'n tzalu'n twutz tx'otx' mixla ch'in aku pon, tze'nku a tqoptz'ajiyil qMan Dios, a tzul, aj tjapin b'ajjo qanb'il tkub' twutz tx'otx', ex aj tyek'ajtz ankye qe tk'wal Dios twutzxix.
62002012	Grace	Ayi'y werman, nxi ntz'ib'i'n kye'y nyakuj tal nk'walqi'y, qu'n tu'n o kub' najsin kyila noq ti'j tb'i qMan Dios.
55001009	Grace	Qu'n ma qo klet tu'n, ex ikytzin ma qo ttxok, tu'n qok te tz'aqle twutz, nya tu'nxjo qb'inchb'in, qala' ikyxtaq t-ximjo atxix ojtxe, tej na'mxtaq tkub' xkye twutz tx'otx', qa tu'ntaqx ttzaj tchq'o'n Crist, a Jesús, noq tu'n t-xtalb'il.
43019006	Violence	Atzaj te' tok kyka'yi'n kynejil pale exqetzi'n xq'uqil tja Dios ikyjo, b'e'x i ok ten ẍch'il: ¡Pejk'inksa twutz cruz! ¡Pejk'inksa twutz cruz tu'n tkyim! chi chi'. Xi tq'ma'n Pilat kye: ¡Kutzin! Kyinxa, ex kypejk'inksa twutz cruz, qu'n nti' jun til ma knet wu'n.
60001010	Grace	Kyojjo q'ij ojtxe, aye yolil Tyol Dios, aye i k'mo'nte Tyol, nim i xpich'in ti'j, ex i jyo'n ti'jjo t-xilin kolb'il, a tu'ntaq xi tq'o'n Dios kye'y tu'n t-xtalb'il.
63001007	Sin	Ma kyij ntz'ib'inji'y lu'n, qu'n at nim sb'ul xjal tzalu'n, aye nxi kyq'ma'n qa mi s-ok Jesucrist te ichin, tej tul twutz tx'otx'. Ayetzin sb'ul xjaljo, aye ajq'ojqe ti'j Klolqe Jesús.*
44024005	Sin	Ma tz'el jyetjo ichin lo qu'n, qu'n ma tzul q'ol te' jun yab'il qxola, ex nb'et twutz tkyaqil twutz tx'otx', tu'n tokx q'oj kyxol Judiy, ex axix kynejiljo jun ma' ch'uq xjal, Nazarenos kyb'i.
54003016	Grace	Tu'npetzi'n, b'i'nxix qu'n, qa nimxix t-xilin qnimb'il, ikyxjo tze'nku nqq'ma'n: Tzaj tyek'in Dios tib' qe noq tu'n Jesús, a Tk'wal, tej tok te xjal. Ex tzaj tchiky'b'in Xewb'aj Xjan qa twutzx, qa a Diosjo; ex iwle kyu'n angel. O yolajtz kyexjal tkyaqil twutz tx'otx', ex nim xjal o nimin ti'j. Ex jax q'i'n toj kya'j, ja' nqoptz'aje qMan Dios te jun majx.
66016021	Violence	Ex b'e'x tzaj tz'aq kyib'ajxjal nim saqb'aqin toj kya'j, b'alaqa wajxaq almud talil junjun.* Me ayetzinxjal, b'e'x i b'aj ok ten yasil ti'j Dios, noq tu'n tpajjo nim saqb'aqin, qu'n nimxixjo ky'ixsb'ajil tu'njo lo.
61003013	Faith	Me metzin qe tzun nqo ayo'n ti'j jun ak'aj kya'j ex jun ak'aj tx'otx', a o tq'ma Dios,* a ja' ktenb'ile' tkyaqiljo wen te jun majx.
66006014	Description	Ex atzin kya'j b'e'x el naj, tze'nku jun u'j njaw tb'altz'in tib'.* Ex kykyaqiljo wutz ex jni' tx'otx' toj ttxuyil a', b'e'x i tx'ixpaj ja' ite'ku.*
58010010	Grace	Ex noq tu'n Jesús, a chojb'il qil, ma tz'ok qanmin saqxix te jun majx, qu'n ate Jesucrist kub' tb'inchin tajb'il qMan Dios, tej tkyim twutz cruz.
52001002	Faith	Kukx nqo q'o'nji'y chjonte te qMan Dios kyi'ja,
66006004	Violence	Ex b'e'x etz juntl chej, kyaq ka'yin.* Ex atzin nchejin tib'aj xi q'o'n jun kxb'il tze'nku machet te b'i'yb'il, ex xi q'o'n toklin, tu'n tel ti'n kymujb'il kyib'xjal kyxolx, tu'ntzintla tkub' kyb'yo'nxjal kyib', jun tuk'a juntl.
54006001	Recommendation	Tkyaqiljo nimil, aye' ma chi ok te aq'nil te jun majx, il ti'j tu'n tkub' kynimin tajaw aq'untl toj tkyaqil, tu'ntzintla mi chi yolb'inxjal ti'j tb'i qMan Dios ex ti'jjo qxnaq'tzb'il.
51003009	Recommendation	Mina chi sb'u'n tuk'a juntl, qu'n o chi tzaqpaja toj ojtxe kyte'n ex tkyaqiljo nya b'a'n, a nkub' kyb'inchintaqa ojtxe.*
66002020	Sin	Me at jun kyky'i'y nwutza, qu'n nkub' kywutzlinji'y qya, a Jezabel,* a ok tq'on tib' te jun yolil wi'ja. Me nchi kub' tsb'u'n tuk'a t-xnaq'tzb'il aye nchi ajb'in we'y, noq tu'n kykub' tz'aq toj ky'a'jin, ex tu'n t-xi kychyo'n chib'j, a xi oyit kywutzjo kywutzb'iyil kydiosxjal.
48003008	Grace	Qu'n ojtzqi'ntaq tu'n Dios, qa iltaq ti'j tu'n kykletjo nya Judiyqe noq tu'n kynimb'il ti'j Tb'anil Tqanil kolb'il. Tu'npetzi'n, xi tq'ma'n te Abraham kyjalu'n: Noq tu'n tpaja, k'wel nky'iwli'n tkyaqil xjal twutz tx'otx'.*
58012005	Recommendation	Ex ma tz'el naj toj kyk'u'ja a saj tq'ma'n Dios kye'y, a ayi'y k'walb'ajqi'y te. Qu'n chitzin Diosjo kyjalu'n toj Tu'jil Tyol: Nk'wal, mi tz'el kyiky'i'n aj tjikysin Dios ti'j kychwinqila, qu'n n-ajb'in te q'ol tumil toj kynimb'ila. Ex mi chi kub' numja, aj kykub' kawi'n tu'n.
58013017	Recommendation	Kyniminqekutzinji'y aye' nejinel kyxola toj Ttanim Dios, ex kyb'inkuji'y kykawb'il; ayetzin xq'uqil kyeji'y, tu'n mi naje kyanmi'n te jun majx toj q'aq'. Qu'n b'i'n kyu'n nejinel, qa at jun q'ij, ja' kyq'a'b'ile tqanil kyi'ja twutz Dios. Tu'ntzin ikyjo, kyniminqekutzi'n, tu'n kyxq'uqin kyi'ja tuk'a tzaljb'il, ex nya tuk'a b'is, qu'n qa tuk'a b'is, nti'xla ch'in tajb'in te kye'y.
44013019	Description	Ex ma kub' tyuch'in wuq ma tij ch'uq xjal toj tx'otx' te Canaán, tu'ntzin t-xi q'o'n tx'otx' anetzi'n kye ojtxe qxe'chil.*
54006003	Faith	Qa at jun xjal nxnaq'tzin jun tumil nya twutzx, qa mikyxi' tze'nku tb'anil xnaq'tzb'il tu'n qAjaw Jesucrist, ex qa mikyxi' tze'nku ntyek'in qnimb'il;
63001010	Recommendation	Qa at jun xjal xkanin xnaq'tzil kyuk'iy, qa nyatil t-xnaq'tzb'iljo tze'nku te Jesús, mi tz'okx kyk'le'n toj kyjay, ex mina kub' kytziyi'n.
47001005	Grace	Qu'n ikytzi'n tze'nku' qe' nim yajb'il n-iky'x qu'n, noq tu'n tpaj taq'in Crist, ex ikyxjo nimxix chewsb'il qanmi'n ktzajil q'o'n tu'n.
65001011	Sin	B'isb'ajilxla kye xjal lu'n, qu'n ma chi ok lipe b'inchilte ikyxjo tze'nku tb'inchb'in Caín, a kub' tb'yo'n titz'in.* Ex ma chi el txalpaj toj kychwinqil, ikyxjo tze'nku te Balaam, noq tu'n tkanb'it kypwaq, me nya toj tumil.* Ex tze'nku kyime Coré, te' tok meltz'aj ti'j tkawb'il Dios,* ikyqetzin xjal lu'n, kchi najil te jun majx.
65001010	Sin	Qalaqetzi'n xjal kyxola, loqe nchi yolb'in nya b'a'n ti'jxjo a mina n-el kyniky' te. Noq n-ok kyu'n, ex atzi'n a ojtzqi'n kyu'n qa nya wen, axixsin nche'xjo b'inchilte, ikyqe tze'nqe txuk nti' kynab'l. Tu'ntzintzjo, chi xe'ltz toj najin te jun majx.
58011007	Faith	Ex ikyxjo te Noé, tej tyolin Dios tuk'a qa attaq jun il tu'n tul twutz tx'otx'. Ex na'mtaq tul kani'n il anetzi'n, tej t-xi tnimin Noé a tq'ma Dios. Ex noq tu'n tkub' tnimin Noé, kub' tb'inchin jun bark ma tij, noq tu'n kykletjo jni' tk'wal, t-xu'jil exqetzi'n tlib'. Tu'n tnimb'il Noé, kub' tyek'in kywutzjo txqantl xjal, qa najnintaq ite'ye. Me atzin kye Noé, noq tu'n kynimb'il, i klete te tkyaqil il.*
58009006	Description	Kykyaqiljo lu'n b'inchin toj ja, a xb'alin tten, te na'b'l Dios; ex ayetzin pale kukx nchi o'kxtaqjo toj tnejil elnin ja, a Xjan Najb'il, te b'inchilte tkyaqil tumil taq'in, tze'nku' kyij tyolin Moisés toj Tu'jil Tyol Dios.*
44007051	Sin	Me ayetzin kye', kukxjo mi n-okx toj kywi'y. Mina nxi kyb'i'n, ex nti' nimb'il toj kyanmi'n; qu'n noqx nchi q'ojli'y ti'j Xewb'aj Xjan ikyqexji'y tze'nku ojtxe qxjalil.*
54001009	Sin	B'a'n tu'n ttzaj qna'n, qa nti' kawb'il ntzaj kyib'ajjo nkub' kyb'inchin wen, qala' kyib'ajjo nchi b'inchin nya wen: Tze'nqeku xjal n-el kyi'jlin kawb'il, ex kyky'e' tu'n kynimin, ex aye nya b'a'nqe, ex aj ilqe, ex aye kyky'e' tu'n t-xi kynimin qMan Dios exsin Tyol, ex aye nkub' kyb'yo'n kyman ex kytxu, ex kykyaqiljo b'yol xjal,
46005009	Recommendation	Tojjo juntl wu'ja, xi nq'ma'n tu'n mina tz'ok kymujb'ina kyib'a kyuk'a aj ky'a'jil,
48001015	Grace	Me ax te Dios xjaw sk'o'n we'y; te' na'mxtaq witz'ji'y, ex noq tu'n t-xtalb'il wi'ja, ma chin tzaj ttxko'n, a tze'nkuxjo taj.
45007015	Description	Qu'n mi n-el nniky'a te tiqu'nil mi nb'ant wu'n a waja tu'n tkub' nb'inchi'n. Ex atzi'n a nky'e'y tu'n tkub' nb'inchi'n, atzin b'antjo wu'n.*
61003018	Faith	Qala' chi ch'iyxa toj t-xtalb'il Dios ex toj kyojtzqib'la ti'jjo qAjaw ex Klolqe Jesucrist; nimxit tb'i ja'lin ex te jun majx. Ikyxitjo.
46004010	Description	Qu'n ma qo oka toj kywutza nyakuj nti' qnab'la, ex nti' qipi'n toj ch'in tal qaq'i'n toj tb'i Crist. Qalatzin kye, ma tz'ok kyq'o'n kyib'a twutz Crist, manyor ẍtijx ex nim kyipi'n wen. Qu'n ma kub' kynimi'n kyib'a kyxola; me atzin qe', ma qo el kyiky'i'n.
60005009	Faith	Chi we'kuxixa twutz toj kynimb'ila, qu'n b'i'n kyu'n, qa kykyaqil nimil toj tkyaqil twutz tx'otx', ikyx n-iky'xjo kyu'n, tze'nkuxjo kye'.
51003022	Recommendation	Ex ayetzi'n aq'nil, kyniminqekutzinji'y tajaw aq'untl toj tkyaqil, a at toklin kyib'aja tzalu'n twutz tx'otx', ex nya noq o'kx tu'n kykyija wen kyuk'a, tze'nku nchi ka'yin kyi'ja; qala' kyb'inchinkuy tuk'a tkyaqil kyanmi'n, ex tuk'a tkyaqil amb'il kyi'ja, nyakaxtlaj te qAjaw Jesús nchi aq'nini'y, ex nya noq o'kx texjal, qu'n b'i'n kyu'n a qAjaw nka'yin kyi'ja.*
66017012	Description	Me ayetzin lajaj tkach, a ma tli'y, ayetzi'n lajaj nmaq kawiljo, a na'm t-xi xkye tu'n kykawin.* Me ok ktzajil q'o'n kyoklin te kawil junx tuk'a ma tijxix txuk, me noq te jun paq.
46002012	Grace	Ex awotzinqe, nya ma tzaj qk'mo'n jun xewb'aj, a tzajnin te twutz tx'otx', qala' a Xewb'aj Xjan, a tzajnin te Dios, tu'ntzin tel qniky' te tkyaqiljo a o tzaj tq'o'n noq tu'n t-xtalb'il.
59005001	Recommendation	Kyb'i'ntzin ja'lin, ayeqi'y q'inin: Chi oq'a, ex chi ẍch'i'n, qu'n ktzajil jun kawb'il kujxix kyib'aja.
66002010	Recommendation	Me mi chi tzaj xob'a ti'jjo k-iky'ix kyu'n. Qu'n k'welix q'o'n junjun kye' toj tze tu'n tajaw il, tu'ntzin kyniky'b'ajtza; me kky'elix jte'b'in q'ij kyu'n. Me chi we'kuxixa toj kynimb'ila tzmaxi aj kykyima, ex kxel nq'o'n jun oyaj kye'y, a kychwinqila te jun majx.
54006011	Recommendation	Me atzin te, ma tz'oka jun ichin te Dios. Tu'npetzi'n, tzaqpinkjiy tkyaqil anetzi'n, ex we'kuxixa jikyin toj tchwinqila, toj tb'inchb'i'n b'a'n, toj tnimb'ila, toj tq'aq'b'il tk'u'ja, ex kukx tu'n tayo'n tajb'il qMan toj tkyaqil, ex mutxinku tten.
59005005	Sin	Atzin kye' tzalu'n twutz tx'otx', ma kyli jun kye' kychwinqil toj tb'anilx, ex tze'nku kyaja, ikyqetzinji'y tze'nku jun ma nimxix wakx ma b'ant, tu'n tkub' b'yet.
66004004	Description	Ex ti'jile q'uqb'il lo, xi nka'yi'n kyaje toj ka'wnaq* nejinel q'uqleqetaq tib'aj kyaje toj ka'wnaq q'uqb'il, toktaq kyxb'alin sjanin wen, ex tokxtaq jun toj kywi' b'inchin tu'n q'anpwaq te jun yek'b'il te' kyoklin.
66018007	Description	Kyq'onxa yajb'il, tu'n tiky'x kyu'n, tze'nkuxjo otaq txi kyq'o'n kyib' nej, tu'n kynimsin kyib', ex tu'n kytzeqin ti'j tkyaqil. Qu'n ma kub' kyximin toj kyanmin: Loqin we q'uqleqi'n tzalu'n tze'nku jun qya kawil, qu'n nya o kyim we wuk'a. Ex nlayxla chin b'isin we', chi'.
60003007	Recommendation	Ex ikyxjo kye' chmilb'aj, tenxit kynab'la kyuk'a kyxu'jila, ex kyq'onktzi'n kyoklin,* qu'n nti'xix kyipin tze'nku kye ichin, ex at kyoklin junx kyuk'iy twutz qMan, ti'jjo ak'aj chwinqil, noq tu'n t-xtalb'il Dios. Kyb'inchinkuji'y lo, tu'n nti' jun ti' aku tz'ok miyo'nte kyna'j Diosa.
54002012	Recommendation	Mi chin q'o'n qya xnaq'tzb'il kyib'aj ichin, ex nya tu'n kykawin kyib'aj. Qala', noq tu'n tkub' kyb'i'n, ex nya tu'n kych'otj.
46001009	Faith	Ex ate Dios kukx njapin b'aj Tyol tu'n, a xjaw sk'o'n kye'y, tu'n kymujb'in te kyib'a tuk'a qAjaw Jesucrist, a Tk'wal.
48005013	Recommendation	Ayi'y werman, ma chi txoklajtza tu'n qMan Dios, tu'n kytzaqpaja tjaq' tkyaqiljo lo. Me nya tu'n ma chi tzaqpeta, k'wel kyb'inchinji'y tkyaqiljo ntqanin ojtxe kyte'n, a tkyaqil achb'il. Qala' il ti'j tu'n kyajb'i'n kyxolilixa, ex tu'n tok kyk'u'jlin kyib'a.
59002012	Recommendation	Ayetzintza ja'lin, chi yolinxa toj ttxolil, ex chi b'et-xa toj tumil, noq te jun yek'b'il ti'j kynimb'ila; qu'n b'i'n kyu'n qa kchi okila toj pa'b'in twutz tkawb'il Dios, ex ax kawb'iljo ktzaqpil kye'y.
46012005	Faith	Ex at nimku tumil tu'n qajb'in te Dios, me junxch'in qAjaw, a ja' nqo ajb'ine.
45009005	Description	Ex k'walb'ajqe kye tnejil qxe'chil, aye nmaq nimil ti'j Dios. Ex tu'ntzin kyyajil ikyjo, itz'je Crist, a Dios, tAjaw Tkyaqil, nimxit tb'i te jun majx. Ikyxitjo.
47001006	Description	Exla qa ma tz'ikyx qu'n tu'n tpaj tb'i Crist, mo qa nqo tzalaja tu'n chewsb'il qanmi'n tu'n, tkyaqiljo lo n-ajb'in te chewsb'il kyanmi'n, ex te kolb'il kye'y, tu'ntzintla kywe'xixa toj kynimb'ila toj tkyaqiljo yajb'il n-iky'x kyu'n, tze'nkuxjo qe' n-iky'x qu'n.
47001021	Faith	Qu'n axte Dios ma q'onte qe, tu'n qwe' wen toj qnimb'il ti'j Crist, ex o qo jaw tsk'o'n, tu'n qb'inchin taq'in tzalu'n twutz tx'otx'.
44010015	Recommendation	Yolin juntl majljo tq'ajq'ojil twi' jun a'la, ex tq'ma: Me ante ja'lin, wen tchyo'ljtzjo, a nya wentaq tchyo'ljtz ojtxe, qu'n ate Dios o q'mante qa wen. Tu'npetzi'n, mina tz'ok tq'o'n te nya wen.
66018009	Sin	Ayetzi'n nmaq kawil twutz tx'otx', aye' ẍi ky'a'jin ex ẍi ten tojjo tzeqb'il kyuk'a xjal toj tnam Babilonia, okxla kchi oq'il, ex kchi lab'il ti'j, aj t-xi kyka'yin tsb'eljo tnam, aj tb'aj tu'n q'aq'.
43014023	Faith	Xi ttzaq'win Jesús: Ankye te nk'u'jlin we'y, ex nkub' tb'i'n tkyaqiljo xi nq'ma'n, okpen k-okil k'u'jlin te' tu'n nMa'n, ex ayin we' tuk'ax nMa'n qo ul qe' najal tuk'a te jun majx.
62004010	Grace	Ikytzi'n tq'aq'b'il tk'u'j Dios qi'j: Qu'n nyaqo xqo ok k'u'jlinte nej, qala' ikytzin a saj q'aq'in tk'u'j qi'j te tnejil, ex saj tchq'o'n Tk'wal tu'n tkyim te chojb'il te' jni' qil.
62001007	Faith	Me qatzin nqo b'et toj spiky'in, tu'n qb'inchin wen, tze'nkuxjo te Dios, a spiky'in, attzin qmujb'il qib'tz qxolx qkyaqilx, qu'n o'kx tchky'el Jesús n-el ttxjo'n tkyaqiljo il.
48004007	Grace	Tu'npetzi'n ja'lin, nya noq jun aq'nilqo, qala' k'walb'ajqo te qMan Dios. Ex tu'ntzin k'walb'ajqo, at qoklin ti'j tkyaqiljo at te, noq tu'n Crist.*
58001008	Faith	Me mikyxi yoline Diosjo tuk'a Tk'wal, qala' chitzin kyjalu'n toj Tu'jil Tyol Dios: Ay Dios, a tAjaw Tkyaqil, atzin Tkawb'ila nimxix toklin te jun majx, ex tz'aqlexix wen.
43010033	Sin	Xi kytzaq'win Judiy te: Nlay tz'ok qxo'n te tu'n ab'j noq tu'n wen nb'ant tu'n; qala' noq tu'n nxo'n yol ti'j Dios tu'n tyola,* a noq jun tal ichin tze'nku qe'. ¿Me ma tz'ok tq'o'nnaj tib'a te Dios?
66014011	Description	Ex atzin tsib'iljo a k-iky'ix kyu'n, kjawix te jun majx,* ex nti' oyb'il ti'j q'ijl ex qniky'in kyejo i k'ulin twutzjo ma tij txuk, ex ti'jjo twutzb'iyil, exqetzi'n xi kytziyin tu'n tok kyechil, a tb'i.
47004001	Faith	Tu'npetzi'n, mi qo kub' numj, qu'n axte Dios tuk'a tkyaqil tq'aq'b'il tk'u'j, ma tzaj toqxenin taq'in qe toj ak'aj tumil, tu'n kykyijxjal toj wen tuk'a.
58013006	Faith	Tu'npetzi'n, qexix qk'u'j ti'jjo tmojb'il Dios qi'j, tu'n t-xi qq'ma'n: Ate Dios onil we'y. Tu'ntzin ikyjo, nlay chin tzaj xob'a tu'n tkyaqiljo aku tz'ok kyb'inchin xjal wi'ja.*
45014003	Recommendation	Ayetzin kye nxi' tkyaqil kyu'n, nya wen tu'n kyyolb'i'n kyi'jjo aye noq itzaj nxi' kyu'n. Ex ayetzin kye noq itzaj nxi' kyu'n, nya wen tu'n kyyolb'in kyi'jjo aye nxi kychyo'n tkyaqil. Qu'n kykyaqiljo lu'n ma chi ok te tk'wal Dios.
45015005	Grace	Noqit ax qMan Dios, a tzaj q'o'nte t-xel kye'y toj kynimb'ila ex Q'uqb'il kyk'u'ja, aku tzaj mojin kye'y, tu'n kyb'eta toj tb'anil kyxolxa, tze'nku xkyij tyek'in Crist, a Jesús,
58007027	Description	Ex mikyxi Jesúsjo tze'nku txqantl tnejilxix pale ojtxe, aye' iltaq ti'j tu'n tkub' kyb'yo'n alu'mj tnejil te chojb'il kyilku, ex te chojb'il kyilxjal.* Me metzi'n te Jesús xi tq'o'n tib' te jun majx, tej tkyim te chojb'il kyil kykyaqil xjal.
62003017	Sin	Me qa at jun, a at ch'in at te, exsin qa noq s-ok kyim ti'jjo juntl, a nti'x ch'in at te, ex mi saj chyo'nx tanmin tu'n t-xi tmojin, ¿Ma atpela tq'aq'b'il tk'u'j Dios toj tanmin? ¡Nti'!
47005008	Faith	Ex q'uqle qk'u'j ti'j, ex tu'ntzi'n ikyjo, qajatla tu'n tkyij tzaqpetjo qxmilil te twutz tx'otx', ex tu'n qaj najal tuk'a qAjaw te jun majx.
60002011	Recommendation	Ayi'y werman, nimx nk'u'ja kyi'ja, ayi'y nyakuj b'etin xjalqi'y tzalu'n twutz tx'otx'. Nchin kub'sin nwutza kye'y, tu'n tkub' kytzyu'n kyib'a ti'jjo kyachb'ila, a nya wen, a nchi q'ojin ti'j kyanmi'n.
60002017	Recommendation	Kyq'onxsi'n nimb'il te tkyaqil. K'u'jlinqekji'y jni' nimil. Tenxit tchewil Dios kyi'ja. Ex kyniminkuji'y nmaq kawil.
44007025	Description	Tu'n b'ant tu'n, kub' tb'isin Moisés qa akutaq tz'el kyniky'jo t-xjalil te, qa attaq toklin tu'n Dios tu'n kytzaqpajjo t-xjalil tjaq' tkawb'il aj Egipto. Me mix ele kyniky' te.
50003002	Violence	Kyka'yink kyib'a kye xjal, a nya b'a'n nb'ant kyu'n, a nya toj ttxolil nxa'ye kynab'l. Noq kyaj tu'n tok kyqitin jun techil ti'j ttz'umil kychib'jila, tu'n kyoka te kye, ex tu'n kyb'inchi'n jun ti' tib'aj kynimb'ila ti'j qAjaw Jesús.
56001016	Sin	Ex nkyq'ma'n xjal lu'n qa ojtzqi'n Dios kyu'n, me tuk'a kyb'inchb'in n-ele qniky' ti'j, qa nya twutzxjo kyyol. Qu'n aye xjal lu'n manyor iky'ilqe, ex mib'in chi nimin, ex nti' kyaj tu'n kyb'inchinte jun ti', a wen.
45010002	Faith	Qu'n ojtzqi'n wu'n, qa kyajxix tu'n kyxi lipe ti'j Dios, me noqtzin tu'n mikyxi' tze'nku' taj qMan.
47001004	Grace	Ex ax ntzaj q'onte chewsb'il qanmin toj tkyaqiljo a n-iky'x qu'n, tu'ntzintla tb'antqe qchewsinte kyanmi'njo noq ti'chaqku n-iky'x kyu'n, tu'nxjo chewsb'il anmin, a ma tzaj q'on qe tu'n Dios.
55002015	Recommendation	Q'onka tilil tu'n toka tze'nku jun aq'nil tb'anil twutz qMan Dios, tu'ntzin nti' tu'n ttzaj tx'ixwi'y ti'jjo taq'nb'i'n. Qala', yek'imjiy Tyol tze'nkux tten.
53002004	Description	Qu'n atzin ichin lo kjawil tnimsin tib' twutz Dios,* ex kq'ojlil ti'j tkyaqil kydiosxjal ex ti'j tkyaqil k'ulb'il. Ex okpe k'wel qe toj tnejil ja te kynab'l nxjalila Dios, aye' aj Judiy. Ex k-okil tq'o'n tib' nyakuj Dios. Ex ok tq'ma'b'il: Ayi'n we' Dios, chila'.
49006004	Recommendation	Ex ikyqex kyeji'y manb'aj, mi ka'min kyk'u'ja kyuk'a kyk'wala, tu'n tb'aj kyk'u'j. Qala' kych'iysinqeksa tuk'a tumil, ex kyxnaq'tzinqexa tu'n kynimin ti'j qAjaw.*
45008037	Grace	Me tojxix kykyaqiljo lo, ma kub' kyi'j qu'n, noq tu'n Crist, a k'u'jlinqo tu'n.
