59002001	Faith	ऐ, मेरे भाइयों; हमारे ख़ुदावन्द ज़ुल्जलाल 'ईसा मसीह का ईमान तुम पर तरफ़दारी के साथ न हो।
45003013	Sin	उनका गला खुली हुई क़ब्र है उन्होंने अपनी ज़बान से धोखा दिया उन के होंटों में साँपों का ज़हर है।
49005028	Recommendation	इसी तरह शौहरों को ज़रूरी है कि अपनी बीवियों से अपने बदन की तरह मुहब्बत रख्खें। जो अपने बीवी से मुहब्बत रखता है, वो अपने आप से मुहब्बत रखता है।
45009030	Faith	पस हम क्या कहें? ये कि ग़ैर क़ौमों ने जो रास्तबाज़ी की तलाश न करती थीं, रास्तबाज़ी हासिल की या'नी वो रास्तबाज़ी जो ईमान से है।
54003009	Faith	और ईमान के भेद को पाक दिल में हिफ़ाज़त से रख्खें।
54006002	Recommendation	और जिनके मालिक ईमानदार हैं वो उनको भाई होने की वजह से हक़ीर न जानें, बल्कि इस लिए ज़्यादातर उनकी ख़िदमत करें कि फ़ाइदा उठानेवाले ईमानदार और 'अज़ीज़ हैं तू इन बातों की ता'लीम दे और नसीहत कर।
45003003	Faith	मगर कुछ बेवफ़ा निकले तो क्या हुआ क्या उनकी बेवफ़ाई ख़ुदा की वफ़ादारी को बेकार करती है?
43019034	Violence	इस के बजाए एक ने भाले से ईसा का पहलू छेद दिया। ज़ख़्म से फ़ौरन ख़ून और पानी बह निकला।
43015012	Recommendation	“मेरा हुक्म यह है कि एक दूसरे को वैसे प्यार करो जैसे मैं ने तुम को प्यार किया है।
45006013	Recommendation	और अपने आ'ज़ा नारास्ती के हथियार होने के लिए गुनाह के हवाले न करो; बल्कि अपने आपको मुर्दों में से ज़िन्दा जानकर ख़ुदा के हवाले करो और अपने आ'ज़ा रास्तबाज़ी के हथियार होने के लिए ख़ुदा के हवाले करो।
58010039	Faith	लेकिन हम उन में से नहीं हैं जो पीछे हट कर तबाह हो जाएँगे बल्कि हम उन में से हैं जो ईमान रख कर नजात पाते हैं।
45011026	Grace	और इस सूरत से तमाम इस्राईल नजात पाएगा; चुनाँचे लिखा है, छुड़ाने वाला सिय्यून से निकलेगा और बेदीनी को या'क़ूब से दफ़ा करेगा।
52002015	Violence	जिन्होंने ख़ुदावन्द ईसा को भी मार डाला और हम को सता सता कर निकाल दिया वो ख़ुदा को पसन्द नहीं आते और सब आदमियों के ख़िलाफ़ हैं।
58010026	Sin	ख़बरदार! अगर हम सच्चाई जान लेने के बाद भी जान — बूझ कर गुनाह करते रहें तो मसीह की क़ुर्बानी इन गुनाहों को दूर नहीं कर सकेगी।
49002006	Grace	और मसीह ईसा में शामिल करके उसके साथ जिलाया, और आसमानी मुक़ामों पर उसके साथ बिठाया।
49004025	Recommendation	पस झूठ बोलना छोड़ कर हर एक शख़्स अपने पड़ोसी से सच बोले, क्यूँकि हम आपस में एक दूसरे के 'बदन हैं।
48002005	Faith	उनके ताबे रहना हम ने पल भर के लिए भी मंज़ूर ना किया, ताकि ख़ुशख़बरी की सच्चाई तुम में क़ाईम रहे।
46014013	Recommendation	इस वजह से जो बेगाना ज़बान से बातें करता है वो दुआ करे कि तर्जुमा भी कर सके।
44009001	Violence	और साऊल जो अभी तक ख़ुदावन्द के शागिर्दों को धमकाने और क़त्ल करने की धुन में था। सरदार काहिन के पास गया।
43017013	Description	अब तो मैं तेरे पास आ रहा हूँ। लेकिन मैं दुनियाँ में होते हुए यह बयान कर रहा हूँ ताकि उन के दिल मेरी ख़ुशी से भर कर छलक उठें।
60004013	Recommendation	बल्कि मसीह के दुखों में जूँ जूँ शरीक हो ख़ुशी करो, ताकि उसके जलाल के ज़हूर के वक़्त भी निहायत ख़ुश — ओ — ख़ुर्म हो।
44011006	Description	उस पर जब मैने ग़ौर से नज़र की तो ज़मीन के चौपाए और जंगली जानवर और कीड़े मकोड़े और हवा के परिन्दे देखे।
51003008	Recommendation	लेकिन अब वक़्त आ गया है कि तुम यह सब कुछ यानी ग़ुस्सा, तैश, बदसुलूकी, बुह्तान और गन्दी ज़बान ख़स्ताहाल कपड़े की तरह उतार कर फेंक दो।
44018003	Description	और चूँकि उनका हम पेशा था, उन के साथ रहा और वो काम करने लगे; और उन का पेशा ख़ेमा दोज़ी था।
45006012	Sin	पस गुनाह तुम्हारे फ़ानी बदन में बादशाही न करे; कि तुम उसकी ख़्वाहिशों के ताबे रहो।
53003012	Recommendation	ऐसे शख़्सों को हम ख़ुदावन्द 'ईसा मसीह में हुक्म देते और सलाह देते हैं कि चुप चाप काम कर के अपनी ही रोटी खाएँ।
44007009	Sin	और बुज़ुर्गों ने हसद में आकर युसूफ़ को बेचा कि मिस्र में पहुँच जाए; मगर ख़ुदा उसके साथ था।
44011028	Description	उन में से एक जिसका नाम अग्बुस था खड़े होकर रूह की हिदायत से ज़ाहिर किया कि तमाम दुनियाँ में बड़ा काल पड़ेगा और क्लोदियुस के अहद में वाक़े हुआ।
44020036	Description	उस ने ये कह कर घुटने टेके और उन सब के साथ दुआ की।
48005024	Faith	और जो मसीह ईसा के हैं उन्होंने जिस्म को उसकी रगबतों और ख़्वाहिशों समेत सलीब पर खींच दिया है।
59001002	Recommendation	ऐ, मेरे भाइयों जब तुम तरह तरह की आज़माइशों में पड़ो।
62001006	Sin	अगर हम कहें कि हमारा उसके साथ मेल मिलाप है और फिर तारीकी में चलें, तो हम झूठे हैं और हक़ पर 'अमल नहीं करते।
44010011	Description	और उस ने देखा कि आस्मान खुल गया और एक चीज़ बड़ी चादर की तरह चारों कोनों से लटकती हुई ज़मीन की तरफ़ उतर रही है।
44002009	Description	हालाँकि हम हैं: पार्थि, मादि, ऐलामी, मसोपोतामिया, यहूदिया, और कप्पदुकिया, और पुन्तुस, और आसिया,
51001010	Faith	क्यूँकि फिर ही तुम अपनी ज़िन्दगी ख़ुदावन्द के लायक़ गुज़ार सकोगे और हर तरह से उसे पसन्द आओगे। हाँ, तुम हर क़िस्म का अच्छा काम करके फल लाओगे और ख़ुदा के इल्म — ओ — 'इरफ़ान में तरक़्क़ी करोगे।
54001018	Recommendation	ऐ फ़र्ज़न्द तीमुथियुस! उन पेशीनगोइयों के मुवाफ़िक़ जो पहले तेरे ज़रिए की गई थीं, मैं ये हुक्म तेरे सुपुर्द करता हूँ ताकि तू उनके मुताबिक़ अच्छी लड़ाई लड़ता रहे; और ईमान और उस नेक नियत पर क़ाईम रहे,
66019001	Faith	इन बातों के बाद मैंने आसमान पर गोया बड़ी जमा'अत को ऊँची आवाज़ से ये कहते सुना, “हालेलूया! नजात और जलाल और क़ुदरत हमारे ख़ुदा की है।
49002001	Grace	और उसने तुम्हें भी ज़िन्दा किया जब अपने क़ुसूरों और गुनाहों की वजह से मुर्दा थे।
46010021	Sin	तुम ख़ुदावन्द के प्याले और शयातीन के प्याले दोनों में से नहीं पी सकते; ख़ुदावन्द के दस्तरख़्वान और शयातीन के दस्तरख़्वान दोनों पर शरीक नहीं हो सकते।
49005003	Recommendation	जैसे के मुक़द्दसों को मुनासिब है, तुम में हरामकारी और किसी तरह की नापाकी या लालच का ज़िक्र तक न हो;
56001015	Sin	पाक लोगों के लिए सब चीज़ें पाक हैं, मगर गुनाह आलूदा और बेईमान लोगों के लिए कुछ भी पाक नहीं, बल्कि उन की 'अक़्ल और दिल दोनों गुनाह आलूदा हैं।
44009021	Description	और सब सुनने वाले हैरान होकर कहने लगे कि “क्या ये वो शख़्स नहीं है, जो येरूशलेम में इस नाम के लेने वालों को तबाह करता था, और यहाँ भी इस लिए आया था, कि उनको बाँध कर सरदार काहिनों के पास ले जाए?”
58008006	Description	लेकिन जो ख़िदमत ईसा को मिल गई है वह दुनिया के इमामों की ख़िदमत से कहीं बेहतर है, उतनी बेहतर जितना वह अह्द जिस का दरमियानी ईसा है पुराने अह्द से बेहतर है। क्यूँकि यह अह्द बेहतर वादों की बुनियाद पर बाँधा गया।
50001021	Faith	क्यूँकि ज़िंदा रहना मेरे लिए मसीह और मरना नफ़ा'।
50001006	Faith	और मुझे इस बात का भरोसा है कि जिस ने तुम में नेक काम शुरू किए है, वो उसे ईसा मसीह के आने तक पूरा कर देगा।
62005020	Faith	और ये भी जानते है कि ख़ुदा का बेटा आ गया है, और उसने हमे समझ बख़्शी है ताकि उसको जो हक़ीक़ी है जानें और हम उसमें जो हक़ीक़ी है, या'नी उसके बेटे ईसा मसीह में हैं। हक़ीक़ी ख़ुदा और हमेशा की ज़िन्दगी यही है।
45012018	Recommendation	जहाँ तक हो सके तुम अपनी तरफ़ से सब आदमियों के साथ मेल मिलाप रख्खो।
58010023	Faith	आएँ, हम मज़बूती से उस उम्मीद को थामे रखें जिस का इक़रार हम करते हैं। हम लड़खड़ा न जाएँ, क्यूँकि जिस ने इस उम्मीद का वादा किया है वह वफ़ादार है।
43014027	Grace	“मैं तुम्हारे पास सलामती छोड़े जाता हूँ, अपनी ही सलामती तुम को दे देता हूँ। और मैं इसे यूँ नहीं देता जिस तरह दुनियाँ देती है। तुम्हारा दिल न घबराए और न डरे।
47005006	Faith	पस हमेशा हम मुतमईन रहते हैं और ये जानते हैं कि जब तक हम बदन के वतन में हैं ख़ुदावन्द के यहाँ से जिला वतन हैं।
43012047	Grace	जो मेरी बातें सुन कर उन पर अमल नहीं करता मैं उसका इन्साफ़ नहीं करूँगा, क्यूँकि मैं दुनियाँ का इन्साफ़ करने के लिए नहीं आया बल्कि उसे नजात देने के लिए।
62003012	Sin	और क़ाइन की तरह न बनें जो उस शरीर से था, और जिसने अपने भाई को क़त्ल किया; और उसने किस वास्ते उसे क़त्ल किया? इस वास्ते कि उसके काम बुरे थे, और उसके भाई के काम रास्ती के थे।
66016020	Description	और हर एक टापू अपनी जगह से टल गया और पहाड़ों का पता न लगा।
58011012	Description	अगरचे अब्रहाम तक़रीबन मर चुका था तो भी उसी एक शख़्स से बेशुमार औलाद निकली, तहदाद में आसमान पर के सितारों और साहिल पर की रेत के ज़र्रों के बराबर।
54001017	Faith	अब हमेशा कि बादशाही या'नी ना मिटने वाली, नादीदा, एक ख़ुदा की 'इज़्ज़त और बड़ाई हमेशा से हमेशा तक होती रहे। आमीन।
66014007	Faith	और उसने बड़ी आवाज़ से कहा, “ख़ुदा से डरो और उसकी बड़ाई करो, क्यूँकि उसकी 'अदालत का वक़्त आ पहुँचा है; और उसी की इबादत करो जिसने आसमान और ज़मीन और समुन्दर और पानी के चश्मे पैदा किए।”
44006001	Description	उन दिनों में जब शागिर्द बहुत होते जाते थे, तो यूनानी माइल यहूदी इब्रानियों की शिकायत करने लगे; इसलिए कि रोज़ाना ख़बरगीरी में उनकी बेवाओं के बारे में लापरवाही होती थी।
60002021	Grace	और तुम इसी के लिए बुलाए गए हो, क्यूँकि मसीह भी तुम्हारे वास्ते दुःख उठाकर तुम्हें एक नमूना दे गया है ताकि उसके नक़्श — ए — क़दम पर चलो।
53003010	Recommendation	और जब हम तुम्हारे पास थे उस वक़्त भी तुम को ये हुक्म देते थे; कि जिसे मेहनत करना मन्ज़ूर न हो वो खाने भी न पाए।
43003016	Grace	“क्यूँकि ख़ुदा ने दुनियाँ से ऐसी मुहब्बत रख्खी कि उसने अपना इकलौता बेटा बख़्श दिया, ताकि जो कोई उस पर ईमान लाए हलाक न हो, बल्कि हमेशा की ज़िन्दगी पाए।
44019015	Description	बदरूह ने जवाब में उन से कहा, ईसा को तो मै जानती हूँ, और पौलुस से भी वाक़िफ़ हूँ “मगर तुम कौन हो?”
66019019	Violence	फिर मैंने उस हैवान और ज़मीन के बादशाहों और उनकी फ़ौजों को, उस घोड़े के सवार और उसकी फ़ौज से जंग करने के लिए इकट्ठे देखा।
44027002	Description	और हम अद्रमुतय्युस के एक जहाज़ पर जो आसिया के किनारे के बन्दरगाहों में जाने को था। सवार होकर रवाना हुए और थिस्सलुनीकियों का अरिस्तरख़ुस मकिदुनी हमारे साथ था।
58013003	Recommendation	जो क़ैद में हैं, उन्हें यूँ याद रखना जैसे आप ख़ुद उन के साथ क़ैद में हों। और जिन के साथ बदसुलूकी हो रही है उन्हें यूँ याद रखना जैसे आप से यह बदसुलूकी हो रही हो।
51003017	Recommendation	और जो कुछ भी तुम करो ख़्वाह ज़बानी हो या अमली वह ख़ुदावन्द ईसा का नाम ले कर करो। हर काम में उसी के वसीले से ख़ुदा बाप का शुक्र करो।
48006006	Recommendation	कलाम की ता'लीम पानेवाला, ता'लीम देनेवाले को सब अच्छी चीज़ों में शरीक करे।
44007005	Description	और उसको कुछ मीरास बल्कि क़दम रखने की भी उस में जगह न दी मगर वा'दा किया कि में ये ज़मीन तेरे और तेरे बाद तेरी नस्ल के क़ब्ज़े में कर दूँगा, हालाँकि उसके औलाद न थी।
44007019	Description	उसने हमारी क़ौम से चालाकी करके हमारे बाप दादा के साथ यहाँ तक बदसुलूकी की कि उन्हें अपने बच्चे फेंकने पड़े ताकि ज़िन्दा न रहें।
43020003	Description	तब पतरस दूसरे शागिर्द समेत क़ब्र की तरफ़ चल पड़ा।
44024016	Faith	इसलिए मैं ख़ुद भी कोशिश में रहता हूँ, कि ख़ुदा और आदमियों के बारे में मेरा दिल मुझे कभी मलामत न करे।
65001013	Description	ये समुन्दर की पुर जोश मौजें, जो अपनी बेशर्मी के झाग उछालती हैं। ये वो आवारा गर्द सितारे हैं, जिनके लिए हमेशा तक बेहद तारीकी धरी है।
48001012	Description	क्यूँकि वो मुझे इंसान की तरफ़ से नहीं पहूँची, और न मुझे सिखाई गई, बल्कि ख़ुदा' मसीह की तरफ़ से मुझे उसका मुक़ाशिफ़ा हुआ।
45007005	Sin	क्यूँकि जब हम जिस्मानी थे गुनाह की ख़्वाहिशों जो शरी'अत के ज़रिए पैदा होती थीं मौत का फल पैदा करने के लिए हमारे आ'ज़ा में तासीर करती थी।
54002007	Faith	मैं सच कहता हूँ, झूठ नहीं बोलता, कि मैं इसी ग़रज़ से ऐलान करने वाला और रसूल और ग़ैर — क़ौमों को ईमान और सच्चाई की बातें सिखाने वाला मुक़र्रर हुआ।
62003024	Faith	और जो उसके हुक्मों पर 'अमल करता है, वो इस में और ये उसमें क़ाईम रहता है; और इसी से या'नी उस पाक रूह से जो उसने हमें दिया है, हम जानते हैं कि वो हम में क़ाईम रहता है।
46010024	Recommendation	कोई अपनी बेहतरी न ढूँडे बल्कि दूसरे की।
45012016	Recommendation	आपस में एक दिल रहो ऊँचे ऊँचे ख़याल न बाँधो बल्कि छोटे लोगों से रिफ़ाक़त रखो अपने आप को अक़्लमन्द न समझो।
49004031	Recommendation	हर तरह की गर्म मिज़ाजी, और क़हर, और ग़ुस्सा, और शोर — ओ — ग़ुल, और बुराई, हर क़िस्म की बद ख़्वाही समेत तुम से दूर की जाएँ।
51001025	Faith	हाँ, ख़ुदा ने मुझे अपनी जमाअत का ख़ादिम बना कर यह ज़िम्मेदारी दी कि मैं तुम को ख़ुदा का पूरा कलाम सुना दूँ,
66001014	Description	उसका सिर और बाल सफ़ेद ऊन बल्कि बर्फ़ की तरह सफ़ेद थे, और उसकी आँखें आग के शो'ले की तरह थीं।
