62003016	Faith	हम ने मुहब्बत को इसी से जाना है कि उसने हमारे वास्ते अपनी जान दे दी, और हम पर भी भाइयों के वास्ते जान देना फ़र्ज़ है।
43013001	Grace	फ़सह की ईद अब शुरू होने वाली थी। ईसा जानता था कि वह वक़्त आ गया है कि मुझे इस दुनियाँ को छोड़ कर बाप के पास जाना है। अगरचे उस ने हमेशा दुनियाँ में अपने लोगों से मुहब्बत रखी थी, लेकिन अब उस ने आख़िरी हद तक उन पर अपनी मुहब्बत का इज़हार किया।
58003017	Sin	और वो किन लोगों से चालीस बरस तक नाराज़ रहा? क्या उनसे नहीं जिन्होंने गुनाह किया, और उनकी लाशें वीराने में पड़ी रहीं?
60001014	Recommendation	और फ़रमाँबरदार बेटा होकर अपनी जहालत के ज़माने की पुरानी ख़्वाहिशों के ताबे' न बनो।
45011032	Grace	इसलिए कि ख़ुदा ने सब को नाफ़रमानी में गिरफ़्तार होने दिया ताकि सब पर रहम फ़रमाए।
66006006	Description	और मैंने गोया उन चारों जानदारों के बीच में से ये आवाज़ आती सुनी, गेहूँ दीनार के सेर भर, और जौ दीनार के तीन सेर, और तेल और मय का नुक़्सान न कर।
59004010	Recommendation	ख़ुदावन्द के सामने फ़िरोतनी करो, वो तुम्हें सरबलन्द करेगा।
44017031	Grace	क्यूँकि उस ने एक दिन ठहराया है, जिस में वो रास्ती से दुनिया की अदालत उस आदमी के ज़रिए करेगा, जिसे उस ने मुक़र्रर किया है और उसे मुर्दों में से जिला कर ये बात सब पर साबित कर दी है।
43019002	Description	फ़ौजियों ने काँटेदार टहनियों का एक ताज बना कर उस के सर पर रख दिया। उन्हों ने उसे इर्ग़वानी रंग का चोग़ा भी पहनाया।
54005014	Recommendation	पस मैं ये चाहता हूँ कि जवान बेवाएँ शादी करें, उनके औलाद हों, घर का इन्तिज़ाम करें, और किसी मुख़ालिफ़ को बदगोई का मौक़ा न दें।
43014011	Faith	मेरी बात का यक़ीन करो कि मैं बाप में हूँ और बाप मुझ में है। या कम से कम उन कामों की बिना पर यक़ीन करो जो मैंने किए हैं।”
66020014	Violence	फिर मौत और 'आलम — ए — अर्वाह आग की झील में डाले गए। ये आग की झील आखरी मौत है,
58009026	Description	अगर ऐसा होता तो उसे दुनिया की पैदाइश से ले कर आज तक बहुत बार दुःख सहना पड़ता। लेकिन ऐसा नहीं है बल्कि अब वह ज़मानो के ख़ातिमें पर एक ही बार सदा के लिए ज़ाहिर हुआ ताकि अपने आप को क़ुर्बान करने से गुनाह को दूर करे।
44013018	Description	और कोई चालीस बरस तक वीरानों में उनकी आदतों की बर्दाश्त करता रहा,
46011033	Recommendation	पस ऐ मेरे भाइयों! जब तुम खाने को जमा हो तो एक दूसरे की राह देखो।
66006012	Violence	जब उसने छटी मुहर खोली, तो मैंने देखा कि एक बड़ा भुन्चाल आया, और सूरज कम्मल की तरह काला और सारा चाँद ख़ून सा हो गया।
58011035	Violence	ईमान रखने के ज़रिए से औरतों को उन के मुर्दा अज़ीज़ ज़िन्दा हालत में वापस मिले।
44016037	Violence	मगर पौलुस ने उससे कहा, उन्होंने हम को जो रोमी हैं क़ुसूर साबित किए बग़ैर “ऐलानिया पिटवाकर क़ैद में डाला। और अब हम को चुपके से निकालते हैं? ये नहीं हो सकता; बल्कि वो आप आकर हमें बाहर ले जाएँ।”
45013009	Recommendation	क्यूँकि ये बातें कि ज़िना न कर, ख़ून न कर, चोरी न कर, लालच न कर और इसके सिवा और जो कोई हुक्म हो उन सब का ख़ुलासा इस बात में पाया जाता है “अपने पड़ोसी से अपनी तरह मुहब्बत रख।”
62003003	Faith	और जो कोई उससे ये उम्मीद रखता है, अपने आपको वैसा ही पाक करता है जैसा वो पाक है।
45007022	Faith	क्यूँकि बातिनी इंसान ियत के ऐतबार से तो मैं ख़ुदा की शरी'अत को बहुत पसन्द करता हूँ।
50004004	Recommendation	ख़ुदावन्द में हर वक़्त ख़ुश रहो; मैं फिर कहता हूँ कि ख़ुश रहो।
66001012	Description	मैंने उस आवाज़ देनेवाले को देखने के लिए मुँह फेरा, जिसने मुझ से कहा था; और फिर कर सोने के सात चिराग़दान देखे,
58003018	Sin	और किनके बारे में उसने क़सम खाई कि वो मेरे आराम में दाख़िल न होने पाएँगे, सिवा उनके जिन्होंने नाफ़रमानी की?
43010008	Sin	जितने भी मुझ से पहले आए वह चोर और डाकू हैं। लेकिन भेड़ों ने उन की न सुनी।
60002018	Recommendation	ऐ नौकरों! बड़े ख़ौफ़ से अपने मालिकों के ताबे' रहो, न सिर्फ़ नेकों और हलीमों ही के बल्कि बद मिज़ाजों के भी।
44006013	Description	और झूठे गवाह खड़े किए जिन्होंने कहा, ये शख़्स इस पाक मुक़ाम और शरी'अत के बरख़िलाफ़ बोलने से बाज़ नहीं आता।
47005018	Faith	और वो सब चीज़ें ख़ुदा की तरफ़ से हैं जिसने मसीह के वसीले से अपने साथ हमारा मेल मिलाप कर लिया और मेल मिलाप की ख़िदमत हमारे सुपुर्द की।
59005010	Recommendation	ऐ, भाइयों! जिन नबियों ने ख़ुदावन्द के नाम से कलाम किया उनको दु:ख उठाने और सब्र करने का नमूना समझो।
44002021	Faith	और यूँ होगा कि जो कोई ख़ुदावन्द का नाम लेगा, नजात पाएगा।
66007012	Faith	कहा, आमीन! तारीफ़ और बड़ाई और हिक्मत और शुक्र और 'इज़्ज़त और क़ुदरत और ताक़त हमेशा से हमेशा हमारे ख़ुदा की हो! आमीन।
60003003	Recommendation	और तुम्हारा सिंगार ज़ाहिरी न हो, या'नी सर गूँधना और सोने के ज़ेवर और तरह तरह के कपड़े पहनना,
55001008	Faith	पस, हमारे ख़ुदावन्द की गवाही देने से और मुझ से जो उसका क़ैदी हूँ शर्म न कर बल्कि ख़ुदा की क़ुदरत के मुताबिक़ ख़ुशख़बरी की ख़ातिर मेरे साथ दु:ख उठा।
43017019	Description	उन की ख़ातिर मैं अपने आप को मख़्सूस करता हूँ, ताकि उन्हें भी सच्चाई के वसीले से मख़्सूस — ओ — मुक़द्दस किया जाए।”
66003002	Recommendation	“जागता रहता, और उन चीज़ों को जो बाक़ी है और जो मिटने को थीं मज़बूत कर, क्यूँकि मैंने तेरे किसी काम को अपने ख़ुदा के नज़दीक पूरा नहीं पाया।
66016004	Description	तीसरे ने अपना प्याला दरियाओं और पानी के चश्मों पर उल्टा और वो ख़ून बन गया।
45005002	Faith	जिस के वसीले से ईमान की वजह से उस फ़ज़ल तक हमारी रिसाई भी हुई जिस पर क़ाईम हैं और ख़ुदा के जलाल की उम्मीद पर फ़ख़्र करें।
49005005	Sin	क्यूँकि तुम ये ख़ूब जानते हो कि किसी हरामकार, या नापाक, या लालची की जो बुत परस्त के बराबर है, मसीह और ख़ुदा की बादशाही में कुछ मीरास नहीं।
58011008	Faith	यह ईमान का काम था कि अब्रहाम ने ख़ुदा की सुनी जब उस ने उसे बुला कर कहा कि वह एक ऐसे मुल्क में जाए जो उसे बाद में मीरास में मिलेगा। हाँ, वह अपने मुल्क को छोड़ कर रवाना हुआ, हालाँकि उसे मालूम न था कि वह कहाँ जा रहा है।
49005018	Recommendation	और शराब में मतवाले न बनो क्यूँकि इससे बदचलनी पेश' आती है, बल्कि पाक रूह से मा'मूर होते जाओ,
61002002	Sin	और बहुत सारे उनकी बुरी आदतों की पैरवी करेंगे, जिनकी वजह से राह — ए — हक़ की बदनामी होगी।
49002018	Faith	क्यूँकि उसी के वसीले से हम दोनों की, एक ही रूह में बाप के पास रसाई होती है।
44021025	Recommendation	मगर ग़ैर क़ौमों में से जो ईमान लाए उनके बारे में हम ने ये फ़ैसला करके लिखा था, कि वो सिर्फ़ बुतों की क़ुर्बानी के गोश्त से और लहू और गला घोंटे हुए जानवरों और हरामकारी से अपने आप को बचाए रखें।
44005003	Sin	मगर पतरस ने कहा, ऐ हननियाह! क्यूँ शैतान ने तेरे दिल में ये बात डाल दी, कि तू रूह — उल — क़ुद्दूस से झूठ बोले और ज़मीन की क़ीमत में से कुछ रख छोड़े।
49004014	Recommendation	ताकि हम आगे को बच्चे न रहें और आदमियों की बाज़ीगरी और मक्कारी की वजह से उनके गुमराह करनेवाले इरादों की तरफ़ हर एक ता'लीम के झोंके से मौजों की तरह उछलते बहते न फिरें
46006009	Sin	क्या तुम नहीं जानते कि बदकार ख़ुदा की बादशाही के वारिस न होंगे धोखा न खाओ न हरामकार ख़ुदा की बादशाही के वारिस होंगे न बुतपरस्त, न ज़िनाकार, न अय्याश, न लौंडे बाज़,
58010025	Recommendation	हम एकसाथ जमा होने से बाज़ न आएँ, जिस तरह कुछ की आदत बन गई है। इस के बजाए हम एक दूसरे की हौसला अफ़्ज़ाई करें, ख़ासकर यह बात मद्द — ए — नज़र रख कर कि ख़ुदावन्द के दिन के आने तक।
51003005	Sin	चुनाँचे उन दुनियावी चीज़ों को मार डालो जो तुम्हारे अन्दर काम कर रही हैं: ज़िनाकारी, नापाकी, शहवतपरस्ती, बुरी ख़्वाहिशात और लालच (लालच तो एक क़िस्म की बुतपरस्ती है)
52005008	Faith	मगर हम जो दिन के हैं ईमान और मुहब्बत का बख़्तर लगा कर और निजात की उम्मीद कि टोपी पहन कर होशियार रहें।
55001007	Grace	क्यूँकि ख़ुदा ने हमें दहशत की रूह नहीं बल्कि क़ुदरत और मुहब्बत और तरबियत की रूह दी है।
62002004	Sin	जो कोई ये कहता है, मैं उसे जान गया हूँ “और उसके हुक्मों पर” अमल नहीं करता, वो झूठा है और उसमें सच्चाई नहीं।
50002002	Faith	तो मेरी ख़ुशी पूरी करो कि एक दिल रहो, यक्साँ मुहब्बत रखो एक जान हो, एक ही ख़याल रख्खो।
43007030	Description	पस वो उसे पकड़ने की कोशिश करने लगे, लेकिन इसलिए कि उसका वक़्त अभी न आया था, किसी ने उस पर हाथ न डाला।
54006018	Recommendation	और नेकी करें, और अच्छे कामों में दौलतमन्द बनें, और सख़ावत पर तैयार और इम्दाद पर मुस्त'ईद हों,
43018030	Description	उन्हों ने जवाब दिया, “अगर यह मुजरिम न होता तो हम इसे आप के हवाले न करते।”
45014006	Faith	जो किसी दिन को मानता है वो ख़ुदावन्द के लिए मानता है और जो खाता है वो ख़ुदावन्द के वास्ते खाता है क्यूँकि वो ख़ुदा का शुक्र करता है और जो नहीं खाता वो भी ख़ुदावन्द के वास्ते नहीं खाता, और ख़ुदावन्द का शुक्र करता है।
45012012	Recommendation	उम्मीद में ख़ुश मुसीबत में साबिर दुआ करने में मशग़ूल रहो।
44024023	Description	और सुबेदार को हुक्म दिया कि उस को क़ैद तो रख मगर आराम से रखना और इसके दोस्तों में से किसी को इसकी ख़िदमत करने से मनह' न करना।
46013007	Description	सब कुछ सह लेती है, सब कुछ यक़ीन करती है, सब बातों की उम्मीद रखती है, सब बातों में बर्दाश्त करती है।
47004013	Faith	और चूँकि हम में वही ईमान की रूह है जिसके बारे में कलाम में लिखा है कि मैं ईमान लाया और इसी लिए बोला; पस हम भी ईमान लाए और इसी लिए बोलते हैं।
52005014	Recommendation	और ऐ भाइयों, हम तुम्हें नसीहत करते हैं कि बे क़ाइदा चलने वालों को समझाओ कम हिम्मतों को दिलासा दो कमज़ोरों को संभालो सब के साथ तहम्मील से पेश आओ।
66016010	Description	पाँचवें ने अपना प्याला उस हैवान के तख़्त पर उलटा, और लोग अपनी ज़बाने काटने लगे,
48006016	Grace	और जितने इस क़ईदे पर चलें उन्हें, और ख़ुदा के इस्राईल को इत्मीनान और रहम हासिल होता रहे।
44018025	Faith	इस शख़्स ने ख़ुदावन्द की राह की ता'लीम पाई थी, और रूहानी जोश से कलाम करता और ईसा की वजह से सहीह सहीह ता'लीम देता था। मगर सिर्फ़ यूहन्ना के बपतिस्मे से वाक़िफ़ था।
46010031	Recommendation	पस तुम खाओ या पियो जो कुछ करो ख़ुदा के जलाल के लिए करो।
62002027	Recommendation	और तुम्हारा वो मसह जो उसकी तरफ़ से किया गया, तुम में क़ाईम रहता है; और तुम इसके मोहताज नहीं कि कोई तुम्हें सिखाए, बल्कि जिस तरह वो मसह जो उसकी तरफ़ से किया गया, तुम्हें सब बातें सिखाता है और सच्चा है और झूठा नहीं; और जिस तरह उसने तुम्हें सिखाया उसी तरह तुम उसमें क़ाईम रहते हो।
59002026	Faith	ग़रज़ जैसे बदन बग़ैर रूह के मुर्दा है वैसे ही ईमान भी बग़ैर आ'माल के मुर्दा है।
44027035	Description	ये कह कर उस ने रोटी ली और उन सब के सामने ख़ुदा का शुक्र किया, और तोड़ कर खाने लगा।
44015020	Sin	मगर उन को लिख भेजें कि बुतों की मकरूहात और हरामकारी और गला घोंटे हुए जानवरों और लहू से परहेज़ करें।
44023003	Sin	पौलुस ने उस से कहा, ऐ सफ़ेदी फिरी हुई दीवार! ख़ुदा “तुझे मारेगा! तू शरी'अत के मुवाफ़िक़ मेरा इन्साफ़ करने को बैठा है, और क्या शरी'अत के बर — ख़िलाफ़ मुझे मारने का हुक्म देता है।”
45008001	Description	पस अब जो मसीह ईसा में है उन पर सज़ा का हुक्म नहीं क्यूँकि जो जिस्म के मुताबिक़ नहीं बल्कि रूह के मुताबिक़ चलते हैं?
52005009	Grace	क्यूँकि ख़ुदा ने हमें ग़ज़ब के लिए नहीं बल्कि इसलिए मुक़र्रर किया कि हम अपने ख़ुदावन्द ईसा मसीह के वसीले से नजात हासिल करें।
66020008	Violence	और उन क़ौमों को जो ज़मीन की चारों तरफ़ होंगी, या'नी जूज और माजूज को गुमराह करके लड़ाई के लिए जमा करने को निकाले; उनका शुमार समुन्दर की रेत के बराबर होगा।
46006011	Grace	और कुछ तुम में ऐसे ही थे भी, 'मगर तुम ख़ुदावन्द ईसा मसीह के नाम से और हमारे ख़ुदा के रूह से धूल गए और पाक हुए और रास्तबाज़ भी ठहरे।
55001012	Faith	इसी वजह से मैं ये दु:ख भी उठाता हूँ, लेकिन शर्माता नहीं क्यूँकि जिसका मैं ने यक़ीन किया है उसे जानता हूँ और मुझे यक़ीन है कि वो मेरी अमानत की उस दिन तक हिफ़ाज़त कर सकता है।
49006018	Faith	और हर वक़्त और हर तरह से रूह में दुआ और मिन्नत करते रहो, और इसी ग़रज़ से जागते रहो कि सब मुक़द्दसों के वास्ते बिला नाग़ा दुआ किया करो,
52001001	Grace	पौलुस और सिलास और तीमुथियुस की तरफ़ से थिस्सलुनीकियों शहर की कलीसिया के नाम ख़त, जो ख़ुदा बाप और ख़ुदा वन्द ईसा मसीह में है, फ़ज़ल और इत्मीनान तुम्हें हासिल होता रहे।
50004005	Faith	तुम्हारी नर्म मिज़ाजी सब आदमियों पर ज़ाहिर हो, ख़ुदावन्द क़रीब है।
46011026	Faith	क्यूँकि जब कभी तुम ये रोटी खाते और इस प्याले में से पीते हो तो ख़ुदावन्द की मौत का इज़हार करते हो; जब तक वो न आए।
