43004014	Grace	मगर जो कोई उस पानी में से पिएगा जो मैं उसे दूँगा, वो अबद तक प्यासा न होगा! बल्कि जो पानी मैं उसे दूँगा, वो उसमें एक चश्मा बन जाएगा जो हमेशा की ज़िन्दगी के लिए जारी रहेगा।”
62002005	Faith	हाँ, जो कोई उसके कलाम पर 'अमल करे, उसमें यक़ीनन ख़ुदा की मुहब्बत कामिल हो गई है। हमें इसी से मा'लूम होता है कि हम उसमें हैं:
66016013	Description	फिर मैंने उस अज़दहा के मुँह से, और उस हैवान के मुँह से, और उस झूठे नबी के मुँह से तीन बदरूहें मेंढकों की सूरत में निकलती देखीं।
59002008	Recommendation	तोभी अगर तुम इस लिखे हुए के मुताबिक़ अपने पड़ोसी से अपनी तरह मुहब्बत रखो उस बादशाही शरी'अत को पूरा करते हो तो अच्छा करते हो।
47004005	Faith	क्यूँकि हम अपनी नहीं बल्कि मसीह ईसा का ऐलान करते हैं कि वो ख़ुदावन्द है और अपने हक़ में ये कहते हैं कि ईसा की ख़ातिर तुम्हारे ग़ुलाम हैं।
46015033	Recommendation	धोखा न खाओ “बुरी सोहबतें अच्छी आदतों को बिगाड़ देती हैं।”
58013020	Grace	अब सलामती का ख़ुदा जो अबदी 'अह्द के ख़ून से हमारे ख़ुदावन्द और भेड़ों के अज़ीम चरवाहे ईसा को मुर्दों में से वापस लाया
50001027	Recommendation	सिर्फ़ ये करो कि मसीह में तुम्हारा चाल चलन मसीह के ख़ुशख़बरी के मुवाफ़िक़ रहे ताकि; चाहे मैं आऊँ और तुम्हें देखूँ चाहे न आऊँ, तुम्हारा हाल सुनूँ कि तुम एक रूह में क़ाईम हो, और ईन्जील के ईमान के लिए एक जान होकर कोशिश करते हो,
46006014	Grace	और ख़ुदा ने ख़ुदावन्द को भी जिलाया और हम को भी अपनी क़ुदरत से जिलाएगा।
55001006	Recommendation	इसी वजह से मै तुझे याद दिलाता हूँ कि तू ख़ुदा की उस ने'अमत को चमका दे जो मेरे हाथ रखने के ज़रिए तुझे हासिल है।
60004006	Grace	क्यूँकि मुर्दों को भी ख़ुशख़बरी इसलिए सुनाई गई थी कि जिस्म के लिहाज़ से तो आदमियों के मुताबिक़ उनका इन्साफ़ हो, लेकिन रूह के लिहाज़ से ख़ुदा के मुताबिक़ ज़िन्दा रहें।
46007023	Recommendation	तुम मसीह के ज़रिए ख़ास क़ीमत से ख़रीदे गए हो आदमियों के ग़ुलाम न बनो।
46010010	Recommendation	और तुम बड़बड़ाओ नहीं जिस तरह उन में से कुछ बड़बड़ाए और हलाक करने वाले से हलाक हुए।
47002017	Faith	क्यूँकि हम उन बहुत लोगों की तरह नहीं जो ख़ुदा के कलाम में मिलावट करते हैं बल्कि दिल की सफ़ाई से और ख़ुदा की तरफ़ से ख़ुदा को हाज़िर जान कर मसीह में बोलते हैं।
45015001	Recommendation	ग़रज़ हम ताक़तवरों को चाहिए कि कमज़ोरों के कमज़ोरियों की रि'आयत करें न कि अपनी ख़ुशी करें।
50002024	Faith	और मुझे ख़ुदावन्द पर भरोसा है कि मैं आप भी जल्द आऊँगा।
66007001	Description	इसके बाद मैंने ज़मीन के चारों कोनों पर चार फ़रिश्ते खड़े देखे। वो ज़मीन की चारों हवाओं को थामे हुए थे, ताकि ज़मीन या समुन्दर या किसी दरख़्त पर हवा न चले।
60004003	Sin	इस वास्ते कि ग़ैर — क़ौमों की मर्ज़ी के मुवाफ़िक़ काम करने और शहवत परस्ती, बुरी ख़्वाहिशों, मयख़्वारी, नाचरंग, नशेबाज़ी और मकरूह बुत परस्ती में जिस क़दर हम ने पहले वक़्त गुज़ारा वही बहुत है।
66011005	Violence	और अगर कोई उन्हें तकलीफ़ पहुँचाना चाहता है, तो उनके मुँह से आग निकलकर उनके दुश्मनों को खा जाती है; और अगर कोई उन्हें तकलीफ़ पहुँचाना चाहेगा, तो वो ज़रूर इसी तरह मारा जाएगा।
44023005	Recommendation	पौलुस ने कहा, ऐ भाइयों, मुझे मालूम न था कि ये सरदार काहिन है, क्यूँकि लिखा है कि, अपनी क़ौम के सरदार को बुरा न कह।
66022015	Sin	मगर कुत्ते, और जादूगर, और हरामकार, और ख़ूनी, और बुत परस्त, और झूठी बात का हर एक पसन्द करने और गढ़ने वाला बाहर रहेगा।
66002014	Sin	लेकिन मुझे चन्द बातों की तुझ से शिकायत है, इसलिए कि तेरे यहाँ कुछ लोग बिल'आम की ता'लीम माननेवाले हैं, जिसने बलक़ को बनी — इस्राईल के सामने ठोकर खिलाने वाली चीज़ रखने की ता'लीम दी, या'नी ये कि वो बुतों की क़ुर्बानियाँ खाएँ और हरामकारी करें।
53001003	Faith	ऐ भाइयों! तुम्हारे बारे में हर वक़्त ख़ुदा का शुक्र करना हम पर फ़र्ज़ है, और ये इसलिए मुनासिब है, कि तुम्हारा ईमान बहुत बढ़ता जाता है; और तुम सब की मुहब्बत आपस में ज़्यादा होती जाती है।
46012002	Sin	तुम जानते हो कि जब तुम ग़ैर क़ौम थे, तो गूँगे बुतों के पीछे जिस तरह कोई तुम को ले जाता था; उसी तरह जाते थे।
49005025	Recommendation	ऐ शौहरो! अपनी बीवियों से मुहब्बत रख्खो, जैसे मसीह ने भी कलीसिया से मुहब्बत करके अपने आप को उसके वास्ते मौत के हवाले कर दिया,
45012017	Recommendation	बदी के बदले किसी से बदी न करो; जो बातें सब लोगों के नज़दीक अच्छी हैं उनकी तदबीर करो।
60005006	Recommendation	पस ख़ुदा के मज़बूत हाथ के नीचे फ़रोतनी से रहो, ताकि वो तुम्हें वक़्त पर सरबलन्द करे।
44014017	Grace	तोभी उस ने अपने आप को बेगवाह न छोड़ा। चुनाँचे, उस ने महरबानियाँ कीं और आसमान से तुम्हारे लिए पानी बरसाया और बड़ी बड़ी पैदावार के मौसम अता' किए और तुम्हारे दिलों को ख़ुराक और ख़ुशी से भर दिया।
54003011	Recommendation	इसी तरह'औरतों को भी संजीदा होना चाहिए; तोहमत लगाने वाली न हों, बल्कि परहेज़गार और सब बातों में ईमानदार हों।
66002021	Sin	मैंने उसको तौबा करने की मुहलत दी, मगर वो अपनी हरामकारी से तौबा करना नहीं चाहती।
44012020	Description	और वो सूर और सैदा के लोगों से निहायत नाख़ुश था, पस वो एक दिल हो कर उसके पास आए, और बादशाह के दरबान बलस्तुस को अपनी तरफ़ करके सुलह चाही, इसलिए कि उन के मुल्क को बादशाह के मुल्क से इम्दाद पहुँचती थी।
43008049	Sin	ईसा ने जवाब दिया, “मुझ में बदरूह नहीं; मगर मैं अपने बाप की इज़्ज़त करता हूँ, और तुम मेरी बे'इज़्ज़ती करते हो।
43006018	Description	और आँधी की वजह से झील में मौजें उठने लगीं।
45008018	Faith	क्यूँकि मेरी समझ में इस ज़माने के दुःख दर्द इस लायक़ नहीं कि उस जलाल के मुक़ाबिले में हो सकें जो हम पर ज़ाहिर होने वाला है।
62002012	Grace	ऐ बच्चो! मैं तुम्हें इसलिए लिखता हूँ कि उसके नाम से तुम्हारे गुनाह मु'आफ़ हुए।
55001009	Grace	जिस ने हमें नजात दी और पाक बुलावे से बुलाया हमारे कामों के मुताबिक़ नहीं बल्कि अपने ख़ास इरादा और उस फ़ज़ल के मुताबिक़ जो मसीह 'ईसा में हम पर शुरू से हुआ।
43019006	Violence	उसे देखते ही राहनुमा इमाम और उन के मुलाज़िम चीख़ने लगे, “इसे मस्लूब करें, इसे मस्लूब करें!”
60001010	Grace	इसी नजात के बारे में नबियों ने बड़ी तलाश और तहक़ीक़ की, जिन्होंने उस फ़ज़ल के बारे में जो तुम पर होने को था नबुव्वत की।
63001007	Sin	क्यूँकि बहुत से ऐसे गुमराह करने वाले दुनिया में निकल खड़े हुए हैं, जो 'ईसा मसीह के मुजस्सिम होकर आने का इक़रार नहीं करते। गुमराह करनेवाला मुख़ालिफ़ — ए — मसीह यही है।
44024005	Sin	क्यूँकि हम ने इस शख़्स को फ़साद करने वाला और दुनिया के सब यहूदियों में फ़ितना अंगेज़ और नासरियों की बिद'अती फ़िरक़े का सरगिरोह पाया।
54003016	Grace	इस में कलाम नहीं कि दीनदारी का भेद बड़ा है, या'नी वो जो जिस्म में ज़ाहिर हुआ, और रूह में रास्तबाज़ ठहरा, और फ़रिश्तों को दिखाई दिया, और ग़ैर — क़ौमों में उसकी मनादी हुई, और दुनिया में उस पर ईमान लाए, और जलाल में ऊपर उठाया गया।
66016021	Violence	और आसमान से आदमियों पर मन मन भर के बड़े बड़े ओले गिरे, और चूँकि ये आफ़त निहायत सख़्त थी इसलिए लोगों ने ओलों की आफ़त के ज़रिए ख़ुदा की निस्बत कुफ़्र बका।
61003013	Faith	लेकिन उसके वादे के मुवाफ़िक़ हम नए आसमान और नई ज़मीन का इन्तज़ार करते हैं, जिनमें रास्तबाज़ी बसी रहेगी।
66006014	Description	और आसमान इस तरह सरक गया, जिस तरह ख़त लपेटने से सरक जाता है; और हर एक पहाड़ और टापू अपनी जगह से टल गया।
58010010	Grace	और उस की मर्ज़ी पूरी हो जाने से हमें ईसा मसीह के बदन के वसीले से ख़ास — ओ — मुक़द्दस किया गया है। क्यूँकि उसे एक ही बार सदा के लिए हमारे लिए क़ुर्बान किया गया।
52001002	Faith	तुम सब के बारे में हम ख़ुदा का शुक्र बजा लाते हैं और अपनी दु'आओं में तुम्हें याद करते हैं।
66006004	Violence	फिर एक और घोड़ा निकला जिसका रंग लाल था। उसके सवार को ये इख़्तियार दिया गया कि ज़मीन पर से सुलह उठा ले ताकि लोग एक दुसरे को क़त्ल करें; और उसको एक बड़ी तलवार दी गई।
54006001	Recommendation	जितने नौकर जुए के नीचे हों, अपने मालिकों को कमाल 'इज़्ज़त के लाइक़ जानें, ताकि ख़ुदा का नाम और ता'लीम बदनाम न हो।
51003009	Recommendation	एक दूसरे से बात करते वक़्त झूठ मत बोलना, क्यूँकि तुमने अपनी पुरानी फ़ितरत उस की हरकतो समेत उतार दी है।
66002020	Sin	पर मुझे तुझ से ये शिकायत है कि तू ने उस औरत ईज़बिल को रहने दिया है जो अपने आपको नबिया कहती है, और मेरे बन्दों को हरामकारी करने और बुतों की क़ुर्बानियाँ खाने की ता'लीम देकर गुमराह करती है
48003008	Grace	और किताब — ए — मुक़द्दस ने पहले से ये जान कर कि ख़ुदा ग़ैर क़ौमों को ईमान से रास्तबाज़ ठहराएगा, पहले से ही अब्रहाम को ये ख़ुशख़बरी सुना दी, “तेरे ज़रिए सब क़ौमें बर्क़त पाएँगी।”
58012005	Recommendation	क्या आप कलाम — ए — मुक़द्दस की यह हिम्मत बढ़ाने वाली बात भूल गए हैं जो आप को ख़ुदा के फ़र्ज़न्द ठहरा कर बयान करती है,
58013017	Recommendation	अपने राहनुमाओं की सुनें और उन की बात मानें। क्यूँकि वह आप की देख — भाल करते करते जागते रहते हैं, और इस में वह ख़ुदा के सामने जवाबदेह हैं। उन की बात मानें ताकि वह ख़ुशी से अपनी ख़िदमत सरअन्जाम दें। वर्ना वह कराहते कराहते अपनी ज़िम्मेदारी निभाएँगे, और यह आप के लिए मुफ़ीद नहीं होगा।
44013019	Description	और कनान के मुल्क में सात क़ौमों को लूट करके तक़रीबन साढ़े चार सौ बरस में उनका मुल्क इन की मीरास कर दिया।
54006003	Faith	अगर कोई शख़्स और तरह की ता'लीम देता है और सही बातों को, या'नी ख़ुदावन्द ईसा मसीह की बातें और उस ता'लीम को नहीं मानता जो दीनदारी के मुताबिक़ है,
63001010	Recommendation	अगर कोई तुम्हारे पास आए और ये ता'लीम न दे, तो न उसे घर में आने दो और न सलाम करो।
47001005	Grace	क्यूँकि जिस तरह मसीह के दु:ख हम को ज़्यादा पहुँचते हैं; उसी तरह हमारी तसल्ली भी मसीह के वसीले से ज़्यादा होती है।
65001011	Sin	इन पर आफ़सोस! कि ये क़ाईन की राह पर चले, और मज़दूरी के लिए बड़ी लालच से बिल'आम की सी गुमराही इख़्तियार की, और कोरह की तरह मुख़ालिफ़त कर के हलाक हुए।
65001010	Sin	मगर ये जिन बातों को नहीं जानते उन पर ला'न ता'न करते हैं, और जिनको बे अक़्ल जानवरों की तरह मिज़ाजी तौर पर जानते हैं, उनमें अपने आप को ख़राब करते हैं।
58011007	Faith	यह ईमान का काम था कि नूह ने ख़ुदा की सुनी जब उस ने उसे आने वाली बातों के बारे में आगाह किया, ऐसी बातों के बारे में जो अभी देखने में नहीं आई थीं। नूह ने ख़ुदा का ख़ौफ़ मान कर एक नाव बनाई ताकि उस का ख़ानदान बच जाए। यूँ उस ने अपने ईमान के ज़रिए दुनिया को मुजरिम क़रार दिया और उस रास्तबाज़ी का वारिस बन गया जो ईमान से हासिल होती है।
58009006	Description	यह चीज़ें इसी तरतीब से रखी जाती हैं। जब इमाम अपनी ख़िदमत के फ़राइज़ अदा करते हैं तो बाक़ाइदगी से पहले कमरे में जाते हैं।
44007051	Sin	ऐ गर्दन कशो, दिल और कान के नामख़्तूनों, तुम हर वक़्त रूह — उल — क़ुद्दूस की मुख़ालिफ़त करते हो; जैसे तुम्हारे बाप दादा करते थे, वैसे ही तुम भी करते हो।
54001009	Sin	या'नी ये समझकर कि शरी'अत रास्तबाज़ों के लिए मुक़र्रर नहीं हुई, बल्कि बेशरा' और सरकश लोगों, और बेदीनों, और गुनहगारों, और नापाक, और रिन्दों, और माँ — बाप के क़ातिलों, और ख़ूनियों,
46005009	Recommendation	मैंने अपने ख़त में तुम को ये लिखा था कि हरामकारों से सुहबत न रखना।
48001015	Grace	लेकिन जिस ख़ुदा ने मेरी माँ के पेट ही से मख़्सूस कर लिया, और अपने फ़ज़ल से बुला लिया, जब उसकी ये मर्ज़ी हुई
45007015	Description	और जो मैं करता हूँ उसको नहीं जानता क्यूँकि जिसका मैं इरादा करता हूँ वो नहीं करता बल्कि जिससे मुझको नफ़रत है वही करता हूँ।
61003018	Faith	बल्कि हमारे ख़ुदावन्द और मुन्जी ईसा मसीह के फ़ज़ल और 'इरफ़ान में बढ़ते जाओ। उसी की बड़ाई अब भी हो, और हमेशा तक होती रहे। आमीन।
46004010	Description	हम मसीह की ख़ातिर बेवक़ूफ़ हैं मगर तुम मसीह में अक़्लमन्द हो: हम कमज़ोर हैं और तुम ताक़तवर तुम इज़्ज़त दार हो: और हम बे'इज़्ज़त।
60005009	Faith	तुम ईमान में मज़बूत होकर और ये जानकर उसका मुक़ाबिला करो कि तुम्हारे भाई जो दुनिया में हैं ऐसे ही दुःख उठा रहे हैं
51003022	Recommendation	ग़ुलामों, हर बात में अपने दुनियावी मालिकों के ताबे रहो। न सिर्फ़ उन के सामने ही और उन्हें ख़ुश रखने के लिए ख़िदमत करें बल्कि ख़ुलूसदिली और ख़ुदावन्द का ख़ौफ़ मान कर काम करें।
66017012	Description	और वो दस सींग जो तू ने देखे दस बादशाह हैं। अभी तक उन्होंने बादशाही नहीं पाई, मगर उस हैवान के साथ घड़ी भर के वास्ते बादशाहों का सा इख़्तियार पाएँगे।
