43011004	Faith	जब ईसा को यह ख़बर मिली तो उस ने कहा, “इस बीमारी का अन्जाम मौत नहीं है, बल्कि यह ख़ुदा के जलाल के वास्ते हुआ है, ताकि इस से ख़ुदा के फ़र्ज़न्द को जलाल मिले।”
45001017	Faith	इस वास्ते कि उसमें ख़ुदा की रास्तबाज़ी ईमान से “और ईमान के लिए ज़ाहिर होती है जैसा लिखा है रास्तबाज़ ईमान से जीता रहेगा”
43019017	Description	वह अपनी सलीब उठाए शहर से निकला और उस जगह पहुँचा जिस का नाम खोपड़ी (अरामी ज़बान में गुल्गुता) था।
45012006	Faith	और चूँकि उस तौफ़ीक़ के मुवाफ़िक़ जो हम को दी गई; हमें तरह तरह की ने'अमतें मिली इसलिए जिस को नबुव्वत मिली हो वो ईमान के अन्दाज़े के मुवाफ़िक़ नबुव्वत करें।
66004007	Description	पहला जानवर बबर की तरह है, और दूसरा जानदार बछड़े की तरह, और तीसरे जानदार का इंसान का सा है, और चौथा जानदार उड़ते हुए 'उक़ाब की तरह है।
49005015	Recommendation	पस ग़ौर से देखो कि किस तरह चलते हो, नादानों की तरह नहीं बल्कि अक़्लमंदों की तरह चलो;
45010012	Grace	क्यूँकि यहूदियों और यूनानियों में कुछ फ़र्क़ नहीं इसलिए कि वही सब का ख़ुदावन्द है और अपने सब दुआ करनेवालों के लिए फ़य्याज़ है।
45010004	Faith	क्यूँकि हर एक ईमान लानेवाले की रास्तबाज़ी के लिए मसीह शरी'अत का अंजाम है।
50004006	Recommendation	किसी बात की फ़िक्र न करो, बल्कि हर एक बात में तुम्हारी दरख़्वास्तें दुआ और मिन्नत के वसीले से शुक्रगुज़ारी के साथ ख़ुदा के सामने पेश की जाएँ।
46010006	Faith	ये बातें हमारे लिए इबरत ठहरीं, ताकि हम बुरी चीज़ों की ख़्वाहिश न करें, जैसे उन्हों ने की।
66009002	Description	और जब उसने अथाह गड्ढे को खोला तो गड्ढे में से एक बड़ी भट्टी का सा धुवाँ उठा, और गड्ढे के धुवें के ज़रिए से सूरज और हवा तारीक हो गई।
52004006	Recommendation	और कोई शख़्स अपने भाई के साथ इस काम में ज़्यादती और दग़ा न करे क्यूँकि ख़ुदावन्द इन सब कामों का बदला लेने वाला है चुनाँचे हम ने पहले भी तुम को करके जता दिया था।
47005017	Faith	इसलिए अगर कोई मसीह में है तो वो नया मख़लूक़ है पूरानी चीज़ें जाती रहीं; देखो वो नई हो गईं।
43005020	Faith	इसलिए कि बाप बेटे को 'अज़ीज़ रखता है, और जितने काम ख़ुद करता है उसे दिखाता है; बल्कि इनसे भी बड़े काम उसे दिखाएगा, ताकि तुम ता'ज्जुब करो।
49004028	Recommendation	चोरी करने वाला फिर चोरी न करे, बल्कि अच्छा हुनर इख़्तियार करके हाथों से मेहनत करे ताकि मुहताज को देने के लिए उसके पास कुछ हो।
57001022	Recommendation	इसके सिवा मेरे लिए ठहरने की जगह तैयार कर, क्यूँकि मुझे उम्मीद है कि मैं तुम्हारी दु' आओं के वसीले से तुम्हें बख़्शा जाऊँगा।
58013009	Recommendation	तरह तरह की और बेगाना तालीमात आप को इधर उधर न भटकाएँ। आप तो ख़ुदा के फ़ज़ल से ताक़त पाते हैं और इस से नहीं कि आप मुख़्तलिफ़ खानों से परहेज़ करते हैं। इस में कोई ख़ास फ़ाइदा नहीं है।
52005012	Recommendation	और ऐ भाइयों, हम तुम से दरख़्वास्त करते हैं, कि जो तुम में मेहनत करते और ख़ुदावन्द में तुम्हारे पेशवा हैं और तुम को नसीहत करते हैं उन्हें मानो।
43009022	Description	उस के वालिदैन ने यह इस लिए कहा कि वह यहूदियों से डरते थे। क्यूँकि वह फ़ैसला कर चुके थे कि जो भी ईसा को मसीह क़रार दे उसे यहूदी जमाअत से निकाल दिया जाए।
50003003	Faith	क्यूँकि मख़्तून तो हम हैं जो ख़ुदा की रूह की हिदायत से ख़ुदा की इबादत करते हैं, और मसीह पर फ़ख़्र करते हैं, और जिस्म का भरोसा नहीं करते।
62003023	Faith	और उसका हुक्म ये है कि हम उसके बेटे ईसा मसीह के नाम पर ईमान लाएँ, जैसा उसने हमें हुक्म दिया उसके मुवाफ़िक़ आपस में मुहब्बत रख्खें।
66013011	Description	फिर मैंने एक और हैवान को ज़मीन में से निकलते हुए देखा। उसके बर्रे के से दो सींग थे और वो अज़दहा की तरह बोलता था।
46014020	Recommendation	ऐ भाइयों! तुम समझ में बच्चे न बनो; बदी में बच्चे रहो, मगर समझ में जवान बनो।
59005013	Recommendation	अगर तुम में कोई मुसीबत ज़दा हो तो दुआ करे, अगर ख़ुश हो तो हम्द के गीत गाए।
58012012	Recommendation	चुनाँचे अपने थके हारे बाज़ू और कमज़ोर घुटनों को मज़बूत करें।
60001017	Recommendation	और जब कि तुम 'बाप' कह कर उससे दुआ करते हो, जो हर एक के काम के मुवाफ़िक़ बग़ैर तरफ़दारी के इन्साफ़ करता है, तो अपनी मुसाफ़िरत का ज़माना ख़ौफ़ के साथ गुज़ारो।
58010036	Recommendation	लेकिन इस के लिए आप को साबित क़दमी की ज़रूरत है ताकि आप ख़ुदा की मर्ज़ी पूरी कर सकें और यूँ आप को वह कुछ मिल जाए जिस का वादा उस ने किया है।
58011001	Faith	ईमान क्या है? यह कि हम उस में क़ाईम रहें जिस पर हम उम्मीद रखते हैं और कि हम उस का यक़ीन रखें जो हम नहीं देख सकते।
49004017	Recommendation	इस लिए मैं ये कहता हूँ और ख़ुदावन्द में जताए देता हूँ कि जिस तरह ग़ैर — क़ौमें अपने बेहूदा ख़यालात के मुवाफ़िक़ चलती हैं, तुम आइन्दा को उस तरह न चलना।
51002016	Recommendation	चुनाँचे कोई तुमको इस वजह से मुजरिम न ठहराए कि तुम क्या क्या खाते — पीते या कौन कौन सी ईदें मनाते हो। इसी तरह कोई तुम्हारी अदालत न करे अगर तुम हक़ की ईद या सबत का दिन नहीं मनाते।
66007015	Faith	“इसी वजह से ये ख़ुदा के तख़्त के सामने हैं, और उसके मक़्दिस में रात दिन उसकी इबादत करते हैं, और जो तख़्त पर बैठा है, वो अपना ख़ेमा उनके ऊपर तानेगा।
44020010	Description	पौलुस उतर कर उस से लिपट गया, और गले लगा कर कहा, घबराओ नहीं इस में जान है।
55002010	Faith	इसी वजह से मैं नेक लोगों की ख़ातिर सब कुछ सहता हूँ ताकि वो भी उस नजात को जो मसीह 'ईसा में है अबदी जलाल समेत हासिल करें।
60005014	Recommendation	मुहब्बत से बोसा ले लेकर आपस में सलाम करो। तुम सबको जो मसीह में हो, इत्मीनान हासिल होता रहे।
49005021	Recommendation	और मसीह के ख़ौफ़ से एक दुसरे के फ़रमाबरदार रहो।
61003017	Recommendation	पस ऐ 'अज़ीज़ो! चूँकि तुम पहले से आगाह हो, इसलिए होशियार रहो, ताकि बे — दीनों की गुमराही की तरफ़ खिंच कर अपनी मज़बूती को छोड़ न दो।
51003018	Recommendation	बीवियो, अपने शौहर के ताबे रहें, क्यूँकि जो ख़ुदावन्द में है उस के लिए यही मुनासिब है।
54005020	Recommendation	गुनाह करने वालों को सब के सामने मलामत कर ताकि औरों को भी ख़ौफ़ हो।
45014013	Recommendation	पस आइन्दा को हम एक दूसरे पर इल्ज़ाम न लगाएँ बल्कि तुम यही ठान लो कि कोई अपने भाई के सामने वो चीज़ न रख्खे जो उसके ठोकर खाने या गिरने का ज़रिया हो।
45002010	Grace	मगर जलाल और इज़्ज़त और सलामती हर एक नेक काम करने वाले को मिलेगी; पहले यहूदी को फिर यूनानी को।
58011034	Violence	और आग के भड़कते शोलों को बुझा दिया। वह तलवार की ज़द से बच निकले। वह कमज़ोर थे लेकिन उन्हें ताक़त हासिल हुई। जब जंग छिड़ गई तो वह इतने ताक़तवर साबित हुए कि उन्हों ने ग़ैरमुल्की लश्करों को शिकस्त दी।
48006017	Faith	आगे को कोई मुझे तकलीफ़ न दे, क्यूँकि मैं अपने जिस्म पर मसीह के दाग़ लिए फिरता हूँ।
66018021	Violence	फिर एक ताक़तवर फ़रिश्ते ने बड़ी चक्की के पाट की तरह एक पत्थर उठाया, और ये कहकर समुन्दर में फेंक दिया, “बाबुल का बड़ा शहर भी इसी तरह ज़ोर से गिराया जाएगा, और फिर कभी उसका पता न मिलेगा।
65001020	Faith	मगर तुम ऐ प्यारों! अपने पाक तरीन ईमान में अपनी तरक़्क़ी करके और रूह — उल — क़ुद्दूस में दुआ करके,
45012002	Recommendation	और इस जहान के हमशक्ल न बनो बल्कि अक़्ल नई हो जाने से अपनी सूरत बदलते जाओ ताकि ख़ुदा की नेक और पसन्दीदा और कामिल मर्ज़ी को तजुर्बा से मा'लूम करते रहो।
46015009	Sin	क्यूँकि मैं रसूलों में सब से छोटा हूँ, बल्कि रसूल कहलाने के लायक़ नहीं इसलिए कि मैने ख़ुदा की कलीसिया को सताया था।
62002015	Recommendation	न दुनिया से मुहब्बत रख्खो, न उन चीज़ों से जो दुनियाँ में हैं। जो कोई दुनिया से मुहब्बत रखता है, उसमें बाप की मुहब्बत नहीं।
45002001	Sin	पस ऐ इल्ज़ाम लगाने वाले तू कोई क्यूँ न हो तेरे पास कोई बहाना नहीं क्यूँकि जिस बात से तू दूसरे पर इल्ज़ाम लगाता है उसी का तू अपने आप को मुजरिम ठहराता है इसलिए कि तू जो इल्ज़ाम लगाता है ख़ुद वही काम करता है।
48002009	Description	और जब उन्होंने उस तौफ़ीक़ को मा'लूम किया जो मुझे मिली थी, तो या'क़ूब और कैफ़ा और याहुन ने जो कलीसिया के सुतून समझे जाते थे, मुझे और बरनबास को दहना हाथ देकर शरीक कर लिया, ताकि हम ग़ैर क़ौमों के पास जाएँ और वो मख़्तूनों के पास;
43019023	Description	ईसा को सलीब पर चढ़ाने के बाद फ़ौजियों ने उस के कपड़े ले कर चार हिस्सों में बाँट लिए, हर फ़ौजी के लिए एक हिस्सा। लेकिन चोग़ा बेजोड़ था। वह ऊपर से ले कर नीचे तक बुना हुआ एक ही टुकड़े का था।
45002021	Sin	पस तू जो औरों को सिखाता है अपने आप को क्यूँ नहीं सिखाता? तू जो बताता है कि चोरी न करना तब तूख़ुद क्यूँ चोरी करता है? तू जो कहता है ज़िना न करना; तब तू क्यूँ ज़िना करता है?
46006019	Faith	क्या तुम नहीं जानते कि तुम्हारा बदन रूह — उल — क़ुद्दूस का मक़दिस है जो तुम में बसा हुआ है और तुम को ख़ुदा की तरफ़ से मिला है? और तुम अपने नहीं।
47005014	Grace	क्यूँकि मसीह की मुहब्बत हम को मजबूर कर देती है इसलिए कि हम ये समझते है कि जब एक सब के वास्ते मरा तो सब मर गए।
58003001	Faith	पस ऐ पाक भाइयों! तुम जो आसमानी बुलावे में शरीक हो, उस रसूल और सरदार काहिन ईसा पर ग़ौर करो जिसका हम करते हैं;
44020035	Recommendation	मैंने तुम को सब बातें करके दिखा दीं कि इस तरह मेहनत करके कमज़ोरों को संभालना और ख़ुदावन्द ईसा की बातें याद रखना चाहिए, उस ने ख़ुद कहा, “देना लेने से मुबारिक़ है।”
58013004	Recommendation	ज़रूरी है कि सब के सब मिली हुई ज़िन्दगी का एहतिराम करें। शौहर और बीवी एक दूसरे के वफ़ादार रहें, क्यूँकि ख़ुदा ज़िनाकारों और शादी का बंधन तोड़ने वालों की अदालत करेगा।
43020005	Description	उस ने झुक कर अन्दर झाँका तो कफ़न की पट्टियाँ वहाँ पड़ी नज़र आईं। लेकिन वह अन्दर न गया।
66016018	Description	फिर बिजलियाँ और आवाज़ें और गरजें पैदा हुईं, और एक ऐसा बड़ा भुन्चाल आया कि जब से इंसान ज़मीन पर पैदा हुए ऐसा बड़ा और सख़्त भुन्चाल कभी न आया था।
66019010	Faith	और मैं उसे सिज्दा करने के लिए उसके पाँव पर गिरा। उसने मुझ से कहा, “ख़बरदार! ऐसा न कर। मैं भी तेरा और तेरे उन भाइयों का हमख़िदमत हूँ, जो ईसा की गवाही देने पर क़ाईम हैं। ख़ुदा ही को सिज्दा कर।” क्यूँकि ईसा की गवाही नबुव्वत की रूह है।
46002010	Grace	लेकिन हम पर ख़ुदा ने उसको रूह के ज़रिए से ज़ाहिर किया क्यूँकि रूह सब बातें बल्कि ख़ुदा की तह की बातें भी दरियाफ़्त कर लेता है।
50002029	Recommendation	पस तुम उससे ख़ुदावन्द में कमाल ख़ुशी के साथ मिलना, और ऐसे शख़्सों की' इज़्ज़त किया करो,
51003020	Recommendation	बच्चे, हर बात में अपने माँ — बाप के ताबे रहें, क्यूँकि यही ख़ुदावन्द को पसन्द है।
47001012	Faith	क्यूँकि हम को अपने दिल की इस गवाही पर फ़ख़्र है कि हमारा चाल चलन दुनिया में और ख़ासकर तुम में जिस्मानी हिक्मत के साथ नहीं बल्कि ख़ुदा के फ़ज़ल के साथ ऐसी पाकीज़गी और सफ़ाई के साथ रहा जो ख़ुदा के लायक़ है।
43014021	Faith	जिस के पास मेरे हुक्म हैं और जो उन के मुताबिक़ ज़िन्दगी गुज़ारता है, वही मुझे प्यार करता है। और जो मुझे प्यार करता है उसे मेरा बाप प्यार करेगा। मैं भी उसे प्यार करूँगा और अपने आप को उस पर ज़ाहिर करूँगा।”
51002023	Sin	बेशक यह अह्काम जो गढ़े हुए मज़्हबी फ़राइज़, नाम — निहाद फ़रोतनी और जिस्म के सख़्त दबाओ का तक़ाज़ा करते हैं हिक्मत पर मुन्हसिर तो लगते हैं, लेकिन यह बेकार हैं और सिर्फ़ जिस्म ही की ख़्वाहिशात पूरी करते हैं।
64001006	Recommendation	उन्होंने कलीसिया के सामने तेरी मुहब्बत की गवाही दी थी। अगर तू उन्हें उस तरह रवाना करेगा, जिस तरह ख़ुदा के लोगों को मुनासिब है तो अच्छा करेगा।
55002023	Recommendation	लेकिन बेवक़ूफ़ी और नादानी की हुज्जतों से किनारा कर क्यूँकि तू जानता है; कि उन से झगड़े पैदा होते हैं।
47003018	Faith	मगर जब हम सब के बे'नक़ाब चेहरों से ख़ुदावन्द का जलाल इस तरह ज़ाहिर होता है; जिस तरह आइने में, तो उस ख़ुदावन्द के वसीले से जो रूह है हम उसी जलाली सूरत में दर्जा ब दर्जा बदलते जाते हैं।
58009014	Grace	अगर इन चीज़ों का यह असर था तो फिर मसीह के ख़ून का क्या ज़बरदस्त असर होगा! अज़ली रूह के ज़रिए उस ने अपने आप को बेदाग़ क़ुर्बानी के तौर पर पेश किया। यूँ उस का ख़ून हमारे ज़मीर को मौत तक पहुँचाने वाले कामों से पाक — साफ़ करता है ताकि हम ज़िन्दा ख़ुदा की ख़िदमत कर सकें।
44011017	Grace	पस जब ख़ुदा ने उस को भी वही ने'मत दी जो हम को ख़ुदावन्द ईसा मसीह पर ईमान लाकर मिली थी? तो मै कौन था कि ख़ुदा को रोक सकता।
49004030	Faith	और ख़ुदा के पाक रूह को ग़मगीन न करो, जिससे तुम पर रिहाई के दिन के लिए मुहर हुई।
