62004015	Faith	Cyotzambapø'is que Jesús Diosise 'yune , itpa Diosis choco'yomo ; y Dios itpa je'is choco'yomo .
49004022	Recommendation	Por eso como pecapø tucu ndø tzacpase , jetse tzactam je yatzipø qui'psocuy mi nø'ijtamupøna'ṉ , jet jamgajpø'tamø . Porque jetsepø qui'psocu'is mi aṉgøma'cøtyamba va'cø mi ndzøctam tococuy ndø sisis syunbase .
43010009	Grace	Øjchøṉ aṉdyuṉ . O'ca aunque i tøjcøpya øtzpit , cotzocpa . Y como borrego tøjcøyajpya y putyapa y pya'tyajpa vøjpø cu'tcuy , jetse øtzpit tøjcøpyajpapø pø'nis maṉba pya'tyaj vøjpø itcuy .
58011037	Violence	Eyata'mbø puṉga'yajtøj tza'ji'ṉ ; eyapø vyøcjacyajtøju sierraji'ṉ , eyapø tzøcna'chajtøju va'cø jana vya'ṉjam Dios pero ja ña'chajø . Eyapø yaj ca'yajtøju espadaji'ṉ . Eyapø vitmaṉvitmaṉyaju vitca'møyajupø borrego nacaji'ṉ y chivu nacaji'ṉ , pobreta'mbøte , ja ityajøna'ṉ ni tiyø , yac toya'isyajtøjupø , yacsutzøcyajtøjupø ;
62002029	Faith	Mitz mi mustamba que Cristo'is chøjcapya mumu Diosis 'yote y por eso mi mustamba que mumu chøjcapyapø'is Diosis 'yote , Diosise 'yuneta'm .
44013047	Grace	Porque øtzta'm ø aṉgui'mda'møjtzi ndø Comi'is , yøcse nøja'yøjtzi : Øjtzø mi ṉgojtam mijtzi para va'cø mi ndzajmatyam ote mumu pøn lo que ji'ndyet Israel pøn , va'cø ityaj como sø'ṉgø'omse ; va'cø mi ndzajmay ote va'cø cyotzocyaj hasta más ya'i nasomda'mbø pønda'm .
47004002	Faith	Jajmbø'ta'møjtzi yatzitzoco'yajcuy , ji'n ø nu'm dza'ajcu chøctamø , ni ji'nø ndzøctam maña'ajcuy . Øtz ji'n aṉgøma'cøtyam ni iyø . Øtz viyuṉ dzamdamba Diosis 'yote , ji'n ø ndzamdam sutzcuy . Sino cøyin vøjpø tiyø ndzamdamba øjtzi . Jetse ndzøcta'mbøjtzi mumu tiyø mumu i'is vyi'naṉdøjqui , y Diosis vyi'naṉdøjqui , va'cø isyajø que vøjpø ti ndzøcta'mbøjtzi .
44002033	Description	Así es que yøti Diosis yac møja'ṉo'maj Jesús ñe'c chø'na'ṉomo , y Jesusis pyøjcøchoṉu'am Masanbø Espiritu Santo Diosis vi'na chajmayu que maṉba chi'i . Y yøti Jesusis nømdi yac mø'n Espiritu Santo , y por eso mi istamba y mi mandamba lo que nø chøjcupø Espiritu Santo'is .
51003010	Recommendation	Y mi nø'ijtamu'am jomepø qui'psocuy . Jetse Diosis mi yac jome'ajatyamba mi ṉgui'psocutya'm como ñe'c Diosis ijtuse qui'psocuy , va'cø mi ṉgomustam Dios . Como jomepø tucu ndø mespase , jetse jomepø qui'psocuy mi mbøctamu'am . Diosis mi yac jomevitu'tamba va'cø mi ṉgomuspø'tam Dios , va'cø mi nø'ijtam vøjpø qui'psocuy como ñø'ijtuse tø jomectamupø'is .
43011004	Faith	Jesusis myanu jetsepø ote , y nømu : ― Yøṉ ca'e'aju pero ji'ndyet va'cø cya'octucø , sino va'cø myøja'ṉomgotzøctøj Dios , y jetsetique't øtz va'cø møja'ṉomgotzøctøjque'ta , øtz Diosis chøṉ 'Yune .
45001017	Faith	Porque Diosis tzajmapya vøjpø ote va'cø tø yac mustamø que muspa tø putø vyøjom Diosis vi'naṉdøjqui cuando tø va'ṉjamba'c Dios , y solamente ndø vaṉjajmocucøtoya . Jetse ijtu jachø'yupø : “ Vya'ṉjamba'is Dios maṉba put vyøjomo Diosis vyi'naṉdøjqui ” .
43019017	Description	Jesús cruz cajpupø put va'cø maṉ tum lugajromo ñøyimø ca'upø'is cyo'cøpacmø . Hebreo ote'omo ñøyipø'is Gólgota .
45012006	Faith	Entonces jetse tumdum pø'nis muspa chøc ne'ne' Diosis yoscuy conforme jujche Diosis tø yac mijnapya ndø jajme'omo ñe' vyø'ajcupit . O'ca muspa ndø tza'maṉvajcoya , hay que va'cø ndø tza'maṉvajcoya mø'chøqui tø tzi'tøjuse va'ṉjajmocuy .
66004007	Description	Y tum copøn caṉse quenbapø , y metza'ombø vacas unese quenbapø , tu'ca'yombø'is pøn vinaca ñø'ijtu . Y masycu'yombø nø syitijtupø møja tajpise quenbapø .
49005015	Recommendation	Mi ⁿvin tzøjcaytam cuenda jujche mi ijtamba va'cø jana ijtam jovi , sino qui'psocu'yøyupø pønse ijtamø .
45010012	Grace	Jetse tucpa parejo Israel pønji'ṉda'm y eyapø pønji'ṉda'm porque mismo ndø Comi aunque i'se ñe' , y mø'chøqui va'ctzi'yajpa vøjpø tiyø mumu pøn lo que vya'cyajpapø'is ñe'jcøsi aunque tiyø .
45010004	Faith	Porque o'ca ndø va'ṉjamba Cristo , vyøjom tø putpa y aṉgui'mocuy ja itø'am øtzcøtoya , cøjtupømete .
50004006	Recommendation	Niticøsi u mi myaya'ndamu , sino aunque tipit Dioscøs vactamø ti mi sundamba . Va'ctam ti mi sundamba , y nøjatyam Dios : “ Yøscøtoya mi ndzøcpa vøjpø tiyø ” .
46010006	Faith	Mumu jetse tujcu va'cø ndø tzi' cuenta que ji'n vyøj va'cø ndø aṉsun yatzita'mbø tiyø como jujche oyse chøcyaj ji'quista'm .
66009002	Description	Y cuando 'yaṉvac jøṉupø tzatøc , put joco como vøti juctyøc jo'cøpyase . Y pi'tzø'ajṉømu , jama ji'nam omba sø'ṉi tzatøjcom pujtupø joco'is .
52004006	Recommendation	va'cø jana cyøtzøjcøyø ni va'cø jana 'yaṉgøma'cøy pyøndøvø ni i'is yøcsepø ticøsi . Porque Diosis maṉba cyastigatzøqui mumu chøcpapø'is jetsepø yatzitzoco'yajcuy . Jetse o'yø mi ndzajmatyame mø'chøqui vi'na .
47005017	Faith	Por eso o'ca ndø va'njamba Cristo , tø jome vitu'pa , ji'nam tø it como vi'nase , viyuṉsye mumu tiyø jome vitu'pa .
43005020	Faith	Porque ø Janda'is su'nbøjtzi , y isindzi'pøjtzi mumu lo que ñe'c chøcpase . Y matøc yac isque't más myøja'ṉomda'mbø tiyø va'cø mi nømaya'ndamø .
49004028	Recommendation	Lo que nu'mbapøna'ṉ , hay que va'cø jana ñu'mø'am ; sino hay que va'cø chøc vøjpø ti yoscuy cyø'ji'ṉ va'cø mus cyotzova ja itø'is ñe' .
57001022	Recommendation	También tø vøjøtzøjcay ø ⁿjejcuy , porque mitz mi o'nøndyamba Dios va'cø mus maṉ mitzcø'mø ; y por eso nø mususe que Diosis ma'ṉbø yac maṉ mitzcø'mø .
58013009	Recommendation	U mi mbøjcøchoṉdam eyata'mbø aṉma'yocuy nunca ji'n ndø mandamepø . Porque ji'ndyet cu'tcuji'n tø va'ṉjajmoy mø'chøqui ndø tzoco'yomo , sino Diosis vyø'ajcupit tø va'ṉjajmopya . Porque cyo'aṉjamyaju'is cu'tcuy nunca ji'n ityaj más vøjø jetse .
52005012	Recommendation	Y mi ndzajmatyamba mijtzi va'cø mi ṉgøna'tzøtyamø yosyajpapø mijtzomda'm , y mi 'yaṉgui'myajpapø'is ndø Comi'is sunbase , y mi ñcha'maṉvajcapapø'is .
43009022	Description	Jetse nømyaj jyatata'm porque na'chaju uytem ti maṉ chøjcayaj Israel pø'nista'm . Porque Israel pøn parejo'ayaju'am va'cø jana yac tøjcøyaj conocscutyøjcomo aunque jutipø pøn o'ca nømba que Jesús Diosis cyø'vejupø .
50003003	Faith	Porque tø øtzta'm viyuṉse ndø tzoco'yom tø seña'øtyamu , ji'ndyet ndø siscøsi . Porque ndø cøna'tzøtyamba Dios Espiritu Santo'is tø cotzoṉdambase , y tø casøtyamba porque tø ijtamba Cristo Jesúsji'ṉ , y øtz musta'mbøjtzi que ni ticøtoya ji'ṉ yose ndø tzøctambase ndø ne'ṉgø va'cø vyøjom tø pujtam Diosis vyi'naṉdøjqui .
62003023	Faith	Diosis tø aṉgui'mba va'cø ndø va'ṉjajmatyam ñe' 'Yune Jesucristo que jujchepøte , y que va'cø nay tyø sundandøj como je'is tø aṉgui'mdamuse .
66013011	Description	Entonces jøsicam ⁿisøjtizi eyapø na'nchaṉbø copøn nasacø'm nø pyujtupø . It metzcuy vyaja borrego'is vyajasepø , pero serpientese vejvejnepya .
46014020	Recommendation	Tøvø'ajcutya'm , u che'pø une'is qui'psocuy nø'ijtatyamu , sino que jujche yava une'is ji'n chøcyaj yatzitzoco'yajcuy , jetseti mitzta'mque't u mi ndzøctam yatzitzoco'yajcuy . Pero jujche tzambø'nis qui'psocuy ijtuse , jetseti nø'ijtaṉgue't mi ṉgui'psocutya'm .
59005013	Recommendation	O'ca it mijtzomda'm nø tyoya'isupø , yac'o'nøy Dios . O'ca it nø cyasøyupø , yac vajnay Dios .
58012012	Recommendation	Como cuando mochi'ajyajpa ndø cø' y ndø coso tiene que va'cø tø pømipøctamø , jetsetique't o'ca mochi mi va'ṉjajmoṉgutya'm tiene que va'cø mi mbyømipøctangue'ta .
60001017	Recommendation	Cuando mi o'nøndyamba Dios , mi nøjandyamba : “ Øjchøṉ mi Janda ” . Y Diosis parejo maṉba tø cøme'tztam mumu pøn ti ndø tzøjcu , pero ji'n queyaṉ ve'ñaṉ maṉba cøme'tze . Por eso mientras que mi ⁿijtamu'øc nascøsi como vitise , hay que va'cø mi na'tztamø jana mi ndzøctam je'is ji'n syunise .
58010036	Recommendation	Pero tiene que va'cø mi ndondam aunque tiyø pasencia'ajcupit , y va'cø mi ndzøctam como Diosis syunbase . Entonces maṉba mi mbøjcøchondam lo que Diosis mi nchamdzi'tamuse .
58011001	Faith	Va'cø ndø va'ṉjamdamø , entonces ndø tumøtzocoy ndø ni'aṉjamdamba que maṉba ndø pøjcøchoṉdame nø ndø ⁿjo'ctamupø tiyø . Y ndø mustamba sevro que it ji'n ndø istamepø tiyø , pero ijtuti .
49004017	Recommendation	Entonces ndø Comi'is ñøyicøsi mi ndzajmacomø'nda'mbøjtzi va'cø jana mi ijtam como ityajpase lo que ji'ndyet Israel pøn ji'n cyomusyaje'is Dios , porque je'is qui'psocuy ni ticøtoya ji'n maṉ yose .
51002016	Recommendation	Jetcøtoya u mi ndzøjcaytam cuenda o'ca aunque i'is mi ñøjatyamba : “ U mi ṉgu'jtam jete , u mi ⁿuctam jete ” . O si no o'ca mi ñøjatyamba : “ Tiene que va'cø mi ṉgo'aṉjamdam søṉ , tiene que va'cø mi ṉgo'aṉjamdam poya minguy , tiene que va'cø mi ṉgo'aṉjamdam sapøjcuy jama ” ; pero u mi ndzøjcatyam cuenda .
66007015	Faith	Por eso ityaj yøti Diosis 'yaṉgui'mguy po'cscu'is vyi'naṉdøjqui , Diosis myasandøjcomo chu'ji'ṉ jamaji'ṉ yosayajpa . Y po'cscu'yom po'scupø ndø Comi Dios maṉba it je'tomda'm va'cø cuendatzøcyajø .
44020010	Description	Entonces mø'n Pablo y mucscøne'c jetcøsi y jyotzcøtøjcøyu ñøjayaju : ― Uy 'yuqui'ajtame , quenbati .
55002010	Faith	Por eso ndo'nbøjtzi mumu toya'iscuy va'cø mus ṉgotzoṉyajø pøn lo que Diosis cyøpiṉyajupø . Su'nbøjtzi va'cø cyotzocyajø . Cristo Jesusis tø yaj cotzocpa va'cø tø it vøjø mumu jamacøtoya myøja'ṉo'majcu'yomo .
60005014	Recommendation	Na yuschi'tandøjø su'cocuji'ṉ porque nay mi sundandøjpa . O'nøpyøjtzi Dios va'cø mi yac ijtam contento mumu mitzta'm Jesuscristo'ise mi ñe'nda'm . Amén .
49005021	Recommendation	Hay que va'cø mi nay gyøma'nøjatyandøjø mi ne'ṉgomda'm porque Dios nø mi ṉgøna'tzøtyamu .
61003017	Recommendation	Por eso mi sundambapø chøṉø , como mi mustamba'am que it jetsepø tø aṉgøma'cøpa'is , tzøctam cuenda jana mi aṉgøma'cøtyaṉgue't yatzipø pø'nis syutzcuji'ṉ , jana mi jajmbø' vøjpø mi va'ṉjajmoṉguy .
51003018	Recommendation	Mitz ṉgyo'tøc yomo'ista'm , cøna'tzøtyam mi ⁿjaya como vøj va'cø chøc vya'ṉjambapø'is ndø Comi .
54005020	Recommendation	O'ca nø chøc cyoja , hay que va'cø mi ojnayø vøti pø'nis vyi'nomda'm , va'cø isyaj eyata'mbø'is que nø 'yojnatyøju , y jetse va'cø ña'chajø .
45014013	Recommendation	Jetcøtoya uy ndø cøque'nøy ndø tøcø o'ca chøc vøjø , ø'ca ja chøc vøjø . Más vøj va'cø ndø cøque'nøy jana ndø yaj cojapa't ndø tøvø ; jana ndø ndzi' qui'psocuy va'cø chøc yatzitzoco'yajcuy .
45002010	Grace	Pero chøcpapø'is vøjø , je pøn Diosis maṉba vyøpøpøngotzøqui , maṉba yac møja'ṉo'maje , maṉba yac it contento . Vi'na jetse maṉba tucyaje Israel pøn , y jetseti maṉba tucyajque't eyata'mbø pøn .
58011034	Violence	Veneta'mbø ni ti ja ñøtzøcyaj pømi nembapø juctyøjquis , venetambø ni jutipø'is ja mus yaj ca'yajø espadaji'ṉ . Cuando vya'ṉjamyaj Dios mochita'mbø'is , entonces pømi'øyaju quipcu'yomo , ja ña'tze quipyajø ; myacnøpoyaj emøta'mbø soldado .
48006017	Faith	Desde yøti u mi ndø molestatzøctamø , porque ø ṉgoṉñacøsi ityajupø ø sas , jet señate que øtz ndø Comi Jesucristo'is choṉ cyoyospa .
66018021	Violence	Entonces pømi'øyupø angelesis cho'ṉdonde'n vacucha'sepø møja tza' y pyatztondøjcøy majromo y nømu : ― Jetsetique't myøja'ṉombø Babilonia cumguy maṉba yajyajtøj pømiji'ṉ y ji'nam ma quej nunca .
65001020	Faith	Pero mijtzi tøvøy mi sundambapø chønø , Dios va'ṉjajmø mi dumø tzocoy va'cø tumdum jama qui'mbati maṉ mi va'ṉjajmoṉguy . O'nøndyam Dios mi ṉgyotzoṉdambase Masanbø Espiritu Santo'is .
45012002	Recommendation	U mi ijtam jujche ityajpase aunque jutzpø nascøsta'mbø pøn , sino jomecotzøctam mi ṉgui'psocuy va'cø mi ṉgacpø'tuctam mi ⁿvin . Entonces maṉba mi ṉgomustam lo que Diosis syunbase . Y lo que Diosis syunbase vøjpø tiyete , porque Diosis jetse vyø'møpya , más vøjpø tiyø ja itø .
46015009	Sin	Porque øtz ji'n mus vøjcotzøctøjø como eyata'mbø apostoles vøjcotzøcyajtøjpase . Y øtz ji'n vyøjø va'cø apostolescotzøctøjø , porque yacsutzøcpana'ṉtzi vya'ṉjamyajpapø'is Dios .
62002015	Recommendation	U mi aṉsundamø yatzipø itcuy nascøspø , u mi aṉsundamu ni ti nascøspø yach espiritu'is ñe' . O'ca ndø aṉsunba yatzipø itcuy nascøspø , entonces ji'nam ndø suni ndø Janda Dios .
45002001	Sin	Y mijtzi mbyøn , o'ca mi ñøjmambya mi ndøvø : “ Ji'n vyøjpø tiyø nø mi ndzøjcupø ” , o'ca jetse mi nøjambya mi ndøvø , mi ne' mi ndzøcpa mi ṉgoja ; porque mitz igual mi ndzøcpa jujche mi ndøvø'is chøcpase . Jetse ji'n mus mi nømø que ja it mi ṉgoja .
48002009	Description	Y como'yajtøjpana'ṉ Jacobo y Pedro y Juan o'ca más covi'najøta'mete . Cuando chi'yaj cuenta je'is que Diosis cotzo'ṉøjtzi jetse va'cø yosa , entonces nøcø'mitzta'møjtzi Bernabeji'ṉ va'cø myustøjø que vyø'møyaju øtz ndzøctambase . Vyø'møyaju que va'cø yosta'møjtzi aunque jujchepø pø'nomo , y ñe'c va'cø yosyajø Israel pø'nomo .
43019023	Description	Mya'møyaju'cam Jesús cruzcøsi soldado'is , entonces pijṉayaj tyucu y tumdumø vye'nbø'yaj macsyaṉbø'nomo , tumdum soldado'is pyøjcayaj tumdumø tyucu . Pero cyamisya ja ña'cøpøna'ṉete , entero tajcupø .
45002021	Sin	Entonces mijtzi mi aṉmambyapø'is mi ndøvø , ¿ jutznøm mi ⁿvin ji'n mi aṉmaye ? Mijtzi mi ndza'maṉvacpa que ji'n musi ndø nu'mø ; pero mi ne' mi nu'mbati .
46006019	Faith	Mi mustambati que Masanbø Espiritu Santo lo que Diosis mi nchi'papø je'is ñøc'ijtøjapya ndø coṉña como ñe' myasandøcse y ji'n mus ndø aṉgui'm ndø tumgø'y ndø vin , porque ndø Comi'is tø ñe'ta'm .
47005014	Grace	Porque Cristo'is tø sunba , por eso ndø penatzøcpa ndø vin va'cø ndø tzøc je'is syunbase . Pues nømda'mbøjtzi que como Cristo ca'u mumu icøtoya , entonces Diosis cyotpa cuenta que mumu tø ca'tamu'am ndø cojacøtoya .
58003001	Faith	Entonces ø mi va'ṉjajmocuy tøvøta'm , Diosis mi ṉgyøpiṉdamupø ñe'cøtoya , y mi ⁿvyejandyamupø va'cø maṉ mi ijtam ñe'cji'ṉ tzajpomo . Como jetse chøc Diosis , por eso tzi'tam cuenta mø'chøqui Jesús . Porque jic Jesús Diosis cyø'vejupø , y como jujche ndø va'ṉjajmoṉguy , Jesús pane covi'najøte .
44020035	Recommendation	Øjtzi mi isindzi'ta'møjtzi mumu tiyø jujche vøjø va'cø ndzøctamø . Syunba va'cø tø yostamø va'cø ndø cotzoṉyaj mochita'mbø y va'cø ndø jajmatyam ndø Comi Jesusis 'yote nømuse : “ Va'cø ndø sajtzi' tum ndø tøvø tiyete , más tø itpa contento que ji'n ndø pøjcøchovese ” .
58013004	Recommendation	Vøjpø tiyøte co'tøjcajcuy , y vøjø va'cø ñø'it yomo pø'nis , y va'cø ñø'it jyaya yomo'is . Pero Diosis maṉba cyastigatzøcyaj møtzi nø'ityajpa'is yomo y cøtzøjcø'yoyajpapø .
43020005	Description	Y jucsycøne'cu y quendøjcøy jojmo tzatøjcomo y is jen tucu monupøji'ṉ , pero ja tyøjcøyø .
66016018	Description	Entonces ne'mnømu , pømi a'ṉøñømu y rayu a'ṉøyu ; y cøt pømipø nasa micscø . Desde ijtzotznøm nascøsi , nunca ja o cøt jetse pømipø nasamicscø . Yøti más pømi cøjtu .
66019010	Faith	Y japcøne'c øjtzi angelesis cyosocø'mø va'cø ṉgøna'tzøyø , pero je'is nøjma'yøjtzi : ― Uy japney ø vi'naṉdøjqui . Porque øtz Diosisti chøn ñu'cscucye't como jujche mijtzi Diosis mi ñu'cscuy y como mi va'ṉjajmoṉguy tøvø'is cyotestigosayajpa'is Jesús Diosisti ñu'cscutya'mgue't ; Dios cøna'tzøyø . Porque va'cø ndø cotestigosaj Jesús , mismo qui'psocuy ndø nø'ijtamba como ñø'ityajuse cha'maṉvajcayajpa'is Diosis 'yote .
46002010	Grace	Pero ñe' Yespirituji'ṉ Diosis tø yac muspa lo que 'yalistatzøjcupø . Porque Espiritu'is cyøme'tzpa mumu tiyø , hasta más jojmo Diosis choco'yomo ijtuse jyajme .
50002029	Recommendation	Casøpya pøjcøchondamø Epafrodito ndø Comi'is ñøyicøsi , y møja'ṉomgotzøctamø jetseta'mbø pøn .
51003020	Recommendation	Mi 'yune'sta'm , cøna'tzøtyam mi jandata'm y mi mamanda'm mumu ticøsi , porque jetse syunba ndø Comi'is .
47001012	Faith	Ijtu ticøtoya casøtya'mbøjtzi . Casøtya'mbøjtzi porque mismo ø ndzoco'is ñi'aṉjajmba o'ca oyuse ijtam yøṉ nascøsi , ndumøchocoyajta'mbøjtzi va'cø ndzøctam mumu tiyø para Dioscøtoya ; y viyuṉse más jetse o ijtam mitzji'ṉda'm . Diosis cotzonda'møjtzi vyø'ajcupit va'cø ijtam nascøsi . Ja o ndzøctam pø'nis qui'psocuji'ṉ .
43014021	Faith	Comusapyapø'is ø aṉgui'mguy y tzøjcapapø'is ø aṉgui'mguy , je'is su'nbøjtzi y ø Janda'is syunba en que sunba'is øjtzi , y øtz tambien mati sunque'te y ma'ṉba yaj comus ø ⁿvin i chøṉø .
51002023	Sin	Cuando ya'inducyajpa cu'tcuy y eyata'mbø tiyø 'yaṉgui'myajpa , ndø como'tyamba que vøjpøt jetse va'cø ndø tzøcø . Tzi'yajpa pena va'cø conocsayaj ñe'c qui'psyajpase , y chøcyajpa vyin como ja itøse aṉgui'mguy , y yacsutzøcyajpa vyin . Pero jetse va'cø chøcyajø , ji'n ya'inducyaj yatzipø syisis qui'psocuy .
64001006	Recommendation	Cuando tu'myajpa yø'qui ndø tøvøta'm , ya'i tzu'ṉyajupø'is mi ñchamyajpa jujche mitz sunyajpa aunque iyø . Tzi'tamø jic vityajpapø ndø tøvø lo que ti syuñajpa para tuṉgøtoya . Jetse syunba Diosis , y vøj jetse va'cø mi ndzøcø .
55002023	Recommendation	Uy mi 'yonguijpu jovita'mbø pønse , ji'n musoyajepø pønse . Porque mi muspa que va'cø onguipyajø , vøti'ajpa quipcuy .
47003018	Faith	Como tum espejo o'ca ja cyøta'cøtyøjø veloji'ṉ sø'ṉvitu'pa ; jetseti mumu tø øtzta'm como ja cyøta'cøtyøjø ø vinaṉga veloji'ṉ . Ndø Comi'is syø'ṉgø nu'cpa øtzcøsi y sø'ṉvitu'que'tpati . Y nømdi cyacpø' ndø qui'psocuy más va'cø tø it como Cristose y como sø'ṉgøse más va'cø ndø nø'ijtay je'is qui'psocuy . Ndø Comi'is 'Yespiritu'is jetse chøcpa .
58009014	Grace	Pero Cristo'is chi'ocuyaj vyin Dioscøsi jana cojapø ; ji'n yajepø Espiritu'is cyotzoṉu . Ñe ñø'pinji'ṉ je'is tø yaj cøvajcøjapya ndø qui'psocuy va'cø ndø musø que ja it ndø coja . Entonces o'ca copø'nis ñø'pinis tø cøvacpa vingøsi , entonces más vøjpø tiyøte que Cristo'is ñø'pi'nis tø yaj cøvajcøjapya ndø tzocoy va'cø jana ndø tzøc tocoy ndø vin , sino va'cø ndø cøna'tzøy quenbapø Dios .
44011017	Grace	Entonces como Diosis chi'yaj jejta'm Espiritu Santo igual como tø tzi'tamuse øjta'm cuando oy tø va'ṉjajmdam ndø Comi Jesucristo , ¿ entonces i chøṉ øjtzi va'cø maṉ ya'induc Dios ?
49004030	Faith	U mi yac maya'tamu Diosis Masanbø 'Yespiritu Santo porque como carta seña'øtyøjpase va'cø cyeja i'is se ñe' , jetse Espiritu Santo'is tø seña'øpya va'cø cyeja que Diosise tø 'yune , va'cø tø mustamø que minbapø hora'omo Diosis maṉba tø yaj cotzojcoctuctame .
66003003	Recommendation	Jajmutzøctamø ti mi ñchajmatandøjuse y mi mandamuse , y seguitzøctamø y qui'psvitu'tamø . O'ca ji'n mi ṉgoquendame , øtz ma'ṉbø nu'c mitzcø'mda'm nu'mbase , y ji'n ma mi mustame ti hora mi'nbøjtzi .
62003007	Recommendation	Øjchøṉ mi unenda'm , tzøctam cuenda jana mi 'yaṉgøma'cøtyandøjø . Chøcpapø'is Diosis syunbase , vøj putpa Diosis vyi'naṉdøjqui como Jesucristo vøj pujtu Diosis vyi'naṉdøjqui .
62004001	Recommendation	Tøvøyta'm nay tø sundandøjpapø'is , u mi va'ṉjamdamu mumu pøn nømbapø que : “ Øtz Diosis 'Yespiritupit 'yaṉma'yopøjtzi ” ; sino que tzøjquistamø a ver o'ca Diosis 'Yespiritu ñø'ijtayu . Porque aunque juti vityajpa sone sutzcuy cha'maṉvacyajpapø'is .
44013038	Grace	Mustam mijtzi , tøvøyta'm , que nømdi tzamdøju que Diosis tø yac tzu'ṉapya ndø coja por lo que chøjcuse aṉcø Jesusis .
50003001	Recommendation	Pues yøti ø mi ndøvøta'm , casøtyamø porque ndø Comi mitzji'nda'mbøte . Ji'ndyet ni tiyø aunque mi ⁿjavyøjøtzøjcayta'mø jana tumnac lo que oyupøm ø mi ⁿjajyandyame ; porque mitzcøtoyata'm , vøjpø tiyete .
46011034	Recommendation	O'ca iyø jutipø ospa , muspa vi'na cyu't tyøcmø . Entonces cuando mi ndyu'mdamba ji'n maṉ mi ndzøctam ji'n vyøjpø tiyø ; jin maṉ mi yaj coja'ajtandøji . Cuando nu'cpa'cøjtzi mi ijtamumø , maṉba mi aṉgui'mdam eyata'mbø ticøsi .
43018031	Description	Entonces Pilato'is ñøjayu : ― Nømaṉdam mi ne'ṉgø y tzøctam mi justicia'ajcuy mi ne'c ijtamuse mi aṉgui'mgutya'm . Pero Israel pø'nista'm 'yaṉdzoṉyaju : ― Pero øtzta'm Israel pø'nista'm ja ñø'ijtam øjtzi aṉgui'mguy va'cø yaj ca'otya'mø .
46012031	Faith	Entonces vøj va'cø mi sundamø más vøjpø musocuy tø tzi'pa Diosis . Pero øtz maṉbatøc mi ndzajmatyam jujche va'cø mi ndu'ṉajtam más vøjpø tu'ṉomo .
58007026	Description	Entonces jetsepø myøja'ṉombø pane ndø sundamba , porque masanbøte , ja it ni yatzitzoco'yajcuy , ni ja it ni cyoja , ja myotapø coja'øyupø pønji'ṉda'm , ñømaṉdøju más møjipø tzajpomo .
50004013	Faith	Øtz mumuti muspa ndzøcø Cristo'is pyømiji'ṉ .
52004003	Recommendation	Porque Diosis syunba ne'ti va'cø mi ijtamø para vyingøtoya , y va'cø jana mi møndzi nø'it eyata'mbø yomo ;
51004002	Recommendation	O'nøtyam Dios mumu jama , u mi jajmbø'tamu . U mi 'yøṉdamu cuando mi o'ṉøndyamba Dios , y jajmutzøc Dios ti mi ñchi'u , y nøjmayø yøscøtoya .
44007029	Description	Yøcsepø ote myanu'øc , Moisés poyu y maṉ vit Madián nasomo . Jiṉ oy metzcuy 'yune .
46011007	Description	Pøn ji'n vyøj va'cø cyo'ta'cø porque ijtuse Dios , jetseti pønda'mque't , y pø'nis yaj quejapya Diosis myøja'ṉo'majcuy ; y pø'nis myøja'ṉo'majcuy yaj quejapya yomo'is .
51003015	Faith	Cuando mi ṉgoqui'pspa ti maṉba mi ndzøqui , o'ca maṉba mi nchø'y Diosji'ṉ vøjø mi ndzoco'yomo , entonces jetse va'cø mi ndzøcø . Porque jetcøtoya mi ⁿvyejandyam Diosis va'cø mi ijtam vøjø como tumbø pønse . Y nømdamø : “ Yøscøtoya chøcpa Diosis ” .
58002010	Grace	Aunque Diosis jyomejcu mumu tiyø y vyingøtoyati ijtu aunque tiyø , pero vøjpø ti chøjcu va'cø chac 'Yune va'cø toya'isø . Porque jetse ta'nemø chøjcu Jesusis ijtusena'ṉ pyena va'cø chøcø va'cø mus yaj cotzocyaj vøti pøn va'cø 'yune'ajyajø . Porque Jesús cotzocyajupø pø'nis vyindu'ṉajpapø va'cø ñømaṉyaj tzajpomo .
59004001	Sin	Ma'ṉbø mi ndzajmatyam ti'is nøcøtzo'tzpa qui'pcuy y qui'sca'cuy mijtzomda'm . Sunba mi ndzøc yatzitzoco'yajcuy y al mismo tiempo ji'n sun mi ndzøc yatzipø , jetse como si fuera quipcuy mi nø'itpa mi ṉgui'psocu'yomo .
46005001	Sin	Tzamdøjpa que it mijtzomda'm nø'ijtupø'is eya yomo ; que tum pø'nis ñø'ijtu jyata'is yomo . Pero ni ji'n vya'ṉjamyajepø'is Dios ji'n chøcyaj jetsepø yatzitzoco'yajcuy .
46010013	Faith	Aunque jujche mi ṉgyomprobatzøctøjpase a ver o'ca maṉba mi ṉgyec coja'omo , igual jetseti tzøjquisyajtøjque'tpa aunque iyø . Pero muspa ndø va'ṉjam Dios que ñe'c Diosis ji'n tø jajmbø'i . Porque ji'n mi yac tzøjquistøji más que ji'n mi ndone'csye'ṉomo . Porque cuando mi ñchøjquistøjpa , maṉba mi ṉgyotzoṉ Diosis va'cø mi ñømbutø .
44020029	Violence	Porque muspøjtzi que maṉujcam øjtzi , maṉba tøjcøyaj pøn ji'n ma's tyo'ya'ṉøyaj vya'ṉjamyajpapø'is Jesús . Jujche ca'ṉis ji'n to'ya'ṉøy borrego , jetse ji'n ma tyoya'ṉøyaj pyøndøvø .
53001004	Faith	Jetcøtoya mi vøṉgotzøcta'mbøjtzi cuando o'nøtya'mbøjtzi ø va'ṉjamoṉguy tøvøta'm tu'myajupø emø va'cø vya'ṉjamyaj Dios . Por que cuando mi yacsutzøctandøjpa y mi yac toya'istandøjpa , mi nømaṉjandyamba pasencia y mi ⁿvya'ṉjajmondyamba .
62004012	Faith	Dios nunca ja is ni i'is , pero o'ca nay tø na sundandøjpa eyata'mbøji'ṉ , Dios itpa ndø tzoco'yomda'm . Entonces ta'nemøse tø su'notyamba como Diosis tø tzi'tambase su'nocuy .
48001001	Description	Øjchøṉø Pablo , øjchøṉ apostoles . Pero ji'n chøṉ pø'nis cyøpiṉupø , ni ji'ndyet chøṉ pø'nis cø'vejupø ; sino Jesucristo'is cø'vejøjtzi y ndø Janda Diosis . Jic ndø Janda Dios yac visa'upø'is Cristo cuando ca'ujacam .
58012003	Recommendation	Qui'pstamø jujche ñømaṉ pasencia ndø Comi'is cuando yac isyaj toya cojatzøquita'mbø pø'nis . Como je'is ñøman pasencia , muspa mi nømaṉdaṉgue't pasencia mijtzi va'cø jana mi i'nbø'tamø ni jana mi myaya'ndamø .
45006005	Faith	Entonces o'ca tø tumø ca'tamuse Cristoji'ṉ tø tuctamu , jetsetique't maṉba tø visa'taṉgue't jujche Cristo visa'use .
45015010	Recommendation	Y emø it jachø'cye'tu : Mijtzi lo que ji'ndyet mi Israel mi mbyønda'm , casøtyam Diosis pyønji'da'm .
54004001	Sin	Espiritu Santo'is viyuṉsye chamba que jøsi'cam minbapø jama'omo vene'aṉbø'nomo maṉba chacyaj va'ṉjajmocuy , maṉba vya'ṉjamyaj aṉgøma'cø'yoyajpapø espiritu , y maṉba vya'ṉjamyaj yatzi'ajcu'is chamyajpapø .
56003001	Recommendation	Yac jajmutzøcyajø que tiene que va'cø cyøna'tzøyaj gobierno y mumu aṉgui'myajpapø , va'cø chøcyaj lo que jujche 'yaṉgui'myajpase y va'cø ityaj listo va'cø chøcyaj mumu vøjta'mbø tiyø ,
61003005	Sin	Ñe'c jetse nømyajpa , pero ñe'c ji'n syun chi'yaj cuenta que ya'møc tuc tzap Diosis 'yotepit y nas put nø'cø'mø , chac je nas nø'is y nas nø'ji'ṉ ijtu .
60003018	Grace	Porque Cristo también toya'isu cuando tumnacti o ca'e ndø cojacøtoyata'm . Vøjpø pøn o ca'e para yatzita'mbø pøngøtoya , va'cø tø yac tøjcøtyam Diosis vyi'naṉdøjqui . Yaj ca'atyøj Cristo'is syis y yac visa'aytøju 'yespiritu .
